NCorralesINQ,2017-06-22 11:13,0,0,Taguiwalo: DSWD has started to procure temporary tents for Marawi evacuees.,"(['Makati City'], Location((14.5591272, 121.0202094, 0.0)))",,,877726214437216256,https://twitter.com/NCorralesINQ/status/877726214437216256,en
cindy_marq,2017-06-22 11:13,0,0,"The kind of president those 16M voted for ...come to think of it, Marawi people should also demand apology from those bloodthirsty voters!","(['Manila', ' Philippines'], Location((14.5906216, 120.9799696, 0.0)))",,,877726212826595329,https://twitter.com/cindy_marq/status/877726212826595329,en
EagleNewsPH,2017-06-22 11:13,1,3,"We are procuring family-sized tents. Three weeks ago we started in prep for return of our evacuees to Marawi, Taguiwalo says","(['Quezon City', 'Philippines'], Location((14.6509905, 121.0486155, 0.0)))",,,877726135286603776,https://twitter.com/EagleNewsPH/status/877726135286603776,en
manilabulletin,2017-06-22 11:13,4,4,LOOK: Marawi crisis updates from DSWD as delivered by Sec. Taguiwalo. | via argyllcyrus_MBpicd,"(['Manila', ' Philippines'], Location((14.5906216, 120.9799696, 0.0)))",@,,877726087844831232,https://twitter.com/manilabulletin/status/877726087844831232,en
thecatholicnews,2017-06-22 11:12,0,0,"CHARIS response to Sri Lanka floods, Marawi crisis","(['Singapore'], Location((1.2904753, 103.8520359, 0.0)))",,,877726054802112513,https://twitter.com/thecatholicnews/status/877726054802112513,en
inquirerdotnet,2017-06-22 11:12,1,2,DSWD Sec. Taguiwalo says only 5 percent of displaced Marawi residents are in evacuation centers; majority are home-based | LeilasINQ,"(['Makati City'], Location((14.5591272, 121.0202094, 0.0)))",@,,877726004680302592,https://twitter.com/inquirerdotnet/status/877726004680302592,en
rapplerdotcom,2017-06-22 11:12,2,2,Taguiwalo: The DSWD has spent Php 294 million for Marawi evacuees.,"(['Philippines'], Location((12.7503486, 122.7312101, 0.0)))",,,877725941480292352,https://twitter.com/rapplerdotcom/status/877725941480292352,en
PhilippineStar,2017-06-22 11:12,0,6,HAPPENING NOW: Social Welfare Sec. Judy Taguiwalo providing updates on Marawi evacuees here in Malacanang | alexisbromero,"(['Philippines'], Location((12.7503486, 122.7312101, 0.0)))",@,,877725913084854273,https://twitter.com/PhilippineStar/status/877725913084854273,en
LeilasINQ,2017-06-22 11:12,0,0,DSWD Sec. Taguiwalo says only 5 percent of displaced Marawi residents are in evacuation centers; majority are home-based,,,,877725842016575490,https://twitter.com/LeilasINQ/status/877725842016575490,en
ANCALERTS,2017-06-22 11:11,1,3,Resolution filed seeking congressional probe into plight of Marawi evacuees. |,"(['Philippines'], Location((12.7503486, 122.7312101, 0.0)))",@,,877725737096060929,https://twitter.com/ANCALERTS/status/877725737096060929,en
ABSCBNNews,2017-06-22 11:11,4,5,DSWD Sec. Judy Taguiwalo: The department has spent P294-M for Marawi evacuees. MarawiClash,"(['Manila', ' Philippines'], Location((14.5906216, 120.9799696, 0.0)))",,#,877725668133396480,https://twitter.com/ABSCBNNews/status/877725668133396480,en
alexisbromero,2017-06-22 11:11,0,0,HAPPENING NOW: Social Welfare Sec. Judy Taguiwalo providing updates on Marawi evacuees here in Malacanang PhilippineStar PhilstarNews,"(['Manila'], Location((14.5906216, 120.9799696, 0.0)))",@ @,,877725602421264385,https://twitter.com/alexisbromero/status/877725602421264385,en
GenKabiling,2017-06-22 11:11,0,0,DSWD sec Taguiwalo says more than P290M worth of relief aid given to displaced families in Marawi manila_bulletin,,@,,877725584792494081,https://twitter.com/GenKabiling/status/877725584792494081,en
enajsancho,2017-06-22 11:10,0,0,"DSWD Sec Taguiwalo bared that there are 16,234 families affected in the Marawi Crisis DZAR1026 smninewschannel","(['makati', ' philippines'], Location((14.55459465, 121.021407905, 0.0)))",@ @,,877725425841053696,https://twitter.com/enajsancho/status/877725425841053696,en
rapplerdotcom,2017-06-22 11:10,2,15,ONGOING: Malacañang press con. Sec. Taguiwalo now giving updates on the situation in Marawi.,"(['Philippines'], Location((12.7503486, 122.7312101, 0.0)))",,,877725368265854976,https://twitter.com/rapplerdotcom/status/877725368265854976,en
PTVisMin,2017-06-22 11:10,0,0,NEWS | AFP: No spillover of Marawi Siege,,,,877725331452338176,https://twitter.com/PTVisMin/status/877725331452338176,en
PTVph,2017-06-22 11:10,1,2,NEWS: AFP: No spillover of Marawi Siege,"(['Philippines'], Location((12.7503486, 122.7312101, 0.0)))",,,877725329531572224,https://twitter.com/PTVph/status/877725329531572224,en
IanEsguerra,2017-06-22 11:09,2,2,Resolution filed seeking congressional probe into plight of Marawi evacuees,"(['Manila'], Location((14.5906216, 120.9799696, 0.0)))",,,877725193765920768,https://twitter.com/IanEsguerra/status/877725193765920768,en
LeilasINQ,2017-06-22 11:09,0,0,DSWD Sec. Taguiwalo discusses the aid being given to evacuees from Marawi in palace press briefing,,,,877725165999710209,https://twitter.com/LeilasINQ/status/877725165999710209,en
ralfely,2017-06-22 11:08,0,0,RT DepEd_PH: NH: Day 3 of the PFA to DepEd personnel affected by the Marawi crisis at the NEAP R-10 in Cagayan de Oro City. (1/2),"(['Ronda Cebu Ph'], Location((9.9991359, 123.4114146, 0.0)))",@,,877724980225519616,https://twitter.com/ralfely/status/877724980225519616,en
radikalchick,2017-06-22 11:07,0,0,Should we really be thinking lipsticks for evacuees? Because FOOD. Marawi Mindanao MartialLaw,"(['Philippines'], Location((12.7503486, 122.7312101, 0.0)))",,# # #,877724821764755457,https://twitter.com/radikalchick/status/877724821764755457,en
AnisaHafiza,2017-06-22 11:06,0,0,"All these huge amount of donations for Marawi make me think, will it bring back the city? Certainly not. It will never be the same.","(['Philippines'], Location((12.7503486, 122.7312101, 0.0)))",,,877724521058324481,https://twitter.com/AnisaHafiza/status/877724521058324481,en
rcarmell0,2017-06-22 11:00,0,1,I pray that stephensackur would also interview Risa Hontiveros about the invasion and rebellion in Marawi. That would be a blast.,"(['Republic of the Philippines'], Location((12.7503486, 122.7312101, 0.0)))",@,,877722981211922433,https://twitter.com/rcarmell0/status/877722981211922433,en
mikiben,2017-06-22 10:59,0,2,"Expert Volunteers in Tree Raising and Vegetable Gardening Needed After War in Marawi. After the war in Marawi,...","(['La Trinidad', ' Philippines'], Location((37.169397, -104.5005411, 0.0)))",,,877722753234722817,https://twitter.com/mikiben/status/877722753234722817,en
wolf112595,2017-06-22 10:52,0,0,So creepy! Marawi at late night. marawicrisis,"(['Marawi City'], Location((8.0034938, 124.286626, 0.0)))",,# #,877721014255337473,https://twitter.com/wolf112595/status/877721014255337473,en
bangsamorodevt,2017-06-22 10:50,1,1,Validation of data and IDP situation of Marawi siege,,,,877720447449669632,https://twitter.com/bangsamorodevt/status/877720447449669632,en
bangsamorodevt,2017-06-22 10:50,0,1,Continuing aid to Marawi,,,,877720418320338945,https://twitter.com/bangsamorodevt/status/877720418320338945,en
nonopogi,2017-06-22 10:50,0,0,yusufledesma they're so astig they should go to Marawi and fight the maute. They can show their manliness there.,"(['33.637836', '-117.649310'], Location((35.3583844, 128.0917732, 0.0)))",@,,877720357955813376,https://twitter.com/nonopogi/status/877720357955813376,en
updatesmanila,2017-06-22 10:50,0,1,AFP apologizes for 'war too long' in Marawi City,,,,877720335847636992,https://twitter.com/updatesmanila/status/877720335847636992,en
AboitizFDN,2017-06-22 10:49,0,2,"Aboitiz sends over P4M in relief aid to over 20,000 families in Marawi City > c","(['Manila', ' Philippines'], Location((14.5906216, 120.9799696, 0.0)))",,#,877720229400518659,https://twitter.com/AboitizFDN/status/877720229400518659,en
Ivan226622,2017-06-22 10:46,0,0,LOOK: Muntinlupa City LGU donates P2 million for strife-torn Marawi City. | via raffsantos D — ABS-CBN News (ABSCBN…,,,,877719405337210881,https://twitter.com/Ivan226622/status/877719405337210881,en
chaygallo,2017-06-22 10:46,0,0,its been a month since the marawi city been doomed. and soon to gloom.,"(['Bayan Ko'], Location((47.6291893, 11.3380555982, 0.0)))",,,877719374693490692,https://twitter.com/chaygallo/status/877719374693490692,en
JohnLester,2017-06-22 10:44,0,0,(Even as spillover is actually occurring). AFP ensures no spillover of Marawi conflict | SunStar,,,,877718930370035712,https://twitter.com/JohnLester/status/877718930370035712,en
boymejo,2017-06-22 10:43,0,1,And sacrifice the lives of more soldiers just to liberate Marawi City? Or would he rather have the Maute stay... c,"(['Iloilo', ' Philippines'], Location((10.9534597, 122.5756326, 0.0)))",,,877718782415863809,https://twitter.com/boymejo/status/877718782415863809,en
ANCALERTS,2017-06-22 10:43,1,9,LOOK: Muntinlupa City LGU donates P2 million for strife-torn Marawi City. |,"(['Philippines'], Location((12.7503486, 122.7312101, 0.0)))",@,,877718769296003074,https://twitter.com/ANCALERTS/status/877718769296003074,en
boymejo,2017-06-22 10:43,1,3,And sacrifice the lives of more soldiers just to liberate Marawi City? Or would he rather have the Maute stay there forever?,"(['Iloilo', ' Philippines'], Location((10.9534597, 122.5756326, 0.0)))",,,877718745136766978,https://twitter.com/boymejo/status/877718745136766978,en
GiselleXanchez,2017-06-22 10:43,0,0,tbt last week... Stars were afraid to fly to Mindanao due to the war in Marawi City. But…,"(['Philippines'], Location((12.7503486, 122.7312101, 0.0)))",,#,877718666577682432,https://twitter.com/GiselleXanchez/status/877718666577682432,en
AnlaboTsong,2017-06-22 10:43,0,0,"Contrary to pro-US media assertions, there are no US boots on the grounds of Marawi City. Even the reported...",,,,877718630267363328,https://twitter.com/AnlaboTsong/status/877718630267363328,en
tessgarcia,2017-06-22 10:43,0,1,"dinkysunflower hello po. Where can we send hijabs, lipsticks, and lady items for our Marawi lady evacuees?","(['Mindanao'], Location((7.68980415, 125.236399692, 0.0)))",@,,877718578832617472,https://twitter.com/tessgarcia/status/877718578832617472,en
RRISC01,2017-06-22 10:42,8,3,Holy crud: Duterte ready to order ‘carpet bombing’ of Marawi if needed IntelOperator BRZRKR_US xbonesrider,,@ @ @,,877718412864110592,https://twitter.com/RRISC01/status/877718412864110592,en
ABSCBNNews,2017-06-22 10:42,14,61,LOOK: Muntinlupa City LGU donates P2 million for strife-torn Marawi City. | via,"(['Manila', ' Philippines'], Location((14.5906216, 120.9799696, 0.0)))",@,,877718386779725824,https://twitter.com/ABSCBNNews/status/877718386779725824,en
Ivan226622,2017-06-22 10:41,0,0,"Ablon says many women in Marawi opted to evacuate following Duterte rape joke | via IanEsguerra — ABS-CBN News (ABSCBNNews) June 22, 2017",,,,877718220177911808,https://twitter.com/Ivan226622/status/877718220177911808,en
piaranada,2017-06-22 10:41,1,4,"Tent cities, mass graves readied as gov't troops clear Marawi via rapplerdotcomhttp://D","(['Philippines'], Location((12.7503486, 122.7312101, 0.0)))",@,,877718160417333248,https://twitter.com/piaranada/status/877718160417333248,en
raffsantos,2017-06-22 10:40,3,17,LOOK: Muntinlupa City LGU donates P2 million for strife torn Marawi City.,"(['Manila'], Location((14.5906216, 120.9799696, 0.0)))",,,877718015843852288,https://twitter.com/raffsantos/status/877718015843852288,en
ABSCBNNews,2017-06-22 10:40,3,7,Ablon says many women in Marawi opted to evacuate following Duterte rape joke | via IanEsguerra,"(['Manila', ' Philippines'], Location((14.5906216, 120.9799696, 0.0)))",@,,877717863129165825,https://twitter.com/ABSCBNNews/status/877717863129165825,en
IanEsguerra,2017-06-22 10:39,1,2,Ablon says many women in Marawi opted to evacuate following Duterte rape joke,"(['Manila'], Location((14.5906216, 120.9799696, 0.0)))",,,877717692601425921,https://twitter.com/IanEsguerra/status/877717692601425921,en
gaijinblog,2017-06-22 10:38,0,0,Heavy fire continues in the southern Philippine city of Marawi,,,,877717275142377472,https://twitter.com/gaijinblog/status/877717275142377472,en
cnnphilippines,2017-06-22 10:37,8,7,"IBP-Lanao Del Sur expresses its severe outrage, condemnation"" over illegal searches and seizures in Marawi by gov't forces | """,,@,,877717234361049088,https://twitter.com/cnnphilippines/status/877717234361049088,en
anjocalimario,2017-06-22 10:36,1,0,"IBP-Lanao Del Sur expresses its severe outrage, condemnation"" over illegal searches and seizures in Marawi by govt forces. ""","(['Philippines'], Location((12.7503486, 122.7312101, 0.0)))",@,,877716999157161985,https://twitter.com/anjocalimario/status/877716999157161985,en
froiLyBaby,2017-06-22 10:34,0,0,"with the failure of Bureau of Immigration, will Manila be the nxt city to fall after Marawi? TV5JournalisMO",,@,,877716442002542593,https://twitter.com/froiLyBaby/status/877716442002542593,en
mindanao_daily,2017-06-22 10:34,0,0,Marawi folk accept Duterte’s apology -,"(['Cagayan de Oro City'], Location((8.42980265, 124.682410212, 0.0)))",,,877716407303028736,https://twitter.com/mindanao_daily/status/877716407303028736,en
froiLyBaby,2017-06-22 10:34,0,0,"with the failure of Bureau of Immigration, will Manila be the nxt city to fall after Marawi? inquirerdotnet PhilstarLIVE sunstar_news",,@ @ @,,877716299811479552,https://twitter.com/froiLyBaby/status/877716299811479552,en
WVAsia,2017-06-22 10:33,4,7,WorldVisionPH handed over 1000 containers of 5-gallon water to dswdserves for the displaced families of Marawi,"(['Asia-Pacific'], Location((49.4212299, 8.4297698, 0.0)))",@ @,#,877716021976604672,https://twitter.com/WVAsia/status/877716021976604672,en
froiLyBaby,2017-06-22 10:32,0,0,"with the failure of Bureau of Immigration, will Manila be the next city to fall after Marawi? gmanewstv stateofdnation cnnphilippines",,@ @ @,,877716003081248768,https://twitter.com/froiLyBaby/status/877716003081248768,en
dannpantoja,2017-06-22 10:32,0,0,Praying for justice for the war victims in Marawi. Praying for comfort for their families and friends. May God...,,,,877715948521742336,https://twitter.com/dannpantoja/status/877715948521742336,en
froiLyBaby,2017-06-22 10:32,0,0,"with the failure of Bureau of Immigration, will Manila be the next city to fall after Marawi? ABSCBNNews TVPatrol rapplerdotcom",,@ @ @,,877715803138703360,https://twitter.com/froiLyBaby/status/877715803138703360,en
Ivan226622,2017-06-22 10:31,0,0,Marawi evacuee Alimondas Laut appeals to Duterte to stop aerial bombings | via IanEsguerra — ABS-CBN News (ABSCBN…,,,,877715549765193728,https://twitter.com/Ivan226622/status/877715549765193728,en
PTVisMin,2017-06-22 10:30,0,0,NEWS: More Marawi Buildings cleared of Maute terrorists,,,,877715264430886912,https://twitter.com/PTVisMin/status/877715264430886912,en
GMPilipinas,2017-06-22 10:27,0,0,"NEWS & VIEWS: Tourist arrivals up despite Marawi crisis; CHED directs colleges, universities to accept Marawi...","(['Philippines'], Location((12.7503486, 122.7312101, 0.0)))",,,877714539948724226,https://twitter.com/GMPilipinas/status/877714539948724226,en
mikiben,2017-06-22 10:26,0,0,We have partnered with our friend Winston Tan and his Dupay Seedbank (Pinoy Seeds) for the 'Seeds for Peace' project for Marawi,"(['La Trinidad', ' Philippines'], Location((37.169397, -104.5005411, 0.0)))",,,877714446239408129,https://twitter.com/mikiben/status/877714446239408129,en
ABSCBNNews,2017-06-22 10:26,15,42,Marawi evacuee Alimondas Laut appeals to Duterte to stop aerial bombings | via,"(['Manila', ' Philippines'], Location((14.5906216, 120.9799696, 0.0)))",@,,877714385677897729,https://twitter.com/ABSCBNNews/status/877714385677897729,en
SonnyAngaraNews,2017-06-22 10:23,0,2,Sen Sonny Angara's stopovers included evacuation centers in Iligan & Cagayan de Oro sonnyangara marawi,"(['Republic of the Philippines'], Location((12.7503486, 122.7312101, 0.0)))",@,#,877713690547470337,https://twitter.com/SonnyAngaraNews/status/877713690547470337,en
monykafsosa,2017-06-22 10:23,0,0,"BREAKING NEWS TODAY! JUNE 22, 2017 DUTERTE TALK TO WIDODO | OPERATION PADLOCK MARAWI | DOJ…","(['Espa\xc3\xb1a'], Location((40.0028028, -4.003104, 0.0)))",,,877713591192887298,https://twitter.com/monykafsosa/status/877713591192887298,en
chariz_williams,2017-06-22 10:23,0,0,Did Trillianes visited Marawi and sympathise those who are homeless.. the answe is no!! And he has the guts to judge our President,,,,877713530832793601,https://twitter.com/chariz_williams/status/877713530832793601,en
mxruvelous,2017-06-22 10:22,1,0,It's the 30th day. It's been a month. MarawiSiege PrayForMarawi,,,# #,877713283850977280,https://twitter.com/mxruvelous/status/877713283850977280,en
IanEsguerra,2017-06-22 10:22,1,2,Marawi evacuee Alimondas Laut appeals to Duterte to stop aerial bombings,"(['Manila'], Location((14.5906216, 120.9799696, 0.0)))",,,877713282387165185,https://twitter.com/IanEsguerra/status/877713282387165185,en
edangara,2017-06-22 10:13,0,1,"Wrote about the ISIS-linked terrorists in Marawi, long-term solution for the situation there in my column","(['Manila', ' Philippines'], Location((14.5906216, 120.9799696, 0.0)))",,,877711216193318912,https://twitter.com/edangara/status/877711216193318912,en
PhilippineStar,2017-06-22 10:13,4,3,"READ: IBP-Lanao del Sur chapter slams military over illegal searches and seizures, rampant looting in Marawi | 2","(['Philippines'], Location((12.7503486, 122.7312101, 0.0)))",@,,877711158588747776,https://twitter.com/PhilippineStar/status/877711158588747776,en
ontay_88,2017-06-22 10:13,0,0,"Marawi is now world-wide famouse, not because of the taste of PALAPA or the plenty streamers and Tarps, it's Marawi Siege","(['KSA'], Location((4.13617025, 9.55242794813, 0.0)))",,,877711010689277953,https://twitter.com/ontay_88/status/877711010689277953,en
publicadvisory,2017-06-22 10:09,0,0,DepEd_PH: NH: Day 3 of the PFA to DepEd personnel affected by the Marawi crisis at the NEAP R-10 in Cagayan de Oro…,,,,877710064353632256,https://twitter.com/publicadvisory/status/877710064353632256,en
kendimalibot,2017-06-22 10:08,0,2,"“They have been saying that they are already starting to eat cardboard boxes just to stop hunger,” Marawi",,,#,877709734043721728,https://twitter.com/kendimalibot/status/877709734043721728,en
DepEd_PH,2017-06-22 10:07,10,35,NH: Day 3 of the PFA to DepEd personnel affected by the Marawi crisis at the NEAP R-10 in Cagayan de Oro City.,"(['Pasig City', ' Philippines'], Location((9.7771753, 125.4915723, 0.0)))",,,877709642456940544,https://twitter.com/DepEd_PH/status/877709642456940544,en
edupunay,2017-06-22 10:06,1,1,"READ: IBP-Lanao del Sur chapter slams military over illegal searches and seizures, rampant looting in Marawi","(['Manila'], Location((14.5906216, 120.9799696, 0.0)))",@,,877709248293027841,https://twitter.com/edupunay/status/877709248293027841,en
Gabgrielle,2017-06-22 10:05,2,2,"There's more hardships,desperations and casualties in Marawi than any media can cover. PrayForMarawi MarawiCityhttps://",,,# #,877709207205629952,https://twitter.com/Gabgrielle/status/877709207205629952,en
iiCHOCOisMoi,2017-06-22 10:05,0,5,"Thank you for visiting the IDPs from Marawi. God bless you always, Sir.",,,,877709162704019457,https://twitter.com/iiCHOCOisMoi/status/877709162704019457,en
inquirer_libre,2017-06-22 10:03,0,0,ICYMI: Duterte ready to order ‘carpet bombing’ of Marawi if needed,"(['Philippines'], Location((12.7503486, 122.7312101, 0.0)))",,,877708557814304768,https://twitter.com/inquirer_libre/status/877708557814304768,en
PhilippineStar,2017-06-22 10:00,0,3,Tourist arrivals up despite Marawi crisis U1,"(['Philippines'], Location((12.7503486, 122.7312101, 0.0)))",,,877707718936731648,https://twitter.com/PhilippineStar/status/877707718936731648,en
samGTweet,2017-06-22 9:58,0,0,"Re Ramadhan for Marawi assistance, any connection to DSWD and DILG National Secretaries or their assistants for Operations, Finance? PLS PM",,,,877707272343793664,https://twitter.com/samGTweet/status/877707272343793664,en
darnitJC,2017-06-22 9:57,0,9,Sobrang cheap shot lang na you're pitting my time spent on work and Marawi work against my time for you. You don't own me,,,,877707172464873473,https://twitter.com/darnitJC/status/877707172464873473,en
carmeladuron,2017-06-22 9:57,0,1,"Government , private sector working together to help Marawi crisis IDPs | Department of Social Welfare and...","(['davao city'], Location((7.22650725, 125.454887691, 0.0)))",,,877707116202532865,https://twitter.com/carmeladuron/status/877707116202532865,en
JohnLester,2017-06-22 9:56,0,0,Day 31 of Marawi Siege ,,,,877706816808927233,https://twitter.com/JohnLester/status/877706816808927233,en
carmeladuron,2017-06-22 9:55,0,0,"DSWD prepares women and children – friendly spaces for Marawi crisis evacuees; says community, women should be...","(['davao city'], Location((7.22650725, 125.454887691, 0.0)))",,,877706477971976192,https://twitter.com/carmeladuron/status/877706477971976192,en
carmeladuron,2017-06-22 9:52,0,0,DSWD execs join Pres. Duterte during distribution of cash aid to Marawi evacuees in Iligan City | Department of... C,"(['davao city'], Location((7.22650725, 125.454887691, 0.0)))",,,877705871836446720,https://twitter.com/carmeladuron/status/877705871836446720,en
watsupasia,2017-06-22 9:46,0,0,Latest: Heavy fire continues in the southern Philippine city of Marawi,"(['Asia'], Location((56.0000002, 103.9999998, 0.0)))",,,877704435178377216,https://twitter.com/watsupasia/status/877704435178377216,en
cnnphilippines,2017-06-22 9:45,1,7,Tarhata Mustarip gave birth to her youngest child at the same hour Marawi came under a vicious terror attack,,,,877703940791554048,https://twitter.com/cnnphilippines/status/877703940791554048,en
PHHotTrends,2017-06-22 9:43,0,0,Tourist arrivals up despite Marawi crisis MarawiUpdates 1c2,"(['Manila City'], Location((14.5906216, 120.9799696, 0.0)))",,#,877703514469748739,https://twitter.com/PHHotTrends/status/877703514469748739,en
egdsgn,2017-06-22 9:42,0,0,More Marawi Buildings cleared of Maute terrorists,"(['Davao City', ' Davao Region'], Location((7.22650725, 125.454887691, 0.0)))",,,877703221187231744,https://twitter.com/egdsgn/status/877703221187231744,en
Nitegammer_,2017-06-22 9:39,0,0,Heavy fire continues in the southern Philippine city of Marawi via YouTube,,@,,877702427121602560,https://twitter.com/Nitegammer_/status/877702427121602560,en
myminc0,2017-06-22 9:38,0,0,DepEdSecBriones reports moreThan 100 Marawi Evacs already enrolled n NCR IS SHE ENSURING they're noMaute/terror sympathyzers/supporters/etc?,"(['Republic of the Philippines'], Location((12.7503486, 122.7312101, 0.0)))",,,877702304647979008,https://twitter.com/myminc0/status/877702304647979008,en
cnnphilippines,2017-06-22 9:38,4,5,Ghodsinia: I hope Marawi crisis ends soon | TheSource,,,#,877702275896008705,https://twitter.com/cnnphilippines/status/877702275896008705,en
egdsgn,2017-06-22 9:31,0,0,AFP: No spillover of Marawi Siege,"(['Davao City', ' Davao Region'], Location((7.22650725, 125.454887691, 0.0)))",,,877700568533348354,https://twitter.com/egdsgn/status/877700568533348354,en
cnnphilippines,2017-06-22 9:30,0,3,Arman Ghodsinia: I hope Marawi crisis ends soon | TheSource live,,,#,877700358235013121,https://twitter.com/cnnphilippines/status/877700358235013121,en
PBSPorg,2017-06-22 9:30,0,0,The ongoing conflict in Marawi that began on May 23 has now resulted to hundred thousands of internally displaced citizens.,"(['Philippines'], Location((12.7503486, 122.7312101, 0.0)))",,,877700277167464448,https://twitter.com/PBSPorg/status/877700277167464448,en
PBSPorg,2017-06-22 9:30,0,0,Former PBSP Mindanao Regional Committee Member Arturo M. Milan contributed cash to the SOS Marawi Donation Drive. SOSMarawi,"(['Philippines'], Location((12.7503486, 122.7312101, 0.0)))",,# #,877700190798364673,https://twitter.com/PBSPorg/status/877700190798364673,en
PBSPorg,2017-06-22 9:28,0,1,"Additionally, eight pupils from Marawi were also provided with school trolleys. PBSPinEducation UnitedWayDayofAction2017 UpliftingLives","(['Philippines'], Location((12.7503486, 122.7312101, 0.0)))",,# # #,877699704225542144,https://twitter.com/PBSPorg/status/877699704225542144,en
jeprothekraken,2017-06-22 9:28,0,0,Marawi crisis... atm,,,#,877699676085997570,https://twitter.com/jeprothekraken/status/877699676085997570,en
toledoram,2017-06-22 9:28,0,0,. junmeromi's reaction to the negative feedback on his ANCALERTS interview re Marawi crisis IanEsguerra,"(['Cotabato City', ' Philippines'], Location((7.1970344, 124.2351714, 0.0)))",@ @ @,#,877699668498448384,https://twitter.com/toledoram/status/877699668498448384,en
cnnphilippines,2017-06-22 9:26,3,9,UP summa cum laude and Marawi native Arman Ghodsinia offers a message of hope | TheSource live,,,#,877699190998028290,https://twitter.com/cnnphilippines/status/877699190998028290,en
myminc0,2017-06-22 9:25,0,0,"NoNeed2 declare Martial Law in Mindanao due 2 Marawi Siege,,but HouseSpeaker&SenatePresident want du30's Martial Law 2last TILhis termEnd?""""","(['Republic of the Philippines'], Location((12.7503486, 122.7312101, 0.0)))",,,877698982742441985,https://twitter.com/myminc0/status/877698982742441985,en
senatePH,2017-06-22 9:25,0,1,Senator Sonny Angara: This guy gave me an ultra-warm welcome kissmuna marawi iligan evacuationcenter...,"(['Pasay City', ' Philippines'], Location((14.5437592, 120.9954657, 0.0)))",,# # # #,877698952195260416,https://twitter.com/senatePH/status/877698952195260416,en
totocyven,2017-06-22 9:25,0,0,Duterte takes soldiers wounded in Marawi on presidential flight to Manila via ABSCBNNews,"(['Philippines'], Location((12.7503486, 122.7312101, 0.0)))",@,,877698928367484929,https://twitter.com/totocyven/status/877698928367484929,en
