OriginalNida,2017-06-13 14:49,0,1,Itong mga nagrereklamo ipadala sa marawi para tamaan ng bomba,,,,874519021470830593,https://twitter.com/OriginalNida/status/874519021470830593,fil
EngrEzraEarl,2017-06-13 14:48,0,0,Isabak ka agad sa marawi bis haha,"(['Quezon City', ' Philippines'], Location((14.6509905, 121.0486155, 0.0)))",,,874518920060739584,https://twitter.com/EngrEzraEarl/status/874518920060739584,fil
zhyeo6C,2017-06-13 14:46,0,0,Laptrip tong si mama bakit daw hindi si Cardo ang dalhin sa Marawi at syang palabanin sa Maute chararat??,,,,874518369235476482,https://twitter.com/zhyeo6C/status/874518369235476482,fil
Ivan226622,2017-06-13 14:46,0,0,"Associate Justice Marvic Leonen now interpellates Atty. Marlon Manuel, counsel of Marawi women MartialLawOrals — ABS-CBN News (ABSCBNNews…",,,#,874518313522671616,https://twitter.com/Ivan226622/status/874518313522671616,fil
gmanews,2017-06-13 14:46,2,11,"Limang pulis na naipit sa Marawi, natagpuan na 8D","(['Philippines'], Location((12.7503486, 122.7312101, 0.0)))",,,874518198078418944,https://twitter.com/gmanews/status/874518198078418944,fil
pilipinasvirals,2017-06-13 14:45,0,0,CHINA SUPORTADO ANG TULONG NG AMERIKA SA MARAWI BREAKING NEWS | PANOORIIN: via YouTube,,@,,874518146631204864,https://twitter.com/pilipinasvirals/status/874518146631204864,fil
egdsgn,2017-06-13 14:45,0,0,"Publiko, naniniwala na Martial Law ang solusyon sa gulo sa Marawi","(['Davao City', ' Davao Region'], Location((7.22650725, 125.454887691, 0.0)))",,,874518094387048448,https://twitter.com/egdsgn/status/874518094387048448,fil
pilipinasvirals,2017-06-13 14:45,0,0,I added a video to a YouTube playlist CHINA SUPORTADO ANG TULONG NG AMERIKA SA MARAWI BREAKING NEWS |,,@,,874518076590628864,https://twitter.com/pilipinasvirals/status/874518076590628864,fil
OkkiPepernoot,2017-06-13 14:44,0,0,"Gaan we weer: NOS correspondent bericht dat IS bij inname van Marawi op Filippijnen, 8 burgers heeft geëxecuteerd"". Not. Ze zijn vermoord""","(['The Hague', ' The Netherlands'], Location((-33.9583333, 18.6416667, 0.0)))",@,,874517881064759296,https://twitter.com/OkkiPepernoot/status/874517881064759296,nl
Staffy_F,2017-06-13 14:43,0,0,"Les islamistes occupent environ 20% de Marawi, aux Philippines","(['Mulhouse', ' France'], Location((47.7494188, 7.3399355, 0.0)))",,,874517503795441664,https://twitter.com/Staffy_F/status/874517503795441664,fr
Jimyparades11,2017-06-13 14:42,0,0,Taga manila po kasi kau kaya wala kayong alam nangyayari dito sa marawi,"(['Manila'], Location((14.5906216, 120.9799696, 0.0)))",,,874517193702096897,https://twitter.com/Jimyparades11/status/874517193702096897,fil
K21289062,2017-06-13 14:41,0,0,Sana ipadala na lang si Cardo sa Marawi para malabanan nya ang Maute,"(['Republic of the Philippines'], Location((12.7503486, 122.7312101, 0.0)))",,,874517156452487168,https://twitter.com/K21289062/status/874517156452487168,fil
maxangelo987,2017-06-13 14:40,0,0,"Pinuri ng Islamic State ang mga jihadist"" sa Pilipinas sa pag-atake sa Marawi City. gma…""",,,#,874516832237039617,https://twitter.com/maxangelo987/status/874516832237039617,fil
maxangelo987,2017-06-13 14:40,0,0,Labis ang pagdadalamhati ngayon ng pamilya ng isa sa mga nasawing sundalo sa Marawi City. …,,,,874516827925344256,https://twitter.com/maxangelo987/status/874516827925344256,fil
arahdotcom,2017-06-13 14:40,0,0,ISIS Klaim Pembebasan Kota Marawi Oleh Militer Gagal Jakarta ISIS Terorisme MiliterFilipina MarawiFilipina,"(['Jakarta Capital Region'], Location((-6.1753942, 106.827183, 0.0)))",,# # # # #,874516695368441856,https://twitter.com/arahdotcom/status/874516695368441856,id
BPIARMM,2017-06-13 14:39,0,0,Nahihirapan pa rin para sa kanilang kaligtasan ang mga sibilyang nananatiling naiipit sa bakbakan sa Marawi...,,,,874516672517951488,https://twitter.com/BPIARMM/status/874516672517951488,fil
radyopilipinas1,2017-06-13 14:37,0,0,"167 na mag-aaral galing Marawi, tinanggap ng mga paaralan sa Region 11.","(['Quezon City', ' Philippines'], Location((14.6509905, 121.0486155, 0.0)))",,,874516053753077760,https://twitter.com/radyopilipinas1/status/874516053753077760,fil
supra1Bqteam,2017-06-13 14:37,0,0,"AFPespanol: Un soldado filipino en Marawi, en la isla de Mindanao, donde las tropas siguen combatiendo a cientos d…","(['Orem', ' UT'], Location((40.2971825, -111.694943, 0.0)))",,,874516039542988800,https://twitter.com/supra1Bqteam/status/874516039542988800,es
AFPespanol,2017-06-13 14:36,3,2,"Un soldado filipino en Marawi, en la isla de Mindanao, donde las tropas siguen combatiendo a cientos de insurgentes islamistas","(['Montevideo', ' Uruguay'], Location((-34.9059039, -56.1913569, 0.0)))",,#,874515777273122817,https://twitter.com/AFPespanol/status/874515777273122817,es
thonymulya,2017-06-13 14:34,0,0,"LAWAN IDIOLOGI ANTI PANCASILA, JANGAN MENUNGGU SEPERTI MARAWI PHILIPINA LAWAN IDIOLOGI KHILAFAH: melalui","(['\xc3\x9cT: -6.23677', '106.75464'], Location((52.226391, 31.382824, 0.0)))",,,874515284530536448,https://twitter.com/thonymulya/status/874515284530536448,id
desamting,2017-06-13 14:33,19,50,"Marami sa nagsasabing daming kyawkyaw, pumunta ka na lang sa Marawi"", wala rin naman sa Marawi no?""","(['Quezon City', ' Philippines'], Location((14.6509905, 121.0486155, 0.0)))",,,874515061368209408,https://twitter.com/desamting/status/874515061368209408,fil
Dbigbalbowski,2017-06-13 14:33,11,17,Edcel Lagman : what's happening now in Marawi is not a rebellion. Birds of the same feathers talaga ang mga dilawan! Kakahiya kayo,,,,874515011770646528,https://twitter.com/Dbigbalbowski/status/874515011770646528,fil
SalaqG,2017-06-13 14:32,0,2,Haynaw mantan ko piyaka mismiss a marawi,"(['MC'], Location((43.15297805, 13.1508822175, 0.0)))",,,874514872356057089,https://twitter.com/SalaqG/status/874514872356057089,fil
superjoms,2017-06-13 14:31,0,1,Ok tama na muna NBA. Move on na. Si Trillanes I-deploy na yan sa Marawi! Now na.,"(['Republic of the Philippines'], Location((12.7503486, 122.7312101, 0.0)))",,,874514609801117696,https://twitter.com/superjoms/status/874514609801117696,fil
egdsgn,2017-06-13 14:31,0,0,"Mga nasawing sundalo sa bakbakan sa Marawi City, ginawaran ng full military honors","(['Davao City', ' Davao Region'], Location((7.22650725, 125.454887691, 0.0)))",,,874514564481765376,https://twitter.com/egdsgn/status/874514564481765376,fil
Jimyparades11,2017-06-13 14:31,0,0,Mas importante pa po bha yung ceremony kesa sa amin dito sa marawi na nakipagbakbakan sa mga maute? Pakisagot po maam..from LT.rapal marines,"(['Manila'], Location((14.5906216, 120.9799696, 0.0)))",,,874514509175545856,https://twitter.com/Jimyparades11/status/874514509175545856,fil
juliosees,2017-06-13 14:29,0,0,"New video by GMA News: BT: 5 pulis at 5 karpintero na naipit sa sentro ng bakbakan sa Marawi City, nakaligtas...",,,,874514074679345152,https://twitter.com/juliosees/status/874514074679345152,fil
juliosees,2017-06-13 14:29,0,0,"New video by GMA News: BT: Mga Bakwit galing Marawi, nananatili sa mga evacuation center sa Iligan at Lanao...",,,,874514070187257857,https://twitter.com/juliosees/status/874514070187257857,fil
juliosees,2017-06-13 14:29,0,0,"New video by GMA News: BT: 5 pulis at 5 karpintero na naipit sa sentro ng bakbakan sa Marawi City, nakaligtas",,,,874514055175733248,https://twitter.com/juliosees/status/874514055175733248,fil
juliosees,2017-06-13 14:29,0,0,"New video by GMA News: BT: Mga Bakwit galing Marawi, nananatili sa mga evacuation center sa Iligan at Lanao provin… 8",,,,874514050385891332,https://twitter.com/juliosees/status/874514050385891332,fil
radyopilipinas1,2017-06-13 14:27,0,0,"QC govt nakiisa sa pagluluksa ng sambayanan sa pagkamatay at kabayanihan ng mga sundalo sa Marawi, sa paglalagay sa half mast ng PH flag.","(['Quezon City', ' Philippines'], Location((14.6509905, 121.0486155, 0.0)))",,,874513602543210496,https://twitter.com/radyopilipinas1/status/874513602543210496,fil
dzrhnews,2017-06-13 14:26,0,2,EARLIER: Press briefing sa Marawi pinangunahan ni Lt. Col Jo-ar Herrera spox ng Tabak 1st Infantry Division | RH24,"(['Manila', ' Philippines'], Location((14.5906216, 120.9799696, 0.0)))",@,,874513319733870592,https://twitter.com/dzrhnews/status/874513319733870592,fil
Pinkfrappe12,2017-06-13 14:25,0,0,Isa pa commander in chief na walang alam daw sa pagtulong ng mga kano sa Marawi?,,,,874513116653961216,https://twitter.com/Pinkfrappe12/status/874513116653961216,fil
LOrientLeJour,2017-06-13 14:25,2,0,"Les islamistes occupent environ 20% de Marawi, aux Philippineshttps://","(['Beyrouth', ' Liban'], Location((33.8959203, 35.47843, 0.0)))",,# #,874512947258814464,https://twitter.com/LOrientLeJour/status/874512947258814464,fr
volkskrant,2017-06-13 14:25,2,0,Niemand kon ooit de Filipijnse stad Marawi veroveren. Dus hoe kan het dat het een handjevol IS-jongeren wél lukt?,"(['Amsterdam'], Location((52.3745403, 4.89797550562, 0.0)))",,,874512915285626880,https://twitter.com/volkskrant/status/874512915285626880,nl
Tamra801,2017-06-13 14:21,0,0,Ang sikip sa dibdib umatend ng independence day kng marami na namatay sa marawi. Naintindihan ko ang pangulo!!! Pero ung iba jan cge ngawa,,,,874512091109109760,https://twitter.com/Tamra801/status/874512091109109760,fil
News5AKSYON,2017-06-13 14:20,2,8,"Sen Sotto on solons saying ML in Minda has no valid basis: Padala na lang lahat ng kontra sa Marawi, sila tumapos ng gulo | maeannelosbanos","(['Philippines'], Location((12.7503486, 122.7312101, 0.0)))",@,,874511733775147008,https://twitter.com/News5AKSYON/status/874511733775147008,fil
DZMMTeleFeed,2017-06-13 14:20,0,0,"AFP: Bakbakan ng Maute at militar sa Marawi, malapitan na",,,,874511653483630594,https://twitter.com/DZMMTeleFeed/status/874511653483630594,fil
AnigaDong,2017-06-13 14:19,0,0,araw ng kalayaan pero d p rn Malaya ang mamayan nation jn sa marawi,,,,874511581928800256,https://twitter.com/AnigaDong/status/874511581928800256,fil
BlackCatlyn,2017-06-13 14:19,0,0,kung tsismis ito di sana walang ISIS sa marawi ngayon.. kasi diba magagaling maxado ang intel ni trillanes..,"(['Cotabato City', ' Soccsksargen'], Location((7.1970344, 124.2351714, 0.0)))",,,874511550383480832,https://twitter.com/BlackCatlyn/status/874511550383480832,fil
vendale143,2017-06-13 14:19,0,0,"Jeg likte en YouTube-video – 24 Oras: Mga nasawing sundalo sa bakbakan sa Marawi, binigyang-pugay","(['NORWAY'], Location((64.5731537, 11.5280364395, 0.0)))",@,,874511503482900481,https://twitter.com/vendale143/status/874511503482900481,fil
radyopilipinas1,2017-06-13 14:19,0,0,Ligtas na ang lahat ng pulis na napaulat na nawawala sa Marawi City. Na-recover ang 5 pulis ng mga tropa ng JTF Marawi kaninang umaga lang.,"(['Quezon City', ' Philippines'], Location((14.6509905, 121.0486155, 0.0)))",,,874511407940648960,https://twitter.com/radyopilipinas1/status/874511407940648960,fil
politikomanila,2017-06-13 14:18,7,3,Maghanda na habang maaga! winnie_castelo urges Palace to prepare fund for Marawi rehab qclocalgovt,,@ @,,874511155024220160,https://twitter.com/politikomanila/status/874511155024220160,fil
NandaDutZ,2017-06-13 14:17,0,0,"Waspada, Panglima TNI: Ada Loncatan ISIS dari Marawi ke Bitung lewat Tribun_Manado","(['jakarta', 'indonesia'], Location((-6.1753942, 106.827183, 0.0)))",@,,874511113777328129,https://twitter.com/NandaDutZ/status/874511113777328129,id
HatawTabloid,2017-06-13 14:14,0,0,Sa ika-119 Araw ng Kalayaan BANDILANG HALF-MAST PARA SA MARAWI INIUTOS ng Palasyo na ila…,"(['Intramuros', ' Manila'], Location((14.5905862, 120.97533, 0.0)))",,,874510291069001728,https://twitter.com/HatawTabloid/status/874510291069001728,fil
CNNIndonesia,2017-06-13 14:14,4,3,Militer Filipina Klaim Kuasai 80 Persen Marawi UC,,,,874510155408318465,https://twitter.com/CNNIndonesia/status/874510155408318465,id
jamesacojedo,2017-06-13 14:13,0,0,Dapat pala kundenanhin natin ang air force kasi wala silang fly by sa independence day kasi busy sila sa marawi?????????,,,,874509957118296064,https://twitter.com/jamesacojedo/status/874509957118296064,fil
dzrhnews,2017-06-13 14:12,0,1,"5 pulis na naipit sa bakbakan sa Marawi City, narescue na ng AFP/PNP/LGU/CSO. | RH24 edmarestabillo","(['Manila', ' Philippines'], Location((14.5906216, 120.9799696, 0.0)))",@,,874509881037864960,https://twitter.com/dzrhnews/status/874509881037864960,fil
dzbb,2017-06-13 14:12,2,9,"TINGNAN: Watawat ng Pilipinas, naka-half mast sa SC bilang pakikidalamhati sa lahat ng nasawi sa Marawi. | via","(['Republic of the Philippines'], Location((12.7503486, 122.7312101, 0.0)))",@,,874509696543150081,https://twitter.com/dzbb/status/874509696543150081,fil
_shaixx_,2017-06-13 14:11,0,1,Nakikisabay sa gulo sa marawi,"(['Philippines'], Location((12.7503486, 122.7312101, 0.0)))",,,874509591672782848,https://twitter.com/_shaixx_/status/874509591672782848,fil
angelcarlosss,2017-06-13 14:11,0,0,"May kaguluhan pa sa Marawi tapos may magpapatayan na din sa basketball, like talaga ba?",,,,874509499100405760,https://twitter.com/angelcarlosss/status/874509499100405760,fil
CecilVillarosa,2017-06-13 14:11,0,0,"TINGNAN: Watawat ng Pilipinas, naka-half mast sa SC bilang pakikidalamhati sa lahat ng nasawi sa Marawi 98",,@,,874509449146228736,https://twitter.com/CecilVillarosa/status/874509449146228736,fil
KotaManado,2017-06-13 14:11,0,0,"Waspada, Panglima TNI: Ada Loncatan ISIS dari Marawi ke Bitung ..","(['Manado'], Location((1.4900578, 124.8408708, 0.0)))",,,874509409489010690,https://twitter.com/KotaManado/status/874509409489010690,id
angelavllrz,2017-06-13 14:10,0,0,Sino? Hahahahha pati ang marawi death squad juskoooooo kakamiss sila kahit isang araw palang na hiwalay,,,,874509311254315008,https://twitter.com/angelavllrz/status/874509311254315008,fil
radyopilipinas1,2017-06-13 14:10,0,0,"Mga otoridad, natukoy na ang ilang indibidwal na nagpakalat ng propaganda sa social media kaugnay ng Marawi siege. Pag-aresto, kinakasa na.","(['Quezon City', ' Philippines'], Location((14.6509905, 121.0486155, 0.0)))",,,874509300311314432,https://twitter.com/radyopilipinas1/status/874509300311314432,fil
DZMMTeleFeed,2017-06-13 14:10,0,0,"Air asset ng AFP, nag-ikot, nagpakawala ng bomba sa Marawi",,,,874509137920507904,https://twitter.com/DZMMTeleFeed/status/874509137920507904,fil
interaksyon,2017-06-13 14:09,2,5,Sotto on solons saying there's no valid basis to declare ML in Mindanao: Padala na lang lahat ng kontra sa Marawi. Sila tumapos ng gulo.,"(['Philippines'], Location((12.7503486, 122.7312101, 0.0)))",,,874509128520974338,https://twitter.com/interaksyon/status/874509128520974338,fil
TheDarkPixel,2017-06-13 14:09,0,0,Forces spéciales US utilisant un drone près de Marawi + RQ-20 Puma dans le pick-up d,,,# # #,874509122577866753,https://twitter.com/TheDarkPixel/status/874509122577866753,fr
PTVisMin,2017-06-13 14:09,1,1,"BALITA: Mga nasawing sundalo sa bakbakan sa Marawi City, ginawaran ng full military honors",,,,874509015178387456,https://twitter.com/PTVisMin/status/874509015178387456,fil
juliosees,2017-06-13 14:09,0,0,"New video by GMA News: BT: Labi ng 5 sa 10 sundalong namatay sa Marawi, kinuha na ng kanilang pamilya...",,,,874509010212339713,https://twitter.com/juliosees/status/874509010212339713,fil
juliosees,2017-06-13 14:09,0,0,"New video by GMA News: BT: Spy plane ng Amerika, nag-ikot sa Marawi",,,,874509009276985346,https://twitter.com/juliosees/status/874509009276985346,fil
juliosees,2017-06-13 14:09,0,0,"New video by GMA News: BT: Labi ng 5 sa 10 sundalong namatay sa Marawi, kinuha na ng kanilang pamilya 0",,,,874508986938208256,https://twitter.com/juliosees/status/874508986938208256,fil
MRYSHLYDLRSR,2017-06-13 14:09,0,0,nag mimilitary diet ako para ready ako makipagbakbakan sa marawi,"(['Jd'], Location((53.56018755, -2.87418774197, 0.0)))",,,874508955111702528,https://twitter.com/MRYSHLYDLRSR/status/874508955111702528,fil
TuballaPJ,2017-06-13 14:08,0,0,Nasawing sundalo sa Marawi ililibing kasama ang bunsong anak,,,,874508809238171649,https://twitter.com/TuballaPJ/status/874508809238171649,fil
dwiz882,2017-06-13 14:08,0,0,PNP – ARMM kinumpirmang marami pang pulis ang nawawala sa kasagsagan ng bakbakan sa Marawi BASAHIN d21,"(['Pasig City', ' Philippines'], Location((9.7771753, 125.4915723, 0.0)))",,#,874508761611632640,https://twitter.com/dwiz882/status/874508761611632640,fil
maeannelosbanos,2017-06-13 14:07,0,1,"Sotto on oppo Solons saying no valid basis 2declare ML in Minda:padala na lang lahat ng kontra sa Marawi.Sila tumapos ng gulo"" News5AKSYON""","(['TV 5'], Location((-18.4830182, -48.4377382, 0.0)))",@,,874508499429892097,https://twitter.com/maeannelosbanos/status/874508499429892097,fil
BatucalBenjel,2017-06-13 14:06,0,0,Giyera sa Marawi pahirapan pa rin; ‘compounding issues’ matindi – AFP Bagama’t nagawang maiwagayway na ang...,"(['general santis city'], Location((-0.2345394, -78.4938239, 0.0)))",,,874508348321914880,https://twitter.com/BatucalBenjel/status/874508348321914880,fil
alila_ng,2017-06-13 14:06,0,0,"No not at all daw, pero dahil palpak ang Zamboanga Okey lang daw ang nangyari sa Marawi! Anong klaseng tao ito?","(['Dubai', ' United Arab Emirates'], Location((2.9470179, 30.961206, 0.0)))",,,874508338108805120,https://twitter.com/alila_ng/status/874508338108805120,fil
radyopilipinas1,2017-06-13 14:06,0,0,Nilinaw ng DSWD na hindi pa maipapamahagi ang nauna nang inanunsyong cash assistance para sa mga pamilyang apektado ng gulo sa Marawi City.,"(['Quezon City', ' Philippines'], Location((14.6509905, 121.0486155, 0.0)))",,,874508278876602368,https://twitter.com/radyopilipinas1/status/874508278876602368,fil
HaroldWrenFinch,2017-06-13 14:06,0,0,Marawi bölgesindeler location olarak.,,,,874508136224370688,https://twitter.com/HaroldWrenFinch/status/874508136224370688,tr
indokininews,2017-06-13 14:05,2,2,Militer Filipina: Militan Muslim Hanya Kuasai 20 Persen Wilayah Marawi,"(['Indonesia'], Location((-4.7993356, 114.5632032, 0.0)))",,,874508038857568256,https://twitter.com/indokininews/status/874508038857568256,id
rmnnetworks,2017-06-13 14:04,0,0,"LatestNews Rehabilitation plan para sa Marawi City, inilalatag na ayon sa Palasyo",,,#,874507788180873216,https://twitter.com/rmnnetworks/status/874507788180873216,fil
FDayun,2017-06-13 14:04,0,0,Lebih Dari 700 Guru Di Marawi Dinyatakan Hilang,"(['Pekanbaru'], Location((0.51532535, 101.445454638, 0.0)))",,,874507691393040384,https://twitter.com/FDayun/status/874507691393040384,id
FDayun,2017-06-13 14:04,0,0,Lebih Dari 700 Guru Di Marawi Dinyatakan Hilang u,"(['Pekanbaru'], Location((0.51532535, 101.445454638, 0.0)))",,,874507689518284800,https://twitter.com/FDayun/status/874507689518284800,id
halfbaaad,2017-06-13 14:03,0,1,Da laged a Marawi a malbod so kapamulong,"(['PH'], Location((12.44249325, 122.160395164, 0.0)))",,,874507582215290880,https://twitter.com/halfbaaad/status/874507582215290880,fil
Graphomotivator,2017-06-13 14:03,0,0,"AMERIKA SERIKAT (AS) DAN KONFLIK DI KOTA MARAWI, FILIPINA Barangsiapa negara yang menentang AS, yang ingin...","(['Jakarta Barat'], Location((-6.16156235, 106.74389124, 0.0)))",,,874507423918280704,https://twitter.com/Graphomotivator/status/874507423918280704,id
kricomid,2017-06-13 14:00,0,0,"Panglima TNI: Jika Disepelekan, Indonesia Bisa Bernasib seperti Marawi Polkam","(['Indonesia'], Location((-4.7993356, 114.5632032, 0.0)))",,#,874506740733292544,https://twitter.com/kricomid/status/874506740733292544,id
Izzabae,2017-06-13 14:00,7,13,Kahit naman siguro humarang ng bala sa Marawi si Nadine may masama pa din masasabi sa kanya. Huminga lang madami na naiinis.,,,,874506670172291072,https://twitter.com/Izzabae/status/874506670172291072,fil
PIADesk,2017-06-13 14:00,4,0,"Patuloy tayong nagpupugay sa mga sundalo, pulis at sibilyan na nadamay sa kaguluhan sa Marawi. MindanaoHourhttp://","(['Philippines'], Location((12.7503486, 122.7312101, 0.0)))",,#,874506623871361024,https://twitter.com/PIADesk/status/874506623871361024,fil
DZMMTeleFeed,2017-06-13 14:00,0,0,"AFP: Morale ng mga sundalo sa Marawi City, mataas pa rin",,,,874506621485019136,https://twitter.com/DZMMTeleFeed/status/874506621485019136,fil
interaksyon,2017-06-13 13:58,0,1,"Three more civilians were rescued at Bgy. Lilod Madaya, Marawi City. | via","(['Philippines'], Location((12.7503486, 122.7312101, 0.0)))",@,,874506328504279040,https://twitter.com/interaksyon/status/874506328504279040,fil
MischordiasD,2017-06-13 13:57,0,0,"Selain Bakar Gereja, Kelompok Militan Culik Pastor dari Kota Marawi u","(['Indonesia'], Location((-4.7993356, 114.5632032, 0.0)))",,,874506112237674496,https://twitter.com/MischordiasD/status/874506112237674496,id
NewsCentralPH,2017-06-13 13:57,0,0,"5 pulis na naipit sa bakbakan sa Marawi, na-rescue na",,,,874506104071266304,https://twitter.com/NewsCentralPH/status/874506104071266304,fil
Asncnkiel_,2017-06-13 13:57,0,1,itapon natin sa Marawi yan.,,,,874506063046860801,https://twitter.com/Asncnkiel_/status/874506063046860801,fil
dzbb,2017-06-13 13:57,0,2,"Tatlong sibilyan, nasagip sa gitna ng bakbakan sa Marawi City. | via Benjielite","(['Republic of the Philippines'], Location((12.7503486, 122.7312101, 0.0)))",@,,874506030012657664,https://twitter.com/dzbb/status/874506030012657664,fil
rmnnetworks,2017-06-13 13:57,0,0,"LatestNews Limang pulis na naipit sa bakbakan sa sa Marawi City, nasa ligtas na kalagayan na ayon sa PNP",,,#,874505953978142724,https://twitter.com/rmnnetworks/status/874505953978142724,fil
KaiDarul,2017-06-13 13:57,0,2,Another 100usd pledge for Marawi City. Huhu. Nakakaiyak ang generosity ng mga friends ko.,"(['Tawi-Tawi', ' Ph'], Location((5.2057, 120.0265, 0.0)))",,,874505898533826560,https://twitter.com/KaiDarul/status/874505898533826560,fil
unlicomments,2017-06-13 13:57,3,7,Hoy! Yung mga pulis mo sa Marawi nagkakandamatay na!!!,"(['NCR', ' Phils'], Location((52.5217268, -1.88499855996, 0.0)))",,,874505893810814976,https://twitter.com/unlicomments/status/874505893810814976,fil
NewsCentralPH,2017-06-13 13:56,0,0,"5 sibilyan pinatay, 8 iba pa binihag ng Maute at ASG sa Marawi",,,,874505831768743936,https://twitter.com/NewsCentralPH/status/874505831768743936,fil
DnyannRenkleri,2017-06-13 13:53,0,1,"Yeni Halk Ordusu, ülkenin güneyindeki Marawi kentinin bir kesimini ele geçirmiş olan IŞİD’e karşı Filipinler...",,,,874504975325552642,https://twitter.com/DnyannRenkleri/status/874504975325552642,tr
KatherineImson,2017-06-13 13:53,0,0,"Three more civilians were rescued at Bgy. Lilod Madaya, Marawi City",,@,,874504930249154562,https://twitter.com/KatherineImson/status/874504930249154562,fil
highkoyajames,2017-06-13 13:52,0,1,Okay na ba? Focus na tayo sa Marawi,"(['Manila City', ' National Capital Region'], Location((14.5906216, 120.9799696, 0.0)))",,,874504775978569728,https://twitter.com/highkoyajames/status/874504775978569728,fil
gmanews,2017-06-13 13:51,2,19,Labis ang pagdadalamhati ngayon ng pamilya ng isa sa mga nasawing sundalo sa Marawi City.,"(['Philippines'], Location((12.7503486, 122.7312101, 0.0)))",,,874504356048936961,https://twitter.com/gmanews/status/874504356048936961,fil
gmanewsfacebook,2017-06-13 13:50,0,0,Kasabay na ililibing ng isa sa mga sundalong nasawi sa Marawi City ang kanyang anim na buwang gulang na anak na...,,,,874504119595130880,https://twitter.com/gmanewsfacebook/status/874504119595130880,fil
Bam1502,2017-06-13 13:49,0,0,Di aken katawan i isembag akenon dahil wala png magandang balita sa nangyayari. Lagid bu o andang! MarawiClash PrayForMarawi,"(['Philippines'], Location((12.7503486, 122.7312101, 0.0)))",,# #,874504029396586496,https://twitter.com/Bam1502/status/874504029396586496,fil
WazzupPilipinas,2017-06-13 13:49,0,0,OgopMarawi WazzupPilipinas PambansangBlogger Marawi,,,# # # #,874503956986245120,https://twitter.com/WazzupPilipinas/status/874503956986245120,fil
jamesacojedo,2017-06-13 13:48,0,1,Tsaka magpaka practical nga tayo mas importante ba na isantabi mga kailangan asikuhin kung ano man nangyayari sa marawi..,,,,874503711283757056,https://twitter.com/jamesacojedo/status/874503711283757056,fil
sycipft,2017-06-13 13:45,0,0,NAG-IYAKAN SA MARAWI! PANOORIN KUNG BAKIT!,,,,874503059396632576,https://twitter.com/sycipft/status/874503059396632576,fil
aljacintoII,2017-06-13 13:42,0,0,"Cyber sedition suspect hinggil sa Marawi siege, aarestuhin na - DICT | Bombo Radyo Philippines","(['Mindanao'], Location((7.68980415, 125.236399692, 0.0)))",,,874502204283113472,https://twitter.com/aljacintoII/status/874502204283113472,fil
redaksiNN,2017-06-13 13:41,0,0,Gerilyawan Marawi Sebut Militer Filipina Gagal - nusantaranews,"(['Jakarta Capital Region'], Location((-6.1753942, 106.827183, 0.0)))",,#,874501849218293761,https://twitter.com/redaksiNN/status/874501849218293761,id
HabibNdeso,2017-06-13 13:40,0,0,"Ente udah selesai cuti jihad cyber nya wan, tangan dah gatel ye fengin pijit2 hp, ane kirain ikut jihad di marawi",,,,874501813084364800,https://twitter.com/HabibNdeso/status/874501813084364800,id
radyopilipinas1,2017-06-13 13:40,0,0,Mga gamot at bottled water na nagkakahalaga ng mahigit sa P5M ipapadala ng PCSO sa mga apektado ng Marawi violence - PCSO GM Balutan.,"(['Quezon City', ' Philippines'], Location((14.6509905, 121.0486155, 0.0)))",,,874501683031621632,https://twitter.com/radyopilipinas1/status/874501683031621632,fil
jeralddeleon,2017-06-13 13:39,0,0,"Truth. Pero in case sa Marawi, Maute and ASG lang talaga ang badtrip. Other muslims naman dun very Christian friendly.","(['Manila'], Location((14.5906216, 120.9799696, 0.0)))",,,874501542769860608,https://twitter.com/jeralddeleon/status/874501542769860608,fil
pm_magazin,2017-06-13 13:39,0,0,Terroristen kontrollieren immer noch 20 Prozent von Marawi,"(['Republic of the Philippines'], Location((12.7503486, 122.7312101, 0.0)))",,,874501468761542656,https://twitter.com/pm_magazin/status/874501468761542656,de
