ABSCBNNews,2017-06-09 08:00,1,4,"Mga mambabatas, binuweltahan si Aguirre sa pagdawit sa kanila sa Marawi siege http://bit.ly/2sZHYAN pic.twitter.com/SxD77Gh2hH","(['Manila', ' Philippines'], Location((14.5906216, 120.9799696, 0.0)))",,,872966479439945733,https://twitter.com/ABSCBNNews/status/872966479439945733
DZMMTeleRadyo,2017-06-09 08:00,0,0,"Mga mambabatas, binuweltahan si Aguirre sa pagdawit sa kanila sa Marawi siege http://bit.ly/2sZHYAN pic.twitter.com/NE3ysh8UIG","(['ABS-CBN', ' Diliman', ' Quezon City'], Location((11.5874907, 122.7520466, 0.0)))",,,872966477447614464,https://twitter.com/DZMMTeleRadyo/status/872966477447614464
narryxlashton_,2017-06-09 07:59,0,1,"strong sya grabe, may skillsxz na pinagmamalaki sa dota2, pwedeng pwede isabak sa marawi, bilhin nyo na HAHAHAHAHA","(['House Stark'], Location((41.0712135, -89.8066831, 0.0)))",,,872966244319637504,https://twitter.com/narryxlashton_/status/872966244319637504
dwiz882,2017-06-09 07:57,0,0,Isa pang peace corridor para agapan ang krisis sa pagkain sa Marawi binuksan na # BASAHIN http://ow.ly/M5mQ30cry96 pic.twitter.com/f0WhsZRfJl,"(['Pasig City', ' Philippines'], Location((9.7771753, 125.4915723, 0.0)))",,#,872965922310438913,https://twitter.com/dwiz882/status/872965922310438913
sellal2,2017-06-09 07:57,0,0,Philippines:des musulmans protègent des chrétiens attaqués par Daesh en fuyant Marawi (VIDEO) https://francais.rt.com/international/39223-philippines-musulmans-protegent-chretiens-attaques-par-daesh-et-fuyant-marawi#.WTnkSqqfMWY.twitter …,,,#,872965881097314309,https://twitter.com/sellal2/status/872965881097314309
EmoTero_AngeLo,2017-06-09 07:55,0,0,News Update: NAHINTO Ang BAKBAKAN sa MARAWI! MAUTE Group NATAKOT ! DAHIL NAHULI AMA ng MAUTE! http://fb.me/vH65Qt2G,"(['philippines'], Location((12.7503486, 122.7312101, 0.0)))",,,872965424245342208,https://twitter.com/EmoTero_AngeLo/status/872965424245342208
binbash1983,2017-06-09 07:53,0,0,News Update: NAHINTO Ang BAKBAKAN sa MARAWI! MAUTE Group NATAKOT ! DAHIL NAHULI AMA ng MAUTE! http://fb.me/6V46B7hPh,"(['Houston', ' TX'], Location((29.7589382, -95.3676974, 0.0)))",,,872964936863035392,https://twitter.com/binbash1983/status/872964936863035392
JhanelAbracosa2,2017-06-09 07:51,0,0,Sarap ipadala sa marawi ihh??,"(['abra'], Location((17.583333, 120.75, 0.0)))",,,872964292219240448,https://twitter.com/JhanelAbracosa2/status/872964292219240448
piamontecastro,2017-06-09 07:48,0,0,sana sila na lang ang ipadala sa marawi bwisit,"([""God's \xc2\xa0\xe2\x9d\xa4""], Location((63.8536592, 20.2167306, 0.0)))",,,872963458240700416,https://twitter.com/piamontecastro/status/872963458240700416
pinoymag15,2017-06-09 07:46,0,0,NAHINTO BAKBAKAN sa MARAWI! MAUTE TUMIKLOP BUNTOT! DAHIL NAHULI AMA ng MAUTE! PANOORIN Slamat sau tatay digong... http://fb.me/73eWCbbmA,,,,872963060050395136,https://twitter.com/pinoymag15/status/872963060050395136
pinoymag15,2017-06-09 07:46,0,0,NAHINTO BAKBAKAN sa MARAWI! MAUTE TUMIKLOP BUNTOT! DAHIL NAHULI AMA ng MAUTE! PANOORIN Slamat sau tatay digong... http://fb.me/1ntMr8kUP,,,,872963056854343681,https://twitter.com/pinoymag15/status/872963056854343681
HaloKBR,2017-06-09 07:46,1,0,"“ @ Citradp: Karena penemuan passpor WNI itu, Filipina mengklaim ada keterlibatan Indonesia dalam teror Marawi # KBRPagi","(['Jakarta', ' Indonesia'], Location((-6.1753942, 106.827183, 0.0)))",@,#,872963018862116864,https://twitter.com/HaloKBR/status/872963018862116864
HaloKBR,2017-06-09 07:45,1,0,"“ @ citradp: Sorotan KBR hari ini soal penemuaan dua passport Warga negara Indonesia di Marawi, Filipina. # KBRPagi","(['Jakarta', ' Indonesia'], Location((-6.1753942, 106.827183, 0.0)))",@,#,872962884220747776,https://twitter.com/HaloKBR/status/872962884220747776
fisheagle10,2017-06-09 07:45,0,0,Marawi Siege http:// http://www.dailytopmedia.com/2017/06/dying-soldier-who-got-cornered-by-maute.html …,"(['Davao City'], Location((7.22650725, 125.454887691, 0.0)))",,,872962811999043585,https://twitter.com/fisheagle10/status/872962811999043585
pinoymag15,2017-06-09 07:40,0,0,Tingnan niyo po ang CHR natin walang imik tungkol sa mga pinaggagawa ng maute sa ating mga kababayan sa marawi.... http://fb.me/vn0wlGEv,,,,872961636239380480,https://twitter.com/pinoymag15/status/872961636239380480
dzbb,2017-06-09 07:39,1,1,"Mga dayuhang terorista, hindi umano malayong sumuporta sa Maute group kapag nagtagal pa ang giyera sa Marawi City. | via @ wengsalvacionpic.twitter.com/FXw00nuMBr","(['Republic of the Philippines'], Location((12.7503486, 122.7312101, 0.0)))",@,,872961421319041024,https://twitter.com/dzbb/status/872961421319041024
merfat__,2017-06-09 07:39,1,2,ربي يسلم قلبك,"(['Kingdom of Saudi Arabia'], Location((-6.8638235, 39.2551949, 0.0)))",,,872961408551579649,https://twitter.com/merfat__/status/872961408551579649
nineteen_hanna,2017-06-09 07:39,0,0,Hanggang ngyon ! D ako makapaniwala sa cnapit ng marawi city! # PrayForMarawi,"(['Teardrops'], Location((52.02604075, -0.767619940116, 0.0)))",,#,872961261511651328,https://twitter.com/nineteen_hanna/status/872961261511651328
CwsOpwxDn8GmJXV,2017-06-09 07:38,0,0,,"(['\xc2\xa0\xf0\x9f\x8c\x95\xc2\xa0\xe2\x99\xa5\xef\xb8\x8f'], Location((6.1653655, -75.6001276, 0.0)))",,,872961154460602368,https://twitter.com/CwsOpwxDn8GmJXV/status/872961154460602368
Jaaaaaaps,2017-06-09 07:36,0,1,Tangina mo. Dun ka sa marawi. Kalalaking tao ampota.,"(['\xce\xb9\xce\xb9\xe2\x99\xa1\xc2\xa0\xe2\x9c\xa1\xe2\x80\xa0\xe2\x98\x85\xe2\x96\xb3\xcc\xb6\xe2\x98\xbd\xe2\x9d\x81\xce\xb9\xce\xb9'], Location((4.207577, 31.9988747, 0.0)))",,,872960453990768641,https://twitter.com/Jaaaaaaps/status/872960453990768641
marawi_q8,2017-06-09 07:32,0,4,تسلمي قلبيpic.twitter.com/5wXEPSnfle,,,,872959497505046528,https://twitter.com/marawi_q8/status/872959497505046528
dzbb,2017-06-09 07:28,0,0,"Bakbakan sa Marawi City, nagpapatuloy. | via @ Benjielitepic.twitter.com/aN6OHddf67","(['Republic of the Philippines'], Location((12.7503486, 122.7312101, 0.0)))",@,,872958655217446912,https://twitter.com/dzbb/status/872958655217446912
ukgdos,2017-06-09 07:27,11,21,"# UKGShowbizGanap Angel Locsin, bumisita sa mga bakwit mula Marawi City","(['Philippines'], Location((12.7503486, 122.7312101, 0.0)))",,#,872958200747892737,https://twitter.com/ukgdos/status/872958200747892737
egdsgn,2017-06-09 07:26,0,0,"Maraming residente, ipit pa rin sa bakbakan sa Marawi https://politicsph.pogoport.com/maraming-residente-ipit-pa-rin-sa-bakbakan-sa-marawi/ …","(['Davao City', ' Davao Region'], Location((7.22650725, 125.454887691, 0.0)))",,,872958149942292482,https://twitter.com/egdsgn/status/872958149942292482
muzi_kha,2017-06-09 07:26,0,0,"Maraming residente, ipit pa rin sa bakbakan sa Marawi https://politicsph.pogoport.com/maraming-residente-ipit-pa-rin-sa-bakbakan-sa-marawi/ …","(['The Office'], Location((9.6663813, 80.0122994306, 0.0)))",,,872958144753926145,https://twitter.com/muzi_kha/status/872958144753926145
chris19thws,2017-06-09 07:26,0,0,"Maraming residente, ipit pa rin sa bakbakan sa Marawi https://politicsph.pogoport.com/maraming-residente-ipit-pa-rin-sa-bakbakan-sa-marawi/ …","(['Philippines'], Location((12.7503486, 122.7312101, 0.0)))",,,872958139846594560,https://twitter.com/chris19thws/status/872958139846594560
PoGo_Port,2017-06-09 07:26,0,0,"Maraming residente, ipit pa rin sa bakbakan sa Marawi https://politicsph.pogoport.com/maraming-residente-ipit-pa-rin-sa-bakbakan-sa-marawi/ …",,,,872958134784012288,https://twitter.com/PoGo_Port/status/872958134784012288
orga_ogop,2017-06-09 07:26,0,0,"Maraming residente, ipit pa rin sa bakbakan sa Marawi https://politicsph.pogoport.com/maraming-residente-ipit-pa-rin-sa-bakbakan-sa-marawi/ …",,,,872958129708904450,https://twitter.com/orga_ogop/status/872958129708904450
RTheKrak3n,2017-06-09 07:26,0,0,"Maraming residente, ipit pa rin sa bakbakan sa Marawi https://politicsph.pogoport.com/maraming-residente-ipit-pa-rin-sa-bakbakan-sa-marawi/ …",,,,872958124709359616,https://twitter.com/RTheKrak3n/status/872958124709359616
Marawi_98,2017-06-09 07:23,1,0,ما أجمل القدر عندما يبعدك عن اشياء لا تستحقك .,,,,872957403423289345,https://twitter.com/Marawi_98/status/872957403423289345
zhrax26,2017-06-09 07:19,1,0,@ _marawi ماينس١٦؛بلغ حسود العين انك حلالي.,,@,,872956391186714624,https://twitter.com/zhrax26/status/872956391186714624
wengsalvacion,2017-06-09 07:19,0,0,"Opensiba vs Maute group sa Marawi, dapat tapusin na ng AFP para hindi ito makahatak ng suporta sa foreign terrorists - Cong Pimentel @ dzbb","(['Philippines'], Location((12.7503486, 122.7312101, 0.0)))",@,,872956153252020224,https://twitter.com/wengsalvacion/status/872956153252020224
c02299f3451f442,2017-06-09 07:18,0,0,Marawi City,,,,872956149313581056,https://twitter.com/c02299f3451f442/status/872956149313581056
dzbb,2017-06-09 07:17,0,0,"Militar, inaalam pa ang balita kung totoong nakalabas na nga ba ng Marawi City si Isnilon Hapilon. # SuperBalitaSaUmagaNationwide","(['Republic of the Philippines'], Location((12.7503486, 122.7312101, 0.0)))",,#,872955876503629824,https://twitter.com/dzbb/status/872955876503629824
ErnestoJoaquin9,2017-06-09 07:16,2,3,Napurnada ang share ni Hontivirus. Milliones ang nasamsan ng AFP sa Marawi! # HontiVirusMauteQueen,,,#,872955621569576960,https://twitter.com/ErnestoJoaquin9/status/872955621569576960
andreaskorinov,2017-06-09 07:16,66,5,se equivocó no es Siria ni Libia tampoco Irak marawi filipinas hoy después de enfrentamientos con yihadistas pic.twitter.com/veRzflprTp,"(['Turkey'], Location((38.9597594, 34.9249653, 0.0)))",,,872955483606458373,https://twitter.com/andreaskorinov/status/872955483606458373
dwiz882,2017-06-09 07:15,1,0,"Mga nagsilikas sa Marawi pumalo na sa 70,000 # BASAHIN http://ow.ly/NcR330crw07 pic.twitter.com/9u3R3bJ9HF","(['Pasig City', ' Philippines'], Location((9.7771753, 125.4915723, 0.0)))",,#,872955337107685377,https://twitter.com/dwiz882/status/872955337107685377
ImJasonBadiang,2017-06-09 07:02,0,0,Sana gagawa din si Ariana ng One Love Marawi. Hahahahaha.,"(['Cagayan De Oro City'], Location((8.42980265, 124.682410212, 0.0)))",,,872952021216710657,https://twitter.com/ImJasonBadiang/status/872952021216710657
merfat__,2017-06-09 06:57,0,0,قمر,"(['Kingdom of Saudi Arabia'], Location((-6.8638235, 39.2551949, 0.0)))",,,872950713369993217,https://twitter.com/merfat__/status/872950713369993217
egdsgn,2017-06-09 06:57,0,0,"Abu Sayyaf at Maute, nag-ikot sa Marawi para planuhan ang pag-atake https://politicsph.pogoport.com/abu-sayyaf-at-maute-nag-ikot-sa-marawi-para-planuhan-ang-pag-atake/ …","(['Davao City', ' Davao Region'], Location((7.22650725, 125.454887691, 0.0)))",,,872950636362551296,https://twitter.com/egdsgn/status/872950636362551296
muzi_kha,2017-06-09 06:57,0,0,"Abu Sayyaf at Maute, nag-ikot sa Marawi para planuhan ang pag-atake https://politicsph.pogoport.com/abu-sayyaf-at-maute-nag-ikot-sa-marawi-para-planuhan-ang-pag-atake/ …","(['The Office'], Location((9.6663813, 80.0122994306, 0.0)))",,,872950631547457538,https://twitter.com/muzi_kha/status/872950631547457538
chris19thws,2017-06-09 06:57,0,0,"Abu Sayyaf at Maute, nag-ikot sa Marawi para planuhan ang pag-atake https://politicsph.pogoport.com/abu-sayyaf-at-maute-nag-ikot-sa-marawi-para-planuhan-ang-pag-atake/ …","(['Philippines'], Location((12.7503486, 122.7312101, 0.0)))",,,872950625700589569,https://twitter.com/chris19thws/status/872950625700589569
PoGo_Port,2017-06-09 06:57,0,0,"Abu Sayyaf at Maute, nag-ikot sa Marawi para planuhan ang pag-atake https://politicsph.pogoport.com/abu-sayyaf-at-maute-nag-ikot-sa-marawi-para-planuhan-ang-pag-atake/ …",,,,872950619820228608,https://twitter.com/PoGo_Port/status/872950619820228608
orga_ogop,2017-06-09 06:56,0,0,"Abu Sayyaf at Maute, nag-ikot sa Marawi para planuhan ang pag-atake https://politicsph.pogoport.com/abu-sayyaf-at-maute-nag-ikot-sa-marawi-para-planuhan-ang-pag-atake/ …",,,,872950614753505280,https://twitter.com/orga_ogop/status/872950614753505280
RTheKrak3n,2017-06-09 06:56,0,0,"Abu Sayyaf at Maute, nag-ikot sa Marawi para planuhan ang pag-atake https://politicsph.pogoport.com/abu-sayyaf-at-maute-nag-ikot-sa-marawi-para-planuhan-ang-pag-atake/ …",,,,872950609640660992,https://twitter.com/RTheKrak3n/status/872950609640660992
egdsgn,2017-06-09 06:56,0,0,"Dating mayor ng Marawi, arestado dahil sa hinihinalang koneksyon sa Maute https://politicsph.pogoport.com/dating-mayor-ng-marawi-arestado-dahil-sa-hinihinalang-koneksyon-sa-maute/ …","(['Davao City', ' Davao Region'], Location((7.22650725, 125.454887691, 0.0)))",,,872950599377199106,https://twitter.com/egdsgn/status/872950599377199106
muzi_kha,2017-06-09 06:56,0,0,"Dating mayor ng Marawi, arestado dahil sa hinihinalang koneksyon sa Maute https://politicsph.pogoport.com/dating-mayor-ng-marawi-arestado-dahil-sa-hinihinalang-koneksyon-sa-maute/ …","(['The Office'], Location((9.6663813, 80.0122994306, 0.0)))",,,872950593882660864,https://twitter.com/muzi_kha/status/872950593882660864
chris19thws,2017-06-09 06:56,0,0,"Dating mayor ng Marawi, arestado dahil sa hinihinalang koneksyon sa Maute https://politicsph.pogoport.com/dating-mayor-ng-marawi-arestado-dahil-sa-hinihinalang-koneksyon-sa-maute/ …","(['Philippines'], Location((12.7503486, 122.7312101, 0.0)))",,,872950589201809409,https://twitter.com/chris19thws/status/872950589201809409
PoGo_Port,2017-06-09 06:56,0,0,"Dating mayor ng Marawi, arestado dahil sa hinihinalang koneksyon sa Maute https://politicsph.pogoport.com/dating-mayor-ng-marawi-arestado-dahil-sa-hinihinalang-koneksyon-sa-maute/ …",,,,872950584638402560,https://twitter.com/PoGo_Port/status/872950584638402560
orga_ogop,2017-06-09 06:56,0,0,"Dating mayor ng Marawi, arestado dahil sa hinihinalang koneksyon sa Maute https://politicsph.pogoport.com/dating-mayor-ng-marawi-arestado-dahil-sa-hinihinalang-koneksyon-sa-maute/ …",,,,872950580142067712,https://twitter.com/orga_ogop/status/872950580142067712
RTheKrak3n,2017-06-09 06:56,0,0,"Dating mayor ng Marawi, arestado dahil sa hinihinalang koneksyon sa Maute https://politicsph.pogoport.com/dating-mayor-ng-marawi-arestado-dahil-sa-hinihinalang-koneksyon-sa-maute/ …",,,,872950575054323712,https://twitter.com/RTheKrak3n/status/872950575054323712
WorldStarIslam1,2017-06-09 06:56,0,0,"Plus de 160 personnes, dont près de 50 enfants, ont été secourues à # Marawi, selon les… https://www.instagram.com/p/BVGJ0CRBjtv/","(['SITE WEB \xc2\xa0\xf0\x9f\x91\x89'], Location((43.6052384, 3.8638769, 0.0)))",,#,872950550832205825,https://twitter.com/WorldStarIslam1/status/872950550832205825
mhow_nethzki,2017-06-09 06:54,0,0,Ipain itong dot sec sa marawi bka mas may kpakipkinabang syang mgwa sa bansa,,,,872950095557177345,https://twitter.com/mhow_nethzki/status/872950095557177345
dwiz882,2017-06-09 06:54,0,0,# IZHeadlines Isa pang peace corridor para agapan ang krisis sa pagkain sa Marawi City binuksan ng gobyerno,"(['Pasig City', ' Philippines'], Location((9.7771753, 125.4915723, 0.0)))",,#,872949945766039552,https://twitter.com/dwiz882/status/872949945766039552
dzrhnews,2017-06-09 06:50,1,0,"Maute Group humina na, giyera sa Marawi City malapit nang matapos ayon sa AFP. # ACSBalita","(['Manila', ' Philippines'], Location((14.5906216, 120.9799696, 0.0)))",,#,872948856782180352,https://twitter.com/dzrhnews/status/872948856782180352
DZMMTeleRadyo,2017-06-09 06:44,3,1,"Wadi: Kung mabilis na na-resolba 'yung sa Marawi, mawawalan ng dahilan ang deklarasyon ng martial law.","(['ABS-CBN', ' Diliman', ' Quezon City'], Location((11.5874907, 122.7520466, 0.0)))",,,872947489271410688,https://twitter.com/DZMMTeleRadyo/status/872947489271410688
dzrhnews,2017-06-09 06:40,0,0,"ASG leader Isnilon Hapilon, pinaniniwalaang nakalabas na ng Marawi City. # ACSBalita","(['Manila', ' Philippines'], Location((14.5906216, 120.9799696, 0.0)))",,#,872946339918774272,https://twitter.com/dzrhnews/status/872946339918774272
maxangelo987,2017-06-09 06:33,0,0,Inaresto ng mga pulis ang tatlo nilang kabaro na hindi huminto sa checkpoint sa Marawi City. May report si https://sandraguinaldo.pic.twitter.com/kr5ojVOK3D  …,,,,872944637115326466,https://twitter.com/maxangelo987/status/872944637115326466
acn_int_es,2017-06-09 06:30,6,3,"Lo ocurrido en Marawi, # Filipinas agrava una situación complicada y dificulta la promoción del diálogo interreligioso http://bit.ly/2r9zPZ8 pic.twitter.com/T01RUwii0Q","(['K\xc3\xb6nigstein im Taunus', ' Alemania'], Location((50.1818833, 8.465271, 0.0)))",,#,872943860896452608,https://twitter.com/acn_int_es/status/872943860896452608
marawi_q8,2017-06-09 06:23,0,0,الله الله علي كلامك,,,,872942127403106305,https://twitter.com/marawi_q8/status/872942127403106305
dwiz882,2017-06-09 06:22,0,0,# IZLIVE sa # RatsadaBalita si DILG Usec. for Peace and Order Catalino Uy kaugnay sa pagkaka-aresto kay dating Marawi City Mayor Salic,"(['Pasig City', ' Philippines'], Location((9.7771753, 125.4915723, 0.0)))",,# #,872942036717928449,https://twitter.com/dwiz882/status/872942036717928449
_N0600,2017-06-09 06:22,1,0,مساء الزهور,,,,872941872964030465,https://twitter.com/_N0600/status/872941872964030465
troll_zn,2017-06-09 06:22,1,0,BBCIndonesia Sabah dan Miangas 'jadi jalur masuk' milisi WNI ke Marawi https://goo.gl/fb/7Gr5Os,"(['Indonesia'], Location((-4.7993356, 114.5632032, 0.0)))",,,872941865942884353,https://twitter.com/troll_zn/status/872941865942884353
i3ryok,2017-06-09 06:22,0,1,"Mga kabataang apektado ng gulo sa Marawi, posibleng mag-aklas na rin laban sa gobyerno-UP professor - http://www.newsportal.ph/mga-kabataang-apektado-ng-gulo-sa-marawi-posibleng-mag-aklas-na-rin-laban-sa-gobyerno-up-professor/ …pic.twitter.com/eXldSR9NaX",,,,872941821566926848,https://twitter.com/i3ryok/status/872941821566926848
marawi_q8,2017-06-09 06:21,1,0,هههههههههه,,,,872941757574651906,https://twitter.com/marawi_q8/status/872941757574651906
marawi_q8,2017-06-09 06:21,2,0,مساء النور,,,,872941622274797568,https://twitter.com/marawi_q8/status/872941622274797568
dzbb,2017-06-09 06:17,0,1,"Militar at mga pulis, tatangkaing matapos na ang kaguluhan sa Marawi City sa mga susunod na apat na araw. | via @ Benjielitepic.twitter.com/9f3qQHgmtM","(['Republic of the Philippines'], Location((12.7503486, 122.7312101, 0.0)))",@,,872940765072248834,https://twitter.com/dzbb/status/872940765072248834
marawi_q8,2017-06-09 06:15,3,6,# العين تشوووف الف والقلب يحب واحد رؤؤؤؤؤؤؤؤعه pic.twitter.com/2ljKPU5WRe,,,#,872940137071726594,https://twitter.com/marawi_q8/status/872940137071726594
twitberitadunia,2017-06-09 06:11,1,0,Sabah dan Miangas 'jadi jalur masuk' milisi WNI ke Marawi: BNPT meyakini bahwa Jamaah Ansharut… # Beritadunia # BBC,"(['Indonesia'], Location((-4.7993356, 114.5632032, 0.0)))",,# #,872939232100306944,https://twitter.com/twitberitadunia/status/872939232100306944
keiicons,2017-06-09 06:07,0,0,uli na kog marawi beeee,"(['New York', ' USA'], Location((40.7306458, -73.9866136, 0.0)))",,,872938122299949056,https://twitter.com/keiicons/status/872938122299949056
UnityNetworks,2017-06-09 06:04,1,0,Sabah dan Miangas ‘jadi jalur masuk’ milisi WNI ke Marawi http://blog.sekseeh.com/berita/sabah-dan-miangas-jadi-jalur-masuk-milisi-wni-ke-marawi/ … http://fb.me/6vcmpxk84,"(['Jakarta'], Location((-6.1753942, 106.827183, 0.0)))",,,872937507545022464,https://twitter.com/UnityNetworks/status/872937507545022464
UnityNetworks,2017-06-09 06:04,1,0,Sabah dan Miangas ‘jadi jalur masuk’ milisi WNI ke Marawi http://blog.sekseeh.com/berita/sabah-dan-miangas-jadi-jalur-masuk-milisi-wni-ke-marawi/ …,"(['Jakarta'], Location((-6.1753942, 106.827183, 0.0)))",,,872937490818240513,https://twitter.com/UnityNetworks/status/872937490818240513
Infonya_Mas,2017-06-09 06:04,1,0,Sabah dan Miangas ‘jadi jalur masuk’ milisi WNI ke Marawi http://blog.sekseeh.com/berita/sabah-dan-miangas-jadi-jalur-masuk-milisi-wni-ke-marawi/ …,"(['Surabaya'], Location((-7.2459717, 112.7378266, 0.0)))",,,872937456844365824,https://twitter.com/Infonya_Mas/status/872937456844365824
jessomie,2017-06-09 06:04,0,0,hariankompas: Pos Pemeriksaan di Marawi http://kompas.id/baca/internasional/2017/06/09/pos-pemeriksaan-di-marawi/ …pic.twitter.com/zn3zI1FhHZ,,,,872937443493900288,https://twitter.com/jessomie/status/872937443493900288
egdsgn,2017-06-09 06:01,0,0,"Rescue operations sa mga sibilyang naiipit sa Marawi crisis, nagpapatuloy https://politicsph.pogoport.com/rescue-operations-sa-mga-sibilyang-naiipit-sa-marawi-crisis-nagpapatuloy/ …","(['Davao City', ' Davao Region'], Location((7.22650725, 125.454887691, 0.0)))",,,872936549742149633,https://twitter.com/egdsgn/status/872936549742149633
muzi_kha,2017-06-09 06:01,0,0,"Rescue operations sa mga sibilyang naiipit sa Marawi crisis, nagpapatuloy https://politicsph.pogoport.com/rescue-operations-sa-mga-sibilyang-naiipit-sa-marawi-crisis-nagpapatuloy/ …","(['The Office'], Location((9.6663813, 80.0122994306, 0.0)))",,,872936543996055552,https://twitter.com/muzi_kha/status/872936543996055552
chris19thws,2017-06-09 06:01,0,0,"Rescue operations sa mga sibilyang naiipit sa Marawi crisis, nagpapatuloy https://politicsph.pogoport.com/rescue-operations-sa-mga-sibilyang-naiipit-sa-marawi-crisis-nagpapatuloy/ …","(['Philippines'], Location((12.7503486, 122.7312101, 0.0)))",,,872936538694463488,https://twitter.com/chris19thws/status/872936538694463488
PoGo_Port,2017-06-09 06:01,0,0,"Rescue operations sa mga sibilyang naiipit sa Marawi crisis, nagpapatuloy https://politicsph.pogoport.com/rescue-operations-sa-mga-sibilyang-naiipit-sa-marawi-crisis-nagpapatuloy/ …",,,,872936533325697024,https://twitter.com/PoGo_Port/status/872936533325697024
orga_ogop,2017-06-09 06:01,0,0,"Rescue operations sa mga sibilyang naiipit sa Marawi crisis, nagpapatuloy https://politicsph.pogoport.com/rescue-operations-sa-mga-sibilyang-naiipit-sa-marawi-crisis-nagpapatuloy/ …",,,,872936525528535040,https://twitter.com/orga_ogop/status/872936525528535040
RTheKrak3n,2017-06-09 06:00,0,0,"Rescue operations sa mga sibilyang naiipit sa Marawi crisis, nagpapatuloy https://politicsph.pogoport.com/rescue-operations-sa-mga-sibilyang-naiipit-sa-marawi-crisis-nagpapatuloy/ …",,,,872936520478490624,https://twitter.com/RTheKrak3n/status/872936520478490624
egdsgn,2017-06-09 06:00,0,0,"PCSO, patuloy na magpapaabot ng tulong sa mga biktima ng Marawi crisis https://politicsph.pogoport.com/pcso-patuloy-na-magpapaabot-ng-tulong-sa-mga-biktima-ng-marawi-crisis/ …","(['Davao City', ' Davao Region'], Location((7.22650725, 125.454887691, 0.0)))",,,872936506121490434,https://twitter.com/egdsgn/status/872936506121490434
muzi_kha,2017-06-09 06:00,0,0,"PCSO, patuloy na magpapaabot ng tulong sa mga biktima ng Marawi crisis https://politicsph.pogoport.com/pcso-patuloy-na-magpapaabot-ng-tulong-sa-mga-biktima-ng-marawi-crisis/ …","(['The Office'], Location((9.6663813, 80.0122994306, 0.0)))",,,872936500903759872,https://twitter.com/muzi_kha/status/872936500903759872
chris19thws,2017-06-09 06:00,0,0,"PCSO, patuloy na magpapaabot ng tulong sa mga biktima ng Marawi crisis https://politicsph.pogoport.com/pcso-patuloy-na-magpapaabot-ng-tulong-sa-mga-biktima-ng-marawi-crisis/ …","(['Philippines'], Location((12.7503486, 122.7312101, 0.0)))",,,872936495606370305,https://twitter.com/chris19thws/status/872936495606370305
PoGo_Port,2017-06-09 06:00,0,0,"PCSO, patuloy na magpapaabot ng tulong sa mga biktima ng Marawi crisis https://politicsph.pogoport.com/pcso-patuloy-na-magpapaabot-ng-tulong-sa-mga-biktima-ng-marawi-crisis/ …",,,,872936490745159680,https://twitter.com/PoGo_Port/status/872936490745159680
orga_ogop,2017-06-09 06:00,0,0,"PCSO, patuloy na magpapaabot ng tulong sa mga biktima ng Marawi crisis https://politicsph.pogoport.com/pcso-patuloy-na-magpapaabot-ng-tulong-sa-mga-biktima-ng-marawi-crisis/ …",,,,872936486144012288,https://twitter.com/orga_ogop/status/872936486144012288
RTheKrak3n,2017-06-09 06:00,0,0,"PCSO, patuloy na magpapaabot ng tulong sa mga biktima ng Marawi crisis https://politicsph.pogoport.com/pcso-patuloy-na-magpapaabot-ng-tulong-sa-mga-biktima-ng-marawi-crisis/ …",,,,872936481249271808,https://twitter.com/RTheKrak3n/status/872936481249271808
DmonVlad,2017-06-09 05:59,1,0,https://www.youtube.com/watch?v=6Nloke-WS-g … Peke din ba to?! Seryoso? Sa panayam na yan parang di mo naiintindihan ang sitwasyon sa Marawi eh. Ano ba!,,,,872936062456283137,https://twitter.com/DmonVlad/status/872936062456283137
dzrhnews,2017-06-09 05:50,0,0,"Inarestong dating asawa ni Alma Moreno na mayor ng Marawi City, itinuturong financier ng Maute group. # MagandangUmagaPilipinas","(['Manila', ' Philippines'], Location((14.5906216, 120.9799696, 0.0)))",,#,872933756616679425,https://twitter.com/dzrhnews/status/872933756616679425
videoztrending,2017-06-09 05:47,0,0,"Maute na napuruhan sa bakbakan nakunan ng video sa cellphone, Bam nadawit sa kaguluhan sa MARAWI http://ift.tt/2sjQsGa",,,,872933202280755206,https://twitter.com/videoztrending/status/872933202280755206
videoztrending,2017-06-09 05:47,0,1,MGA SUNDALO NAGBUWIS NG BUHAY PARA SAGIPIN ANG MGA BATA SA MARAWI CITY http://ift.tt/2sjTOJm,,,,872933198866636800,https://twitter.com/videoztrending/status/872933198866636800
traveLinks,2017-06-09 05:46,0,0,Überfall auf philippinische Stadt: Kampfzone Marawi http://travelink4you.de/ueberfall-auf-philippinische-stadt-kampfzone-marawi/ …,"(['Germany'], Location((51.0834196, 10.4234469, 0.0)))",,,872932980121108480,https://twitter.com/traveLinks/status/872932980121108480
