fritztenebro,2017-06-09 15:33,0,0,Fucks inbound! # philippines # marawi # mindanao # philippinearmy # isis_hunter… https://www.instagram.com/p/BVHE_SNFi02/,"(['Pearl of the Orient'], Location((50.8474666, -1.0308452, 0.0)))",,# # # # #,873080688794189825,https://twitter.com/fritztenebro/status/873080688794189825
Carolle0909,2017-06-09 15:31,13,1,Napakdemonyo mo William ang sarap mo talagang pasabogin sa Marawi... # LBMagtagoKaNaWilliam,,,#,873080005680537600,https://twitter.com/Carolle0909/status/873080005680537600
anh__nah,2017-06-09 15:30,0,0,Asa dapita sa marawi te?,,,,873079942644289536,https://twitter.com/anh__nah/status/873079942644289536
DZMMTeleFeed,2017-06-09 15:30,0,0,"5 pang magnanakaw sa Marawi, arestado",,,,873079719008149504,https://twitter.com/DZMMTeleFeed/status/873079719008149504
Thetruth1019,2017-06-09 15:29,0,0,"@ risahontiveros dahil po sa mukha naman na alam na alam nyo ang dapat gawin sa Marawi, siguro po kayo ang dapat ipadala doon.","(['Cabanatuan', ' Central Luzon'], Location((15.4891397, 120.9693062, 0.0)))",@,,873079644701859840,https://twitter.com/Thetruth1019/status/873079644701859840
AsiaNews_FR,2017-06-09 15:27,6,0,# Phillipines troisième semaine de conflit entre les militants islamistes et les troupes à # Marawi par @ herime23pic.twitter.com/h1qGbrEVNe,,@,# #,873079117830279169,https://twitter.com/AsiaNews_FR/status/873079117830279169
celleestrucked,2017-06-09 15:27,0,0,"Dapat kasi bumalik na si Cardo sa pagiging pulis para matapos na ang gyera sa Marawi."" HAY NAKO PINOY GYUD HAHAHA""",,,,873079095973691393,https://twitter.com/celleestrucked/status/873079095973691393
juliosees,2017-06-09 15:24,0,0,"New video by GMA News: Ilang senador, binatikos ang pagdadawit ni Sec. Aguirre sa ilang senador sa gulo sa Marawi... http://fb.me/8daQnAjJJ",,,,873078411463335937,https://twitter.com/juliosees/status/873078411463335937
juliosees,2017-06-09 15:24,0,0,"New video by GMA News: Ama ng Maute brothers na lider ng mga umatake sa Marawi, bantay-sarado sa Camp Bagong Diwa... http://fb.me/ZQCwqnaI",,,,873078398142128128,https://twitter.com/juliosees/status/873078398142128128
juliosees,2017-06-09 15:24,0,0,"New video by GMA News: Ilang senador, binatikos ang pagdadawit ni Sec. Aguirre sa ilang senador sa gulo sa Marawi https://youtu.be/M1IwrRkFrT0",,,,873078380173774848,https://twitter.com/juliosees/status/873078380173774848
juliosees,2017-06-09 15:24,0,0,"New video by GMA News: Ama ng Maute brothers na lider ng mga umatake sa Marawi, bantay-sarado sa Camp Bagong Diwa https://youtu.be/1jw4v0b7em8",,,,873078377237716993,https://twitter.com/juliosees/status/873078377237716993
Kweynz,2017-06-09 15:24,0,4,Awww. Sana matigil na ang gulo sa marawi,"(['Seoul', ' Republic of Korea'], Location((37.5666791, 126.9782914, 0.0)))",,,873078249374359552,https://twitter.com/Kweynz/status/873078249374359552
LhexceLLence_01,2017-06-09 15:23,0,0,Ang daming pabida at pabibo nangunguna na dun si Risa Hontiveros! Bakit hindi kaya sya ang magpunta sa marawi?,"(['Tarlac city', ' Ph'], Location((15.485997, 120.589556, 0.0)))",,,873078049943597056,https://twitter.com/LhexceLLence_01/status/873078049943597056
Gerhard0708,2017-06-09 15:17,0,1,Oh pisti kud kaayo sya oh dapat naglaag ta ses bago ka nilakaw og marawi,,,,873076513259741184,https://twitter.com/Gerhard0708/status/873076513259741184
dzbb,2017-06-09 15:15,0,0,"FLASH: Isang batang lalaki, patay matapos tamaan ng ligaw na bala sa loob ng isang mosque sa Marawi City. | via @ Benjielitepic.twitter.com/o4dYzx52vL","(['Republic of the Philippines'], Location((12.7503486, 122.7312101, 0.0)))",@,,873076120316329984,https://twitter.com/dzbb/status/873076120316329984
ElAlescay,2017-06-09 15:15,1,0,C'est ouf que personne parle de ce qu'il passe à # Marawi,,,#,873076089781862401,https://twitter.com/ElAlescay/status/873076089781862401
LPLdirect,2017-06-09 15:13,24,5,FLASH # Marawi # Daesh possède toujours la ville. L'armée est forcée à reculer. # PrayForMarawi pic.twitter.com/RzghGx24rE,,,# # #,873075605582958592,https://twitter.com/LPLdirect/status/873075605582958592
dzrhnews,2017-06-09 15:12,1,2,Mga dayuhang negosyante gusto pa ring mamuhunan sa Mindanao sa kabila ng Marawi siege | RH04 @ KarenowYong # RapidoHatawBalita,"(['Manila', ' Philippines'], Location((14.5906216, 120.9799696, 0.0)))",@,#,873075188627144704,https://twitter.com/dzrhnews/status/873075188627144704
Genzukie,2017-06-09 15:11,0,0,Tara nood tayo dc sa marawi libre kita pamasahe,,,,873075064278663168,https://twitter.com/Genzukie/status/873075064278663168
brigadanational,2017-06-09 15:08,0,0,'Wag nang magsisihan' - Padilla re: Marawi siege Read more: http://bit.ly/2rc9NVs pic.twitter.com/cEgq2cRkxm,"(['Makati', ' PH'], Location((14.55459465, 121.021407905, 0.0)))",,,873074234502766594,https://twitter.com/brigadanational/status/873074234502766594
dyABTeleRadyo,2017-06-09 15:07,0,0,AFP gihimakak nga nakagawas na sa Marawi City si Isnilon Hapilon. http://fb.me/22n6iIzwA,"(['Cebu', ' Philippines'], Location((10.45, 123.84, 0.0)))",,,873074077304446977,https://twitter.com/dyABTeleRadyo/status/873074077304446977
dyABTeleRadyo,2017-06-09 15:07,0,0,AFP: Paningkamutan namo nga sa lunes makalingkawas na ang Marawi City http://fb.me/4fPQfTvkg,"(['Cebu', ' Philippines'], Location((10.45, 123.84, 0.0)))",,,873073957519237120,https://twitter.com/dyABTeleRadyo/status/873073957519237120
mheKittyMeow,2017-06-09 15:06,7,19,SI ANGEL LOCSIN LANG TALAGA ANG NAG IISANG DARNA SA LAHAT.. MULA MANILA LUMIPAD NG MARAWI MINDANAO.. KAYA VERY BLESSED DIN SI @ 143redangel,"(['Philippines'], Location((12.7503486, 122.7312101, 0.0)))",@,,873073832872951809,https://twitter.com/mheKittyMeow/status/873073832872951809
ndeicm,2017-06-09 15:06,0,0,BAHALA KA DIHA DILI JUD KO HAHAHAHAHA pero bitaw ay na curious ko unsa naa sa marawi ron bwahahahaha try daw nako one time,"(['life'], Location((35.6145156, -88.4786605, 0.0)))",,,873073820742975490,https://twitter.com/ndeicm/status/873073820742975490
ochia99,2017-06-09 15:04,0,0,Mga flatchested pangandam namos inyung kaugalingon kay kung dili pa mahuman ang gyera ddtus Marawi basin kamo moy pasulongon ddto.,"(['Gala', 'Dipolog City'], Location((11.450531, 8.950162, 0.0)))",,,873073272383971329,https://twitter.com/ochia99/status/873073272383971329
dzIQ990,2017-06-09 15:02,0,0,"Brgy. Banggolo sa Marawi, namamaho na dahil sa mga bangkay ulat ni @ chonayu1","(['Makati City'], Location((14.5591272, 121.0202094, 0.0)))",@,,873072856837480449,https://twitter.com/dzIQ990/status/873072856837480449
krlivnm,2017-06-09 15:01,0,2,para nakong nasa marawi samen,,,,873072492469866496,https://twitter.com/krlivnm/status/873072492469866496
ndeicm,2017-06-09 15:00,0,0,"HAHAHAHAHAHAHA good for her. Ka hadlok ra adtog marawi, delikado kaayo iyang sitwasyon ba","(['life'], Location((35.6145156, -88.4786605, 0.0)))",,,873072377935953921,https://twitter.com/ndeicm/status/873072377935953921
AdamsJeddah,2017-06-09 15:00,0,0,القلب واحد,,,,873072363880857601,https://twitter.com/AdamsJeddah/status/873072363880857601
gmanewsfacebook,2017-06-09 15:00,0,0,"Nasabat sa bahay ng dating alkalde ng Marawi City ang ilang matataas na kalibre ng baril, bala at sachet ng shabu. http://fb.me/1dZ619Egc",,,,873072183198613505,https://twitter.com/gmanewsfacebook/status/873072183198613505
mheKittyMeow,2017-06-09 14:59,3,3,ang kauna unahang artista na pumunta at tumulong sa Marawi Mindanao.. Ang nag iisang Darna na si Angel Locsin @ 143redangel your my angel https://twitter.com/ABSCBNNews/status/873030645416460288 …,"(['Philippines'], Location((12.7503486, 122.7312101, 0.0)))",@,,873071990864609281,https://twitter.com/mheKittyMeow/status/873071990864609281
DZMMTeleRadyo,2017-06-09 14:57,3,3,"14-anyos na batang lalaki, patay matapos mabaril ng Maute sniper sa Marawi City | via @ dzmmPatrol44pic.twitter.com/hMgVLIYUFG","(['ABS-CBN', ' Diliman', ' Quezon City'], Location((11.5874907, 122.7520466, 0.0)))",@,,873071570066915329,https://twitter.com/DZMMTeleRadyo/status/873071570066915329
Nemezida67,2017-06-09 14:56,0,0,Philippines: Dozens of weapons found in vehicle at Marawi checkpoint https://youtu.be/oLul7xTibss  с помощью @ YouTube,,@,,873071365158445056,https://twitter.com/Nemezida67/status/873071365158445056
Rufs_ML,2017-06-09 14:56,7,2,"Iba talaga si Angel Locsin, nasa Marawi na, iba din, # MMKPoserBUKASNA","(['Republic of the Philippines'], Location((12.7503486, 122.7312101, 0.0)))",,#,873071263790399491,https://twitter.com/Rufs_ML/status/873071263790399491
PHFederalismo,2017-06-09 14:55,0,0,"BREAKING NEWS JUNE 9, 2017 | DATING MAYOR NG MARAWI, ARESTADO DAHIL SA PAKIKIPAGSABWATAN SA MAUTE http://youtu.be/x3GA1qwBXY4?a","(['Republic of the Philippines'], Location((12.7503486, 122.7312101, 0.0)))",,,873071000497209344,https://twitter.com/PHFederalismo/status/873071000497209344
dzmmPatrol44,2017-06-09 14:55,0,0,"14 anyos na batang lalake, patay matapos tamaan ng bala galing sa snipper ng maute sa marawi city pic.twitter.com/5Dtg1QHfCA",,,,873070978212876289,https://twitter.com/dzmmPatrol44/status/873070978212876289
AlertesInfos,2017-06-09 14:55,212,30,SUIVI - Les affiliés à l'EI détiennent plusieurs milliers d'otages dont près de 100 catholiques qui ont été enfermés ds une église. # Marawi,,,#,873070957899915264,https://twitter.com/AlertesInfos/status/873070957899915264
realraymundsee,2017-06-09 14:54,0,0,"Kung hindi martial law ang solusyon sa krisis sa Marawi, ano? # PrayForMarawi","(['Republic of the Philippines'], Location((12.7503486, 122.7312101, 0.0)))",,#,873070756732616704,https://twitter.com/realraymundsee/status/873070756732616704
rmnnetworks,2017-06-09 14:51,0,0,"# LatestNews Liberation of Marawi, target sa Araw ng Kasarinlan http://fb.me/12QzPPVNX",,,#,873070011237060609,https://twitter.com/rmnnetworks/status/873070011237060609
realraymundsee,2017-06-09 14:51,0,1,Imbes na suportahan na lang natin ang ating presidente @ RRD_Davao eh dumadagdag pa kayo sa sakit ng ulo. # MarawiUpdates # PrayForMarawi,"(['Republic of the Philippines'], Location((12.7503486, 122.7312101, 0.0)))",@,# #,873069942672809984,https://twitter.com/realraymundsee/status/873069942672809984
papaly87,2017-06-09 14:50,0,0,Tuara... miabot na si DARNA sa Marawi... Tago namo mga Maute!!! http://fb.me/9iqZva7AH,"(['clarin misamis occidental'], Location((8.1998924, 123.8616135, 0.0)))",,,873069840319119361,https://twitter.com/papaly87/status/873069840319119361
ShonSiasol,2017-06-09 14:49,0,1,Sarap ipadala si riza hontiveros sa marawi at ipapain sa mga maute! # MarawiUpdates,"(['Roxas City', ' Western Visayas'], Location((11.62493885, 122.739520941, 0.0)))",,#,873069495606059009,https://twitter.com/ShonSiasol/status/873069495606059009
andreasales_,2017-06-09 14:48,0,1,ANG SAKIT NITO SOBRA # PrayForMarawi pic.twitter.com/SP1i3oOEnh,,,#,873069218089943040,https://twitter.com/andreasales_/status/873069218089943040
PrncessGarcia_,2017-06-09 14:47,1,71,So andito kami sa lamay ng isa sa mga sundalo na namatay sa Marawi and its so heartbreaking kasi yung anak niyang dalawa ang liliit pa,"(['Fort Bonifacio', ' Taguig City'], Location((14.5492496, 121.0506413, 0.0)))",,,873069115400830976,https://twitter.com/PrncessGarcia_/status/873069115400830976
itsyahbtxh,2017-06-09 14:46,0,0,DAMING TOXIC SA LIPUNAN NGAYON. SARAP IPATAPON SA MARAWI,,,,873068828913057792,https://twitter.com/itsyahbtxh/status/873068828913057792
jmg_marl,2017-06-09 14:45,0,2,nakakaiyak yung mga kwento ng mga sundalo sa Marawi.,,,,873068539149602820,https://twitter.com/jmg_marl/status/873068539149602820
jirahLamion,2017-06-09 14:44,0,0,Unsa ni papansin kay ka @ risahontiveros ?? Totoo to?? Nakakainis po talaga! Sana wala kang pamilya sa # marawi! pic.twitter.com/GV462vsM5A,,@,#,873068369267666944,https://twitter.com/jirahLamion/status/873068369267666944
clickafternoon,2017-06-09 14:43,0,0,Mga bakwit gikan marawi malipayong gidawat ang tabang gikan sa kapitolyo. Ubos sa liderato ni Gov. Dodo Cagas.,"(['Digos City', ' Philippines'], Location((14.6845631, 121.0931731, 0.0)))",,,873067951963873280,https://twitter.com/clickafternoon/status/873067951963873280
missjustACE,2017-06-09 14:38,13,8,Lunukin mo na kasi ang bato DARNA at nang malupig na yang mga bad guys dyan sa Marawi! MAYWARD BENCHEveryday https://twitter.com/AnnaSmith830/status/872778120977235968 …,"(['Somewhere'], Location((48.8440437, 2.2934455, 0.0)))",,,873066849017053185,https://twitter.com/missjustACE/status/873066849017053185
majoycadiz,2017-06-09 14:36,0,0,Papadala ko sa marawi lechee siyaa hahahahaha,"(['bernardo-padilla'], Location((10.9988764, -71.6049517, 0.0)))",,,873066178897256448,https://twitter.com/majoycadiz/status/873066178897256448
PTVph,2017-06-09 14:35,3,7,"BALITA: Sen. Lacson, positibo na matatapos na ang bakbakan sa Marawi City https://www.youtube.com/watch?v=mJi64mo3YJc …","(['Philippines'], Location((12.7503486, 122.7312101, 0.0)))",,,873065876521721856,https://twitter.com/PTVph/status/873065876521721856
oohroms,2017-06-09 14:31,0,0,Ipadala sa Marawi!!!! http://fb.me/1t7h8NceR,"(['Macau'], Location((22.1741907, 113.5515429, 0.0)))",,,873064990642655232,https://twitter.com/oohroms/status/873064990642655232
senopati_id,2017-06-09 14:31,245,174,"Cegah ISIS dari Marawi, TNI Tambah Pasukan ke Area Maluku Utara. NKRI adalah kita # JumatBerkah @ jokowi @ wiranto1947 @ PolhukamRI @ KSPgoid","(['Indonesia'], Location((-4.7993356, 114.5632032, 0.0)))",@ @ @ @,#,873064883171893250,https://twitter.com/senopati_id/status/873064883171893250
AceLingat,2017-06-09 14:29,0,1,Ang Vovo ni Risa Hontiveros! Kahit grade school alam ang issue sa Marawi! Bopols LP PEEPS!,"(['Pilipinas'], Location((12.7503486, 122.7312101, 0.0)))",,,873064535694778373,https://twitter.com/AceLingat/status/873064535694778373
ErnestoJoaquin9,2017-06-09 14:28,1,3,"Kaya pala dumadagsa sa Marawi mga dilawan, dahil sa droga at sa mahilig ng Mauten!",,,,873064175303405572,https://twitter.com/ErnestoJoaquin9/status/873064175303405572
DracolangGud,2017-06-09 14:28,0,0,Ayan @ risahontiveros so ano antayin mo pa na lahat ng tao sa marawi at iligan at lanao pinatay na lahat ng Maute bago ka mag martial law ? https://twitter.com/sandraguinaldo/status/873062092575653889 …,,@,,873064161315479562,https://twitter.com/DracolangGud/status/873064161315479562
babejoy01,2017-06-09 14:28,0,1,Hahaha hayop bat di ka pa sumugod sa Marawi,"(['Gotham City'], Location((32.7579739, -97.0669292, 0.0)))",,,873064113269690370,https://twitter.com/babejoy01/status/873064113269690370
Harperblammo,2017-06-09 14:27,1,3,"Mag pa edit na lang ng image kay uson, kunyari na sa Marawi sya. https://twitter.com/EmilioDJacinto/status/873062524035387392 …",,,,873064075038646273,https://twitter.com/Harperblammo/status/873064075038646273
Sam_Mielleeeeee,2017-06-09 14:27,0,0,kasi naman sa marawi eh :(,,,,873064057594458112,https://twitter.com/Sam_Mielleeeeee/status/873064057594458112
Radyo_Agila1062,2017-06-09 14:26,0,0,Liberation ng Marawi City itinakda ng militar sa June 12 - http://bit.ly/2rSstLH pic.twitter.com/6O5DJRsfx7,,,,873063848579702784,https://twitter.com/Radyo_Agila1062/status/873063848579702784
dzbb,2017-06-09 14:26,0,1,Iniimbestigahan na ang isang pulis na nagpumilit pumasok na walang koordinasyon sa AFP at pulis sa Marawi City ayon kay Col Herrera.,"(['Republic of the Philippines'], Location((12.7503486, 122.7312101, 0.0)))",,,873063733156749312,https://twitter.com/dzbb/status/873063733156749312
PTVph,2017-06-09 14:25,1,2,"BALITA: BFP, nagbigay ng tulong sa mga apektado ng bakbakan sa Marawi City https://www.youtube.com/watch?v=Xvaqir4yPw4 …","(['Philippines'], Location((12.7503486, 122.7312101, 0.0)))",,,873063360220336128,https://twitter.com/PTVph/status/873063360220336128
Stephen_from_Fr,2017-06-09 14:22,0,0,"# Philippines : # Marawi, une ville où les # Chrétiens fuient par les attaques des islamistes radicaux.http://www.la-croix.com/Religion/Catholicisme/Monde/Philippines-conflit-senlise-chretiens-senfuient-2017-06-08-1200853532 …",,,# # #,873062798577631233,https://twitter.com/Stephen_from_Fr/status/873062798577631233
iamjanifapnndgn,2017-06-09 14:21,0,2,"Habang showing ang wonder woman sa mga sinehan, si Angel nman ang kasa kasma ng mga rescue team at volunteer para sa mga apektado sa Marawi. pic.twitter.com/F6Q2RBVsf8","(['National Capital Region', ' Repub'], Location((14.5736108, 121.0329706, 0.0)))",,,873062351934603267,https://twitter.com/iamjanifapnndgn/status/873062351934603267
zearrah,2017-06-09 14:20,0,0,"TINGNAN: Angel Locsin, bumisita sa mga 'bakwit' mula Marawi:http://news.abs-cbn.com/entertainment/06/09/17/tingnan-angel-locsin-bumisita-sa-mga-bakwit-mula-marawi … via @ ABSCBNNews","(['Philippines'], Location((12.7503486, 122.7312101, 0.0)))",@,,873062105124962306,https://twitter.com/zearrah/status/873062105124962306
banderainquirer,2017-06-09 14:19,0,0,Listahan ng mahigit 300 sangkot sa paglusob sa Marawi ipinalabas https://shar.es/1R90Sm  via @ banderainquirer,"(['Makati City', ' Philippines'], Location((14.5591272, 121.0202094, 0.0)))",@,,873062063752347652,https://twitter.com/banderainquirer/status/873062063752347652
media_riau,2017-06-09 14:17,0,0,Panglima TNI: Jangan Sampai Teror Marawi Ada di Indonesia - https://mediariau.com/panglima-tni-jangan-sampai-teror-marawi-ada-di-indonesia/ …pic.twitter.com/F6WE7NutmD,,,,873061532745072640,https://twitter.com/media_riau/status/873061532745072640
PresPoliticsPh,2017-06-09 14:17,1,1,COMMANDER BRAVO NG M I L F NAGSALITA NA TUNGKOL SA PINAGAGAWA NG MAUTE GROUP SA MARAWI CITY!: http://youtu.be/QSOMiVTxLMs?a  via @ YouTube,"(['Davao Region'], Location((7.0645241, 125.6084143, 0.0)))",@,,873061508191666178,https://twitter.com/PresPoliticsPh/status/873061508191666178
enajharas71,2017-06-09 14:17,0,1,"Mga salot SA lipunan,doon kaayo SA marawi daming problema sa bansa pasaway pa kayo",,,,873061470547787776,https://twitter.com/enajharas71/status/873061470547787776
ShamilB29,2017-06-09 14:16,0,0,",,kejadian marawi.. Jauhkan bala ya Allah..",,,,873061199352545280,https://twitter.com/ShamilB29/status/873061199352545280
pree_dam,2017-06-09 14:15,0,0,"Tuwang-tuwa ang @ RRD_Davao regime, malaki na ang kanilang pagkakakitaan sa imprastruktura sa Marawi! https://twitter.com/prwc_info/status/872636594867646465 …","(['The Netherlands'], Location((36.2992331, -89.751194, 0.0)))",@,,873060941457350658,https://twitter.com/pree_dam/status/873060941457350658
JaimeHHHHH,2017-06-09 14:12,0,0,Sa mga nagbabasa. Read: M-A-L-A-W-I. Hindi Marawi.,"(['Republic of the Philippines'], Location((12.7503486, 122.7312101, 0.0)))",,,873060299246456833,https://twitter.com/JaimeHHHHH/status/873060299246456833
RishlynS,2017-06-09 14:12,2,2,Yung matatapang lagi may kaaway ipadala nyo nga sila sa marawi para mapatunayan kung gaano sila katapang,"(['Taguig City', ' National Capital'], Location((14.5266254, 121.074403, 0.0)))",,,873060234574520324,https://twitter.com/RishlynS/status/873060234574520324
UriahPancho,2017-06-09 14:12,0,0,Me: ...May kaibigan kasi akong nagcrossregister galing UP Mindanao. Kuya: Ay! Galing Marawi pa daw o! *tawa*,,,,873060222876524544,https://twitter.com/UriahPancho/status/873060222876524544
96fmmercury,2017-06-09 14:09,0,0,Panglima TNI Jangan Sampai Teror Marawi Ada di Indonesia http://nasional.news.viva.co.id/news/read/924399-panglima-tni-jangan-sampai-teror-marawi-ada-di-indonesia … lewat @ VIVAcoid,"(['Kota Surabaya', ' East Java'], Location((3.9696002, 108.1756093, 0.0)))",@,,873059395248070656,https://twitter.com/96fmmercury/status/873059395248070656
Anime2r1,2017-06-09 14:07,0,0,kita dri bc kau cge post ug gugma'2x atong magiting nga sundalo ngadto sa marawi ga cge na ug gyera. nya asa mang hustisya? Lol!!,,,,873058928212430853,https://twitter.com/Anime2r1/status/873058928212430853
elnellastan,2017-06-09 14:05,10,15,kumusta naman ang ibang artista diyan si angel locsin lang ba ang may plano tumulong sa marawi HA,"(['finesse'], Location((50.7748407, 7.2839859, 0.0)))",,,873058373557563393,https://twitter.com/elnellastan/status/873058373557563393
anh__nah,2017-06-09 14:04,0,0,Karon pa ko kabalo nga naa diay tunnel sa Marawi na gbuhat pa in '70s. Wala lagi ni gilecture sa History 3?,,,,873058178191155200,https://twitter.com/anh__nah/status/873058178191155200
VIVAcoid,2017-06-09 14:04,13,23,Panglima TNI: Jangan Sampai Teror Marawi Ada di Indonesia http://dlvr.it/PKwMLx,"(['Jakarta', ' Indonesia'], Location((-6.1753942, 106.827183, 0.0)))",,,873058128341876738,https://twitter.com/VIVAcoid/status/873058128341876738
MMheann,2017-06-09 14:01,0,0,"Daniel: so hindi sila taga-marawi? Risa: Yes Daniel: pumasok sila Risa: yes Daniel: may armas sila, na parang... http://fb.me/wQ7DeIls","(['\xe2\x98\x86\xe3\x83\x9f\xe3\x80\x80\xe2\x98\x86\xe5\xbd\xa1'], Location((45.5530613, 131.8816151, 0.0)))",,,873057320422350849,https://twitter.com/MMheann/status/873057320422350849
cutecams,2017-06-09 14:01,0,0,Napag hahalataan mg dilawan na to. Kayo siguro nasa likod ng kaguluhan sa marawi. # yellowtards http://fb.me/1WfRzE6MS,"(['Manila'], Location((14.5906216, 120.9799696, 0.0)))",,#,873057320288137216,https://twitter.com/cutecams/status/873057320288137216
dzbb,2017-06-09 14:00,0,1,Adiong: nagdecrease na rin ang figure natin (ng mga narerescue na civilians sa ilang lugar sa Marawi City),"(['Republic of the Philippines'], Location((12.7503486, 122.7312101, 0.0)))",,,873057273559392256,https://twitter.com/dzbb/status/873057273559392256
Opalum_Journey,2017-06-09 14:00,0,0,Hinahamon ko ang mga kontra kay Hontiveros sa talakayan. Bakit ka o kayo naniniwala na ang Marawi siege ay... http://fb.me/7JRmsHUcS,,,,873057214528856064,https://twitter.com/Opalum_Journey/status/873057214528856064
DZMMTeleRadyo,2017-06-09 14:00,11,18,"TINGNAN: Angel Locsin, bumisita sa mga 'bakwit' mula Marawi http://bit.ly/2s1QuSD pic.twitter.com/oRTQVRFhnB","(['ABS-CBN', ' Diliman', ' Quezon City'], Location((11.5874907, 122.7520466, 0.0)))",,,873057071197036544,https://twitter.com/DZMMTeleRadyo/status/873057071197036544
karlpabyyy,2017-06-09 13:59,0,1,"mga meme ng mga walang magandang plano sa buhay masyadong matatapang mag post ng meme eh, edi sila pagerahin sa marawi. matatapang eh","(['black out fitness'], Location((43.5954882, 3.8662552, 0.0)))",,,873057054184816641,https://twitter.com/karlpabyyy/status/873057054184816641
RoxasErasga,2017-06-09 13:59,0,0,Salamat ate Angel sa pagtulong mo sa mga kababayan natin sa Marawi! http://fb.me/1Ycg3UkDB,"(['Philippines'], Location((12.7503486, 122.7312101, 0.0)))",,,873056908176793601,https://twitter.com/RoxasErasga/status/873056908176793601
PinoyTeleserye1,2017-06-09 13:56,0,0,"Watch: Bandila: Mga mambabatas, binuweltahan si Aguirre sa pagdawit sa kanila sa Marawi siege https://www.pinoyteleseryerewind.com/bandila-mga-mambabatas-binuweltahan-si-aguirre-sa-pagdawit-sa-kanila-sa-marawi-siege/ …pic.twitter.com/e91zp9HL4R",,,,873056301051371520,https://twitter.com/PinoyTeleserye1/status/873056301051371520
DarkCharlotte_,2017-06-09 13:56,0,1,Si Jessie Mendiola kaya kelan pupunta ng Marawi? Hmm http://fb.me/vh0AXufx,"(['Legazpi City', ' Bicol Region', ' PH'], Location((13.1516322, 123.7520096, 0.0)))",,,873056076949626883,https://twitter.com/DarkCharlotte_/status/873056076949626883
sycipft,2017-06-09 13:54,0,0,BREAKING: Ama Ng Maute Brothers Nagsalita Na Sa Kanilang Tunay Na Pakay Sa Marawi City http://www.ddsnewstrend.com/2017/06/breaking-ama-ng-maute-brothers.html#.WTo4JLaeILg.twitter …,,,#,873055772564791297,https://twitter.com/sycipft/status/873055772564791297
lowkeyrnz,2017-06-09 13:51,0,0,mga nag enroll kanina puro taga marawi,"(['manila', ' PH'], Location((14.5906216, 120.9799696, 0.0)))",,,873054802770411524,https://twitter.com/lowkeyrnz/status/873054802770411524
NewsRmn,2017-06-09 13:50,0,0,"Bilang ng mga nagkakasakit na “bakwit” sa patuloy na bakbakan sa Marawi City, patuloy sa pagtaas https://rmn.ph/bilang-ng-mga-nagkakasakit-na-bakwit-sa-patuloy-na-bakbakan-sa-marawi-city-patuloy-sa-pagtaas/ … via @ rmnnetworks","(['Republic of the Philippines'], Location((12.7503486, 122.7312101, 0.0)))",@,,873054790283952128,https://twitter.com/NewsRmn/status/873054790283952128
DZMMTeleFeed,2017-06-09 13:50,0,0,"Rehabilitasyon sa Marawi City, pinaplano na ng DND",,,,873054551678603264,https://twitter.com/DZMMTeleFeed/status/873054551678603264
LeriaWorkman,2017-06-09 13:47,0,0,Grabi ginawa ne Du30 sa Marawi para a ghost town saan kaya siya kukuha mga pera para itayo ulit mga bahay ng mga tao sa Marawi so idiot Pres,,,,873053847408697344,https://twitter.com/LeriaWorkman/status/873053847408697344
pabingsanchez,2017-06-09 13:46,0,1,Big deal sayo public apology? Wait mo lang ebidensya kung kelan ka talaga nagpunta ng marawi bambina.,,,,873053593288400896,https://twitter.com/pabingsanchez/status/873053593288400896
halfbaaad,2017-06-09 13:45,0,1,COC a myasuwa a Marawi Subhanallāh https://twitter.com/heynairing/status/872924748409323521 …,"(['PH'], Location((12.44249325, 122.160395164, 0.0)))",,,873053420311138305,https://twitter.com/halfbaaad/status/873053420311138305
pondokindahinfo,2017-06-09 13:44,0,0,# News: Aman Abdurrahman Diduga Perintahkan Kombatan WNI ke Marawi http://ift.tt/2skTLgk  | http://Tempo.co,"(['Pondok Indah', ' Jakarta Selatan'], Location((-6.2915605, 106.7838466, 0.0)))",,#,873053183039250434,https://twitter.com/pondokindahinfo/status/873053183039250434
puisina,2017-06-09 13:43,0,0,http://goo.gl/G3voB6  Aman Abdurrahman Diduga Perintahkan Kombatan WNI ke Marawi,,,,873052794701336577,https://twitter.com/puisina/status/873052794701336577
Radyo_Agila1062,2017-06-09 13:42,0,1,Sec. Aguirre nagmistulang clown sa pagbawi ng alegasyon na nagdadawit sa oposisyon sa Marawi siege - Sen. de Lima - http://bit.ly/2rSmXbX pic.twitter.com/oCiq9HfHk6,,,,873052774342082561,https://twitter.com/Radyo_Agila1062/status/873052774342082561
