auskoe80,2017-06-13 23:59,0,1,Proyek ISIS dan Krisis di Marawi lewat the_geotimes,,@,,874657570140569600,https://twitter.com/auskoe80/status/874657570140569600,id
ivanpards,2017-06-13 23:58,0,0,"HOY HINDI MO KAYA AKO INAYA HAHAHA No, her roomie's coordinating an effort to donate to our troops in Marawi",,,,874657197921230848,https://twitter.com/ivanpards/status/874657197921230848,fil
pongelesis,2017-06-13 23:57,0,0,Sana naman maintindihan ng nakakarami na mas priority ng pangulo ang sitwasyon sa marawi para mapanatili ang kalayaan nito mula sa terrorist,,,,874657059660210176,https://twitter.com/pongelesis/status/874657059660210176,fil
JxssxcxMxnxs,2017-06-13 23:56,0,1,ihagis kita pabalik ng Marawi :)),,,,874656774044786689,https://twitter.com/JxssxcxMxnxs/status/874656774044786689,fil
dolletkarylle,2017-06-13 23:56,0,0,Yung mga sundalo namatay sa Marawi,,,,874656640129155072,https://twitter.com/dolletkarylle/status/874656640129155072,fil
jamaesb_,2017-06-13 23:55,0,0,Si patchot lang hindi. Baka maubos bigas ng Pilipinas pano na mga taga Marawi.,,,,874656586840526850,https://twitter.com/jamaesb_/status/874656586840526850,fil
pressegauche,2017-06-13 23:52,0,0,Marawi (Mindanao) : état de guerre et loi martiale dans le Sud philippin,"(['Qu\xc3\xa9bec'], Location((52.4760892, -71.8258668, 0.0)))",,,874655789419552768,https://twitter.com/pressegauche/status/874655789419552768,fr
mcdalejado,2017-06-13 23:52,0,1,Onga eh. Sten sa ttoong buhay si God lng mkkpg sabi Kung ttoo sana si grim reaper at Goblin sgro yung mission nila nsa marawi,"(['Las Pinas City', ' National Capit'], Location((-1.0917672, -80.8977939, 0.0)))",,,874655637950550016,https://twitter.com/mcdalejado/status/874655637950550016,fil
Riz2817,2017-06-13 23:47,0,0,Mabuti p!Lahat ng kontra s martial law s mindanao!Kau pumunta s marawi kau n din tumapos ng gulo dun!palitan nyo...,"(['Quezon city'], Location((14.6509905, 121.0486155, 0.0)))",,,874654439784591360,https://twitter.com/Riz2817/status/874654439784591360,fil
demorgen,2017-06-13 23:47,2,1,Niemand kon ooit Marawi veroveren. Hoe is een handjevol IS-jongeren daar dan toch in geslaagd? (+),"(['Brussel'], Location((50.8465573, 4.351697, 0.0)))",,,874654397359370240,https://twitter.com/demorgen/status/874654397359370240,nl
PinoyTeleserye1,2017-06-13 23:45,0,0,"Watch: QRT: Labi ng ilang sundalong namatay sa bakbakan sa Marawi, naiuwi na sa kani-kanilang pamilya u",,,,874654026062635008,https://twitter.com/PinoyTeleserye1/status/874654026062635008,fil
BomboRadyoNews,2017-06-13 23:43,0,0,"Pagtulong ng Chinese at Russian troops sa Marawi crisis, ‘di akma dahil sa language barrier- Rep. Alejano","(['Makati City'], Location((14.5591272, 121.0202094, 0.0)))",,,874653553607925761,https://twitter.com/BomboRadyoNews/status/874653553607925761,fil
epic_viral,2017-06-13 23:43,0,0,"I added a video to a YouTube playlist Taga MARAWI din pala ang protektor ng IS-MAUTE, Binalaan ni Pres.",,@,,874653403695263744,https://twitter.com/epic_viral/status/874653403695263744,fil
alysserenity,2017-06-13 23:42,0,1,Owaymba owhm. Kung matapos man ang conflict within next month na mga ilang months na naman ang recovery period sa Marawi.,,,,874653145321807873,https://twitter.com/alysserenity/status/874653145321807873,fil
aceavila_,2017-06-13 23:41,0,0,They try to change the government by the use of violence! Tapos hindi rebellion ang nangyayari sa marawi?! Ang tanga! Nainis ako!,"(['Naga City', ' Bicol Region'], Location((13.6232024, 123.1857873, 0.0)))",,,874652898340216832,https://twitter.com/aceavila_/status/874652898340216832,fil
bandila,2017-06-13 23:40,0,2,"Bentahan ng bigas sa Marawi, sumipa sa higit P200/kilo, ayon sa DTI","(['Manila', ' Philippines'], Location((14.5906216, 120.9799696, 0.0)))",,,874652658002296832,https://twitter.com/bandila/status/874652658002296832,fil
bandila,2017-06-13 23:40,0,1,"5 pulis at 5 sibilyan na naipit sa gulo sa Marawi, nakatakas","(['Manila', ' Philippines'], Location((14.5906216, 120.9799696, 0.0)))",,,874652618714370048,https://twitter.com/bandila/status/874652618714370048,fil
phildaily,2017-06-13 23:40,0,0,Batang Pinoy 2017 Mindanao leg postponed due to Marawi crisis | SunStar -,,,,874652600678973440,https://twitter.com/phildaily/status/874652600678973440,fil
suaraislamco,2017-06-13 23:39,1,1,"Kejamnya ISIS di Marawi, Selain Bunuh Warga Sipil juga Paksa Jadi Budak","(['Jakarta Capital Region'], Location((-6.1753942, 106.827183, 0.0)))",,,874652487193575427,https://twitter.com/suaraislamco/status/874652487193575427,id
epic_viral,2017-06-13 23:36,0,0,"Taga MARAWI din pala ang protektor ng IS-MAUTE, Pres.Du30 Galit sa MARANAO na sangkot: via YouTube",,@,,874651705673232384,https://twitter.com/epic_viral/status/874651705673232384,fil
83Kindy,2017-06-13 23:35,0,0,"RT RFImag: Philippines : des civils, piégés au milieu des combats dans la ville de Marawi EI. Un ReportageRFI de…","(['Barcelona', ' Spain'], Location((41.3828939, 2.1774322, 0.0)))",,# #,874651378072911873,https://twitter.com/83Kindy/status/874651378072911873,fr
dzrhnews,2017-06-13 23:35,0,0,"Mga mosque sa Marawi City na pinagku-kutaan ng mga Maute, 'bobombahin' na rin ng military RHBalitaAgad","(['Manila', ' Philippines'], Location((14.5906216, 120.9799696, 0.0)))",,#,874651324926775296,https://twitter.com/dzrhnews/status/874651324926775296,fil
SteffanyLim16,2017-06-13 23:34,0,0,Wiranto : Kami Akan Mengkordinasi Dengan Beberapa Negara Untuk Memberantas ISIS DI Marawi,"(['Jakarta Pusat', ' DKI Jakarta'], Location((-6.18233995, 106.842871536, 0.0)))",,,874651280970403840,https://twitter.com/SteffanyLim16/status/874651280970403840,id
iamallyster,2017-06-13 23:33,0,3,"Kalaki gud talaga ng problema nya! As in, nahiya ang marawi besh",,,,874650846201389059,https://twitter.com/iamallyster/status/874650846201389059,fil
bandila,2017-06-13 23:31,0,2,"Deped: Higit sa 22,000 estudyante, apektado ng gulo sa Marawi","(['Manila', ' Philippines'], Location((14.5906216, 120.9799696, 0.0)))",,,874650389064241152,https://twitter.com/bandila/status/874650389064241152,fil
itsmeeyna,2017-06-13 23:31,0,1,no need na ipunta sa marawi be. kase dito palang papatayin ko na hahahaha,"(['LU-MNL'], Location((14.5121499, 121.022046716, 0.0)))",,,874650383246778368,https://twitter.com/itsmeeyna/status/874650383246778368,fil
bandila,2017-06-13 23:31,0,1,"Ilang bata at sanggol sa evacuation centers dahil sa gulo sa Marawi, nagkakasakit na","(['Manila', ' Philippines'], Location((14.5906216, 120.9799696, 0.0)))",,,874650353232363520,https://twitter.com/bandila/status/874650353232363520,fil
wengatot,2017-06-13 23:30,0,0,Halos lahat ng soldiers na namatay sa marawi mga bata at gwapo pa.. MAUTE ma ubos na kayo..,"(['phil.'], Location((34.7482178, -79.2139264, 0.0)))",,,8.7465E+17,https://twitter.com/wengatot/status/874650182700245000,fil
icekendii,2017-06-13 23:28,0,0,"That 4yr old child na naipit sa gyera sa marawi, survives the days hearing the bombs & gun shots pati na ang gutom. PLEASE HELP HIM AND ALL.",,,,874649786120458240,https://twitter.com/icekendii/status/874649786120458240,fil
Side_View,2017-06-13 23:28,0,0,Hanggang saan tatagal ang Maute? Maute Marawi ISIS KIM MILF AbuSayyaf Duterte DU30... 8,,,# # # # # # # #,874649722568323072,https://twitter.com/Side_View/status/874649722568323072,fil
_sprondot,2017-06-13 23:27,0,2,Saludo sa mga Bayani ng Marawi. MarawiClash,,,#,874649501016891395,https://twitter.com/_sprondot/status/874649501016891395,fil
updatesmindanao,2017-06-13 23:26,0,0,Batang Pinoy 2017 Mindanao leg postponed due to Marawi crisis,,,,874649125869953024,https://twitter.com/updatesmindanao/status/874649125869953024,fil
VanSulitas,2017-06-13 23:24,0,23,"gustong-gusto ko patulan yung offer sakin na maging crew sa isang docu film shoot sa Marawi mismo, huhu pero yung parents ko for sure ayaw","(['UP Diliman'], Location((14.6495832, 121.05965, 0.0)))",,,874648619789320192,https://twitter.com/VanSulitas/status/874648619789320192,fil
BomboRadyoNews,2017-06-13 23:23,0,0,"Bangkay ng sundalong pinakahuling namatay sa Marawi siege, naiuwi na sa kanyang pamilya","(['Makati City'], Location((14.5591272, 121.0202094, 0.0)))",,,874648538512216066,https://twitter.com/BomboRadyoNews/status/874648538512216066,fil
Prncsspdlls,2017-06-13 23:23,0,0,anlaki ng problema niyo kay kath no? nahiya yung problema sa Marawi,,,,874648404965548032,https://twitter.com/Prncsspdlls/status/874648404965548032,fil
grechecheeeeel,2017-06-13 23:20,0,0,Sana matapos na ang gulo sa Marawi. Haaaays.,"(['Dasmarinas', ' Calabarzon'], Location((14.6455597, 120.9995684, 0.0)))",,,874647649462308869,https://twitter.com/grechecheeeeel/status/874647649462308869,fil
RMontajes15,2017-06-13 23:20,0,0,ni hindi nga cya naka visit pa sa Marawi mismo eh,"(['Philippines'], Location((12.7503486, 122.7312101, 0.0)))",,,874647617082347521,https://twitter.com/RMontajes15/status/874647617082347521,fil
stateofdnation,2017-06-13 23:20,0,0,"VIDEO: SolGen, iginiit na isinumite niyang komento na rebelyon ang nangyayari sa Marawi","(['Manila', ' Philippines'], Location((14.5906216, 120.9799696, 0.0)))",,,874647584593158148,https://twitter.com/stateofdnation/status/874647584593158148,fil
saksi,2017-06-13 23:19,0,0,"Bago pa sumiklab ang gulo sa Marawi, may impormasyon na raw tungkol dito ang ating gobyerno.","(['Philippines'], Location((12.7503486, 122.7312101, 0.0)))",,,874647528486064130,https://twitter.com/saksi/status/874647528486064130,fil
khrstncl,2017-06-13 23:19,0,1,taena sarap ipatapon sa marawi si brix,,,,874647525562605568,https://twitter.com/khrstncl/status/874647525562605568,fil
toypo2,2017-06-13 23:18,2,4,Nung c idol duterte kumalas sa america panay ang batikos ng dilawan ngaun nmn tumutulong ang america sa marawi batikos p rin anu b tlga Lp?,"(['Saudi Arabia Dammam'], Location((26.0915378, 45.2078808, 0.0)))",,,874647286520967168,https://twitter.com/toypo2/status/874647286520967168,fil
ariesdaleaguila,2017-06-13 23:18,0,0,"Kamakailan lang sinasakop pa ang Marawi.. Ngayon, narekober na ng militar at gobyerno uli ang Marawi sa awa't...","(['Earth'], Location((34.2331373, -102.4107493, 0.0)))",,,874647107512090624,https://twitter.com/ariesdaleaguila/status/874647107512090624,fil
RFImag,2017-06-13 23:17,9,5,"Philippines : des civils, piégés au milieu des combats dans la ville de Marawi EI. Un ReportageRFI de mdardard à écouter demain","(['Paris', ' France'], Location((48.8566101, 2.3514992, 0.0)))",@ @ @,# #,874647002742763525,https://twitter.com/RFImag/status/874647002742763525,fr
keightdelacruz,2017-06-13 23:16,0,0,PrayForMarawi,"(['PH'], Location((12.44249325, 122.160395164, 0.0)))",,#,874646688878673921,https://twitter.com/keightdelacruz/status/874646688878673921,pl
mediagarudacoid,2017-06-13 23:16,0,0,Indonesia Ajak 5 Negara Hadapi ISIS di Marawi,"(['Kota Bandung', ' Jawa Barat'], Location((0.2988473, 99.5962186, 0.0)))",,,874646657228517376,https://twitter.com/mediagarudacoid/status/874646657228517376,id
JerriAC,2017-06-13 23:15,0,0,"Mindanao conflict has always been a cat-and-mouse game."" Marawi is the latest locale. Hindi ako masasanay, kahit... """,,,,874646315069788160,https://twitter.com/JerriAC/status/874646315069788160,fil
tr1pnautic,2017-06-13 23:14,0,4,Balikan din natin yung sinabi ng poon mo na hinamon ang Maute na sunugin ang Marawi? Eh di ginawa nga. Ngayon maraming namatay na sundalo.,,,,874646201835991040,https://twitter.com/tr1pnautic/status/874646201835991040,fil
ianjabon,2017-06-13 23:11,0,0,"Ok, padala na naten ito sa marawi, now na!","(['Cavite Phils'], Location((14.29092, 120.931003633, 0.0)))",,,874645334235922432,https://twitter.com/ianjabon/status/874645334235922432,fil
Cesscerda,2017-06-13 23:10,0,0,Ang batang pinulot sa marawi,,,,874645096607531010,https://twitter.com/Cesscerda/status/874645096607531010,fil
lookformae,2017-06-13 23:09,0,0,"sana matigil na ang nagaganap na gulo sa Marawi. ang dami nang inosente taong nadadamay, pero pinaka-kawawa parin ang mga sundalo..",,,,874644832609632256,https://twitter.com/lookformae/status/874644832609632256,fil
ianjabon,2017-06-13 23:09,1,0,"Pwede ba padala na nten sya sa marawi, asap pls, ng matapos na ito!","(['Cavite Phils'], Location((14.29092, 120.931003633, 0.0)))",,,874644826381144066,https://twitter.com/ianjabon/status/874644826381144066,fil
prcsthea,2017-06-13 23:07,0,0,Sa Marawi na ako mag-aaral kasi matagal pa pasok.,"(['New World', ' Grand Line'], Location((-43.53892745, 172.632625857, 0.0)))",,,874644327493808128,https://twitter.com/prcsthea/status/874644327493808128,fil
atjehcyber,2017-06-13 23:06,2,1,Militer Filipina Kesulitan Merebut Marawi dari Militan Pro-ISIS,"(['Banda Aceh'], Location((5.56318155, 95.3221454617, 0.0)))",,,874644107884351489,https://twitter.com/atjehcyber/status/874644107884351489,id
unomagnifico,2017-06-13 23:05,1,2,Parang nabawasan ang ejks eversince Marawi happened?,"(['Pearl of the Orient'], Location((50.8474666, -1.0308452, 0.0)))",,,874643948408414209,https://twitter.com/unomagnifico/status/874643948408414209,fil
SurYosodipuro_,2017-06-13 23:05,2,1,Ya Allah...Ya Rabby...lindungilah saudara/i kami para mujahid dari Raqqa smpai Marawi dan kaum muslimin yg istiqhamah dalam jihad,"(['Indonesia'], Location((-4.7993356, 114.5632032, 0.0)))",,,874643816262770690,https://twitter.com/SurYosodipuro_/status/874643816262770690,ms
MoxieLi,2017-06-13 23:04,7,18,"Ayy bakit nung tulog din siya nung June 12, 2016, may Marawi din?? May patay din?? Wala naman eh. Hes tamad. Period",,,,874643744959610882,https://twitter.com/MoxieLi/status/874643744959610882,fil
MoxieLi,2017-06-13 23:03,1,7,"Wala naman inattendan na problem in Marawi, si Cayetano mismo nagsabi natutulog. Huwag ka na magpalusot. Buko na e",,,,874643423059247104,https://twitter.com/MoxieLi/status/874643423059247104,fil
VxvEeee,2017-06-13 23:02,0,5,Tumal naman sa bulusan parang marawi walang tao putek,"(['Calumpit Bulacan'], Location((14.9151619, 120.7636605, 0.0)))",,,874643144712663040,https://twitter.com/VxvEeee/status/874643144712663040,fil
pinoynewsonline,2017-06-13 23:02,0,0,"BP: Pres. Duterte, nagdeklara ng Martial Law sa Mindanao bunsod ng kaguluhan sa Marawi More info:...","(['Republic of the Philippines'], Location((12.7503486, 122.7312101, 0.0)))",,,874643125901373440,https://twitter.com/pinoynewsonline/status/874643125901373440,fil
cameraman_4,2017-06-13 23:01,0,0,"ドローンで空撮、市街戦による破壊の跡 フィリピン南部　Aerial images show explosions, destruction in Marawi AFPBB News",,,,874642889497640960,https://twitter.com/cameraman_4/status/874642889497640960,ja
bientawing,2017-06-13 23:00,0,4,Padala na po natin si Kuya Cardo sa Marawi. PLEEEEEEASE,,,,874642591685292035,https://twitter.com/bientawing/status/874642591685292035,fil
Iqbal__Kholidi,2017-06-13 23:00,106,38,video menampilkan serangan udara di pertempuran Marawi City.,"(['Indonesia - Saudi Arabia'], Location((21.486356, 39.183278003, 0.0)))",,,874642585469440001,https://twitter.com/Iqbal__Kholidi/status/874642585469440001,id
habertakip,2017-06-13 23:00,0,0,Filipinler'de IŞİD üç haftalık kuşatmada Marawi kasabasının yüzde 20'sini aldı,"(['Turkey'], Location((38.9597594, 34.9249653, 0.0)))",,,874642532478701570,https://twitter.com/habertakip/status/874642532478701570,tr
TVPatrol,2017-06-13 23:00,3,9,PANOORIN: Pagdating ng Maute sa Marawi MarawiClash 9,"(['Philippines'], Location((12.7503486, 122.7312101, 0.0)))",,#,874642531308363776,https://twitter.com/TVPatrol/status/874642531308363776,fil
WattatempuraPIO,2017-06-13 22:59,0,0,Hahahaha yatia sa mga video sa marawi fight erp,"(['Enchanted Forest'], Location((34.8717841, -82.4620688, 0.0)))",,,874642456356073473,https://twitter.com/WattatempuraPIO/status/874642456356073473,fil
MoxieLi,2017-06-13 22:57,0,1,"Take note guys for Dutertards flag-raising mean NOTHING. Sa mga taga-Marawi daw,bakit pa kayo ng flag-raising???",,,,874641890779451392,https://twitter.com/MoxieLi/status/874641890779451392,fil
jovelyn_n,2017-06-13 22:56,0,0,PANOORIN: Pagdating ng Maute sa Marawi u,,,,874641753646804993,https://twitter.com/jovelyn_n/status/874641753646804993,fil
Senyona,2017-06-13 22:56,14,45,"these ppl already forgot what just happened to marawi and to resorts world because of kathryn, tuwang tuwa pa habang nangbabash mga olol",,,,874641668732895236,https://twitter.com/Senyona/status/874641668732895236,fil
MoxieLi,2017-06-13 22:56,4,12,FLAG-RAISING LANG naman pala. So for Dutertards flag raising mean NOTHING. Bakit kaya tayo naiyak sa flag raising sa Marawi???,,,,874641530975272960,https://twitter.com/MoxieLi/status/874641530975272960,fil
meowmommylatte,2017-06-13 22:55,0,0,Instead of kidding y not help Filipinos in marawi? HAHAHAHAHAHA,"(['Bataan'], Location((14.666667, 120.416667, 0.0)))",,,874641282022256644,https://twitter.com/meowmommylatte/status/874641282022256644,fil
gmanewsfacebook,2017-06-13 22:55,0,0,"Alam na umano ng gobyerno ang planong pag-atake ng Maute group sa Marawi City noon pang Abril, pero giit ng...",,,,874641273671385089,https://twitter.com/gmanewsfacebook/status/874641273671385089,fil
carmen60javier,2017-06-13 22:54,0,0,Slim Possible habang nakikipaggyera mga kabaro nyo sa Marawi? Tsk tsk tsk,,,,874641228247314432,https://twitter.com/carmen60javier/status/874641228247314432,fil
toilatoi123234,2017-06-13 22:54,0,0,"Tôi đã thích video Tin Nóng: Thật Kinh hòa.ng, Hôm nay IS bắ,t 1.500 dân thường ở Marawi,","(['United States'], Location((39.7837304, -100.4458825, 0.0)))",,,874641020012687360,https://twitter.com/toilatoi123234/status/874641020012687360,vi
all__alriyadh,2017-06-13 22:53,2,4,مراوي_بوتيك MarawiBoutique أزياء عالمية مع إمكانية الشحن حول العالم 0543891070 انستقرام : سناب : MarawiBoutique,"(['\xd8\xa7\xd9\x84\xd8\xb1\xd9\x8a\xd8\xa7\xd8\xb6'], Location((24.6319692, 46.7150648, 0.0)))",@ @Marawi_Boutique,#,874640955990827009,https://twitter.com/all__alriyadh/status/874640955990827009,ar
dexterbayhon,2017-06-13 22:53,0,0,SARAP IPADALA SA MARAWI TONG KATULONG NATO,"(['Quezon City'], Location((14.6509905, 121.0486155, 0.0)))",,,874640918569037825,https://twitter.com/dexterbayhon/status/874640918569037825,fil
toilatoi123234,2017-06-13 22:53,0,0,"Tin Nóng: Kinh hòa.ng Hôm nay IS bắ,t 1.500 dân thường ở Marawi, Philippines làm c,on ti,n","(['United States'], Location((39.7837304, -100.4458825, 0.0)))",,,874640781402935297,https://twitter.com/toilatoi123234/status/874640781402935297,vi
Iqbal__Kholidi,2017-06-13 22:51,39,9,Kelompok Maute beroperasi di Marawi memiliki banyak pengikut kaum muda dan mengakar di MSU (Mindanao State University),"(['Indonesia - Saudi Arabia'], Location((21.486356, 39.183278003, 0.0)))",,,874640429399941120,https://twitter.com/Iqbal__Kholidi/status/874640429399941120,id
rmnnetworks,2017-06-13 22:51,0,0,"LatestNews Papel ng Amerika sa operasyon ng AFP sa Marawi, pinaiimbestigihan",,,#,874640339402870784,https://twitter.com/rmnnetworks/status/874640339402870784,fil
rmnnetworks,2017-06-13 22:51,0,0,"LatestNews Mga plano ng Department of Agriculture para sa mga magsasakang naapektuhan ng krisis sa Marawi,...",,,#,874640299309408256,https://twitter.com/rmnnetworks/status/874640299309408256,fil
eekstin,2017-06-13 22:50,0,1,taga marawi ako ;-;,"(['bikini bottom'], Location((61.2347804, 73.4389746, 0.0)))",,,874640187552169984,https://twitter.com/eekstin/status/874640187552169984,fil
DZMMTeleFeed,2017-06-13 22:49,0,0,"Papel ng US sa Marawi, nais paimbestigahan sa Kamara",,,,874639752624046080,https://twitter.com/DZMMTeleFeed/status/874639752624046080,fil
PresPoliticsPh,2017-06-13 22:48,0,0,"I liked a YouTube video KAKAPASOK LANG NA BALITA LATEST UPDATE SA MARAWI PRES. DUTERTE NEWS JUNE 14, 2017","(['Davao Region'], Location((7.0645241, 125.6084143, 0.0)))",@,,874639516400857088,https://twitter.com/PresPoliticsPh/status/874639516400857088,fil
loidita,2017-06-13 22:47,0,2,"Those days na may mga crucial matters sa office, may semi-tampuhan pa w/ bf, conflict pa rin in Marawi then talo pa Ginebra. DefineBadWeek","(['Philippines'], Location((12.7503486, 122.7312101, 0.0)))",,#,874639375811846145,https://twitter.com/loidita/status/874639375811846145,fil
PresPoliticsPh,2017-06-13 22:45,0,0,"KAKAPASOK LANG NA BALITA LATEST UPDATE SA MARAWI PRES. DUTERTE NEWS JUNE 14, 2017: via YouTube","(['Davao Region'], Location((7.0645241, 125.6084143, 0.0)))",@,,874638978892394496,https://twitter.com/PresPoliticsPh/status/874638978892394496,fil
PresPoliticsPh,2017-06-13 22:45,0,0,I added a video to a YouTube playlist KAKAPASOK LANG NA BALITA LATEST UPDATE SA MARAWI PRES. DUTERTE NEWS,"(['Davao Region'], Location((7.0645241, 125.6084143, 0.0)))",@,,874638947217027074,https://twitter.com/PresPoliticsPh/status/874638947217027074,fil
Philtizen,2017-06-13 22:44,0,0,"Pinuri ng Islamic State ang mga jihadist"" sa Pilipinas sa pag-atake sa Marawi City. ""","(['Republic of the Philippines'], Location((12.7503486, 122.7312101, 0.0)))",,,874638506726916096,https://twitter.com/Philtizen/status/874638506726916096,fil
SiBonekaAyu,2017-06-13 22:43,2,3,"Apakah tidak ada upaya untuk melumpuhkan marawi sementara, contohnya dengan mematikan listrik dan air?","(['Turkey'], Location((38.9597594, 34.9249653, 0.0)))",,,874638448581165056,https://twitter.com/SiBonekaAyu/status/874638448581165056,id
hoheySazle,2017-06-13 22:43,0,2,Dapat diyan kay sir mangui-ob pinapadala sa marawi hahahaha jk lang Binibigyan mo na ba ng hint si crush mo na may gusto ka sa kanya?,"(['Hogwarts'], Location((-1.24139975, 36.784112734, 0.0)))",,,874638278716145664,https://twitter.com/hoheySazle/status/874638278716145664,fil
Reysizzle,2017-06-13 22:42,0,2,"Feeling ko ginabatyag ko ang gakatabo sa world subong. Marawi crisis, Qatar crisis, etc. Humanity please?","(['PAMET', ' Inc'], Location((48.1124043, 15.9135488, 0.0)))",,,874638182272258050,https://twitter.com/Reysizzle/status/874638182272258050,ceb
storyahiko,2017-06-13 22:42,0,0,Lagman: Ang Gobyerno ang nauna sa arm conflict sa marawi:madaling salita pinag tanggol ang mga Maute-,"(['Manila City'], Location((14.5906216, 120.9799696, 0.0)))",,,874638117461868544,https://twitter.com/storyahiko/status/874638117461868544,fil
iamjohnmdg24,2017-06-13 22:42,0,0,I liked a YouTube video PANOORIN: Pagdating ng Maute sa Marawi,"(['Lagonoy', ' Bicol Region'], Location((13.7378792, 123.5210819, 0.0)))",@,,874638041427693568,https://twitter.com/iamjohnmdg24/status/874638041427693568,fil
Pinkfrappe12,2017-06-13 22:41,0,1,Mas importante daw yon. Alam mo na baka ipadala sya sa marawi hindi sya makatakbo. lalo na pag binatuhan ng piccolo.,,,,874637899613872129,https://twitter.com/Pinkfrappe12/status/874637899613872129,fil
Ivan226622,2017-06-13 22:41,0,0,"Marawi City siege enters 4th week 0C — ABS-CBN News (ABSCBNNews) June 13, 2017",,,,874637849777381376,https://twitter.com/Ivan226622/status/874637849777381376,fil
MonesaSnsd,2017-06-13 22:40,0,0,Wag na sana isali na papuntahin si kuya sa bakbakan ng Marawi Hoping... **,,,,874637557434245120,https://twitter.com/MonesaSnsd/status/874637557434245120,fil
unomagnifico,2017-06-13 22:39,0,2,Inuna pa ang pagpapapayat kesa sa Marawi. Ang galeng.,"(['Pearl of the Orient'], Location((50.8474666, -1.0308452, 0.0)))",,,874637439750602752,https://twitter.com/unomagnifico/status/874637439750602752,fil
edtan5252,2017-06-13 22:39,0,0,Experience marawi etc. Mbuti pyon dti. Wow Philippines,,,,874637374277296128,https://twitter.com/edtan5252/status/874637374277296128,fil
jfvelasco24,2017-06-13 22:38,0,3,Hay! Sayang ng mga buhay ng nga sundalo na namamatay sa giyera sa Marawi. Ang bata ng iba. Gone too soon!,"(['Pasig City'], Location((9.7771753, 125.4915723, 0.0)))",,,874636980797136897,https://twitter.com/jfvelasco24/status/874636980797136897,fil
cistik_sayur,2017-06-13 22:36,0,0,beja terkini Konflik di Marawi Bisa Bergeser ke Indonesia thx 4,"(['west java.bdg'], Location((-6.8611951, 107.5953286, 0.0)))",,,874636522342891522,https://twitter.com/cistik_sayur/status/874636522342891522,id
BandungCN,2017-06-13 22:36,0,0,Konflik di Marawi Bisa Bergeser ke Indonesia,,,,874636509810274304,https://twitter.com/BandungCN/status/874636509810274304,id
penelopexcurtis,2017-06-13 22:36,0,9,Mum: Yang pinang order mo sa Zalora na bags and shoes ipabenta mo para makatulong ka sa mga tao Marawi. Me: ay iba si mother,"(['Las Islas Filipinas'], Location((-0.40244, -79.124184, 0.0)))",,,874636474720727041,https://twitter.com/penelopexcurtis/status/874636474720727041,fil
IveeenK,2017-06-13 22:35,0,0,Padala kita sa marawi,"(['uranus'], Location((60.2009107, 24.8242259, 0.0)))",,,874636256197595137,https://twitter.com/IveeenK/status/874636256197595137,fil
juliosees,2017-06-13 22:34,0,0,"New video by GMA News: SONA: Mga naulila ng mga nasawing sundalo sa Marawi, ipinagmamalaki ang mga ito...",,,,874636113335508992,https://twitter.com/juliosees/status/874636113335508992,fil
juliosees,2017-06-13 22:34,0,0,New video by GMA News: SONA: AFP: Nasa 300 hanggang 500 pa ang mga sibilyang naiipit sa gulo sa Marawi City... d,,,,874636111447904256,https://twitter.com/juliosees/status/874636111447904256,fil
juliosees,2017-06-13 22:34,0,0,"New video by GMA News: SONA: Mga naulila ng mga nasawing sundalo sa Marawi, ipinagmamalaki ang mga ito",,,,874636094045921280,https://twitter.com/juliosees/status/874636094045921280,fil
juliosees,2017-06-13 22:34,0,0,New video by GMA News: SONA: AFP: Nasa 300 hanggang 500 pa ang mga sibilyang naiipit sa gulo sa Marawi City,,,,874636088677208064,https://twitter.com/juliosees/status/874636088677208064,fil
xopasid,2017-06-13 22:33,0,0,"Selain Bunuh, Teroris ISIS di Marawi Jadikan Warga sebagai Budak -",,,,874635772577501184,https://twitter.com/xopasid/status/874635772577501184,ms
