mariadefante,2017-06-09 19:47,0,0,"haha stay lang sila sa marawi, tapos paalisin na din sila dun. Dont worry hahahaha pray lang tayo","(['Carmona', ' Calabarzon'], Location((37.4718765, -5.6410704, 0.0)))",,,873144522737307649,https://twitter.com/mariadefante/status/873144522737307649
24OrasGMA,2017-06-09 19:47,0,1,"Ilang pakete ng shabu, mga granada at rifle ang narekober sa bahay sa Cagayan de Oro City ni dating Marawi Mayor Fajad Pre"" Salic... pic.twitter.com/IVuWLbwrsr""","(['Philippines'], Location((12.7503486, 122.7312101, 0.0)))",,,873144512608034817,https://twitter.com/24OrasGMA/status/873144512608034817
lumbera14,2017-06-09 19:47,0,0,mag dadalawang linggo na ang bakbakan sa marawi,"(['Calabarzon'], Location((14.16441485, 121.353652374, 0.0)))",,,873144478256713728,https://twitter.com/lumbera14/status/873144478256713728
Persianistas,2017-06-09 19:47,0,0,GOOD NEWS! BUTI NALANG NAPIGILAN ng MILITAR! PLANO ng MAUTE sa MARAWI PUMALPAK! https://goo.gl/fb/J3Lnkt,,,,873144441925718016,https://twitter.com/Persianistas/status/873144441925718016
Fanboiiiiiiiii,2017-06-09 19:47,4,1,# MVRPagbabalik KapusoBrigade Kalayaan para sa Marawi ...,,,#,873144414566088704,https://twitter.com/Fanboiiiiiiiii/status/873144414566088704
monykafsosa,2017-06-09 19:46,0,0,GOOD NEWS! BUTI NALANG NAPIGILAN ng MILITAR! PLANO ng MAUTE sa MARAWI PUMALPAK! https://goo.gl/fb/J3Lnkt,"(['Espa\xc3\xb1a'], Location((40.0028028, -4.003104, 0.0)))",,,873144341577039872,https://twitter.com/monykafsosa/status/873144341577039872
janicake_,2017-06-09 19:46,0,1,"Hanggang ngayon di pa din okay ung Marawi, lapit na Independece Day eh. Sana makalaya na din Marawi sa araw na yon",,,,873144257233604608,https://twitter.com/janicake_/status/873144257233604608
Merylle_ellyreM,2017-06-09 19:46,0,0,marawi,,,,873144141948919809,https://twitter.com/Merylle_ellyreM/status/873144141948919809
monykafsosa,2017-06-09 19:45,0,0,GOOD NEWS! BUTI NALANG NAPIGILAN ng MILITAR! PLANO ng MAUTE sa MARAWI PUMALPAK! https://goo.gl/fb/J3Lnkt,"(['Espa\xc3\xb1a'], Location((40.0028028, -4.003104, 0.0)))",,,873144079122669568,https://twitter.com/monykafsosa/status/873144079122669568
thelotalete,2017-06-09 19:45,0,2,Kalayaan sa Marawi para sa kalayaan.,,,,873143976068390912,https://twitter.com/thelotalete/status/873143976068390912
Dosocialhub1,2017-06-09 19:44,0,0,My God Bam Aquino..deny pa more!!..ikaw ang dahilan sa maute sa marawi!!,,,,873143784053157888,https://twitter.com/Dosocialhub1/status/873143784053157888
ZeusKino,2017-06-09 19:44,0,0,I liked a @ YouTube video http://youtu.be/gdvrreyZRBo?a  ACTUAL VIDEO ANG TUNAY NA BUHAY NG MGA MAUTE GROUP SA MARAWI CITY PANOORIN,"(['Davao City', 'Philippines'], Location((7.22650725, 125.454887691, 0.0)))",@,,873143732111126529,https://twitter.com/ZeusKino/status/873143732111126529
kitkitLaparan,2017-06-09 19:44,0,0,MARAWI nalang lagi ko naririnig sa BALITA,"(['Domingo st. /mae\xe2\x99\xa1'], Location((51.5236585, -0.0965919, 0.0)))",,,873143716256468992,https://twitter.com/kitkitLaparan/status/873143716256468992
ChururotTusok,2017-06-09 19:44,0,0,Pati pagbisita sa Marawi ginagawang promo sa La Luna kaloka https://twitter.com/PEPalerts/status/873077375935721472 …,,,,873143690591485952,https://twitter.com/ChururotTusok/status/873143690591485952
MadamVPLeni,2017-06-09 19:43,0,6,Kawawa naman mga troops natin sa Marawi.,"(['Laylayan', ' Bicol Region'], Location((10.88356, 122.3827363, 0.0)))",,,873143618764013568,https://twitter.com/MadamVPLeni/status/873143618764013568
ReputationYel,2017-06-09 19:43,0,0,Sa totoo lang naiiyak parin ko para sa Marawi.,"(['Valletta', ' Malta'], Location((35.8989818, 14.5136759, 0.0)))",,,873143564640731136,https://twitter.com/ReputationYel/status/873143564640731136
lausevilla1982,2017-06-09 19:40,0,0,GOOD NEWS! BUTI NALANG NAPIGILAN ng MILITAR! PLANO ng MAUTE sa MARAWI PUMALPAK! https://goo.gl/fb/J3Lnkt,"(['Espa\xc3\xb1a'], Location((40.0028028, -4.003104, 0.0)))",,,873142732662951936,https://twitter.com/lausevilla1982/status/873142732662951936
NewsRmn,2017-06-09 19:39,0,0,"# BREAKING Bakbakan sa Marawi City, umabot na sa kampo ng 103rd Infantry Brigade pic.twitter.com/QQfyR4ksVD","(['Republic of the Philippines'], Location((12.7503486, 122.7312101, 0.0)))",,#,873142570993410048,https://twitter.com/NewsRmn/status/873142570993410048
Tatuaje_famosos,2017-06-09 19:38,0,0,GOOD NEWS! BUTI NALANG NAPIGILAN ng MILITAR! PLANO ng MAUTE sa MARAWI PUMALPAK! https://goo.gl/fb/J3Lnkt,"(['Espa\xc3\xb1a'], Location((40.0028028, -4.003104, 0.0)))",,,873142329896579072,https://twitter.com/Tatuaje_famosos/status/873142329896579072
doremirosie,2017-06-09 19:38,0,0,"Take note, She"" I nearly cried sa 'Sinong gustong maassign sa Marawi?' Grabe kayo mga bes. Salute! https://twitter.com/cnnphilippines/status/873135587376496640 …""","(['Sto. Tomas', ' Batangas'], Location((11.8495434, 125.4199234, 0.0)))",,,873142153639231488,https://twitter.com/doremirosie/status/873142153639231488
GusGusalit69,2017-06-09 19:37,0,0,Situasi Marawi Memanas Brimob Polda Sulut Siap Siaga Di Pantai Perbatasan – MANADO AKTUAL http://fb.me/8Ex1u7K3M,,,,873142115169169409,https://twitter.com/GusGusalit69/status/873142115169169409
bebutsanchez,2017-06-09 19:37,0,0,"Unta to kung mag sige og bomba sa Marawi, see to it nga igo dayon kanang precise sad ba, walay lain ma igo. Ang... http://fb.me/DXGaJT58",,,,873142085393711104,https://twitter.com/bebutsanchez/status/873142085393711104
24OrasGMA,2017-06-09 19:37,0,0,...at ilang prominenteng pamilya sa nangyayaring gulo sa Marawi. Inaalmahan yan ng mga reporter na nag-cover sa kanyang presscon.,"(['Philippines'], Location((12.7503486, 122.7312101, 0.0)))",,,873141967487553536,https://twitter.com/24OrasGMA/status/873141967487553536
monykafsosa,2017-06-09 19:35,0,0,GOOD NEWS! BUTI NALANG NAPIGILAN ng MILITAR! PLANO ng MAUTE sa MARAWI PUMALPAK! https://goo.gl/fb/J3Lnkt,"(['Espa\xc3\xb1a'], Location((40.0028028, -4.003104, 0.0)))",,,873141496136036352,https://twitter.com/monykafsosa/status/873141496136036352
patrol_ph,2017-06-09 19:34,0,0,"Baril, droga, nasabat sa bahay ng dating alkalde ng Marawi http://ift.tt/2sKz37h",,,,873141369522597888,https://twitter.com/patrol_ph/status/873141369522597888
JaneColes30,2017-06-09 19:34,0,0,"Kanang mga BTS army, pwd ideploy na cla sa Marawi kay murag dghan2x pud na cla. may nlng maghasik clag Kpop sa mga Maute didto","(['Philippines'], Location((12.7503486, 122.7312101, 0.0)))",,,873141225372516352,https://twitter.com/JaneColes30/status/873141225372516352
FwedoRamos,2017-06-09 19:32,0,0,Mga BTS Army jan Padala ko kayo sa Marawi ! Puro KPOP ang alam eh Edi woew!,,,,873140814351872001,https://twitter.com/FwedoRamos/status/873140814351872001
vncldc,2017-06-09 19:32,0,12,kalooy sa mga sundalo nga nangamatay tungod sa conflict sa marawi tapos naa lang dayoy mag binuang nga musuporta aning mga maute LUUUUUUH,,,,873140746726948864,https://twitter.com/vncldc/status/873140746726948864
jaysoncrv,2017-06-09 19:31,0,7,archdiocese of marawi kaso di pala archdiocese yun,"(['ua&p'], Location((14.5803302, 121.060979735, 0.0)))",,,873140596709380096,https://twitter.com/jaysoncrv/status/873140596709380096
ImJoseph_Apurds,2017-06-09 19:31,0,0,Kalami mu adtog marawi.,"(['Gen. Santos City', ' Soccsksargen'], Location((14.6207049, 121.0515971, 0.0)))",,,873140577063256064,https://twitter.com/ImJoseph_Apurds/status/873140577063256064
jajargeous,2017-06-09 19:31,0,4,"Hearing all these news about Marawi are making me really, really sad. Nalulungkot ako sa sitwasyon ng mga kababayan natin doon.",,,,873140403184181248,https://twitter.com/jajargeous/status/873140403184181248
RotoniLance,2017-06-09 19:30,0,0,Ay. Alis na ba ako? Uwi na ko marawi? HAHAHA,,,,873140279691300864,https://twitter.com/RotoniLance/status/873140279691300864
AdmiringJohnRoa,2017-06-09 19:30,0,0,SINONG MGA NAGSASABI SA'YO PAPÍ? 'Punta natin sa Marawi charot iloveyouuu basta be happy always na lang https://twitter.com/Johneilito/status/873138661964959746 …,,,,873140176494632961,https://twitter.com/AdmiringJohnRoa/status/873140176494632961
quotevista,2017-06-09 19:30,0,0,"Kung sniper ang isa sa alas ng maute, bakit wala bang sniper ang govt forces na pantapat dyan? # Marawi",,,#,873140170823835648,https://twitter.com/quotevista/status/873140170823835648
DZMMTeleRadyo,2017-06-09 19:30,2,2,"12 batang lumikas sa Marawi City, nagbalik-eskwela sa Pangasinan # BalikEskuwela2017 http://bit.ly/2rTuPdo pic.twitter.com/APcGLgkBnN","(['ABS-CBN', ' Diliman', ' Quezon City'], Location((11.5874907, 122.7520466, 0.0)))",,#,873140120991416321,https://twitter.com/DZMMTeleRadyo/status/873140120991416321
TVPatrol,2017-06-09 19:29,1,3,"# TVPatrol Limang lalake na nagnanakaw umano sa mga bahay sa Marawi, naaresto ng PNP # MarawiClash | ulat ni @ raphbosanopic.twitter.com/lYnEGHsGjG","(['Philippines'], Location((12.7503486, 122.7312101, 0.0)))",@,# #,873139930683371520,https://twitter.com/TVPatrol/status/873139930683371520
LourdesEscaros,2017-06-09 19:28,0,0,"JUST IN: Matinding putukan sa Marawi, umaabot na malapit sa kampo ng 103rd Brigade",,,,873139760620912640,https://twitter.com/LourdesEscaros/status/873139760620912640
Balitanghali11,2017-06-09 19:27,0,2,"VIDEO: Ilang senador, binatikos ang pagdadawit ni Sec. Aguirre sa ilang senador sa gulo sa Marawi http://bit.ly/2r2vVCl pic.twitter.com/iRG2ty3MuF","(['Quezon City', ' Philippines'], Location((14.6509905, 121.0486155, 0.0)))",,,873139511974174720,https://twitter.com/Balitanghali11/status/873139511974174720
mark_arandia,2017-06-09 19:26,4,0,# MVRPagbabalik grabe parin ang bakbakan sa Marawi KapusoBrigade,,,#,873139219106979840,https://twitter.com/mark_arandia/status/873139219106979840
rue_la_rila,2017-06-09 19:25,1,3,Mother: Kabalo ka unsaon pagpilde ang Maute? Buhian na lang natog daghan kaayog baboy ang Marawi.,"(['Davao City', ' Davao Region'], Location((7.22650725, 125.454887691, 0.0)))",,,873139093911121920,https://twitter.com/rue_la_rila/status/873139093911121920
Ivan226622,2017-06-09 19:25,0,0,"JUST IN: Matinding putukan sa Marawi, umaabot na malapit sa kampo ng 103rd Brigade # MarawiClash | ulat ni chiarazambrano …",,,#,873138989276049409,https://twitter.com/Ivan226622/status/873138989276049409
Jerilynbrgd,2017-06-09 19:24,0,1,Sana matapos na ang putokan sa marawi. Pls lord,"(['ph.'], Location((12.44249325, 122.160395164, 0.0)))",,,873138731598856193,https://twitter.com/Jerilynbrgd/status/873138731598856193
ianskie_sg,2017-06-09 19:24,0,0,Iba ka idol # PrayForMarawi https://twitter.com/143redangel/status/873131868220268544 …,,,#,873138728335626241,https://twitter.com/ianskie_sg/status/873138728335626241
alteyayaya,2017-06-09 19:24,0,2,"papadala sana kita sa marawi. kaso naalala ko, ako nga hindi mo kayang ipaglaban, yung iba pa kaya?","(['worthless'], Location((48.9274185, -124.6205493, 0.0)))",,,873138647700197376,https://twitter.com/alteyayaya/status/873138647700197376
TVPatrol,2017-06-09 19:23,4,14,"# TVPatrol Bandila ng Pilipinas, iwawagayway sa Marawi City sa Araw ng Kalayaan # MarawiClash # Kalayaan2017 | ulat ni @ pia_gutierrezpic.twitter.com/YcJ0y2ppHe","(['Philippines'], Location((12.7503486, 122.7312101, 0.0)))",@,# # #,873138585226145792,https://twitter.com/TVPatrol/status/873138585226145792
itsmaykil,2017-06-09 19:23,0,0,kumusta na kaha ang marawi karun?,"(['Ph'], Location((12.44249325, 122.160395164, 0.0)))",,,873138498521374720,https://twitter.com/itsmaykil/status/873138498521374720
akosipaparobin,2017-06-09 19:22,0,0,RIP don sa batang muslim tinamaan ng bala sa ulo kahit nasa loob na sila ng mosque. Lord ikw na po bahala # PrayForMarawi @ TVPatrolABSCBN2,,@,#,873138174653906944,https://twitter.com/akosipaparobin/status/873138174653906944
keen_kyungsoo,2017-06-09 19:22,0,1,Walang humpay ang putukan grabe na Marawi tama na po mga Maute,,,,873138147600719872,https://twitter.com/keen_kyungsoo/status/873138147600719872
pinay_chismosa,2017-06-09 19:21,0,0,I think media should not divulge lahat lahat ng ngyayari sa Marawi. Di kaya kumalat pa sila lalo nung nagkaroon ng humanitarian ceasefire.,,,,873138025022148608,https://twitter.com/pinay_chismosa/status/873138025022148608
charlesssjade,2017-06-09 19:21,0,0,yung laptop para bang nagdaan sa marawi,"(['hell'], Location((63.445531, 10.9032872, 0.0)))",,,873137942222348288,https://twitter.com/charlesssjade/status/873137942222348288
AsiaNewsIT,2017-06-09 19:21,7,3,"Mindanao, i leader islamici condannano la dissacrazione della cattedrale di Marawi http://www.asianews.it/notizie-it/Mindanao,-i-leader-islamici-condannano-la-dissacrazione-della-cattedrale-di-Marawi-40976.html … # Filippine # AsiaNewspic.twitter.com/Ch4eZnQ3b5",,,# #,873137851617214466,https://twitter.com/AsiaNewsIT/status/873137851617214466
DZMMTeleFeed,2017-06-09 19:20,0,0,"Binatilyo, patay sa tama ng bala ng Maute sniper sa Marawi",,,,873137602345521152,https://twitter.com/DZMMTeleFeed/status/873137602345521152
jannettedtrla,2017-06-09 19:19,0,0,Marawi City.,,,,873137476449181697,https://twitter.com/jannettedtrla/status/873137476449181697
YsabelF21,2017-06-09 19:18,0,0,I think di pa nila alam kung may mga legit na organisers kasi parang unstable yung lagay ng Marawi. Sa pagkakaalam ko nakablock mga -,"(['getaway car'], Location((-35.1132475, 139.2282292, 0.0)))",,,873137257904881664,https://twitter.com/YsabelF21/status/873137257904881664
Tatuaje_famosos,2017-06-09 19:18,0,0,MATIBAY na EBIDENSYA! AGUIRRE AYAW ng GULO! DENY NALANG! MEETING ng DILAWAN sa MARAWI! https://goo.gl/fb/rixKqd,"(['Espa\xc3\xb1a'], Location((40.0028028, -4.003104, 0.0)))",,,873137241769496577,https://twitter.com/Tatuaje_famosos/status/873137241769496577
Lieeeeeezel,2017-06-09 19:18,0,0,May putukan na naman sa Marawi.,"(['Republic of the Philippines :)'], Location((12.7503486, 122.7312101, 0.0)))",,,873137190678679552,https://twitter.com/Lieeeeeezel/status/873137190678679552
TVPatrol,2017-06-09 19:18,15,32,"JUST IN: Matinding putukan sa Marawi, umaabot na malapit sa kampo ng 103rd Brigade # MarawiClash | ulat ni @ chiarazambranopic.twitter.com/TrzdqKZbXC","(['Philippines'], Location((12.7503486, 122.7312101, 0.0)))",@,#,873137138098987010,https://twitter.com/TVPatrol/status/873137138098987010
Persianistas,2017-06-09 19:17,0,0,MATIBAY na EBIDENSYA! AGUIRRE AYAW ng GULO! DENY NALANG! MEETING ng DILAWAN sa MARAWI! https://goo.gl/fb/rixKqd,,,,873136929537216512,https://twitter.com/Persianistas/status/873136929537216512
isabellaxmarga,2017-06-09 19:17,0,0,jusq naman marawi.,"(['B'], Location((52.5198535, 13.4385964, 0.0)))",,,873136908611624960,https://twitter.com/isabellaxmarga/status/873136908611624960
MisterSemiColon,2017-06-09 19:16,0,0,Malinaw mong sinabi Aguirre na may kinatagpong pamilya sina Aquino at Trillanes sa Marawi noong April. Anong misquoted ka diyan?!,"(['Black Hole'], Location((52.3031429, 8.0526258, 0.0)))",,,873136698246316034,https://twitter.com/MisterSemiColon/status/873136698246316034
ToniTililing,2017-06-09 19:16,0,2,Sa Marawi ba? https://twitter.com/trishaay/status/873030754669809664 …,,,,873136628721532929,https://twitter.com/ToniTililing/status/873136628721532929
mikeligalig,2017-06-09 19:15,1,0,Sulondon ang maayong gawi ni Angel Locsin nga mibisita sa mga evacuees nga nag-antos tungod sa gyera sa Marawi... http://fb.me/1uX2toLMJ,"(['Bohol', ' Philippines'], Location((9.833333, 124.1615579, 0.0)))",,,873136528578363393,https://twitter.com/mikeligalig/status/873136528578363393
monykafsosa,2017-06-09 19:15,0,0,MATIBAY na EBIDENSYA! AGUIRRE AYAW ng GULO! DENY NALANG! MEETING ng DILAWAN sa MARAWI! https://goo.gl/fb/rixKqd,"(['Espa\xc3\xb1a'], Location((40.0028028, -4.003104, 0.0)))",,,873136406276845570,https://twitter.com/monykafsosa/status/873136406276845570
Farreee,2017-06-09 19:13,0,0,Yun yung sinabi kanina sa Masjid. Kung di ako nagkakamali advance na napag tahajud basta may mga nangyayari gaya sa Marawi.,,,,873135902456922113,https://twitter.com/Farreee/status/873135902456922113
readysooon,2017-06-09 19:11,0,0,pagtapos na bakbakan sa marawi,"(['Puerto Princesa City', ' Mimaropa'], Location((9.7376025, 118.7350414, 0.0)))",,,873135492719456257,https://twitter.com/readysooon/status/873135492719456257
dzIQ990,2017-06-09 19:10,1,1,"Rehabilitasyon sa Marawi City, pinaghahandaan na ng Engineering Brigade ng DPWH | @ BrozasRicky","(['Makati City'], Location((14.5591272, 121.0202094, 0.0)))",@,,873135238318358528,https://twitter.com/dzIQ990/status/873135238318358528
lausevilla1982,2017-06-09 19:10,0,0,MATIBAY na EBIDENSYA! AGUIRRE AYAW ng GULO! DENY NALANG! MEETING ng DILAWAN sa MARAWI! https://goo.gl/fb/rixKqd,"(['Espa\xc3\xb1a'], Location((40.0028028, -4.003104, 0.0)))",,,873135237651365888,https://twitter.com/lausevilla1982/status/873135237651365888
Tatuaje_famosos,2017-06-09 19:08,0,0,MATIBAY na EBIDENSYA! AGUIRRE AYAW ng GULO! DENY NALANG! MEETING ng DILAWAN sa MARAWI! https://goo.gl/fb/rixKqd,"(['Espa\xc3\xb1a'], Location((40.0028028, -4.003104, 0.0)))",,,873134650713100288,https://twitter.com/Tatuaje_famosos/status/873134650713100288
jmg_marl,2017-06-09 19:07,0,0,shit. na-snipe sa Marawi yung dating kasama ng tatay ko sa Sulu.,,,,873134456873205761,https://twitter.com/jmg_marl/status/873134456873205761
trishalistanco_,2017-06-09 19:07,0,0,tapon ko kayo sa marawi e,,,,873134443023613953,https://twitter.com/trishalistanco_/status/873134443023613953
yararigato,2017-06-09 19:07,0,0,crush: uy nandito ka nanaman sa marawi ah. delikado dito me: okay lang anjan naman atlst andito ka crush; Marines: Army: Npa: maute group:,"(['Cagayan De Oro City', ' Northern Mindanao'], Location((8.42980265, 124.682410212, 0.0)))",,,873134411373355009,https://twitter.com/yararigato/status/873134411373355009
alpatrickxviii,2017-06-09 19:06,0,0,looy kaayo ang mga tao pas marawi :(,"(['Alubijid', ' Northern Mindanao'], Location((8.5704786, 124.4711949, 0.0)))",,,873134275880603648,https://twitter.com/alpatrickxviii/status/873134275880603648
roxynigang,2017-06-09 19:04,0,2,Kawawa naman yung batang namatay dahil natamaan ng ligaw na bala habang nagdadasal sa marawi,"(['Paranaque City'], Location((49.2086619, -2.0238323, 0.0)))",,,873133795150503936,https://twitter.com/roxynigang/status/873133795150503936
GoddiesGracias,2017-06-09 19:04,0,0,Lord SaNa TumIgiL na PoH anG GulO sa MaraWi!! # PrayForMarawi,,,#,873133690527686656,https://twitter.com/GoddiesGracias/status/873133690527686656
monykafsosa,2017-06-09 19:04,0,0,MATIBAY na EBIDENSYA! AGUIRRE AYAW ng GULO! DENY NALANG! MEETING ng DILAWAN sa MARAWI! https://goo.gl/fb/rixKqd,"(['Espa\xc3\xb1a'], Location((40.0028028, -4.003104, 0.0)))",,,873133645963329536,https://twitter.com/monykafsosa/status/873133645963329536
blenggggggg,2017-06-09 19:03,0,0,marawi hay,,,,873133450936451072,https://twitter.com/blenggggggg/status/873133450936451072
OccupyPhils,2017-06-09 19:01,0,0,SOBRANG NAKAKAGULAT! ACTUAL FOOTAGE NG PAGPAPLANO NG PAGWASAK SA MARAWI CITY http://fb.me/vjJhlww7,"(['Philippines'], Location((12.7503486, 122.7312101, 0.0)))",,,873132870843465728,https://twitter.com/OccupyPhils/status/873132870843465728
Mahida_07,2017-06-09 19:01,0,1,Ang ganda at bait talaga ni @ 143redangel imagine sa kabila ng kagulohan dito sa Marawi city ay nagawa pa niyang pumunta dito. God bless you! pic.twitter.com/6bEzFycHKz,"(['Philippines'], Location((12.7503486, 122.7312101, 0.0)))",@,,873132834663182338,https://twitter.com/Mahida_07/status/873132834663182338
Aj_baekhyun17,2017-06-09 18:59,0,0,# PrayForMarawi may namatay nanaman,"(['Seoul', ' Republic of Korea'], Location((37.5666791, 126.9782914, 0.0)))",,#,873132526763524096,https://twitter.com/Aj_baekhyun17/status/873132526763524096
KasanSamad,2017-06-09 18:59,0,0,"Ang bait po nyo ate angel,slamat sa pagdalaw m sa marawi I love u ate angel",,,,873132448288301056,https://twitter.com/KasanSamad/status/873132448288301056
RmrJai,2017-06-09 18:58,0,0,Sugod nalang ako sa marawi para may halaga ako,"(['Macabebe Pampanga Philippines'], Location((14.909613, 120.7155154, 0.0)))",,,873132307762237440,https://twitter.com/RmrJai/status/873132307762237440
IcayWonderland,2017-06-09 18:58,0,0,Sinusubukan kong wag umiyak ng mapanuod ko na naman yung news abt Marawi City. Hayyyssssss,,,,873132211821658112,https://twitter.com/IcayWonderland/status/873132211821658112
lainelalala,2017-06-09 18:58,0,3,Sana mabigyang katapusan na ang gulo sa Marawi at sa iba pang panig ng mundo. Ang daming buhay na nasasayang.,,,,873132136785625088,https://twitter.com/lainelalala/status/873132136785625088
jayzameyy,2017-06-09 18:57,0,1,Kadtong bata ba na namatay ddto sa Marawi while gaampo.,"(['ph'], Location((12.44249325, 122.160395164, 0.0)))",,,873131855104491520,https://twitter.com/jayzameyy/status/873131855104491520
rmnnetworks,2017-06-09 18:56,0,0,"# LatestNews Bilang ng mga nagkakasakit na “bakwit” sa patuloy na bakbakan sa Marawi City, patuloy sa pagtaas... http://fb.me/8T3v50pmz",,,#,873131694127108096,https://twitter.com/rmnnetworks/status/873131694127108096
nelcabz,2017-06-09 18:56,0,0,Sa Mga Gusto Motabang sa # OneLoveMindanao Concert for # Marawi na gaganapin sa # DavaoCity http://fb.me/EbE4lywx,"(['Davao City', ' Philippines'], Location((7.22650725, 125.454887691, 0.0)))",,# # #,873131598425710592,https://twitter.com/nelcabz/status/873131598425710592
DinandFer20,2017-06-09 18:55,0,1,yung mga sundalo namamatay sa Marawi tapos ikaw namamatay sa everwing HAHAHAHAHA TNGINA ANG BENTA,"(['National Capital Region', ' Repub'], Location((14.5736108, 121.0329706, 0.0)))",,,873131487536660480,https://twitter.com/DinandFer20/status/873131487536660480
JahnehM,2017-06-09 18:55,0,0,Dalhin na natin sa marawi ung nangbabash sa crush natin. Hahaha,"(['Abu Dhabi', ' United Arab Emirate'], Location((40.4071708, 49.8461271, 0.0)))",,,873131472064045056,https://twitter.com/JahnehM/status/873131472064045056
panchomenk,2017-06-09 18:55,0,0,Nauna pa si angel makarating ng marawi kaysa kay presidente,"(['National Capital Region'], Location((14.5736108, 121.0329706, 0.0)))",,,873131307596824576,https://twitter.com/panchomenk/status/873131307596824576
JahnehM,2017-06-09 18:54,0,1,Dapat ito ang dinadala sa marawi e.. Nakakadagdag salot ka lang sa lipunan..,"(['Abu Dhabi', ' United Arab Emirate'], Location((40.4071708, 49.8461271, 0.0)))",,,873131162906001410,https://twitter.com/JahnehM/status/873131162906001410
miamoriess,2017-06-09 18:54,0,0,Nakakabroken hearted ang nangyayari sa marawi,"(['Quezon City'], Location((14.6509905, 121.0486155, 0.0)))",,,873131061022048256,https://twitter.com/miamoriess/status/873131061022048256
adelizejade2001,2017-06-09 18:52,0,0,Para sa mga Pilipino pagdasal natin ang taga-Mindanao # PrayForPhilippines # PrayForMarawi,"(['Bataan', 'Philippines'], Location((14.666667, 120.416667, 0.0)))",,# #,873130653369245697,https://twitter.com/adelizejade2001/status/873130653369245697
jhay24cute,2017-06-09 18:52,0,0,ISA KANG HANGAAAAALLLLLLLL! DAKIPIN AT DALHIN SA MARAWI ITO! http://fb.me/zyzAnm5p,"(['Leveriza ', ' Malate'], Location((14.5648744, 120.990857, 0.0)))",,,873130645777563648,https://twitter.com/jhay24cute/status/873130645777563648
yararigato,2017-06-09 18:51,0,0,Marawi marawi marawi.,"(['Cagayan De Oro City', ' Northern Mindanao'], Location((8.42980265, 124.682410212, 0.0)))",,,873130543939854336,https://twitter.com/yararigato/status/873130543939854336
RWCh0i,2017-06-09 18:51,0,0,Hays sana nga maiwagayway ang watawat ng Pilipinas sa Lunes tanda na tapos na ang gera sa Marawi.,,,,873130410141560833,https://twitter.com/RWCh0i/status/873130410141560833
nickeebutlangan,2017-06-09 18:51,0,0,"Dahil sa bakbakan, nahinto sa pag-aaral ang ilang estudyante mula sa Marawi city. Pangamba nila, baka hindi na... http://fb.me/5ShKzzSs8",,,,873130374871764992,https://twitter.com/nickeebutlangan/status/873130374871764992
RWCh0i,2017-06-09 18:50,0,0,Sakit na kaayo akoa dughan sa gera sa Marawi ba. Luoy na kaayo ang mga sundalo ug sibilyan.,,,,873130060546416640,https://twitter.com/RWCh0i/status/873130060546416640
PTVph,2017-06-09 18:50,0,2,"BALITA: Pamahalaan, target na maiwagayway ang bandila ng Pilipinas sa Liberation of Marawi sa June 12 https://www.youtube.com/watch?v=l-TzNuFMNhg …","(['Philippines'], Location((12.7503486, 122.7312101, 0.0)))",,,873130050551296000,https://twitter.com/PTVph/status/873130050551296000
AndreCayas,2017-06-09 18:49,0,0,Naa nasad namatay na inosente sa Marawi,"(['Davao City'], Location((7.22650725, 125.454887691, 0.0)))",,,873129911854215168,https://twitter.com/AndreCayas/status/873129911854215168
TVPatrol,2017-06-09 18:49,1,9,"# TVPatrol Duterte: Gulo sa Marawi, posibleng matapos sa loob ng ilang araw pic.twitter.com/VDrMZinbJd","(['Philippines'], Location((12.7503486, 122.7312101, 0.0)))",,#,873129885279154177,https://twitter.com/TVPatrol/status/873129885279154177
Drayutt,2017-06-09 18:49,0,0,Sana naman matapos na yng gulo sa Marawi. Nakakaawa yung mga nappanuod ko.,"(['Dasmari\xc3\xb1as City Cavite'], Location((14.3270819, 120.9370871, 0.0)))",,,873129835652030464,https://twitter.com/Drayutt/status/873129835652030464
_itstheKline,2017-06-09 18:48,0,4,Grbe abi kog hapit na mahuman ning gyera sa marawi layo paman diay sa tinood.,"(['Iligan City', ' Northern Mindanao'], Location((8.17846435, 124.470789035, 0.0)))",,,873129756908072960,https://twitter.com/_itstheKline/status/873129756908072960
LizandroCalzado,2017-06-09 18:48,0,2,This Marawi War must stop. Madami ng buhay ang nawala.,,,,873129658044239872,https://twitter.com/LizandroCalzado/status/873129658044239872
champaloc,2017-06-09 18:48,0,0,Nakakaiyak yung news abt marawi city :((((((,,,,873129650272092160,https://twitter.com/champaloc/status/873129650272092160
cmpbagacay,2017-06-09 18:47,0,0,Kailan ba matatapos yung gulo sa Marawi?,"(['Philippines'], Location((12.7503486, 122.7312101, 0.0)))",,,873129531728576512,https://twitter.com/cmpbagacay/status/873129531728576512
