narkosun,2017-06-13 9:29,0,0,"Ini di Marawi Philipina, bukan di Suriah atau Libya. Dekat sekali dengan negara kita, mungkin hanya perlu waktu 1...","(['Indonesia'], Location((-4.7993356, 114.5632032, 0.0)))",,,874438442909937666,https://twitter.com/narkosun/status/874438442909937666,id
DixGIOF,2017-06-13 9:27,0,15,"Wait lang. Ang giyera po sa MARAWI, di po sa buong MINDANAO. Wag atat please. Shut thy mouth kung wala namang alam. Please lang.","(['Republic of the Philippines'], Location((12.7503486, 122.7312101, 0.0)))",,,874438026515980289,https://twitter.com/DixGIOF/status/874438026515980289,fil
Radyo_Agila1062,2017-06-13 9:27,0,1,Bilang ng namatay sa sagupaan ng tropa ng gobyerno at Maute group sa Marawi City umakyat na sa 290 -,,,,874437941392801794,https://twitter.com/Radyo_Agila1062/status/874437941392801794,fil
RitaBaua,2017-06-13 9:26,0,0,"June 13, 2017 - hindi pa rin malaya ang mga mamayan ng Marawi kahit itinaas na doon kahapon ang mga bandila ng PH.","(['Quezon City'], Location((14.6509905, 121.0486155, 0.0)))",,,874437767454900224,https://twitter.com/RitaBaua/status/874437767454900224,fil
Radyo_Agila1062,2017-06-13 9:21,0,1,"Posibleng pagkakaroon ng outbreak sa evacuation centers sa Marawi, ibinabala ng DOH - c",,,,874436495385538562,https://twitter.com/Radyo_Agila1062/status/874436495385538562,fil
dzrhnews,2017-06-13 9:20,1,0,"Ina ng Maute brothers, sinampahan na ng reklamo at dating Mayor ng Marawi City, na-inquest na rin | RH29 boy_gonzales","(['Manila', ' Philippines'], Location((14.5906216, 120.9799696, 0.0)))",@,,874436171576647680,https://twitter.com/dzrhnews/status/874436171576647680,fil
DZMMTeleFeed,2017-06-13 9:20,0,0,"DND, pinasalamatan ang US sa technical support sa Marawi",,,,874436156523290625,https://twitter.com/DZMMTeleFeed/status/874436156523290625,fil
Persianistas,2017-06-13 9:18,0,0,"BREAKING NEWS TODAY! JUNE 13, 2017 DUTERTE ARMAS AMERIKA | ARAW NG KALAYAAN MARAWI | SC…",,,,874435808408858624,https://twitter.com/Persianistas/status/874435808408858624,fil
dzbb,2017-06-13 9:16,0,2,"FLASH: 5 na sibilyan, nasagip ng militar sa Marawi City. | via","(['Republic of the Philippines'], Location((12.7503486, 122.7312101, 0.0)))",@,,874435263635869698,https://twitter.com/dzbb/status/874435263635869698,fil
Ivan226622,2017-06-13 9:16,0,0,"5 pulis, nailigtas matapos maipit sa bakbakan sa Marawi City | Ulat ni dzmmPatrol44 MarawiClash — DZMM TeleRadyo…",,,#,874435240969859075,https://twitter.com/Ivan226622/status/874435240969859075,fil
egdsgn,2017-06-13 9:15,0,0,"UB: Mga sundalong nasugatan sa Marawi, ililipat sa mas maayos na ospital","(['Davao City', ' Davao Region'], Location((7.22650725, 125.454887691, 0.0)))",,,874435065413079040,https://twitter.com/egdsgn/status/874435065413079040,fil
egdsgn,2017-06-13 9:15,0,0,"UB: Batang Bakwit mula sa Marawi, pumanaw dahil sa meningitis","(['Davao City', ' Davao Region'], Location((7.22650725, 125.454887691, 0.0)))",,,874435033670594560,https://twitter.com/egdsgn/status/874435033670594560,fil
daczgurl,2017-06-13 9:14,0,0,C PRRD sumalubong sa mga bayaning sundalo namatay sa marawi. Ikaw trillanes dati kang sundaling duwag sumalubong k ba?Wla putak ka ng putak.,"(['davao city'], Location((7.22650725, 125.454887691, 0.0)))",,,874434813150638080,https://twitter.com/daczgurl/status/874434813150638080,fil
DZMMTeleRadyo,2017-06-13 9:12,4,3,"5 pulis, nailigtas matapos maipit sa bakbakan sa Marawi City | Ulat ni dzmmPatrol44","(['ABS-CBN', ' Diliman', ' Quezon City'], Location((11.5874907, 122.7520466, 0.0)))",@,#,874434320038940672,https://twitter.com/DZMMTeleRadyo/status/874434320038940672,fil
ChrisRrr_ph,2017-06-13 9:12,0,1,Winner????!!! Meanwhile in Marawi nag bubuwis ng buhay mga tunay na winner ng bayan.,"(['Makati City', ' National Capital Region'], Location((14.5591272, 121.0202094, 0.0)))",,,874434259527671809,https://twitter.com/ChrisRrr_ph/status/874434259527671809,fil
TwEEtUmz,2017-06-13 9:12,0,2,PrayforMarawi SaveMarawi ReliefOperation 9,"(['Cagayan de Oro City'], Location((8.42980265, 124.682410212, 0.0)))",,# # # #,874434171434713089,https://twitter.com/TwEEtUmz/status/874434171434713089,co
dayananunyes,2017-06-13 9:12,0,0,Dalin ka dapat sa Marawi tapang mo masyado,"(['Nowhere'], Location((38.7311123, -95.2414104, 0.0)))",,,874434168704323584,https://twitter.com/dayananunyes/status/874434168704323584,fil
egdsgn,2017-06-13 9:11,0,0,"UB: Sundalong nasawi sa Marawi, ililibing kasama ang namatay na anak","(['Davao City', ' Davao Region'], Location((7.22650725, 125.454887691, 0.0)))",,,874434132314664960,https://twitter.com/egdsgn/status/874434132314664960,fil
egdsgn,2017-06-13 9:11,0,0,"Saksi: 10 marines na kabilang sa 58 tropa ng gobyerno na nasawi sa Marawi, ginawaran ng medal","(['Davao City', ' Davao Region'], Location((7.22650725, 125.454887691, 0.0)))",,,874434101037723648,https://twitter.com/egdsgn/status/874434101037723648,fil
baldozj23,2017-06-13 9:09,0,0,BREAKING! JAPAN nagbigay ng 1Trillion kay PRRD para sa MARAWI CITY! PANOORIN!,,,,874433530847264770,https://twitter.com/baldozj23/status/874433530847264770,fil
egdsgn,2017-06-13 9:09,0,0,"UB: Labi ng ilan sa mga marines na namatay sa Marawi, kinuha na ng kanilang pamilya","(['Davao City', ' Davao Region'], Location((7.22650725, 125.454887691, 0.0)))",,,874433424538222592,https://twitter.com/egdsgn/status/874433424538222592,fil
Jimparedes,2017-06-13 9:08,25,67,Honest question po. Bakit kayo naunahan? D kayo naghanda? inquirerdotnet Palace knew Marawi plot ahead of attack,,@,,874433295609548800,https://twitter.com/Jimparedes/status/874433295609548800,fil
NewsRmn,2017-06-13 9:05,0,0,"Gabriela solons, tinawag na pangungutya sa bansa ang pagpayag na tumulong ang US sa Marawi via rmnnetworks","(['Republic of the Philippines'], Location((12.7503486, 122.7312101, 0.0)))",@,,874432381989421056,https://twitter.com/NewsRmn/status/874432381989421056,fil
mamadudut,2017-06-13 9:03,0,0,Jangan lemah nalar ama provokasi ini mah! Aduh aduh remuk ama ISIS ini mah! ISIS bukan ISLAM. TITIK. kasian warga marawi,"(['in your \xc2\xa0\xe2\x9d\xa4'], Location((48.2025836, 16.3638175, 0.0)))",,,874432112069271552,https://twitter.com/mamadudut/status/874432112069271552,id
NewsRmn,2017-06-13 9:03,0,0,"Isang bakwit, nasawi dahil sa meningitis sa Marawi City via rmnnetworks","(['Republic of the Philippines'], Location((12.7503486, 122.7312101, 0.0)))",@,,874431901066448896,https://twitter.com/NewsRmn/status/874431901066448896,fil
8trimedia,2017-06-13 9:02,0,0,"TRILLANES SA PAG-IMBESTIGA NG SENADO KAY AGUIRRE:'PAG RESUME NG SESSION, HOPEFULLY HUMUPA NA ANG SITWASYON SA MARAWI PARA MAKAPAG-FOCUS DITO","(['Manila Philippines'], Location((14.5906216, 120.9799696, 0.0)))",,,874431709273407488,https://twitter.com/8trimedia/status/874431709273407488,fil
dzbb,2017-06-13 9:01,3,5,"FLASH: 5 pulis, na-rescue ng tropa ng pamahalaan sa Marawi City, Lanao del Sur. | via","(['Republic of the Philippines'], Location((12.7503486, 122.7312101, 0.0)))",@,,874431487327817728,https://twitter.com/dzbb/status/874431487327817728,fil
rmnnetworks,2017-06-13 9:00,0,0,"LatestNews Gabriela solons, tinawag na pangungutya sa bansa ang pagpayag na tumulong ang US sa Marawi 9",,,#,874431125564801024,https://twitter.com/rmnnetworks/status/874431125564801024,fil
calosandalloan1,2017-06-13 8:57,0,0,", PAPUNTAHIN SA MARAWI.",,,#CHR,874430474168352768,https://twitter.com/calosandalloan1/status/874430474168352768,fil
Ivan226622,2017-06-13 8:56,0,0,Padilla sa Maute group: Balak nilang sirain ang buong Marawi para maipakita sa Gitnang Silangan ang kaya nilang gawin. MarawiClash — DZMM…,,,#,874430228629774336,https://twitter.com/Ivan226622/status/874430228629774336,fil
Ivan226622,2017-06-13 8:56,0,0,"Padilla: Kapag nailikas na ang lahat sa Marawi, mawawala na ang komplikasyon (sa operasyon). MarawiClash — DZMM TeleRadyo (DZMMTeleRadyo)…",,,#,874430224154447872,https://twitter.com/Ivan226622/status/874430224154447872,fil
Ivan226622,2017-06-13 8:56,0,0,"Padilla: Unti-unti nating nabatid na may pagpaplanong nangyari sa Marawi City. MarawiClash — DZMM TeleRadyo (DZMMTeleRadyo) June 13, 2017",,,#,874430222178889728,https://twitter.com/Ivan226622/status/874430222178889728,fil
Ivan226622,2017-06-13 8:56,0,0,Padilla sa mga Amerikanong sundalo sa Marawi: Sila rin ang nasa Zamboanga na tumutulong na sa atin. MarawiClash — DZMM TeleRadyo (DZMMTel…,,,#,874430215350571009,https://twitter.com/Ivan226622/status/874430215350571009,fil
IrNkkblhTzPJhGh,2017-06-13 8:55,0,0,,"(['Central Region', ' Singapore'], Location((0.2815436, 32.6270774, 0.0)))",,,874429927055085569,https://twitter.com/IrNkkblhTzPJhGh/status/874429927055085569,#VALUE!
interaksyon,2017-06-13 8:53,1,0,"Maute’s orders: bomb Marawi, Iligan, CDO","(['Philippines'], Location((12.7503486, 122.7312101, 0.0)))",,,874429363596525569,https://twitter.com/interaksyon/status/874429363596525569,fil
itsAaronDane,2017-06-13 8:52,0,0,Idk if magaling lang magsulat ung mga journalist sa marawi pero pls ok lang ba maiyak???,"(['Manila', ' Philippines'], Location((14.5906216, 120.9799696, 0.0)))",,,874429141310820353,https://twitter.com/itsAaronDane/status/874429141310820353,fil
maasmichel,2017-06-13 8:51,13,8,"Vandaag in de Volkskrant, mijn verslag uit Marawi: Hoe een handjevol IS-jongeren de Filipijnse stad Marawi verovert","(['Jakarta'], Location((-6.1753942, 106.827183, 0.0)))",,,874429067340070913,https://twitter.com/maasmichel/status/874429067340070913,nl
krantenkoppen,2017-06-13 8:50,0,0,Hoe een handjevol IS-jongeren de Filipijnse stad Marawi verovert: Niemand kon… D nieuws nl,,,# #,874428688418263041,https://twitter.com/krantenkoppen/status/874428688418263041,nl
D0D0NNA,2017-06-13 8:48,21,32,Can our soldiers in Marawi refuse to fight for lack of sleep? Aminin nyo na. Hindi siya qualified maging pangulo.,,,,874428294946447360,https://twitter.com/D0D0NNA/status/874428294946447360,fil
wawhyrebel,2017-06-13 8:48,0,0,"Tatak Pinoy: PANOORIN: 5 BAHAY NG INA NG MAUTE BROTHERS, SINALAKAY NG PNP AT AFP SA MARAWI",,,#,874428219826487301,https://twitter.com/wawhyrebel/status/874428219826487301,fil
Michukooooy,2017-06-13 8:47,0,1,Lord oy i stop na ang gubat sa Marawi pls,"(['Cagayan de Oro', ' Philippines'], Location((8.42980265, 124.682410212, 0.0)))",,,874427930595676160,https://twitter.com/Michukooooy/status/874427930595676160,fil
wagJanBarla,2017-06-13 8:45,0,1,Marawi > Luneta,,,,874427527317512196,https://twitter.com/wagJanBarla/status/874427527317512196,fil
DZMMTeleRadyo,2017-06-13 8:45,2,3,Padilla sa Maute group: Balak nilang sirain ang buong Marawi para maipakita sa Gitnang Silangan ang kaya nilang gawin. MarawiClash,"(['ABS-CBN', ' Diliman', ' Quezon City'], Location((11.5874907, 122.7520466, 0.0)))",,#,874427359625072640,https://twitter.com/DZMMTeleRadyo/status/874427359625072640,fil
juliosees,2017-06-13 8:44,0,0,"New video by GMA News: UB: Labi ng ilan sa mga marines na namatay sa Marawi, kinuha na ng kanilang pamilya...",,,,874427259871875072,https://twitter.com/juliosees/status/874427259871875072,fil
juliosees,2017-06-13 8:44,0,0,"New video by GMA News: UB: Labi ng ilan sa mga marines na namatay sa Marawi, kinuha na ng kanilang pamilya",,,,874427238342590469,https://twitter.com/juliosees/status/874427238342590469,fil
juliosees,2017-06-13 8:44,0,0,"New video by GMA News: UB: Mga sundalong nasugatan sa Marawi, ililipat sa mas maayos na ospital...",,,,874427225046568960,https://twitter.com/juliosees/status/874427225046568960,fil
juliosees,2017-06-13 8:44,0,0,"New video by GMA News: UB: Batang Bakwit mula sa Marawi, pumanaw dahil sa meningitis",,,,874427220433018880,https://twitter.com/juliosees/status/874427220433018880,fil
juliosees,2017-06-13 8:44,0,0,"New video by GMA News: UB: Sundalong nasawi sa Marawi, ililibing kasama ang namatay na anak",,,,874427217761128448,https://twitter.com/juliosees/status/874427217761128448,fil
juliosees,2017-06-13 8:44,0,0,"New video by GMA News: UB: Mga sundalong nasugatan sa Marawi, ililipat sa mas maayos na ospital",,,,874427202917597184,https://twitter.com/juliosees/status/874427202917597184,fil
juliosees,2017-06-13 8:44,0,0,"New video by GMA News: UB: Batang Bakwit mula sa Marawi, pumanaw dahil sa meningitis 8",,,,874427200094838785,https://twitter.com/juliosees/status/874427200094838785,fil
alfiarnimakhtaf,2017-06-13 8:44,0,0,"upDateMarawi Kelakukan ISIS terakhir di Marawi, mereka memepertontonkan saat mengeksekusi mati 6 warga Nasrani...","(['INDONESIA'], Location((-4.7993356, 114.5632032, 0.0)))",,#,874427159191838720,https://twitter.com/alfiarnimakhtaf/status/874427159191838720,id
TheEliseans,2017-06-13 8:43,0,0,"Di ko nga kayang magkwento! Nakakaiyak ulit eh Uy natuwa ako, si Angel Locsin nagvolunteer sa Marawi. Wala lang katuwa lang.",,,,874426966354444288,https://twitter.com/TheEliseans/status/874426966354444288,fil
Jekarl78,2017-06-13 8:43,0,0,Maute pero nasa marawi fttm,"(['Bay', ' Laguna'], Location((14.1412627, 121.269694228, 0.0)))",@OfficialFTTM,#,874426952613994497,https://twitter.com/Jekarl78/status/874426952613994497,fil
dzrhnews,2017-06-13 8:43,0,0,Arevalo: Yung assistance ng bansang Amerika ay hindi kailangan na direkta sa ground. Hindi kailangan na may sundalong Amerikano sa Marawi.,"(['Manila', ' Philippines'], Location((14.5906216, 120.9799696, 0.0)))",,,874426872272236546,https://twitter.com/dzrhnews/status/874426872272236546,fil
DZMMTeleRadyo,2017-06-13 8:41,1,4,"Padilla: Kapag nailikas na ang lahat sa Marawi, mawawala na ang komplikasyon (sa operasyon). MarawiClash","(['ABS-CBN', ' Diliman', ' Quezon City'], Location((11.5874907, 122.7520466, 0.0)))",,#,874426579937513473,https://twitter.com/DZMMTeleRadyo/status/874426579937513473,fil
azaalicious,2017-06-13 8:40,0,2,Pagpupugay sa mga nasawi natin kaibigan sa Marawi. MarawiHeroes,"(['Philippines'], Location((12.7503486, 122.7312101, 0.0)))",,#,874426271161212928,https://twitter.com/azaalicious/status/874426271161212928,fil
AntonioYel,2017-06-13 8:37,0,0,"hindi ba dapat kasuhan ang intellinges dito ,dahil sa marawi war",,,,874425459424976896,https://twitter.com/AntonioYel/status/874425459424976896,fil
DZMMTeleRadyo,2017-06-13 8:35,1,4,Padilla: Unti-unti nating nabatid na may pagpaplanong nangyari sa Marawi City. MarawiClash,"(['ABS-CBN', ' Diliman', ' Quezon City'], Location((11.5874907, 122.7520466, 0.0)))",,#,874425040254640129,https://twitter.com/DZMMTeleRadyo/status/874425040254640129,fil
akahnnyc,2017-06-13 8:35,0,0,"Presensya ng tropang US sa Marawi City, magdudulot ng higit na kaguluhan sa bansa - PRWC via Instapaper",,@,,874424876412485632,https://twitter.com/akahnnyc/status/874424876412485632,fil
kaminewsph,2017-06-13 8:35,1,1,Nakakalungkot tingnan ang mga kinuhang litrato ni Angel Locsin mula sa Marawi.,"(['Republic of the Philippines'], Location((12.7503486, 122.7312101, 0.0)))",,,874424869869559809,https://twitter.com/kaminewsph/status/874424869869559809,fil
ruben_meteor,2017-06-13 8:33,0,0,Ang mga sundalo natin nakikipagpatatan para lang maawit ang kantang yan sa marawi pero tayo ginagawa lang nating joke,"(['Davao Region', ' Republic of the'], Location((7.0645241, 125.6084143, 0.0)))",,,8.74424E+17,https://twitter.com/ruben_meteor/status/874424478301696000,fil
DZMMTeleRadyo,2017-06-13 8:31,3,3,Padilla sa mga Amerikanong sundalo sa Marawi: Sila rin ang nasa Zamboanga na tumutulong na sa atin. MarawiClash,"(['ABS-CBN', ' Diliman', ' Quezon City'], Location((11.5874907, 122.7520466, 0.0)))",,#,874423872019324929,https://twitter.com/DZMMTeleRadyo/status/874423872019324929,fil
bagmeupjules,2017-06-13 8:30,0,0,"Marine soldier a pimmusay iti agtultuloy a krisis sadiay Marawi City, maiyawid sadiay Benguet | Bombo Radyo...","(['Quezon City'], Location((14.6509905, 121.0486155, 0.0)))",,,874423786426081281,https://twitter.com/bagmeupjules/status/874423786426081281,fil
bangkapos,2017-06-13 8:30,1,0,Panglima TNI: Kekuatan Kelompok ISIS Marawi Berpotensi Masuk Indonesia via bangkapos,"(['bangka belitung'], Location((-2.7577503, 107.583942008, 0.0)))",@,,874423784249282560,https://twitter.com/bangkapos/status/874423784249282560,id
dzrhnews,2017-06-13 8:29,1,0,18 tumakas at nilangoy ang Agus mula sa isang barangay sa Marawi; lima nasagip ng militar | RH24 edmarestabillo,"(['Manila', ' Philippines'], Location((14.5906216, 120.9799696, 0.0)))",@,,874423438483406848,https://twitter.com/dzrhnews/status/874423438483406848,fil
hateisworthless,2017-06-13 8:29,0,0,"Marawi dalam BARU"" 2 minggu ini. Tak terpikir kalau cuma 3000an km dari Jakarta, sudah gak bisa lagi pakai istilah : ISIS masih jauh ! """,,,,874423419089043457,https://twitter.com/hateisworthless/status/874423419089043457,id
dzIQ990,2017-06-13 8:27,1,1,"WATCH: Labi ng 5 Marines na nasawi sa Marawi City, naiuwi na sa kanilang pamilya - | CyrilleCupino","(['Makati City'], Location((14.5591272, 121.0202094, 0.0)))",@,,874422998400466947,https://twitter.com/dzIQ990/status/874422998400466947,fil
christian_enero,2017-06-13 8:26,0,0,hahaha Marawi,"(['Western Visayas', ' Republic of t'], Location((10.67295935, 122.722990873, 0.0)))",,#,874422768850227200,https://twitter.com/christian_enero/status/874422768850227200,fil
jennyyoshie,2017-06-13 8:26,0,0,Kakabilib nga si angel Hindi natakot pumunta sa marawi kahit Alam nya dilikado go p din sya,"(['makati'], Location((14.55459465, 121.021407905, 0.0)))",,,874422564478623744,https://twitter.com/jennyyoshie/status/874422564478623744,fil
cakranewsonline,2017-06-13 8:23,0,0,Lompatan Konflik Marawi Berpotensi Bangunkan Sel Tidur ISIS Indonesia Berita,,,#,874421940257251328,https://twitter.com/cakranewsonline/status/874421940257251328,id
fxld_,2017-06-13 8:23,0,1,Sana tumigil na yung mga nangyayare sa marawi,"(['Winnipeg', ' Manitoba'], Location((49.884017, -97.168579, 0.0)))",,,874421863446872064,https://twitter.com/fxld_/status/874421863446872064,fil
rmnnetworks,2017-06-13 8:21,0,0,"LatestNews Isang bakwit, nasawi dahil sa meningitis sa Marawi City",,,#,874421460718112768,https://twitter.com/rmnnetworks/status/874421460718112768,fil
330Ayu,2017-06-13 8:19,0,0,"Perayaan Kemerdekaan, Filipina Bombardir Militan di Marawi",,,,874420854779768835,https://twitter.com/330Ayu/status/874420854779768835,ms
elmercuriotam,2017-06-13 8:18,0,0,INTERNACIONAL Honran a caídos de Marawi en Filipinas -,"(['Tamaulipas'], Location((23.9891553, -98.7026825, 0.0)))",,#,874420786383204352,https://twitter.com/elmercuriotam/status/874420786383204352,es
dzIQ990,2017-06-13 8:18,0,0,Padilla: ang ating mga kasamahan sa Marawi ay nangailangan ng tulong para sa mga equipment mula sa Amerika |,"(['Makati City'], Location((14.5591272, 121.0202094, 0.0)))",,,874420746218590208,https://twitter.com/dzIQ990/status/874420746218590208,fil
gmanewsfacebook,2017-06-13 8:12,0,0,Iniuwi na sa kani-kanilang probinsya ang mga labi ng lima sa sampung sundalong nasawi sa Marawi City.,,,,874419074792431616,https://twitter.com/gmanewsfacebook/status/874419074792431616,fil
jennyyoshie,2017-06-13 8:12,0,0,Hindi Naman kagustuhan ni Angel na kuhaan sya Ng pic habang tumutulong sa marawi,"(['makati'], Location((14.55459465, 121.021407905, 0.0)))",,,874419046841589760,https://twitter.com/jennyyoshie/status/874419046841589760,fil
1alienfrommars,2017-06-13 8:10,0,0,"tapos ngayon sabihin may intel ang government"" beforehand na may plan of attack sa marawi?""",,,,874418686466994176,https://twitter.com/1alienfrommars/status/874418686466994176,fil
notnoufeigh,2017-06-13 8:08,0,1,Ipadala nalang din natin sa Marawi. Hahahaha,,,,874418227652198400,https://twitter.com/notnoufeigh/status/874418227652198400,fil
marawi_3li_,2017-06-13 8:08,0,0,يارب وإن كنّا مقصرين في الدعاء للأموات فأنت الكريم الذي لا تنسى هب لهُم نعيمًا ورضوانًا وسُرورًا.,,,,874418107271581702,https://twitter.com/marawi_3li_/status/874418107271581702,ar
edmarestabillo,2017-06-13 8:08,0,0,"FlashReport: 5 sa 18 lalaking tumakas at nilangoy ang agus river mula sa war zone ng Marawi, nasagip ng militar sa Brgy. Rorog. 29","(['Quezon City'], Location((14.6509905, 121.0486155, 0.0)))",@,#,874418102691217409,https://twitter.com/edmarestabillo/status/874418102691217409,fil
do_followme,2017-06-13 8:07,0,0,Hoe een handjevol IS-jongeren de Filipijnse stad Marawi verovert news,,,#,874417876698107905,https://twitter.com/do_followme/status/874417876698107905,nl
NokieVillanueva,2017-06-13 8:06,0,0,"Mga MIRON nagrally sa Plaza Miranda, pwede ipadala silang lahat sa Marawi, ipag volunteer sa Evacuation center doon! Mga miron kayo!",,,,874417569154842625,https://twitter.com/NokieVillanueva/status/874417569154842625,fil
prwc_info,2017-06-13 8:05,0,1,"Presensya ng tropang US sa Marawi City, magdudulot ng higit na kaguluhan sa bansa",,,,874417383708008450,https://twitter.com/prwc_info/status/874417383708008450,fil
abiabidapdap,2017-06-13 8:03,0,1,i mean huhuhu gusto kong magsulat tungkol sa independence day tsaka sa marawi but i need elsa's motivation charaughtt,,,,874416908648558594,https://twitter.com/abiabidapdap/status/874416908648558594,fil
El_Jusuf,2017-06-13 8:03,0,0,Pemuka Gereja Katolik Marawi Masih Disandera Ekstremis Maute U,,,,874416825617981440,https://twitter.com/El_Jusuf/status/874416825617981440,id
EmeraldJackie,2017-06-13 7:57,1,3,"Mas makatotohanan ang mga Independence Day sa Marawi, at ibang sulok ng Pilipinas may puso ramdam mo. Yung sa Luneta full of hypocrisy","(['Manila Philippines'], Location((14.5906216, 120.9799696, 0.0)))",,,874415373646417920,https://twitter.com/EmeraldJackie/status/874415373646417920,fil
leomiladriano,2017-06-13 7:57,0,0,May giyera sa Marawi. Mahal ang tuition fee. And hirap ng buhay. Atbpa. Solusyon?? Palitan ang pangalan ng... 908,,,,874415311814045697,https://twitter.com/leomiladriano/status/874415311814045697,fil
elvinuy,2017-06-13 7:54,2,4,High noon salute to Marawi heroes | Maraming salamat sa inyong katapangan at kabayanihan para sa ating kalayaan.,"(['Manila', ' Philippines'], Location((14.5906216, 120.9799696, 0.0)))",,,874414600246108160,https://twitter.com/elvinuy/status/874414600246108160,fil
wil_twits,2017-06-13 7:53,0,0,"Si Duts nga wla din sa Marawi, umurong balls. Kapag etong si Leni nagpunta dun, mas may balls p sya sa idol mo.","(['Manila'], Location((14.5906216, 120.9799696, 0.0)))",,,874414364182233089,https://twitter.com/wil_twits/status/874414364182233089,fil
Ivan226622,2017-06-13 7:51,0,0,"Air strike, nag-umpisa na naman sa Marawi City. | via dzmmPatrol44 MarawiClash — DZMM TeleRadyo (DZMMTeleRadyo) …",,,#,874413901601005569,https://twitter.com/Ivan226622/status/874413901601005569,fil
Angelfryxx,2017-06-13 7:50,0,1,Sana matapos na ang gulo sa Marawi PrayforMarawi,,,#,874413537602314240,https://twitter.com/Angelfryxx/status/874413537602314240,fil
horaciobottino,2017-06-13 7:45,0,0,El terrorismo quiere dividir -Católicos y musulmanes después del ataque a la catedral de Marawi,,,,874412489806667777,https://twitter.com/horaciobottino/status/874412489806667777,es
TrendingBreak,2017-06-13 7:45,0,0,DUTERTE PINIGILANG hindi MALUHA para BIGYANG LAKAS ang PAMILYA ng mga NASAWING SUNDALO sa MARAWI!,"(['Republic of the Philippines'], Location((12.7503486, 122.7312101, 0.0)))",,,874412334852321282,https://twitter.com/TrendingBreak/status/874412334852321282,fil
EnfoqueNoticias,2017-06-13 7:44,0,0,Filipinas rinde homenaje a soldados caídos en Marawi | Enfoque Noticias,"(['Ciudad de M\xc3\xa9xico'], Location((19.4326009, -99.1333416, 0.0)))",,,874412120397492224,https://twitter.com/EnfoqueNoticias/status/874412120397492224,es
kenjitorcende23,2017-06-13 7:43,0,0,"JUNE 13,2017 NAKAKASHOCK NA BALITA BAKBAKAN SA MARAWI CITY PANOORIN NYO 1: via YouTube","(['Davao Region'], Location((7.0645241, 125.6084143, 0.0)))",@,,874411813001154563,https://twitter.com/kenjitorcende23/status/874411813001154563,fil
gus_Tiann,2017-06-13 7:42,15,7,Media A'MAQ Memperlihatkan Video Pertempuran Mujahidin IS melawan Tentara Filipina di Kota Marawi yg telah memasuki hari ke 21.,"(['Indonesia'], Location((-4.7993356, 114.5632032, 0.0)))",,,874411523266945024,https://twitter.com/gus_Tiann/status/874411523266945024,ms
dzrhnews,2017-06-13 7:41,1,0,"WATCH: Armed Forces of the Philippines, maagang sinimulan ang airstrike sa war zone ng Marawi Lanao Del Sur | RH24","(['Manila', ' Philippines'], Location((14.5906216, 120.9799696, 0.0)))",@,,874411330370813953,https://twitter.com/dzrhnews/status/874411330370813953,fil
DZMMTeleRadyo,2017-06-13 7:38,6,6,"Air strike, nag-umpisa na naman sa Marawi City. | via dzmmPatrol44 MarawiClash","(['ABS-CBN', ' Diliman', ' Quezon City'], Location((11.5874907, 122.7520466, 0.0)))",@,#,874410679318454272,https://twitter.com/DZMMTeleRadyo/status/874410679318454272,fil
edmarestabillo,2017-06-13 7:37,0,0,"Armed Forces of the Philippines, maagang sinimulan ang airstrike sa war zone ng Marawi Lanao Del Sur.","(['Quezon City'], Location((14.6509905, 121.0486155, 0.0)))",@,,874410472123936768,https://twitter.com/edmarestabillo/status/874410472123936768,fil
dzbb,2017-06-13 7:37,0,1,"Mga pulis sa ARMM, aminadong magiging pahirapan ang retrieval operations sa mga napaslang sa bakbakan sa Marawi City. | via","(['Republic of the Philippines'], Location((12.7503486, 122.7312101, 0.0)))",@,,874410462057828353,https://twitter.com/dzbb/status/874410462057828353,fil
jerometarriela,2017-06-13 7:36,0,4,"Dear Mr. President, hindi kahinaan ang humingi ng tulong. :) Di maaalmusal ng mga taga-Marawi ang ego mo. :)","(['Republic of the Philippines'], Location((12.7503486, 122.7312101, 0.0)))",,,874410040983080960,https://twitter.com/jerometarriela/status/874410040983080960,fil
ShirleyOrtaleza,2017-06-13 7:35,0,0,LIHIM NG MAUTE AYAW MABULGAR | APAT NA MIYEMBRO INAMBUSH | MARAWI UPDATE,,,,874409912671121412,https://twitter.com/ShirleyOrtaleza/status/874409912671121412,fil
