gerardquibael,2017-06-13 19:32,0,1,GUSTONG PAIMBESTIGAHAN NG ISANG REP YUNG TULONG NA PRINOPROVIDE NG US SA MARAWI? UHMM SIR? GAGO KA PO BA?,"(['Central City'], Location((39.8019322, -105.5141639, 0.0)))",,,874590370557902849,https://twitter.com/gerardquibael/status/874590370557902849,fil
Tikoymanstur,2017-06-13 19:32,0,1,"Uy congressman Zarate, bakit atat na atat ka na malaman anonpapel ng amerika sa marawi? Ang papelan mo bakit yung mga NPA niyo terorista!","(['Legazpi City', ' Bicol Region'], Location((13.1516322, 123.7520096, 0.0)))",,,874590352023330816,https://twitter.com/Tikoymanstur/status/874590352023330816,fil
TVPatrol,2017-06-13 19:32,3,3,"TVPatrol Papel ng US sa military operations sa Marawi, gustong paimbestigahan ni Rep. Zarate sa Kamara","(['Philippines'], Location((12.7503486, 122.7312101, 0.0)))",,# #,874590234486460416,https://twitter.com/TVPatrol/status/874590234486460416,fil
JahMyk20,2017-06-13 19:31,0,0,Nakakaiyak yung limang pulis na muslim na naipit sa bakbakan sa marawi at limang karpeneterong sibilyan na naipit...,"(['Davao City', ' Davao Region'], Location((7.22650725, 125.454887691, 0.0)))",,,874590128207011840,https://twitter.com/JahMyk20/status/874590128207011840,fil
re6arrock,2017-06-13 19:30,0,0,"Bikin Geger!! Sejak 20 Hari Pertempuran di Marawi, Segini Jumlah PNS Yang dinyatakan Hilang.. c","(['Medan'], Location((3.5896654, 98.6738261, 0.0)))",,,874589736609959936,https://twitter.com/re6arrock/status/874589736609959936,id
kaylajoan____,2017-06-13 19:30,1,11,"sarap ipadala sa marawi yung mga taong nag rereply ng ahh"" ""ok"" ""g"" "" k"" mga deputa""","(['worthless'], Location((48.9274185, -124.6205493, 0.0)))",,,874589733757755393,https://twitter.com/kaylajoan____/status/874589733757755393,fil
Bruniq_News,2017-06-13 19:30,0,0,"Bikin Geger!! Sejak 20 Hari Pertempuran di Marawi, Segini Jumlah PNS Yang dinyatakan Hilang.. U","(['Jakarta Capital Region'], Location((-6.1753942, 106.827183, 0.0)))",,,874589721212592128,https://twitter.com/Bruniq_News/status/874589721212592128,id
PTVph,2017-06-13 19:30,0,2,"BALITA: Mga nawawalang guro sa Marawi City, patuloy na hinahanap ng DepEd","(['Philippines'], Location((12.7503486, 122.7312101, 0.0)))",,,874589672508280832,https://twitter.com/PTVph/status/874589672508280832,fil
andreaskorinov,2017-06-13 19:29,60,1,El Ejército filipino afirma que el grupo yihadista Maute llega a controlar el 20 % Marawi,"(['Turkey'], Location((38.9597594, 34.9249653, 0.0)))",,# #,874589434389377024,https://twitter.com/andreaskorinov/status/874589434389377024,es
ChenXing1021,2017-06-13 19:28,0,0,PATAPON SA MARAWI YAAAAAN!!! POTEEEK!!! NKAKA-BEASTMODE S TEH!! Na-BLOCKED N B YAN?!,"(['PH'], Location((12.44249325, 122.160395164, 0.0)))",,,874589256529752064,https://twitter.com/ChenXing1021/status/874589256529752064,fil
TMI_QatarOfc,2017-06-13 19:26,3,1,Tagapagligtas ng marawi TANNER ForKapamilyaProjects,,,,874588752789876738,https://twitter.com/TMI_QatarOfc/status/874588752789876738,fil
missblcn,2017-06-13 19:26,0,0,Oo nga be eh ang sarap pabaril sa mga marawi Bakit,,,#,874588698024615937,https://twitter.com/missblcn/status/874588698024615937,fil
caliswaaagg,2017-06-13 19:25,0,0,jusko murag mas grabe pas gyera sa marawi ang away-away sa armys ug exo-ls hoy kanus a man intawn mo muondang???,,,,874588563484033024,https://twitter.com/caliswaaagg/status/874588563484033024,ceb
Dutchie68105,2017-06-13 19:25,1,2,"11% is frontsoldaat, 40/50% is ondersteunend. Marawi is nog steeds bezig, stad van 110.000, 3 weken al door paar honderd man en ingenomen.",,,,874588511038574592,https://twitter.com/Dutchie68105/status/874588511038574592,nl
adriyeeern,2017-06-13 19:24,0,3,Yung mga paalam ng mga sundalong nasasawi sa marawi. Sad,"(['The Wall'], Location((40.3936801, -79.7861577, 0.0)))",,,874588354255364096,https://twitter.com/adriyeeern/status/874588354255364096,fil
kamaongpilipino,2017-06-13 19:23,0,0,I added a video to a YouTube playlist Mga Armas at Bala narecover galing Terrorista sa Marawi,"(['Eastern Visayas'], Location((11.32782725, 124.997556122, 0.0)))",@,,874587979276324867,https://twitter.com/kamaongpilipino/status/874587979276324867,fil
yourfavwolf,2017-06-13 19:23,0,0,ang mga pamilya bala sng mga napatyan nga army sa marawi dpoga mni yaw dw manguynguy kman bwset,"(['lany tour \xc2\xa0\xf0\x9f\xa5\x80'], Location((49.3555968, 23.5070509, 0.0)))",,,874587932220207104,https://twitter.com/yourfavwolf/status/874587932220207104,ceb
eljan_elleze,2017-06-13 19:21,0,0,PULB*SIN NA ANG MGA PASIMUNO NG MAUTE SIEGE SA MARAWI. DAMI NILANG SINIRANG ARIARIAN PATI BUHAY NG MGA INOSENTENG...,"(['United Kingdom'], Location((25.2232283, 55.1594933009, 0.0)))",,,874587460352606208,https://twitter.com/eljan_elleze/status/874587460352606208,fil
issjndyn,2017-06-13 19:21,0,9,"goodmorning, my name is isis jandre m. jandayan i live in marawi city"" HAHAHAHHAHAAHA yan talaga sinabi ko kanina guys langyang isis HAHAHA""",,,,874587425959313408,https://twitter.com/issjndyn/status/874587425959313408,fil
ChrisDaveTan,2017-06-13 19:19,0,0,Pupunta kau marawi?,,,,874587054373347330,https://twitter.com/ChrisDaveTan/status/874587054373347330,fil
ACamilledeLeon,2017-06-13 19:19,0,1,Kinikilabutan ako lapag pinapakita yung mga nasawing sundalo sa marawi :(,"(['Lucena City', ' Calabarzon'], Location((13.9269297, 121.6131654, 0.0)))",,,874586979400245248,https://twitter.com/ACamilledeLeon/status/874586979400245248,fil
rmnnetworks,2017-06-13 19:18,0,0,"LatestNews Mga pulis na matataba na hindi gumawa ng paraan magbawas ng timbang, binantaang ipapadala sa Marawi City",,,#,874586718900412416,https://twitter.com/rmnnetworks/status/874586718900412416,fil
24OrasGMA,2017-06-13 19:17,1,5,May 300 hanggang 500 daw na mga sibilyang naiipit sa gulo sa Marawi City ayon sa militar.,"(['Philippines'], Location((12.7503486, 122.7312101, 0.0)))",,,874586532778090496,https://twitter.com/24OrasGMA/status/874586532778090496,fil
hatchieerocxs,2017-06-13 19:17,0,0,Ako lang ba tong walang pake sa NBA at sa Marawi News lang nakatutok?,"(['Baguio City', ' Philippines'], Location((14.6481727, 121.0315073, 0.0)))",,,874586495306178560,https://twitter.com/hatchieerocxs/status/874586495306178560,fil
RenovaMidia,2017-06-13 19:15,4,9,Governo das Filipinas informa que extremistas islâmicos controlam apenas 20% da cidade de Marawi,,,#,874585939867312128,https://twitter.com/RenovaMidia/status/874585939867312128,pt
colind_errs,2017-06-13 19:14,0,0,"Dami nagbubuwis buhay sa marawi, habang nagkokontrahan ang mga pulitiko dito sa maynila.",,,,874585865296650241,https://twitter.com/colind_errs/status/874585865296650241,fil
RoxasKentAldrin,2017-06-13 19:13,0,1,Taga marawi to e,,,,874585557237497857,https://twitter.com/RoxasKentAldrin/status/874585557237497857,fil
olfinduhjoy,2017-06-13 19:11,0,0,Sarap itapon ng cellphone ko sa Marawi tsk tsk,"(['kaina jade'], Location((4.9373263, -52.3151534, 0.0)))",,,874584951533969410,https://twitter.com/olfinduhjoy/status/874584951533969410,fil
PTVisMin,2017-06-13 19:10,0,0,"BALITA: COMELEC, mamamahagi ng temporary ID sa Marawi City",,,,874584637850439680,https://twitter.com/PTVisMin/status/874584637850439680,fil
mayebrrnts,2017-06-13 19:09,0,2,Naay 2 ka taga marawi nag transfer samong school,,,,874584596679016448,https://twitter.com/mayebrrnts/status/874584596679016448,fil
marieAnne0915,2017-06-13 19:09,1,1,"Magulo pa din sa Marawi and yet asan si Bato kung Di magboodle fight, bawas taba nman. Tumulong po kau sa AFP para sa peace & order duon.","(['tagaytay'], Location((14.1149812, 120.9635545, 0.0)))",,,874584471214841857,https://twitter.com/marieAnne0915/status/874584471214841857,fil
_eurowi,2017-06-13 19:08,0,0,KAHIBAW KA? LAMI KA IPAAPIL UG PUSIL DIDTOS MARAWI!!,"(['In Reality'], Location((39.2733824, -86.1749925, 0.0)))",,,874584274522873856,https://twitter.com/_eurowi/status/874584274522873856,ceb
troytomarz,2017-06-13 19:08,0,0,Eh hanggang satsat ka lang gurl eh risahontiveros wala ka gawa to end Marawi crisis. Sayang boto ko sa yo! Pwe!,"(['Cebu', ' Philippines'], Location((10.45, 123.84, 0.0)))",@,,874584260295798784,https://twitter.com/troytomarz/status/874584260295798784,fil
BrianSPaguia,2017-06-13 19:07,0,0,Pagpapaalam sa concert ni Ed. First attempt: Failed Reason: Marawi,"(['Caloocan City', ' National Capital Region'], Location((14.6815301, 121.0089111, 0.0)))",,,874584004028112896,https://twitter.com/BrianSPaguia/status/874584004028112896,fil
frncsenriquez,2017-06-13 19:07,0,0,"Punta ka sa Marawi at doon ka sumigaw ng ganyan, Ewan kulang paguwi mo sa Manila puno kanang bukol at pasa sa katawan dhil sa galit nila syo","(['Central Luzon'], Location((15.39091185, 120.685699512, 0.0)))",,,874583988500824064,https://twitter.com/frncsenriquez/status/874583988500824064,fil
Duterte_Tracker,2017-06-13 19:07,0,0,"TERORISTANG MAUTE, NAGSALITA NA KAUGNAY SA PANINIRA SA MARAWI CITY ; MGA KAPWA MUSLIM, SINISI TERORISTANG MAUTE, N…",,,,874583966237569024,https://twitter.com/Duterte_Tracker/status/874583966237569024,fil
okincallejo,2017-06-13 19:06,1,1,"Sila nagpondo ng Maute Rebellion sa Marawi. Siyempre, susuportahan nila ang kanilang local ISIS fans club.","(['Makati City', ' National Capital'], Location((14.5591272, 121.0202094, 0.0)))",,,874583680512999425,https://twitter.com/okincallejo/status/874583680512999425,fil
B4B4YU,2017-06-13 19:05,0,0,naks di mareach. sige lang pareho naman bisaya hahahaha goodluck! kelan class niyo? balik ka pa msu marawi?,,,,874583596207439873,https://twitter.com/B4B4YU/status/874583596207439873,fil
Hatsan2011,2017-06-13 19:04,0,0,"And most probably no Isis in marawi, Abu sayyaf, & BIFF atbp!!!",,,,874583132162334720,https://twitter.com/Hatsan2011/status/874583132162334720,fil
GMA_BP,2017-06-13 19:03,0,1,"VIDEO: 5 pulis at 5 sibilyan na naipit sa bakbakan sa Marawi City, nakaligtas",,,,874583097882189824,https://twitter.com/GMA_BP/status/874583097882189824,fil
24h_tve,2017-06-13 19:03,1,0,Los yihadistas controlan aún una quinta parte de la ciudad de Marawi después de tres semanas de combates,,,,874582966466465792,https://twitter.com/24h_tve/status/874582966466465792,es
MsGubatbakan,2017-06-13 19:02,0,0,Shame dun sa mga taong nananamantala sa sitwasyon ng mga taga Marawi UPStudentPeroHindiAktibista,"(['Batangas', ' Philippines'], Location((13.916453, 121.0864884, 0.0)))",,#,874582837583683584,https://twitter.com/MsGubatbakan/status/874582837583683584,fil
exoshitdoes,2017-06-13 19:02,0,1,TANGINA MO MAMATAY KANA SANA MABARIL KA NG LIGAW NA BALA GALING MARAWI HAYOP KA TANGINA MO,,,,874582767329099777,https://twitter.com/exoshitdoes/status/874582767329099777,fil
Jerilynbrgd,2017-06-13 19:02,0,1,Sana yang mga nag kagaradan sa marawi manatiling bayani ta bako tong ngunyan lang ina idolize tapos after a week or month lingaw na,"(['ph.'], Location((12.44249325, 122.160395164, 0.0)))",,,874582765957562368,https://twitter.com/Jerilynbrgd/status/874582765957562368,fil
Jerilynbrgd,2017-06-13 19:02,0,0,lalo na mga sundalo saka pulis na sinasabak sa marawi,"(['ph.'], Location((12.44249325, 122.160395164, 0.0)))",,,874582742930923525,https://twitter.com/Jerilynbrgd/status/874582742930923525,fil
dairo_fernando,2017-06-13 19:01,1,2,Hwag maniwala jan.. Sa dami ng mga Kalaban at mga armas nkapasok sa marawi.. Di man lang na detect? Natulog sa kangkungan ang tawag jan.,,,,874582615503757312,https://twitter.com/dairo_fernando/status/874582615503757312,fil
maae_abdon,2017-06-13 19:01,0,0,Kailan po ba maalis sa balita ang tungkol sa marawi?,"(['Milaor', ' Bicol Region'], Location((13.5969368, 123.1805981, 0.0)))",,,874582528971087872,https://twitter.com/maae_abdon/status/874582528971087872,fil
PTVisMin,2017-06-13 19:00,0,0,"BALITA: AFP-AMWSLAI, namigay ng tulong sa kaanak ng mga sundalong nasawi sa Marawi City",,,,874582128406691841,https://twitter.com/PTVisMin/status/874582128406691841,fil
cvernsm,2017-06-13 18:58,0,0,What r u saying edcel lagman gobyerno pa may kasalanan kung kya nilusob ng maute ang marawi. I dont understand u why r u protecting maute,"(['Palawan', ' Philippines'], Location((10.0, 118.75, 0.0)))",,,874581709118820352,https://twitter.com/cvernsm/status/874581709118820352,fil
JuanSinag,2017-06-13 18:58,0,1,"RealitiesOfWar: sundalo ka sa Marawi, at babarilin ka ng 12-yr old na bata. Babarilin mo ang bata o i-sugal ang buhay mo at mga kasama mo?","(['Quezon City'], Location((14.6509905, 121.0486155, 0.0)))",,#,874581697773182976,https://twitter.com/JuanSinag/status/874581697773182976,fil
kntslzr,2017-06-13 18:57,0,0,Hindi kase sila 'yung mga lumalaban para mabawi 'yung Marawi eh.,,,,874581543926104064,https://twitter.com/kntslzr/status/874581543926104064,fil
kntslzr,2017-06-13 18:57,1,2,Tangina neto ni Edcel Lagman. Anong hindi rebellion ang nangyayare sa Marawi? Gago.,,,,874581393937883136,https://twitter.com/kntslzr/status/874581393937883136,fil
UpdatesKissMarc,2017-06-13 18:57,36,11,Thank yoooou so much sa mga nagpadala ng mga damit for marawi evacuees. Sobrang Thank yoooou. ItsUnisilverTime KISSMARC,"(['Republic of the Philippines'], Location((12.7503486, 122.7312101, 0.0)))",,,874581368025501696,https://twitter.com/UpdatesKissMarc/status/874581368025501696,fil
egdsgn,2017-06-13 18:56,0,0,"Mga nawawalang guro sa Marawi City, patuloy na hinahanap ng DepEd","(['Davao City', ' Davao Region'], Location((7.22650725, 125.454887691, 0.0)))",,,874581337243623425,https://twitter.com/egdsgn/status/874581337243623425,fil
marcoismyfriend,2017-06-13 18:56,0,0,"“Padala na lang lahat ng kontra sa Marawi. Sila tumapos ng gulo,” ani Sen. Sotto. U","(['Cebu City', ' Philippines'], Location((10.3090298, 123.8930839, 0.0)))",,,874581267861430277,https://twitter.com/marcoismyfriend/status/874581267861430277,fil
katarinross,2017-06-13 18:56,0,1,dili daw imartial law ang buong mindanao kay wala daw crisis sa ubang ay wow so nagtuo mo na di sila maggawas sa marawi BRIGHT KAAYO BRIGHT,"(['BEBE CLUB', ' GALAXY'], Location((-34.7437224, -58.3888860635, 0.0)))",,,874581255672569856,https://twitter.com/katarinross/status/874581255672569856,ceb
egdsgn,2017-06-13 18:56,0,0,"Mga residenteng nasaktan at nasugatan sa krisis sa Marawi, bibigyang-ayuda ng PCSO","(['Davao City', ' Davao Region'], Location((7.22650725, 125.454887691, 0.0)))",,,874581212035260417,https://twitter.com/egdsgn/status/874581212035260417,fil
Markven_CDO,2017-06-13 18:55,1,1,"What the F !!! No rebellion ? Ano tawag nyo sa ngyayari sa Marawi , may mga foreign Terrorist na ! MARKVEN ForASAPChillOut","(['Cagayan De Oro City', ' Northern'], Location((8.42980265, 124.682410212, 0.0)))",,,874581085279076354,https://twitter.com/Markven_CDO/status/874581085279076354,fil
PinoyTeleserye1,2017-06-13 18:55,0,0,"Watch: BP: Fundraising concert, isinagawa sa Davao City para sa mga naapektuhan ng bakbakan sa Marawi",,,,874581051116367872,https://twitter.com/PinoyTeleserye1/status/874581051116367872,fil
jambalnaja,2017-06-13 18:55,0,0,"Anhi sa mo diri, ddto jd sa marawi","(['Philippines'], Location((12.7503486, 122.7312101, 0.0)))",,,874581025132650496,https://twitter.com/jambalnaja/status/874581025132650496,ceb
berylbenenoso,2017-06-13 18:55,0,1,Nigara mo ay. Ilabay tamos marawi ron na,,,,874581024230866944,https://twitter.com/berylbenenoso/status/874581024230866944,fil
Politiko_Ph,2017-06-13 18:55,1,3,Yan ang magkaibigan! jvejercito hopes US aid in Marawi will help restore warm bilateral ties with PH,,@,,874580957965107201,https://twitter.com/Politiko_Ph/status/874580957965107201,fil
maxangelo987,2017-06-13 18:55,0,0,Tutol ang ilang grupo sa pagbibigay ng technical assistance ng mga sundalong Amerikano sa ating militar sa Marawi …,,,,874580932581314560,https://twitter.com/maxangelo987/status/874580932581314560,fil
katarinross,2017-06-13 18:55,0,0,jusko unsa nalang diay kung dili rebellion//invasion ang sa marawi punyeta droga pa more nkklk,"(['BEBE CLUB', ' GALAXY'], Location((-34.7437224, -58.3888860635, 0.0)))",,,874580908904374272,https://twitter.com/katarinross/status/874580908904374272,ceb
MackeeMacky,2017-06-13 18:54,0,0,Uy putek papuntang Marawi ung Sulat ko,"(['bed'], Location((22.432375, 69.8997711, 0.0)))",,,874580850528079872,https://twitter.com/MackeeMacky/status/874580850528079872,fil
jambalnaja,2017-06-13 18:54,0,0,Atay murag naa sila sa marawi,"(['Philippines'], Location((12.7503486, 122.7312101, 0.0)))",,,874580838662287361,https://twitter.com/jambalnaja/status/874580838662287361,fil
def_filipino,2017-06-13 18:54,0,0,"“Padala na lang lahat ng kontra sa Marawi. Sila tumapos ng gulo,” ani Sen. Sotto.","(['Philippines'], Location((12.7503486, 122.7312101, 0.0)))",,,874580793103986688,https://twitter.com/def_filipino/status/874580793103986688,fil
SirChrisEmman13,2017-06-13 18:54,0,0,Ung mga against sa Martial Law kayo na ang pumunta sa Marawi. Ung mga ano jan. Kayo na,,,,874580767833075712,https://twitter.com/SirChrisEmman13/status/874580767833075712,fil
Matahumnz,2017-06-13 18:54,0,0,Ipadala na si Risa Hontiveros sa Marawi para humarap sa maute at isis.,,,,874580676426686465,https://twitter.com/Matahumnz/status/874580676426686465,fil
k_violet25,2017-06-13 18:54,0,0,titosottoreal eto po una niong ipadala sa marawi! Ang dami ng namamatay na sundalo. Imbes na tumulong nakakadagdag lang sa problema,"(['Quezon City'], Location((14.6509905, 121.0486155, 0.0)))",@,,874580648891109377,https://twitter.com/k_violet25/status/874580648891109377,fil
aiiloveme,2017-06-13 18:53,0,0,"Truth is, nahuman nlang ang NBA17 wala pa gehapon na totally end ang Marawi Seige — feeling sad",,,,874580362894102528,https://twitter.com/aiiloveme/status/874580362894102528,ceb
gangbadoy,2017-06-13 18:52,2,2,Accdg to DZMMTeleRadyo report just now on AM radio-DTI still mtg on this. Hindi yan pwede! Marawi is Beleaguered enough. SO opportunistic!,"(['Manila', ' Philippines'], Location((14.5906216, 120.9799696, 0.0)))",@,,874580345579905024,https://twitter.com/gangbadoy/status/874580345579905024,fil
stuffandplayx,2017-06-13 18:52,0,0,Retweeted ABS-CBN News ( ABSCBNNews): Bayan Muna seeks House probe of US role in Marawi siege...,,@,,874580308791894016,https://twitter.com/stuffandplayx/status/874580308791894016,fil
dzIQ990,2017-06-13 18:52,1,0,"Vice President Leni Robredo, nagpasalamat sa US dahil sa pagtulong sa Marawi City | albarmarch22","(['Makati City'], Location((14.5591272, 121.0202094, 0.0)))",@,,874580143255236608,https://twitter.com/dzIQ990/status/874580143255236608,fil
itsrodsmya_,2017-06-13 18:51,0,1,Napapaiyak ako pati si mommy sa mga sundalong namatay sa Marawi. Ahays,"(['Republic of the Philippines'], Location((12.7503486, 122.7312101, 0.0)))",,,874579990691454976,https://twitter.com/itsrodsmya_/status/874579990691454976,fil
Ivan226622,2017-06-13 18:51,0,0,"Bayan Muna seeks House probe of US role in Marawi siege 90 MarawiClash — ABS-CBN News (ABSCBNNews) June 13, 2017",,,#,874579990268039169,https://twitter.com/Ivan226622/status/874579990268039169,fil
banderainquirer,2017-06-13 18:51,1,0,P10B supplemental budget para sa Marawi via banderainquirer,"(['Makati City', ' Philippines'], Location((14.5591272, 121.0202094, 0.0)))",@,,874579884818825216,https://twitter.com/banderainquirer/status/874579884818825216,fil
_QuePasaChica_,2017-06-13 18:50,13,18,"*{%|^|*>\>}* itong CPNP! Habang pulis nya ay namamaril ng bihag sa Marawi, he's focusing on losing weight?","(['Hong Kong'], Location((22.2793278, 114.1628131, 0.0)))",,#,874579849116921856,https://twitter.com/_QuePasaChica_/status/874579849116921856,fil
angelikabianzon,2017-06-13 18:50,0,0,ang haharot nyo dalhin ko kayo sa Marawi e :<<<,"(['Riyadh \xc2\xa0\xf0\x9f\x90\x89'], Location((15.5835188, 32.5677069, 0.0)))",,,874579754082381824,https://twitter.com/angelikabianzon/status/874579754082381824,fil
ABSCBNNews,2017-06-13 18:50,7,14,Bayan Muna seeks House probe of US role in Marawi siege 90 MarawiClash,"(['Manila', ' Philippines'], Location((14.5906216, 120.9799696, 0.0)))",,#,874579604304003072,https://twitter.com/ABSCBNNews/status/874579604304003072,fil
PTVph,2017-06-13 18:50,1,4,"BALITA: Mga residenteng nasaktan at nasugatan sa krisis sa Marawi, bibigyang-ayuda ng PCSO","(['Philippines'], Location((12.7503486, 122.7312101, 0.0)))",,,874579603104256001,https://twitter.com/PTVph/status/874579603104256001,fil
DZMMTeleFeed,2017-06-13 18:50,0,0,"Bilang ng mga sibilyan na nailigtas sa Marawi, 1,628 na",,,,874579602227769344,https://twitter.com/DZMMTeleFeed/status/874579602227769344,fil
Gabgrielle,2017-06-13 18:48,5,6,Talunan.Kinain mo yabang mo. Tinablan ka na ba sa bilang ng namamatay sa Marawi? Duwag ka Duterte. Wala kang saysay sa bayan.,,,,874579305258340353,https://twitter.com/Gabgrielle/status/874579305258340353,fil
PolhukamRI,2017-06-13 18:48,0,2,"2.Dalam pertemuan tersebut, kedua negara membicarakan mengenai masalah keamanan khususnya basis ISIS yang ada di Marawi, Filipina","(['Jakarta Pusat', ' DKI Jakarta'], Location((-6.18233995, 106.842871536, 0.0)))",,,874579108478328837,https://twitter.com/PolhukamRI/status/874579108478328837,id
NawiCPA2020,2017-06-13 18:47,0,0,Matagal na namin alam na may ISIS sa marawi kasi may nagwawagayway doon na flag na kulay itim tapos late lang sinabi sa balita about sa ISIS,"(['Calabarzon'], Location((14.16441485, 121.353652374, 0.0)))",,,874578874880860160,https://twitter.com/NawiCPA2020/status/874578874880860160,fil
misschaningg,2017-06-13 18:46,0,1,"Grabi naman mga gatinda sa marawi oy, 225 per kilo jud ang bugas. Luoy na gani, mahalon pajud","(['Outer Space'], Location((52.61713175, -1.10132823869, 0.0)))",,,874578726880657409,https://twitter.com/misschaningg/status/874578726880657409,ceb
egdsgn,2017-06-13 18:46,0,0,"COMELEC, mamamahagi ng temporary ID sa Marawi City","(['Davao City', ' Davao Region'], Location((7.22650725, 125.454887691, 0.0)))",,,874578620324425728,https://twitter.com/egdsgn/status/874578620324425728,fil
egdsgn,2017-06-13 18:45,0,0,"AFP-AMWSLAI, namigay ng tulong sa kaanak ng mga sundalong nasawi sa Marawi City","(['Davao City', ' Davao Region'], Location((7.22650725, 125.454887691, 0.0)))",,,874578529941413889,https://twitter.com/egdsgn/status/874578529941413889,fil
egdsgn,2017-06-13 18:45,0,0,"NEWS BREAK: P700-K, tatanggaping benepisyo ng pamilya ng 13 marines na nasawi sa Marawi City","(['Davao City', ' Davao Region'], Location((7.22650725, 125.454887691, 0.0)))",,,874578492989591552,https://twitter.com/egdsgn/status/874578492989591552,fil
NawiCPA2020,2017-06-13 18:45,0,0,Galing kasi ako sa mindano take note taga Lanao del sur din ako.. Nakapunta na ako sa marawi city.,"(['Calabarzon'], Location((14.16441485, 121.353652374, 0.0)))",,,874578412555218944,https://twitter.com/NawiCPA2020/status/874578412555218944,fil
kjeweljade,2017-06-13 18:45,0,0,jusko 200/kilo ng bigas binibenta sa marawi??!! hustisya prang awa naman,,,,874578410562920452,https://twitter.com/kjeweljade/status/874578410562920452,fil
reallyjam,2017-06-13 18:44,0,0,Ang sakit sa kalooban panoorin yung balita about sa Marawi. Yung mga bata pati na yung mga parents at matatanda.,,,#,874578339134005248,https://twitter.com/reallyjam/status/874578339134005248,fil
AnneCabalce,2017-06-13 18:44,0,1,so sad :( :( feeling ko tlga cancelled yan dahil sa marawi at ung sa resorts world,"(['philippines'], Location((12.7503486, 122.7312101, 0.0)))",,,874578275372158977,https://twitter.com/AnneCabalce/status/874578275372158977,fil
JeyRhyner,2017-06-13 18:44,0,0,"dami na kasing namamatay na sundalo eh, huhu, kaya sana matapos na yung sa Marawi.","(['\xec\x84\x9c\xec\x9a\xb8'], Location((37.5666791, 126.9782914, 0.0)))",,,874578131935305730,https://twitter.com/JeyRhyner/status/874578131935305730,fil
NariaAbbey,2017-06-13 18:43,0,1,"Kung totoo mang may nagbebenta ng PHP 200 per kilo ng bigas sa Marawi City, ang kakapal ng mga mukha ninyo. Anong kagaguhan 'yan?","(['MNL'], Location((14.5121499, 121.022046716, 0.0)))",,,874578077069660160,https://twitter.com/NariaAbbey/status/874578077069660160,fil
Camszh,2017-06-13 18:43,0,0,OA naman yang bigas na yan sa Marawi.,"(['Valenzuela City'], Location((37.7751808, -4.220174, 0.0)))",,,874577968093208576,https://twitter.com/Camszh/status/874577968093208576,fil
AdrienneV_13,2017-06-13 18:43,0,4,Parehong nakatataba at nakadudurog ng puso na makitang inililibing ang ating mga sundalong namamayani sa digmaan para sa kalayaan ng Marawi.,,,,874577917614759938,https://twitter.com/AdrienneV_13/status/874577917614759938,fil
TVPatrol,2017-06-13 18:43,3,2,"TVPatrol DTI, nakatanggap ng ulat na may nagtitinda ng bigas sa Marawi na nagkakahalaga ng P225/kilo MarawiClash | ulat ni du","(['Philippines'], Location((12.7503486, 122.7312101, 0.0)))",@,# #,874577869405552640,https://twitter.com/TVPatrol/status/874577869405552640,fil
gummytaep,2017-06-13 18:42,0,0,ANO? 225 ISANG KILONG BIGAS? TAS SA MARAWI PA? K LANG KAYO?,"(['ph'], Location((12.44249325, 122.160395164, 0.0)))",,,874577819577102336,https://twitter.com/gummytaep/status/874577819577102336,fil
berlynwild,2017-06-13 18:42,0,0,Kung mayaman lang ako nako ako na nag sponsor pagaaral mga bata sa marawi anuna,"(['MNL PH'], Location((14.5121499, 121.022046716, 0.0)))",,,874577784709931008,https://twitter.com/berlynwild/status/874577784709931008,fil
PinoyAkoBlog,2017-06-13 18:42,28,39,"Dear Solicitor Gen. Calida, Kung alam niyo na pala 5 days before the Marawi siege, bakit hindi tayo nakapaghanda?","(['National Capital Region', ' Repub'], Location((14.5736108, 121.0329706, 0.0)))",,,874577709317332994,https://twitter.com/PinoyAkoBlog/status/874577709317332994,fil
MyungPWINCHESS,2017-06-13 18:41,0,0,Sobrang sad ng nangyayari sa Marawi kawawa naman ung nga kids na hindi makapasok sa school naiiyak ako,"(['ph'], Location((12.44249325, 122.160395164, 0.0)))",,,874577525963317248,https://twitter.com/MyungPWINCHESS/status/874577525963317248,fil
