bworldph,2017-06-20 11:27,de vera ched will release within this week an advisory telling schools to immediately accept students from marawi  via ipcigaral,"(['Philippines'], Location((12.7503486, 122.7312101, 0.0)))",en,0.135088,0.48804,0.167749,0.186977,0.101093,"['joy', 0.48804]"
ipcigaral,2017-06-20 11:26,de vera ched will release within this week an advisory telling schools to immediately accept students from marawi,"(['Republic of the Philippines'], Location((12.7503486, 122.7312101, 0.0)))",en,0.213237,0.468772,0.155295,0.14339,0.07403,"['joy', 0.468772]"
gmanews,2017-06-20 11:26,de vera ched to issue advisory to schools to immediately accept transferees affected by marawi crisis even with incomplete documents,"(['Philippines'], Location((12.7503486, 122.7312101, 0.0)))",en,0.252008,0.021884,0.57238,0.351319,0.11638,"['sadness', 0.57238]"
Makoy_Palaboy,2017-06-20 11:25,while marawi is still in chaos leni is socializing abroad,"(['Tagbilaran City', ' Bohol'], Location((14.6616744, 121.0478608, 0.0)))",en,0.285932,0.179846,0.154931,0.225143,0.111153,"['anger', 0.285932]"
gmanews,2017-06-20 11:25,de vera on schools affected by marawi problem mindanao state university marawi and iligan open their classes in august  trishamacas,"(['Philippines'], Location((12.7503486, 122.7312101, 0.0)))",en,0.069349,0.037972,0.639089,0.390533,0.082749,"['sadness', 0.639089]"
trishamacas,2017-06-20 11:25,de vera on schools affected by marawi problem mindanao state university marawi and iligan open their classes in august,"(['Republic of the Philippines'], Location((12.7503486, 122.7312101, 0.0)))",en,0.069349,0.037972,0.639089,0.390533,0.082749,"['sadness', 0.639089]"
rapplerdotcom,2017-06-20 11:23,ongoing pnp holds press briefing on marawi situation,"(['Philippines'], Location((12.7503486, 122.7312101, 0.0)))",en,0.176301,0.369555,0.245403,0.174494,0.136663,"['joy', 0.369555]"
phnews24x7,2017-06-20 11:16,airstrikes continue as marawi conflict enters 29th day ,"(['Philippines'], Location((12.7503486, 122.7312101, 0.0)))",en,0.138932,0.213216,0.531767,0.041432,0.077332,"['sadness', 0.531767]"
JhessetEnanoINQ,2017-06-20 11:15,isko from marawi is valedictory speaker at up diliman graduation,"(['Republic of the Philippines'], Location((12.7503486, 122.7312101, 0.0)))",en,0.062234,0.258622,0.075171,0.480834,0.005081,"['fear', 0.480834]"
gogreenr12,2017-06-20 11:13,house raises p13 million for marawi victims by gogreenr12,"(['Philippines'], Location((12.7503486, 122.7312101, 0.0)))",en,0.056002,0.151995,0.574275,0.104499,0.304533,"['sadness', 0.574275]"
gmanews,2017-06-20 11:11,cotabato district jail inmates skip meal for marawi evacuees,"(['Philippines'], Location((12.7503486, 122.7312101, 0.0)))",en,0.080649,0.131395,0.289596,0.045382,0.320024,"['disgust', 0.320024]"
reycarts,2017-06-20 11:01,pride of marawi is the class valedictorian of up diliman iskolarngbayan up isko,"(['General Santos City'], Location((6.1265778, 125.1985022, 0.0)))",en,0.118808,0.56514,0.152393,0.049175,0.138863,"['joy', 0.56514]"
dhess02,2017-06-20 11:01,lets help our fellow filipinos in marawi please do check the poster on how you can send your donation thank,"(['Philippines'], Location((12.7503486, 122.7312101, 0.0)))",en,0.029971,0.295881,0.034105,0.028678,0.017844,"['joy', 0.295881]"
ffreethinkers,2017-06-20 10:58,sc ruling on martial law wont stop offensive in marawi,"(['Philippines'], Location((12.7503486, 122.7312101, 0.0)))",en,0.048425,0.030312,0.051762,0.125621,0.070436,"['fear', 0.125621]"
bagmeupjules,2017-06-20 10:57,marawi in particular has become the new sexy destination for jihad whoever thought of that line dot please,"(['Quezon City'], Location((14.6509905, 121.0486155, 0.0)))",en,0.054328,0.670601,0.068304,0.055023,0.124572,"['joy', 0.670601]"
obphil,2017-06-20 10:52,4800 meals for marawi just arrived thanks centurytuna for helping us feed more families affected by marawiclash,"(['Philippines'], Location((12.7503486, 122.7312101, 0.0)))",en,0.032175,0.308057,0.180885,0.008307,0.045223,"['joy', 0.308057]"
KayaNatinPH,2017-06-20 10:37,busy day sorting goods to ship to marawi at the kaya natin office drop your donations today at 21 kaliraya st brgy doa josefa qc 9,"(['Quezon City', ' Philippines'], Location((14.6509905, 121.0486155, 0.0)))",en,0.038007,0.414727,0.431543,0.07013,0.012556,"['sadness', 0.431543]"
philmonitor,2017-06-20 10:34,maute terror group use drones to flee incoming militaries in marawi city  via philmonitor,"(['Republic of the Philippines'], Location((12.7503486, 122.7312101, 0.0)))",en,0.031531,0.020297,0.149558,0.81266,0.112866,"['fear', 0.81266]"
alter_egow,2017-06-20 10:33,now delegates from up diliman in marawi city hold a press forum at the cmc auditorium 1,"(['National Capital Region'], Location((14.5736108, 121.0329706, 0.0)))",en,0.075272,0.094519,0.250515,0.120565,0.119036,"['sadness', 0.250515]"
gmanews,2017-06-20 10:29,maute terrorists in marawi city also have drones to monitor advancing government troops  via junveneracion,"(['Philippines'], Location((12.7503486, 122.7312101, 0.0)))",en,0.056925,0.052943,0.147779,0.431151,0.23411,"['fear', 0.431151]"
WilsonLeeFlores,2017-06-20 10:27,i suggest that this school be totally rebuilt  even beautified in marawi city as symbol not only of tolerance but of hope  resilience,"(['Metro Manila', ' Philippines'], Location((14.5736108, 121.0329706, 0.0)))",en,0.072727,0.332882,0.217301,0.222358,0.187771,"['joy', 0.332882]"
LOCALNEWSNgayon,2017-06-20 10:26,cotabato district jail inmates skip meal for marawi evacuees  read via gma news,"(['Philippines'], Location((12.7503486, 122.7312101, 0.0)))",en,0.037016,0.169015,0.356297,0.098637,0.474401,"['disgust', 0.474401]"
jun_veneracion,2017-06-20 10:26,maute terrorists in marawi city also have drones to monitor advancing government troops,"(['Philippines'], Location((12.7503486, 122.7312101, 0.0)))",en,0.080389,0.041794,0.124158,0.326503,0.178522,"['fear', 0.326503]"
WilsonLeeFlores,2017-06-20 10:24,how is the dansalan college of marawi city totally destroyed or partially i read news about attack by terrorists there,"(['Metro Manila', ' Philippines'], Location((14.5736108, 121.0329706, 0.0)))",en,0.337246,0.00877,0.25305,0.581119,0.214806,"['fear', 0.581119]"
DPWHph,2017-06-20 10:22,dpwh extends helping hands to idps affected by marawi city armed conflict 2,"(['Port Area', ' Manila', ' PH'], Location((14.5889597, 120.9686124, 0.0)))",en,0.049714,0.07703,0.185849,0.569038,0.092434,"['fear', 0.569038]"
beam_armm,2017-06-20 10:21,australia will provide humanitarian support for marawi,"(['Cotabato City'], Location((7.1970344, 124.2351714, 0.0)))",en,0.050113,0.154518,0.086443,0.04289,0.082748,"['joy', 0.154518]"
phnews24x7,2017-06-20 10:16,cotabato district jail inmates skip meal for marawi evacuees ,"(['Philippines'], Location((12.7503486, 122.7312101, 0.0)))",en,0.080649,0.131395,0.289596,0.045382,0.320024,"['disgust', 0.320024]"
pnagovph,2017-06-20 10:10,comelec ready to issue voters certification to marawi residents  inanph ,"(['Quezon City'], Location((14.6509905, 121.0486155, 0.0)))",en,0.124768,0.218078,0.306774,0.071452,0.264574,"['sadness', 0.306774]"
soniapddm,2017-06-20 10:09,in marawi city muslims shelter christians from jihadist militants  weareallbrothersandsisters nototerrorism,"(['Manila', ' Philippines'], Location((14.5906216, 120.9799696, 0.0)))",en,0.218314,0.166522,0.298854,0.150281,0.366379,"['disgust', 0.366379]"
PHLNewsOnline,2017-06-20 10:08,gma news airstrikes continue as marawi conflict enters 29th day,"(['Philippines'], Location((12.7503486, 122.7312101, 0.0)))",en,0.121309,0.177298,0.625469,0.067696,0.108998,"['sadness', 0.625469]"
PHLNewsOnline,2017-06-20 10:08,gma news analyst links dutertes incognito trip to marawi conflict,"(['Philippines'], Location((12.7503486, 122.7312101, 0.0)))",en,0.12111,0.169366,0.418288,0.143568,0.020984,"['sadness', 0.418288]"
LOCALNEWSNgayon,2017-06-20 10:06,airstrikes continue as marawi conflict enters 29th day  read via gma news,"(['Philippines'], Location((12.7503486, 122.7312101, 0.0)))",en,0.057049,0.252715,0.535366,0.126653,0.154686,"['sadness', 0.535366]"
greensubmariner,2017-06-20 10:05,hows marawi mrs robredo,"(['Manila', ' Philippines'], Location((14.5906216, 120.9799696, 0.0)))",en,0.085791,0.184333,0.161776,0.091244,0.066051,"['joy', 0.184333]"
gogreenr12,2017-06-20 10:04,marawi battle zone urban warfare challenges ph military by gogreenr12,"(['Philippines'], Location((12.7503486, 122.7312101, 0.0)))",en,0.03928,0.079476,0.111987,0.353642,0.048231,"['fear', 0.353642]"
PhilDefNews,2017-06-20 10:03,the philippine army in zamboanga 2013 and marawi 2017,"(['Manila', ' Philippines'], Location((14.5906216, 120.9799696, 0.0)))",en,0.261587,0.017365,0.241809,0.133709,0.403137,"['disgust', 0.403137]"
almimco,2017-06-20 10:03,atmgunfire and bombs again pray for marawi,"(['Manila', 'Philippines'], Location((14.5906216, 120.9799696, 0.0)))",en,0.077078,0.018862,0.400961,0.649748,0.176547,"['fear', 0.649748]"
hotel_jb,2017-06-20 9:59,duterte no failure of intelligence in marawi crisis,"(['pagadian city'], Location((7.8249717, 123.4365816, 0.0)))",en,0.111409,0.027909,0.216438,0.484899,0.24968,"['fear', 0.484899]"
AranasRv,2017-06-20 9:52,stay strong marawi,"(['South Cotabato'], Location((6.166667, 125.0, 0.0)))",en,0.040045,0.58441,0.138967,0.067319,0.039368,"['joy', 0.58441]"
valenzuelacity,2017-06-20 9:47,valenzuela city cares for marawi and taraka the city government of valenzuela in cooperation with the office of,"(['Valenzuela City', ' Philippines'], Location((37.7751808, -4.220174, 0.0)))",en,0.157745,0.096616,0.348864,0.060477,0.12901,"['sadness', 0.348864]"
inquirer_libre,2017-06-20 9:40,icymi frustration probably made duterte say he would pull out marawi troops,"(['Philippines'], Location((12.7503486, 122.7312101, 0.0)))",en,0.306924,0.032579,0.573172,0.281421,0.125121,"['sadness', 0.573172]"
JPValdez2015,2017-06-20 9:34,manila standard headlines tuesday  june 20 maute asg men using shabu  afp another marawi ruled out,"(['Isabela', ' Philippines'], Location((17.0, 122.0, 0.0)))",en,0.030479,0.107642,0.220654,0.091265,0.156097,"['sadness', 0.220654]"
PhilDefNews,2017-06-20 9:33,re battle of marawi on its fifth week of combat,"(['Manila', ' Philippines'], Location((14.5906216, 120.9799696, 0.0)))",en,0.172434,0.318828,0.260436,0.185141,0.021048,"['joy', 0.318828]"
egdsgn,2017-06-20 9:31,over p100m worth of shabu recovered inmarawi,"(['Davao City', ' Davao Region'], Location((7.22650725, 125.454887691, 0.0)))",en,0.047259,0.277357,0.055633,0.147792,0.042151,"['joy', 0.277357]"
JPValdez2015,2017-06-20 9:30,manila bulletin headlines tuesday  june 20 19 marawi evacuees die ph indonesia malaysia open borders in,"(['Isabela', ' Philippines'], Location((17.0, 122.0, 0.0)))",en,0.010549,0.039865,0.355039,0.282077,0.046083,"['sadness', 0.355039]"
egdsgn,2017-06-20 9:27,news break solons raise p13m for marawivictims,"(['Davao City', ' Davao Region'], Location((7.22650725, 125.454887691, 0.0)))",en,0.138719,0.023395,0.782756,0.150724,0.17011,"['sadness', 0.782756]"
storyahiko,2017-06-20 9:25,over p100m worth of shabu recovered in marawi,"(['Manila City'], Location((14.5906216, 120.9799696, 0.0)))",en,0.047259,0.277357,0.055633,0.147792,0.042151,"['joy', 0.277357]"
dswdfo5,2017-06-20 9:24,president duterte to lead distribution of food assistance to marawi idps president rodrigo duterte will lead the,"(['Legazpi City', ' Bicol Region'], Location((13.1516322, 123.7520096, 0.0)))",en,0.059488,0.082798,0.06935,0.023178,0.184181,"['disgust', 0.184181]"
cjlopezmercado,2017-06-20 9:17,kin of fallen marines in marawi city to get benefits worth php700 via conceptgrp,"(['Makati City'], Location((14.5591272, 121.0202094, 0.0)))",en,0.029711,0.526869,0.156883,0.108617,0.069617,"['joy', 0.526869]"
cjlopezmercado,2017-06-20 9:17,islinked militants killing enslaving civiliansin marawi via conceptgrp,"(['Makati City'], Location((14.5591272, 121.0202094, 0.0)))",en,0.226901,0.041953,0.424947,0.333078,0.215133,"['sadness', 0.424947]"
cjlopezmercado,2017-06-20 9:17,us troops sighted on ground in warravaged marawi via conceptgrp,"(['Makati City'], Location((14.5591272, 121.0202094, 0.0)))",en,0.043825,0.180301,0.32125,0.128787,0.324328,"['disgust', 0.324328]"
Picoespino,2017-06-20 9:16,brilliant kid is summa cum laude with a degree in molecular biology gpa 11 up is from marawi,"(['manila'], Location((14.5906216, 120.9799696, 0.0)))",en,0.049747,0.642912,0.09876,0.056706,0.068724,"['joy', 0.642912]"
cjlopezmercado,2017-06-20 9:14,doh denies 59 marawi evacuees died of various illnesses via conceptgrp,"(['Makati City'], Location((14.5591272, 121.0202094, 0.0)))",en,0.159723,0.017523,0.869175,0.11256,0.054872,"['sadness', 0.869175]"
Rosario_UST,2017-06-20 9:13,toy drive for the children of marawi a dominican family project co dominican missions philippines please see,"(['Manila City'], Location((14.5906216, 120.9799696, 0.0)))",en,0.015688,0.614493,0.020174,0.1751,0.083188,"['joy', 0.614493]"
LOCALNEWSNgayon,2017-06-20 9:11,analyst links dutertes incognito trip to marawi conflict  read via gma news,"(['Philippines'], Location((12.7503486, 122.7312101, 0.0)))",en,0.053764,0.277421,0.425009,0.241001,0.052599,"['sadness', 0.425009]"
TakboPhChic,2017-06-20 9:11,time to help out lets help people in marawi share your blessings momsofmanila momsformarawi,"(['Philippines'], Location((12.7503486, 122.7312101, 0.0)))",en,0.032227,0.777488,0.131974,0.008449,0.002663,"['joy', 0.777488]"
ZFF_foundation,2017-06-20 9:04,zff hands buntis kits to internally displaced mothers from marawi read more,"(['Paranaque City'], Location((49.2086619, -2.0238323, 0.0)))",en,0.076251,0.38148,0.069699,0.139339,0.228643,"['joy', 0.38148]"
gmanews,2017-06-20 9:01,mbb summa cum laude from marawi to deliver valedictory speech at up diliman graduation 9,"(['Philippines'], Location((12.7503486, 122.7312101, 0.0)))",en,0.134655,0.354546,0.194594,0.307061,0.011795,"['joy', 0.354546]"
IAGorgph,2017-06-20 8:56,marawi is in our thoughts as we open todays forum with prayer,"(['Cotabato City'], Location((7.1970344, 124.2351714, 0.0)))",en,0.011795,0.215175,0.686007,0.145158,0.006706,"['sadness', 0.686007]"
NoonBreak,2017-06-20 8:53,escape from marawi jail surrendered to bjmp chief,"(['Philippines'], Location((12.7503486, 122.7312101, 0.0)))",en,0.350033,0.05412,0.261086,0.245694,0.366346,"['disgust', 0.366346]"
PhilippineStar,2017-06-20 8:50,11 kilos of shabu seized in marawi clearing d,"(['Philippines'], Location((12.7503486, 122.7312101, 0.0)))",en,0.08686,0.175699,0.151545,0.093654,0.072945,"['joy', 0.175699]"
RSHSVIOfficial,2017-06-20 8:46,students form human flag pray for marawi kalibo aklan by jun aguirre 220 rshsvilovesph rshsvioneformarawi,"(['Kalibo', ' Western Visayas'], Location((11.79354705, 122.441378329, 0.0)))",en,0.068459,0.079898,0.283246,0.104068,0.572118,"['disgust', 0.572118]"
davidyusantos,2017-06-20 8:40,ph navys ld602 brp davao del sur arrives in iligan to bring relief  rehabilitation to marawi 9,"(['Manila'], Location((14.5906216, 120.9799696, 0.0)))",en,0.018552,0.109878,0.022806,0.073528,0.010541,"['joy', 0.109878]"
cebudailynews,2017-06-20 8:32,icymi marawi becoming hub for is fighters from se asia,"(['NRA', ' Cebu City', ' Philippines'], Location((39.369933, -120.233522, 0.0)))",en,0.050311,0.065314,0.236702,0.268609,0.072449,"['fear', 0.268609]"
ANCALERTS,2017-06-20 8:30,fr eliseo mercado jr shares his thoughts on the marawi crisis ancrecap,"(['Philippines'], Location((12.7503486, 122.7312101, 0.0)))",en,0.042758,0.045917,0.117063,0.329996,0.066112,"['fear', 0.329996]"
PTVph,2017-06-20 8:30,news over p100m worth of shabu recovered in marawi c,"(['Philippines'], Location((12.7503486, 122.7312101, 0.0)))",en,0.055363,0.274499,0.155765,0.245857,0.111823,"['joy', 0.274499]"
ModernizePH,2017-06-20 8:14,how much shabu troops found in marawi,"(['Republic of the Philippines'], Location((12.7503486, 122.7312101, 0.0)))",en,0.059578,0.230581,0.179548,0.132705,0.059246,"['joy', 0.230581]"
roilogolez,2017-06-20 8:05,roilo golez dzrh interview said afp doing well in marawi june 20 2017 via youtube,"(['Philippines'], Location((12.7503486, 122.7312101, 0.0)))",en,0.003488,0.442211,0.127926,0.263886,0.158524,"['joy', 0.442211]"
ma_espanol,2017-06-20 8:03,have a blessed philippines and hello world stay safety marawi,"(['National Capital Region', ' Repub'], Location((14.5736108, 121.0329706, 0.0)))",en,0.008263,0.704365,0.076196,0.047868,0.016155,"['joy', 0.704365]"
margadeona,2017-06-20 8:00,look an approximation of the marawi battle zone,"(['Manila', ' Philippines'], Location((14.5906216, 120.9799696, 0.0)))",en,0.125099,0.224516,0.230669,0.276882,0.027358,"['fear', 0.276882]"
def_filipino,2017-06-20 8:00,just like the learners and other citizens of marawi teachers also fled and sought refuge in other safe,"(['Philippines'], Location((12.7503486, 122.7312101, 0.0)))",en,0.066258,0.19116,0.123241,0.410308,0.202524,"['fear', 0.410308]"
SeventhCrg,2017-06-20 7:57,davao city philippines  soldiers recovering from injuries sustained in the marawi clash have expressed,"(['Quezon City'], Location((14.6509905, 121.0486155, 0.0)))",en,0.164606,0.093612,0.511839,0.253113,0.036471,"['sadness', 0.511839]"
AusAmbPH,2017-06-20 7:56,australia is providing vital support to the displaced people of marawi,"(['Manila', ' Philippines'], Location((14.5906216, 120.9799696, 0.0)))",en,0.088753,0.162399,0.142771,0.045873,0.181884,"['disgust', 0.181884]"
OneMNLF,2017-06-20 7:56,zamboanga siege and marawi siege is a product of a politicized afp and pnp,"(['Mindanao (MI)'], Location((30.335525, -89.405573, 0.0)))",en,0.046442,0.374189,0.192843,0.076129,0.056901,"['joy', 0.374189]"
PLCPD1989,2017-06-20 7:55,hundreds of families from marawi marked this years ramadan fleeing to safety with no assurance on when they can,"(['Quezon City'], Location((14.6509905, 121.0486155, 0.0)))",en,0.019261,0.182919,0.384035,0.346759,0.086685,"['sadness', 0.384035]"
jassspreadlove,2017-06-20 7:54,retweeted concept  conceptgrp govt forces gear up for marawi rehab,"(['Manila City', ' National Capital'], Location((14.5906216, 120.9799696, 0.0)))",en,0.144315,0.033068,0.628735,0.135143,0.079539,"['sadness', 0.628735]"
cebudailynews,2017-06-20 7:52,icymi 11 kilos of shabu seized from maute stronghold in marawi,"(['NRA', ' Cebu City', ' Philippines'], Location((39.369933, -120.233522, 0.0)))",en,0.073894,0.081149,0.497774,0.253545,0.237571,"['sadness', 0.497774]"
PLCPD1989,2017-06-20 7:51,heres a special prayer collated from people forced to flee conflict in marawi offer a taraweeformarawi worldrefugeeday 9,"(['Quezon City'], Location((14.6509905, 121.0486155, 0.0)))",en,0.074196,0.057105,0.622438,0.405314,0.044257,"['sadness', 0.622438]"
PHHotTrends,2017-06-20 7:48,11 kilos of shabu seized in marawi clearing marawiupdateshttps,"(['Manila City'], Location((14.5906216, 120.9799696, 0.0)))",en,0.08686,0.175699,0.151545,0.093654,0.072945,"['joy', 0.175699]"
ANCALERTS,2017-06-20 7:48,ancearlyedition mercado marawi is not a big city we know whos who and what happening whos the foreigner and the stranger,"(['Philippines'], Location((12.7503486, 122.7312101, 0.0)))",en,0.129423,0.247913,0.353408,0.156655,0.059283,"['sadness', 0.353408]"
PHHotTrends,2017-06-20 7:38,ofws sending letters for soldiers in marawi marawiupdateshttps,"(['Manila City'], Location((14.5906216, 120.9799696, 0.0)))",en,0.0625,0.0564,0.256671,0.403939,0.051334,"['fear', 0.403939]"
ANCALERTS,2017-06-20 7:37,ancearlyedition mercado how come there was no prior report that maute was going to marawi,"(['Philippines'], Location((12.7503486, 122.7312101, 0.0)))",en,0.131372,0.239508,0.370789,0.324157,0.042335,"['sadness', 0.370789]"
ANCALERTS,2017-06-20 7:36,ancearlyedition mercado in terms of arms presence marawi will have the most firearms in entire ph,"(['Philippines'], Location((12.7503486, 122.7312101, 0.0)))",en,0.018483,0.145363,0.072628,0.090404,0.012859,"['joy', 0.145363]"
PhilstarNews,2017-06-20 7:31,ofws sending letters for soldiers in marawi marawiupdates,"(['Manila', ' Philippines'], Location((14.5906216, 120.9799696, 0.0)))",en,0.0625,0.0564,0.256671,0.403939,0.051334,"['fear', 0.403939]"
totocyven,2017-06-20 7:30,marawi attackers down to 120 running out of ammo military via abscbnnews,"(['Philippines'], Location((12.7503486, 122.7312101, 0.0)))",en,0.026928,0.178276,0.284666,0.420885,0.167278,"['fear', 0.420885]"
totocyven,2017-06-20 7:30,as marawi battle continues some who fled die in refugee centers via abscbnnews,"(['Philippines'], Location((12.7503486, 122.7312101, 0.0)))",en,0.058073,0.014685,0.764131,0.337711,0.096453,"['sadness', 0.764131]"
gmanews,2017-06-20 7:21,ofws join support drive for embattled troops in marawi,"(['Philippines'], Location((12.7503486, 122.7312101, 0.0)))",en,0.148406,0.37969,0.043277,0.1392,0.045471,"['joy', 0.37969]"
PinoyTambayanan,2017-06-20 7:15,ofws join support drive for embattled troops in marawi pinoy tambayan 9,"(['Philippines'], Location((12.7503486, 122.7312101, 0.0)))",en,0.13531,0.338628,0.056695,0.13315,0.051204,"['joy', 0.338628]"
PhilDefNews,2017-06-20 7:00,marawi attackers down to 120 running out of ammo military,"(['Manila', ' Philippines'], Location((14.5906216, 120.9799696, 0.0)))",en,0.052193,0.148965,0.260928,0.332548,0.119092,"['fear', 0.332548]"
oxfamph,2017-06-20 7:00,heres a special prayer collated from people forced to flee conflict in marawi offer a taraweeformarawi worldrefugeeday,"(['Philippines'], Location((12.7503486, 122.7312101, 0.0)))",en,0.074196,0.057105,0.622438,0.405314,0.044257,"['sadness', 0.622438]"
nakngtweeting,2017-06-20 6:59,humanitarian crisis in marawi should be addressed by this government if the prexy is mia then cabinet leaders should step up,"(['Quezon City', ' Philippines'], Location((14.6509905, 121.0486155, 0.0)))",en,0.111553,0.017895,0.137889,0.323744,0.363551,"['disgust', 0.363551]"
elvinuy,2017-06-20 6:50,these are the cowards who have caused so much bloodshed  suffering in marawi  beyond their time will come too,"(['Manila', ' Philippines'], Location((14.5906216, 120.9799696, 0.0)))",en,0.261133,0.014164,0.7066,0.22515,0.100146,"['sadness', 0.7066]"
dswdfo7,2017-06-20 6:40,today another batch of food packs will be brought to iligan city to help the displaced families from marawi city,"(['Cebu City', ' Philippines'], Location((10.3090298, 123.8930839, 0.0)))",en,0.057941,0.470348,0.294295,0.076883,0.05578,"['joy', 0.470348]"
iambluefish,2017-06-20 6:39,the marawi crisis has been an emotional roller coaster ride but its bringing out the best in us salamat altteamafphttps,"(['Makati Philippines'], Location((14.55459465, 121.021407905, 0.0)))",en,0.054095,0.600586,0.19901,0.077113,0.05005,"['joy', 0.600586]"
Go_Masterpiece,2017-06-20 6:39,good morning  sending love to marawi abscbnnews starcreativestv delavinkisses barberedward,"(['MNL'], Location((14.5121499, 121.022046716, 0.0)))",en,0.014427,0.920176,0.010688,0.00522,0.002696,"['joy', 0.920176]"
inquirerdotnet,2017-06-20 6:30,400 marawi evacuees suffer in emergency shelters,"(['Makati City'], Location((14.5591272, 121.0202094, 0.0)))",en,0.072531,0.017158,0.589748,0.540102,0.023726,"['sadness', 0.589748]"
lccd_scb,2017-06-20 6:27,still pray for marawi,"(['Republic of the Philippines'], Location((12.7503486, 122.7312101, 0.0)))",en,0.051475,0.022576,0.553192,0.506608,0.139116,"['sadness', 0.553192]"
DailyStarPH,2017-06-20 6:25,dailystarph philippines marawi inmate freed by terror group yields  tempo ,"(['Republic of the Philippines'], Location((12.7503486, 122.7312101, 0.0)))",en,0.093227,0.242718,0.164086,0.10028,0.106539,"['joy', 0.242718]"
leuterio_ray,2017-06-20 6:17,11 kilos of shabu seized in marawi clearing philstarnews martiallawinmindanao prayforphilippines marawicity,"(['Philippines'], Location((12.7503486, 122.7312101, 0.0)))",en,0.08686,0.175699,0.151545,0.093654,0.072945,"['joy', 0.175699]"
PinoyTambayanKo,2017-06-20 6:13,marawi inmate freed by terror group yields,"(['Bulacan'], Location((14.794871, 120.8777119, 0.0)))",en,0.106298,0.259604,0.143352,0.096867,0.084515,"['joy', 0.259604]"
VotersPhil,2017-06-20 6:04,what the h is vp lr doing in there while marawi is fighting for their lives it would help if she supports the president,"(['Daet', ' Bicol Region'], Location((14.17750935, 123.010441095, 0.0)))",en,0.057299,0.10943,0.222659,0.034501,0.205382,"['sadness', 0.222659]"
TempoPHL,2017-06-20 6:00,marawi inmate freed by terror groupyields,"(['Intramuros', ' Philippines'], Location((14.5905862, 120.97533, 0.0)))",en,0.08686,0.174219,0.151545,0.093654,0.072945,"['joy', 0.174219]"
ABSCBNNews,2017-06-20 6:00,as marawi battle continues some who fled die in refugee centers,"(['Manila', ' Philippines'], Location((14.5906216, 120.9799696, 0.0)))",en,0.078616,0.011738,0.799552,0.294328,0.077264,"['sadness', 0.799552]"
PHILAlerts,2017-06-20 5:57,typhoon news 100 bodies may still be in besieged marawi says official ,"(['Philippines'], Location((12.7503486, 122.7312101, 0.0)))",en,0.129717,0.165685,0.258932,0.398753,0.297933,"['fear', 0.398753]"
archieherrera,2017-06-20 5:56,as marawi burns,"(['Manila City'], Location((14.5906216, 120.9799696, 0.0)))",en,0.356278,0.026132,0.466507,0.373085,0.122584,"['sadness', 0.466507]"
inquirer_libre,2017-06-20 5:47,400 marawi evacuees suffer in emergency shelters 8,"(['Philippines'], Location((12.7503486, 122.7312101, 0.0)))",en,0.072531,0.017158,0.589748,0.540102,0.023726,"['sadness', 0.589748]"
leelah_veevie,2017-06-20 5:11,help marawi save marawi,"(['philippines'], Location((12.7503486, 122.7312101, 0.0)))",en,0.032987,0.302041,0.132169,0.057442,0.004566,"['joy', 0.302041]"
