PHLNewsOnline,2017-06-20 17:19,news5 ph launches offensive hopes to recapture marawi before end of ramadan,"(['Philippines'], Location((12.7503486, 122.7312101, 0.0)))",en,0.012513,0.050193,0.167175,0.085378,0.370681,"['disgust', 0.370681]"
ANCALERTS,2017-06-20 17:17,the fighting is contained in 4 barangays in marawi city intense gunfight still ongoing marawiclash,"(['Philippines'], Location((12.7503486, 122.7312101, 0.0)))",en,0.156358,0.156257,0.278022,0.079826,0.058931,"['sadness', 0.278022]"
Duterte24x7,2017-06-20 17:16,duterte sends more troops to marawi  protectpprd,"(['Republic of the Philippines'], Location((12.7503486, 122.7312101, 0.0)))",en,0.097186,0.114006,0.11312,0.081639,0.052624,"['joy', 0.114006]"
egdsgn,2017-06-20 17:15,ncrpo chief albayalde on marawi seige rwm attack and antidrugcampaign,"(['Davao City', ' Davao Region'], Location((7.22650725, 125.454887691, 0.0)))",en,0.327617,0.005013,0.15076,0.705819,0.149616,"['fear', 0.705819]"
ramilsanchez,2017-06-20 17:15,phched assistance for the students affected by the crisis in marawi read here,"(['Butuan City'], Location((14.6169132, 121.018525, 0.0)))",en,0.061831,0.019869,0.32797,0.229462,0.366273,"['disgust', 0.366273]"
CHEDCaraga,2017-06-20 17:15,assistance for the students affected by the crisis in marawi read here,"(['Philippines'], Location((12.7503486, 122.7312101, 0.0)))",en,0.061831,0.019869,0.32797,0.229462,0.366273,"['disgust', 0.366273]"
lefthandedsnake,2017-06-20 17:14,idps from marawi are not beggars dont give relief goods in poor condition give the best you can give,"(['Davao City', ' Davao Region'], Location((7.22650725, 125.454887691, 0.0)))",en,0.047684,0.669237,0.195616,0.106546,0.015045,"['joy', 0.669237]"
dwiz882,2017-06-20 17:10,read proclamation no232 declaring june 1316 2017 as days of natl mourning to remember the fallen heroes of marawi via ,"(['Pasig City', ' Philippines'], Location((9.7771753, 125.4915723, 0.0)))",en,0.008339,0.413327,0.493095,0.082944,0.055564,"['sadness', 0.493095]"
Rise2030_Phil,2017-06-20 17:07,help us rise for marawi join us in meal packaging event on 627 at conrad manila sm moa pls register at,"(['Republic of the Philippines'], Location((12.7503486, 122.7312101, 0.0)))",en,0.04575,0.299494,0.08679,0.025053,0.070818,"['joy', 0.299494]"
cebudailynews,2017-06-20 17:06,just in palace declared june 1316 as days of natl mourning for marawi victims proclamation released only on tuesday  via,"(['NRA', ' Cebu City', ' Philippines'], Location((39.369933, -120.233522, 0.0)))",en,0.0219,0.088415,0.602034,0.169303,0.131795,"['sadness', 0.602034]"
sunstarcebu,2017-06-20 17:03,fyi palace releases on tuesday proclamation 232 declaring june 1316 as days of national mourning for marawi victims  via,"(['Cebu', ' Philippines'], Location((10.45, 123.84, 0.0)))",en,0.015449,0.077595,0.599459,0.143752,0.175373,"['sadness', 0.599459]"
ruffybiazon,2017-06-20 17:03,a marine i know whose brother got wounded in an rpg attack last week just had his cousin wounded by an ied yesterday in marawi,"(['Philippines'], Location((12.7503486, 122.7312101, 0.0)))",en,0.163118,0.037809,0.648794,0.127864,0.300259,"['sadness', 0.648794]"
rolandoaltoiv,2017-06-20 17:00,pray for marawi 1 pray for wisdom upon our government officials on what to do 2 pray for strength and,"(['Taguig City'], Location((14.5266254, 121.074403, 0.0)))",en,0.025439,0.549047,0.130056,0.289711,0.110573,"['joy', 0.549047]"
iamcy_villan,2017-06-20 17:00,salute to all fallen soldiers in marawi,"(['Imus', ' Calabarzon'], Location((14.4021133, 120.932366655, 0.0)))",en,0.089205,0.060437,0.330092,0.407071,0.087982,"['fear', 0.407071]"
guru_guerrero,2017-06-20 16:59,pastoral statement of the united methodist bishops of the philippines on the ongoing marawi crisis pray for marawi,"(['Dasmarinas', ' Cavite'], Location((14.6455597, 120.9995684, 0.0)))",en,0.071366,0.021608,0.291126,0.429034,0.285443,"['fear', 0.429034]"
PIA_NorMin,2017-06-20 16:51,seventynine wounded in action soldiers from the marawi crisis will be awarded with a medal cash assistance and d,"(['Cagayan de Oro City'], Location((8.42980265, 124.682410212, 0.0)))",en,0.079546,0.024772,0.156743,0.230829,0.363447,"['disgust', 0.363447]"
WilsonLeeFlores,2017-06-20 16:50,when shall war end in syria  also in far south city of marawi build schools produce more foods less weapons  no to wars rthttps,"(['Metro Manila', ' Philippines'], Location((14.5736108, 121.0329706, 0.0)))",en,0.111434,0.26871,0.489223,0.110102,0.14786,"['sadness', 0.489223]"
KaHenryDZRH,2017-06-20 16:49,palace declares june 13162017 as national day of mourning for marawi dzrhnews ,"(['National Capital Region'], Location((14.5736108, 121.0329706, 0.0)))",en,0.020032,0.12628,0.650467,0.108507,0.09265,"['sadness', 0.650467]"
philmonitor,2017-06-20 16:46,muslim boy displaced by war in marawi dreams of becoming an engineer  via philmonitor,"(['Republic of the Philippines'], Location((12.7503486, 122.7312101, 0.0)))",en,0.138101,0.387459,0.214249,0.145068,0.258326,"['joy', 0.387459]"
tj_roxas,2017-06-20 16:46,military checking existence of shabu lab in marawi conflict zone via gmanews,"(['Philippines'], Location((12.7503486, 122.7312101, 0.0)))",en,0.027138,0.158997,0.451595,0.290395,0.121325,"['sadness', 0.451595]"
CarmeloBibal,2017-06-20 16:42,military mounts renewed offensive to end marawi battle by weekend via news5  interaksyon,"(['Ligao City', ' Albay', ' Philippines'], Location((13.2411647, 123.5373582, 0.0)))",en,0.060727,0.076949,0.50153,0.384847,0.197185,"['sadness', 0.50153]"
DailyStarPH,2017-06-20 16:40,dailystarph philippines isis wont stop in marawi ,"(['Republic of the Philippines'], Location((12.7503486, 122.7312101, 0.0)))",en,0.170792,0.057089,0.238041,0.122856,0.261758,"['disgust', 0.261758]"
PHHotTrends,2017-06-20 16:33,you missed it palace declared june 1316 days of national mourning over marawi siege document issued just now ,"(['Manila City'], Location((14.5906216, 120.9799696, 0.0)))",en,0.050723,0.029803,0.775836,0.184974,0.037521,"['sadness', 0.775836]"
inquirerdotnet,2017-06-20 16:32,palace declared june 1316 as days of natl mourning for marawi victims proclamation released only on tuesday ,"(['Makati City'], Location((14.5591272, 121.0202094, 0.0)))",en,0.03188,0.075802,0.571054,0.125208,0.10264,"['sadness', 0.571054]"
RedTani,2017-06-20 16:31,frustration probably made duterte say he would pull out marawi troops,"(['Philippines'], Location((12.7503486, 122.7312101, 0.0)))",en,0.516895,0.058502,0.40623,0.192787,0.064459,"['anger', 0.516895]"
NCorralesINQ,2017-06-20 16:30,palace declared june 1316 as days of natl mourning for marawi victims proclamation released only on tuesday,"(['Makati City'], Location((14.5591272, 121.0202094, 0.0)))",en,0.03188,0.075802,0.571054,0.125208,0.10264,"['sadness', 0.571054]"
PhilippineStar,2017-06-20 16:28,you missed it  palace declared june 1316 days of national mourning because of marawi siege document issued just now ,"(['Philippines'], Location((12.7503486, 122.7312101, 0.0)))",en,0.050723,0.029803,0.775836,0.184974,0.037521,"['sadness', 0.775836]"
gmanews,2017-06-20 16:28,palace just released copy of proc no 232 that declared june 1316 as days of natl mourning for those who died in marawi  ,"(['Philippines'], Location((12.7503486, 122.7312101, 0.0)))",en,0.028464,0.034837,0.846375,0.145977,0.014343,"['sadness', 0.846375]"
manilabulletin,2017-06-20 16:28,delayed release from the palace proclamation declaring june 1316 as days of national mourning for slain troops in marawi ,"(['Manila', ' Philippines'], Location((14.5906216, 120.9799696, 0.0)))",en,0.06967,0.043613,0.606578,0.093557,0.089716,"['sadness', 0.606578]"
PhilstarNews,2017-06-20 16:28,you missed it palace declared june 1316 days of national mourning over marawi siege document issued just now  via,"(['Manila', ' Philippines'], Location((14.5906216, 120.9799696, 0.0)))",en,0.036993,0.037014,0.756453,0.227791,0.051787,"['sadness', 0.756453]"
trishamacas,2017-06-20 16:27,palace just released copy of proclamation no 232 that declared june 1316 as days of natl mourning for those who died in marawi ,"(['Republic of the Philippines'], Location((12.7503486, 122.7312101, 0.0)))",en,0.028464,0.034837,0.846375,0.145977,0.014343,"['sadness', 0.846375]"
alexisbromero,2017-06-20 16:26,you missed it  palace declared june 1316 days of national mourning because of marawi siege document issued just now,"(['Manila'], Location((14.5906216, 120.9799696, 0.0)))",en,0.050723,0.029803,0.775836,0.184974,0.037521,"['sadness', 0.775836]"
jpjbencito,2017-06-20 16:26,look palace comms group on tuesday belatedly released proc no 232 declaring june 13 to 16 as days of national mourning for marawi siege 0,"(['Philippines'], Location((12.7503486, 122.7312101, 0.0)))",en,0.060563,0.240707,0.39122,0.114113,0.080531,"['sadness', 0.39122]"
rapplerdotcom,2017-06-20 16:25,look presidentduterte declared june 1316 2017 as days of national mourning for the deaths of soldiers who died in marawi clashes,"(['Philippines'], Location((12.7503486, 122.7312101, 0.0)))",en,0.04806,0.017354,0.849554,0.212315,0.082752,"['sadness', 0.849554]"
MindanaoExamine,2017-06-20 16:21,muslim boy displaced by war in marawi dreams of becoming an engineer,"(['Southern Philippines'], Location((17.4097041, 121.4382768, 0.0)))",en,0.229817,0.370906,0.202014,0.102976,0.226201,"['joy', 0.370906]"
doledavaoregion,2017-06-20 16:19,sharing dole xi conducts 10k liters of water campaign for marawi city,"(['Davao City'], Location((7.22650725, 125.454887691, 0.0)))",en,0.029055,0.242972,0.261344,0.08949,0.264144,"['disgust', 0.264144]"
msnph,2017-06-20 16:17,palace says marawi unlikely to become new hub for isis fighters d,"(['Manila', ' Philippines'], Location((14.5906216, 120.9799696, 0.0)))",en,0.159767,0.310995,0.326891,0.177272,0.110936,"['sadness', 0.326891]"
valenzuelacity,2017-06-20 16:15,valenzuela city cares for marawi and taraka first leg of our relief ops for marawi crisis victims the city,"(['Valenzuela City', ' Philippines'], Location((37.7751808, -4.220174, 0.0)))",en,0.061524,0.084674,0.488578,0.303912,0.274934,"['sadness', 0.488578]"
DILGPhilippines,2017-06-20 16:12,dilg seeks support in employing dependents of fallen soldiers cops in marawi incident u,"(['Quezon City'], Location((14.6509905, 121.0486155, 0.0)))",en,0.150693,0.029228,0.253463,0.255424,0.448262,"['disgust', 0.448262]"
KatarHol5,2017-06-20 16:11,give him a gun and let him ride a horse then send him to marawi,"(['Sta Rosa ', 'Laguna Philippines'], Location((38.4404675, -122.7144314, 0.0)))",en,0.442202,0.288102,0.123924,0.092187,0.250659,"['anger', 0.442202]"
ABSCBNNews,2017-06-20 16:10,ched seeks help for transferees from marawi,"(['Manila', ' Philippines'], Location((14.5906216, 120.9799696, 0.0)))",en,0.029255,0.257907,0.50802,0.066761,0.023685,"['sadness', 0.50802]"
barnabychuck,2017-06-20 16:08,while everyones focused on marawi,"(['Manila', ' Philippines'], Location((14.5906216, 120.9799696, 0.0)))",en,0.017538,0.467618,0.155103,0.100164,0.031003,"['joy', 0.467618]"
GianoTurning,2017-06-20 16:08,truth that must be considered there is a big difference between the orientation fo a civilian aid worker and a soldier marawi,"(['Makati City', ' National Capital Region'], Location((14.5591272, 121.0202094, 0.0)))",en,0.191796,0.222737,0.210479,0.235744,0.12935,"['fear', 0.235744]"
CoconutsManila,2017-06-20 16:05,philippines launches offensives in hopes of recapturing marawi by eid alfitr,"(['Metro Manila', ' Philippines'], Location((14.5736108, 121.0329706, 0.0)))",en,0.007774,0.158761,0.529411,0.053293,0.343805,"['sadness', 0.529411]"
GianoTurning,2017-06-20 16:03,im not sure what degree of civilianmilitary coordination is being established by the afp i hope theyre not single minded marawi,"(['Makati City', ' National Capital Region'], Location((14.5591272, 121.0202094, 0.0)))",en,0.03893,0.196558,0.17695,0.153305,0.112185,"['joy', 0.196558]"
IAGorgph,2017-06-20 16:02,pancho lara besides asking what triggered marawi crisis also important to look into what enabled it to endure,"(['Cotabato City'], Location((7.1970344, 124.2351714, 0.0)))",en,0.151007,0.275276,0.137089,0.319924,0.119557,"['fear', 0.319924]"
gmanews,2017-06-20 16:02,president duterte to visit 79 soldiers who were injured in marawi ops to give p100k each  josephmorongpic,"(['Philippines'], Location((12.7503486, 122.7312101, 0.0)))",en,0.083884,0.081811,0.448737,0.246483,0.318832,"['sadness', 0.448737]"
GianoTurning,2017-06-20 16:01,at this very moment our soldiers are not only battling terrorists but also a slow growth of resentment unavoidable but unfortunate marawi,"(['Makati City', ' National Capital Region'], Location((14.5591272, 121.0202094, 0.0)))",en,0.12478,0.05012,0.64735,0.411162,0.024233,"['sadness', 0.64735]"
redraymond,2017-06-20 15:59,marawi grad up summa cum laude in molecular bio to deliver valedictory address at state u,"(['qc'], Location((52.4760892, -71.8258668, 0.0)))",en,0.128393,0.196054,0.207005,0.068499,0.087492,"['sadness', 0.207005]"
dennisuy,2017-06-20 15:57,please help in this noble project the fight is not only in the streets of marawi but in the hearts of the,"(['Pozorrubio', ' Pangasinan'], Location((16.1104804, 120.5458922, 0.0)))",en,0.052058,0.192657,0.331575,0.54577,0.036776,"['fear', 0.54577]"
MyRizalPH,2017-06-20 15:52,marawi is a lesson learned for all of us every action will have a consequence support terrorists  u bring death  destruction on urself,"(['Republic of the Philippines'], Location((12.7503486, 122.7312101, 0.0)))",en,0.397698,0.017888,0.435454,0.373686,0.109539,"['sadness', 0.435454]"
letsgonegosyo,2017-06-20 15:51,sending care packages and letters to our soldiers in marawi ,"(['Philippines'], Location((12.7503486, 122.7312101, 0.0)))",en,0.08737,0.057664,0.623966,0.080278,0.054559,"['sadness', 0.623966]"
MyRizalPH,2017-06-20 15:50,the 1st thing ppl of marawi ought to tell themselves is that they wouldnt be in this situation if their own neighbors didnt support mautes,"(['Republic of the Philippines'], Location((12.7503486, 122.7312101, 0.0)))",en,0.242668,0.119623,0.296836,0.217807,0.255455,"['sadness', 0.296836]"
RitaBaua,2017-06-20 15:49,you can pray for the soldiers fighting in marawi but moreso for the evacuees whose dire situation is now a big humanitarian crisis,"(['Quezon City'], Location((14.6509905, 121.0486155, 0.0)))",en,0.078582,0.012346,0.283297,0.635621,0.34536,"['fear', 0.635621]"
annafelicia_,2017-06-20 15:43,military aims to clear marawi by end of ramadan via gmanews,"(['Quezon City', ' National Capital Region'], Location((14.6509905, 121.0486155, 0.0)))",en,0.023722,0.189905,0.200153,0.298798,0.205974,"['fear', 0.298798]"
kompani202,2017-06-20 15:42,army renews push against isillinked group in marawi,"(['Republic of the Philippines'], Location((12.7503486, 122.7312101, 0.0)))",en,0.276575,0.073297,0.319229,0.170487,0.182325,"['sadness', 0.319229]"
dswdfo10,2017-06-20 15:42,contents of the dswd ramadan food pack which we have begun to distribute to all evacuees from marawi,"(['Cagayan De Oro City'], Location((8.42980265, 124.682410212, 0.0)))",en,0.233336,0.401433,0.181225,0.094498,0.066208,"['joy', 0.401433]"
reneletran,2017-06-20 15:42,breaking p79m worth of cash and cheques seized in marawi dispensed from the opposition,"(['philippines'], Location((12.7503486, 122.7312101, 0.0)))",en,0.190968,0.173551,0.405149,0.134278,0.136732,"['sadness', 0.405149]"
HailaMB,2017-06-20 15:41,marawi city 3,"(['Philippines'], Location((12.7503486, 122.7312101, 0.0)))",en,0.051394,0.216157,0.175201,0.061141,0.050338,"['joy', 0.216157]"
eeczyneecin,2017-06-20 15:40,equally heartbreaking abandoned pets seen roaming the streets of marawi  news  gma news online via gmanews,"(['Republic of the Philippines'], Location((12.7503486, 122.7312101, 0.0)))",en,0.040658,0.027005,0.579633,0.43866,0.185898,"['sadness', 0.579633]"
PLCPD1989,2017-06-20 15:32,plcpd supports the simultaneous taraweeh for marawi on world refugee day u,"(['Quezon City'], Location((14.6509905, 121.0486155, 0.0)))",en,0.024112,0.448943,0.368386,0.019927,0.225358,"['joy', 0.448943]"
KliteOlongapo,2017-06-20 15:31,to help the families of fallen soldiers  victims in marawi you may buy the tshirts in camp aguinaldo worth,"(['Olongapo City', ' Central Luzon'], Location((14.8314675, 120.2835205, 0.0)))",en,0.045452,0.270358,0.493144,0.176258,0.134564,"['sadness', 0.493144]"
inquirer_libre,2017-06-20 15:30,palace says marawi will never become terror hub,"(['Philippines'], Location((12.7503486, 122.7312101, 0.0)))",en,0.134267,0.17333,0.290992,0.117428,0.112001,"['sadness', 0.290992]"
BamAlegre_,2017-06-20 15:27,from the frontlines of marawi altteamafp,"(['Quezon City', ' Philippines'], Location((14.6509905, 121.0486155, 0.0)))",en,0.08686,0.174219,0.151545,0.093654,0.072945,"['joy', 0.174219]"
luisaelago,2017-06-20 15:26,in fact pdut worse than pnoy because govt killed our own soldiers plus they knew maute was attacking and allowed them to get marawi,"(['Rockwell', ' Makati City'], Location((33.5912176, -95.5496789, 0.0)))",en,0.319814,0.000749,0.511954,0.355863,0.200323,"['sadness', 0.511954]"
DailyStarPH,2017-06-20 15:25,dailystarph philippines over 200 evacuees from marawi had medical concerns  doh  man,"(['Republic of the Philippines'], Location((12.7503486, 122.7312101, 0.0)))",en,0.083343,0.040295,0.278489,0.230385,0.261106,"['sadness', 0.278489]"
IAGorgph,2017-06-20 15:23,lingga marawi is not a religious war,"(['Cotabato City'], Location((7.1970344, 124.2351714, 0.0)))",en,0.354125,0.045216,0.376442,0.317174,0.150776,"['sadness', 0.376442]"
PHILAlerts,2017-06-20 15:17,typhoon news ilonggos launch drive to raise cash relief goods for marawi  ,"(['Philippines'], Location((12.7503486, 122.7312101, 0.0)))",en,0.009875,0.725076,0.116728,0.038494,0.020709,"['joy', 0.725076]"
dndphl,2017-06-20 15:16,in photos president duterte honoring cops and soldiers wounded in marawi,"(['CGEA', ' Quezon City'], Location((40.4335216, -3.7199977914, 0.0)))",en,0.186363,0.216658,0.218115,0.0384,0.538962,"['disgust', 0.538962]"
InqNational,2017-06-20 15:13,video tribute to sgt jobert cofino 37th mcoy mblt5 one of the 62 fallen heroes in marawi city alipalajulieinq,"(['Manila', ' Philippines'], Location((14.5906216, 120.9799696, 0.0)))",en,0.043518,0.607716,0.234193,0.021514,0.087237,"['joy', 0.607716]"
alipalajulieINQ,2017-06-20 15:12,video tribute to sgt jobert cofino 37th mcoy mblt5 one of the 62 fallen heroes in marawi city inqmindanao,"(['Zamboanga City'], Location((6.9046004, 122.0763695, 0.0)))",en,0.043518,0.607716,0.234193,0.021514,0.087237,"['joy', 0.607716]"
gmanews,2017-06-20 15:11,afp is checking information about a shabu laboratory within the conflict zone in marawi city,"(['Philippines'], Location((12.7503486, 122.7312101, 0.0)))",en,0.009838,0.733444,0.027844,0.046665,0.011486,"['joy', 0.733444]"
betaANDREnergic,2017-06-20 15:10,wow fb posts blaming the government and the afp for the destruction of marawi instead of pointing the blame on isismauteasg bravo,"(['Philippines'], Location((12.7503486, 122.7312101, 0.0)))",en,0.539546,0.013106,0.433625,0.093557,0.284828,"['anger', 0.539546]"
manilabulletin,2017-06-20 15:06,over 200 evacuees from marawi had medical concerns  doh  read befullyinformed,"(['Manila', ' Philippines'], Location((14.5906216, 120.9799696, 0.0)))",en,0.042017,0.059307,0.230606,0.29331,0.150682,"['fear', 0.29331]"
nakngtweeting,2017-06-20 15:02,receive donations for marawi victims from san beda alabang planning for thursday relief drive meeting w lgu for 2nd batch training,"(['Quezon City', ' Philippines'], Location((14.6509905, 121.0486155, 0.0)))",en,0.071834,0.329972,0.159891,0.032665,0.011686,"['joy', 0.329972]"
natemurthy,2017-06-20 14:59,military launches fresh offensive in marawi,"(['Oakland', ' CA'], Location((37.8044557, -122.2713563, 0.0)))",en,0.008283,0.371512,0.238195,0.09237,0.39686,"['disgust', 0.39686]"
kristinamisajon,2017-06-20 14:58,reposting our marawi soldiers reading our letters credits to ms joyce ,"(['Republic of the Philippines'], Location((12.7503486, 122.7312101, 0.0)))",en,0.069733,0.095689,0.344964,0.355685,0.069954,"['fear', 0.355685]"
IAGorgph,2017-06-20 14:55,casiple marawi threat is beyond borders something that will not end even with the end of the crisis rather its only the beginning,"(['Cotabato City'], Location((7.1970344, 124.2351714, 0.0)))",en,0.092535,0.041606,0.307619,0.711899,0.107066,"['fear', 0.711899]"
OneMapua,2017-06-20 14:51,from the frontlines of marawi via,"(['Philippines'], Location((12.7503486, 122.7312101, 0.0)))",en,0.013027,0.284484,0.240458,0.34001,0.241772,"['fear', 0.34001]"
PIA_NorMin,2017-06-20 14:51,lives had been lost in marawi city all in the name of freedom and peace for this young widow who lost her,"(['Cagayan de Oro City'], Location((8.42980265, 124.682410212, 0.0)))",en,0.063139,0.143431,0.810726,0.078843,0.011453,"['sadness', 0.810726]"
philippinenews7,2017-06-20 14:49,military aims to clear marawi by end of ramadan  marawi city  philippine aircraft bombed rebel positions and ,"(['Philippines'], Location((12.7503486, 122.7312101, 0.0)))",en,0.097355,0.104959,0.245628,0.339099,0.183105,"['fear', 0.339099]"
philippinenews7,2017-06-20 14:49,armm exec 300 to 500 residents still trapped in marawi  the number of trapped residents in strifetorn marawi,"(['Philippines'], Location((12.7503486, 122.7312101, 0.0)))",en,0.112014,0.069161,0.268458,0.142514,0.237198,"['sadness', 0.268458]"
PIA_NorMin,2017-06-20 14:47,marawi still needs your help you may donate money or in kind and send it through philippine red cross details,"(['Cagayan de Oro City'], Location((8.42980265, 124.682410212, 0.0)))",en,0.029714,0.210807,0.057336,0.098758,0.042381,"['joy', 0.210807]"
PIA_NorMin,2017-06-20 14:47,civilians directly affected by marawi clash are being taken cared and processed in the provincial capitol in,"(['Cagayan de Oro City'], Location((8.42980265, 124.682410212, 0.0)))",en,0.190499,0.051002,0.291629,0.047629,0.033232,"['sadness', 0.291629]"
dswdfo10,2017-06-20 14:46,dswd acknowledges local donors for assistance to marawi crisisaffected families dswdmaymalasakithttps,"(['Cagayan De Oro City'], Location((8.42980265, 124.682410212, 0.0)))",en,0.014775,0.281907,0.173872,0.020277,0.065811,"['joy', 0.281907]"
PIA_NorMin,2017-06-20 14:41,a food chain has provided food packs to soldiers and police in marawi city for fathers day way to go full,"(['Cagayan de Oro City'], Location((8.42980265, 124.682410212, 0.0)))",en,0.170598,0.161303,0.312218,0.281598,0.280645,"['sadness', 0.312218]"
dzrhnews,2017-06-20 14:36,read marawi update as of june 19 6 pm  rh30 liezeloncepic,"(['Manila', ' Philippines'], Location((14.5906216, 120.9799696, 0.0)))",en,0.011089,0.079418,0.236966,0.117764,0.030649,"['sadness', 0.236966]"
DailyStarPH,2017-06-20 14:27,dailystarph philippines nearly a month since the war in marawi city started over 200 ,"(['Republic of the Philippines'], Location((12.7503486, 122.7312101, 0.0)))",en,0.134617,0.104687,0.553863,0.30551,0.137134,"['sadness', 0.553863]"
gmanews,2017-06-20 14:23,malacaang said it would be unlikely for marawi city to turn into a hub for isis fighters,"(['Philippines'], Location((12.7503486, 122.7312101, 0.0)))",en,0.238322,0.056564,0.554872,0.131991,0.157872,"['sadness', 0.554872]"
dwiz882,2017-06-20 14:21,16 read joint task force marawi updates on the rebellion in marawi as of 6pm of 19 june 2017 from gen padilla via jonathanandalpicd,"(['Pasig City', ' Philippines'], Location((9.7771753, 125.4915723, 0.0)))",en,0.05569,0.042852,0.249542,0.454125,0.158558,"['fear', 0.454125]"
PHLNewsOnline,2017-06-20 14:15,news5 expanded us role in marawi unlikely  palace,"(['Philippines'], Location((12.7503486, 122.7312101, 0.0)))",en,0.42997,0.024069,0.112281,0.042294,0.183915,"['anger', 0.42997]"
AksyonTV,2017-06-20 14:15,expanded us role in marawi unlikely  palace  breakingnews national ernestoabella,"(['TV5', ' Philippines'], Location((47.8967217, 106.887564062, 0.0)))",en,0.361593,0.032301,0.254019,0.055175,0.353627,"['anger', 0.361593]"
nerowattz,2017-06-20 14:08,palace says marawi will never become terror hub inquirermobilehttp0,"(['Makati City'], Location((14.5591272, 121.0202094, 0.0)))",en,0.134267,0.17333,0.290992,0.117428,0.112001,"['sadness', 0.290992]"
AndyDsecond,2017-06-20 14:04,congratulations to the pride of marawi city the summa cum laude of university of the philippines a student,"(['Cainta', ' Calabarzon'], Location((14.5925129, 121.123530488, 0.0)))",en,0.043605,0.809575,0.035033,0.006914,0.046216,"['joy', 0.809575]"
cerra410,2017-06-20 14:01,islamist terrorists also using drones to check on govt forces position in marawi via eaglenewsph,"(['Republic of the Philippines'], Location((12.7503486, 122.7312101, 0.0)))",en,0.158413,0.013879,0.554802,0.295549,0.157321,"['sadness', 0.554802]"
dswdserves,2017-06-20 14:01,dswd acknowledges local donors for assistance to marawi crisisaffected families read secjudy dswdmaymalasakit,"(['Quezon City', ' Philippines'], Location((14.6509905, 121.0486155, 0.0)))",en,0.013927,0.391985,0.176674,0.02858,0.104482,"['joy', 0.391985]"
pinoymommy,2017-06-20 14:00,even prisoners who are already experiencing deplorable conditions are willing to give up a meal to help the marawi evacuees,"(['Philippines'], Location((12.7503486, 122.7312101, 0.0)))",en,0.0866,0.217466,0.561292,0.017336,0.008398,"['sadness', 0.561292]"
pinoymommy,2017-06-20 13:59,instead of wasting the countrys resources on what is most probably a junket they should just donate this to marawi evacuees,"(['Philippines'], Location((12.7503486, 122.7312101, 0.0)))",en,0.20884,0.04463,0.677753,0.145034,0.138855,"['sadness', 0.677753]"
