PTVph,10/22/2017,9:34:0,cebu imam hopes to see new beautiful marawi,'Philippines',12.7503486,122.7312101,en,0.008024,0.825289,0.100695,0.036536,0.007959,joy,0.825289
PHLNewsOnline,10/22/2017,9:32:0,rappler marawi heroes soldier brings home brother killed in marawi,'Philippines',12.7503486,122.7312101,en,0.323657,0.187614,0.342885,0.226016,0.117554,sadness,0.342885
AFPManila,10/22/2017,9:26:0,philippine soldiers from marawi are welcomed home by their relatives in manila on october 20 as fighting there winds down photo,'Manila',14.5906216,120.9799696,en,0.061242,0.435497,0.156455,0.268122,0.081237,joy,0.435497
AlmonJeflex,10/22/2017,9:24:0,if marawi siege occurred during aquinos time after 3 days no more bombing marawi will just be using isis flag under governor hapilon,"'Cocofed Dorm', ' Davao City'",10.35518765,123.911870879,en,0.169184,0.043754,0.170859,0.133877,0.429721,disgust,0.429721
LOCALNEWSNgayon,10/22/2017,9:21:0,over 10 terrorists are still in marawi afp spokesman says  read via gma news,'Philippines',12.7503486,122.7312101,en,0.074265,0.024389,0.494635,0.433332,0.329963,sadness,0.494635
carmscastelo,10/22/2017,9:19:0,marawi heroes soldier brings home brother killed in marawi  via rapplerdotcom bicol lost 7 soldiers in marawi,'Philippines',12.7503486,122.7312101,en,0.180758,0.040941,0.581212,0.36041,0.151776,sadness,0.581212
EJMantillo,10/22/2017,9:0:0,topnews why it took 5 months to end marawi siege ,'Philippines',12.7503486,122.7312101,en,0.146793,0.186542,0.393165,0.121157,0.101094,sadness,0.393165
niljanjan,10/22/2017,8:47:0,one is in cebu one in manila one in marawi praying for your safety and pasalubongs panguli na mo ginobelloperez sailsqt rhylsteelhttps,'DVO',51.9948305,5.66616532284,en,0.050029,0.078743,0.291556,0.262872,0.050182,sadness,0.291556
EdgeDavao,10/22/2017,8:41:0,troops pullout starts in marawi,"'Davao City', ' Philippines'",7.22650725,125.454887691,en,0.084846,0.269998,0.138535,0.173326,0.045831,joy,0.269998
erleargonza,10/22/2017,8:36:0,dna test proves hapilon was among marawi fatalities,'Manila',14.5906216,120.9799696,en,0.106478,0.31636,0.221878,0.090482,0.024658,joy,0.31636
PHLNewsOnline,10/22/2017,8:22:0,rappler marawi heroes soldier brings home brother killed in marawi d8,'Philippines',12.7503486,122.7312101,en,0.323657,0.187614,0.342885,0.226016,0.117554,sadness,0.342885
mariaressa,10/22/2017,8:22:0,marawi heroes soldier brings home brother killed in marawi  via rapplerdotcom,'Philippines',12.7503486,122.7312101,en,0.196804,0.207413,0.363539,0.300091,0.151092,sadness,0.363539
ANCALERTS,10/22/2017,8:12:0,more soldiers from marawi return to manila,'Philippines',12.7503486,122.7312101,en,0.082653,0.209862,0.240173,0.205084,0.082688,sadness,0.240173
BinghayLougene,10/22/2017,8:1:0,bangon marawi massive housing by dutertes administration,"'Cebu City', ' Philippines'",10.3090298,123.8930839,en,0.144628,0.076623,0.115119,0.254402,0.187162,fear,0.254402
