dzbb,2017-06-10 16:33,1,0,"Tatlong sibilyan, na-rescue sa operasyon ng mga sundalo sa Marawi City ngayong hapon, binigyan ng tulong ng lokal na pamahalaan at ng DOH","(['Republic of the Philippines'], Location((12.7503486, 122.7312101, 0.0)))",,,873458199847989248,https://twitter.com/dzbb/status/873458199847989248,fil
24_indianews,2017-06-10 16:33,0,0,Daesh terrorists kill 13 Philippine marines in Marawi battle -,"(['Australia'], Location((-24.7761086, 134.755, 0.0)))",,,873458064560664576,https://twitter.com/24_indianews/status/873458064560664576,en
fauzan_mufc,2017-06-10 16:33,0,0,"Air strike on jihadist targets in Marawi, Philippines News",,,#,873457987871940608,https://twitter.com/fauzan_mufc/status/873457987871940608,en
chengxciao_,2017-06-10 16:32,0,0,detikcom: 13 Marinir Filipina Tewas dalam Pertempuran di Marawi C,"(['Shenzhen', ' China'], Location((22.5445697, 114.0545346, 0.0)))",,,873457790534201344,https://twitter.com/chengxciao_/status/873457790534201344,id
zyiteblog,2017-06-10 16:32,0,0,US special forces providing help in Marawi – embassy - The Manila Times Online,,,,873457709353504768,https://twitter.com/zyiteblog/status/873457709353504768,en
Najmahbee,2017-06-10 16:31,0,1,"Sa mga may kakilalang volunteer sa Marawi, kung pwede sana nilang irescue sila Billy and Bella. Mahal ko mga pusang yun. Huhuhuhuhu","(['Dubai', ' UAE'], Location((2.9470179, 30.961206, 0.0)))",,,873457650905759744,https://twitter.com/Najmahbee/status/873457650905759744,fil
bootscanlas,2017-06-10 16:31,0,0,Too much pride & incompetent leadership caused the lives of our military men in Marawi ! MarawiHeroes,"(['United States'], Location((39.7837304, -100.4458825, 0.0)))",,#,873457629523197952,https://twitter.com/bootscanlas/status/873457629523197952,en
zyiteblog,2017-06-10 16:31,0,0,US forces join Philippine troops to end Marawi city siege - US special forces are helping the Armed Forces of t... u,,,,873457609252188161,https://twitter.com/zyiteblog/status/873457609252188161,en
zyiteblog,2017-06-10 16:31,0,0,US special forces providing help in Marawi – embassy - MANILA: United States special forces are providing suppo...,,,,873457588217708544,https://twitter.com/zyiteblog/status/873457588217708544,en
serrano_rene,2017-06-10 16:31,0,0,Another fentanyl-fueled rant from the murderous psychopatic dictator-wannabe. You dared Maute to burn Marawi and they did. Whose fault is it,,,,873457478196895745,https://twitter.com/serrano_rene/status/873457478196895745,en
BurlingtonFiles,2017-06-10 16:31,3,4,"FaireSansDire BBC News - Air strike on jihadist targets in Marawi, Philippines","(['Everywhere'], Location((41.7776533, -72.6740756, 0.0)))",@,,873457465689604096,https://twitter.com/BurlingtonFiles/status/873457465689604096,en
primenewsau,2017-06-10 16:30,0,0,US forces join Philippine troops to end Marawi city siege -,"(['Australia'], Location((-24.7761086, 134.755, 0.0)))",,#,873457427680833536,https://twitter.com/primenewsau/status/873457427680833536,en
PHLNewsInsider,2017-06-10 16:30,0,0,"BREAKINGNEWSNOW:(DEVELOPING)AFP, kinumpirmang 13 sundalo ang nasawi sa bakbakan sa Marawi kahapon. | dzbb OnlyInThePhilippines",,@,# #,873457408911130624,https://twitter.com/PHLNewsInsider/status/873457408911130624,fil
eTurboNews,2017-06-10 16:30,0,0,13 Philippine marines killed in Marawi,,,,873457330347757569,https://twitter.com/eTurboNews/status/873457330347757569,en
guyelster,2017-06-10 16:30,0,0,Remember that Duterte have said that he does not want any US assistance anymore? so the US gives him assistance in Marawi,"(['Israel'], Location((30.8760272, 35.0015196, 0.0)))",,#,873457303298740224,https://twitter.com/guyelster/status/873457303298740224,en
_Reality_Check_,2017-06-10 16:30,0,0,France 24: US forces assist Philippines military as Marawi siege rages on France24,"(['Southern Michigan'], Location((41.9429134, -83.9460166, 0.0)))",,#,873457256020537344,https://twitter.com/_Reality_Check_/status/873457256020537344,en
abcnews,2017-06-10 16:30,20,8,"13 more Philippine marines dead, US forces join fight as Marawi city siege continues MarawiClash","(['Australia'], Location((-24.7761086, 134.755, 0.0)))",,#,873457222948233216,https://twitter.com/abcnews/status/873457222948233216,en
omeelemilio,2017-06-10 16:30,0,0,Remember this noon napaaway ako ng fan ni maris hahaha kasagsagan pa yun ng gyera sa marawi. Btangn pn uto ah babae haha iniblock ka sasayan,"(['Ph'], Location((12.44249325, 122.160395164, 0.0)))",,,873457221593554945,https://twitter.com/omeelemilio/status/873457221593554945,fil
RiedsBudiono,2017-06-10 16:29,1,2,13 Marinir Philipina Gugur malawan Militan Marawi. Waspadai Militan Radikal di Indonesia? triefince - lewat ABC,"(['Denpasar', ' Bali'], Location((-8.6691324, 115.218809241, 0.0)))",@ @,,873457183542845440,https://twitter.com/RiedsBudiono/status/873457183542845440,id
rstongio,2017-06-10 16:29,0,1,Marawi hahahaha ika menanka?,,,,873457143818661888,https://twitter.com/rstongio/status/873457143818661888,fil
mypk247,2017-06-10 16:29,0,0,Militants kill 13 Philippine marines in wartorn Marawi city,,,,873457105457618944,https://twitter.com/mypk247/status/873457105457618944,en
jobellebusnag,2017-06-10 16:29,1,3,Thank you Marawi Heroes ..,,,#,873457098402783232,https://twitter.com/jobellebusnag/status/873457098402783232,en
PHLNewsInsider,2017-06-10 16:28,0,0,AFP: Isnilon Hapilon is still in Marawi. He is still in the area. (via gmanews),,@,,873456932186537987,https://twitter.com/PHLNewsInsider/status/873456932186537987,en
anathoth4art,2017-06-10 16:28,0,0,US Forces Assist Philippines In Battle To End Marawi City Siege UC9,"(['Salmiya', ' Kuwait'], Location((6.9582435, 80.7728553, 0.0)))",,,873456881183866880,https://twitter.com/anathoth4art/status/873456881183866880,en
kiyeowong,2017-06-10 16:28,0,0,"RT detikcom 13 Marinir Filipina Tewas dalam Pertempuran di Marawi """"",,,,873456830160273408,https://twitter.com/kiyeowong/status/873456830160273408,id
dzbb,2017-06-10 16:28,1,0,"Bakbakan, muling sumiklab sa Marawi City ngayong hapon, airstrike, isinagawa ng militar SuperBalitaSaHapon","(['Republic of the Philippines'], Location((12.7503486, 122.7312101, 0.0)))",,#,873456814863654913,https://twitter.com/dzbb/status/873456814863654913,fil
LuisCampos_ST,2017-06-10 16:27,0,0,US forces assist Philippines military as Marawi siege rages on US forces are providing the Philippines with technical assistance to end a s…,,,,873456557547245568,https://twitter.com/LuisCampos_ST/status/873456557547245568,en
omeelemilio,2017-06-10 16:26,0,0,"Aya tabo maiilay sa social media na NBA, kamusta naman ang Marawi?","(['Ph'], Location((12.44249325, 122.160395164, 0.0)))",,,873456430509989888,https://twitter.com/omeelemilio/status/873456430509989888,fil
GEMAWAHYUH,2017-06-10 16:26,0,0,"info - Antisipasi Konflik ISIS di Marawi, TNI Kerahkan Kapal Selam Jaga Perbatasan","(['Pagaden - Subang'], Location((-6.4561464, 107.79642, 0.0)))",@,,873456281725620224,https://twitter.com/GEMAWAHYUH/status/873456281725620224,id
CrimsonMariner,2017-06-10 16:26,0,0,"Air strike on jihadist targets in Marawi, Philippines d","(['Owens Cross Roads AL'], Location((34.569804, -86.4747591694, 0.0)))",,,873456237496590336,https://twitter.com/CrimsonMariner/status/873456237496590336,en
usapangpinas,2017-06-10 16:26,0,0,Hoping to raise the Philippine Flag in all corners of Marawi on June 12 to celebrate independence from terrorists 0,,,,873456233315020801,https://twitter.com/usapangpinas/status/873456233315020801,en
cochesvoladores,2017-06-10 16:25,0,0,Pasukan Khusus AS Bantu Militer Filipina Rebut Kembali Marawi - Detikcom,"(['Espa\xc3\xb1a'], Location((40.0028028, -4.003104, 0.0)))",,,873456136850223105,https://twitter.com/cochesvoladores/status/873456136850223105,id
Rus_Eng_News,2017-06-10 16:25,0,0,"In Marawi, the militants killed 13 Philippine Marines: news Russia","(['Canada'], Location((61.0666922, -107.9917071, 0.0)))",,# #,873456110069481472,https://twitter.com/Rus_Eng_News/status/873456110069481472,en
BangkokPostNews,2017-06-10 16:25,2,0,13 Philippine marines killed in Marawi,"(['Thailand'], Location((14.8971921, 100.83273, 0.0)))",,,873455995770388480,https://twitter.com/BangkokPostNews/status/873455995770388480,en
twitberitadunia,2017-06-10 16:24,0,0,Pasukan elite AS bantu Filipina bebaskan Kota Marawi: Pasukan elite Amerika Serikat sedang… Beritadunia BBC,"(['Indonesia'], Location((-4.7993356, 114.5632032, 0.0)))",,# #,873455902350872582,https://twitter.com/twitberitadunia/status/873455902350872582,id
showstopper_29,2017-06-10 16:24,1,1,"punta ka ng Marawi,lumaban ka sa Maute Group","(['Glendale', ' CA'], Location((34.142498, -118.248596, 0.0)))",,,873455872818556928,https://twitter.com/showstopper_29/status/873455872818556928,fil
newsheadlinesng,2017-06-10 16:24,0,0,Islamists kill 13 Philippine marines in wartorn Marawi city READ MORE,"(['Nigeria'], Location((9.6000359, 7.9999721, 0.0)))",,,873455848496013312,https://twitter.com/newsheadlinesng/status/873455848496013312,en
StevenSGrant1,2017-06-10 16:24,0,0,"Air strike on jihadist targets in Marawi, Philippines c","(['ALSWEAR', ' UK'], Location((50.9846428, -3.8200882, 0.0)))",,,873455834272940032,https://twitter.com/StevenSGrant1/status/873455834272940032,en
Thailand_Inf,2017-06-10 16:24,0,0,13 Philippine marines killed in Marawi 2 news,,,#,873455818456408064,https://twitter.com/Thailand_Inf/status/873455818456408064,en
weekendround,2017-06-10 16:24,0,0,Pamplona US forces assist Philippines military as Marawi siege rages on,,,#,873455726953365504,https://twitter.com/weekendround/status/873455726953365504,en
TeamAFP,2017-06-10 16:23,10,8,Official statement on the recent major armed engagement in Marawi City. 0d,"(['Philippines'], Location((12.7503486, 122.7312101, 0.0)))",,,873455575719346176,https://twitter.com/TeamAFP/status/873455575719346176,en
PHLNewsInsider,2017-06-10 16:23,0,0,"AFP says Ominta Romato Maute, mother of Maute brothers, has been transported out of Marawi and undergoing investigation.",,,,873455565371973637,https://twitter.com/PHLNewsInsider/status/873455565371973637,en
thenaimcode,2017-06-10 16:23,0,0,"in News Online–Air strike on jihadist targets in Marawi, Philippines","(['Melbourne', ' Victoria'], Location((-37.8142176, 144.9631608, 0.0)))",,#1,873455477396471808,https://twitter.com/thenaimcode/status/873455477396471808,en
GlobalZarfati,2017-06-10 16:23,1,1,"Latest | Philippine Military Confirmed that Yesterday it Lost 13 Soldiers, with another 51 injured during fighting with ISIS in Marawi City","(['Global'], Location((43.7283874, -79.3491487932, 0.0)))",,#,873455444823506945,https://twitter.com/GlobalZarfati/status/873455444823506945,en
TerrorEvents,2017-06-10 16:22,28,13,Philippines Marawi - Military confirming reports IS-linked Maute brothers killed in firefight -,,,# # # #,873455379870560256,https://twitter.com/TerrorEvents/status/873455379870560256,en
LeadersNG,2017-06-10 16:22,0,0,PHILIPPINE | Islamists kill 13 marines in wartorn Marawi city,"(['London', ' England'], Location((51.5073219, -0.1276474, 0.0)))",,,873455301185372160,https://twitter.com/LeadersNG/status/873455301185372160,en
thus_spake,2017-06-10 16:22,0,0,"Fighting continues after militants linked to IS, seized parts of Marawi last month","(['England', ' Great Britain.'], Location((52.7954791, -0.540240286617, 0.0)))",,,873455273746329600,https://twitter.com/thus_spake/status/873455273746329600,en
MNyman_COI,2017-06-10 16:22,0,0,"bbc Air strike on jihadist targets in Marawi, Philippines asia","(['Finland'], Location((63.2467777, 25.9209164, 0.0)))",,# #,873455265076719617,https://twitter.com/MNyman_COI/status/873455265076719617,en
riskinfo,2017-06-10 16:22,0,0,"BBC WorldNews Air strike on jihadist targets in Marawi, Philippines","(['UK'], Location((54.7023545, -3.2765753, 0.0)))",,#,873455261104603136,https://twitter.com/riskinfo/status/873455261104603136,en
AgenturRU,2017-06-10 16:22,0,0,.. US-Truppen unterstützen Philippinen bei Schlacht um Marawi,"(['Berlin'], Location((52.5170365, 13.3888599, 0.0)))",,,873455234160500736,https://twitter.com/AgenturRU/status/873455234160500736,de
freddie1999,2017-06-10 16:22,0,0,13 Philippine marines killed as fighting with jihadists continues in Marawi IslamicState Philippines,"(['England'], Location((52.7954791, -0.540240286617, 0.0)))",,# # #,873455202631921665,https://twitter.com/freddie1999/status/873455202631921665,en
Baron28Baron286,2017-06-10 16:22,0,0,13 נחתים פיליפינים נהרגו בהתקלות עם אנשי דע״ש אשר מחזיק 100 בני ערובה בעיר Marawi שבדרום המדינה.,"(['JERUSALEM ISRAEL'], Location((31.78911765, 35.2229730135, 0.0)))",,#,873455201507827713,https://twitter.com/Baron28Baron286/status/873455201507827713,iw
fruitoftheloom2,2017-06-10 16:21,0,0,For our fellow Filipinos who want to know efforts being done for Marawi.,"(['london'], Location((51.5073219, -0.1276474, 0.0)))",,,873455142258982912,https://twitter.com/fruitoftheloom2/status/873455142258982912,en
commrguanzon,2017-06-10 16:21,3,8,COMELEC will give temporary voters' IDs to Marawi evacuees if registered,"(['COMELEC'], Location((14.6592003, 121.02949111, 0.0)))",@,,873455137418747904,https://twitter.com/commrguanzon/status/873455137418747904,en
AlimMarissa,2017-06-10 16:21,0,0,BREAKING NEWS: ARESTADO ANG MGA PULIS NG HINDI ITO HUMINTO SA CHECKPOINT SA MARAWI,"(['eastern Europe'], Location((50.2656898, 18.6975624709, 0.0)))",,,873455056158425089,https://twitter.com/AlimMarissa/status/873455056158425089,fil
AfghanistanTest,2017-06-10 16:21,0,0,"Afghanistan Air strike on jihadist targets in Marawi, Philippines Afghanistan",,,# #,873455012676075520,https://twitter.com/AfghanistanTest/status/873455012676075520,en
GlobalZarfati,2017-06-10 16:21,1,0,Philippine military says 13 marines killed in fighting with Muslim militants who have laid siege to Marawi city. AP,"(['Global'], Location((43.7283874, -79.3491487932, 0.0)))",@,,873455006376239104,https://twitter.com/GlobalZarfati/status/873455006376239104,en
HellsGatePhl,2017-06-10 16:21,0,0,"MILF leader hits Marawi siege plotters, calls them ‘misguided’ via manila_bulletin","(['Molino', ' Bacoor', ' Philippines'], Location((2.448942, -76.5986534, 0.0)))",@,,873454982720217090,https://twitter.com/HellsGatePhl/status/873454982720217090,en
parkleeshin02,2017-06-10 16:20,0,1,Tara hatid n nten sa marawi yan kume angas d nmn manalo sa ginebra,"(['Seoul', ' Republic of Korea'], Location((37.5666791, 126.9782914, 0.0)))",,,873454927586054144,https://twitter.com/parkleeshin02/status/873454927586054144,fil
thus_spake,2017-06-10 16:20,0,0,US special forces are helping the Armed Forces of the Philippines (AFP) to end a siege in Marawi by militants al...,"(['England', ' Great Britain.'], Location((52.7954791, -0.540240286617, 0.0)))",,,873454927334576128,https://twitter.com/thus_spake/status/873454927334576128,en
Limportant_fr,2017-06-10 16:20,2,2,Philippines : des troupes US aident à mettre fin au siège de Marawi par l'EI D,"(['Paris', ' France'], Location((48.8566101, 2.3514992, 0.0)))",,#,873454846090907648,https://twitter.com/Limportant_fr/status/873454846090907648,fr
phaxyn,2017-06-10 16:20,0,0,"BBCWorld: Air strike on jihadist targets in Marawi, Philippines d","(['Maldives', "" Male' City""], Location((25.2258151, 55.1830144241, 0.0)))",,,873454799261454337,https://twitter.com/phaxyn/status/873454799261454337,en
imax111,2017-06-10 16:20,0,0,"StratSentinel: BREAKING US special forces providing support in Philippine city of Marawi, besieged by ISIL-linked…","(['everywhere'], Location((41.7776533, -72.6740756, 0.0)))",,#,873454721549443073,https://twitter.com/imax111/status/873454721549443073,en
msianinsight,2017-06-10 16:20,0,0,13 Philippine marines die in Marawi clashes,"(['Kuala Lumpur City'], Location((7.0385065, 125.5072204, 0.0)))",,,873454705917087744,https://twitter.com/msianinsight/status/873454705917087744,en
iss_iskandar,2017-06-10 16:19,0,0,"13 askar marin Filipina maut: MARAWI, Filipina: Seramai 13 askar marin… ۞ Salam Ramadhan ۞","(['Sepang', ' Selangor'], Location((2.6923752, 101.7501574, 0.0)))",,,873454668650868736,https://twitter.com/iss_iskandar/status/873454668650868736,ms
inquirerdotnet,2017-06-10 16:19,21,43,LTC Herrera confirms US operatives now in Marawi |,"(['Makati City'], Location((14.5591272, 121.0202094, 0.0)))",@,,873454582130782212,https://twitter.com/inquirerdotnet/status/873454582130782212,en
RTGWorld,2017-06-10 16:19,0,0,"Air strike on jihadist targets in Marawi, Philippines RTGWorld",,,#,873454555744305152,https://twitter.com/RTGWorld/status/873454555744305152,en
dibakarme,2017-06-10 16:19,0,0,"From BBC World Air strike on jihadist targets in Marawi, Philippines d","(['Tbilisi', ' Georgia'], Location((41.6935247, 44.8015019, 0.0)))",,,873454512496943104,https://twitter.com/dibakarme/status/873454512496943104,en
vkj73,2017-06-10 16:19,0,0,"BBCWorld : Air strike on jihadist targets in Marawi, Philippines (via Twitter )9","(['Mumbai', ' India'], Location((19.1334321, 72.8882172, 0.0)))",,,873454483644305408,https://twitter.com/vkj73/status/873454483644305408,en
lutwem,2017-06-10 16:18,0,0,"Air strike on jihadist targets in Marawi, Philippines 20""","(['Nigeria'], Location((9.6000359, 7.9999721, 0.0)))",,,,,en
nakhon224,2017-06-10 16:18,0,0,"13 Philippine marines killed in Marawi"" 2""","(['\xe0\xb8\x99\xe0\xb8\x84\xe0\xb8\xa3\xe0\xb8\xa8\xe0\xb8\xa3\xe0\xb8\xb5\xe0\xb8\x98\xe0\xb8\xa3\xe0\xb8\xa3\xe0\xb8\xa1\xe0\xb8\xa3\xe0\xb8\xb2\xe0\xb8\x8a', ' \xe0\xb8\x9b\xe0\xb8\xa3\xe0\xb8\xb0\xe0\xb9\x80\xe0\xb8\x97\xe0\xb8\xa8\xe0\xb9\x84\xe0\xb8\x97\xe0\xb8\xa2'], Location((8.4321444, 99.9638643, 0.0)))",,,873454332225740801,https://twitter.com/nakhon224/status/873454332225740801,en
Ptrsnpllns,2017-06-10 16:18,0,1,Grabe!!! Ang tatapang naman ng mga tao dito! Dapat ito yung mga pinapadala sa marawi eh!! Sayang mga sundalong nagbubuwis ng buhay!,"(['Mandaluyong City', ' National Cap'], Location((14.5774598, 121.0334694, 0.0)))",,,873454258229661696,https://twitter.com/Ptrsnpllns/status/873454258229661696,fil
Figikung,2017-06-10 16:17,0,0,"Air strike on jihadist targets in Marawi, Philippines BBCWorld","(['United States'], Location((39.7837304, -100.4458825, 0.0)))",,,873454088083701760,https://twitter.com/Figikung/status/873454088083701760,en
ragaminfonews,2017-06-10 16:17,0,0,"BBCWorld : Air strike on jihadist targets in Marawi, Philippines (via Twitter )1",,,,873454048917192704,https://twitter.com/ragaminfonews/status/873454048917192704,en
superonom,2017-06-10 16:17,0,0,"RT BBCWorld Air strike on jihadist targets in Marawi, Philippines """"",,,,873454015434158080,https://twitter.com/superonom/status/873454015434158080,en
DannyShookNews,2017-06-10 16:17,0,0,US-Truppen unterstützen Philippinen bei Schlacht um Marawi DSNGerman aktuelles,"(['Dreieich', ' Germany'], Location((50.011974, 8.7123912, 0.0)))",,# #,873453976469065729,https://twitter.com/DannyShookNews/status/873453976469065729,de
ShafranNaizer,2017-06-10 16:17,0,0,"Air strike on jihadist targets in Marawi, Philippines BBCWorld June 10, 2017 at 01:45PM","(['Galle Srilanka'], Location((6.0328139, 80.214955, 0.0)))",,,873453967900102657,https://twitter.com/ShafranNaizer/status/873453967900102657,en
theluckyman,2017-06-10 16:16,0,0,"BBC Alert! Air strike on jihadist targets in Marawi, Philippines U","(['United States'], Location((39.7837304, -100.4458825, 0.0)))",,#,873453760592400384,https://twitter.com/theluckyman/status/873453760592400384,en
AquinasCosmas,2017-06-10 16:16,0,0,Fighting continues after militants linked to so-called Islamic State seized components of Marawi in the southern...,"(['Lagos Nigeria'], Location((6.4550575, 3.3941795, 0.0)))",,,873453705651036161,https://twitter.com/AquinasCosmas/status/873453705651036161,en
sujon_mia2005,2017-06-10 16:16,0,0,"Air strike on jihadist targets in Marawi, Philippines 1",,,,873453694465060865,https://twitter.com/sujon_mia2005/status/873453694465060865,en
k22snyder,2017-06-10 16:15,0,0,"This just in... Air strike on jihadist targets in Marawi, Philippines",,,,873453666799419394,https://twitter.com/k22snyder/status/873453666799419394,en
guyelster,2017-06-10 16:15,0,0,Philippines says 'strong indications' that ISIS-linked Maute militant brothers dead in the ongoing clashes in Marawi,"(['Israel'], Location((30.8760272, 35.0015196, 0.0)))",,# # #,873453651242745856,https://twitter.com/guyelster/status/873453651242745856,en
HatawTabloid,2017-06-10 16:15,0,0,Vin d’honneur kanselado MARAWI LIBERATION ASAHAN SA LUNES...,"(['Intramuros', ' Manila'], Location((14.5905862, 120.97533, 0.0)))",,,873453649699237889,https://twitter.com/HatawTabloid/status/873453649699237889,fil
4LifeTFCebu,2017-06-10 16:15,0,0,MARAWI NIGHTMARE: The fighting intensifies,,,,873453565502783488,https://twitter.com/4LifeTFCebu/status/873453565502783488,en
MyAlliesNews,2017-06-10 16:15,0,0,Air strike targets jihadists in Marawi 9,,,,873453565397827584,https://twitter.com/MyAlliesNews/status/873453565397827584,en
annie44839700,2017-06-10 16:15,0,0,"Wow! 143redangel went to marawi, such a brave woman.. please take care angel ALDUBPusuan",,@,#,873453480949628928,https://twitter.com/annie44839700/status/873453480949628928,en
yuniaranggrai12,2017-06-10 16:15,0,0,Filipina minta bantuan AS buat lawan militan di Marawi,,,,873453458099019777,https://twitter.com/yuniaranggrai12/status/873453458099019777,ms
franceworldnews,2017-06-10 16:15,0,0,"Air strike on jihadist targets in Marawi, Philippines. France surrenders.",,,,873453452352991233,https://twitter.com/franceworldnews/status/873453452352991233,en
UpdatesMalaysia,2017-06-10 16:14,0,0,Islamists kill 13 Philippine marines in wartorn Marawi city | World - kill 13,"(['Petaling Jaya', ' Selangor'], Location((3.1055929, 101.642697, 0.0)))",,,873453417183690753,https://twitter.com/UpdatesMalaysia/status/873453417183690753,en
techjollof,2017-06-10 16:14,0,0,"Air strike on jihadist targets in Marawi, Philippines - techjollof","(['Planet Earth'], Location((47.5044752, 19.1251107, 0.0)))",@,,873453376117387264,https://twitter.com/techjollof/status/873453376117387264,en
AiFroztbyte,2017-06-10 16:14,1,0,After so many soldiers and civilian killed by Maute/ISIS in Marawi.Sen. Hontiveros believed this is not an act of violent or an invasion.,,,,873453305099374592,https://twitter.com/AiFroztbyte/status/873453305099374592,en
substitute,2017-06-10 16:14,0,0,AFP and Reuters report US troops fighting in Marawi per the embassy.,"(['Pollo del Mar', ' CA'], Location((23.1692068, -82.1419517, 0.0)))",,,873453294105919489,https://twitter.com/substitute/status/873453294105919489,en
BraveLeon66,2017-06-10 16:14,0,0,Marawi (Mindanao) : état de guerre et loi martiale dans le Sud Philippines EI EIIL USA,"(['Perpignan', ' France'], Location((42.6953868, 2.8844713, 0.0)))",,# # # # # # #,873453255568838657,https://twitter.com/BraveLeon66/status/873453255568838657,fr
imax111,2017-06-10 16:14,0,0,"BREAKING US special forces providing support in Philippine city of Marawi, besieged by ISIL-linked fighters: emba…","(['everywhere'], Location((41.7776533, -72.6740756, 0.0)))",,#,873453251156422657,https://twitter.com/imax111/status/873453251156422657,en
PhilippineStar,2017-06-10 16:14,0,0,. ICRC expresses concers over health of Marawi evacuees with the onset of rainy season. | shecrisostomo,"(['Philippines'], Location((12.7503486, 122.7312101, 0.0)))",@ @,,873453240280432642,https://twitter.com/PhilippineStar/status/873453240280432642,en
inquirer_libre,2017-06-10 16:13,0,0,It’s Not Too Late to Help Out the Citizens of Marawi City 1,"(['Philippines'], Location((12.7503486, 122.7312101, 0.0)))",,,873453145032208385,https://twitter.com/inquirer_libre/status/873453145032208385,en
ErnestoSuidry,2017-06-10 16:13,1,2,Filipinas: 13 soldados muertos combates con islamistas eleva a 58 los soldados muertos Marawi. vía LOrientLeJour,,@,# #,873453100127977473,https://twitter.com/ErnestoSuidry/status/873453100127977473,es
anawalINQ,2017-06-10 16:13,6,5,LTC Herrera confirms US operatives now in Marawi inquirerdotnet InqNational,,@ @,,873453081484156928,https://twitter.com/anawalINQ/status/873453081484156928,en
jovelyn_n,2017-06-10 16:13,0,0,"Lalaking hinihinalang binugbog umano ng mga sundalo sa Marawi, nasagip",,,,873453024731176960,https://twitter.com/jovelyn_n/status/873453024731176960,fil
andri000me_11,2017-06-10 16:12,0,0,"RT SINDOnews Perang Sengit Lawan Maute di Marawi, 13 Marinir Filipina Terbunuh """"",,,,873452892291829761,https://twitter.com/andri000me_11/status/873452892291829761,id
kevinyandg,2017-06-10 16:12,0,0,Oh so now Pres. Duterte wants our support? Philippines ISIL Marawi,,,# # #,873452858103873536,https://twitter.com/kevinyandg/status/873452858103873536,en
pirsarwarras,2017-06-10 16:12,0,0,BREAKING: U.S. forces finally jumped into theScene to assist thePhilippineArmy driveISIS out ofBesieged city-Marawi,"(['NZ'], Location((-41.5000831, 172.8344077, 0.0)))",,#,873452857298526208,https://twitter.com/pirsarwarras/status/873452857298526208,en
priznajem_hr,2017-06-10 16:12,0,1,New post: Američke specijalne snage pomažu filipinskoj vojsci u borbama za Marawi,"(['Republic of Croatia'], Location((45.5643442, 17.0118954, 0.0)))",,,873452828383170560,https://twitter.com/priznajem_hr/status/873452828383170560,bs
RSumalipao,2017-06-10 16:12,0,0,Yes ma'am we will! IDs for Marawi evacuees!,"(['COMELEC'], Location((14.6592003, 121.02949111, 0.0)))",,,873452804538417152,https://twitter.com/RSumalipao/status/873452804538417152,en
shecrisostomo,2017-06-10 16:12,0,0,. ICRC expresses concers over health of Marawi evacuees w/ the onset of rainy season. PhilippineStar,"(['Philippines'], Location((12.7503486, 122.7312101, 0.0)))",@ @,,873452763287396353,https://twitter.com/shecrisostomo/status/873452763287396353,en
