DungBAPham,2017-06-10 19:48,0,0,Tôi đã thêm video vào danh sách phát US special forces aiding Philippine army in Marawi trên YouTube,,@,,873507214463561728,https://twitter.com/DungBAPham/status/873507214463561728,vi
DungBAPham,2017-06-10 19:48,0,0,US special forces aiding Philippine army in Marawi: via YouTube,,@,,873507194876162048,https://twitter.com/DungBAPham/status/873507194876162048,en
LawrenceMachado,2017-06-10 19:48,0,0,"13 more Philippine marines dead, US forces join fight as Marawi city siege continues via abcnews","(['Castle Hill', ' NSW', ' Australia'], Location((-33.7315318, 151.0071718, 0.0)))",@,,873507154300239872,https://twitter.com/LawrenceMachado/status/873507154300239872,en
lysternii,2017-06-10 19:48,0,0,Ex mayor daw sa marawi .. pero not sure,,,,873507108863463425,https://twitter.com/lysternii/status/873507108863463425,fil
dayuduan,2017-06-10 19:47,0,0,Lawyers to Duterte: Stop martial law abuses in Marawi via rapplerdotcomhttp://,,@,,873506807620042752,https://twitter.com/dayuduan/status/873506807620042752,en
reccadear,2017-06-10 19:47,1,15,Then go to Marawi and help the people there. Having a vacation doesn't mean she doesn't care about the plight of other people.,"(['Las Pinas City'], Location((-1.0917672, -80.8977939, 0.0)))",,,873506807511109632,https://twitter.com/reccadear/status/873506807511109632,en
Trendsiana,2017-06-10 19:46,0,0,ISIS claims to disabling of 1 Philippine Army armored vehicle with rocket-propelled grenade yesterday in Marawi,"(['Worldwide'], Location((53.4573434, -2.22698994022, 0.0)))",,# #,873506730491101184,https://twitter.com/Trendsiana/status/873506730491101184,en
Hera_Noticias,2017-06-10 19:46,0,0,Filipinas: Grupo Yihadista mata a 13 soldados en sitiada Marawi...,,,#,873506541525139456,https://twitter.com/Hera_Noticias/status/873506541525139456,es
didaherself,2017-06-10 19:45,0,0,Why are these barbarisms committed by the gov't not reported at all PrayForMarawi,"(['K\xc3\xb8benhavn'], Location((55.6867243, 12.5700724, 0.0)))",,#,873506442803765249,https://twitter.com/didaherself/status/873506442803765249,en
AkhBen,2017-06-10 19:45,0,0,"Yes, war torn Marawi City. I'll come back again, inshaAllah. marawicity marawi…","(['Cotabato City', ' Soccsksargen'], Location((7.1970344, 124.2351714, 0.0)))",,# #,873506410885140481,https://twitter.com/AkhBen/status/873506410885140481,en
burongmangga,2017-06-10 19:45,0,0,marawi,,,#,873506313346490369,https://twitter.com/burongmangga/status/873506313346490369,fil
MyFreedomNews,2017-06-10 19:44,1,0,ISIS vs Phillipine Army in Marawi City,"(['United Kingdom'], Location((25.2232283, 55.1594933009, 0.0)))",,,873506065744142337,https://twitter.com/MyFreedomNews/status/873506065744142337,en
Afropages,2017-06-10 19:43,0,0,"Journal du Cameroun - Philippines/islamistes: forces spéciales US à Marawi, 13 soldats philippins tués Afropages","(['France'], Location((46.603354, 1.8883335, 0.0)))",@,,873505978414755840,https://twitter.com/Afropages/status/873505978414755840,fr
dbyuda,2017-06-10 19:41,0,0,Gempur habis aja lah marawi. Bom atom bila perlu. ISIS itu bukan manusia. Mereka mesin pembunuh. Itu kata duterte jg sih,"(['The city of god'], Location((54.90490915, -1.37535264746, 0.0)))",,,873505510091141121,https://twitter.com/dbyuda/status/873505510091141121,ms
piperlois,2017-06-10 19:41,0,0,Wow. 143redangel was IN Marawi. She got THAT close!!!!! Maa sha Allah! therealangellocsin's photo,,@,,873505481943261185,https://twitter.com/piperlois/status/873505481943261185,en
yusufledesma,2017-06-10 19:41,0,0,inquirerdotnet CHR urges gov’t to stop airstrikes in Marawi,"(['Manila'], Location((14.5906216, 120.9799696, 0.0)))",@,,8.73505E+17,https://twitter.com/yusufledesma/status/873505464474112000,en
robotbum,2017-06-10 19:41,0,0,13 Philippines Marines Killed in Maute-Held Marawi City via EnglishAlwaght,"(['At home'], Location((35.4588343, -97.6218320998, 0.0)))",@,,873505338196017159,https://twitter.com/robotbum/status/873505338196017159,en
Haysmart,2017-06-10 19:40,0,0,13 marines killed as fighting rages in Marawi City c,"(['Next Bus stop'], Location((51.6314179, -0.7562189, 0.0)))",,,873505108688084996,https://twitter.com/Haysmart/status/873505108688084996,en
1freetruth,2017-06-10 19:39,0,0,13 marines killed as fighting rages in Marawi City Occupy OWS occupywallstreet OccupyHQ OccupyInfo OWSinfo …,,,# # # # # # #,873504813777944576,https://twitter.com/1freetruth/status/873504813777944576,en
aitor24584,2017-06-10 19:38,0,0,"Fuerzas especiales de EE.UU. colaboran con el Ejército de Filipinas para recuperar la ciudad sureña de Marawi,...",,,,873504691711344640,https://twitter.com/aitor24584/status/873504691711344640,es
clairelagman_,2017-06-10 19:37,0,1,dinamay pa niya marawi HAHAHAHHAHAHAHAHA,,,,873504419719004160,https://twitter.com/clairelagman_/status/873504419719004160,fil
theglobalworld,2017-06-10 19:36,0,0,13 marines killed as fighting rages in Marawi City: US confirms it is 'assisting… news,"(['Universe'], Location((55.85881005, -4.00208685913, 0.0)))",,#,873504135605256193,https://twitter.com/theglobalworld/status/873504135605256193,en
volkskrant,2017-06-10 19:36,2,2,Amerikaanse commando's ondersteunen Filipijns leger bij offensief tegen IS bij Marawi,"(['Amsterdam'], Location((52.3745403, 4.89797550562, 0.0)))",,,873504086972403714,https://twitter.com/volkskrant/status/873504086972403714,nl
rmnnetworks,2017-06-10 19:35,0,0,"LatestNews AFP, tiniyak na hindi iiwan sa ere ang Marawi City kahit na masugpo ang Maute Group MauteGroup... 1",,,# #,873503931309096960,https://twitter.com/rmnnetworks/status/873503931309096960,fil
burongmangga,2017-06-10 19:35,0,0,Marawi Casualtyhttps://,,,# #,873503880583159808,https://twitter.com/burongmangga/status/873503880583159808,en
clrnctrrs,2017-06-10 19:35,0,1,Aydana jo ngeni de pa pepalto ing saleponu ku! Pero jo aydana mipakananu ne ing kaluguran ta keng marawi?,"(['ph'], Location((12.44249325, 122.160395164, 0.0)))",,,873503876250578944,https://twitter.com/clrnctrrs/status/873503876250578944,jv
WIONews,2017-06-10 19:35,0,5,US aids Philippines to flush out Islamist fighters from Marawi,"(['South Asia'], Location((-32.1759338, -61.7189621, 0.0)))",,,873503874115620865,https://twitter.com/WIONews/status/873503874115620865,en
onetwfour,2017-06-10 19:34,0,0,I miss u Marawi:-(( kaulan kaya kita masisilayan ulit?? PrayForMarawi,"(['Marawi city'], Location((8.0034938, 124.286626, 0.0)))",,#,873503755077001216,https://twitter.com/onetwfour/status/873503755077001216,fil
Owais04642093,2017-06-10 19:34,0,0,US forces join Philippine troops to end Marawi city siege - ABC News,"(['sydney'], Location((-33.8548157, 151.2164539, 0.0)))",,,873503741164388352,https://twitter.com/Owais04642093/status/873503741164388352,en
salveasis,2017-06-10 19:34,0,1,"‘Di natakot sa giyera, Angel bumisita sa marawi! pilstarngayon","(['port area', ' manila'], Location((14.5889597, 120.9686124, 0.0)))",@,,873503732276772864,https://twitter.com/salveasis/status/873503732276772864,fil
doctordeeram,2017-06-10 19:34,0,0,daghan2 napod gkan Marawi nag refugee dri,"(['Brgy. Bubbles'], Location((5.0118792, 119.7648769, 0.0)))",,,873503589607415808,https://twitter.com/doctordeeram/status/873503589607415808,ceb
NarrendraM,2017-06-10 19:34,0,0,RT W7VOA: Philippines military says US forces providing technical assistance to end siege of Marawi.,"(['Mumbai', ' India'], Location((19.1334321, 72.8882172, 0.0)))",,#,873503571098165248,https://twitter.com/NarrendraM/status/873503571098165248,en
carol_sundahl,2017-06-10 19:34,0,0,"They are not fighting. They are just providing technical support,"" military spokesman told a news conference in Marawi City. [GROAN]""","(['Seattle', ' WA'], Location((47.6038321, -122.3300624, 0.0)))",,,873503559198720001,https://twitter.com/carol_sundahl/status/873503559198720001,en
eywrickaa,2017-06-10 19:34,0,0,sa marawi malakas wifi tara??,"(['Jesus'], Location((52.2095649, 0.123596911981, 0.0)))",,,873503530216079360,https://twitter.com/eywrickaa/status/873503530216079360,fil
stanislaskazal,2017-06-10 19:33,0,0,"Les forces spéciales américaines appuient les militaires philippins pour reprendre Marawi à l’EI"" defense feedly""","(['#Bordeaux'], Location((44.841225, -0.5800364, 0.0)))",,# #,873503494745063424,https://twitter.com/stanislaskazal/status/873503494745063424,fr
rnfrancisfranc1,2017-06-10 19:33,0,0,BBC News - Marawi siege: US special forces aiding Philippine army - bravo to Duterte and US military,"(['Chester', ' UK'], Location((53.1908873, -2.8908955, 0.0)))",,,873503382102839297,https://twitter.com/rnfrancisfranc1/status/873503382102839297,en
the_dead_poetic,2017-06-10 19:33,0,0,‘Bangon Marawi’ EO now awaiting Duterte’s signature via manila_bulletin,"(['Manila', ' Philippines'], Location((14.5906216, 120.9799696, 0.0)))",@,,873503376012488704,https://twitter.com/the_dead_poetic/status/873503376012488704,fil
Minkapauline1,2017-06-10 19:33,0,0,Philippines: 13 soldats morts lors d'un combat à Marawi ejicom,"(['Dakar -Sn'], Location((14.693425, -17.447938, 0.0)))",,#,873503304306884608,https://twitter.com/Minkapauline1/status/873503304306884608,fr
RMF24pl,2017-06-10 19:32,1,1,Zacięta bitwa o Marawi. Siły specjalne USA włączyły się w operację przeciwko terrorystom,,,,873503233259470848,https://twitter.com/RMF24pl/status/873503233259470848,pl
imax111,2017-06-10 19:31,0,0,13 marines killed as fighting rages in Marawi City:,"(['everywhere'], Location((41.7776533, -72.6740756, 0.0)))",,,873502968477364224,https://twitter.com/imax111/status/873502968477364224,en
debbiecataluna,2017-06-10 19:31,0,5,Its ever heart warming to fly a kite and pray for the Marawi victims at the kind of situation our nation is facing,,,,873502855612612609,https://twitter.com/debbiecataluna/status/873502855612612609,en
PinoyTeleserye1,2017-06-10 19:30,0,0,"Watch: 13 gov't troops killed, 51 injured in latest Marawi offensive - sources",,,,873502740558692352,https://twitter.com/PinoyTeleserye1/status/873502740558692352,en
PHTopNews,2017-06-10 19:30,0,0,CHR urges gov't to stop airstrikes in Marawi -,,,,873502589949812737,https://twitter.com/PHTopNews/status/873502589949812737,en
aylahvyu,2017-06-10 19:29,0,4,"Apya dn so titiyobaan a marawi na ayapn a pkispot gya sabaad na NBA."" piyor""","(['ILG', ' PH'], Location((50.5929466, 8.7227851, 0.0)))",,,873502385271848961,https://twitter.com/aylahvyu/status/873502385271848961,fil
ifntseomi,2017-06-10 19:29,0,0,nagapalayo ka kim marawi na gud na sunod tsk,"(['Davao Region', ' Republic of the Philippines'], Location((7.0645241, 125.6084143, 0.0)))",,,873502293965946881,https://twitter.com/ifntseomi/status/873502293965946881,ceb
HemantKothari77,2017-06-10 19:28,2,2,13 Philippines Marines Killed in ISIS-Held Marawi City Philippines Marawi Maute Shivraj4Peace ZairaWasim RadhaMohanSingh,"(['worldwide !'], Location((53.4573434, -2.22698994022, 0.0)))",,# # # # # # #,873502227498926081,https://twitter.com/HemantKothari77/status/873502227498926081,en
tropzjham,2017-06-10 19:28,1,0,Pray for Marawi SabaTWO MARVOREE,"(['BORACAY ISLAND'], Location((11.9693431, 121.922688541, 0.0)))",,,873502144745230336,https://twitter.com/tropzjham/status/873502144745230336,en
sheikhjalala,2017-06-10 19:28,0,0,13 Philippines Marines Killed in ISIS-Held Marawi City 00 Philippines Marawi Maute Marines …,"(['kigogo', ' Dar es salaam'], Location((-2.5677194, 30.5058836, 0.0)))",,# # # #,873502099098791936,https://twitter.com/sheikhjalala/status/873502099098791936,en
tropzjham,2017-06-10 19:28,1,1,Hnd n mabilang patay n civilian s marawi SabaTWO MARVOREE,"(['BORACAY ISLAND'], Location((11.9693431, 121.922688541, 0.0)))",,,873502094463873025,https://twitter.com/tropzjham/status/873502094463873025,fil
dmitryzaksAFP,2017-06-10 19:27,4,0,Little noticed: US forces back Philippine troops in street-to-street gunbattles in Islamist held Marawi - AFP,"(['Kiev and Moscow'], Location((55.7431194, 37.5654146728, 0.0)))",@,,873501959814348800,https://twitter.com/dmitryzaksAFP/status/873501959814348800,en
Dario_Blues,2017-06-10 19:27,0,0,Marawi ISIShttps://,"(['France'], Location((46.603354, 1.8883335, 0.0)))",,# #,873501934178758656,https://twitter.com/Dario_Blues/status/873501934178758656,fil
JotoBumbong,2017-06-10 19:27,2,4,AY PUTA MAY TERORISTA SA MARAWI,,,,873501874921418752,https://twitter.com/JotoBumbong/status/873501874921418752,fil
tropzjham,2017-06-10 19:27,1,1,SNA matapoz n gulo s marawi kAwAwa family's KO don huhuhu SabaTWO MARVOREE,"(['BORACAY ISLAND'], Location((11.9693431, 121.922688541, 0.0)))",,,873501828222144512,https://twitter.com/tropzjham/status/873501828222144512,fil
benavu54,2017-06-10 19:27,0,0,US forces join Philippine troops to end Marawi city siege - via abcnews,"(['Australia'], Location((-24.7761086, 134.755, 0.0)))",@,,873501800946585600,https://twitter.com/benavu54/status/873501800946585600,en
collinskadiri,2017-06-10 19:26,0,0,Islamists kill 13 Philippine marines in wartorn Marawi city: Thirteen Philippine marines…,"(['Canada'], Location((61.0666922, -107.9917071, 0.0)))",,,873501744906604544,https://twitter.com/collinskadiri/status/873501744906604544,en
nhinggay,2017-06-10 19:26,0,1,Pag nalaman mong yung isang student mo na officer na Marines eh naiipit sa ganap sa Marawi.,"(['philippines', 'manila'], Location((12.7503486, 122.7312101, 0.0)))",,,873501701965139969,https://twitter.com/nhinggay/status/873501701965139969,fil
ianjamesesc,2017-06-10 19:26,0,2,Na-fly a drone for marawi zoned shukems hahahahaha,"(['Butuan City', ' Caraga'], Location((14.6169132, 121.018525, 0.0)))",,,873501663453102080,https://twitter.com/ianjamesesc/status/873501663453102080,fil
storyahiko,2017-06-10 19:26,1,1,"Film & Television Actress Angel Locsin visited the Marawi evacuees in Balo-i , Lanao del Sur.","(['Manila City'], Location((14.5906216, 120.9799696, 0.0)))",,,873501660085075968,https://twitter.com/storyahiko/status/873501660085075968,en
EnglishAlwaght,2017-06-10 19:25,9,7,13 Philippines Marines Killed in ISIS-Held Marawi City 00 Philippines Marawi Maute,,,# # # #,873501437451542528,https://twitter.com/EnglishAlwaght/status/873501437451542528,en
nhinggay,2017-06-10 19:25,0,0,Pag yung dati mong intern na nagka-bf ng dati mong student na Marine officer ay nag msg na di nya macontact si bf sa Marawi.,"(['philippines', 'manila'], Location((12.7503486, 122.7312101, 0.0)))",,,873501423895429120,https://twitter.com/nhinggay/status/873501423895429120,fil
BomboRadyoNews,2017-06-10 19:25,0,0,P10-B ‘Bangon Marawi’ program pangungunahan ng DND – Palasyo,"(['Makati City'], Location((14.5591272, 121.0202094, 0.0)))",,,873501374373220353,https://twitter.com/BomboRadyoNews/status/873501374373220353,fil
4LifeTFCebu,2017-06-10 19:25,0,0,MARAWI WAR MACHINES: Seen cruising the national highway along NSC Iligan en route to the battle zone. Not too...,,,,873501365829611520,https://twitter.com/4LifeTFCebu/status/873501365829611520,en
pangerankoeboe,2017-06-10 19:25,0,0,Bayot real hero Marawi pinoy Duterte Indonesia _TNIAU,,@,# # # #,873501265308798980,https://twitter.com/pangerankoeboe/status/873501265308798980,en
openomroep,2017-06-10 19:24,0,0,NEWS NIEUWS Amerikaanse eenheden ondersteunen Filipijnen bij strijd om Marawi - NU.nl: NU.nl Amerikaanse…,"(['EUROPA'], Location((51.0, 10.0, 0.0)))",,# #,873501154021433344,https://twitter.com/openomroep/status/873501154021433344,nl
P_Sng,2017-06-10 19:23,0,0,"Updates on UK after the elections, fighting in Marawi and Myanmar's…",,,,873500977508171776,https://twitter.com/P_Sng/status/873500977508171776,en
pakhead,2017-06-10 19:23,4,1,Duterte retracts earlier call for MILF and NPA fighters to help in battle for Marawi. Seems he doesn't trust them,"(['Bangkok'], Location((-7.846423, 112.1005469, 0.0)))",,,873500921468039168,https://twitter.com/pakhead/status/873500921468039168,en
Orbitus,2017-06-10 19:23,0,0,Marawi siege: US special forces aiding Philippines (via BBCNews) counterterrorismhttp://,"(['Washington', ' DC | Honolulu', ' HI'], Location((38.8949549, -77.0366456, 0.0)))",@,# # # #,873500905768923139,https://twitter.com/Orbitus/status/873500905768923139,en
Limportant_fr,2017-06-10 19:23,5,1,Philippines : des troupes US aident à mettre fin au siège de Marawi par l'EI,"(['Paris', ' France'], Location((48.8566101, 2.3514992, 0.0)))",,#,873500895232839680,https://twitter.com/Limportant_fr/status/873500895232839680,fr
marbin76tchr,2017-06-10 19:23,0,0,Filipiny: siły USA włączają się do walk z rebeliantami w Marawi,"(['Calgary /Alberta/ \xc2\xa0\xf0\x9f\x87\xa8\xf0\x9f\x87\xa6'], Location((51.02532675, -114.049868486, 0.0)))",,,873500883614674945,https://twitter.com/marbin76tchr/status/873500883614674945,pl
RikardJalkebro,2017-06-10 19:21,0,0,Lawyers to Duterte: Stop martial law abuses in Marawi via rapplerdotcom,"(['St Andrews'], Location((56.3403902, -2.7955844, 0.0)))",@,,873500409922564096,https://twitter.com/RikardJalkebro/status/873500409922564096,en
MyAlliesNews,2017-06-10 19:21,0,0,World U.S. forces helping end ISIS-linked siege in Marawi,,,,873500395733217280,https://twitter.com/MyAlliesNews/status/873500395733217280,en
sgt_flower,2017-06-10 19:21,0,0,Islamisten töten 13 Soldaten in belagertem Marawi via zeitonline,"(['Hohwachter Bucht'], Location((54.30649015, 10.6372669133, 0.0)))",@,,873500351265112064,https://twitter.com/sgt_flower/status/873500351265112064,lb
maxangelo987,2017-06-10 19:21,0,0,"Ilang residente ng Marawi, tinawid ang ilog para makaligtas sa kaguluhan gmanews",,,#,873500323620540416,https://twitter.com/maxangelo987/status/873500323620540416,fil
aamslay3,2017-06-10 19:20,0,0,Thank you for helping my fellow kababayan in Marawi City. im sure doble ang saya nila nung makita ka nila. PrayforMarawi SaveMarawi,"(['neverland'], Location((36.548132, -121.919599, 0.0)))",,# #,873500234801795072,https://twitter.com/aamslay3/status/873500234801795072,fil
mediat_es,2017-06-10 19:20,0,0,Filipinas: islamistas matan a 13 soldados en sitiada Marawi - Deutsche Welle: Deutsche Welle… Noticias destacadas,,,,873500146658676736,https://twitter.com/mediat_es/status/873500146658676736,es
evita_susan,2017-06-10 19:20,0,0,"Air strike on jihadist targets in Marawi, Philippines bbc","(['jakarta'], Location((-6.1753942, 106.827183, 0.0)))",,#,873500145421131776,https://twitter.com/evita_susan/status/873500145421131776,en
gmanewsfacebook,2017-06-10 19:20,0,0,Ilang residente ng Marawi ang napilitang lumangoy nang halos kalahating kilometro matawid lamang ang isang ilog...,,,,873500002940616705,https://twitter.com/gmanewsfacebook/status/873500002940616705,fil
SADN_Diaspora,2017-06-10 19:20,0,0,"Islamists kill 13 Philippine marines in wartorn Marawi city, ...","(['South Africa'], Location((-28.8166236, 24.991639, 0.0)))",,,873499999300198400,https://twitter.com/SADN_Diaspora/status/873499999300198400,en
sulubmember,2017-06-10 19:19,0,0,BBC Somali - Dagaal ba'an oo weli ka socda magaalada Marawi ee Philippines,"(['Kenya'], Location((1.4419683, 38.4313975, 0.0)))",,,873499918291410945,https://twitter.com/sulubmember/status/873499918291410945,so
deanjorgebocobo,2017-06-10 19:18,0,0,"Useless denying something pretty severe happened in Marawi--over 200 dead, more refugees than population. And may soon happen elsewhere.","(['Philippines'], Location((12.7503486, 122.7312101, 0.0)))",,,873499629861588992,https://twitter.com/deanjorgebocobo/status/873499629861588992,en
philmonitor,2017-06-10 19:18,0,0,Hundreds of Public School Teachers in Marawi Missing - via philmonitor,"(['Republic of the Philippines'], Location((12.7503486, 122.7312101, 0.0)))",@,,873499556092166144,https://twitter.com/philmonitor/status/873499556092166144,en
ReputationYel,2017-06-10 19:17,0,0,So it is the goal of thr GRP to wave the Phil Flag on Indeoendence Day in Marawi.,"(['Valletta', ' Malta'], Location((35.8989818, 14.5136759, 0.0)))",@ @,,873499370867441664,https://twitter.com/ReputationYel/status/873499370867441664,en
ivan2266,2017-06-10 19:17,0,0,"Isang dokumentaryong tutuklas ng iba't-ibang mukha ng katapangan. Abangan ang CNN Philippines Presents: Inside Marawi"" sa June 27, 8 p.m. …""","(['Earth'], Location((34.2331373, -102.4107493, 0.0)))",,,873499291691737088,https://twitter.com/ivan2266/status/873499291691737088,fil
nerowattz,2017-06-10 19:16,0,0,CHR urges gov’t to stop airstrikes in Marawi InquirerMobilehttp://,"(['Makati City'], Location((14.5591272, 121.0202094, 0.0)))",,,873499120635441152,https://twitter.com/nerowattz/status/873499120635441152,en
ferrari_viva,2017-06-10 19:16,0,0,"ISIS kejam di Marawi ,, mereka belum ngrasain Runcingnya Bambu Indonesia ,, wahai PATRIOT INDONESIA ,,,, BERSATU lah ,,","(['Earth'], Location((34.2331373, -102.4107493, 0.0)))",,,873499035214069761,https://twitter.com/ferrari_viva/status/873499035214069761,id
BBCSomali,2017-06-10 19:16,1,5,Dagaal ba'an oo weli ka socda magaalada Marawi ee Philippines,"(['London', ' UK'], Location((51.5073219, -0.1276474, 0.0)))",,,873498986736480259,https://twitter.com/BBCSomali/status/873498986736480259,so
IbnMetternich,2017-06-10 19:14,0,0,"Philippines/islamistes: forces spéciales US à Marawi, 13 soldats philippins tués via NewsRepublic_fr",,@,,873498710419877888,https://twitter.com/IbnMetternich/status/873498710419877888,fr
engr_agustin,2017-06-10 19:14,0,0,"MARAWI CLASH. Using their V-300 Commando Fire Support Vehicle, the Philippine Marines patr... via rapplerdotcomhttp://",,@,,873498614856785920,https://twitter.com/engr_agustin/status/873498614856785920,en
amzngASH,2017-06-10 19:14,0,0,"I dunno if that's enough but i certainly hope that a rehab program would be established in Marawi. Please do, not just say.","(['Cagayan De Oro City'], Location((8.42980265, 124.682410212, 0.0)))",,,873498492714459136,https://twitter.com/amzngASH/status/873498492714459136,en
Cierzo_bardener,2017-06-10 19:13,9,4,Los hermanos Maute lideres del grupo que asaltó Marawi probablemente han muerto a manos ejercito filipino Sus padres han sido detenidos,,,,873498420069224448,https://twitter.com/Cierzo_bardener/status/873498420069224448,es
rickrick888,2017-06-10 19:13,0,0,UPDATE: Task Force Marawi spokesperson Jo-Ar Herrera says Farhana Maute has links to international terrorist groups …,,,,873498388284755969,https://twitter.com/rickrick888/status/873498388284755969,en
petesengson,2017-06-10 19:13,0,0,"On Al-Jazeera: estranged allies back together,"" ""only US, not China,"" can provide technical assistance to PH in resolving Marawi crisis.""","(['Manila'], Location((14.5906216, 120.9799696, 0.0)))",,,873498257304858624,https://twitter.com/petesengson/status/873498257304858624,en
cheorcz,2017-06-10 19:12,2,0,ANGEL LOCSIN VISITS EVACUEES AT MARAWI CITY: via YouTube,,@,,873498151914807296,https://twitter.com/cheorcz/status/873498151914807296,en
cnnphilippines,2017-06-10 19:12,37,95,"Isang dokumentaryong tutuklas ng iba't-ibang mukha ng katapangan. Abangan ang CNN Philippines Presents: Inside Marawi"" sa June 27, 8 p.m. """,,,,873498125511475200,https://twitter.com/cnnphilippines/status/873498125511475200,fil
katiadavis,2017-06-10 19:12,0,0,marines killed as fighting rages in Marawi City | News: At least 13 Philippine… c,"(['EU'], Location((50.0456114, 1.4214368, 0.0)))",,#13 # # # # # # #,873498080183820288,https://twitter.com/katiadavis/status/873498080183820288,en
lynredw,2017-06-10 19:12,0,0,"Hontiveros trying to be funny, listen to her reason regarding Marawi. Yo... via YouTube","(['Republic of the Philippines'], Location((12.7503486, 122.7312101, 0.0)))",@,,873498077964812288,https://twitter.com/lynredw/status/873498077964812288,en
KotaManado,2017-06-10 19:12,0,0,Filipina klaim Maute bersaudara tewas dalam pertempuran di Marawi ..,"(['Manado'], Location((1.4900578, 124.8408708, 0.0)))",,,873498025502617600,https://twitter.com/KotaManado/status/873498025502617600,id
medicalboox,2017-06-10 19:12,0,0,13 marines killed as fighting rages in Marawi City | News,,,,873497982930472960,https://twitter.com/medicalboox/status/873497982930472960,en
Defence24pl,2017-06-10 19:11,1,3,Filipiny : bitwa o Marawi. Amerykanie dostarczają wsparcie techniczne terror Daesh USArmy | Defence24pl,,@ @,# # # #,873497958758707200,https://twitter.com/Defence24pl/status/873497958758707200,pl
IvoCerckel,2017-06-10 19:11,0,0,"Armed Forces of the Philippines confirms presence of US forces in Marawi, but participation limited","(['Siquijor', ' Philippines'], Location((9.2040074, 123.596558503, 0.0)))",,,873497901049069568,https://twitter.com/IvoCerckel/status/873497901049069568,en
katiadavis,2017-06-10 19:11,0,0,13 marines killed as fighting rages in Marawi City | News U,"(['EU'], Location((50.0456114, 1.4214368, 0.0)))",,,873497878001483776,https://twitter.com/katiadavis/status/873497878001483776,en
katiazev,2017-06-10 19:11,0,0,13 marines killed as fighting rages in Marawi City | News 1,"(['37.83162', '23.777289'], Location((21.0977499, -101.6412234, 0.0)))",,,873497868727980032,https://twitter.com/katiazev/status/873497868727980032,en
abbynobletaa,2017-06-10 19:11,0,1,HAHAHAHHAAH HUYYYY GIKAN MI MARAWI,,,,873497861513596929,https://twitter.com/abbynobletaa/status/873497861513596929,ceb
SaladinAlDronni,2017-06-10 19:10,13,10,IS in Marawi confirms US SOF presence,,,,873497718198611968,https://twitter.com/SaladinAlDronni/status/873497718198611968,en
D0RKYBAEK,2017-06-10 19:10,0,0,okay so yung bahay namin sa marawi na isa ginawang kampo ng mga sundalo nice naman eong kwarto ko dun jddfnfnfnc,,,,873497581841600512,https://twitter.com/D0RKYBAEK/status/873497581841600512,fil
borneotodaynews,2017-06-10 19:09,0,0,US Special Forces Join Fight Against Marawi Militants; 13 Troops Die,"(['Sabah', ' Malaysia'], Location((5.595237, 117.0051734, 0.0)))",,,873497464682295296,https://twitter.com/borneotodaynews/status/873497464682295296,en
mamaknock1,2017-06-10 19:09,0,0,DriveThemOut Marawi US Sends Help To phillipines ISIShttps://,,,# # # #,873497418725302272,https://twitter.com/mamaknock1/status/873497418725302272,en
