PresPoliticsPh,2017-06-10 12:15,0,2,NAPAIYAK SA TUWA ANG BIKTIMA SA MARAWI NG BINISITA NI ANGEL LOCSIN PERSONAL NA NAMIGAY NG TULONG 1: via,"(['Davao Region'], Location((7.0645241, 125.6084143, 0.0)))",,,873393159748890628,https://twitter.com/PresPoliticsPh/status/873393159748890628,fil
Partyalcoholics,2017-06-10 12:14,0,0,MARAWI DefendTheLand,"(['Manila City', ' National Capital'], Location((14.5906216, 120.9799696, 0.0)))",,#,873393012302168064,https://twitter.com/Partyalcoholics/status/873393012302168064,en
MCNM_Marketing,2017-06-10 12:14,0,0,Marawi ‘looters’ arrested,"(['Las Vegas'], Location((36.1662859, -115.149225, 0.0)))",,,873392987883089922,https://twitter.com/MCNM_Marketing/status/873392987883089922,en
ivan2266,2017-06-10 12:13,0,0,"Military eyes June 12 freedom for Marawi — CNN Philippines (cnnphilippines) June 10, 2017","(['Earth'], Location((34.2331373, -102.4107493, 0.0)))",,,873392676351225856,https://twitter.com/ivan2266/status/873392676351225856,en
Noria_lundayao,2017-06-10 12:13,0,0,Thank you miss angel to help marawi allah blees us all,,,,873392674585272320,https://twitter.com/Noria_lundayao/status/873392674585272320,en
ricafort1103,2017-06-10 12:10,0,1,Pag dating ng araw na binobomba yang palasyo nyo huwag kayo magpapa tulong sa mga sundalo. Pagod na sila sa Marawi namatayan ng kaibigan.,"(['Moon', ' PA'], Location((44.7716333, -89.787902, 0.0)))",,,873392013588049920,https://twitter.com/ricafort1103/status/873392013588049920,fil
sabangon,2017-06-10 12:10,0,0,"In war-shaken city, civilians struggle to escape Marawi 0",,,,873391935318138880,https://twitter.com/sabangon/status/873391935318138880,en
negrosdaily,2017-06-10 12:10,0,0,June 10 Negros Daily Bulletin NDB NEWS-INFO* ::: (1) Marawi evacuees arrived in Bacolod; Close monitoring... d,"(['Bacolod City', ' Philippines'], Location((10.6762836, 122.9513786, 0.0)))",,,873391852560551936,https://twitter.com/negrosdaily/status/873391852560551936,en
cnnphilippines,2017-06-10 12:10,9,17,Military eyes June 12 freedom for Marawi,,,,873391799338844160,https://twitter.com/cnnphilippines/status/873391799338844160,en
sweeeetbravery,2017-06-10 12:10,0,1,Most people probably became desensitized by what's happening in Marawi already. i hardly see updates in my newsfeed.,,,,873391782528036864,https://twitter.com/sweeeetbravery/status/873391782528036864,en
alders_ledge,2017-06-10 12:09,0,0,15yo Abdillah Masid was observing Ramadan in a Marawi mosque when he was shot and killed. ?,,,# #,873391766073782273,https://twitter.com/alders_ledge/status/873391766073782273,en
_loriecristel,2017-06-10 12:09,0,3,DefendTheLand kasi mga pare malapit nang lumaya ang Marawi ano,"(['University of the Philippines'], Location((16.377798, 119.9113091, 0.0)))",,#,873391762408067072,https://twitter.com/_loriecristel/status/873391762408067072,fil
FanboyMclisse21,2017-06-10 12:09,1,1,How i wish may maitulong tayo McLisseWorldPH kahit kunti sa mga kababayan natin na naapektuhan ng Marawi Crisis,,@,,873391752740085761,https://twitter.com/FanboyMclisse21/status/873391752740085761,fil
DZMMTeleRadyo,2017-06-10 12:09,0,1,"RadyoPatrol Bakbakan sa Marawi City, mas tumindi pa","(['ABS-CBN', ' Diliman', ' Quezon City'], Location((11.5874907, 122.7520466, 0.0)))",,#,873391726701887488,https://twitter.com/DZMMTeleRadyo/status/873391726701887488,fil
Noria_lundayao,2017-06-10 12:09,0,0,Help marawi city miss ann miss angel already come up there ..,,,,873391718162354176,https://twitter.com/Noria_lundayao/status/873391718162354176,en
GwapongBabaeeee,2017-06-10 12:09,0,0,"Di nakakatawa Joke mo ateng. Nagkakagulo na nga sa Marawi, dinamay mo pa! Shame on you! Pabibo ka din eh nuh?",,,,873391716438466560,https://twitter.com/GwapongBabaeeee/status/873391716438466560,fil
jervismanahan,2017-06-10 12:09,0,0,It's an eerily quiet Saturday here in Marawi City UcU,"(['Manila', ' Philippines'], Location((14.5906216, 120.9799696, 0.0)))",@,,873391708381171712,https://twitter.com/jervismanahan/status/873391708381171712,en
LilyT32,2017-06-10 12:08,0,0,Philippines: Govt assures enough funds available to sustain needs of Marawi IDPs humanitarian newzealand,"(['New Zealand'], Location((-41.5000831, 172.8344077, 0.0)))",,# # #,873391397042356224,https://twitter.com/LilyT32/status/873391397042356224,en
SimpleITGuy,2017-06-10 12:08,0,2,Ulol anong simple ang dami na nilang pipatay sa marawi. Fuckssit ka talaga risahontiveros,"(['Manila City', ' National Capital'], Location((14.5906216, 120.9799696, 0.0)))",@,,873391308315832320,https://twitter.com/SimpleITGuy/status/873391308315832320,fil
sharxsbdnx,2017-06-10 12:07,0,0,Alam mo kung ayaw mong mapikon lumayas ka sa twitter. Maka awa ka lang. Dun ka sa marawi! DefendTheLand,,,#,873391255136329728,https://twitter.com/sharxsbdnx/status/873391255136329728,fil
omgerieee,2017-06-10 12:07,0,6,ang sarap ipatapon sa marawi nung mga taong asking the obvious lagi,"(['hogwarts'], Location((-1.24139975, 36.784112734, 0.0)))",,,873391164501536768,https://twitter.com/omgerieee/status/873391164501536768,fil
rickrick888,2017-06-10 12:07,0,0,DEVELOPING STORY: Authorities arrest mother of Maute brothers. davidyusantos reports from Marawi City …,,,,873391118486056960,https://twitter.com/rickrick888/status/873391118486056960,en
interaksyon,2017-06-10 12:07,1,1,"Tutulungan po namin na bumangon muli ang Marawi sa mabilis na panahon."" ""","(['Philippines'], Location((12.7503486, 122.7312101, 0.0)))",,,873391020288995330,https://twitter.com/interaksyon/status/873391020288995330,fil
PublikGuarico,2017-06-10 12:06,0,0,RT recoge los testimonios de los que arriesgan su vida contra el asedio yihadista en Marawi Vía ActualidadRT,"(['San Juan De Los Morros'], Location((9.9078854, -67.3539529, 0.0)))",,,873390889749671936,https://twitter.com/PublikGuarico/status/873390889749671936,es
marizumali,2017-06-10 12:06,1,52,Stay safe mahal praying for you and the entire Marawi.,"(['Manila', ' Philippines'], Location((14.5906216, 120.9799696, 0.0)))",,,873390879830007808,https://twitter.com/marizumali/status/873390879830007808,en
BomboErwinOnan,2017-06-10 12:05,0,0,Ipadala si lebron sa marawi,"(['Philippines'], Location((12.7503486, 122.7312101, 0.0)))",,,873390732148658176,https://twitter.com/BomboErwinOnan/status/873390732148658176,fil
muchlis_ar,2017-06-10 12:05,5,1,ISIS marawi tumbuh dari paham islam ekstrim yg udah nyebar bertahun-tahun sebelumnya.. Pemimpinnya pernah tinggal di Bekasi..,"(['Jakarta Capital Region'], Location((-6.1753942, 106.827183, 0.0)))",,,873390634861645824,https://twitter.com/muchlis_ar/status/873390634861645824,id
alders_ledge,2017-06-10 12:05,1,1,Four female residents of Marawi ask the Supreme Court to nullify martial law in Mindanao Philippineshttp://,,,# # #,873390586639679488,https://twitter.com/alders_ledge/status/873390586639679488,en
pengshoppe_17,2017-06-10 12:04,0,0,Ililigtas ko na kayo jan sa marawi! Hahaha,"(['Cavite'], Location((14.25, 120.833333, 0.0)))",,,873390374890242048,https://twitter.com/pengshoppe_17/status/873390374890242048,fil
News5AKSYON,2017-06-10 12:03,0,1,"13 sundalo, patay sa pinakahuling bakbakan ng militar at mga terorista sa Marawi","(['Philippines'], Location((12.7503486, 122.7312101, 0.0)))",,,873390099244830720,https://twitter.com/News5AKSYON/status/873390099244830720,fil
alders_ledge,2017-06-10 12:03,1,1,"As Marawi crisis drags on, risks to the health of displaced peoples mount. Philippines MarawiUpdateshttp://",,,# # #,873390074368372741,https://twitter.com/alders_ledge/status/873390074368372741,en
cnnphilippines,2017-06-10 12:03,3,9,DEVELOPING STORY: Authorities arrest mother of Maute brothers. davidyusantos reports from Marawi City,,@,,873390036523245568,https://twitter.com/cnnphilippines/status/873390036523245568,en
lovelymariskie1,2017-06-10 12:02,0,0,Sig bash sa both team maypa e ampo nas marawi katabang pamo,"(['Lapu-Lapu City'], Location((10.4218504, 123.2679822, 0.0)))",,,873389942126256128,https://twitter.com/lovelymariskie1/status/873389942126256128,ceb
SalmanRanaw,2017-06-10 12:02,0,0,"SIGNING OFF - In respect to the authorities amid Martial Law, my coverage of the war will cease starting today. PrayForMarawi","(['Marawi City'], Location((8.0034938, 124.286626, 0.0)))",,#,873389910626934784,https://twitter.com/SalmanRanaw/status/873389910626934784,en
poemcrap,2017-06-10 12:01,0,0,trendthis An amazing cause to raise donations for the people affected in Marawi by the youth in Butuan ! ALL proceeds and goods+,,,#,873389674810662912,https://twitter.com/poemcrap/status/873389674810662912,en
TempoPHL,2017-06-10 12:00,0,0,Civilians struggle to escape Marawi,"(['Intramuros', ' Philippines'], Location((14.5905862, 120.97533, 0.0)))",,,873389491074998272,https://twitter.com/TempoPHL/status/873389491074998272,en
rmnnetworks,2017-06-10 11:59,0,0,LatestNews Bangkay ng isa sa mga sundalong namatay sa bakbakan sa Marawi City hinihintay ng pamilya nito sa...,,,#,873389223071555586,https://twitter.com/rmnnetworks/status/873389223071555586,fil
rakernel01,2017-06-10 11:59,0,0,Gulo na nga sa marawi makikisabay pa kayo laro lang yan. Hahaha! NBAFinals,"(['San Pedro', ' TX'], Location((-24.1602794, -56.713749623, 0.0)))",,#,873389004510515200,https://twitter.com/rakernel01/status/873389004510515200,fil
LilyT32,2017-06-10 11:58,0,0,"Philippines: PDRRMO sends empty gallons, 300k worth of goods to Marawi IDPs humanitarian newzealand 0","(['New Zealand'], Location((-41.5000831, 172.8344077, 0.0)))",,# # #,873388853549301760,https://twitter.com/LilyT32/status/873388853549301760,en
ChannixC,2017-06-10 11:57,0,1,13 PH marines down. MARAWI CLASH,"(['Cagayan De Oro City', ' Northern'], Location((8.42980265, 124.682410212, 0.0)))",,,873388557708042240,https://twitter.com/ChannixC/status/873388557708042240,en
chiarazambrano,2017-06-10 11:56,5,65,"Back when our biggest hazards were of the natural kind. Kitakits sa Maynila, nababaha Tell everyone there to keep an eye out for Marawi","(['Pilipinas'], Location((12.7503486, 122.7312101, 0.0)))",@,,873388370704998400,https://twitter.com/chiarazambrano/status/873388370704998400,en
News5AKSYON,2017-06-10 11:55,2,9,"13 miyembro ng Marines, nasawi sa matinding bakbakan sa Marawi kahapon | via C","(['Philippines'], Location((12.7503486, 122.7312101, 0.0)))",@,,873388113816567812,https://twitter.com/News5AKSYON/status/873388113816567812,fil
PhilippinePolRR,2017-06-10 11:55,0,0,Crisis committee expecting to retrieve a lot of bodies in Marawi war zone,,,,873388049752838144,https://twitter.com/PhilippinePolRR/status/873388049752838144,en
Politiko_Ph,2017-06-10 11:52,4,8,. dswdserves to give one-time cash grant to Marawi evacuees MarawiClash,,@,#,873387294643765248,https://twitter.com/Politiko_Ph/status/873387294643765248,en
ChururotTusok,2017-06-10 11:52,0,0,DontMe bes love ang kathniel duh epal k gaya ng epal mong idol epal n nga sa Laluna epal pa s Marawi,,,#,873387254999171072,https://twitter.com/ChururotTusok/status/873387254999171072,fil
PTVisMin,2017-06-10 11:51,0,0,ARMM Governor Mujiv Hataman is confident Marawi will be free by Independence Day | via,,@,,873387241246253056,https://twitter.com/PTVisMin/status/873387241246253056,en
Leimonty,2017-06-10 11:51,0,0,"Hontiveros trying to be funny, listen to her reason regarding Marawi. Yo... Sooo annoying!",,,,873387219951550465,https://twitter.com/Leimonty/status/873387219951550465,en
carooowlll,2017-06-10 11:51,0,1,ay gago marawi HAHAHAHAHA,,,,873387189865897984,https://twitter.com/carooowlll/status/873387189865897984,fil
ali_sangki,2017-06-10 11:51,0,0,Mga Gsw fans dapat senyo ipadala sa marawi,,,,873387135927287808,https://twitter.com/ali_sangki/status/873387135927287808,fil
DuterteLatest,2017-06-10 11:51,0,0,MARAWI UPDATE - ISANG MAUTE BROTHERS PATAY NG MILITAR SA BAKBAKAN SA MARAWI: via YouTube,"(['Canas Urbano', ' USA'], Location((18.0085285, -66.6367997364, 0.0)))",@,,873387108723040256,https://twitter.com/DuterteLatest/status/873387108723040256,fil
lostnpound,2017-06-10 11:51,0,0,Tsk tsk PrayForMarawi,,,#,873387106789318657,https://twitter.com/lostnpound/status/873387106789318657,sv
PhilippineStar,2017-06-10 11:50,1,0,Student killed by stray bullet in Marawi.,"(['Philippines'], Location((12.7503486, 122.7312101, 0.0)))",,,873386982788878338,https://twitter.com/PhilippineStar/status/873386982788878338,en
PTVisMin,2017-06-10 11:50,0,0,NEWS | Rep. Bertiz: Human traffickers may victimize displaced Marawi residents,,,,8.73387E+17,https://twitter.com/PTVisMin/status/873386872319488000,en
PTVisMin,2017-06-10 11:50,0,0,NEWS: Military continues clearing operations in Marawi City,,,,873386757928124416,https://twitter.com/PTVisMin/status/873386757928124416,en
PisayCVCUpdates,2017-06-10 11:50,0,1,"LOOK: PSHS-Central Mindanao schedules clearance signing, enrollment to finally cap off AY 2016-2017. Sched was delayed due to Marawi Crisis","(['Bayombong', ' Nueva Vizcaya'], Location((16.4841392, 121.1439344, 0.0)))",,,873386753813393408,https://twitter.com/PisayCVCUpdates/status/873386753813393408,en
PTVisMin,2017-06-10 11:49,0,0,NEWS: 6 looters arrested in Marawi City,,,,873386688512446464,https://twitter.com/PTVisMin/status/873386688512446464,en
PTVisMin,2017-06-10 11:49,0,0,NEWS: AFP doing everything to avert another Marawi incident - military official,,,,873386579406016513,https://twitter.com/PTVisMin/status/873386579406016513,en
PTVisMin,2017-06-10 11:49,0,0,NEWS: Marawi evacuees continue to receive relief aid,,,,873386509180837890,https://twitter.com/PTVisMin/status/873386509180837890,en
PTVisMin,2017-06-10 11:48,0,0,NEWS: AFP still verifying reports of Hapilon's escape from Marawi City,,,,873386444454322176,https://twitter.com/PTVisMin/status/873386444454322176,en
LilyT32,2017-06-10 11:48,0,0,Philippines: Lanao del Norte opens more evacuation centers for Marawi IDPs humanitarian newzealand,"(['New Zealand'], Location((-41.5000831, 172.8344077, 0.0)))",,# # #,873386434400579588,https://twitter.com/LilyT32/status/873386434400579588,en
PTVisMin,2017-06-10 11:48,0,0,NEWS: AFP eyes raising PHL flag in entire Marawi City on June 12,,,,873386280196988928,https://twitter.com/PTVisMin/status/873386280196988928,en
jervismanahan,2017-06-10 11:47,1,0,ARMM Governor Mujiv Hataman is confident Marawi will be free by Independence Day,"(['Manila', ' Philippines'], Location((14.5906216, 120.9799696, 0.0)))",@,,873386120259579904,https://twitter.com/jervismanahan/status/873386120259579904,en
hecallsmeathena,2017-06-10 11:47,0,1,"This war at Marawi, Philippines is senseless. Civilians are affected. Innocent children are killed. What is Maute trying to prove?","(['Dubai', ' United Arab Emirates'], Location((2.9470179, 30.961206, 0.0)))",,,873386105290330112,https://twitter.com/hecallsmeathena/status/873386105290330112,en
adharves,2017-06-10 11:47,5,5,Marawi siege breathing new life into Islamic extremists in s-e Asia - from hodgeamandahttps://,"(['Jakarta'], Location((-6.1753942, 106.827183, 0.0)))",@,,873386076160667649,https://twitter.com/adharves/status/873386076160667649,en
mizahael,2017-06-10 11:46,0,0,How many more innocent lives do we have to sacrifice before we all open our eyes to the gravity of the things happening in Marawi?,"(['Manila', ' Philippines'], Location((14.5906216, 120.9799696, 0.0)))",,,873385947857002497,https://twitter.com/mizahael/status/873385947857002497,en
nababaha,2017-06-10 11:46,1,26,chiarazambrano noong bata pa tayo. Ingat ka diyan sa Marawi. D1,"(['Philippines'], Location((12.7503486, 122.7312101, 0.0)))",@,#,873385770714767360,https://twitter.com/nababaha/status/873385770714767360,fil
akirezzz,2017-06-10 11:45,0,1,Porket lamang na g na g sa pagsisi sa referee? Mga ulol sarap ipatapon sa marawi,,,,873385587268403200,https://twitter.com/akirezzz/status/873385587268403200,fil
rmnnetworks,2017-06-10 11:44,0,0,"LatestNews Rehabilitasyon ng Marawi City, sisimulan na",,,#,873385362378248193,https://twitter.com/rmnnetworks/status/873385362378248193,fil
rmnnetworks,2017-06-10 11:44,0,0,"LatestNews 15-anyos na binatilyo na tinamaan ng ligaw na bala habang nagdadasal sa isang Mosque sa Marawi,...",,,#,873385327963942913,https://twitter.com/rmnnetworks/status/873385327963942913,fil
AngeleSamura,2017-06-10 11:42,3,2,She was traveling with some serious amo Marawi,"(['Netherlands'], Location((52.2379891, 5.53460738162, 0.0)))",,#,873384856218083329,https://twitter.com/AngeleSamura/status/873384856218083329,en
jamelaaisha,2017-06-10 11:41,1,5,Lahat ay may espasyo. Malaking bagay ang pag labas ng opinyon at lalo na ang pagtulong. Send aid to Marawi,"(['Manila'], Location((14.5906216, 120.9799696, 0.0)))",,#,873384655944167424,https://twitter.com/jamelaaisha/status/873384655944167424,fil
jamelaaisha,2017-06-10 11:41,6,18,"Donations keep coming still. No matter how dire the situation may seem- never, never give in to despair Marawi","(['Manila'], Location((14.5906216, 120.9799696, 0.0)))",,#,873384496627830784,https://twitter.com/jamelaaisha/status/873384496627830784,en
KatherineImson,2017-06-10 11:40,3,0,13 Marines died during yesterday's intense firefight bet military troops and militants here in Marawi,,@,,873384460829335552,https://twitter.com/KatherineImson/status/873384460829335552,en
RitaBaua,2017-06-10 11:40,1,1,"Du30: No Npa, Mnlf to fight alongside Afp in Marawi coz they might shoot each other. Ndfp: Npa will not join Afp; will only block & mop up","(['Quezon City', ' National Capital Region'], Location((14.6509905, 121.0486155, 0.0)))",,,873384385545777154,https://twitter.com/RitaBaua/status/873384385545777154,en
jamelaaisha,2017-06-10 11:40,3,24,We have already received at least 2 tons of aid to Marawi from people we know and even from random strangers.,"(['Manila'], Location((14.5906216, 120.9799696, 0.0)))",,#,873384373663301633,https://twitter.com/jamelaaisha/status/873384373663301633,en
AkhBen,2017-06-10 11:40,0,0,"Saguiaran, the first town outside Marawi leading to Iligan, caters to thousands of evacuees, and market is business as usual. MarawiClash","(['Cotabato City', ' Soccsksargen'], Location((7.1970344, 124.2351714, 0.0)))",,#,873384290347700231,https://twitter.com/AkhBen/status/873384290347700231,en
AngeleSamura,2017-06-10 11:39,2,0,Amid rumours that Hapilon managed once again to escape Marawi,"(['Netherlands'], Location((52.2379891, 5.53460738162, 0.0)))",,#,873383977494626304,https://twitter.com/AngeleSamura/status/873383977494626304,en
minietweets,2017-06-10 11:35,1,3,Cool nya pak jokowi saat ini adalah mempelajari setiap kesamaan peristiwa baik marawi maupun krisis qatar,"(['earth'], Location((34.2331373, -102.4107493, 0.0)))",@,,873383118136197120,https://twitter.com/minietweets/status/873383118136197120,id
PhilippineStar,2017-06-10 11:34,2,1,WATCH: DOH closely monitoring possible outbreak of acute gastroenteritis and cholera among Marawi evacuees. | via,"(['Philippines'], Location((12.7503486, 122.7312101, 0.0)))",@,,873382898644140032,https://twitter.com/PhilippineStar/status/873382898644140032,en
raffytima,2017-06-10 11:34,14,62,"They were the first to push back the Maute terrorists in Marawi, losing some men in the process. They want to be the one to end it.","(['Manila', ' Philippines'], Location((14.5906216, 120.9799696, 0.0)))",,,873382779316191232,https://twitter.com/raffytima/status/873382779316191232,en
sentineltimesph,2017-06-10 11:33,0,0,Gatchalian Calls for All-Out Relief Ops for Marawi Evacuees - via Shareaholic,,@,,873382639117283328,https://twitter.com/sentineltimesph/status/873382639117283328,en
TKasoy,2017-06-10 11:32,0,0,"Amen to that, our brothers/sisters in Marawi have suffered enough.",,,,873382367062147073,https://twitter.com/TKasoy/status/873382367062147073,en
radikalchick,2017-06-10 11:31,0,0,MartialLaw Marawi Mindanaohttps://,"(['Philippines'], Location((12.7503486, 122.7312101, 0.0)))",,# # #,873382191350243329,https://twitter.com/radikalchick/status/873382191350243329,en
ctkpproj7,2017-06-10 11:31,0,0,Here's one way of helping the children of Marawi.,"(['Quezon City'], Location((14.6509905, 121.0486155, 0.0)))",,,873382139005468672,https://twitter.com/ctkpproj7/status/873382139005468672,en
TKasoy,2017-06-10 11:31,0,0,"Ravages of war, let's pray that the Marawi conflict will soon be over, and somehow we hope for the best that the city shall rebuild later.",,,,873382056901828609,https://twitter.com/TKasoy/status/873382056901828609,en
gmanews,2017-06-10 11:31,18,31,14-yr-old boy killed by stray bullet while praying inside Marawi mosque,"(['Philippines'], Location((12.7503486, 122.7312101, 0.0)))",,,873381960588177408,https://twitter.com/gmanews/status/873381960588177408,en
putrione201,2017-06-10 11:30,0,0,Ratusan Pasukan Brimob Diterjunkan Jaga Pulau Indonesia Terluar Dari Pemberontak Marawi,,,,873381948437155840,https://twitter.com/putrione201/status/873381948437155840,id
BeritaCenter,2017-06-10 11:30,0,0,- Ratusan Pasukan Brimob Diterjunkan Jaga Pulau Indonesia Terluar Dari Pemberontak Marawi D,"(['Jakarta Capital Region'], Location((-6.1753942, 106.827183, 0.0)))",,,873381917739057158,https://twitter.com/BeritaCenter/status/873381917739057158,id
newstogoGNTV,2017-06-10 11:30,0,1,"VIDEO: Sec. Aguirre, nilinaw na wala sa Marawi si Sen. Aquino noong May 2","(['Manila', ' Philippines'], Location((14.5906216, 120.9799696, 0.0)))",,,873381740504530945,https://twitter.com/newstogoGNTV/status/873381740504530945,fil
muam_jo,2017-06-10 11:29,1,0,Pede po ba magrequest ulit ng updated aerial shot ng marawi?,,,,873381572866473988,https://twitter.com/muam_jo/status/873381572866473988,fil
manuelg56250743,2017-06-10 11:29,0,0,Military vows ‘free’ Marawi by June 12 - The Manila Times Online,,,,873381546895343617,https://twitter.com/manuelg56250743/status/873381546895343617,en
iY6yhBDXb8T1QzG,2017-06-10 11:28,0,0,اميين يارب r0r0r021,"(['Yemen'], Location((16.3471243, 47.8915271, 0.0)))",@,,873381428087664640,https://twitter.com/iY6yhBDXb8T1QzG/status/873381428087664640,ar
inquirerdotnet,2017-06-10 11:28,1,3,"Abella says the DND will lead the recovery and reconstruction efforts in Marawi, in cooperation with other govt agencies | LeilasINQ","(['Makati City'], Location((14.5591272, 121.0202094, 0.0)))",@,,873381361960321024,https://twitter.com/inquirerdotnet/status/873381361960321024,en
inquirerdotnet,2017-06-10 11:28,1,6,"Abella says draft of the EO for the P10B Bangong Marawi"" reconstruction program will be sent to the President soon for his signature""","(['Makati City'], Location((14.5591272, 121.0202094, 0.0)))",,,873381323645366274,https://twitter.com/inquirerdotnet/status/873381323645366274,en
trumpathon,2017-06-10 11:27,0,0,"BREAKING NEWS! JUNE 09, 2017 SENADOR. PING LACSON NANIWALA MATATAPOS NA ANG MARAWI CRISIS",,,,873381158792437760,https://twitter.com/trumpathon/status/873381158792437760,fil
jack_s_hewson,2017-06-10 11:27,0,1,From Indonesian village to Marawi siege chief,"(['Jakarta'], Location((-6.1753942, 106.827183, 0.0)))",,,873381156955201536,https://twitter.com/jack_s_hewson/status/873381156955201536,en
rmnnetworks,2017-06-10 11:27,0,0,"LatestNews Limang kataong nagnanakaw sa mga abandonadong bahay sa Marawi, arestado",,,#,873381150193893376,https://twitter.com/rmnnetworks/status/873381150193893376,fil
PhilippineStar,2017-06-10 11:27,3,2,DND to lead 'Bangon Marawi' rebuilding initiative; military engineering battalions to be involved. | alexisbromero,"(['Philippines'], Location((12.7503486, 122.7312101, 0.0)))",@,,873381136667336704,https://twitter.com/PhilippineStar/status/873381136667336704,en
patkun01,2017-06-10 11:27,0,0,"Away sila sa Cavs kag GSW, ang Marawi sige mangud girahay, tapos hindi nah siya invasion according to Risa wat","(['Philippines'], Location((12.7503486, 122.7312101, 0.0)))",,#,873381124990480384,https://twitter.com/patkun01/status/873381124990480384,fil
alexisbromero,2017-06-10 11:27,0,0,DND to lead 'Bangon Marawi' rebuilding initiative; military engineering battalions to be involved PhilippineStar PhilstarNews,"(['Manila'], Location((14.5906216, 120.9799696, 0.0)))",@ @,,873380983864664064,https://twitter.com/alexisbromero/status/873380983864664064,en
LeilasINQ,2017-06-10 11:26,2,1,"Abella says the DND will lead the recovery and reconstruction efforts in Marawi, in cooperation with other govt agencies",,,,873380934648713216,https://twitter.com/LeilasINQ/status/873380934648713216,en
iamJoie01,2017-06-10 11:26,0,0,i adore you with having such brave soul 143redangel please do take care prayers for ur safety and all the other heroes /heroines in Marawi,"(['Bacolod City', ' Western Visayas'], Location((10.6762836, 122.9513786, 0.0)))",@,,873380869125177345,https://twitter.com/iamJoie01/status/873380869125177345,en
PhilippineStar,2017-06-10 11:26,2,6,"Duterte to sign executive order on 'Bangon Marawi,' the P10 billion rebuilding program for Marawi. | alexisbromero","(['Philippines'], Location((12.7503486, 122.7312101, 0.0)))",@,,873380856190033922,https://twitter.com/PhilippineStar/status/873380856190033922,en
PhilippineStar,2017-06-10 11:26,4,6,Government to allot P10 billion for reconstruction efforts in Marawi. | alexisbromero,"(['Philippines'], Location((12.7503486, 122.7312101, 0.0)))",@,,873380799596199937,https://twitter.com/PhilippineStar/status/873380799596199937,en
CanillasRain,2017-06-10 11:26,0,2,Nung pumutok yung balita sa Marawi wala kayong ebas. Pucha ngayon mag 3-1 lang kala nyo ikamamatay nyo. HAHAHAHAHAHAHAHAHA.,"(['babe'], Location((41.8232129, -6.6349633, 0.0)))",,,873380743346495489,https://twitter.com/CanillasRain/status/873380743346495489,fil
alexisbromero,2017-06-10 11:25,2,0,"Duterte to sign executive order on 'Bangon Marawi,' the P10 billion rebuilding program for Marawi PhilippineStar PhilstarNews","(['Manila'], Location((14.5906216, 120.9799696, 0.0)))",@ @,,873380501817483264,https://twitter.com/alexisbromero/status/873380501817483264,en
