sherwinalfaro,2017-08-01 09:18,0,0,Catch the thrilling Marawi experience of Adam Harvey @ ABChttps://twitter.com/adharves/status/892179380767670273 …,"(['pasay city', ' philippines'], Location((14.5437592, 120.9954657, 0.0)))",@,,892192875999444993,https://twitter.com/sherwinalfaro/status/892192875999444993
07Joanaguilar,2017-08-01 09:15,0,0,Napaka epal talagapatapon Kita sa Marawi eh,"(['California', ' USA'], Location((36.7014631, -118.7559974, 0.0)))",,,892191994918821888,https://twitter.com/07Joanaguilar/status/892191994918821888
USAFnews,2017-08-01 09:14,0,0,US delivers weapons for PAF amid Marawi siege - Philippine Star : http://fat.ly/2NImk,"(['USA'], Location((39.7837304, -100.4458825, 0.0)))",,,892191797966917633,https://twitter.com/USAFnews/status/892191797966917633
NewTalk_Tw,2017-08-01 09:12,0,0,效忠「伊斯蘭國」(the Islamic State)的菲律賓穆斯林極端組織馬巫德(the Maute)，於該國南方民答那峨島的馬拉威市(the Marawi... http://fb.me/sSMqH7Aw,,,,892191354322812928,https://twitter.com/NewTalk_Tw/status/892191354322812928
PHShowbizNow,2017-08-01 09:12,0,0,"Solenn Heussaff describes visiting wounded Marawi soldiers as life-changing"" http://ift.tt/2tTcwF7  | via PUSH©""","(['\xc3\x9cT: 14.5339204', '121.0738461'], Location((47.8892975, -94.2631618, 0.0)))",,,892191266502520832,https://twitter.com/PHShowbizNow/status/892191266502520832
kingoftalk,2017-08-01 09:10,0,5,"Solenn Heussaff describes visiting wounded Marawi soldiers as life-changing"" - http://t.boyabunda.net/2tYE0xp""","(['Philippines'], Location((12.7503486, 122.7312101, 0.0)))",,,892190708743929861,https://twitter.com/kingoftalk/status/892190708743929861
jurgabes,2017-08-01 09:05,0,0,Cguro i garage Sale na ung mga bag at damit ni VM.. donate it to Marawi to restore the city..,"(['Palo Leyte', ' Philippines'], Location((11.1600825, 124.9901121, 0.0)))",,,892189597039329280,https://twitter.com/jurgabes/status/892189597039329280
RiffRaffBriz,2017-08-01 09:03,0,1,@ Badinskas It's local terrorists from Maute group and Abu Sayyaf plus a few foreign fighters in Marawi but they do plead allegiance to ISIS.,"(['Selatan'], Location((-5.5, 127.566667, 0.0)))",@,,892189084138881025,https://twitter.com/RiffRaffBriz/status/892189084138881025
CarlsenMEB04,2017-08-01 09:03,0,0,There are displaced Marawi kids who view terrorists as heroes. (check comments below),"(['Quezon City', ' Philippines'], Location((14.6509905, 121.0486155, 0.0)))",,,892188906564747265,https://twitter.com/CarlsenMEB04/status/892188906564747265
FintechPH,2017-08-01 09:00,0,0,"Filipino Startups Answer The Call Back Home, Raise Funds For Victims Displaced By Fighting In Marawi # Startups http://buff.ly/2vVTJuz pic.twitter.com/n2rx2E6xTt","(['Philippines'], Location((12.7503486, 122.7312101, 0.0)))",,#,892188136868106241,https://twitter.com/FintechPH/status/892188136868106241
PCSOLotteryDraw,2017-08-01 08:59,0,0,"MARAWI UPDATE | AUGUST 01, 2017: http://youtu.be/9Z6zDAwL3C0?a  via @ YouTube",,@,,892187967418249217,https://twitter.com/PCSOLotteryDraw/status/892187967418249217
Ivan226622,2017-08-01 08:59,0,0,"Battle for Marawi down to 2 villages, AFP says http://bit.ly/2uOGjBN # MarawiClash pic.twitter.com/qSapplfOZE — ABS-CBN News (ABSCBNNews) …",,,#,892187952394141697,https://twitter.com/Ivan226622/status/892187952394141697
PCSOLotteryDraw,2017-08-01 08:59,0,0,"I added a video to a @ YouTube playlist http://youtu.be/9Z6zDAwL3C0?a  MARAWI UPDATE | AUGUST 01, 2017",,@,,892187948271140866,https://twitter.com/PCSOLotteryDraw/status/892187948271140866
RiffRaffBriz,2017-08-01 08:53,0,0,"Fighting continues in # Marawi 40 to 60 remaining terrorists holding 80 to 100 civilian hostages, mostly in a mosque http://newsinfo.inquirer.net/919098/govt-troops-capture-key-bridge-near-marawi-militants …","(['Selatan'], Location((-5.5, 127.566667, 0.0)))",,#,892186528889192448,https://twitter.com/RiffRaffBriz/status/892186528889192448
ZamanOw_com,2017-08-01 08:51,0,0,Apakah TNI Perlu Operasi Militer di Marawi? Cukupkah Informasi Intelijen Akurat? https://lnkd.in/fBBuvvS,"(['jakarta indonesia'], Location((-6.1753942, 106.827183, 0.0)))",,,892186020598480896,https://twitter.com/ZamanOw_com/status/892186020598480896
MMakalaladINQ,2017-08-01 08:51,0,0,"Gobyerno ng Japan, magdo-donate ng $2-M na tulong para sa mga biktima ng bakbakan sa Marawi City I @ dzIQ990",,@,,892186005926625280,https://twitter.com/MMakalaladINQ/status/892186005926625280
ZamanOw_com,2017-08-01 08:51,0,0,Apakah TNI Perlu Operasi Militer di Marawi? Cukupkah Informasi Intelijen Akurat? http://galaberita.com/news-features/nasional/5480-apakah-tni-perlu-operasi-militer-di-marawi-cukupkah-informasi-intelijen-akurat …,"(['jakarta indonesia'], Location((-6.1753942, 106.827183, 0.0)))",,,892185920807387136,https://twitter.com/ZamanOw_com/status/892185920807387136
marit_cabugon,2017-08-01 08:50,0,0,"Marawi fundraiser and recruiter. Mahmud Ahmad, the IS money man http://po.st/fpvmps  via @ staronline","(['Cebu City', ' Central Visayas'], Location((10.3090298, 123.8930839, 0.0)))",@,,892185789630529537,https://twitter.com/marit_cabugon/status/892185789630529537
ABSCBNNews,2017-08-01 08:50,6,27,"Battle for Marawi down to 2 villages, AFP says http://bit.ly/2uOGjBN # MarawiClashpic.twitter.com/kaAOGiTxxE","(['Manila', ' Philippines'], Location((14.5906216, 120.9799696, 0.0)))",,#,892185613406838786,https://twitter.com/ABSCBNNews/status/892185613406838786
topMelbourneNow,2017-08-01 08:46,0,0,Getting shot was just the beginning. Escape from Marawi airs tonight at 9.20pm on Foreign Correspondent http://toplocalnow.com/au/melbourne/at/10#t6401331 …,"(['Melbourne', ' Victoria'], Location((-37.8142176, 144.9631608, 0.0)))",,#t6401331,892184616743964672,https://twitter.com/topMelbourneNow/status/892184616743964672
ZamanOw_com,2017-08-01 08:44,0,0,Apakah TNI Perlu Operasi Militer di Marawi? Cukupkah Informasi Intelijen Akurat? http://fb.me/7VbiChTXH,"(['jakarta indonesia'], Location((-6.1753942, 106.827183, 0.0)))",,,892184274790514688,https://twitter.com/ZamanOw_com/status/892184274790514688
dzIQ990,2017-08-01 08:43,0,0,"Gobyerno ng Japan, magdo-donate ng $2-M na tulong para sa biktima ng bakbakan sa Marawi City | @ MMakalaladINQ","(['Makati City'], Location((14.5591272, 121.0202094, 0.0)))",@,,892184085195390977,https://twitter.com/dzIQ990/status/892184085195390977
castillo19939,2017-08-01 08:42,0,0,"Areas nearby Marawi yes okay, not yet in the city itself. Good signs, go # BangonMarawihttps://twitter.com/mariaressa/status/892177827335880705 …","(['Philippines'], Location((12.7503486, 122.7312101, 0.0)))",,#,892183609242656768,https://twitter.com/castillo19939/status/892183609242656768
PinoyTambayanKo,2017-08-01 08:38,0,0,Unnamed Marawi resident leases 11-hectare land to gov’t for IDP housing for free – officials http://www.pinoytambayan.org.ph/2017/07/unnamed-marawi-resident-leases-11.html …pic.twitter.com/HH7QumURsz,"(['Bulacan'], Location((14.794871, 120.8777119, 0.0)))",,,892182638785699840,https://twitter.com/PinoyTambayanKo/status/892182638785699840
happydreams22,2017-08-01 08:38,0,0,abcnews: RT adharves: WATCH: Getting shot was just the beginning. Escape from Marawi airs tonight at 9.20pm on For… pic.twitter.com/biz7iWenTc,"(['Meridian', ' MS'], Location((32.3643098, -88.703656, 0.0)))",,,892182614521630720,https://twitter.com/happydreams22/status/892182614521630720
PinoyTambayanan,2017-08-01 08:34,0,0,Unnamed Marawi resident leases 11-hectare land to gov’t for IDP housing for free – officials http://bit.ly/2uexAp8 # pinoy # tambayan # pin…pic.twitter.com/nk0T00nCRo,"(['Philippines'], Location((12.7503486, 122.7312101, 0.0)))",,# # #,892181812499402754,https://twitter.com/PinoyTambayanan/status/892181812499402754
pinoynewsonline,2017-08-01 08:32,0,0,Rodrigo Duterte News | PUTAK ng PUTAK mga BINAYARAN ng DILAWAN na MUSLIM sa MARAWI! GUSTONG IPATI More on... http://fb.me/6yipeoiYA,"(['Republic of the Philippines'], Location((12.7503486, 122.7312101, 0.0)))",,,892181260948316161,https://twitter.com/pinoynewsonline/status/892181260948316161
cnnphilippines,2017-08-01 08:27,1,3,Youth organization in GenSan gives soldiers in Marawi chocolates with inspirational messages | # CNNPHNewsroom live http://cnn.ph/1LXc9jG pic.twitter.com/RpRK9qt4k5,,,#,892179981798789120,https://twitter.com/cnnphilippines/status/892179981798789120
actindonesia,2017-08-01 08:27,0,0,[indonesia-act] Indonesia not ruling out sending troops to Marawi - ETAN http://dlvr.it/PZvdjm,,,,892179841360973824,https://twitter.com/actindonesia/status/892179841360973824
adharves,2017-08-01 08:25,200,273,WATCH: Getting shot was just the beginning. Escape from Marawi airs tonight at 9.20pm on Foreign Correspondent pic.twitter.com/XJ6siVb3tr,"(['Jakarta'], Location((-6.1753942, 106.827183, 0.0)))",,,892179380767670273,https://twitter.com/adharves/status/892179380767670273
andoyp,2017-08-01 08:19,0,0,"Musicians, artists, and individuals from Iligan collaboratively made this music video in response for the Marawi... http://fb.me/2a83KaILC","(['Manila'], Location((14.5906216, 120.9799696, 0.0)))",,,892177918230769666,https://twitter.com/andoyp/status/892177918230769666
mariaressa,2017-08-01 08:19,0,0,Military says residents of towns around Marawi can go home - http://www.rappler.com/nation/177275-military-residents-towns-around-marawi-home … via @ rapplerdotcompic.twitter.com/pW7HDmK2R6,"(['Philippines'], Location((12.7503486, 122.7312101, 0.0)))",@,,892177827335880705,https://twitter.com/mariaressa/status/892177827335880705
beritagar,2017-08-01 08:15,0,0,Agar gejolak Marawi tak merembet ke Indonesia https://beritagar.id/artikel/berita/agar-gejolak-marawi-tak-merembet-ke-indonesia …,"(['Jakarta'], Location((-6.1753942, 106.827183, 0.0)))",,,892176980602306561,https://twitter.com/beritagar/status/892176980602306561
itsme_pauuuu,2017-08-01 08:14,0,0,mukha akong napalaban sa marawi,,,,892176745364824064,https://twitter.com/itsme_pauuuu/status/892176745364824064
DZMMTeleRadyo,2017-08-01 08:11,1,0,Joint Task Force Marawi: Wala pang bagong impormasyon sa kinaroroonan o kalagayan ni Fr. Chito Suganob | via @ jeffreyhernaezpic.twitter.com/t4gxM89Oi0,"(['ABS-CBN', ' Diliman', ' Quezon City'], Location((11.5874907, 122.7520466, 0.0)))",@,,892175975391166464,https://twitter.com/DZMMTeleRadyo/status/892175975391166464
vickygarch,2017-08-01 08:11,0,1,Who can disabuse them of this view? The teachers in Marawi should help them discern the truth.,,,,892175951919890432,https://twitter.com/vickygarch/status/892175951919890432
zandro_sayson,2017-08-01 08:06,0,0,ML in Mindanao will help get rid of the terrorists in Marawi. I don't worry about Human Rights Abuses. The police & soldiers know the rules.,"(['Davao City', ' Davao Region'], Location((7.22650725, 125.454887691, 0.0)))",,,892174629199945728,https://twitter.com/zandro_sayson/status/892174629199945728
jeffreyhernaez,2017-08-01 08:06,0,0,Joint Task Force Marawi: Wala pang bagong impormasyon sa kinaroroonan o kalagayan ni Fr. Chito Suganob. pic.twitter.com/n8sG1XaawZ,"(['Manila', ' the place to be.'], Location((14.5906216, 120.9799696, 0.0)))",,,892174584065081344,https://twitter.com/jeffreyhernaez/status/892174584065081344
jeffreyhernaez,2017-08-01 08:05,0,0,"Joint Task Force Marawi: Puwersa ng Maute Group, humihina na; dumedepende na lamang sa mga IED o mga pampasabog. pic.twitter.com/aePA8lNj0d","(['Manila', ' the place to be.'], Location((14.5906216, 120.9799696, 0.0)))",,,892174404934696961,https://twitter.com/jeffreyhernaez/status/892174404934696961
ruffybiazon,2017-08-01 08:04,2,3,"ISIS proved it is a true global threat as violent extremist organizations banded together to occupy Marawi City in Mindanao in the Phils."" https://twitter.com/pacificcommand/status/892154615726080000 …""","(['Philippines'], Location((12.7503486, 122.7312101, 0.0)))",,,892174221421322241,https://twitter.com/ruffybiazon/status/892174221421322241
dzbb,2017-08-01 08:03,1,0,"Militar, tikom ang bibig sa kalagayan ng mga bihag ng grupong Maute sa Marawi City. | via @ Benjielitepic.twitter.com/T5K1IQe266","(['Republic of the Philippines'], Location((12.7503486, 122.7312101, 0.0)))",@,,892173825693143041,https://twitter.com/dzbb/status/892173825693143041
ManilaRR,2017-08-01 08:03,0,0,Nearly half a million displaced by Marawi siege; Major health concerns raised http://www.rightrelevance.com/search/articles/hero?article=33b4d4737a36cfa6927ea06e95c4142e74d0f580&query=manila%20philippines&taccount=manilarr …pic.twitter.com/PgeJhm3wD4,,,,892173791643697153,https://twitter.com/ManilaRR/status/892173791643697153
PhilippinePolRR,2017-08-01 08:02,0,0,Philippine troops capture key bridge near Marawi militants http://www.rightrelevance.com/search/articles/hero?article=d9ba198e5f5a1a500ab1a2ea52e68dfe678aced4&query=philippines&taccount=philippinepolrr …,,,,892173706210009090,https://twitter.com/PhilippinePolRR/status/892173706210009090
politikovismin,2017-08-01 08:02,0,0,DOH to build Cuban-style health facilities in Marawi - Ubial http://mindanao.politics.com.ph/doh-build-cuban-style-health-facilities-marawi-ubial/ …,,,,892173535573139456,https://twitter.com/politikovismin/status/892173535573139456
egdsgn,2017-08-01 08:01,0,0,"Marawi hero, ikinulong matapos makapatay ng drug pusher https://politicsph.pogoport.com/marawi-hero-ikinulong-matapos-makapatay-ng-drug-pusher/ …","(['Davao City', ' Davao Region'], Location((7.22650725, 125.454887691, 0.0)))",,,892173292727087104,https://twitter.com/egdsgn/status/892173292727087104
muzi_kha,2017-08-01 08:01,0,0,"Marawi hero, ikinulong matapos makapatay ng drug pusher https://politicsph.pogoport.com/marawi-hero-ikinulong-matapos-makapatay-ng-drug-pusher/ …","(['The Office'], Location((9.6663813, 80.0122994306, 0.0)))",,,892173285164711937,https://twitter.com/muzi_kha/status/892173285164711937
chris19thws,2017-08-01 08:01,0,0,"Marawi hero, ikinulong matapos makapatay ng drug pusher https://politicsph.pogoport.com/marawi-hero-ikinulong-matapos-makapatay-ng-drug-pusher/ …","(['Philippines'], Location((12.7503486, 122.7312101, 0.0)))",,,892173279385071616,https://twitter.com/chris19thws/status/892173279385071616
PoGo_Port,2017-08-01 08:00,0,0,"Marawi hero, ikinulong matapos makapatay ng drug pusher https://politicsph.pogoport.com/marawi-hero-ikinulong-matapos-makapatay-ng-drug-pusher/ …",,,,892173273471045632,https://twitter.com/PoGo_Port/status/892173273471045632
orga_ogop,2017-08-01 08:00,0,0,"Marawi hero, ikinulong matapos makapatay ng drug pusher https://politicsph.pogoport.com/marawi-hero-ikinulong-matapos-makapatay-ng-drug-pusher/ …",,,,892173267074777089,https://twitter.com/orga_ogop/status/892173267074777089
RTheKrak3n,2017-08-01 08:00,0,0,"Marawi hero, ikinulong matapos makapatay ng drug pusher https://politicsph.pogoport.com/marawi-hero-ikinulong-matapos-makapatay-ng-drug-pusher/ …",,,,892173256664522752,https://twitter.com/RTheKrak3n/status/892173256664522752
unicefphils,2017-08-01 08:00,1,8,Japan extends humanitarian grant aid to support children and families affected by the Marawi conflict: http://uni.cf/2vY6ox8,"(['Manila', ' Philippines'], Location((14.5906216, 120.9799696, 0.0)))",,,892173223311364096,https://twitter.com/unicefphils/status/892173223311364096
SunStarBacolod,2017-08-01 08:00,0,0,AFP spokesperson Brigadier General Restituto Padilla Jr. said individuals residing in Marawi City could not still... http://fb.me/4srDnbvtZ,,,,892173130776461312,https://twitter.com/SunStarBacolod/status/892173130776461312
RiffRaffBriz,2017-08-01 07:59,1,1,"Escape from the clinic under fire, wounded locals not so lucky and soldiers having to buy their own ammo. # Marawi http://www.abc.net.au/news/2017-08-01/journalist-adam-harvey-recounts-being-shot-and-following-ordeal/8748408?section=world …","(['Selatan'], Location((-5.5, 127.566667, 0.0)))",,#,892172920801210369,https://twitter.com/RiffRaffBriz/status/892172920801210369
Kicau_Politik,2017-08-01 07:59,0,0,Penjelasan Wiranto Soal Kerja Sama Mengeroyok ISIS di Marawi http://ift.tt/2tYnwp6,,,,892172819995521024,https://twitter.com/Kicau_Politik/status/892172819995521024
rexfactor21,2017-08-01 07:58,0,0,Is he serious? We're cancelling it for next year di ba because of the Marawi issue! Insensitive much.,,,,892172635710279681,https://twitter.com/rexfactor21/status/892172635710279681
pondokindahinfo,2017-08-01 07:56,0,0,# News: Penjelasan Wiranto Soal Kerja Sama Mengeroyok ISIS di Marawi http://ift.tt/2tYnwp6  | http://Tempo.co,"(['Pondok Indah', ' Jakarta Selatan'], Location((-6.2915605, 106.7838466, 0.0)))",,#,892172076534116353,https://twitter.com/pondokindahinfo/status/892172076534116353
PhilippineStar,2017-08-01 07:54,4,3,"Pres. Duterte amends EO 17 creating Order of Lapu-lapu, signs EO 35 on July 28, citing new awards for acts valor to help end Marawi siege.","(['Philippines'], Location((12.7503486, 122.7312101, 0.0)))",,,892171577231458304,https://twitter.com/PhilippineStar/status/892171577231458304
dzrhnews,2017-08-01 07:43,0,0,"Resident who insisted to go back to Marawi, hit by stray bullet. # PangunahingBalita","(['Manila', ' Philippines'], Location((14.5906216, 120.9799696, 0.0)))",,#,892168983951978496,https://twitter.com/dzrhnews/status/892168983951978496
pnagovph,2017-08-01 07:43,0,0,Gov't to provide transitional shelters for displaced Marawi City residents | @ DPWHph http://www.pna.gov.ph/articles/1003928 …,"(['Quezon City'], Location((14.6509905, 121.0486155, 0.0)))",@,,892168945267916801,https://twitter.com/pnagovph/status/892168945267916801
30cde5d44f83422,2017-08-01 07:40,0,0,nasaan nga pala si marcos? cidg din? expect more violent confrontations. these alleged drug personalities will fight back. another marawi.,,,,892168095321645058,https://twitter.com/30cde5d44f83422/status/892168095321645058
PhilDefNews,2017-08-01 07:40,0,0,The story of the foreign journalist who was shot in Marawi https://www.facebook.com/philippinedefensebulletin/posts/1017359661699675 …,"(['Manila', ' Philippines'], Location((14.5906216, 120.9799696, 0.0)))",,,892168043433873409,https://twitter.com/PhilDefNews/status/892168043433873409
PhilDefNews,2017-08-01 07:38,0,0,Ground work begins for Marawi relocation site http://www.rappler.com/nation/177266-marawi-relocation-site-construction-model-houses-military …,"(['Manila', ' Philippines'], Location((14.5906216, 120.9799696, 0.0)))",,,892167628818481152,https://twitter.com/PhilDefNews/status/892167628818481152
Dian_Supolo,2017-08-01 07:38,0,0,"Duterte ud bhssil matiin tuh para teroris di Marawi, blm? https://twitter.com/kompascom/status/892163472825360384 …",,,,892167610757898241,https://twitter.com/Dian_Supolo/status/892167610757898241
findtrendingph,2017-08-01 07:37,0,0,Sundalong Galing Marawi Ikinulong Matapos Makapatay Ng Drug Lord Sa Cavite - https://www.findtrendingportal.com/2017/08/01/sundalong-galing-marawi-ikinulong-matapos-makapatay-ng-drug-lord-sa-cavite/ …pic.twitter.com/BYHdDTaMky,,,,892167314875068416,https://twitter.com/findtrendingph/status/892167314875068416
PHHotTrends,2017-08-01 07:30,0,0,Maute fighters in Marawi down to 40 — Lorenzana # MarawiUpdateshttps://shar.es/1TADap,"(['Manila City'], Location((14.5906216, 120.9799696, 0.0)))",,#,892165653766995968,https://twitter.com/PHHotTrends/status/892165653766995968
politikovismin,2017-08-01 07:30,0,0,Ben Evardone honors Samar soldier who died in Marawi http://visayas.politics.com.ph/ben-evardone-honors-samar-soldier-died-marawi/ …,,,,892165480886259716,https://twitter.com/politikovismin/status/892165480886259716
cbcpnews,2017-08-01 07:28,2,12,Catholic school network ends 14 days of prayer for Marawi @ CatholicEdPH http://cbcpnews.net/cbcpnews/catholic-school-network-ends-14-days-of-prayer-for-marawi/ …pic.twitter.com/TDFwZmKGAi,"(['Intramuros', ' Manila'], Location((14.5905862, 120.97533, 0.0)))",@,,892164977166999552,https://twitter.com/cbcpnews/status/892164977166999552
CBCPNews_Nirva,2017-08-01 07:28,0,0,Catholic school network ends 14 days of prayer for Marawi @ CatholicEdPH http://cbcpnews.net/cbcpnews/catholic-school-network-ends-14-days-of-prayer-for-marawi/ …pic.twitter.com/uSOVAQLEDx,"(['Republic of the Philippines'], Location((12.7503486, 122.7312101, 0.0)))",@,,892164975736705024,https://twitter.com/CBCPNews_Nirva/status/892164975736705024
Ivan226622,2017-08-01 07:24,0,0,"Joint Task Force Marawi: Ulat na isang 'key person' ng Maute group ang napatay, kinukumpirma pa ng militar | via jeffreyhernaez …",,,,892164099341201408,https://twitter.com/Ivan226622/status/892164099341201408
RHF_M8,2017-08-01 07:23,0,0,هلا وغلاء مروتي نورتي حسابي م جديد ومشكوره ع البلوك الي سويتيها قبل,,,,892163816976510976,https://twitter.com/RHF_M8/status/892163816976510976
phildaily,2017-08-01 07:23,0,0,Tent city plan for Marawi evacuees dropped - http://Inquirer.net https://goo.gl/fb/51vYxE,,,,892163804070653953,https://twitter.com/phildaily/status/892163804070653953
l2IDI1bR1wRm3Le,2017-08-01 07:22,0,0,سلا مه وليش,"(['Kingdom of Saudi Arabia'], Location((-6.8638235, 39.2551949, 0.0)))",,,892163642690596864,https://twitter.com/l2IDI1bR1wRm3Le/status/892163642690596864
DZMMTeleRadyo,2017-08-01 07:21,2,9,"Joint Task Force Marawi: Ulat na isang 'key person' ng Maute group ang napatay, kinukumpirma pa ng militar | via @ jeffreyhernaezpic.twitter.com/0WaZ4Ch60u","(['ABS-CBN', ' Diliman', ' Quezon City'], Location((11.5874907, 122.7520466, 0.0)))",@,,892163414197379072,https://twitter.com/DZMMTeleRadyo/status/892163414197379072
PhilstarNews,2017-08-01 07:21,0,1,Maute fighters in Marawi down to 40 — Lorenzana # MarawiUpdateshttps://shar.es/1TADap,"(['Manila', ' Philippines'], Location((14.5906216, 120.9799696, 0.0)))",,#,892163366738739200,https://twitter.com/PhilstarNews/status/892163366738739200
gmanews,2017-08-01 07:21,7,23,Ilang kuwento ng kabayanihan at sakripisyo ang naibahagi ng mga sundalong galing sa frontlines sa Marawi City. http://gmane.ws/2uO4eBo,"(['Philippines'], Location((12.7503486, 122.7312101, 0.0)))",,,892163215987290117,https://twitter.com/gmanews/status/892163215987290117
ANCALERTS,2017-08-01 07:20,2,11,"Battle for Marawi down to 2 villages, AFP says http://bit.ly/2vZyEiP","(['Philippines'], Location((12.7503486, 122.7312101, 0.0)))",,,892162963561426944,https://twitter.com/ANCALERTS/status/892162963561426944
marawi_q8,2017-08-01 07:18,1,1,شكرا الغاليه,,,,892162586988466176,https://twitter.com/marawi_q8/status/892162586988466176
marawi_q8,2017-08-01 07:18,0,1,عنوني انتي,,,,892162475357077504,https://twitter.com/marawi_q8/status/892162475357077504
imharvieamerol,2017-08-01 07:17,3,7,Madakl a pakamiss sa Marawi.,"(['Philippines'], Location((12.7503486, 122.7312101, 0.0)))",,,892162384042663938,https://twitter.com/imharvieamerol/status/892162384042663938
Jetong,2017-08-01 07:15,0,0,Should spend the resources on the rehab of Marawi.,,,,892161727936086016,https://twitter.com/Jetong/status/892161727936086016
dzrhnews,2017-08-01 07:12,0,0,"Bakwit na nagpumilit bumalik sa Marawi, sapul sa stray bullet! # PangunahingBalita","(['Manila', ' Philippines'], Location((14.5906216, 120.9799696, 0.0)))",,#,892161140821598209,https://twitter.com/dzrhnews/status/892161140821598209
jeffreyhernaez,2017-08-01 07:12,0,0,"Panoorin: Joint Task Force Marawi: Ulat na isang key person"" ng Maute Group ang napatay, kinukumpirma pa ng militar. pic.twitter.com/rQLGCC9w1A""","(['Manila', ' the place to be.'], Location((14.5906216, 120.9799696, 0.0)))",,,892161104448598017,https://twitter.com/jeffreyhernaez/status/892161104448598017
DavaoToday,2017-08-01 07:10,0,0,Images of Marawi evacuees two months after the seige http://fb.me/5zcZP9lLo,"(['Davao City', ' Philippines'], Location((7.22650725, 125.454887691, 0.0)))",,,892160517049114624,https://twitter.com/DavaoToday/status/892160517049114624
GinRumandTruth,2017-08-01 07:02,0,0,Highlights of Saturday's Benefit gig for Marawi. Check it out! (c) Shayne Jeanjaquet http://fb.me/95rYZq40S,"(['Manila'], Location((14.5906216, 120.9799696, 0.0)))",,,892158680052883457,https://twitter.com/GinRumandTruth/status/892158680052883457
RHF_M8,2017-08-01 07:01,2,4,"دعم_خاص  ..❥ ♩ مغرده رآقيه مبدعه ￼ جميله بحضورۿا وكلمآتۿا تستحق المتابعة ￼ @ marawi_q8""",,@,,892158311394574336,https://twitter.com/RHF_M8/status/892158311394574336
WhenInManila,2017-08-01 07:00,0,1,Solenn Heussaff Visits Wounded Marawi Soldiers ~When In Manila http://fb.me/99mFm1p4x,"(['Manila', ' Philippines - Asia'], Location((14.5906216, 120.9799696, 0.0)))",,,892157944338407425,https://twitter.com/WhenInManila/status/892157944338407425
Sh_____d,2017-08-01 06:59,1,3,روعااتك مروه,,,,892157895730757632,https://twitter.com/Sh_____d/status/892157895730757632
dwiz882,2017-08-01 06:55,0,0,"# IZHeadlines Isa pang “stronghold” ng grupong Maute sa Marawi City, nabawi na rin ng militar","(['Pasig City', ' Philippines'], Location((9.7771753, 125.4915723, 0.0)))",,#,892156804209098752,https://twitter.com/dwiz882/status/892156804209098752
ytdlpro,2017-08-01 06:54,0,0,Philippine Government Advance Troops in Marawi: http://youtu.be/R2rgA_l6zas?a  via @ YouTube,"(['Leyte', ' Eastern Visayas'], Location((10.833333, 124.833333, 0.0)))",@,,892156486587224064,https://twitter.com/ytdlpro/status/892156486587224064
ytdlpro,2017-08-01 06:54,0,0,I added a video to a @ YouTube playlist http://youtu.be/R2rgA_l6zas?a  Philippine Government Advance Troops in Marawi,"(['Leyte', ' Eastern Visayas'], Location((10.833333, 124.833333, 0.0)))",@,,892156475019317249,https://twitter.com/ytdlpro/status/892156475019317249
