Politiko_Ph,2017-06-10 20:27,2,5,top photos superhero angel locsin lifts spirits of marawi evacuees,,,,873516980875042816,https://twitter.com/Politiko_Ph/status/873516980875042816,en
peacegovph,2017-06-10 20:26,0,0,despite the armed conflict she remains to believe that peace will soon reign in marawi ang ,"(['Philippines'], Location((12.7503486, 122.7312101, 0.0)))",,,873516815695060992,https://twitter.com/peacegovph/status/873516815695060992,en
juliemadsen001,2017-06-10 20:26,1,0,only a matter of time until this happens in western europe and then what isis destroying churches in marawi,"(['Asturias y Madrid'], Location((40.4611735, -3.4613878, 0.0)))",,# #,873516731121139712,https://twitter.com/juliemadsen001/status/873516731121139712,en
worldonalert,2017-06-10 20:26,72,39,philippines list shows names of 45 government forces who were killed in marawi heavy casualties of the last 48 hours are not included u,"(['Germany'], Location((51.0834196, 10.4234469, 0.0)))",,# #,873516716353085440,https://twitter.com/worldonalert/status/873516716353085440,en
junalcoverjr,2017-06-10 20:25,0,0,biggest nonfactor by philip jr lustre what is now taking shape in the marawi city is something unthinkable for,"(['Cebu City', ' Philippines'], Location((10.3090298, 123.8930839, 0.0)))",,,873516369186144256,https://twitter.com/junalcoverjr/status/873516369186144256,en
Marocconnected,2017-06-10 20:25,0,0,13 marines killed as fighting rages in marawi city marocconnected,"(['Rotterdam'], Location((51.92779805, 4.48862326926, 0.0)))",,#,873516367797997569,https://twitter.com/Marocconnected/status/873516367797997569,en
mafaesays,2017-06-10 20:23,0,0,ok i know human lives matter the most in times of war but i cant help but feel sad for the pets  animals left behind in marawi,"(['Manila'], Location((14.5906216, 120.9799696, 0.0)))",,,873515915035291648,https://twitter.com/mafaesays/status/873515915035291648,en
Bakuuu74Ru,2017-06-10 20:22,0,0,marawi siege us special forces aiding philippine army  azturk fm,,,,873515658113404928,https://twitter.com/Bakuuu74Ru/status/873515658113404928,en
Trendsiana,2017-06-10 20:21,0,0,8 philippine soldiers were killed by isis sniper during clashes in daagodban district of the city of marawi,"(['Worldwide'], Location((53.4573434, -2.22698994022, 0.0)))",,# #,873515561983983616,https://twitter.com/Trendsiana/status/873515561983983616,en
TerrorEvents,2017-06-10 20:21,32,12,philippines marawi  images of the intense fighting between the army and islinked maute,,,# # # #,873515554480500736,https://twitter.com/TerrorEvents/status/873515554480500736,en
kamaongpilipino,2017-06-10 20:21,0,0,this was the plan to invade marawi by maute and abu sayyaf condemnedalltraitors,"(['Eastern Visayas'], Location((11.32782725, 124.997556122, 0.0)))",,#,873515516329177088,https://twitter.com/kamaongpilipino/status/873515516329177088,en
kamaongpilipino,2017-06-10 20:21,0,0,i added a video to a youtube playlist this was the plan to invade marawi by maute and abu sayyaf,"(['Eastern Visayas'], Location((11.32782725, 124.997556122, 0.0)))",@,,873515507542089729,https://twitter.com/kamaongpilipino/status/873515507542089729,en
alaturka,2017-06-10 20:21,0,0,update  philippines 13 marines slain in fight formarawi,"(['Beverly Hills', ' CA'], Location((34.0736204, -118.4003563, 0.0)))",,,873515473035563009,https://twitter.com/alaturka/status/873515473035563009,en
tonyocruz,2017-06-10 20:20,2,10,mindanao state university in marawi 8,"(['Manila', ' Philippines'], Location((14.5906216, 120.9799696, 0.0)))",,#,873515164967911424,https://twitter.com/tonyocruz/status/873515164967911424,en
skinnergj,2017-06-10 20:19,0,0,us forces assist philippines military as marawi siege rages on via skinnergj,"(['Sydney', ' New South Wales'], Location((-33.8548157, 151.2164539, 0.0)))",@,,873514996327522304,https://twitter.com/skinnergj/status/873514996327522304,en
eTurboNews,2017-06-10 20:19,0,0,marawi citys strategic importance comes tofore,,,,873514939574620161,https://twitter.com/eTurboNews/status/873514939574620161,en
benavu54,2017-06-10 20:19,1,0,us special forces helping philippines fight militants in marawi via voanews,"(['Australia'], Location((-24.7761086, 134.755, 0.0)))",@,,873514919257284608,https://twitter.com/benavu54/status/873514919257284608,en
PhyIis,2017-06-10 20:18,0,0,us forces assist philippines in battle to end city siege via reuters marawi daesh,,@,# # # #,873514742840786944,https://twitter.com/PhyIis/status/873514742840786944,en
tonyocruz,2017-06-10 20:18,7,27,mindanao state university in marawi,"(['Manila', ' Philippines'], Location((14.5906216, 120.9799696, 0.0)))",,#,873514736549117952,https://twitter.com/tonyocruz/status/873514736549117952,en
inquirerdotnet,2017-06-10 20:18,5,9,3 more civilians rescued in marawi,"(['Makati City'], Location((14.5591272, 121.0202094, 0.0)))",,,873514646220701697,https://twitter.com/inquirerdotnet/status/873514646220701697,en
drubald,2017-06-10 20:18,0,0,who arms the jihadists marawi,,,#,873514628558585856,https://twitter.com/drubald/status/873514628558585856,en
thenewpaper,2017-06-10 20:16,0,0,end is near says philippine general of marawi seige,"(['Singapore'], Location((1.2904753, 103.8520359, 0.0)))",,,873514277847658498,https://twitter.com/thenewpaper/status/873514277847658498,en
AnnalisaBurgos,2017-06-10 20:16,0,3,wonder why philippines seems to be downplaying this marawi,,,#,873514211447422978,https://twitter.com/AnnalisaBurgos/status/873514211447422978,en
realhumanrights,2017-06-10 20:16,0,0,philippines  usa special forces helping with technical support in fighting isislinked terrorists in marawi,"(['Washington DC'], Location((38.8949549, -77.0366456, 0.0)))",,# # # # #,873514180225241088,https://twitter.com/realhumanrights/status/873514180225241088,en
skinnergj,2017-06-10 20:15,0,0,13 marines killed as fighting rages in marawi city via skinnergj,"(['Sydney', ' New South Wales'], Location((-33.8548157, 151.2164539, 0.0)))",@,,873514052806295552,https://twitter.com/skinnergj/status/873514052806295552,en
dzmc911fmtarlac,2017-06-10 20:15,0,0,49 displaced marawi learners enroll in cl public schools by carlo lorenzo datu city of san fernando pampanga,"(['Tarlac City', ' Philippines'], Location((15.485997, 120.589556, 0.0)))",,,873514021470707712,https://twitter.com/dzmc911fmtarlac/status/873514021470707712,en
MoxieLi,2017-06-10 20:15,4,5,duterte said he doesnt need america  then begs for us help in marawi,,,,873514020384288768,https://twitter.com/MoxieLi/status/873514020384288768,en
tesco_press,2017-06-10 20:15,0,0,marawi siege us special forces aiding philippine army via inexpensive ,"(['East Midlands', ' England'], Location((52.79657515, -0.671822256834, 0.0)))",@so,,873513862267641860,https://twitter.com/tesco_press/status/873513862267641860,en
RamiroEncerrado,2017-06-10 20:15,0,0,philippine military says 13 marines killed in fighting with muslim militants who have laid siege to marawi city,,,,873513852868194305,https://twitter.com/RamiroEncerrado/status/873513852868194305,en
aljazeeratoday,2017-06-10 20:14,0,0,13 marines killed as fighting rages in marawi city  news ,,,,873513653173178369,https://twitter.com/aljazeeratoday/status/873513653173178369,en
AFPCRS,2017-06-10 20:12,0,2,together let us build a stronger and better marawi marawi will rise again uniteagainstterrorism,"(['Camp Aguinaldo', ' Quezon City'], Location((14.6065379, 121.063758836, 0.0)))",,#,873513294488772609,https://twitter.com/AFPCRS/status/873513294488772609,en
MovePH,2017-06-10 20:11,71,88,this independenceday say thanks to the soldiers who put their lives on the line to free marawi salamatsaserbisyohttp,"(['Philippines'], Location((12.7503486, 122.7312101, 0.0)))",,# #,873513018902138881,https://twitter.com/MovePH/status/873513018902138881,en
maxangelo987,2017-06-10 20:11,0,0,pnparmm rpsb chief says police convoy from marawi was ambushed near border of pantar and baloi towns in lanao de norte  cedriccastillo,,,,873512915617370112,https://twitter.com/maxangelo987/status/873512915617370112,en
rupertambil,2017-06-10 20:09,0,0,salamatsaserbisyo show your support for marawi soldiers cops via rapplerdotcom,"(['Philippines'], Location((12.7503486, 122.7312101, 0.0)))",@,#,873512513421234176,https://twitter.com/rupertambil/status/873512513421234176,en
tonyocruz,2017-06-10 20:09,4,26,marawi uc,"(['Manila', ' Philippines'], Location((14.5906216, 120.9799696, 0.0)))",,,873512509164068865,https://twitter.com/tonyocruz/status/873512509164068865,en
skinnergj,2017-06-10 20:08,0,0,us forces join philippine troops to end marawi city siege via skinnergj,"(['Sydney', ' New South Wales'], Location((-33.8548157, 151.2164539, 0.0)))",@,,873512299037839360,https://twitter.com/skinnergj/status/873512299037839360,en
scowsfield,2017-06-10 20:07,0,0,too many government troops killed in this marawi encounter rip,,,,873511870602162176,https://twitter.com/scowsfield/status/873511870602162176,en
TausugAku95,2017-06-10 20:07,2,1,marawi war will end up like the zamboanga war back channeling has to pursue to stop the war noynoying was adamant to show might in the,"(['Maimbung', ' Sulu'], Location((5.9309973, 121.0269364, 0.0)))",,,873511827518271489,https://twitter.com/TausugAku95/status/873511827518271489,en
SavingMind,2017-06-10 20:06,0,0,please share let us pray for our troops who are fighting for peace in marawi city prayforoursoldiers photo ,"(['Iloilo City', ' Western Visayas'], Location((10.7026718, 122.5686136, 0.0)))",,#,873511689320361984,https://twitter.com/SavingMind/status/873511689320361984,en
snowyukiyap,2017-06-10 20:06,0,0,retweeted bbc news asia  bbcnewsasia air strike on jihadist targets in marawi philippines,"(['Malaysia'], Location((2.3923759, 112.8471939, 0.0)))",@,,873511667505737729,https://twitter.com/snowyukiyap/status/873511667505737729,en
snowyukiyap,2017-06-10 20:06,0,0,retweeted bbc news asia  bbcnewsasia marawi siege us special forces aiding philippine army d,"(['Malaysia'], Location((2.3923759, 112.8471939, 0.0)))",@,,873511657393324032,https://twitter.com/snowyukiyap/status/873511657393324032,en
ivan2266,2017-06-10 20:05,0,0,maute sniper kills boy in marawi  cnn philippines cnnphilippines june 10 2017,"(['Earth'], Location((34.2331373, -102.4107493, 0.0)))",,,873511448156270592,https://twitter.com/ivan2266/status/873511448156270592,en
TheOsintJournal,2017-06-10 20:05,2,2,philippines us special forces providing technical assistance to end marawi siege,,,,873511402870329344,https://twitter.com/TheOsintJournal/status/873511402870329344,en
mindanaoan,2017-06-10 20:05,0,0,just got word that the marawi donationfeeding program will provide 150 food packs 100 hygiene kits and 60 packs with napkins diapers,"(['Philippines - New York City'], Location((40.7559436, -73.9793307, 0.0)))",,#,873511361019555840,https://twitter.com/mindanaoan/status/873511361019555840,en
SOFNewsUpdate,2017-06-10 20:04,5,4,us forces are providing some technical assistance to the philippines in the fight to end a siege of marawi,,,,873511243872653312,https://twitter.com/SOFNewsUpdate/status/873511243872653312,en
LourdesEscaros,2017-06-10 20:04,0,0,police convoy from marawi was ambushed in baloi,,,,873511114637574144,https://twitter.com/LourdesEscaros/status/873511114637574144,en
Qatar_Update,2017-06-10 20:04,0,0,marawi citys strategic importance comes to fore news,"(['Qatar'], Location((25.22803095, 55.1733279309, 0.0)))",,#,873511106781880320,https://twitter.com/Qatar_Update/status/873511106781880320,en
JDRedding,2017-06-10 20:03,0,0,rt myradiointl marawi siege us special forces aiding philippine army  bbc news cspanwj,"(['Central Plains'], Location((-18.1012935, 178.4585901, 0.0)))",@ @,,873511019758456832,https://twitter.com/JDRedding/status/873511019758456832,en
bdsaguing,2017-06-10 20:03,0,0,inquirerdotnet afp confirms presence of us forces in marawi but participation limited,"(['Rome', ' Italy'], Location((34.257038, -85.1646726, 0.0)))",@,,873510886140506112,https://twitter.com/bdsaguing/status/873510886140506112,en
JCIDuwaling,2017-06-10 20:03,0,1,wear your support for marawi  these shirts are available for preorders interested please send us a,,,,873510816888258561,https://twitter.com/JCIDuwaling/status/873510816888258561,en
Ivan226622,2017-06-10 20:01,0,0,flash chr urges govt to stop airstrikes in marawi the commission on human rights chr,,,,873510304197619715,https://twitter.com/Ivan226622/status/873510304197619715,en
newsclose2home,2017-06-10 20:00,0,0,breaking marawi siege china special forces aiding philippine army,,,,873510283284803584,https://twitter.com/newsclose2home/status/873510283284803584,en
rupieroop,2017-06-10 20:00,0,0,bbc news  marawi siege us special forces aiding philippine army  engage and eliminatenot exchange and endear,,,,873510207225253889,https://twitter.com/rupieroop/status/873510207225253889,en
gmanews,2017-06-10 20:00,13,12,pnparmm rpsb chief says police convoy from marawi was ambushed near border of pantar and baloi towns in lanao de norte  cedriccastillohttps,"(['Philippines'], Location((12.7503486, 122.7312101, 0.0)))",@,,873510207082582019,https://twitter.com/gmanews/status/873510207082582019,en
aizanglaagan,2017-06-10 20:00,0,0,i pray that tonight everyone in marawi can sleep in peacefulness,"(['Guyangan'], Location((-6.8756703, 111.1338156, 0.0)))",,,873510185033015296,https://twitter.com/aizanglaagan/status/873510185033015296,en
cnnphilippines,2017-06-10 20:00,6,7,maute sniper kills boy in marawi,,,,873510063742308352,https://twitter.com/cnnphilippines/status/873510063742308352,en
cedric_castillo,2017-06-10 19:59,4,2,chief of pnparmm rpsb says 5vehicle police convoy from marawi was ambushed near border of pantar and baloi towns in lanao de norte,,,,873509808636284930,https://twitter.com/cedric_castillo/status/873509808636284930,en
bdsaguing,2017-06-10 19:56,0,0,retweeted teddy casio  teddycasino we extend our solidarity to the victims of the marawi siege we condemn,"(['Rome', ' Italy'], Location((34.257038, -85.1646726, 0.0)))",@,,873509193201975296,https://twitter.com/bdsaguing/status/873509193201975296,en
bibmacasaet,2017-06-10 19:55,1,20,you put the milf and commies in marawi  you get dead soldiers sira ulo talaga si duterte,,,,873508870672465920,https://twitter.com/bibmacasaet/status/873508870672465920,en
BlogBurgerBlog,2017-06-10 19:55,0,0,american forces join philippine troops to end marawi siege ,"(['London'], Location((51.5073219, -0.1276474, 0.0)))",,,873508870081191936,https://twitter.com/BlogBurgerBlog/status/873508870081191936,en
RaymundDadpaas,2017-06-10 19:54,0,0,comm  i saw two p3 orion hovering over marawi city for how many days already ,,,,873508712421269504,https://twitter.com/RaymundDadpaas/status/873508712421269504,en
PHTopNews,2017-06-10 19:54,0,0,chr urges govt to stop airstrikes in marawi  8,,,,873508636303249408,https://twitter.com/PHTopNews/status/873508636303249408,en
bdsaguing,2017-06-10 19:54,0,0,retweeted salinlahi  salinlahiphils we extend our solidarity to the victims of the marawi siege we condemn,"(['Rome', ' Italy'], Location((34.257038, -85.1646726, 0.0)))",@,,873508634495504389,https://twitter.com/bdsaguing/status/873508634495504389,en
bizzyboneee,2017-06-10 19:53,0,0,us confirms it is assisting philippine army in besieged marawi where fighting broke out,,,,873508368757006341,https://twitter.com/bizzyboneee/status/873508368757006341,en
ranaalikash,2017-06-10 19:51,0,0,highlights 1 us joins battle as philippines takes losses in besieged marawi city 2 us forces giving technical,"(['World'], Location((32.8548259, -117.2041575, 0.0)))",,,873507877167738884,https://twitter.com/ranaalikash/status/873507877167738884,en
Insight4News4,2017-06-10 19:51,1,1,us forces assist philippines in battle over city siege marawi,,,#,873507874374381568,https://twitter.com/Insight4News4/status/873507874374381568,en
MattRaider5,2017-06-10 19:50,0,0,i salute our soldiers in marawi kindly use drone before entering enemy territory analyze the imagesuse mortar to neutralize any hindrance,"(['Republic of the Philippines'], Location((12.7503486, 122.7312101, 0.0)))",,,873507710083317761,https://twitter.com/MattRaider5/status/873507710083317761,en
Paul_Intel,2017-06-10 19:50,0,0,us special forces aiding philippine army to retake marawi from isislinked forces,"(['United Kingdom'], Location((25.2232283, 55.1594933009, 0.0)))",,# #pt0,873507664315265024,https://twitter.com/Paul_Intel/status/873507664315265024,en
Sigaw_Ko,2017-06-10 19:49,0,0,tabang marawi youth leaders donationdrive,"(['Mandaluyong City'], Location((14.5774598, 121.0334694, 0.0)))",,,873507533075382272,https://twitter.com/Sigaw_Ko/status/873507533075382272,en
mariaressa,2017-06-10 19:48,3,9,duterte to marawi exmayor clear your name or ill have you killed via rapplerdotcomhttp,"(['Philippines'], Location((12.7503486, 122.7312101, 0.0)))",@,,873507220532625410,https://twitter.com/mariaressa/status/873507220532625410,en
DungBAPham,2017-06-10 19:48,0,0,us special forces aiding philippine army in marawi via youtube,,@,,873507194876162048,https://twitter.com/DungBAPham/status/873507194876162048,en
LawrenceMachado,2017-06-10 19:48,0,0,13 more philippine marines dead us forces join fight as marawi city siege continues via abcnews,"(['Castle Hill', ' NSW', ' Australia'], Location((-33.7315318, 151.0071718, 0.0)))",@,,873507154300239872,https://twitter.com/LawrenceMachado/status/873507154300239872,en
dayuduan,2017-06-10 19:47,0,0,lawyers to duterte stop martial law abuses in marawi via rapplerdotcomhttp,,@,,873506807620042752,https://twitter.com/dayuduan/status/873506807620042752,en
reccadear,2017-06-10 19:47,1,15,then go to marawi and help the people there having a vacation doesnt mean she doesnt care about the plight of other people,"(['Las Pinas City'], Location((-1.0917672, -80.8977939, 0.0)))",,,873506807511109632,https://twitter.com/reccadear/status/873506807511109632,en
Trendsiana,2017-06-10 19:46,0,0,isis claims to disabling of 1 philippine army armored vehicle with rocketpropelled grenade yesterday in marawi,"(['Worldwide'], Location((53.4573434, -2.22698994022, 0.0)))",,# #,873506730491101184,https://twitter.com/Trendsiana/status/873506730491101184,en
didaherself,2017-06-10 19:45,0,0,why are these barbarisms committed by the govt not reported at all pray for marawi,"(['K\xc3\xb8benhavn'], Location((55.6867243, 12.5700724, 0.0)))",,#,873506442803765249,https://twitter.com/didaherself/status/873506442803765249,en
AkhBen,2017-06-10 19:45,0,0,yes war torn marawi city ill come back again inshaallah marawicity marawi,"(['Cotabato City', ' Soccsksargen'], Location((7.1970344, 124.2351714, 0.0)))",,# #,873506410885140481,https://twitter.com/AkhBen/status/873506410885140481,en
MyFreedomNews,2017-06-10 19:44,1,0,isis vs phillipine army in marawi city,"(['United Kingdom'], Location((25.2232283, 55.1594933009, 0.0)))",,,873506065744142337,https://twitter.com/MyFreedomNews/status/873506065744142337,en
piperlois,2017-06-10 19:41,0,0,wow 143redangel was in marawi she got that close maa sha allah therealangellocsins photo,,@,,873505481943261185,https://twitter.com/piperlois/status/873505481943261185,en
yusufledesma,2017-06-10 19:41,0,0,inquirerdotnet chr urges govt to stop airstrikes in marawi,"(['Manila'], Location((14.5906216, 120.9799696, 0.0)))",@,,8.73505E+17,https://twitter.com/yusufledesma/status/873505464474112000,en
robotbum,2017-06-10 19:41,0,0,13 philippines marines killed in mauteheld marawi city via englishalwaght,"(['At home'], Location((35.4588343, -97.6218320998, 0.0)))",@,,873505338196017159,https://twitter.com/robotbum/status/873505338196017159,en
Haysmart,2017-06-10 19:40,0,0,13 marines killed as fighting rages in marawi city c,"(['Next Bus stop'], Location((51.6314179, -0.7562189, 0.0)))",,,873505108688084996,https://twitter.com/Haysmart/status/873505108688084996,en
1freetruth,2017-06-10 19:39,0,0,13 marines killed as fighting rages in marawi city occupy ows occupywallstreet occupyhq occupyinfo owsinfo ,,,# # # # # # #,873504813777944576,https://twitter.com/1freetruth/status/873504813777944576,en
theglobalworld,2017-06-10 19:36,0,0,13 marines killed as fighting rages in marawi city us confirms it is assisting news,"(['Universe'], Location((55.85881005, -4.00208685913, 0.0)))",,#,873504135605256193,https://twitter.com/theglobalworld/status/873504135605256193,en
burongmangga,2017-06-10 19:35,0,0,marawi casualtyhttps,,,# #,873503880583159808,https://twitter.com/burongmangga/status/873503880583159808,en
WIONews,2017-06-10 19:35,0,5,us aids philippines to flush out islamist fighters from marawi,"(['South Asia'], Location((-32.1759338, -61.7189621, 0.0)))",,,873503874115620865,https://twitter.com/WIONews/status/873503874115620865,en
Owais04642093,2017-06-10 19:34,0,0,us forces join philippine troops to end marawi city siege  abc news,"(['sydney'], Location((-33.8548157, 151.2164539, 0.0)))",,,873503741164388352,https://twitter.com/Owais04642093/status/873503741164388352,en
NarrendraM,2017-06-10 19:34,0,0,rt w7voa philippines military says us forces providing technical assistance to end siege of marawi,"(['Mumbai', ' India'], Location((19.1334321, 72.8882172, 0.0)))",,#,873503571098165248,https://twitter.com/NarrendraM/status/873503571098165248,en
carol_sundahl,2017-06-10 19:34,0,0,they are not fighting they are just providing technical support military spokesman told a news conference in marawi city groan,"(['Seattle', ' WA'], Location((47.6038321, -122.3300624, 0.0)))",,,873503559198720001,https://twitter.com/carol_sundahl/status/873503559198720001,en
rnfrancisfranc1,2017-06-10 19:33,0,0,bbc news  marawi siege us special forces aiding philippine army  bravo to duterte and us military,"(['Chester', ' UK'], Location((53.1908873, -2.8908955, 0.0)))",,,873503382102839297,https://twitter.com/rnfrancisfranc1/status/873503382102839297,en
imax111,2017-06-10 19:31,0,0,13 marines killed as fighting rages in marawi city,"(['everywhere'], Location((41.7776533, -72.6740756, 0.0)))",,,873502968477364224,https://twitter.com/imax111/status/873502968477364224,en
debbiecataluna,2017-06-10 19:31,0,5,its ever heart warming to fly a kite and pray for the marawi victims at the kind of situation our nation is facing,,,,873502855612612609,https://twitter.com/debbiecataluna/status/873502855612612609,en
PinoyTeleserye1,2017-06-10 19:30,0,0,watch 13 govt troops killed 51 injured in latest marawi offensive  sources,,,,873502740558692352,https://twitter.com/PinoyTeleserye1/status/873502740558692352,en
PHTopNews,2017-06-10 19:30,0,0,chr urges govt to stop airstrikes in marawi ,,,,873502589949812737,https://twitter.com/PHTopNews/status/873502589949812737,en
HemantKothari77,2017-06-10 19:28,2,2,13 philippines marines killed in isisheld marawi city philippines marawi maute shivraj4peace zairawasim radhamohansingh,"(['worldwide !'], Location((53.4573434, -2.22698994022, 0.0)))",,# # # # # # #,873502227498926081,https://twitter.com/HemantKothari77/status/873502227498926081,en
tropzjham,2017-06-10 19:28,1,0,pray for marawi sabatwo marvoree,"(['BORACAY ISLAND'], Location((11.9693431, 121.922688541, 0.0)))",,,873502144745230336,https://twitter.com/tropzjham/status/873502144745230336,en
sheikhjalala,2017-06-10 19:28,0,0,13 philippines marines killed in isisheld marawi city 00 philippines marawi maute marines ,"(['kigogo', ' Dar es salaam'], Location((-2.5677194, 30.5058836, 0.0)))",,# # # #,873502099098791936,https://twitter.com/sheikhjalala/status/873502099098791936,en
dmitryzaksAFP,2017-06-10 19:27,4,0,little noticed us forces back philippine troops in streettostreet gunbattles in islamist held marawi  afp,"(['Kiev and Moscow'], Location((55.7431194, 37.5654146728, 0.0)))",@,,873501959814348800,https://twitter.com/dmitryzaksAFP/status/873501959814348800,en
benavu54,2017-06-10 19:27,0,0,us forces join philippine troops to end marawi city siege  via abcnews,"(['Australia'], Location((-24.7761086, 134.755, 0.0)))",@,,873501800946585600,https://twitter.com/benavu54/status/873501800946585600,en
collinskadiri,2017-06-10 19:26,0,0,islamists kill 13 philippine marines in wartorn marawi city thirteen philippine marines,"(['Canada'], Location((61.0666922, -107.9917071, 0.0)))",,,873501744906604544,https://twitter.com/collinskadiri/status/873501744906604544,en
storyahiko,2017-06-10 19:26,1,1,film  television actress angel locsin visited the marawi evacuees in baloi  lanao del sur,"(['Manila City'], Location((14.5906216, 120.9799696, 0.0)))",,,873501660085075968,https://twitter.com/storyahiko/status/873501660085075968,en
EnglishAlwaght,2017-06-10 19:25,9,7,13 philippines marines killed in isisheld marawi city 00 philippines marawi maute,,,# # # #,873501437451542528,https://twitter.com/EnglishAlwaght/status/873501437451542528,en
4LifeTFCebu,2017-06-10 19:25,0,0,marawi war machines seen cruising the national highway along nsc iligan en route to the battle zone not too,,,,873501365829611520,https://twitter.com/4LifeTFCebu/status/873501365829611520,en
pangerankoeboe,2017-06-10 19:25,0,0,bayot real hero marawi pinoy duterte indonesia tniau,,@,# # # #,873501265308798980,https://twitter.com/pangerankoeboe/status/873501265308798980,en
P_Sng,2017-06-10 19:23,0,0,updates on uk after the elections fighting in marawi and myanmars,,,,873500977508171776,https://twitter.com/P_Sng/status/873500977508171776,en
pakhead,2017-06-10 19:23,4,1,duterte retracts earlier call for milf and npa fighters to help in battle for marawi seems he doesnt trust them,"(['Bangkok'], Location((-7.846423, 112.1005469, 0.0)))",,,873500921468039168,https://twitter.com/pakhead/status/873500921468039168,en
Orbitus,2017-06-10 19:23,0,0,marawi siege us special forces aiding philippines via bbcnews counterterrorismhttp,"(['Washington', ' DC | Honolulu', ' HI'], Location((38.8949549, -77.0366456, 0.0)))",@,# # # #,873500905768923139,https://twitter.com/Orbitus/status/873500905768923139,en
