AntifaBranson,2017-06-10 13:05,0,1,matriarch and patriarch of the isis aligned maute clan that attacked marawi have been caught not much left but abu sayeff,,,,873405758146301952,https://twitter.com/AntifaBranson/status/873405758146301952,en
JohnLester,2017-06-10 13:04,0,0,day 19 of marawi siege,,,,873405411180851204,https://twitter.com/JohnLester/status/873405411180851204,en
miamin_tan,2017-06-10 13:03,0,1,yes it is im in luzon but the siege in marawi was v scary i couldnt sleep well on the night that it started,"(['SEA'], Location((47.4475673, -122.308015857, 0.0)))",,,873405339755880448,https://twitter.com/miamin_tan/status/873405339755880448,en
alders_ledge,2017-06-10 13:02,0,0,red cross fears disease outbreak in marawi city philippines marawiupdateshttp,,,# # #,873404878000766980,https://twitter.com/alders_ledge/status/873404878000766980,en
TheFreemanNews,2017-06-10 13:00,0,0,top story dswd7 sends more goods for marawi evacuees,"(['Cebu', ' Philippines'], Location((10.45, 123.84, 0.0)))",,,873404508742623232,https://twitter.com/TheFreemanNews/status/873404508742623232,en
manilabulletin,2017-06-10 13:00,3,4,abella bangon marawi will be a multiagency effort including dti deped dswd dpwh doe dict among others  via argyllcyrusmb,"(['Manila', ' Philippines'], Location((14.5906216, 120.9799696, 0.0)))",@,,873404465633566724,https://twitter.com/manilabulletin/status/873404465633566724,en
argyllcyrus_MB,2017-06-10 13:00,0,1,abella bangon marawi will be a multiagency effort including dti deped dswd dpwh doe dict among others,"(['Manila City'], Location((14.5906216, 120.9799696, 0.0)))",,,873404375875502080,https://twitter.com/argyllcyrus_MB/status/873404375875502080,en
azir_sangri88,2017-06-10 12:59,0,1,pray for marawi pctto mayward tenthmonthsaryna,"(['Republic of the Philippines'], Location((12.7503486, 122.7312101, 0.0)))",,,873404313552404480,https://twitter.com/azir_sangri88/status/873404313552404480,en
manilabulletin,2017-06-10 12:58,4,8,abella eo for the p10billion recovery reconstruction rehabilitation program for marawi now awaiting prrds signature  argyllcyrusmb,"(['Manila', ' Philippines'], Location((14.5906216, 120.9799696, 0.0)))",@,,873404040813592576,https://twitter.com/manilabulletin/status/873404040813592576,en
alders_ledge,2017-06-10 12:58,1,0,how to help the children of marawi philippines marawiupdates onewithmarawihttp,,,# # # #,873404004838985728,https://twitter.com/alders_ledge/status/873404004838985728,en
betseyklark,2017-06-10 12:58,1,2,grr politicians should sacrifice at least 1 month of their salaries  give them to soldiers  their families who are fighting in marawi,,,,873403955543277569,https://twitter.com/betseyklark/status/873403955543277569,en
argyllcyrus_MB,2017-06-10 12:58,0,1,abella eo for the p10billion recovery reconstruction rehabilitation program for marawi now awaiting prrds signature manilabulletin,"(['Manila City'], Location((14.5906216, 120.9799696, 0.0)))",@,,873403919635894272,https://twitter.com/argyllcyrus_MB/status/873403919635894272,en
PinoyTambayanKo,2017-06-10 12:55,0,0,antiillegal recruitment team to be sent to marawi city,"(['Bulacan'], Location((14.794871, 120.8777119, 0.0)))",,,873403236652285952,https://twitter.com/PinoyTambayanKo/status/873403236652285952,en
PHHotTrends,2017-06-10 12:54,0,0,afp eyes independence day liberation for marawi marawiupdates,"(['Manila City'], Location((14.5906216, 120.9799696, 0.0)))",,#,873402942103187456,https://twitter.com/PHHotTrends/status/873402942103187456,en
JHowardDP,2017-06-10 12:53,0,2,may those who lost their lives will not go in vain and their memories will never fade pray for marawi,"(['Earth \xc2\xa0\xf0\x9f\x8c\x8f'], Location((34.2331373, -102.4107493, 0.0)))",,#,873402767309590529,https://twitter.com/JHowardDP/status/873402767309590529,en
SunStarBacolod,2017-06-10 12:51,0,1,help nongovernment organization negros volunteers for change sends mingo meals to 39159 kids to marawi city,,,,873402228186501120,https://twitter.com/SunStarBacolod/status/873402228186501120,en
AiloTimeLow,2017-06-10 12:50,0,0,youre too busy opposing the ml and figuring out what the mautes are doing to even care about the people of marawi smh,"(['Philippines'], Location((12.7503486, 122.7312101, 0.0)))",,,873401905640202240,https://twitter.com/AiloTimeLow/status/873401905640202240,en
jervismanahan,2017-06-10 12:48,0,0,sources 13 soldiers killed in action 40 wounded in an intense firefight in marawi city ptvph,"(['Manila', ' Philippines'], Location((14.5906216, 120.9799696, 0.0)))",@,,873401410267734017,https://twitter.com/jervismanahan/status/873401410267734017,en
novakmartin,2017-06-10 12:47,2,3,us special forces assisting philippine troops to end siege of marawi city by islamic stateallied fighters  us embassy,"(['Prague', ' Czech Republic'], Location((35.4867369, -96.6850174, 0.0)))",,,873401091026812929,https://twitter.com/novakmartin/status/873401091026812929,en
SarahLeeBLoom,2017-06-10 12:43,0,1,look angel locsin spotted in marawi personally helping the filipinos affected by ongoing marawi crisis,"(['EARTH'], Location((34.2331373, -102.4107493, 0.0)))",,,873400187753873409,https://twitter.com/SarahLeeBLoom/status/873400187753873409,en
buboyperalta,2017-06-10 12:39,0,1,im so proud of 143redangel the real darna bangon marawi,"(['Philippines'], Location((12.7503486, 122.7312101, 0.0)))",@,# #,873399215904313345,https://twitter.com/buboyperalta/status/873399215904313345,en
KaiDarul,2017-06-10 12:35,0,4,ma sha allah generous people everywhere you may still donate at marawicity onewithmarawi marawi marawiclash,"(['Tawi-Tawi', ' Ph'], Location((5.2057, 120.0265, 0.0)))",,# # # #,873398285913833472,https://twitter.com/KaiDarul/status/873398285913833472,en
pctechph,2017-06-10 12:35,0,0,a 14yearold boy named abdillah was fervently praying inside a mosque together with other residents in marawi 9,,,,873398242112929792,https://twitter.com/pctechph/status/873398242112929792,en
allforjuannews,2017-06-10 12:33,0,0,a 14yearold boy named abdillah was fervently praying inside a mosque together with other residents in marawi,"(['Republic of the Philippines'], Location((12.7503486, 122.7312101, 0.0)))",,,873397763706421249,https://twitter.com/allforjuannews/status/873397763706421249,en
SilentNoMorePH,2017-06-10 12:31,1,1,dear fellow filipinos factcheck aguirre used old photo to tag lawmakers in marawi crisis aguirre tried to,"(['Republic of the Philippines'], Location((12.7503486, 122.7312101, 0.0)))",,,873397256313069568,https://twitter.com/SilentNoMorePH/status/873397256313069568,en
iraqsunnews,2017-06-10 12:31,0,0,philippines forces claim islamist fighters suffer great loss in besieged marawi city,"(['Baghdad', ' Iraq'], Location((2.1565307, 42.1630707, 0.0)))",,,873397251011473408,https://twitter.com/iraqsunnews/status/873397251011473408,en
maxangelo987,2017-06-10 12:31,0,0,marine commandant majgen salamat confirms 13kia and 40wia from marine units in yesterdays fighting in marawi city pray for marawip,,,#http,873397206694416384,https://twitter.com/maxangelo987/status/873397206694416384,en
LanOfTheFirefly,2017-06-10 12:30,0,3,engaged my mom in a discussion with marawi happenings lerd wala pa akong allowance huhuhu,"(['Philippines'], Location((12.7503486, 122.7312101, 0.0)))",,,873396994944794624,https://twitter.com/LanOfTheFirefly/status/873396994944794624,en
markanthony0099,2017-06-10 12:28,2,4,angel locsin visited the evacuees in iligan city after the marawi terror attacks 1,"(['1st street mandaluyong city'], Location((14.5801836, 121.0201355, 0.0)))",,,873396537652596737,https://twitter.com/markanthony0099/status/873396537652596737,en
GoyYLarrazabal,2017-06-10 12:25,13,33,i hope the independence day deadline to retake marawi is not forcing some to take risks our brave soldiers lives are very important,"(['Philippines'], Location((12.7503486, 122.7312101, 0.0)))",,,873395602620424192,https://twitter.com/GoyYLarrazabal/status/873395602620424192,en
SunStarDavao,2017-06-10 12:24,0,0,sunstareditorial in offering help to fight the terrorists in marawi city the moro islamic liberation front dudcd,"(['Davao City', ' Davao Region'], Location((7.22650725, 125.454887691, 0.0)))",,#,873395296558100480,https://twitter.com/SunStarDavao/status/873395296558100480,en
jun_veneracion,2017-06-10 12:22,23,33,marine commandant majgen salamat confirms 13kia and 40wia from marine units in yesterdays fighting in marawi city pray for marawi d,"(['Philippines'], Location((12.7503486, 122.7312101, 0.0)))",,#,873394948682403841,https://twitter.com/jun_veneracion/status/873394948682403841,en
maxangelo987,2017-06-10 12:21,0,0,14yrold boy killed by stray bullet while praying inside marawi mosque gmanews,,,#,873394626803191813,https://twitter.com/maxangelo987/status/873394626803191813,en
apocalypto100,2017-06-10 12:21,0,0,salute to our fighting soldiers and policemen in marawi city may god be with all of you bravery loveforflagandcountry ultimatesacrifice,,,# # #,873394559585091588,https://twitter.com/apocalypto100/status/873394559585091588,en
EngdahlFW,2017-06-10 12:19,3,1,the cias cloddish isis attack on duterte politics geopolitics marawi c,,,# # # # # # #,873394141769719809,https://twitter.com/EngdahlFW/status/873394141769719809,en
MeLLanJolly,2017-06-10 12:17,0,0,sc shld the marawi siege escalate bec of ur incompetence would you take the blame for it,"(['Republic of the Philippines'], Location((12.7503486, 122.7312101, 0.0)))",,,873393687270539265,https://twitter.com/MeLLanJolly/status/873393687270539265,en
ArjayAbrea,2017-06-10 12:15,0,0,day 19 of marawi crisis on balitanghali weekend with cedriccastillo reporting live from marawi city,,@,,873393276031614976,https://twitter.com/ArjayAbrea/status/873393276031614976,en
zyiteblog,2017-06-10 12:15,0,0,student killed by stray bullet in marawi,,,,873393164324929537,https://twitter.com/zyiteblog/status/873393164324929537,en
Partyalcoholics,2017-06-10 12:14,0,0,marawi defendtheland,"(['Manila City', ' National Capital'], Location((14.5906216, 120.9799696, 0.0)))",,#,873393012302168064,https://twitter.com/Partyalcoholics/status/873393012302168064,en
MCNM_Marketing,2017-06-10 12:14,0,0,marawi looters arrested,"(['Las Vegas'], Location((36.1662859, -115.149225, 0.0)))",,,873392987883089922,https://twitter.com/MCNM_Marketing/status/873392987883089922,en
ivan2266,2017-06-10 12:13,0,0,military eyes june 12 freedom for marawi  cnn philippines cnnphilippines june 10 2017,"(['Earth'], Location((34.2331373, -102.4107493, 0.0)))",,,873392676351225856,https://twitter.com/ivan2266/status/873392676351225856,en
Noria_lundayao,2017-06-10 12:13,0,0,thank you miss angel to help marawi allah blees us all,,,,873392674585272320,https://twitter.com/Noria_lundayao/status/873392674585272320,en
sabangon,2017-06-10 12:10,0,0,in warshaken city civilians struggle to escape marawi 0,,,,873391935318138880,https://twitter.com/sabangon/status/873391935318138880,en
negrosdaily,2017-06-10 12:10,0,0,june 10 negros daily bulletin ndb newsinfo  1 marawi evacuees arrived in bacolod close monitoring d,"(['Bacolod City', ' Philippines'], Location((10.6762836, 122.9513786, 0.0)))",,,873391852560551936,https://twitter.com/negrosdaily/status/873391852560551936,en
cnnphilippines,2017-06-10 12:10,9,17,military eyes june 12 freedom for marawi,,,,873391799338844160,https://twitter.com/cnnphilippines/status/873391799338844160,en
sweeeetbravery,2017-06-10 12:10,0,1,most people probably became desensitized by whats happening in marawi already i hardly see updates in my newsfeed,,,,873391782528036864,https://twitter.com/sweeeetbravery/status/873391782528036864,en
alders_ledge,2017-06-10 12:09,0,0,15yo abdillah masid was observing ramadan in a marawi mosque when he was shot and killed ,,,# #,873391766073782273,https://twitter.com/alders_ledge/status/873391766073782273,en
Noria_lundayao,2017-06-10 12:09,0,0,help marawi city miss ann miss angel already come up there ,,,,873391718162354176,https://twitter.com/Noria_lundayao/status/873391718162354176,en
jervismanahan,2017-06-10 12:09,0,0,its an eerily quiet saturday here in marawi city ucu,"(['Manila', ' Philippines'], Location((14.5906216, 120.9799696, 0.0)))",@,,873391708381171712,https://twitter.com/jervismanahan/status/873391708381171712,en
LilyT32,2017-06-10 12:08,0,0,philippines govt assures enough funds available to sustain needs of marawi idps humanitarian newzealand,"(['New Zealand'], Location((-41.5000831, 172.8344077, 0.0)))",,# # #,873391397042356224,https://twitter.com/LilyT32/status/873391397042356224,en
rickrick888,2017-06-10 12:07,0,0,developing story authorities arrest mother of maute brothers davidyusantos reports from marawi city ,,,,873391118486056960,https://twitter.com/rickrick888/status/873391118486056960,en
marizumali,2017-06-10 12:06,1,52,stay safe mahal praying for you and the entire marawi,"(['Manila', ' Philippines'], Location((14.5906216, 120.9799696, 0.0)))",,,873390879830007808,https://twitter.com/marizumali/status/873390879830007808,en
alders_ledge,2017-06-10 12:05,1,1,four female residents of marawi ask the supreme court to nullify martial law in mindanao philippineshttp,,,# # #,873390586639679488,https://twitter.com/alders_ledge/status/873390586639679488,en
alders_ledge,2017-06-10 12:03,1,1,as marawi crisis drags on risks to the health of displaced peoples mount philippines marawiupdateshttp,,,# # #,873390074368372741,https://twitter.com/alders_ledge/status/873390074368372741,en
cnnphilippines,2017-06-10 12:03,3,9,developing story authorities arrest mother of maute brothers davidyusantos reports from marawi city,,@,,873390036523245568,https://twitter.com/cnnphilippines/status/873390036523245568,en
SalmanRanaw,2017-06-10 12:02,0,0,signing off  in respect to the authorities amid martial law my coverage of the war will cease starting today pray for marawi,"(['Marawi City'], Location((8.0034938, 124.286626, 0.0)))",,#,873389910626934784,https://twitter.com/SalmanRanaw/status/873389910626934784,en
poemcrap,2017-06-10 12:01,0,0,trendthis an amazing cause to raise donations for the people affected in marawi by the youth in butuan  all proceeds and goods,,,#,873389674810662912,https://twitter.com/poemcrap/status/873389674810662912,en
TempoPHL,2017-06-10 12:00,0,0,civilians struggle to escapemarawi,"(['Intramuros', ' Philippines'], Location((14.5905862, 120.97533, 0.0)))",,,873389491074998272,https://twitter.com/TempoPHL/status/873389491074998272,en
LilyT32,2017-06-10 11:58,0,0,philippines pdrrmo sends empty gallons 300k worth of goods to marawi idps humanitarian newzealand 0,"(['New Zealand'], Location((-41.5000831, 172.8344077, 0.0)))",,# # #,873388853549301760,https://twitter.com/LilyT32/status/873388853549301760,en
ChannixC,2017-06-10 11:57,0,1,13 ph marines down marawi clash,"(['Cagayan De Oro City', ' Northern'], Location((8.42980265, 124.682410212, 0.0)))",,,873388557708042240,https://twitter.com/ChannixC/status/873388557708042240,en
chiarazambrano,2017-06-10 11:56,5,65,back when our biggest hazards were of the natural kind kitakits sa maynila nababaha tell everyone there to keep an eye out for marawi,"(['Pilipinas'], Location((12.7503486, 122.7312101, 0.0)))",@,,873388370704998400,https://twitter.com/chiarazambrano/status/873388370704998400,en
PhilippinePolRR,2017-06-10 11:55,0,0,crisis committee expecting to retrieve a lot of bodies in marawi war zone,,,,873388049752838144,https://twitter.com/PhilippinePolRR/status/873388049752838144,en
Politiko_Ph,2017-06-10 11:52,4,8, dswdserves to give onetime cash grant to marawi evacuees marawiclash,,@,#,873387294643765248,https://twitter.com/Politiko_Ph/status/873387294643765248,en
PTVisMin,2017-06-10 11:51,0,0,armm governor mujiv hataman is confident marawi will be free by independence day  via,,@,,873387241246253056,https://twitter.com/PTVisMin/status/873387241246253056,en
Leimonty,2017-06-10 11:51,0,0,hontiveros trying to be funny listen to her reason regarding marawi yo soo annoying,,,,873387219951550465,https://twitter.com/Leimonty/status/873387219951550465,en
PhilippineStar,2017-06-10 11:50,1,0,student killed by stray bullet in marawi,"(['Philippines'], Location((12.7503486, 122.7312101, 0.0)))",,,873386982788878338,https://twitter.com/PhilippineStar/status/873386982788878338,en
PTVisMin,2017-06-10 11:50,0,0,news  rep bertiz human traffickers may victimize displaced marawi residents,,,,8.73387E+17,https://twitter.com/PTVisMin/status/873386872319488000,en
PTVisMin,2017-06-10 11:50,0,0,news military continues clearing operations in marawi city,,,,873386757928124416,https://twitter.com/PTVisMin/status/873386757928124416,en
PisayCVCUpdates,2017-06-10 11:50,0,1,look pshscentral mindanao schedules clearance signing enrollment to finally cap off ay 20162017 sched was delayed due to marawi crisis,"(['Bayombong', ' Nueva Vizcaya'], Location((16.4841392, 121.1439344, 0.0)))",,,873386753813393408,https://twitter.com/PisayCVCUpdates/status/873386753813393408,en
PTVisMin,2017-06-10 11:49,0,0,news 6 looters arrested in marawi city,,,,873386688512446464,https://twitter.com/PTVisMin/status/873386688512446464,en
PTVisMin,2017-06-10 11:49,0,0,news afp doing everything to avert another marawi incident  military official,,,,873386579406016513,https://twitter.com/PTVisMin/status/873386579406016513,en
PTVisMin,2017-06-10 11:49,0,0,news marawi evacuees continue to receive relief aid,,,,873386509180837890,https://twitter.com/PTVisMin/status/873386509180837890,en
PTVisMin,2017-06-10 11:48,0,0,news afp still verifying reports of hapilons escape from marawi city,,,,873386444454322176,https://twitter.com/PTVisMin/status/873386444454322176,en
LilyT32,2017-06-10 11:48,0,0,philippines lanao del norte opens more evacuation centers for marawi idps humanitarian newzealand,"(['New Zealand'], Location((-41.5000831, 172.8344077, 0.0)))",,# # #,873386434400579588,https://twitter.com/LilyT32/status/873386434400579588,en
PTVisMin,2017-06-10 11:48,0,0,news afp eyes raising phl flag in entire marawi city on june 12,,,,873386280196988928,https://twitter.com/PTVisMin/status/873386280196988928,en
jervismanahan,2017-06-10 11:47,1,0,armm governor mujiv hataman is confident marawi will be free by independence day,"(['Manila', ' Philippines'], Location((14.5906216, 120.9799696, 0.0)))",@,,873386120259579904,https://twitter.com/jervismanahan/status/873386120259579904,en
hecallsmeathena,2017-06-10 11:47,0,1,this war at marawi philippines is senseless civilians are affected innocent children are killed what is maute trying to prove,"(['Dubai', ' United Arab Emirates'], Location((2.9470179, 30.961206, 0.0)))",,,873386105290330112,https://twitter.com/hecallsmeathena/status/873386105290330112,en
adharves,2017-06-10 11:47,5,5,marawi siege breathing new life into islamic extremists in se asia  from hodgeamandahttps,"(['Jakarta'], Location((-6.1753942, 106.827183, 0.0)))",@,,873386076160667649,https://twitter.com/adharves/status/873386076160667649,en
mizahael,2017-06-10 11:46,0,0,how many more innocent lives do we have to sacrifice before we all open our eyes to the gravity of the things happening in marawi,"(['Manila', ' Philippines'], Location((14.5906216, 120.9799696, 0.0)))",,,873385947857002497,https://twitter.com/mizahael/status/873385947857002497,en
AngeleSamura,2017-06-10 11:42,3,2,she was traveling with some serious amo marawi,"(['Netherlands'], Location((52.2379891, 5.53460738162, 0.0)))",,#,873384856218083329,https://twitter.com/AngeleSamura/status/873384856218083329,en
jamelaaisha,2017-06-10 11:41,6,18,donations keep coming still no matter how dire the situation may seem never never give in to despair marawi,"(['Manila'], Location((14.5906216, 120.9799696, 0.0)))",,#,873384496627830784,https://twitter.com/jamelaaisha/status/873384496627830784,en
KatherineImson,2017-06-10 11:40,3,0,13 marines died during yesterdays intense firefight bet military troops and militants here in marawi,,@,,873384460829335552,https://twitter.com/KatherineImson/status/873384460829335552,en
RitaBaua,2017-06-10 11:40,1,1,du30 no npa mnlf to fight alongside afp in marawi coz they might shoot each other ndfp npa will not join afp will only block  mop up,"(['Quezon City', ' National Capital Region'], Location((14.6509905, 121.0486155, 0.0)))",,,873384385545777154,https://twitter.com/RitaBaua/status/873384385545777154,en
jamelaaisha,2017-06-10 11:40,3,24,we have already received at least 2 tons of aid to marawi from people we know and even from random strangers,"(['Manila'], Location((14.5906216, 120.9799696, 0.0)))",,#,873384373663301633,https://twitter.com/jamelaaisha/status/873384373663301633,en
AkhBen,2017-06-10 11:40,0,0,saguiaran the first town outside marawi leading to iligan caters to thousands of evacuees and market is business as usual marawiclash,"(['Cotabato City', ' Soccsksargen'], Location((7.1970344, 124.2351714, 0.0)))",,#,873384290347700231,https://twitter.com/AkhBen/status/873384290347700231,en
AngeleSamura,2017-06-10 11:39,2,0,amid rumours that hapilon managed once again to escape marawi,"(['Netherlands'], Location((52.2379891, 5.53460738162, 0.0)))",,#,873383977494626304,https://twitter.com/AngeleSamura/status/873383977494626304,en
PhilippineStar,2017-06-10 11:34,2,1,watch doh closely monitoring possible outbreak of acute gastroenteritis and cholera among marawi evacuees  via,"(['Philippines'], Location((12.7503486, 122.7312101, 0.0)))",@,,873382898644140032,https://twitter.com/PhilippineStar/status/873382898644140032,en
raffytima,2017-06-10 11:34,14,62,they were the first to push back the maute terrorists in marawi losing some men in the process they want to be the one to end it,"(['Manila', ' Philippines'], Location((14.5906216, 120.9799696, 0.0)))",,,873382779316191232,https://twitter.com/raffytima/status/873382779316191232,en
sentineltimesph,2017-06-10 11:33,0,0,gatchalian calls for allout relief ops for marawi evacuees  via shareaholic,,@,,873382639117283328,https://twitter.com/sentineltimesph/status/873382639117283328,en
TKasoy,2017-06-10 11:32,0,0,amen to that our brotherssisters in marawi have suffered enough,,,,873382367062147073,https://twitter.com/TKasoy/status/873382367062147073,en
radikalchick,2017-06-10 11:31,0,0,martiallaw marawi mindanaohttps,"(['Philippines'], Location((12.7503486, 122.7312101, 0.0)))",,# # #,873382191350243329,https://twitter.com/radikalchick/status/873382191350243329,en
ctkpproj7,2017-06-10 11:31,0,0,heres one way of helping the children of marawi,"(['Quezon City'], Location((14.6509905, 121.0486155, 0.0)))",,,873382139005468672,https://twitter.com/ctkpproj7/status/873382139005468672,en
TKasoy,2017-06-10 11:31,0,0,ravages of war lets pray that the marawi conflict will soon be over and somehow we hope for the best that the city shall rebuild later,,,,873382056901828609,https://twitter.com/TKasoy/status/873382056901828609,en
gmanews,2017-06-10 11:31,18,31,14yrold boy killed by stray bullet while praying inside marawi mosque,"(['Philippines'], Location((12.7503486, 122.7312101, 0.0)))",,,873381960588177408,https://twitter.com/gmanews/status/873381960588177408,en
manuelg56250743,2017-06-10 11:29,0,0,military vows free marawi by june 12  the manila times online,,,,873381546895343617,https://twitter.com/manuelg56250743/status/873381546895343617,en
inquirerdotnet,2017-06-10 11:28,1,3,abella says the dnd will lead the recovery and reconstruction efforts in marawi in cooperation with other govt agencies  leilasinq,"(['Makati City'], Location((14.5591272, 121.0202094, 0.0)))",@,,873381361960321024,https://twitter.com/inquirerdotnet/status/873381361960321024,en
inquirerdotnet,2017-06-10 11:28,1,6,abella says draft of the eo for the p10b bangong marawi reconstruction program will be sent to the president soon for his signature,"(['Makati City'], Location((14.5591272, 121.0202094, 0.0)))",,,873381323645366274,https://twitter.com/inquirerdotnet/status/873381323645366274,en
jack_s_hewson,2017-06-10 11:27,0,1,from indonesian village to marawi siege chief,"(['Jakarta'], Location((-6.1753942, 106.827183, 0.0)))",,,873381156955201536,https://twitter.com/jack_s_hewson/status/873381156955201536,en
PhilippineStar,2017-06-10 11:27,3,2,dnd to lead bangon marawi rebuilding initiative military engineering battalions to be involved  alexisbromero,"(['Philippines'], Location((12.7503486, 122.7312101, 0.0)))",@,,873381136667336704,https://twitter.com/PhilippineStar/status/873381136667336704,en
alexisbromero,2017-06-10 11:27,0,0,dnd to lead bangon marawi rebuilding initiative military engineering battalions to be involved philippinestar philstarnews,"(['Manila'], Location((14.5906216, 120.9799696, 0.0)))",@ @,,873380983864664064,https://twitter.com/alexisbromero/status/873380983864664064,en
LeilasINQ,2017-06-10 11:26,2,1,abella says the dnd will lead the recovery and reconstruction efforts in marawi in cooperation with other govt agencies,,,,873380934648713216,https://twitter.com/LeilasINQ/status/873380934648713216,en
iamJoie01,2017-06-10 11:26,0,0,i adore you with having such brave soul 143redangel please do take care prayers for ur safety and all the other heroes heroines in marawi,"(['Bacolod City', ' Western Visayas'], Location((10.6762836, 122.9513786, 0.0)))",@,,873380869125177345,https://twitter.com/iamJoie01/status/873380869125177345,en
PhilippineStar,2017-06-10 11:26,2,6,duterte to sign executive order on bangon marawi the p10 billion rebuilding program for marawi  alexisbromero,"(['Philippines'], Location((12.7503486, 122.7312101, 0.0)))",@,,873380856190033922,https://twitter.com/PhilippineStar/status/873380856190033922,en
PhilippineStar,2017-06-10 11:26,4,6,government to allot p10 billion for reconstruction efforts in marawi  alexisbromero,"(['Philippines'], Location((12.7503486, 122.7312101, 0.0)))",@,,873380799596199937,https://twitter.com/PhilippineStar/status/873380799596199937,en
