Briseisji,2017-06-17 9:16,0,0,we dont need that black ribbon martial law suited to the situation of marawi you see even if we have ml still terrorist are able to escape,,,,875884825457991680,https://twitter.com/Briseisji/status/875884825457991680,en
tanjooilong,2017-06-17 9:16,2,1,trio believed to be on way to join terror group in marawi city  thestar malaysia mikichoo nonvitaltooth rtked,"(['Kuala Lumpur', ' Malaysia'], Location((0.642715, 122.5909774, 0.0)))",@ @ @,#,875884758361821184,https://twitter.com/tanjooilong/status/875884758361821184,en
SMARFreedom,2017-06-17 9:16,0,1,the marawi crisis in the philippines  persecutionnews,,@,,875884701902409731,https://twitter.com/SMARFreedom/status/875884701902409731,en
CRSVirtualRTV,2017-06-17 9:15,0,0,for those who want to help for the families of our fallen heroes of marawi here are some information for,,,,875884539138146306,https://twitter.com/CRSVirtualRTV/status/875884539138146306,en
FortunReason,2017-06-17 9:15,0,0,who knows if may natamaang maute or civilians sa marawi and if yes was if significant enough for them to lose that much people,,,,875884493613158400,https://twitter.com/FortunReason/status/875884493613158400,en
NievBuscayno,2017-06-17 9:14,1,1,duterte dared maute group to attack marawi in december 2016 speech via youtube,"(['Quezon City'], Location((14.6509905, 121.0486155, 0.0)))",@,,875884431067586561,https://twitter.com/NievBuscayno/status/875884431067586561,en
manilabulletin,2017-06-17 9:10,4,10,umak opens doors to students displaced by fighting in marawi  read d9 befullyinformed,"(['Manila', ' Philippines'], Location((14.5906216, 120.9799696, 0.0)))",,#,875883195773931521,https://twitter.com/manilabulletin/status/875883195773931521,en
auroraalmendral,2017-06-17 9:09,4,0,59 civilians who evacuated marawi have died so far more than the number of civilians who have died in the conflict,"(['New York', ' USA'], Location((40.7306458, -73.9866136, 0.0)))",,,875882987979587584,https://twitter.com/auroraalmendral/status/875882987979587584,en
ricosantillan,2017-06-17 9:04,0,0,just watch wonder woman it was a blast movie  well done galgadot  love is what we need to stop war marawi wonderwoman,"(['Manila City', ' Philippines'], Location((14.5906216, 120.9799696, 0.0)))",@,# #,875881771664982016,https://twitter.com/ricosantillan/status/875881771664982016,en
mindanaoan,2017-06-17 9:01,7,2,business losses in cagayandeoro alone since declaration of martiallawinmindanao  php 200million marawi martiallaw,"(['New York City'], Location((40.7306458, -73.9866136, 0.0)))",,# # # #,875881095132217346,https://twitter.com/mindanaoan/status/875881095132217346,en
thucysides,2017-06-17 9:00,0,0,marawi cements us importance for phl,,,,875880674028158976,https://twitter.com/thucysides/status/875880674028158976,en
_laslvlla,2017-06-17 8:56,0,0,i just cant bear to see their loved ones crying while sending them off to marawi hayy protect my fellow ilonggos my lord,"(['DLSU'], Location((14.5684454, 120.991376083, 0.0)))",,,875879679550308352,https://twitter.com/_laslvlla/status/875879679550308352,en
_laslvlla,2017-06-17 8:52,1,2,praying for the safety of 82nd ib who will be sent to marawi city please be back safe lord guide and protect them,"(['DLSU'], Location((14.5684454, 120.991376083, 0.0)))",,,875878721881755648,https://twitter.com/_laslvlla/status/875878721881755648,en
OreoTiuHsieh,2017-06-17 8:50,0,0,guess afp wary cuz commies r good in using humanitarian as cover in this case if they get into marawi they cn discredit or spy on afp ops,"(['Binondo', ' MaNiLa'], Location((14.60089925, 120.974706746, 0.0)))",,,875878321988423681,https://twitter.com/OreoTiuHsieh/status/875878321988423681,en
T_Klumklomchit,2017-06-17 8:49,6,2,2 indonesians  a malaysian arrested in sabah for alleged attempt to join militants in marawi,,,# # # #,875878142275076096,https://twitter.com/T_Klumklomchit/status/875878142275076096,en
raindeocampo,2017-06-17 8:47,0,0,world vision extends help to the children ofmarawi,"(['Manila'], Location((14.5906216, 120.9799696, 0.0)))",,,875877537884381184,https://twitter.com/raindeocampo/status/875877537884381184,en
ukbizz,2017-06-17 8:44,0,0,the battle for marawi uk ukbiz,"(['UK'], Location((54.7023545, -3.2765753, 0.0)))",,# #,875876747039977472,https://twitter.com/ukbizz/status/875876747039977472,en
maxangelo987,2017-06-17 8:41,0,0,mass for 1st ltjohn frederick savellanoone of the marines killed last june 9 in marawi he will be buried today in libingan ng mga ,,,,875875977536188416,https://twitter.com/maxangelo987/status/875875977536188416,en
BlackHawk20171,2017-06-17 8:39,0,0,the muslims in marawi city are suffering this time in ramadhan may allah swt accept their sacrifices and protect them from kufrs,,,,875875509766283264,https://twitter.com/BlackHawk20171/status/875875509766283264,en
GNismalOfficial,2017-06-17 8:39,0,2,stay safe and god bless to the brave ilonggo marines who will be deployed to marawi and also to the ones already risking their lives there,,,,875875409853677568,https://twitter.com/GNismalOfficial/status/875875409853677568,en
deanjorgebocobo,2017-06-17 8:38,0,1,the end of the world according to isis sam harris interviews journalist graeme wood marawi is mentioned too,"(['Philippines'], Location((12.7503486, 122.7312101, 0.0)))",,,875875363640954880,https://twitter.com/deanjorgebocobo/status/875875363640954880,en
RuscelMary,2017-06-17 8:31,0,1,fast facts marawi city via rapplerdotcomhttp,"(['Republic of the Philippines'], Location((12.7503486, 122.7312101, 0.0)))",@,,875873498991738880,https://twitter.com/RuscelMary/status/875873498991738880,en
AmericaRising17,2017-06-17 8:30,0,0,freak open sea collision has my brain moving 100 mihr philippine cargo shipmarawi usscole,,,,875873196951687168,https://twitter.com/AmericaRising17/status/875873196951687168,en
PTVisMin,2017-06-17 8:30,0,0,news  afp marawi terrorist siege wont happen in iligan or cdo 1,,,,875873129700225025,https://twitter.com/PTVisMin/status/875873129700225025,en
Politicwatcher3,2017-06-17 8:29,0,0,marawi battle has potential to ignite something similar to fallujah battles storming of mosul in jihadi consciousness,"(['Sydney', ' Australia'], Location((-33.8548157, 151.2164539, 0.0)))",,,875873015430397952,https://twitter.com/Politicwatcher3/status/875873015430397952,en
shorayah,2017-06-17 8:28,0,0,sunrise in marawi,"(['iligan city'], Location((8.17846435, 124.470789035, 0.0)))",,#,875872670994186240,https://twitter.com/shorayah/status/875872670994186240,en
sentineltimesph,2017-06-17 8:26,0,0,community kitchen as an interfaith initiative amidst continuing conflict in marawi  via shareaholic,,@,,875872250456440832,https://twitter.com/sentineltimesph/status/875872250456440832,en
jeanarbon,2017-06-17 8:25,1,0,eto kasi title sa rapplerdotcom ubial 59 dead in evacuation sites for marawi residents the leader of fake news ,"(['Philippines'], Location((12.7503486, 122.7312101, 0.0)))",@,,875871922889805826,https://twitter.com/jeanarbon/status/875871922889805826,en
SilentNoMorePH,2017-06-17 8:23,0,1,dear fellow filipinos while marawi death toll rises day by day the president is on personal time  u,"(['Republic of the Philippines'], Location((12.7503486, 122.7312101, 0.0)))",,,875871496647856128,https://twitter.com/SilentNoMorePH/status/875871496647856128,en
LITechNewsPosts,2017-06-17 8:19,0,0,litechnews some maute militants have reportedly escaped marawi city youtube,"(['Bohemia', ' NY'], Location((49.8167003, 15.4749544, 0.0)))",,# #,875870472080175106,https://twitter.com/LITechNewsPosts/status/875870472080175106,en
aitody,2017-06-17 8:15,0,0,residents fleeing marawi saw around 100 bodies philippines official says cnnihttp,"(['Jakarta-Jogja'], Location((-7.7991378, 110.3621344, 0.0)))",@,,875869366075523073,https://twitter.com/aitody/status/875869366075523073,en
disruptivesigna,2017-06-17 8:12,0,0,philippine army controls 90 of marawi fighting with isis ongoing news news feedly,"(['Worldwide'], Location((53.4573434, -2.22698994022, 0.0)))",@jimmypedya,# # #,875868786733088768,https://twitter.com/disruptivesigna/status/875868786733088768,en
MrLorag,2017-06-17 8:09,0,0,will phl airstrikes vs maute in marawi city go this direction,"(['The Netherlands'], Location((36.2992331, -89.751194, 0.0)))",,,875868045360734208,https://twitter.com/MrLorag/status/875868045360734208,en
inquirerdotnet,2017-06-17 8:08,3,8,marawi folk barter relief for fresh food 0,"(['Makati City'], Location((14.5591272, 121.0202094, 0.0)))",,,875867600789663744,https://twitter.com/inquirerdotnet/status/875867600789663744,en
sweeeetbravery,2017-06-17 8:07,0,6,in the last days of ramadhan we all have that one same prayer in our dua right lets vault in pray for marawi,,,#,875867436020514817,https://twitter.com/sweeeetbravery/status/875867436020514817,en
manilabulletin,2017-06-17 8:05,5,0,over 200 teachers in marawi unaccounted for  read d befullyinformed,"(['Manila', ' Philippines'], Location((14.5906216, 120.9799696, 0.0)))",,#,875866836528754688,https://twitter.com/manilabulletin/status/875866836528754688,en
zyiteblog,2017-06-17 8:03,0,0,the battle for marawi  philippines president rodrigo duterte who has expended huge amounts of political and m,,,,875866404838395905,https://twitter.com/zyiteblog/status/875866404838395905,en
AdZUOfficial,2017-06-17 8:00,0,1,we continue to pray for the people of marawi for our soldiers for our protection from violence for peace in,"(['Zamboanga City', ' Philippines'], Location((6.9046004, 122.0763695, 0.0)))",,,875865597179031552,https://twitter.com/AdZUOfficial/status/875865597179031552,en
PTVph,2017-06-17 8:00,1,2,news deped tracking whereabouts of teacher displaced by marawi conflict,"(['Philippines'], Location((12.7503486, 122.7312101, 0.0)))",,,875865580804251648,https://twitter.com/PTVph/status/875865580804251648,en
PolitikoWatch,2017-06-17 8:00,0,0,600 civilians remain trapped in marawi  padilla,,,,875865576391843840,https://twitter.com/PolitikoWatch/status/875865576391843840,en
ManilaMetroBN,2017-06-17 7:59,0,0,philippine officials foreigners among islamist gunmen involved in marawi violence,,,,875865322074640384,https://twitter.com/ManilaMetroBN/status/875865322074640384,en
Politiko_Ph,2017-06-17 7:58,2,4,wag nang magpabida afp tells good samaritans to hand aid over to govt instead of going to marawi,,,,875865071875796992,https://twitter.com/Politiko_Ph/status/875865071875796992,en
drrmd_fo12,2017-06-17 7:56,0,0,today dswd foxii goes to saguiaran evacuation center to release food and nonfood relief goods to marawi idps teamdrrms dswdmaymalasakit,"(['Koronadal City', ' South Cotabato'], Location((6.4900622, 124.836511, 0.0)))",,# #,875864785308467200,https://twitter.com/drrmd_fo12/status/875864785308467200,en
dhinjar1,2017-06-17 7:51,0,0,military says some maute militants may have slipped out of marawi via abscbnnews,,@,,875863360956506114,https://twitter.com/dhinjar1/status/875863360956506114,en
RadioFarSide,2017-06-17 7:50,0,0,isis invades in marawi philippines may have slipped out of containment zone,"(['Jakarta'], Location((-6.1753942, 106.827183, 0.0)))",,# # #,875863215732695040,https://twitter.com/RadioFarSide/status/875863215732695040,en
MikeofNewYORK,2017-06-17 7:45,1,1,marawi fighting rages but elsewhere too in mindanao  philippine army units secure areas vs another isis linked group in,,,# # # #,875862021681631233,https://twitter.com/MikeofNewYORK/status/875862021681631233,en
SilentNoMorePH,2017-06-17 7:45,0,0,dear fellow filipinos the pain and the deaths at marawi can you avoided with hood leadership leadership that u,"(['Republic of the Philippines'], Location((12.7503486, 122.7312101, 0.0)))",,,875861834980409344,https://twitter.com/SilentNoMorePH/status/875861834980409344,en
victoriatulad,2017-06-17 7:42,42,146,mass for 1st ltjohn frederick savellanoone of the marines killed last june 9 in marawi he will be buried today in libingan ng mga bayani,,,,875861256317452288,https://twitter.com/victoriatulad/status/875861256317452288,en
SilentNoMorePH,2017-06-17 7:40,0,2,dear fellow filipinos how many more civilians will die in marawi personal time in time of crisis,"(['Republic of the Philippines'], Location((12.7503486, 122.7312101, 0.0)))",,,875860727948496896,https://twitter.com/SilentNoMorePH/status/875860727948496896,en
GuinalShiela,2017-06-17 7:35,5,22,abscbnnews ml is securing my family mmbers  friends who live in and near marawi  is evil for duterte haters,,@,,875859389579640832,https://twitter.com/GuinalShiela/status/875859389579640832,en
bugsybites,2017-06-17 7:34,0,0,good morning i feel like buddy today thank you lord for all the blessings you are sending for marawi through us,"(['Philippines'], Location((12.7503486, 122.7312101, 0.0)))",,,875859122956115969,https://twitter.com/bugsybites/status/875859122956115969,en
dagapusa,2017-06-17 7:33,0,0,the milf show is starting to roll lets brace for the credits that they will ask after the marawi crisis,"(['Dasmarinas', ' Calabarzon'], Location((14.6455597, 120.9995684, 0.0)))",,,875859002143391745,https://twitter.com/dagapusa/status/875859002143391745,en
staronline,2017-06-17 7:33,2,0,trio believed to be on way to join terror group in marawi city d,"(['Kuala Lumpur', ' Malaysia'], Location((0.642715, 122.5909774, 0.0)))",,,875858804738478080,https://twitter.com/staronline/status/875858804738478080,en
sunstarcebu,2017-06-17 7:33,0,0,those solicitation letters allegedly for marawi victims are fake find out more u,"(['Cebu', ' Philippines'], Location((10.45, 123.84, 0.0)))",,,875858780826738688,https://twitter.com/sunstarcebu/status/875858780826738688,en
PhilDefNews,2017-06-17 7:32,0,0,world class sharpshooters ready 2 serve in marawi by all accounts dey r badly needed there,"(['Manila', ' Philippines'], Location((14.5906216, 120.9799696, 0.0)))",,,875858685418889216,https://twitter.com/PhilDefNews/status/875858685418889216,en
itsariannepearl,2017-06-17 7:32,0,1,praying for the ilonggo troops who are heading to marawi today one of them is the husband of my friend may they all come home safe,"(['Seoul', ' South Korea'], Location((37.5666791, 126.9782914, 0.0)))",,,875858561838002177,https://twitter.com/itsariannepearl/status/875858561838002177,en
RJ_delosSantos,2017-06-17 7:29,0,1,his bravery and faith in god makes him invincible trillanessonny is nothing but a shit of imagination compared to this soldier marawi,"(['Philippines'], Location((12.7503486, 122.7312101, 0.0)))",@,#,875857935292809216,https://twitter.com/RJ_delosSantos/status/875857935292809216,en
MrLorag,2017-06-17 7:28,0,0,why dont nyt press potus to negotiate w isis in syria or marawi trouble makers r their creation n knew they will all b slaightered,"(['The Netherlands'], Location((36.2992331, -89.751194, 0.0)))",,,875857720779427840,https://twitter.com/MrLorag/status/875857720779427840,en
Reg_2K,2017-06-17 7:19,21,56,all incoming grade 11 baby tams are encouraged to bring donations for the feu for marawi drive on thursday feuformarawi feuhsannouncements,"(['National Capital Region'], Location((14.5736108, 121.0329706, 0.0)))",,# #,875855354071994369,https://twitter.com/Reg_2K/status/875855354071994369,en
lorelyn_dumaug,2017-06-17 7:15,0,0,repost a speculation but i share same thought read and share  the marawi,"(['Cagayan de Oro', ' Philippines'], Location((8.42980265, 124.682410212, 0.0)))",,#,875854444075917313,https://twitter.com/lorelyn_dumaug/status/875854444075917313,en
gina_nurse,2017-06-17 7:12,0,0,afp some maute members may have left marawi philstarnews,"(['Manila', ' Philippines'], Location((14.5906216, 120.9799696, 0.0)))",@,,875853521362354176,https://twitter.com/gina_nurse/status/875853521362354176,en
dagapusa,2017-06-17 7:10,0,5,how can govt fasttrack development in mindanao under martial rule are you saying that marawi crisis wont be over till 2022 what a joke,"(['Dasmarinas', ' Calabarzon'], Location((14.6455597, 120.9995684, 0.0)))",,,875853167455420416,https://twitter.com/dagapusa/status/875853167455420416,en
phildaily,2017-06-17 7:10,0,0,afp some maute members may have left marawi  philippine star 8,,,,875853149680144384,https://twitter.com/phildaily/status/875853149680144384,en
LumpyAsia,2017-06-17 7:09,2,1,the 2017 marawi attacks implications for regional security u,"(['Asia-Pacific'], Location((49.4212299, 8.4297698, 0.0)))",,,875852746787827712,https://twitter.com/LumpyAsia/status/875852746787827712,en
cindy_marq,2017-06-17 7:08,2,10,yup saw that 2016 video where duterte taunted the maute group to attack marawi,"(['Manila', ' Philippines'], Location((14.5906216, 120.9799696, 0.0)))",,,875852649664356356,https://twitter.com/cindy_marq/status/875852649664356356,en
Alan_Mark_,2017-06-17 7:06,0,0,unfortunately for duterte marcos and their followers it was and is never about yolanda or marawi all about power greed  wealth,"(['New South Wales', ' Australia'], Location((-31.8759835, 147.2869493, 0.0)))",,,875852128681578496,https://twitter.com/Alan_Mark_/status/875852128681578496,en
xsirhc30x,2017-06-17 7:06,0,0,to yellow shits you idiots said duterte is in coma right so why the hell your vp is out of the country in the midst of marawi crisis,,,,875852097266339840,https://twitter.com/xsirhc30x/status/875852097266339840,en
phnews24x7,2017-06-17 7:00,0,0,meet the cop who defied science in marawi  d,"(['Philippines'], Location((12.7503486, 122.7312101, 0.0)))",,#,875850587551576065,https://twitter.com/phnews24x7/status/875850587551576065,en
eleaks_reina,2017-06-17 7:00,0,0,isis in the philippines the battle for marawi city resassenterritory authority rights,"(['Leon', ' Spain'], Location((30.4683062, -84.2549068, 0.0)))",,,875850483881070592,https://twitter.com/eleaks_reina/status/875850483881070592,en
PTVisMin,2017-06-17 7:00,0,0,news afp resumes use of sf260 planes vs terrorists in marawi,,,,875850483855839233,https://twitter.com/PTVisMin/status/875850483855839233,en
RCDefense,2017-06-17 6:59,8,6,philippines battleground in global fight against extremism  wedwards thecipherbrief marawi,"(['Washington', ' D.C.'], Location((38.8949549, -77.0366456, 0.0)))",@ @,# #,875850224589131776,https://twitter.com/RCDefense/status/875850224589131776,en
BataKayumanggi,2017-06-17 6:56,0,2,du30 challenged them and said go ahead be my guest burn marawi and so they did it helps when a leader is not arrogant  tactful u know,"(['Republic of the Philippines'], Location((12.7503486, 122.7312101, 0.0)))",,,875849580545318912,https://twitter.com/BataKayumanggi/status/875849580545318912,en
akahnnyc,2017-06-17 6:55,0,0,desperation builds for marawi folk via instapaper,,@,,875849428195696640,https://twitter.com/akahnnyc/status/875849428195696640,en
iameugeneeric,2017-06-17 6:55,0,0,easy access to weapons known as an islamic centre marawi is a muslimmajority city in a country where 90 per,"(['ad doha'], Location((24.5562051, 46.812608, 0.0)))",,,875849401549299712,https://twitter.com/iameugeneeric/status/875849401549299712,en
PHLNewsOnline,2017-06-17 6:51,0,0,news5 want to help marawi heres one way,"(['Philippines'], Location((12.7503486, 122.7312101, 0.0)))",,,875848256818905089,https://twitter.com/PHLNewsOnline/status/875848256818905089,en
Veeanonymousros,2017-06-17 6:46,1,0,howitzer in marawi via abscbnnews target the camaute crazeisis hybrid murderers attn big mama farthana kamote,,@,,875847063916888064,https://twitter.com/Veeanonymousros/status/875847063916888064,en
paula199x,2017-06-17 6:45,0,0,saw a post on ig about ilonggo soldiers in the airport en route to marawi city,,,,875846703697416192,https://twitter.com/paula199x/status/875846703697416192,en
inquirer_libre,2017-06-17 6:36,0,0,marawi folk barter relief for fresh food,"(['Philippines'], Location((12.7503486, 122.7312101, 0.0)))",,,875844654054469632,https://twitter.com/inquirer_libre/status/875844654054469632,en
douglasweller,2017-06-17 6:36,0,1,amid ongoing violence in marawi a journalist takes a bullet,"(['Melbourne', ' Victoria', ' Australia'], Location((-37.8142176, 144.9631608, 0.0)))",,,875844653081214976,https://twitter.com/douglasweller/status/875844653081214976,en
dyslexiczs,2017-06-17 6:35,0,1,the information of rapplerdotcom of 59 deaths in evacuation centers in marawi is wrong totally and intentionally gave wrong numbers 2,,@,,875844184430833664,https://twitter.com/dyslexiczs/status/875844184430833664,en
jeany_c,2017-06-17 6:31,3,3,tadecokobai pray for marawi tadecosupportsmarawihttps,,,# # #,875843255644037120,https://twitter.com/jeany_c/status/875843255644037120,en
dumidyeypee,2017-06-17 6:31,1,1,hey imthinkingpinoy perhaps you want to list the things that you and your group had been doing for marawi if any wala na bang bago,"(['Muntinlupa City'], Location((14.3940614, 121.0410436, 0.0)))",@,,875843221720412160,https://twitter.com/dumidyeypee/status/875843221720412160,en
SaadAbedine,2017-06-17 6:23,1,1,if isis claim is authentic unlike what they tried to pull in marawi christmas came way early for israel netanyahu  avigdorlibermanhttps,"(['Doha', ' Atlanta', ' Abu Dhabi'], Location((25.3014957, 51.4996673988, 0.0)))",@ @,# #,875841255577575424,https://twitter.com/SaadAbedine/status/875841255577575424,en
AksyonTV,2017-06-17 6:21,0,0,want to help marawi heres one way  breakingnews mainhomepageheader national,"(['TV5', ' Philippines'], Location((47.8967217, 106.887564062, 0.0)))",,# # #,875840828429787136,https://twitter.com/AksyonTV/status/875840828429787136,en
Nic0tineJunkie,2017-06-17 6:17,0,0,a message to duterte from an evacuee inside marawi city,"(['Philippines'], Location((12.7503486, 122.7312101, 0.0)))",,,875839655165415424,https://twitter.com/Nic0tineJunkie/status/875839655165415424,en
0ryuge,2017-06-17 6:09,0,1,philippine troops capture maute brother in marawi seige rantburg waronterror ryuge 16june2017,"(['Arizona'], Location((34.395342, -111.7632755, 0.0)))",,# # # #,875837818957778944,https://twitter.com/0ryuge/status/875837818957778944,en
tscLETRAN,2017-06-17 6:09,3,8,june 26 is eidl fitr walangpasok lets be one with our brothers and sisters in prayers for peace in marawi and in the entire world,"(['Bataan PH'], Location((14.666667, 120.416667, 0.0)))",,#,875837665102450688,https://twitter.com/tscLETRAN/status/875837665102450688,en
anawalINQ,2017-06-17 6:07,2,1,gphmilf team rescues three men trapped in heart of marawi on friday inquirerdotnet inqnational,,@ @,,875837192571994112,https://twitter.com/anawalINQ/status/875837192571994112,en
JnzTweets,2017-06-17 6:06,0,0,will loudmouth conceited duterte appear in public this weekend duterte sleeps while marawi burns martiallaw,,,# #,875837064561872897,https://twitter.com/JnzTweets/status/875837064561872897,en
wardiaabdulrah2,2017-06-17 6:03,0,0,stop bombing in marawi city,,,,875836237969575936,https://twitter.com/wardiaabdulrah2/status/875836237969575936,en
mindanao_daily,2017-06-17 6:00,0,0,rebellion is written all over the marawi siege ,"(['Cagayan de Oro City'], Location((8.42980265, 124.682410212, 0.0)))",,,875835594441711616,https://twitter.com/mindanao_daily/status/875835594441711616,en
ryanbonnduadua,2017-06-17 5:57,0,0,the marawi siege following the money trail by y a joey tugung  06162017 i am not a banker and neither,"(['Taytay Rizal'], Location((14.5587811, 121.140779552, 0.0)))",,,875834787839131648,https://twitter.com/ryanbonnduadua/status/875834787839131648,en
shaprecioso,2017-06-17 5:57,0,1,atm ilonggo soldiers send off to marawigod bless you all,"(['Sampaloc', ' Manila'], Location((14.610265, 120.9965673, 0.0)))",,,875834727374008320,https://twitter.com/shaprecioso/status/875834727374008320,en
clavenilo,2017-06-17 5:52,4,5,paging air force can you get a heli and drop this pnp cheap direct into the combat zone sa marawi,"(['Philippines'], Location((12.7503486, 122.7312101, 0.0)))",,,875833598787461120,https://twitter.com/clavenilo/status/875833598787461120,en
pntimes,2017-06-17 5:51,0,0,govt assures swift action to aid idps from marawi,"(['Manila', ' Philippines'], Location((14.5906216, 120.9799696, 0.0)))",,,875833354695979012,https://twitter.com/pntimes/status/875833354695979012,en
Antokin_LOTRO,2017-06-17 5:51,0,0,show of support for afp troops in marawi city before joining my bestfriends for dinner last night i met up with ,,,,875833187028672512,https://twitter.com/Antokin_LOTRO/status/875833187028672512,en
puretuts,2017-06-17 5:47,0,0,i noticed the glaring difference between the surviving families of those who died n marawi vs saf 44 very stoic yung sa heroes of marawi,,,,875832215619289088,https://twitter.com/puretuts/status/875832215619289088,en
VOPnewsroom,2017-06-17 5:45,0,0,fighting has been continuing in the philippine city of marawi on thursday with philippine air force planes,"(['Worldwide'], Location((53.4573434, -2.22698994022, 0.0)))",,,875831672591306753,https://twitter.com/VOPnewsroom/status/875831672591306753,en
VOP_Today,2017-06-17 5:45,0,0,fighting continuing in marawi philippine  air force drop bombs on islamicmilitants,"(['Worldwide'], Location((53.4573434, -2.22698994022, 0.0)))",,,875831668912906240,https://twitter.com/VOP_Today/status/875831668912906240,en
grayjaycanada,2017-06-17 5:44,1,12,he is he is responsible bec he provoked maute to burn down marawi,"(['Toronto', ' Ontario'], Location((43.653963, -79.387207, 0.0)))",,,875831423114072065,https://twitter.com/grayjaycanada/status/875831423114072065,en
globnewsen,2017-06-17 5:41,0,0,philippines conflict in the philippines marawi siege  situation report no 2 june 16 2017,,,,875830685231181824,https://twitter.com/globnewsen/status/875830685231181824,en
iamsittierahma,2017-06-17 5:35,1,15,one thing that i surely miss about marawi is the adhn come to success come to peace aya panginam a umaniisa imanto na gyanan a dowa,"(['Republic of the Philippines'], Location((12.7503486, 122.7312101, 0.0)))",,,875829265547141120,https://twitter.com/iamsittierahma/status/875829265547141120,en
