9CharlesMorales,2017-06-17 19:43,0,0,pray for marawi,"(['Inside the court'], Location((42.2667591, 2.9615402, 0.0)))",,,876042504969125889,https://twitter.com/9CharlesMorales/status/876042504969125889,en
PhilippineStar,2017-06-17 19:40,3,9,mvp group other companies join marawi relief effort,"(['Philippines'], Location((12.7503486, 122.7312101, 0.0)))",,,876041739097735168,https://twitter.com/PhilippineStar/status/876041739097735168,en
llyoung28,2017-06-17 19:37,0,0,scores of dead bodies litter streets of besieged marawi  your news wire,"(['United States'], Location((39.7837304, -100.4458825, 0.0)))",,,876041121327190017,https://twitter.com/llyoung28/status/876041121327190017,en
aceesmeralda,2017-06-17 19:37,0,0,us special forces in marawi providing battlefield information to military commanders and have been operating,"(['Philippines'], Location((12.7503486, 122.7312101, 0.0)))",,,876041113542459393,https://twitter.com/aceesmeralda/status/876041113542459393,en
johnnagiolagon,2017-06-17 19:37,0,0,scores of civilian bodies seen in marawi philippine official,,,,876041098853990400,https://twitter.com/johnnagiolagon/status/876041098853990400,en
felixthepusa,2017-06-17 19:37,1,4,god bless our troops in marawi and the families who were affected pray for marawi,,,#,876041092939956224,https://twitter.com/felixthepusa/status/876041092939956224,en
kakmidah,2017-06-17 19:37,0,0,marawi city philippine troops pound islamists as death toll passes 300,,,,876041055774228480,https://twitter.com/kakmidah/status/876041055774228480,en
MediatorGiL,2017-06-17 19:36,0,0,by the numbers dutertes marawi conflict is already worse than aquinos zamboanga crisis and its not yet over ,,,,876040930398277632,https://twitter.com/MediatorGiL/status/876040930398277632,en
ManilaRR,2017-06-17 19:36,0,0,young evacuees ask for privacy in evacuation centers in wartorn marawi  coconuts manila,,,,876040892548866048,https://twitter.com/ManilaRR/status/876040892548866048,en
thus_spake,2017-06-17 19:33,1,0,marawi philippines philippine troops pounded islamist militants holding parts of southern marawi city with air,"(['England', ' Great Britain.'], Location((52.7954791, -0.540240286617, 0.0)))",,,876040161389420544,https://twitter.com/thus_spake/status/876040161389420544,en
zyiteblog,2017-06-17 19:30,0,0,ph troops pound islamists as death toll passes 300  marawi city philippine troops pounded islamist militants ,,,,876039398990729216,https://twitter.com/zyiteblog/status/876039398990729216,en
pinoynewsonline,2017-06-17 19:30,0,0,president rodrigo duterte leads the arrival honors for killed inaction in marawi more info,"(['Republic of the Philippines'], Location((12.7503486, 122.7312101, 0.0)))",,,876039384134537218,https://twitter.com/pinoynewsonline/status/876039384134537218,en
Gagagumball,2017-06-17 19:28,0,0,a dont make promises you cant keep b these statements will only demoralize our soldiers who are risking their lives in marawi,"(['Republic of the Philippines'], Location((12.7503486, 122.7312101, 0.0)))",,,876038901411926017,https://twitter.com/Gagagumball/status/876038901411926017,en
miriamgracego,2017-06-17 19:25,2,0,marawi crisis death toll passes 300 marawiclashhttps,,,#,876038021497233408,https://twitter.com/miriamgracego/status/876038021497233408,en
HappyNanayof3,2017-06-17 19:23,3,7,dear god when im worried about 2mrw pls remind me that people in marawi has bigger problems than my worries in life amen pray for marawi,,,#,876037690902233088,https://twitter.com/HappyNanayof3/status/876037690902233088,en
Ivan226622,2017-06-17 19:23,0,0,govt taps barangay chiefs to secure communities near marawi from terrorist spillover marawiclash  abscbn news,,,#,876037510375374848,https://twitter.com/Ivan226622/status/876037510375374848,en
Nic0tineJunkie,2017-06-17 19:19,0,0,so we published a transcript of an interview of an evacuee in marawi asking dutz to stop the airstrikes and the trolls came as usual,"(['Philippines'], Location((12.7503486, 122.7312101, 0.0)))",,,876036685410086912,https://twitter.com/Nic0tineJunkie/status/876036685410086912,en
elekonsult,2017-06-17 19:19,0,0,i liked a youtube video raw philippine air force drop bombs on isislinked militants in marawi,,@,,876036682998571008,https://twitter.com/elekonsult/status/876036682998571008,en
NPRAshley,2017-06-17 19:18,0,0,update marawi,"(['Washington', ' DC'], Location((38.8949549, -77.0366456, 0.0)))",,#,876036320396705792,https://twitter.com/NPRAshley/status/876036320396705792,en
zyiteblog,2017-06-17 19:17,0,0,no sulubased abus joined in the marawi siege says military,,,,876036158437953536,https://twitter.com/zyiteblog/status/876036158437953536,en
bdsaguing,2017-06-17 19:17,0,0,retweeted inqmindanao  inqmindanao presidentduterte we took for granted entry of arms in marawi inqnational inquirerdotnet,"(['Rome', ' Italy'], Location((34.257038, -85.1646726, 0.0)))",@ @ @,#,876036100791336960,https://twitter.com/bdsaguing/status/876036100791336960,en
bdsaguing,2017-06-17 19:16,0,0,retweeted jun veneracion  junveneracion afp drones shot down by maute snipers in marawi says retired,"(['Rome', ' Italy'], Location((34.257038, -85.1646726, 0.0)))",@,,876035867650994176,https://twitter.com/bdsaguing/status/876035867650994176,en
rickrick888,2017-06-17 19:16,0,0,inside marawi firefight airstrikes continue civilian forces eyed to defend cities  c,,,,876035750369923072,https://twitter.com/rickrick888/status/876035750369923072,en
inseinxen,2017-06-17 19:15,0,0,playing gta iv marawi style,"(['Davao City'], Location((7.22650725, 125.454887691, 0.0)))",,,876035632820244488,https://twitter.com/inseinxen/status/876035632820244488,en
ABSCBNNews,2017-06-17 19:15,6,28,govt taps barangay chiefs to secure communities near marawi from terrorist spillover marawiclashhttp,"(['Manila', ' Philippines'], Location((14.5906216, 120.9799696, 0.0)))",,#,876035445943025665,https://twitter.com/ABSCBNNews/status/876035445943025665,en
base_thai,2017-06-17 19:14,1,1,philippines islamic leaders around marawi fearful of denouncing extreme militants,,,#,876035215310831616,https://twitter.com/base_thai/status/876035215310831616,en
marchelespina,2017-06-17 19:14,0,0,marawi crisis death toll passes 300 via rapplerdotcomhttp,"(['Middle of Nowhere'], Location((50.063242, -123.000116, 0.0)))",@,,876035214656417793,https://twitter.com/marchelespina/status/876035214656417793,en
cnnphilippines,2017-06-17 19:11,18,31,inside marawi firefight airstrikes continue civilian forces eyed to defend cities,,,,876034601138896896,https://twitter.com/cnnphilippines/status/876034601138896896,en
mikeligalig,2017-06-17 19:10,0,0,battle to regain marawi continues  cnn philippines,"(['Bohol', ' Philippines'], Location((9.833333, 124.1615579, 0.0)))",,,876034383945150464,https://twitter.com/mikeligalig/status/876034383945150464,en
PHLNewsOnline,2017-06-17 19:10,1,1,gma news tf marawi believes maute fighters are running out of ammunition,"(['Philippines'], Location((12.7503486, 122.7312101, 0.0)))",,,876034262998405121,https://twitter.com/PHLNewsOnline/status/876034262998405121,en
kmtaetae0113,2017-06-17 19:03,0,0,i am basically homeless when marawi siege is over,,,,876032558970032129,https://twitter.com/kmtaetae0113/status/876032558970032129,en
PIA7NegOr,2017-06-17 19:03,0,0,for updates information and other related stories and photos on the situation in marawi city,"(['Capitol Area', ' Dumaguete City'], Location((6.1506858, 1.2665775, 0.0)))",,,876032468729593856,https://twitter.com/PIA7NegOr/status/876032468729593856,en
paubuluran,2017-06-17 19:02,1,1,for those who want to send help to the people in marawi specially kids  our soldiers you can reach me pwede ko sabay donations,,,,876032246234271744,https://twitter.com/paubuluran/status/876032246234271744,en
CergyPapers,2017-06-17 19:02,0,0,philippines  marawi conflict  dg echo daily map  16062017 the increasing number of idps results in overwhelming needs in essecdwc,"(['Cergy', ' France'], Location((49.0527528, 2.0388736, 0.0)))",,#,876032192169758720,https://twitter.com/CergyPapers/status/876032192169758720,en
rickrick888,2017-06-17 19:01,0,0,battle to regain marawi continues  cnn philippines cnnphilippines june 17 2017,,,,876032079091335168,https://twitter.com/rickrick888/status/876032079091335168,en
ontarioherald1,2017-06-17 19:01,0,0,we stand ready to help canada vows aid for ph amid marawi crisis ,"(['Global'], Location((43.7283874, -79.3491487932, 0.0)))",,,876031973352800256,https://twitter.com/ontarioherald1/status/876031973352800256,en
cnnphilippines,2017-06-17 19:00,10,12,battle to regain marawi continues d,,,,876031911772119041,https://twitter.com/cnnphilippines/status/876031911772119041,en
PolitikoWatch,2017-06-17 19:00,0,0,padilla govt troops will not bomb mosques in marawi,,,,876031673569345536,https://twitter.com/PolitikoWatch/status/876031673569345536,en
mermaidtatted,2017-06-17 18:59,0,1,yall this senator is trying to pass an unlimited rice ban despite all of the things happening in marawi she do this,,,,876031558091591680,https://twitter.com/mermaidtatted/status/876031558091591680,en
AyaloweCNA,2017-06-17 18:58,1,2,former students from the msu have been distributing these jollibee food packs to soldiers in marawi,"(['Manila', ' Philippines'], Location((14.5906216, 120.9799696, 0.0)))",@,#,876031277039730688,https://twitter.com/AyaloweCNA/status/876031277039730688,en
tatancast,2017-06-17 18:54,0,1,except marawi p,,,,876030230875447296,https://twitter.com/tatancast/status/876030230875447296,en
ChickieHilborn,2017-06-17 18:53,1,1,the battle for marawi philippines new front against isis a visual essay reporttruth maga mbga v ibtimesuk,"(['The World'], Location((45.1047263, 7.695728, 0.0)))",@,# # #,876030027862814720,https://twitter.com/ChickieHilborn/status/876030027862814720,en
CheekyLeila,2017-06-17 18:51,1,0,to our filipino soldiers deployed in marawi  advance happy fathers day to you all happyfathersday,,,# #,876029600555384832,https://twitter.com/CheekyLeila/status/876029600555384832,en
LetdeLara,2017-06-17 18:50,0,0,the messages of the soldiers in marawi for their loved ones broke my heart god bless them,"(['Gapan City', 'Nueva Ecija'], Location((15.3074471, 120.945596, 0.0)))",,,876029335592775682,https://twitter.com/LetdeLara/status/876029335592775682,en
Rikiculous,2017-06-17 18:49,0,0,i hope the war in marawi ends so that fathers can already come home to their families,,,,876029019543810048,https://twitter.com/Rikiculous/status/876029019543810048,en
teddyboylocsin,2017-06-17 18:48,0,9,on eve of victory they should to determine if situation calls for lifting ml in marawi  extending to other areas maute escaped to,"(['Philippines'], Location((12.7503486, 122.7312101, 0.0)))",,,876028761908576256,https://twitter.com/teddyboylocsin/status/876028761908576256,en
Ideal_Views,2017-06-17 18:47,1,3,i love you all duterte rallies troops as marawi firefights rage on via abscbnnews,"(['Worldwide'], Location((53.4573434, -2.22698994022, 0.0)))",@,,876028511579889668,https://twitter.com/Ideal_Views/status/876028511579889668,en
PHHotTrends,2017-06-17 18:47,0,0,palace disputes nyt editorial saying duterte partly to blame for marawi crisis marawiupdates martiallaw,"(['Manila City'], Location((14.5906216, 120.9799696, 0.0)))",,# #,876028446371184640,https://twitter.com/PHHotTrends/status/876028446371184640,en
zyiteblog,2017-06-17 18:45,0,0,philippine troops battle islamic state militants in marawi as civilian death toll rises to 300,,,,876028085367431168,https://twitter.com/zyiteblog/status/876028085367431168,en
twaspau,2017-06-17 18:45,0,0,salute to the policemarinessoldier who died in marawi so other can live with peace,"(['Binangonan', 'Rizal'], Location((14.465142, 121.1921185, 0.0)))",,,876028055742853120,https://twitter.com/twaspau/status/876028055742853120,en
bdsaguing,2017-06-17 18:45,0,0,facetoface soldiers recount terrorist encounters as marawi purge continues via abscbnnews,"(['Rome', ' Italy'], Location((34.257038, -85.1646726, 0.0)))",@,,876028054887333889,https://twitter.com/bdsaguing/status/876028054887333889,en
MCNM_Marketing,2017-06-17 18:45,0,0,over 400 soldiers from visayas heading to marawicity,"(['Las Vegas'], Location((36.1662859, -115.149225, 0.0)))",,,876028035610357761,https://twitter.com/MCNM_Marketing/status/876028035610357761,en
nora_snorjin,2017-06-17 18:44,0,0,may we learn what we ought to learn in this crisis marawi,"(['Cagayan De Oro City', ' Northern'], Location((8.42980265, 124.682410212, 0.0)))",,#,876027789756977153,https://twitter.com/nora_snorjin/status/876027789756977153,en
Bee_Guffan_290,2017-06-17 18:43,0,0,pray for marawi prayfortheworld,,,# #,876027505068589056,https://twitter.com/Bee_Guffan_290/status/876027505068589056,en
AcheDinAaneWale,2017-06-17 18:42,0,0,philippine troops battle islamic state militants in marawi as civilian death toll rises to 300 topnews india,"(['New Delhi', ' India'], Location((28.6141793, 77.2022662, 0.0)))",,# #,876027270619680768,https://twitter.com/AcheDinAaneWale/status/876027270619680768,en
GulfTimes_QATAR,2017-06-17 18:39,2,2,philippine troops pound islamists as death toll passes 300 unrest conflict marawi 2,"(['Al Hilal - C Ring Road'], Location((25.2640725, 51.544784, 0.0)))",,# # #,876026624164208641,https://twitter.com/GulfTimes_QATAR/status/876026624164208641,en
PeninsulaQatar,2017-06-17 18:39,0,0,59 marawi city evacuees die of diseases philippines,"(['Qatar'], Location((25.22803095, 55.1733279309, 0.0)))",,# #,876026582158024704,https://twitter.com/PeninsulaQatar/status/876026582158024704,en
awesummly,2017-06-17 18:38,0,0,philippine troops battle islamicstate militants in marawi as civilian death toll rises to 300 top d,"(['Bengaluru', ' India'], Location((12.9791198, 77.5912997, 0.0)))",,# # #,876026273742573568,https://twitter.com/awesummly/status/876026273742573568,en
Ivan226622,2017-06-17 18:38,0,0,i love you all duterte rallies troops as marawi firefights rage on marawiclash  abscbn news abscbnnews ju,,,#,876026255602323457,https://twitter.com/Ivan226622/status/876026255602323457,en
jervicp,2017-06-17 18:37,0,0,duterte said hes ready to withdraw military forces from marawi if sc finds no factual basis for his ml declaration,"(['Philippines'], Location((12.7503486, 122.7312101, 0.0)))",,,876026077323288578,https://twitter.com/jervicp/status/876026077323288578,en
Nonaaaaaaa,2017-06-17 18:37,0,0,a part of me dies every time i hear a news of death casualty or trauma from the marawi war,,,,876026055370326016,https://twitter.com/Nonaaaaaaa/status/876026055370326016,en
PhamNguyenly,2017-06-17 18:37,0,0,philippine troops battle islamic state militants in marawi as civilian death toll rises to,,,,876025951485915136,https://twitter.com/PhamNguyenly/status/876025951485915136,en
ANCALERTS,2017-06-17 18:36,5,16,i love you all duterte rallies troops as marawi firefights rage on u,"(['Philippines'], Location((12.7503486, 122.7312101, 0.0)))",,,876025799480008705,https://twitter.com/ANCALERTS/status/876025799480008705,en
maxangelo987,2017-06-17 18:36,0,0,9 trapped civilians rescued in marawi gmanews,,,#,876025704110059521,https://twitter.com/maxangelo987/status/876025704110059521,en
maxangelo987,2017-06-17 18:36,0,0,afp drones shot down by maute snipers in marawi says retired general and pcso gm balutan will donate new one marawisiegepictwit,,,#http,876025701538942976,https://twitter.com/maxangelo987/status/876025701538942976,en
GrovelandJohn,2017-06-17 18:36,1,1,retweeted royalista joe  royalistajoe philippine troops pound isislinked militants in marawi as death toll,"(['Groveland', ' IL'], Location((42.7603688, -71.0314451, 0.0)))",@,,876025666633965569,https://twitter.com/GrovelandJohn/status/876025666633965569,en
ABSCBNNews,2017-06-17 18:35,9,48,i love you all duterte rallies troops as marawi firefights rage on marawiclash,"(['Manila', ' Philippines'], Location((14.5906216, 120.9799696, 0.0)))",,#,876025500619030530,https://twitter.com/ABSCBNNews/status/876025500619030530,en
IBTimesUK,2017-06-17 18:34,7,1,the battle for marawi a visual essay,"(['London'], Location((51.5073219, -0.1276474, 0.0)))",,,876025130958413824,https://twitter.com/IBTimesUK/status/876025130958413824,en
Abogado_PH,2017-06-17 18:32,2,0,caught on camera solgencalida interviewed for marawi docu,,@,,876024768444514305,https://twitter.com/Abogado_PH/status/876024768444514305,en
NCorralesINQ,2017-06-17 18:32,0,1,presidentduterte says there is terrorism in marawi city and that is rebellion inquirerdotnet,"(['Makati City'], Location((14.5591272, 121.0202094, 0.0)))",@,#,876024742276284416,https://twitter.com/NCorralesINQ/status/876024742276284416,en
northbound_ph,2017-06-17 18:32,0,0,doh denies citing 59 evacuees from marawi died of various illnesses via northboundph,,@,,876024646495158277,https://twitter.com/northbound_ph/status/876024646495158277,en
NCorralesINQ,2017-06-17 18:31,3,6,presidentduterte slams sc justices questioning rebellion in marawi city its crazy inquirerdotnet,"(['Makati City'], Location((14.5591272, 121.0202094, 0.0)))",@,#,876024583979126784,https://twitter.com/NCorralesINQ/status/876024583979126784,en
northbound_ph,2017-06-17 18:31,0,0,maute fighters in marawi dwindle via northboundph,,@,,876024557689126914,https://twitter.com/northbound_ph/status/876024557689126914,en
northbound_ph,2017-06-17 18:31,0,0,power restored in some parts of marawi via northboundph,,@,,876024458103762945,https://twitter.com/northbound_ph/status/876024458103762945,en
ANCALERTS,2017-06-17 18:30,3,16,facetoface soldiers recount terrorist encounters as marawi purge continues,"(['Philippines'], Location((12.7503486, 122.7312101, 0.0)))",,,876024122991452161,https://twitter.com/ANCALERTS/status/876024122991452161,en
phildaily,2017-06-17 18:29,0,0,deped provides psych first aid for displaced marawi students  rappler,,,,876024046785310720,https://twitter.com/phildaily/status/876024046785310720,en
iamReejhannBee,2017-06-17 18:22,0,0,off to marawi city,,,,876022248100032513,https://twitter.com/iamReejhannBee/status/876022248100032513,en
IRindependiente,2017-06-17 18:18,0,1,partido independiente joins the nation in remembering and giving salute to the brave heroes of marawi as well as,,,,876021252774924289,https://twitter.com/IRindependiente/status/876021252774924289,en
RJ_delosSantos,2017-06-17 18:13,0,0,a nice gesture from the ndfp we should be fighting one common enemy and that is terrorism marawi,"(['Philippines'], Location((12.7503486, 122.7312101, 0.0)))",,#,876019852401455105,https://twitter.com/RJ_delosSantos/status/876019852401455105,en
juLiusbabao,2017-06-17 18:12,1,52,on fathers day christinebbabao  i decided 2 donate blood for our troops  civilians in marawi city a bag donation can help save 4 lives c,"(['Republic of the Philippines'], Location((12.7503486, 122.7312101, 0.0)))",@,,876019734545784832,https://twitter.com/juLiusbabao/status/876019734545784832,en
rickrick888,2017-06-17 18:11,0,0,armm officials improving facilities for marawi evacuees  newsroomweekend live  cnn ph,,,#,876019373928067072,https://twitter.com/rickrick888/status/876019373928067072,en
alders_ledge,2017-06-17 18:11,0,1,deped provides psychological first aid for displaced marawi students philippines marawicrisishttp,,,# # #,876019367850385409,https://twitter.com/alders_ledge/status/876019367850385409,en
khayeee23,2017-06-17 18:11,0,0,praying for all the soldiers in marawi,"(['Republic of the Philippines'], Location((12.7503486, 122.7312101, 0.0)))",,,876019354038554624,https://twitter.com/khayeee23/status/876019354038554624,en
cnnphilippines,2017-06-17 18:10,0,1,armm officials improving facilities for marawi evacuees  newsroomweekend live u,,,#,876019218294034432,https://twitter.com/cnnphilippines/status/876019218294034432,en
superyeye_phd,2017-06-17 18:09,0,0,to all military dads in marawi advance happy fathers day ill be praying for all of you youre not just your familys hero but ours too 8,"(['Planet Earth', ' Milky Way Galaxy'], Location((47.5044752, 19.1251107, 0.0)))",,,876018858808623104,https://twitter.com/superyeye_phd/status/876018858808623104,en
Baibonn,2017-06-17 18:08,0,0,nyt dutertes braggadocio partly to blame for marawi crisis philstarnewshttps2,"(['Quezon City', ' Philippines'], Location((14.6509905, 121.0486155, 0.0)))",@,#039,876018669272289281,https://twitter.com/Baibonn/status/876018669272289281,en
DuterteWatchdog,2017-06-17 18:08,0,6,oh wow president duterte sent a postcard to the troops in marawi so cool,"(['Republic of the Philippines'], Location((12.7503486, 122.7312101, 0.0)))",,,876018589945475072,https://twitter.com/DuterteWatchdog/status/876018589945475072,en
AlahednewsEn,2017-06-17 18:07,0,0,marawi siege philippine troops pound militants death toll passes 300 philippines marawi isis,,,# # #,876018563143925760,https://twitter.com/AlahednewsEn/status/876018563143925760,en
PHLNewsOnline,2017-06-17 18:07,0,0,gma news task force marawi believes maute fighters are running out of ammunition,"(['Philippines'], Location((12.7503486, 122.7312101, 0.0)))",,,876018551915773952,https://twitter.com/PHLNewsOnline/status/876018551915773952,en
rickrick888,2017-06-17 18:06,0,0,senior correspondent davidyusantos reports on the latest in marawi  newsroomweekend live ,,,#,876018157017849856,https://twitter.com/rickrick888/status/876018157017849856,en
maxangelo987,2017-06-17 18:06,0,0,rrddavao talked about marawi  how they will finish the fight the npa his familiarity with agusan del norte and drugs gmanewsbreaking ,,,,876018140995620864,https://twitter.com/maxangelo987/status/876018140995620864,en
alders_ledge,2017-06-17 18:05,0,1,if marawi was manila the military wouldnt be dive bombing it wouldnt be leaving luzon in lockdown,,,# #,876017882148216833,https://twitter.com/alders_ledge/status/876017882148216833,en
TheresaAFallon,2017-06-17 18:04,2,12,eating his words clearly isnt agreeing w dutertehes had to swallow his pride as us aids philippines in marawi,"(['Brussels', ' Belgium'], Location((50.8465573, 4.351697, 0.0)))",,,876017630561406976,https://twitter.com/TheresaAFallon/status/876017630561406976,en
condorbox,2017-06-17 18:03,0,0,the latest rbnews radiobubble hashtag rbnews marawi,"(['43.52247', '13.23519'], Location((50.0918549, 16.7080549, 0.0)))",,# # #,876017461539332096,https://twitter.com/condorbox/status/876017461539332096,en
cnnphilippines,2017-06-17 18:03,0,1,senior correspondent davidyusantos reports on the latest in marawi  newsroomweekend live,,@,#,876017414495809537,https://twitter.com/cnnphilippines/status/876017414495809537,en
aries_1395,2017-06-17 18:02,0,0,seeing the news about marawi city our soldiers risking their lives for us it brings tears to my eyes salute to our military men heroes,"(['Philippines'], Location((12.7503486, 122.7312101, 0.0)))",,,876017254009257984,https://twitter.com/aries_1395/status/876017254009257984,en
gmanews,2017-06-17 18:01,3,16,9 trapped civilians rescued in marawi,"(['Philippines'], Location((12.7503486, 122.7312101, 0.0)))",,,876016822864285696,https://twitter.com/gmanews/status/876016822864285696,en
DarwinAwardsPH,2017-06-17 18:01,1,1,meet the cop who defied science in marawi,,,,876016819387080704,https://twitter.com/DarwinAwardsPH/status/876016819387080704,en
LOCALNEWSNgayon,2017-06-17 18:00,0,0,task force marawi believes maute fighters are running out of ammunition  read via gma news,"(['Philippines'], Location((12.7503486, 122.7312101, 0.0)))",,,876016740886564864,https://twitter.com/LOCALNEWSNgayon/status/876016740886564864,en
alders_ledge,2017-06-17 18:00,0,0,with disease hunger  people already perishing from both  marawis humanitarian crisis has arrived philippineshttp,,,# #,876016716416811008,https://twitter.com/alders_ledge/status/876016716416811008,en
roquimtisha,2017-06-17 18:00,0,1,marawi city ,"(['ksa / ph'], Location((4.13617025, 9.55242794813, 0.0)))",,,876016637853421568,https://twitter.com/roquimtisha/status/876016637853421568,en
jasminnism,2017-06-17 17:59,1,2,duterte to soldiers i love you all vice pussy robredo hurry up boys im itching to get my hands on the 10b marawi rehabilitation funds,"(['San Junipero'], Location((25.8416418, -100.406909, 0.0)))",,,876016345212571649,https://twitter.com/jasminnism/status/876016345212571649,en
mariaressa,2017-06-17 17:56,0,4,deped provides psych first aid for displaced marawi students via rapplerdotcomhttp,"(['Philippines'], Location((12.7503486, 122.7312101, 0.0)))",@,,876015811768471552,https://twitter.com/mariaressa/status/876015811768471552,en
Danict89,2017-06-17 17:54,5,2,the battle for marawi philippines ibtimesuk visual investigation behind isis influence in southeast asia,"(['London'], Location((51.5073219, -0.1276474, 0.0)))",@,# # # #,876015173756227589,https://twitter.com/Danict89/status/876015173756227589,en
LuisCampos_ST,2017-06-17 17:54,0,0,philippine troops pound islamists as death toll passes 300 philippine troops pounded islamist militants holding parts of southern marawi c,,,,876015148217106432,https://twitter.com/LuisCampos_ST/status/876015148217106432,en
alders_ledge,2017-06-17 17:53,0,0,canada has offered its support to the philippines as marawicrisis drags on marawi,,,# # # #,876014879253045248,https://twitter.com/alders_ledge/status/876014879253045248,en
AranzazuShrine,2017-06-17 17:52,0,0,marawi relief ops continue amid airstrikes,"(['Republic of the Philippines'], Location((12.7503486, 122.7312101, 0.0)))",,,876014724084711424,https://twitter.com/AranzazuShrine/status/876014724084711424,en
ducdemontebello,2017-06-17 17:52,0,0,where does us role in marawi leave dutertes china pivot via scmpnews,,@,,876014558841679873,https://twitter.com/ducdemontebello/status/876014558841679873,en
dianekristel,2017-06-17 17:50,0,1,no im just glad i dont live in marawi etc,,,,876014257912987648,https://twitter.com/dianekristel/status/876014257912987648,en
