ABSCBNNews,2017-06-17 16:00,3,14,government verifying reported deaths among marawi evacuees marawiclash,"(['Manila', ' Philippines'], Location((14.5906216, 120.9799696, 0.0)))",,#,875986376222806016,https://twitter.com/ABSCBNNews/status/875986376222806016,en
PIADesk,2017-06-17 16:00,2,0,for the latest updates  info on the marawi crisis follow the mindanaohour online via fb twitter ig  website,"(['Philippines'], Location((12.7503486, 122.7312101, 0.0)))",,# #,875986374309982208,https://twitter.com/PIADesk/status/875986374309982208,en
prwc_info,2017-06-17 15:59,2,0,of marawi residents notomartiallaw stopairstrikes,,,# #,875986256689328131,https://twitter.com/prwc_info/status/875986256689328131,en
aseanwatch,2017-06-17 15:58,0,1,islamic leaders around marawi fearful of denouncing extreme militants  2d8c,"(['Southeast Asia'], Location((56.0000002, 103.9999998, 0.0)))",,,875985874340663296,https://twitter.com/aseanwatch/status/875985874340663296,en
dannahmaeB,2017-06-17 15:57,0,0,pray for the safety ilonggo soldiers sent to marawi martiallaw marawiheroes stopthewarinmarawi,,,# # #,875985620606214145,https://twitter.com/dannahmaeB/status/875985620606214145,en
BusinessMirror,2017-06-17 15:56,0,1,the government has recently announced that it will allot p10 billion for the rehabilitation of marawi although,"(['Makati', ' Philippines'], Location((14.55459465, 121.021407905, 0.0)))",,,875985427538354176,https://twitter.com/BusinessMirror/status/875985427538354176,en
ANCALERTS,2017-06-17 15:54,5,10,government verifying reported deaths among marawi evacuees u,"(['Philippines'], Location((12.7503486, 122.7312101, 0.0)))",,,875985051304865792,https://twitter.com/ANCALERTS/status/875985051304865792,en
Darzanity,2017-06-17 15:53,0,1,send joven to marawi,"(['Los Angeles', ' CA'], Location((34.054935, -118.244476, 0.0)))",,,875984678070534145,https://twitter.com/Darzanity/status/875984678070534145,en
IAPDefenseForum,2017-06-17 15:50,0,0,philippine troops nab one maute brother in marawi crisis d indoasiapac philippines marawi,,,# # #,875983869253746688,https://twitter.com/IAPDefenseForum/status/875983869253746688,en
DHMrs,2017-06-17 15:48,0,1,marawi city already strongly majority muslim wmuslim mayor now arrested for role in terrorist plotthey want caliphate not civil lib,,,,875983528629907456,https://twitter.com/DHMrs/status/875983528629907456,en
aseanwatch,2017-06-17 15:48,0,0,marawi siege expected to be protracted security source ,"(['Southeast Asia'], Location((56.0000002, 103.9999998, 0.0)))",,,875983352674648064,https://twitter.com/aseanwatch/status/875983352674648064,en
JMonde_23,2017-06-17 15:41,0,0,heartbreaking ilonggo soldiers sent to marawi bids tearful farewell to family,,,,875981823448203264,https://twitter.com/JMonde_23/status/875981823448203264,en
carimaeperez,2017-06-17 15:41,0,0,prayforphilippines pray for marawi,"(['Lipa City', ' Calabarzon'], Location((13.9405848, 121.1375424, 0.0)))",,# #,875981742263291904,https://twitter.com/carimaeperez/status/875981742263291904,en
globnewsen,2017-06-17 15:39,0,0,snipers rpgs molotov cocktails  soldier recalls marawi battle that cost 13 marine lives,,,,875981196374790144,https://twitter.com/globnewsen/status/875981196374790144,en
karishmau,2017-06-17 15:37,0,0,the battle for marawi city,"(['Mumbai', ' India'], Location((19.1334321, 72.8882172, 0.0)))",,,875980769881190401,https://twitter.com/karishmau/status/875980769881190401,en
rupertnotholmes,2017-06-17 15:36,4,6,rapplers info of 59 deaths in evacuation centers in marawi is wrong ha even pna originally cited 59 buti may cache function ang google ,"(['Tralala'], Location((45.5201509, -73.5979382, 0.0)))",,,875980504905822209,https://twitter.com/rupertnotholmes/status/875980504905822209,en
ChaeeunXOX,2017-06-17 15:34,0,0,its in marawi not manila yeah probably soon in manila,"(['Hell'], Location((63.445531, 10.9032872, 0.0)))",,,875979908417069056,https://twitter.com/ChaeeunXOX/status/875979908417069056,en
siennadane7,2017-06-17 15:31,0,0,calling all feu alumni lets us lend our hand to our brave soldiers by supporting feu for marawi campaign details are attached,,,,875979197172170752,https://twitter.com/siennadane7/status/875979197172170752,en
yusufledesma,2017-06-17 15:31,0,0,in fight for marawi city a painful window on war philstarnews,"(['Manila'], Location((14.5906216, 120.9799696, 0.0)))",@,,875979144735191040,https://twitter.com/yusufledesma/status/875979144735191040,en
ershad_tapa,2017-06-17 15:27,0,1,enjoy your us trip lenirobredo you dont need to worry about the people of marawi right leahnavarro mariaressa raissawriter mlq3,"(['Paranaque City', ' National Capit'], Location((49.2086619, -2.0238323, 0.0)))",@ @ @ @ @,,875978104295931905,https://twitter.com/ershad_tapa/status/875978104295931905,en
LitoPerlas,2017-06-17 15:26,0,0,prayforoursoldiers pray for marawi prayformindanao prayforthephilippines prayforthepresident,"(['PH 6000'], Location((10.2819623, 123.8786806, 0.0)))",,# # # # #,875978016547012608,https://twitter.com/LitoPerlas/status/875978016547012608,en
PHLNewsInsider,2017-06-17 15:23,0,0,breakingnewsnowdevelopinggphmilf team rescues three men trapped in heart of marawi on friday via anawalinq onlyinthephilippines,,@,# #,875977284217257984,https://twitter.com/PHLNewsInsider/status/875977284217257984,en
T_witterador,2017-06-17 15:21,0,1,as i said in previously you know tree by its fruit marawi siege 10k ejks  after a year traffic mrt mess did u see lower remittance,,,,875976732737585152,https://twitter.com/T_witterador/status/875976732737585152,en
yudhapati88,2017-06-17 15:18,2,0,philippine air force drop bombs on isislinked militants in marawi via youtube,"(['Belongs to you..'], Location((12.9120498, 80.2287526329, 0.0)))",@,,875975830337314816,https://twitter.com/yudhapati88/status/875975830337314816,en
PHLNewsInsider,2017-06-17 15:17,0,0,breaking news alertspokesman ernesto abella on marawi siege enemy hold areas continue to grow smaller  ncorralesinq impactphilippines,,@,#,875975661503922176,https://twitter.com/PHLNewsInsider/status/875975661503922176,en
PHLNewsInsider,2017-06-17 15:16,0,0,breaking news alertdevelopingspokesman ernesto abella on marawi siege enemy hold areas continue to grow smaller via ncorralesinq,,@,,875975500341977088,https://twitter.com/PHLNewsInsider/status/875975500341977088,en
manoftwit,2017-06-17 15:14,0,0,partner 4 change the battle of marawi attention congressman lagman,,,,875974937252474880,https://twitter.com/manoftwit/status/875974937252474880,en
ashrafd1,2017-06-17 15:12,0,0,not everyone who was with us last ramadan has lived to see this one pray for marawi day26 worldpeace,,,# # #,875974372674093056,https://twitter.com/ashrafd1/status/875974372674093056,en
my_dhok,2017-06-17 15:11,0,1,there are so many intervention that stop the crisis in marawi not to declare martial law immediately and burn down the place,"(['Najran'], Location((18.0, 45.666667, 0.0)))",,,875974116276350977,https://twitter.com/my_dhok/status/875974116276350977,en
ashrafd1,2017-06-17 15:09,0,0,the prophet pbuh said the best charity is that given in ramadan pray for marawi day26 worldpeace,,,# # #,875973777984634880,https://twitter.com/ashrafd1/status/875973777984634880,en
jheffdeleon,2017-06-17 15:09,0,0,i added a video to a youtube playlist some maute militants have reportedly escaped marawi city,,@,,875973740261244928,https://twitter.com/jheffdeleon/status/875973740261244928,en
jheffdeleon,2017-06-17 15:04,0,0,i added a video to a youtube playlist unicef begins recovery program for thousands of displaced marawi,,@,,875972309588332544,https://twitter.com/jheffdeleon/status/875972309588332544,en
bdsaguing,2017-06-17 15:03,0,0,abc reporter injured in marawi city now recovering via davaotoday,"(['Rome', ' Italy'], Location((34.257038, -85.1646726, 0.0)))",@,,875972243892961280,https://twitter.com/bdsaguing/status/875972243892961280,en
mrjohncrowley,2017-06-17 15:03,2,1,the battle for marawi immerse yourself in this piece by my colleague danict89http,"(['London'], Location((51.5073219, -0.1276474, 0.0)))",@,,875972200079208448,https://twitter.com/mrjohncrowley/status/875972200079208448,en
bdsaguing,2017-06-17 15:03,0,0,we see the looming humanitarian crisis as the military operations continue in marawi while the government failed,"(['Rome', ' Italy'], Location((34.257038, -85.1646726, 0.0)))",,,875972027412348930,https://twitter.com/bdsaguing/status/875972027412348930,en
EisaJavier,2017-06-17 14:55,0,1,maranao traditional leaders plead to duterte declare ceasefire stop airstrikes in marawi,"(['Davao City', ' Davao Region'], Location((7.22650725, 125.454887691, 0.0)))",,,875970086867259392,https://twitter.com/EisaJavier/status/875970086867259392,en
ammosexualist,2017-06-17 14:54,0,1,yes fighters for the islamic state took the city in marawi still under siege buy military forces,"(['Michigan', ' United States'], Location((43.6211955, -84.6824346, 0.0)))",,,875969992088592384,https://twitter.com/ammosexualist/status/875969992088592384,en
judeemachow,2017-06-17 14:52,0,6,this marawi crisis is bigger thn ive ever expected,"(['Gen. Santos City', ' Soccsksargen'], Location((14.6207049, 121.0515971, 0.0)))",,,875969300061839360,https://twitter.com/judeemachow/status/875969300061839360,en
mcjwn,2017-06-17 14:48,1,2,china does not care abt marawi and us involvement it is bent on giving us loans to bury us in debt and undermine our sovereign rights,,,,875968428745433089,https://twitter.com/mcjwn/status/875968428745433089,en
MoxieLi,2017-06-17 14:48,0,1,so are you saying altteamafp that only those you like can help the people of marawi you are as divisive as duterte and his trolls,,@,,875968351738011649,https://twitter.com/MoxieLi/status/875968351738011649,en
philippinenews7,2017-06-17 14:47,0,0,some maute militants supporters slipped out of marawi analyst,"(['Philippines'], Location((12.7503486, 122.7312101, 0.0)))",,,875968089858375680,https://twitter.com/philippinenews7/status/875968089858375680,en
LourdesEscaros,2017-06-17 14:46,0,0,zia adiong marawi crisis comm we cannot say when this crisis will be over,,,,875967995457159168,https://twitter.com/LourdesEscaros/status/875967995457159168,en
thus_spake,2017-06-17 14:45,0,0,marawi philippines united states special forces are providing support to the philippine military battling to d,"(['England', ' Great Britain.'], Location((52.7954791, -0.540240286617, 0.0)))",,,875967561002831877,https://twitter.com/thus_spake/status/875967561002831877,en
dzrhnews,2017-06-17 14:45,0,0,icymi malacanang reminds media to take extra caution in covering marawi siege,"(['Manila', ' Philippines'], Location((14.5906216, 120.9799696, 0.0)))",,,875967497652121600,https://twitter.com/dzrhnews/status/875967497652121600,en
ejvb,2017-06-17 14:44,1,5,let us bless marawi my friend and her group will accept donations till june 23 2017 lets all do our part to,,,,875967258304155648,https://twitter.com/ejvb/status/875967258304155648,en
Ivan226622,2017-06-17 14:43,0,0,the temporary shelter shall be constructed for internally displaced persons in marawi  via jorgecarino  abscbn news abscbnnews june ,,,,875967059380842496,https://twitter.com/Ivan226622/status/875967059380842496,en
menchumacapagal,2017-06-17 14:42,0,4,in the middle of buying socks to donate to soldiers in marawi i get a call from my helper saying my shih tzu is giving birth 12,"(['Manila', ' Philippines'], Location((14.5906216, 120.9799696, 0.0)))",,,875966760373018624,https://twitter.com/menchumacapagal/status/875966760373018624,en
carlmicooo,2017-06-17 14:41,0,3,happy fathers day to the real fathers at this moment of war in marawi city our soldiers mabuhay,"(['ph'], Location((12.44249325, 122.160395164, 0.0)))",,#,875966589706805248,https://twitter.com/carlmicooo/status/875966589706805248,en
AntifaBranson,2017-06-17 14:40,1,1,when the battle for marawi is over some very pissed newly homeless maranao are going to take street justice on the maute family c,,,,875966240065499136,https://twitter.com/AntifaBranson/status/875966240065499136,en
ABSCBNNews,2017-06-17 14:39,1,11,the temporary shelter shall be constructed for internally displaced persons in marawi  via jorgecarino,"(['Manila', ' Philippines'], Location((14.5906216, 120.9799696, 0.0)))",@,,875966164907704321,https://twitter.com/ABSCBNNews/status/875966164907704321,en
mylenejacob,2017-06-17 14:36,0,0,cmon amusing himself in the midst of marawi is it okay if the afp chief do the same,"(['Manila', ' Philippines'], Location((14.5906216, 120.9799696, 0.0)))",,,875965450936401920,https://twitter.com/mylenejacob/status/875965450936401920,en
mariyalisa1219,2017-06-17 14:35,0,0,this might be one of those tough times for filipinos but we refuse to back down we are resilient people pray for marawi pilipinaskongmahal,,,# #,875965183415402496,https://twitter.com/mariyalisa1219/status/875965183415402496,en
inquirerdotnet,2017-06-17 14:35,3,6,aleta esperat wife of jimmy esperat pleads help of prrd to bring home her husband alive trapped in marawi,"(['Makati City'], Location((14.5591272, 121.0202094, 0.0)))",,#,875965162628534272,https://twitter.com/inquirerdotnet/status/875965162628534272,en
ivan2266,2017-06-17 14:34,0,0,health officials said 39 evacuees from marawi city have died from various illnesses while in evacuation centers ,"(['Earth'], Location((34.2331373, -102.4107493, 0.0)))",,,875964819425374208,https://twitter.com/ivan2266/status/875964819425374208,en
EhLaeSantos,2017-06-17 14:33,0,2,hi guys if you are willing to help were here for you pray for marawi,,,#,875964633407815680,https://twitter.com/EhLaeSantos/status/875964633407815680,en
kaceybaduria1,2017-06-17 14:31,0,0,marawi update  priest hostage by maute group in marawi city important m via youtube,,@,,875964147246145536,https://twitter.com/kaceybaduria1/status/875964147246145536,en
AyaloweCNA,2017-06-17 14:30,1,2,sgt pacana was shot in the shoulder and chest in marawi it was 2 days before they were able to retrieve him from the battle field,"(['Manila', ' Philippines'], Location((14.5906216, 120.9799696, 0.0)))",,,875963808895741952,https://twitter.com/AyaloweCNA/status/875963808895741952,en
ANCALERTS,2017-06-17 14:30,6,25,unicef begins recovery program for thousands of displaced marawi children dc,"(['Philippines'], Location((12.7503486, 122.7312101, 0.0)))",,,875963726054273025,https://twitter.com/ANCALERTS/status/875963726054273025,en
PhilippineStar,2017-06-17 14:30,2,3,health officials said 39 evacuees from marawi city have died from various illnesses while in evacuation centers,"(['Philippines'], Location((12.7503486, 122.7312101, 0.0)))",,,875963725584502784,https://twitter.com/PhilippineStar/status/875963725584502784,en
SOTTnet,2017-06-17 14:29,0,0,societys child philippines official says jihadist fighters may have escaped marawi city,"(['Global'], Location((43.7283874, -79.3491487932, 0.0)))",,# # #,875963615362383872,https://twitter.com/SOTTnet/status/875963615362383872,en
Ivan226622,2017-06-17 14:28,0,0,now on anc zia adiong spokesperson of crisis management committee in marawi holds press briefing 9  abscbn new,,,,875963331953266688,https://twitter.com/Ivan226622/status/875963331953266688,en
rickrick888,2017-06-17 14:27,0,0,crisis management committee undp to extend help to marawi  live  cnn philippines cnnphilippines june 17 2017,,,,875963047373934592,https://twitter.com/rickrick888/status/875963047373934592,en
ANCALERTS,2017-06-17 14:25,1,7,now on anc zia adiong spokesperson of crisis management committee in marawi holds press briefing,"(['Philippines'], Location((12.7503486, 122.7312101, 0.0)))",,,875962538239721472,https://twitter.com/ANCALERTS/status/875962538239721472,en
rangerperots,2017-06-17 14:24,0,0,weve lost another brave army officer in marawi rest in peace brother,"(['Central Luzon'], Location((15.39091185, 120.685699512, 0.0)))",,,875962454542503936,https://twitter.com/rangerperots/status/875962454542503936,en
ayehsince1992,2017-06-17 14:24,0,0,repacking for marawi student mass celebration and carshow,"(['Trece Martires City', ' Cavite'], Location((14.6649503, 121.0835242, 0.0)))",,,875962281032536064,https://twitter.com/ayehsince1992/status/875962281032536064,en
cnnphilippines,2017-06-17 14:21,1,2,crisis management committee undp to extend help to marawi  live,,,,875961678759731200,https://twitter.com/cnnphilippines/status/875961678759731200,en
rickrick888,2017-06-17 14:21,0,0,crisis management committee nine civilians rescued from danger area in marawi  live  cnn philippines cnnphi,,,,875961553211854848,https://twitter.com/rickrick888/status/875961553211854848,en
Danict89,2017-06-17 14:21,1,0,the battle for marawi philippines ibtimesuk visual investigation behind isis influence in southeast asia ddj,"(['London'], Location((51.5073219, -0.1276474, 0.0)))",@,# # # #,875961466242949120,https://twitter.com/Danict89/status/875961466242949120,en
camilas_brat,2017-06-17 14:20,0,2,international airport sendoff ceremony of 82nd ib to marawi city,"(['at .'], Location((50.6311349, 3.7769485, 0.0)))",@Iloilo,,875961327730032644,https://twitter.com/camilas_brat/status/875961327730032644,en
Bleziel_kun,2017-06-17 14:20,0,0,no legal basis for us joining marawi conflict yet duterte allows it,,,,875961327243624448,https://twitter.com/Bleziel_kun/status/875961327243624448,en
cnnphilippines,2017-06-17 14:16,1,0,crisis management committee nine civilians rescued from danger area in marawi  live,,,,875960413250244608,https://twitter.com/cnnphilippines/status/875960413250244608,en
Pulitika2010,2017-06-17 14:14,0,1,maybe he should visit the evac centers where more people have died than in marawi,"(['Manila', ' Philippines'], Location((14.5906216, 120.9799696, 0.0)))",,,875959767902035969,https://twitter.com/Pulitika2010/status/875959767902035969,en
rickrick888,2017-06-17 14:11,0,0,adiong nine civilians rescued from danger area in marawi bring total number of rescued civilians to 998  live,,,,875959002684903424,https://twitter.com/rickrick888/status/875959002684903424,en
rickrick888,2017-06-17 14:11,0,0,happening now media briefing on marawi crisis  live streaming 0  cnn philippines cnnp,,,,875958993864323072,https://twitter.com/rickrick888/status/875958993864323072,en
rockomajor,2017-06-17 14:07,0,0,take 200 grunts and push through marawi house to house then surrounding areas when you find them kill them,"(['Texas', ' USA / Manila', ' Ph.'], Location((31.8160381, -99.5120986, 0.0)))",,,875958127757213696,https://twitter.com/rockomajor/status/875958127757213696,en
pinoynewsonline,2017-06-17 14:06,0,0,soldiers become emotional as they saying goodbye to their relatives before being deploy in marawi more info 2,"(['Republic of the Philippines'], Location((12.7503486, 122.7312101, 0.0)))",,,875957743978516481,https://twitter.com/pinoynewsonline/status/875957743978516481,en
cnnphilippines,2017-06-17 14:06,5,13,happening now media briefing on marawi crisis  live streaming,,,,875957716090445824,https://twitter.com/cnnphilippines/status/875957716090445824,en
Ann1215S,2017-06-17 14:03,0,0,doh denies 59 marawi evacuees died of various illnesses,"(['Pasay City'], Location((14.5437592, 120.9954657, 0.0)))",,,875957142854877190,https://twitter.com/Ann1215S/status/875957142854877190,en
lyn260392,2017-06-17 14:03,0,0,my prayers for your safety in marawi manong boy godbless trueheroes,"(['Universe'], Location((55.85881005, -4.00208685913, 0.0)))",,# #,875956980162088960,https://twitter.com/lyn260392/status/875956980162088960,en
JackBoardCNA,2017-06-17 14:01,12,6,rooftop vantage point shows more fresh explosions in downtown marawi little respite from the fighting 1,"(['Cambodia'], Location((13.5066394, 104.869423, 0.0)))",,,875956492620357632,https://twitter.com/JackBoardCNA/status/875956492620357632,en
PTVNewsOfficial,2017-06-17 14:00,0,1,residents fleeing marawi saw around 100 bodies philippines official says,"(['Islamabad'], Location((14.5538586, 121.1353647, 0.0)))",,,875956275292405760,https://twitter.com/PTVNewsOfficial/status/875956275292405760,en
Wanda_Ellie,2017-06-17 13:58,0,0,lord please protect our soldiers and policemen marawiclash pray for marawi,"(['New York', ' USA'], Location((40.7306458, -73.9866136, 0.0)))",,# #,875955715348869120,https://twitter.com/Wanda_Ellie/status/875955715348869120,en
JohnLester,2017-06-17 13:56,0,0,isis pouring into philippines from around world trio believed to be on way to join terror group in marawi city ,,,,875955350129840128,https://twitter.com/JohnLester/status/875955350129840128,en
DailyStarPH,2017-06-17 13:55,0,0,dailystarph philippines australian journalist covering marawi siege shot in the neck  u0,"(['Republic of the Philippines'], Location((12.7503486, 122.7312101, 0.0)))",,# #,875955092247252992,https://twitter.com/DailyStarPH/status/875955092247252992,en
KRNGRadio,2017-06-17 13:55,0,0,muslims appeal to duterte for dialogue to end fighting in marawi,"(['Wadsworth', ' Nevada'], Location((41.0256101, -81.7298519, 0.0)))",,,875954932687523840,https://twitter.com/KRNGRadio/status/875954932687523840,en
oppakongmahal,2017-06-17 13:52,0,0,the only thing thats important to these people are their properties for the love of god alam ng gobyerno ang ginagawa nya pray for marawi,,,#,875954246939590656,https://twitter.com/oppakongmahal/status/875954246939590656,en
OccupySchagen,2017-06-17 13:51,0,0,philippine army controls 90 of marawi fighting with isis ongoing via southfronteng,"(['Schagen The Netherlands'], Location((52.784346, 4.78914914517, 0.0)))",@,,875954005049999360,https://twitter.com/OccupySchagen/status/875954005049999360,en
barnabychuck,2017-06-17 13:50,1,0,huge cloud of smoke going up in marawi again,"(['Manila', ' Philippines'], Location((14.5906216, 120.9799696, 0.0)))",,#,875953840129941504,https://twitter.com/barnabychuck/status/875953840129941504,en
julmir8art,2017-06-17 13:50,0,0,where does us role in marawi leave dutertes china pivot,,,,875953709368430592,https://twitter.com/julmir8art/status/875953709368430592,en
PHLNewsOnline,2017-06-17 13:49,0,0,gma news some maute militants supporters slipped out of marawi analyst,"(['Philippines'], Location((12.7503486, 122.7312101, 0.0)))",,,875953418883538944,https://twitter.com/PHLNewsOnline/status/875953418883538944,en
issa_summer,2017-06-17 13:46,0,0,look retired military revealed the alleged plan of the opposition to oust duterte thru marawi crisis,"(['cebu/manila'], Location((14.6096248, 121.0083994, 0.0)))",,,875952858113421312,https://twitter.com/issa_summer/status/875952858113421312,en
cheorcz,2017-06-17 13:46,0,0,525 soldiers will be flying today to marawi city via youtube,,@,,875952781844238339,https://twitter.com/cheorcz/status/875952781844238339,en
SunStarDavao,2017-06-17 13:46,0,0,sunstarnews some 50 families displaced by the siege in marawi city received yesterday the first batch of relief,"(['Davao City', ' Davao Region'], Location((7.22650725, 125.454887691, 0.0)))",,#,875952764257435648,https://twitter.com/SunStarDavao/status/875952764257435648,en
Politiko_Ph,2017-06-17 13:45,9,12,by the numbers rrddavaos marawi conflict is already worse than aquinos zamboanga crisis and its not yet over,,@,,875952610452193281,https://twitter.com/Politiko_Ph/status/875952610452193281,en
BeaaaMichelleee,2017-06-17 13:45,0,1,off to marawi,,,,875952444965920769,https://twitter.com/BeaaaMichelleee/status/875952444965920769,en
WrittenOnWater,2017-06-17 13:43,0,0,isis on a mission to cleanse marawi meaning they are killing all nonmuslims in the area islam,"(['Melbourne', ' Victoria'], Location((-37.8142176, 144.9631608, 0.0)))",,#,875952081735106560,https://twitter.com/WrittenOnWater/status/875952081735106560,en
JackBoardCNA,2017-06-17 13:40,24,16,if i talk about them what will happen why muslim leaders around marawi say they wont denounce isis d,"(['Cambodia'], Location((13.5066394, 104.869423, 0.0)))",,# #,875951202558648320,https://twitter.com/JackBoardCNA/status/875951202558648320,en
Visayanbizpost,2017-06-17 13:39,0,0,over 400 soldiers from visayas heading to marawi city  the standard,"(['Ormoc', ' Philippines'], Location((11.0094099, 124.6075767, 0.0)))",,,875950908189822977,https://twitter.com/Visayanbizpost/status/875950908189822977,en
pia3tarlac,2017-06-17 13:38,0,0,for the latest updates and info on the crisis in marawi including news features videos and photos follow the mindanao hour online,"(['De Leon Building', ' McArthur Highway', ' San Rafael', ' Tarlac City'], Location((16.41561475, 120.59603125, 0.0)))",,#,875950721060847617,https://twitter.com/pia3tarlac/status/875950721060847617,en
PIA_RIII,2017-06-17 13:35,0,0,for the latest updates and information on the crisis in marawi including news features videos and photos,"(['Hyatt Garden Building', ' Dolores', ' City of San Fernando', ' Pampanga'], Location((33.7616238, -84.3866370084, 0.0)))",,#,875949959245250561,https://twitter.com/PIA_RIII/status/875949959245250561,en
BenDeLBB,2017-06-17 13:33,0,0,as clashes continue armm gov lanao sur leader discuss marawi crisis 8,"(['blue planet'], Location((-37.826321, 144.959354, 0.0)))",,,875949401738534912,https://twitter.com/BenDeLBB/status/875949401738534912,en
WhyPhilippines,2017-06-17 13:32,0,0,the 2017 marawi attacks implications for regional security  analysis philippines,,,#,875949357094383617,https://twitter.com/WhyPhilippines/status/875949357094383617,en
shahnonsalleh,2017-06-17 13:32,1,0,trio believed to be on way to join terror group in marawi citydetained,"(['Subang Jaya', ' Malaysia'], Location((3.0567521, 101.5854671, 0.0)))",,,875949186692268032,https://twitter.com/shahnonsalleh/status/875949186692268032,en
maxangelo987,2017-06-17 13:31,0,0,some maute militants supporters slipped out of marawi gmanews,,,#,875949000775655424,https://twitter.com/maxangelo987/status/875949000775655424,en
