WorldNewsNgayon,2017-07-31 23:57,0,0,Philippine troops capture key bridge near Marawi militants http://ift.tt/2vYrw6m  via Yahoo!,"(['Worldwide'], Location((53.4573434, -2.22698994022, 0.0)))",,,892051538075693057,https://twitter.com/WorldNewsNgayon/status/892051538075693057
ggnewsus,2017-07-31 23:56,0,0,Philippine troops capture key bridge near Marawi militants http://ift.tt/2vYrw6m,"(['Mountain View', ' CA'], Location((37.3893889, -122.0832101, 0.0)))",,,892051279484203008,https://twitter.com/ggnewsus/status/892051279484203008
krunox123,2017-07-31 23:53,0,0,Philippine troops capture key bridge near Marawi militants http://ift.tt/2vYrw6m,"(['Not Found'], Location((41.1851881, -122.9240849, 0.0)))",,,892050590083239936,https://twitter.com/krunox123/status/892050590083239936
breaking_news_4,2017-07-31 23:52,0,0,Philippine troops capture key bridge near Marawi militants http://ift.tt/2vYrw6m,,,,892050307164909569,https://twitter.com/breaking_news_4/status/892050307164909569
Anti_tr0ll,2017-07-31 23:48,0,0,The girl and her red shoes: A haunting story from Marawi http://www.aljazeera.com/blogs/asia/2017/07/girl-red-shoes-haunting-story-marawi-170727060503251.html?utm_source=dlvr.it&utm_medium=twitter …pic.twitter.com/KvGB6fdvi6,"(['New York', ' USA'], Location((40.7306458, -73.9866136, 0.0)))",,,892049251429007360,https://twitter.com/Anti_tr0ll/status/892049251429007360
LetUsAllVegan,2017-07-31 23:44,0,0,http://newsinfo.inquirer.net/918257/displaced-kids-view-marawi-terrorists-as-heroes … Displaced kids view Marawi terrorists as heroes,"(['Republika ng Pilipinas'], Location((12.7503486, 122.7312101, 0.0)))",,,892048304766201856,https://twitter.com/LetUsAllVegan/status/892048304766201856
ruslantrad,2017-07-31 23:43,0,0,3 Philippines soldiers were killed while ISIS land mine detonation in # Marawi.,"(['Bulgaria / Middle East'], Location((42.6894409, 23.3302238, 0.0)))",,#,892048129427726336,https://twitter.com/ruslantrad/status/892048129427726336
Joe_America1776,2017-07-31 23:43,0,1,Marawi takeover: A 'wake-up call' to ISIS presence in Pacific # MAGA # TCOThttp://www.michaelsavage.wnd.com/2017/07/marawi-takeover-a-wake-up-call-to-isis-presence-in-pacific/ …,"(['BROOKLYN NEW YORK'], Location((40.6501038, -73.9495823, 0.0)))",,# #,892048085072977920,https://twitter.com/Joe_America1776/status/892048085072977920
sunny19666453,2017-07-31 23:35,0,0,"siteintelgroup https://twitter.com/siteintelgroup/status/892046009387364352 … Filipino IS Operative Calls for Migration to Marawi, Philippines http://tinyurl.com/ya4uxo9z",,,,892046057512808453,https://twitter.com/sunny19666453/status/892046057512808453
siteintelgroup,2017-07-31 23:35,6,0,"Filipino IS Operative Calls for Migration to Marawi, Philippines http://tinyurl.com/ya4uxo9z",,,,892046009387364352,https://twitter.com/siteintelgroup/status/892046009387364352
mariaressa,2017-07-31 23:31,2,0,Military says residents of towns around Marawi can go home via @ rapplerdotcomhttp://s.rplr.co/MAXbY0W,"(['Philippines'], Location((12.7503486, 122.7312101, 0.0)))",@,,892044937331523584,https://twitter.com/mariaressa/status/892044937331523584
ralfely,2017-07-31 23:23,0,0,RT @ Jimparedes: Displaced kids view Marawi terrorists as heroes http://newsinfo.inquirer.net/918257/displaced-kids-view-marawi-terrorists-as-heroes …,"(['Ronda Cebu Ph'], Location((9.9991359, 123.4114146, 0.0)))",@,,892042932705832961,https://twitter.com/ralfely/status/892042932705832961
PCSOLotteryDraw,2017-07-31 23:20,0,0,"I liked a @ YouTube video http://youtu.be/FKNhLhLGQlA?a  Sundalong Hero sa Marawi,kulong dahil nakapatay ng isang Drug Lord",,@,,892042343486042112,https://twitter.com/PCSOLotteryDraw/status/892042343486042112
nolybig,2017-07-31 23:19,0,0,UNTVNewsRescue: RT Construction of transitional shelters in Marawi begins READ: https://www.untvweb.com/news/construction-transitional-shelters-marawi-begins/ …pic.twitter.com/KHnlXvLHMz,,,,892041985980334080,https://twitter.com/nolybig/status/892041985980334080
alders_ledge,2017-07-31 23:12,0,0,"# Japan donates $800,000 for # UNICEF's health and sanitation programs in # Marawi. # MarawiUpdates # Mindanaohttp://globalnation.inquirer.net/159215/japan-donates-800000-unicefs-health-sanitation-programs-marawi …",,,# # # # #,892040301992333312,https://twitter.com/alders_ledge/status/892040301992333312
UNTVNewsRescue,2017-07-31 23:10,1,1,Construction of transitional shelters in Marawi begins READ: https://www.untvweb.com/news/construction-transitional-shelters-marawi-begins/ …pic.twitter.com/2iHi62Uvl8,"(['Quezon City', ' Philippines'], Location((14.6509905, 121.0486155, 0.0)))",,,892039739494223873,https://twitter.com/UNTVNewsRescue/status/892039739494223873
hamassenger,2017-07-31 22:54,0,0,Philippine troops capture key bridge near Marawi militants http://hamassenger.com/2017/07/philippine-troops-capture-key-bridge-near-marawi-militants/ …,"(['The Netherlands'], Location((36.2992331, -89.751194, 0.0)))",,,892035871951794177,https://twitter.com/hamassenger/status/892035871951794177
fiestasaquiapo,2017-07-31 22:53,0,0,Displaced kids view Marawi terrorists as heroes - ASEAN/East Asia ... - The Star Online http://bit.ly/2vfgjAu,"(['Republic of the Philippines'], Location((12.7503486, 122.7312101, 0.0)))",,,892035416009973760,https://twitter.com/fiestasaquiapo/status/892035416009973760
fiestasaquiapo,2017-07-31 22:51,0,0,Nearly half a million displaced by Marawi siege; Major health concerns raised - Manila Bulletin http://bit.ly/2ucb8Nn,"(['Republic of the Philippines'], Location((12.7503486, 122.7312101, 0.0)))",,,892035007396630528,https://twitter.com/fiestasaquiapo/status/892035007396630528
RealtorJairo,2017-07-31 22:51,0,0,Philippine troops capture key bridge near Marawi militants http://fb.me/1pSj7Dlw8,"(['Houston', 'TX'], Location((29.7589382, -95.3676974, 0.0)))",,,892034939247394816,https://twitter.com/RealtorJairo/status/892034939247394816
nikkagrospe,2017-07-31 22:44,0,0,My makeup look just inspired me to do some kind of makeover day for the refugees from Marawi City. Who's with me?,"(['Republic of the Philippines'], Location((12.7503486, 122.7312101, 0.0)))",,,892033254533943297,https://twitter.com/nikkagrospe/status/892033254533943297
inquirer_libre,2017-07-31 22:43,0,0,ARMM weeps for loss of cultural heritage properties in Marawi http://ebx.sh/2wda6Ch,"(['Philippines'], Location((12.7503486, 122.7312101, 0.0)))",,,892032857773936640,https://twitter.com/inquirer_libre/status/892032857773936640
WritesRights,2017-07-31 22:42,0,1,Philippine troops capture key bridge near Marawi militants http://abcn.ws/2uPjMn6  via @ ABC # Mapandi,"(['London'], Location((51.5073219, -0.1276474, 0.0)))",@,#,892032689406169088,https://twitter.com/WritesRights/status/892032689406169088
Jimparedes,2017-07-31 22:42,11,29,Displaced kids view Marawi terrorists as heroes http://newsinfo.inquirer.net/918257/displaced-kids-view-marawi-terrorists-as-heroes …,,,,892032626529148928,https://twitter.com/Jimparedes/status/892032626529148928
OFWupdates,2017-07-31 22:39,0,0,Philippine troops capture key bridge near Marawi militants - ABC News http://dlvr.it/PZnxcd pic.twitter.com/j6lehgi2Ip,"(['Manila', ' Philippines'], Location((14.5906216, 120.9799696, 0.0)))",,,892031914843881473,https://twitter.com/OFWupdates/status/892031914843881473
tempo_english,2017-07-31 22:39,0,1,Wiranto Calls on Five Countries to Drive ISIS from Marawi http://dlvr.it/PZnx7d pic.twitter.com/tUQDdRjZGZ,"(['Jakarta', ' Indonesia'], Location((-6.1753942, 106.827183, 0.0)))",,,892031875690012674,https://twitter.com/tempo_english/status/892031875690012674
Conflictstime,2017-07-31 22:36,0,0,Nearly half a million displaced by Marawi siege; Major health concerns raised - Manila Bulletin http://dlvr.it/PZnw0Y,,,,892031111353704448,https://twitter.com/Conflictstime/status/892031111353704448
Purkins104,2017-07-31 22:29,0,0,Philippine troops capture key bridge near Marawi militants - ABC News - http://abcn.ws/2uPjMn6  via @ ABC,"(['Arkansas', ' USA'], Location((35.2048883, -92.4479108, 0.0)))",@,,892029475050926080,https://twitter.com/Purkins104/status/892029475050926080
kim_casapao,2017-07-31 22:27,0,0,Nasa marawi city,,,,892029054357913601,https://twitter.com/kim_casapao/status/892029054357913601
BalayanM,2017-07-31 22:27,0,0,Humanitarian assistance for the victims of Marawi incident. @ BatangasPNP @ pnpdpcr @ rpiopro4a @ IORC4Apic.twitter.com/2A0zAv8YwF,,@ @ @ @,,892028917330001921,https://twitter.com/BalayanM/status/892028917330001921
SaladinAlDronni,2017-07-31 22:25,7,3,IS claims to have killed 6 AFP soldiers in Marawi today # Philippines,,,#,892028350881030144,https://twitter.com/SaladinAlDronni/status/892028350881030144
JustArhany,2017-07-31 22:24,0,0,Thank you po!! Till next time. We love you Titus John Monterde from yiur TJFs Marawi chapter @ tjmusicmonterde,"(['Philippines'], Location((12.7503486, 122.7312101, 0.0)))",@,,892028121985073153,https://twitter.com/JustArhany/status/892028121985073153
aranetaaa,2017-07-31 22:20,6,67,prayer for peace in marawi and marikina let us form another dove,,,,892027261028769792,https://twitter.com/aranetaaa/status/892027261028769792
ASHS_Sanggu,2017-07-31 22:12,18,15,"The Sanggu-SHS is still accepting donations. Together, let us stretch out our helping hands to our brethren in Marawi. pic.twitter.com/KOXBJMWVeR","(['Katipunan', ' Quezon City'], Location((8.0746134, 123.4340679, 0.0)))",,,892025271640928257,https://twitter.com/ASHS_Sanggu/status/892025271640928257
inquirerdotnet,2017-07-31 22:06,4,4,ARMM weeps for loss of cultural heritage properties in Marawi http://ebx.sh/2eZMFsN,"(['Makati City'], Location((14.5591272, 121.0202094, 0.0)))",,,892023733921165313,https://twitter.com/inquirerdotnet/status/892023733921165313
ella_naddie,2017-07-31 22:05,0,0,"Yesss, you may visit Marawi City hehe","(['Republic of the Philippines'], Location((12.7503486, 122.7312101, 0.0)))",,,892023479406534661,https://twitter.com/ella_naddie/status/892023479406534661
Phil_Reporter,2017-07-31 22:04,0,0,ARMM weeps for loss of cultural heritage properties in Marawi http://fb.me/6cNnEmTkk,"(['Toronto', ' Canada'], Location((43.653963, -79.387207, 0.0)))",,,892023256932339713,https://twitter.com/Phil_Reporter/status/892023256932339713
unicefphils,2017-07-31 22:01,4,13,"Japan's $800k donation will strengthen health, water and sanitation response for children of Marawi: http://uni.cf/2vY6ox8","(['Manila', ' Philippines'], Location((14.5906216, 120.9799696, 0.0)))",,,892022416809091072,https://twitter.com/unicefphils/status/892022416809091072
oHnEL1224,2017-07-31 21:55,0,0,Grade 7 Students Slogan and Poster making.. # PeaceforMarawi # PrayforMarawi,"(['Aliaga', ' Philippines'], Location((40.6735719, -0.7031715, 0.0)))",,# #,892020850370781186,https://twitter.com/oHnEL1224/status/892020850370781186
stateofdnation,2017-07-31 21:52,0,0,"Summer capital of the south, at tahanan ng makulay na kultura-- Ganyan kung ituring ang Islamic City of Marawi...","(['Manila', ' Philippines'], Location((14.5906216, 120.9799696, 0.0)))",,,892020228846002180,https://twitter.com/stateofdnation/status/892020228846002180
fiestasaquiapo,2017-07-31 21:51,0,0,Nearly half a million displaced by Marawi siege; Major health concerns raised - Manila Bulletin http://bit.ly/2vbiRzX,"(['Republic of the Philippines'], Location((12.7503486, 122.7312101, 0.0)))",,,892019861957869571,https://twitter.com/fiestasaquiapo/status/892019861957869571
Politiko_Ph,2017-07-31 21:51,1,0,Only 40 Maute fighters left fighting in Marawi City - @ del_lorenzanahttp://politics.com.ph/40-maute-fighters-left-fighting-marawi-city-lorenzana/ …,,@,,892019770090041345,https://twitter.com/Politiko_Ph/status/892019770090041345
ABSCBNNews,2017-07-31 21:50,3,15,Construction of temporary shelters for Marawi evacuees starts http://bit.ly/2vYlOl0 # MarawiClashpic.twitter.com/0z7CA8Tegc,"(['Manila', ' Philippines'], Location((14.5906216, 120.9799696, 0.0)))",,#,892019520671449088,https://twitter.com/ABSCBNNews/status/892019520671449088
ABSCBNNews,2017-07-31 21:47,1,18,Tingnan: Ilan sa mga narekober na improvised explosive devices o IEDs ng militar sa Marawi City. | @ jeffreyhernaezpic.twitter.com/wf5wWEw0H2,"(['Manila', ' Philippines'], Location((14.5906216, 120.9799696, 0.0)))",@,,892018805836206084,https://twitter.com/ABSCBNNews/status/892018805836206084
myp27,2017-07-31 21:46,0,0,The latest The Faith Journey Daily! http://paper.li/myp27/1318193190?edition_id=b2e869f0-75f6-11e7-b326-0cc47a0d15fd … # philippine # marawi,"(['Abbotsford', ' BC', ' Canada'], Location((49.05227, -122.330017, 0.0)))",,# #,892018719857287168,https://twitter.com/myp27/status/892018719857287168
RK_U2,2017-07-31 21:43,0,0,On Telegram: # Daesh # Marawi pic.twitter.com/bHanoprf9f,"(['Everywhere'], Location((41.7776533, -72.6740756, 0.0)))",,# #,892018005177249793,https://twitter.com/RK_U2/status/892018005177249793
radyopilipinas1,2017-07-31 21:43,0,0,NEWS: DOH eyes to build back better health facilities in Marawi - Sec. Ubial / PNA,"(['Quezon City', ' Philippines'], Location((14.6509905, 121.0486155, 0.0)))",,,892017810691379201,https://twitter.com/radyopilipinas1/status/892017810691379201
LcCopier,2017-07-31 21:38,0,0,"P34 million aid to Marawi, 2 spy planes to help AFP hunt Maute, and Jeff Horn who beat Pacquiao. THANKS AUSTRALIA!",,,,892016544703590400,https://twitter.com/LcCopier/status/892016544703590400
phoenixgold0224,2017-07-31 21:36,0,0,"Dengue, typhoid, diarrhea down 25 soldiers fighting in Marawi http://fb.me/7sTdAw4Il","(['Quezon City', ' Philippines'], Location((14.6509905, 121.0486155, 0.0)))",,,892016121972498433,https://twitter.com/phoenixgold0224/status/892016121972498433
acelvanommen,2017-07-31 21:29,0,1,Just finished recording a song. Isang awit para sa Marawi. I'm happy to be a part of this project together with... http://fb.me/7S6uf0QZK,"(['Philippines'], Location((12.7503486, 122.7312101, 0.0)))",,,892014452677017600,https://twitter.com/acelvanommen/status/892014452677017600
LcCopier,2017-07-31 21:27,0,0,"Many more Filipinas serve in Marawi as PNP scouts, combat nurses, and Army chefs. All of them deserve a respectable Commander-in-Chief.",,,,892013786290282501,https://twitter.com/LcCopier/status/892013786290282501
surrealistjust,2017-07-31 21:26,0,0,Troops to focus on rescue not assault after capturing key Marawi bridge @ PhilstarNews https://shar.es/1TxQah,,@,,892013693176774659,https://twitter.com/surrealistjust/status/892013693176774659
rapplerdotcom,2017-07-31 21:25,3,13,Ground work begins for Marawi relocation site. FULL STORY: http://s.rplr.co/oqdKfok pic.twitter.com/6I9UGGXnIJ,"(['Philippines'], Location((12.7503486, 122.7312101, 0.0)))",,,892013355182850048,https://twitter.com/rapplerdotcom/status/892013355182850048
EagleNewsPH,2017-07-31 21:24,1,2,AFP chief asks Marawi residents to patiently wait until military has cleared city of explosive devices - http://bit.ly/2vf4GsX pic.twitter.com/XpGswLdoQy,"(['Quezon City', 'Philippines'], Location((14.6509905, 121.0486155, 0.0)))",,,892013032519368704,https://twitter.com/EagleNewsPH/status/892013032519368704
Safeture,2017-07-31 21:20,0,0,"Militant activity continues to pose a threat to civilians and tourists in # Marawi and # Mindanao, # Philippineshttp://globalwarningsystem.com/militant-activity-in-marawi-and-mindanao-province/ …","(['Lund', ' Sweden'], Location((55.7029296, 13.1929449, 0.0)))",,# # #,892012039006298112,https://twitter.com/Safeture/status/892012039006298112
ANCALERTS,2017-07-31 21:15,2,7,Construction of temporary shelters for Marawi evacuees starts # MarawiClashhttp://bit.ly/2uMBfOm,"(['Philippines'], Location((12.7503486, 122.7312101, 0.0)))",,#,892010714910543872,https://twitter.com/ANCALERTS/status/892010714910543872
cnnphilippines,2017-07-31 21:12,1,1,# InsideMarawi: Improvised explosive devices recovered in Marawi City | Newsroom live http://cnn.ph/1LXc9jG,,,#,892010108552585218,https://twitter.com/cnnphilippines/status/892010108552585218
pnpunisan,2017-07-31 21:07,0,3,07.31.17 12NN PNP personnel of Unisan Mps conducts 12:00NN Prayer Habit for Peace as our communal prayer for peace in Marawi City. pic.twitter.com/IgocVw7xDO,,,,892008881357897728,https://twitter.com/pnpunisan/status/892008881357897728
1MillionPHL,2017-07-31 21:05,0,0,The very latest news and videos updated every hour (P2.7B needed to rebuild Marawi ...) has been published on http://1millionfilipinos.com/p2-7b-needed-to-rebuild-marawi-health-facilities-ubial-2/ …,,,,892008239612678145,https://twitter.com/1MillionPHL/status/892008239612678145
1MillionPHL,2017-07-31 21:04,0,0,The very latest news and videos updated every hour (P2.7B needed to rebuild Marawi ...) has been published on http://1millionfilipinos.com/p2-7b-needed-to-rebuild-marawi-health-facilities-ubial/ …,,,,892008082129039361,https://twitter.com/1MillionPHL/status/892008082129039361
capt_ejayz,2017-07-31 21:02,1,5,"Good job to the raiding team, no casualties. The government can use them in Marawi.",,,,892007583338291200,https://twitter.com/capt_ejayz/status/892007583338291200
TweetingJihad,2017-07-31 21:01,0,0,Philippine troops capture key bridge near Marawi militants http://abcnews.go.com/International/wireStory/philippine-troops-capture-key-bridge-marawi-militants-48942609 …,,,,892007203170918400,https://twitter.com/TweetingJihad/status/892007203170918400
zandrajamilan,2017-07-31 20:54,2,7,"we already get reservation for this light up wristband, eto sana yung gagamitin sa ptm e, order na kayo, mapupunta to sa marawi victims https://twitter.com/BieberBuyoutPH/status/891644556755615749 …",,,,892005484521074688,https://twitter.com/zandrajamilan/status/892005484521074688
CarloPabale22,2017-07-31 20:51,0,0,"I liked a @ YouTube video http://youtu.be/cg5-65vHJqU?a  Marawi hero, ikinulong matapos makapatay ng drug pusher","(['Philippines'], Location((12.7503486, 122.7312101, 0.0)))",@,,892004670708887552,https://twitter.com/CarloPabale22/status/892004670708887552
zenszei,2017-07-31 20:49,0,1,Thanks! RT: @ tan2sy H1 earnings and # marawi,,@,#,892004329447538689,https://twitter.com/zenszei/status/892004329447538689
EagleNewsPH,2017-07-31 20:48,1,3,"Gov't developing 11-hectare land in Marawi as transitional shelter"" for displaced residents - http://bit.ly/2veRncj pic.twitter.com/t4cGlaQYQU""","(['Quezon City', 'Philippines'], Location((14.6509905, 121.0486155, 0.0)))",,,892003971526787073,https://twitter.com/EagleNewsPH/status/892003971526787073
CARDSdefense,2017-07-31 20:46,0,0,Philippine troops capture key bridge near Marawi militants - ABC News - http://abcn.ws/2uPjMn6  via @ ABC,"(['Arlington', ' VA'], Location((32.701939, -97.1057149358, 0.0)))",@,,892003594014216192,https://twitter.com/CARDSdefense/status/892003594014216192
Daesh_Hunter,2017-07-31 20:37,1,0,Siege of Marawi: Philippines soldiers capture key bridge from Isis fighters http://ibt.uk/A6qkC  via @ IBTimesUK,,@,,892001192804528128,https://twitter.com/Daesh_Hunter/status/892001192804528128
kas_mic,2017-07-31 20:36,0,3,JGH from marawi guys hahahahaha,,,,892000904383045632,https://twitter.com/kas_mic/status/892000904383045632
juysmiyo,2017-07-31 20:34,0,0,Punta ka din sa ... MARAWI andun first love moe ! HAHAH,"(['Feu Manila'], Location((14.6035573, 120.986471087, 0.0)))",,,892000497229381632,https://twitter.com/juysmiyo/status/892000497229381632
jsmnvcnt,2017-07-31 20:32,0,0,calling the attention of all passengers going to marawi,"(['Bulacan', ' Central Luzon'], Location((14.794871, 120.8777119, 0.0)))",,,892000070555639808,https://twitter.com/jsmnvcnt/status/892000070555639808
marikahmei,2017-07-31 20:32,0,2,"wait langdaw, nasa marawi pa si @ kas_mic","(['Agloe', ' New York'], Location((41.9653544, -74.90702, 0.0)))",@,,892000039790231553,https://twitter.com/marikahmei/status/892000039790231553
NewsBossIndia,2017-07-31 20:28,0,0,Philippine troops capture key bridge near Marawi militants.. http://www.tribuneindia.com/news/world/philippine-troops-capture-key-bridge-near-marawi-militants/444885.html …,,,,891999104661807104,https://twitter.com/NewsBossIndia/status/891999104661807104
ZelthromaxRPh,2017-07-31 20:25,0,0,In need daw ng Pharmacist sa Marawi.,,,,891998312659734528,https://twitter.com/ZelthromaxRPh/status/891998312659734528
DefenceNews_SDI,2017-07-31 20:25,0,1,US donates more counterterror weapons for Marawi troops http://news.abs-cbn.com/news/07/29/17/us-donates-more-counterterror-weapons-for-marawi-troops … # DefenceIntelligence,"(['London', ' UK'], Location((51.5073219, -0.1276474, 0.0)))",,#,891998144476655616,https://twitter.com/DefenceNews_SDI/status/891998144476655616
Bam1502,2017-07-31 20:21,0,0,At Provincial Capitol-Marawi City. pic.twitter.com/ISCZO9hCEd,"(['Philippines'], Location((12.7503486, 122.7312101, 0.0)))",,,891997132520955904,https://twitter.com/Bam1502/status/891997132520955904
CarlLimlao,2017-07-31 20:19,0,1,Aw larga na ta pa marawi,"(['City of Tagum', ' Davao Region'], Location((7.4468904, 125.8095771, 0.0)))",,,891996658245918720,https://twitter.com/CarlLimlao/status/891996658245918720
Bam1502,2017-07-31 20:18,0,0,Protection Monitoring & Assessment at Capitol-Marawi City. pic.twitter.com/VOXvjqJLk9,"(['Philippines'], Location((12.7503486, 122.7312101, 0.0)))",,,891996364820721664,https://twitter.com/Bam1502/status/891996364820721664
elginepecson02,2017-07-31 20:17,0,0,Pray for marawi!,"(['mnl'], Location((14.5121499, 121.022046716, 0.0)))",,,891996348639191041,https://twitter.com/elginepecson02/status/891996348639191041
politikovismin,2017-07-31 20:17,0,0,Ben Evardone honors Samar soldier who died in Marawi http://visayas.politics.com.ph/ben-evardone-honors-samar-soldier-died-marawi/ …,,,,891996274311929856,https://twitter.com/politikovismin/status/891996274311929856
boi_gomez,2017-07-31 20:11,0,0,"Youngest Soldier From Allacapan,Cagayan Died Fighting in Marawi City http://fb.me/A9bCY3QU",,,,891994752735903744,https://twitter.com/boi_gomez/status/891994752735903744
channelislam,2017-07-31 20:10,0,0,Displaced Marawi residents allowed to return to peripheries of Philippine City http://ciiradio.com/2017/07/31/displaced-marawi-residents-allowed-to-return-to-peripheries-of-philippine-city/ …pic.twitter.com/cWqkosI5wL,"(['Johannesburg', ' South Africa'], Location((-26.205, 28.049722, 0.0)))",,,891994595269238784,https://twitter.com/channelislam/status/891994595269238784
NEWS957,2017-07-31 20:05,0,0,Philippine troops capture key bridge near Marawi militants - NEWS 95.7 http://www.news957.com/world/2017/07/31/philippine-troops-capture-key-bridge-near-marawi-militants/ …,"(['Halifax', ' Nova Scotia', ' Canada'], Location((53.7229229, -1.8604874, 0.0)))",,,891993096136908801,https://twitter.com/NEWS957/status/891993096136908801
mariakayzelmyka,2017-07-31 20:01,0,6,join us as we do a fund-raising campaign to help the people in marawi city https://m.facebook.com/story.php?story_fbid=156135141609065&id=114724349083478 …pic.twitter.com/gw0VPWwsvr,"(['calapan'], Location((13.4070484, 121.1778479, 0.0)))",,,891992250330128384,https://twitter.com/mariakayzelmyka/status/891992250330128384
pbaconnect,2017-07-31 20:00,2,5,Register now for the # PBARunForACause8 ! Proceeds will go to our Marawi troops & Alagang PBA projects! https://www.facebook.com/pbaofficial/photos/a.168128433203600.46214.168046639878446/1851028088246951/?type=3&theater … # WeArePBApic.twitter.com/fFTtcQL3Xx,"(['philippines'], Location((12.7503486, 122.7312101, 0.0)))",,# #,891992065122455552,https://twitter.com/pbaconnect/status/891992065122455552
Neeshole,2017-07-31 19:59,0,0,"oh, they will deploy healthcare professionals sa Marawi. hmm parang gusto ko to",,,,891991649982611456,https://twitter.com/Neeshole/status/891991649982611456
BMarchadesch,2017-07-31 19:55,0,0,Unnamed Marawi resident leases 11-hectare land to gov't for IDP housing for free - officials https://shar.es/1TxiyI  via @ gmanews,"(['Metro Manila'], Location((14.5736108, 121.0329706, 0.0)))",@,,891990722437562370,https://twitter.com/BMarchadesch/status/891990722437562370
tofutamia,2017-07-31 19:53,12,195,"today, we turned over 1200 malongs to VP Leni Robredo who'll be taking them to Marawi this weekend. thank you to everyone who donated! pic.twitter.com/1fGab6Yuxz",,,,891990234698731521,https://twitter.com/tofutamia/status/891990234698731521
jewel_virata,2017-07-31 19:53,0,0,WHAT THE-- TEACHER KO DATI SA TLE SUNDALO NA PALA AT PAPUNTA NA SA MARAWI LIKE WHAT ///anywho I salute him for that,,,,891990109670617088,https://twitter.com/jewel_virata/status/891990109670617088
manilabulletin,2017-07-31 19:50,4,2,Nearly half a million displaced by Marawi siege; Major health concerns raised - Read: http://bit.ly/2hg2V9D # BeFullyInformed,"(['Manila', ' Philippines'], Location((14.5906216, 120.9799696, 0.0)))",,#,891989323826024448,https://twitter.com/manilabulletin/status/891989323826024448
KaramKarimi,2017-07-31 19:48,0,0,Philippine troops capture key bridge near Marawi militants http://ift.tt/2ubZJgr  http://ift.tt/2wdyAvf,,,,891988922653437952,https://twitter.com/KaramKarimi/status/891988922653437952
HFACorUnum,2017-07-31 19:48,0,1,Japan grants USD800000 to UNICEF to be used in responding to the Marawi crisis: http://globalnation.inquirer.net/159215/japan-donates-800000-unicefs-health-sanitation-programs-marawi …,,,,891988861756231680,https://twitter.com/HFACorUnum/status/891988861756231680
PCRRHPU12,2017-07-31 19:48,0,0,"RHPU 12 led by PCI DANIEL A DEUDA, DRC, turned over the goods to DSWD General Santos City, for the intrnally displced person of Marawi City pic.twitter.com/gLr7jCbTAc",,,,891988825978806277,https://twitter.com/PCRRHPU12/status/891988825978806277
pledis_EXO,2017-07-31 19:46,0,0,"Hm, okay lang. We did a peace walk for the people of Marawi this afternoon and prayed for their safety. Ikaw? Kumusta?",,,,891988449481285634,https://twitter.com/pledis_EXO/status/891988449481285634
