manilabulletin,2017-07-31 11:22,0,0,Brig. Gen. Padilla clarifies that Marawi residents cannot return yet to their homes. LIVE: https://youtu.be/tbr5dz9eqJg,"(['Manila', ' Philippines'], Location((14.5906216, 120.9799696, 0.0)))",,,891861673090310144,https://twitter.com/manilabulletin/status/891861673090310144
manilabulletin,2017-07-31 11:21,0,1,LOOK: Marawi crisis update as of Sunday evening: pic.twitter.com/7EdUXZhI9y,"(['Manila', ' Philippines'], Location((14.5906216, 120.9799696, 0.0)))",,,891861435524931584,https://twitter.com/manilabulletin/status/891861435524931584
RuthAbbey,2017-07-31 11:21,0,0,Padilla reiterates security troops not setting deadline in liberating Marawi City. @ sunstaronline,,@,,891861383532355584,https://twitter.com/RuthAbbey/status/891861383532355584
argyllcyrus_MB,2017-07-31 11:21,0,0,Padilla says AFP are trying to expedite the clearing operations in Marawi City but sets no deadline due to complexities.,"(['Manila City'], Location((14.5906216, 120.9799696, 0.0)))",,,891861338636431360,https://twitter.com/argyllcyrus_MB/status/891861338636431360
inquirerdotnet,2017-07-31 11:19,0,0,Follow @ pctubezaINQ for Marawi updates! More: http://newsinfo.inquirer.net https://twitter.com/pctubezaINQ/status/891860529332879361 …,"(['Makati City'], Location((14.5591272, 121.0202094, 0.0)))",@,,891860900361011200,https://twitter.com/inquirerdotnet/status/891860900361011200
PhilippineStar,2017-07-31 11:19,1,1,Task Force # BangonMarawi spokesman Asec. Toby Purisima says Marawi rapid damage assessment report out soon. | @ alexisbromero,"(['Philippines'], Location((12.7503486, 122.7312101, 0.0)))",@,#,891860778529177601,https://twitter.com/PhilippineStar/status/891860778529177601
argyllcyrus_MB,2017-07-31 11:19,0,0,"Padilla says workers, despite the dangers and risks, are working hard in to prepare the relocation area for the Marawi IDPs.","(['Manila City'], Location((14.5906216, 120.9799696, 0.0)))",,,891860772535402497,https://twitter.com/argyllcyrus_MB/status/891860772535402497
puccanginame,2017-07-31 11:18,0,2,"We all remember our PNP Chief running away from that firecracker. And he wants to join our military in Marawi? 'Pabibo lang',as they say. https://twitter.com/kbomolina/status/891856369401319424 …",,,,891860638418345984,https://twitter.com/puccanginame/status/891860638418345984
pctubezaINQ,2017-07-31 11:18,0,0,AFP spox Brig. Gen. Padilla says clearing ops in Marawi slowed down from 50-100 bldgs a day to 15-20 plus bldgs due to unexploded ordnance. pic.twitter.com/TouqeCkT8A,,,,891860529332879361,https://twitter.com/pctubezaINQ/status/891860529332879361
TeamAFP,2017-07-31 11:18,4,12,"60 Suspicious Individuals Attempting to Sneak to Marawi Nabbed We thank the people for their cooperation even... http://fb.me/91dUSgYMY""","(['Philippines'], Location((12.7503486, 122.7312101, 0.0)))",,,891860482990231553,https://twitter.com/TeamAFP/status/891860482990231553
RuthAbbey,2017-07-31 11:18,0,1,Purisima says government would provide transitional shelters rather than tents to IDPs in Marawi. @ sunstaronline,,@,,891860481027096577,https://twitter.com/RuthAbbey/status/891860481027096577
argyllcyrus_MB,2017-07-31 11:18,0,0,Padilla says even the relocation area for the Marawi IDPs in evacuation centers are being hit by stray bullets.,"(['Manila City'], Location((14.5906216, 120.9799696, 0.0)))",,,891860479563321344,https://twitter.com/argyllcyrus_MB/status/891860479563321344
alexisbromero,2017-07-31 11:18,0,1,Task Force # BangonMarawi spokesman Asec. Toby Purisima says Marawi rapid damage assessment report out soon @ PhilippineStar @ PhilstarNews,"(['Manila'], Location((14.5906216, 120.9799696, 0.0)))",@ @,#,891860476396658688,https://twitter.com/alexisbromero/status/891860476396658688
PhilippineStar,2017-07-31 11:17,0,1,OCD Asec. Purisima: Rapid Analysis & Needs Assessment on Marawi is finished; report ready within the week. | @ xtinamen,"(['Philippines'], Location((12.7503486, 122.7312101, 0.0)))",@,,891860399309508608,https://twitter.com/PhilippineStar/status/891860399309508608
gmanews,2017-07-31 11:17,3,3,AFP Spox BGen. Resty Padilla: a resident who insisted on returning to Marawi City was injured by stray bullet. | via @ Joseph_Morong,"(['Philippines'], Location((12.7503486, 122.7312101, 0.0)))",@,,891860347438510081,https://twitter.com/gmanews/status/891860347438510081
maracepeda,2017-07-31 11:17,2,1,"Ubial says doctors, health personnel from Manila,Visayas have volunteered to help in Marawi,but they don't send them due to language barrier","(['Manila', ' Philippines'], Location((14.5906216, 120.9799696, 0.0)))",,,891860318426587136,https://twitter.com/maracepeda/status/891860318426587136
PhilippineStar,2017-07-31 11:17,1,0,Padilla to Marawi residents: Do not return to your homes yet. | @ alexisbromero,"(['Philippines'], Location((12.7503486, 122.7312101, 0.0)))",@,,891860302777548800,https://twitter.com/PhilippineStar/status/891860302777548800
jpjbencito,2017-07-31 11:17,0,1,"Purisima says Transitional shelters to be provided to Marawi residents, not tent cities","(['Philippines'], Location((12.7503486, 122.7312101, 0.0)))",,,891860245131124736,https://twitter.com/jpjbencito/status/891860245131124736
argyllcyrus_MB,2017-07-31 11:16,0,0,Brig. Gen. Padilla clarifies that Marawi residents cannot return yet to their homes.,"(['Manila City'], Location((14.5906216, 120.9799696, 0.0)))",,,891860137492717568,https://twitter.com/argyllcyrus_MB/status/891860137492717568
RuthAbbey,2017-07-31 11:16,0,1,Purisima: Priority still is the clearing of Marawi City. @ sunstaronline,,@,,891860018793820161,https://twitter.com/RuthAbbey/status/891860018793820161
xtinamen,2017-07-31 11:15,0,1,OCD Asec. Purisima: Rapid Analysis & Needs Assessment on Marawi is finished; report ready within the week.,"(['manila', ' ph'], Location((14.5906216, 120.9799696, 0.0)))",,,891859891664543744,https://twitter.com/xtinamen/status/891859891664543744
MindanaoGSD,2017-07-31 11:15,0,0,Mothers bear brunt of Marawi crisis # MindanaoGoldstarDaily # GoldstarDailyNews @ mindanaogsdhttp://mindanaogoldstardaily.com/mothers-bear-brunt-of-marawi-crisis/ …,"(['Mindanao', ' Philippines'], Location((7.68980415, 125.236399692, 0.0)))",@,# #,891859738421477378,https://twitter.com/MindanaoGSD/status/891859738421477378
j_mreyes,2017-07-31 11:14,1,0,Padilla says only residents outside of Marawi are allowed to return @ Malaya_Online,,@,,891859637988859905,https://twitter.com/j_mreyes/status/891859637988859905
kotawinters,2017-07-31 11:14,0,0,Rufinos could raise P10 billion for Marawi http://www.manilatimes.net/rufinos-could-raise-p10-billion-for-marawi/341581/ …,,,,891859628061069312,https://twitter.com/kotawinters/status/891859628061069312
jpjbencito,2017-07-31 11:14,0,0,Padilla says no tent city being prepared for Marawi City,"(['Philippines'], Location((12.7503486, 122.7312101, 0.0)))",,,891859534829862913,https://twitter.com/jpjbencito/status/891859534829862913
piaranada,2017-07-31 11:13,4,2,AFP Spox Padilla: Stray bullets reaching relocation areas for Marawi residents. Govt' personnel risking their lives to prepare sites.,"(['Philippines'], Location((12.7503486, 122.7312101, 0.0)))",,,891859446858620929,https://twitter.com/piaranada/status/891859446858620929
ABSCBNNews,2017-07-31 11:13,1,0,Padilla says Marawi residents still not allowed to go back to their homes. # MarawiClash | via @ dgplacido,"(['Manila', ' Philippines'], Location((14.5906216, 120.9799696, 0.0)))",@,#,891859434514694144,https://twitter.com/ABSCBNNews/status/891859434514694144
alexisbromero,2017-07-31 11:13,0,0,Padilla to Marawi residents: Do not return to your homes yet @ PhilippineStar @ PhilstarNews,"(['Manila'], Location((14.5906216, 120.9799696, 0.0)))",@ @,,891859375156977664,https://twitter.com/alexisbromero/status/891859375156977664
PTVph,2017-07-31 11:13,1,1,NEWS: AFP now taking steps to curb troop sickness in Marawi http://ptvnews.ph/afp-now-taking-steps-to-curb-troop-sickness-in-marawi/ …,"(['Philippines'], Location((12.7503486, 122.7312101, 0.0)))",,,891859276897042432,https://twitter.com/PTVph/status/891859276897042432
ANCALERTS,2017-07-31 11:12,0,0,Padilla says Marawi residents still not allowed to go back to their homes | @ dgplacido,"(['Philippines'], Location((12.7503486, 122.7312101, 0.0)))",@,,891859081136291840,https://twitter.com/ANCALERTS/status/891859081136291840
cnnphilippines,2017-07-31 11:12,1,0,Padilla: Signal for displaced people to return to their homes only applies to those who reside outside Marawi | # MindanaoHour,,,#,891859011896623104,https://twitter.com/cnnphilippines/status/891859011896623104
dgplacido,2017-07-31 11:12,0,0,Padilla says Marawi residents still not allowed to go back to their homes @ ABSCBNNews,"(['Manila', ' Philippines'], Location((14.5906216, 120.9799696, 0.0)))",@,,891858971971145729,https://twitter.com/dgplacido/status/891858971971145729
piaranada,2017-07-31 11:11,3,1,AFP Spox Padilla appeals to displaced residents of Marawi not to return to their homes just yet bec of danger of unexploded bombs.,"(['Philippines'], Location((12.7503486, 122.7312101, 0.0)))",,,891858957219766272,https://twitter.com/piaranada/status/891858957219766272
Joseph_Morong,2017-07-31 11:11,0,3,AFP Spox BGen. Resty Padilla: a resident who insisted on returning to Marawi City was injured by stray bullet @ gmanews,,@,,891858894338891777,https://twitter.com/Joseph_Morong/status/891858894338891777
icarus1521,2017-07-31 11:11,0,0,Opium of the people in Marawi via @ rapplerdotcomhttp://s.rplr.co/EonT1xB,"(['Big D', ' TX'], Location((44.07153355, -103.256884045, 0.0)))",@,,891858872150917121,https://twitter.com/icarus1521/status/891858872150917121
PhilippineStar,2017-07-31 11:11,0,0,AFP spox BGen Restituto Padilla: Signal for displaced people to return only for those outside Marawi | @ alexisbromero,"(['Philippines'], Location((12.7503486, 122.7312101, 0.0)))",@,,891858721520852992,https://twitter.com/PhilippineStar/status/891858721520852992
jpjbencito,2017-07-31 11:11,0,0,"Padilla says some residents tried to return to their homes, stray bullets still flying all over Marawi City","(['Philippines'], Location((12.7503486, 122.7312101, 0.0)))",,,891858714344308736,https://twitter.com/jpjbencito/status/891858714344308736
RuthAbbey,2017-07-31 11:10,0,0,Padilla: The opening of return of residents are for those who live outside Marawi city itself. @ sunstaronline,,@,,891858701027389441,https://twitter.com/RuthAbbey/status/891858701027389441
PHHotTrends,2017-07-31 11:10,0,0,AFP spox BGen Restituto Padilla: Signal for displaced people to return only for those outside Marawi. | via alexisbromero,"(['Manila City'], Location((14.5906216, 120.9799696, 0.0)))",,,891858697365880832,https://twitter.com/PHHotTrends/status/891858697365880832
PhilstarNews,2017-07-31 11:10,0,0,AFP spox BGen Restituto Padilla: Signal for displaced people to return only for those outside Marawi. | via @ alexisbromero,"(['Manila', ' Philippines'], Location((14.5906216, 120.9799696, 0.0)))",@,,891858466855243776,https://twitter.com/PhilstarNews/status/891858466855243776
RuthAbbey,2017-07-31 11:10,0,0,Padilla says current operation in Marawi City ongoing; asks public's patience as troops aims to retake the besieged city. @ sunstaronline,,@,,891858465873723392,https://twitter.com/RuthAbbey/status/891858465873723392
HASSUQ,2017-07-31 11:09,1,1,Public lecture: # Marawi Crisis and Martial Law in Mindanao. 7 August at @ UQ_News. Register online -> http://bit.ly/2f0k070 pic.twitter.com/trM1Zn4I6W,"(['Brisbane', ' Queensland'], Location((-27.4689682, 153.0234991, 0.0)))",@,#,891858415793782784,https://twitter.com/HASSUQ/status/891858415793782784
ANCALERTS,2017-07-31 11:09,0,2,AFP's Restituto Padilla says clearing of buildings in Marawi has slowed down as troops get closer to main battle area | via @ dgplacido,"(['Philippines'], Location((12.7503486, 122.7312101, 0.0)))",@,,891858383812280320,https://twitter.com/ANCALERTS/status/891858383812280320
alexisbromero,2017-07-31 11:09,0,0,AFP spox BGen Restituto Padilla: Signal for displaced people to return only for those outside Marawi @ PhilstarNews @ PhilippineStar,"(['Manila'], Location((14.5906216, 120.9799696, 0.0)))",@ @,,891858349037191168,https://twitter.com/alexisbromero/status/891858349037191168
Joseph_Morong,2017-07-31 11:09,0,1,AFP Spox B/Gen. Resty Padilla: evacuees are still not allowed to return to Marawi City @ gmanewspic.twitter.com/zPlFTPSwY5,,@,,891858261800095744,https://twitter.com/Joseph_Morong/status/891858261800095744
jpjbencito,2017-07-31 11:09,0,0,Padilla: Those living in Marawi City still not allowed to return to their homes,"(['Philippines'], Location((12.7503486, 122.7312101, 0.0)))",,,891858260835287040,https://twitter.com/jpjbencito/status/891858260835287040
NDRRMC_OpCen,2017-07-31 11:08,1,1,Task Force Bangon Marawi Spokesperson Asec Toby Purisima live in today's Mindanao Hour at Malacanan. # BangonMarawi http://ow.ly/rbfk30e1RlL,"(['Camp Aguinaldo', ' Quezon City'], Location((14.6065379, 121.063758836, 0.0)))",,#,891858199409602561,https://twitter.com/NDRRMC_OpCen/status/891858199409602561
civildefensePH,2017-07-31 11:08,2,3,Task Force Bangon Marawi Spokesperson Asec Toby Purisima live in today's Mindanao Hour at Malacanan. # BangonMarawi http://ow.ly/rbfk30e1RlL,"(['Camp Aguinaldo', ' Quezon City'], Location((14.6065379, 121.063758836, 0.0)))",,#,891858199241924608,https://twitter.com/civildefensePH/status/891858199241924608
piaranada,2017-07-31 11:08,1,0,AFP Spox Padilla clarifies erroneous news reports: Only residents of towns outside Marawi City allowed to go back to homes. @ rapplerdotcom,"(['Philippines'], Location((12.7503486, 122.7312101, 0.0)))",@,,891858168036208641,https://twitter.com/piaranada/status/891858168036208641
ABSCBNNews,2017-07-31 11:07,1,3,AFP's Restituto Padilla says clearing of buildings in Marawi has slowed down as troops get closer to main battle area | via @ dgplacido,"(['Manila', ' Philippines'], Location((14.5906216, 120.9799696, 0.0)))",@,,891857768403025920,https://twitter.com/ABSCBNNews/status/891857768403025920
cnnphilippines,2017-07-31 11:06,0,1,AFP Spokesperson B/Gen Restituto Padilla: IEDs slowing down clearing operations in Marawi City | # MindanaoHour live http://bit.ly/2v9OB8l,,,#,891857595421474816,https://twitter.com/cnnphilippines/status/891857595421474816
ABSCBNNews,2017-07-31 11:06,2,9,Palace says 9 more terrorists were killed in Marawi City # MarawiClash pic.twitter.com/Gj5LSyiUAW | via @ dgplacido,"(['Manila', ' Philippines'], Location((14.5906216, 120.9799696, 0.0)))",@,#,891857544494198788,https://twitter.com/ABSCBNNews/status/891857544494198788
dgplacido,2017-07-31 11:06,0,0,AFP spokeserson Restituto Padilla says clearing of buildings in Marawi has slowed down as troops get closer to main battle area @ ABSCBNNews,"(['Manila', ' Philippines'], Location((14.5906216, 120.9799696, 0.0)))",@,,891857521370996736,https://twitter.com/dgplacido/status/891857521370996736
ANCALERTS,2017-07-31 11:06,1,12,Palace says 9 more terrorists were killed in Marawi City | @ dgplacidopic.twitter.com/4gM7Fz1k00,"(['Philippines'], Location((12.7503486, 122.7312101, 0.0)))",@,,891857462751395841,https://twitter.com/ANCALERTS/status/891857462751395841
argyllcyrus_MB,2017-07-31 11:04,0,0,Marawi crisis update as of Sunday evening. pic.twitter.com/1EXfFcrCNN,"(['Manila City'], Location((14.5906216, 120.9799696, 0.0)))",,,891857173399052288,https://twitter.com/argyllcyrus_MB/status/891857173399052288
yusufledesma,2017-07-31 11:04,0,0,@ inquirerdotnet ARMM weeps for loss of cultural heritage properties in Marawi http://lifestyle.inquirer.net/269579/armm-weeps-loss-cultural-heritage-properties-marawi/ …,"(['Manila'], Location((14.5906216, 120.9799696, 0.0)))",@,,891856947648974848,https://twitter.com/yusufledesma/status/891856947648974848
dgplacido,2017-07-31 11:03,0,0,Palace says 9 more terrorists were killed in Marawi City @ ABSCBNNewspic.twitter.com/BMZ6o0SrQm,"(['Manila', ' Philippines'], Location((14.5906216, 120.9799696, 0.0)))",@,,891856791067279360,https://twitter.com/dgplacido/status/891856791067279360
pnagovph,2017-07-31 11:00,0,0,@ TeamAFP now taking steps to curb troop sickness in Marawi | @ PriamN | http://www.pna.gov.ph/articles/1003816 …pic.twitter.com/RFzcjclLTO,"(['Quezon City'], Location((14.6509905, 121.0486155, 0.0)))",@ @,,891856066664779776,https://twitter.com/pnagovph/status/891856066664779776
gmanewsfacebook,2017-07-31 11:00,0,0,"Despite the ongoing hostilities in Marawi City, local government officials have decided to begin rehabilitation... http://fb.me/3sTVCZRO1",,,,891855955444482050,https://twitter.com/gmanewsfacebook/status/891855955444482050
Chislon_Bolanos,2017-07-31 10:58,1,7,"# BarangayTibay's Benefit Show for Marawi Soldiers. See you on Aug 4 (Fri), 8PM at @ SaguijoOfficialpic.twitter.com/OrtYvcHGHo","(['Republic of the Philippines'], Location((12.7503486, 122.7312101, 0.0)))",@,#,891855483992104960,https://twitter.com/Chislon_Bolanos/status/891855483992104960
jdesignz,2017-07-31 10:54,0,0,Rehabilitation to begin in Marawi City despite ongoing conflict http://ift.tt/2vWNsij  http://ift.tt/eA8V8J,,,,891854556715503616,https://twitter.com/jdesignz/status/891854556715503616
LOCALNEWSNgayon,2017-07-31 10:52,0,0,Rehabilitation to begin in Marawi City despite ongoing conflict | Read: http://ift.tt/2vWNsij  via GMA News,"(['Philippines'], Location((12.7503486, 122.7312101, 0.0)))",,,891854000559185921,https://twitter.com/LOCALNEWSNgayon/status/891854000559185921
raffytima,2017-07-31 10:50,38,127,"Temporary housing project in Brgy Sagonsongan now being preped for Marawi evacuees, 1st 2 phases good for 900 coco lumber & steel shelters. pic.twitter.com/R8ezOwx6eZ","(['Manila', ' Philippines'], Location((14.5906216, 120.9799696, 0.0)))",,,891853653031534592,https://twitter.com/raffytima/status/891853653031534592
santostinaINQ,2017-07-31 10:46,0,0,Marawi siege is one of the biggest displacement not caused by natural disaster--DOH Sec Paulyn Ubial,,,,891852606716264449,https://twitter.com/santostinaINQ/status/891852606716264449
emmzztrinidad,2017-07-31 10:42,42,60,Ready n kame sa Sunday ni @ apd_aurea 4 Marawi Concert.See you Direk @ Alco_Guerrero @ voltsvallejo and @ MissMarisRacal MarNigoMMK SaSabadoNapic.twitter.com/NsrIaf8PkZ,"(['Dasmarinas', ' Calabarzon'], Location((14.6455597, 120.9995684, 0.0)))",@ @ @ @,,891851427332603904,https://twitter.com/emmzztrinidad/status/891851427332603904
ACTEDPH,2017-07-31 10:35,0,1,Check out our July Newsletter for latest updates: http://www.acted.org/en/acted-philippines-monthly-newsletters … # Marawi # shelter # Philippines,,,# # #,891849757299167232,https://twitter.com/ACTEDPH/status/891849757299167232
mbsportsonline,2017-07-31 10:20,0,0,Marawi kids join games http://dlvr.it/PZh05S # MBSportsOnline,"(['Manila', ' Philippines'], Location((14.5906216, 120.9799696, 0.0)))",,#,891845908534411264,https://twitter.com/mbsportsonline/status/891845908534411264
maracepeda,2017-07-31 10:19,1,2,Ubial: We have mobilized around P95 million in terms of assistance in terms of supplies and meds to the Marawi conflict,"(['Manila', ' Philippines'], Location((14.5906216, 120.9799696, 0.0)))",,,891845637343297538,https://twitter.com/maracepeda/status/891845637343297538
PhilippineStar,2017-07-31 10:19,0,0,@ Dok_Pau: Much better health system will be rebuilt in Marawi.,"(['Philippines'], Location((12.7503486, 122.7312101, 0.0)))",@,,891845626484228096,https://twitter.com/PhilippineStar/status/891845626484228096
manilabulletin,2017-07-31 10:17,0,1,Ubial: Marawi siege is one of the largest displacements in PH history which is not caused by natural disaster.,"(['Manila', ' Philippines'], Location((14.5906216, 120.9799696, 0.0)))",,,891845232886558720,https://twitter.com/manilabulletin/status/891845232886558720
shecrisostomo,2017-07-31 10:17,0,0,. @ Dok_Pau: Much better health system will be rebuilt in Marawi. @ PhilippineStar,"(['Philippines'], Location((12.7503486, 122.7312101, 0.0)))",@ @,,891845175084961793,https://twitter.com/shecrisostomo/status/891845175084961793
maracepeda,2017-07-31 10:16,1,0,Ubial: We estimated P2.7 billion for infrastructure of damaged health facilities in Marawi,"(['Manila', ' Philippines'], Location((14.5906216, 120.9799696, 0.0)))",,,891844895375110144,https://twitter.com/maracepeda/status/891844895375110144
MBChaEchaluce,2017-07-31 10:12,0,0,Ubial: Marawi siege is one of the largest displacement in PH history which is not caused by natural disaster.,,,,891843982400999426,https://twitter.com/MBChaEchaluce/status/891843982400999426
PhilippineStar,2017-07-31 10:11,2,1,DOH Sec. @ Dok_Pau: Marawi siege - one of the biggest displacement in Phil. history not caused by natural disaster.,"(['Philippines'], Location((12.7503486, 122.7312101, 0.0)))",@,,891843707279876096,https://twitter.com/PhilippineStar/status/891843707279876096
maracepeda,2017-07-31 10:09,1,4,"Ubial says as early as May 24, DOH already set up an incident command area to address health needs of Marawi residents","(['Manila', ' Philippines'], Location((14.5906216, 120.9799696, 0.0)))",,,891843315712180224,https://twitter.com/maracepeda/status/891843315712180224
shecrisostomo,2017-07-31 10:07,1,0,DOH Sec. @ Dok_Pau: Marawi siege - one of the biggest displacement in Phil. history not caused by natural disaster. @ PhilippineStar,"(['Philippines'], Location((12.7503486, 122.7312101, 0.0)))",@ @,,891842844159205378,https://twitter.com/shecrisostomo/status/891842844159205378
docshymee,2017-07-31 10:07,0,7,"Grabe, 70th day na ng Marawi Siege. This is probably the longest siege in our country post WWII.","(['PH'], Location((12.44249325, 122.160395164, 0.0)))",,,891842800286695424,https://twitter.com/docshymee/status/891842800286695424
abell_0,2017-07-31 10:00,0,0,http://newsinfo.inquirer.net/918257/displaced-kids-view-marawi-terrorists-as-heroes … Some displaced children from # Marawi sees IS (Islamic State) as heroes.,"(['Jakarta Capital Region', ' Indonesia'], Location((-6.1753942, 106.827183, 0.0)))",,#,891841074313928704,https://twitter.com/abell_0/status/891841074313928704
dbecphilippines,2017-07-31 10:00,0,2,Relief Drive for Marawi l http://ow.ly/b8Dn30e1d7B pic.twitter.com/7Bcu4pPmgp,"(['Philippines'], Location((12.7503486, 122.7312101, 0.0)))",,,891840940343775233,https://twitter.com/dbecphilippines/status/891840940343775233
jrblapid_2001,2017-07-31 10:00,0,1,StartingAug.2PBA Gen Ad tickets will be 30peoes proceeds will help Marawi victims. @ PUSO2019 We R PBA,"(['Quezon city philippines'], Location((14.6509905, 121.0486155, 0.0)))",@,,891840858340720640,https://twitter.com/jrblapid_2001/status/891840858340720640
fiestasaquiapo,2017-07-31 09:58,0,0,Displaced kids view Marawi terrorists as heroes - ASEAN/East Asia ... - The Star Online http://bit.ly/2vdepA5,"(['Republic of the Philippines'], Location((12.7503486, 122.7312101, 0.0)))",,,891840496506687488,https://twitter.com/fiestasaquiapo/status/891840496506687488
maracepeda,2017-07-31 09:57,2,0,Ubial: We're on 70th day of armed conflict in Marawi & there are many health impacts of this armed conflict in that part of the country.,"(['Manila', ' Philippines'], Location((14.5906216, 120.9799696, 0.0)))",,,891840189617676292,https://twitter.com/maracepeda/status/891840189617676292
dzrhlucena,2017-07-31 09:54,0,0,Soldiers suffer from sickness amid on-going Marawi siege http://dzrhnews.com.ph/soldiers-fighting-vs-maute-group-get-sick-marawi/ …,,,,891839425474437120,https://twitter.com/dzrhlucena/status/891839425474437120
PTVisMin,2017-07-31 09:45,0,0,ON THE SPOT: Benefit concert para sa mga biktima ng Marawi Seige http://dai.ly/x5vcpoy,,,,891837071890948097,https://twitter.com/PTVisMin/status/891837071890948097
PTVph,2017-07-31 09:45,1,5,ON THE SPOT: Benefit concert para sa mga biktima ng Marawi Seige http://dai.ly/x5vcpoy,"(['Philippines'], Location((12.7503486, 122.7312101, 0.0)))",,,891837066081738752,https://twitter.com/PTVph/status/891837066081738752
pbaconnect,2017-07-31 09:43,1,15,"PBA to help Marawi victims, reduce ticket rates READ: http://www.pba.ph/news/pba-to-help-marawi-victims-reduce-ticket-rates … # WeArePBApic.twitter.com/XXmLyoNX6n","(['philippines'], Location((12.7503486, 122.7312101, 0.0)))",,#,891836606314725376,https://twitter.com/pbaconnect/status/891836606314725376
iammarcosparin,2017-07-31 09:39,0,0,'Marawi Should Be a Wake-Up Call': USPACOM Head Warns of Daesh Migration to Asia http://fb.me/36ax2g54b,"(['Manila City'], Location((14.5906216, 120.9799696, 0.0)))",,,891835775876300802,https://twitter.com/iammarcosparin/status/891835775876300802
pagasaisland,2017-07-31 09:39,0,0,'Marawi Should Be a Wake-Up Call': USPACOM Head Warns of Daesh Migration to Asia http://fb.me/1C2TT3eQ8,"(['Republic of the Philippines'], Location((12.7503486, 122.7312101, 0.0)))",,,891835717546115072,https://twitter.com/pagasaisland/status/891835717546115072
1kityoung,2017-07-31 09:39,1,0,'Marawi Should Be a Wake-Up Call': USPACOM Head Warns of Daesh Migration to Asia http://fb.me/2ejuSShaE,"(['Traveler'], Location((46.0728918, -68.8449378, 0.0)))",,,891835593071763460,https://twitter.com/1kityoung/status/891835593071763460
Motoogoose,2017-07-31 09:35,0,1,Key terror leader in Marawi reported killed &mdash;AFP http://www.gmanetwork.com/news/news/nation/620027/key-terror-leader-in-marawi-reported-killed-afp/story#sthash.1N2mwuoK.uxfs … via @ gmanews,"(['Quezon City', ' Philippines'], Location((14.6509905, 121.0486155, 0.0)))",@,#sthash,891834584316338177,https://twitter.com/Motoogoose/status/891834584316338177
EagleNewsPH,2017-07-31 09:34,1,3,News in photo: Senator Pacquiao boosts gov't troops' morale in Marawi - http://bit.ly/2vcZ6r2 pic.twitter.com/Hv6BE40WKV,"(['Quezon City', 'Philippines'], Location((14.6509905, 121.0486155, 0.0)))",,,891834479651807232,https://twitter.com/EagleNewsPH/status/891834479651807232
