AlohaSummit,2017-07-31 13:51,0,0,Philippine troops capture key bridge near Marawi militants http://bit.ly/2tVo7Ib,,,,891899177751388160,https://twitter.com/AlohaSummit/status/891899177751388160
KawalPH,2017-07-31 13:48,0,0,"7 civilians posing as police, military personnel nabbed in Marawi http://fb.me/27JAgpyDX","(['Manila', 'Philippines'], Location((14.5906216, 120.9799696, 0.0)))",,,891898378099052544,https://twitter.com/KawalPH/status/891898378099052544
PhilippineStar,2017-07-31 13:47,0,7,WATCH: Health secretary Paulyn Ubial discusses DOH's rehabilitation plan for Marawi City. | via @ shecrisostomopic.twitter.com/QVcjfX1vqW,"(['Philippines'], Location((12.7503486, 122.7312101, 0.0)))",@,,891898215879946240,https://twitter.com/PhilippineStar/status/891898215879946240
LOCALNEWSNgayon,2017-07-31 13:47,0,0,Resident hit by stray bullet after returning to Marawi | Read: http://ift.tt/2f0ayAo  via GMA News,"(['Philippines'], Location((12.7503486, 122.7312101, 0.0)))",,,891898085978365952,https://twitter.com/LOCALNEWSNgayon/status/891898085978365952
gmanews,2017-07-31 13:46,16,120,Solenn Heussaff visited soldiers of Marawi a second time and it changed her life http://gmane.ws/2f0lhuv,"(['Philippines'], Location((12.7503486, 122.7312101, 0.0)))",,,891897715029889025,https://twitter.com/gmanews/status/891897715029889025
acpadilla82,2017-07-31 13:44,0,0,"IDPs outside Marawi can return to homes # InTheLoop # CignalTVrt@bloombergtvphbloombergtvph https://twitter.com/bloombergtvph/status/891896447183994880 … July 30, 2017 at 07:40PM","(['1 Commonwealth Ln', ' Singapore 149544'], Location((1.3047676, 103.7962879, 0.0)))",@bloombergtvphbloombergtvph,# #,891897268596559872,https://twitter.com/acpadilla82/status/891897268596559872
AICSFlashNews,2017-07-31 13:42,0,0,Marawi Islamists appeal to volunteers - Philippines pic.twitter.com/U6uyzv59Td,"(['Madrid - Spain'], Location((40.4167047, -3.7035825, 0.0)))",,,891896894699577348,https://twitter.com/AICSFlashNews/status/891896894699577348
AICSpain,2017-07-31 13:41,1,0,Marawi Islamists appeal to volunteers - Philippines pic.twitter.com/IVTNgVklGs,"(['Madrid'], Location((40.4167047, -3.7035825, 0.0)))",,,891896679322005504,https://twitter.com/AICSpain/status/891896679322005504
bloombergtvph,2017-07-31 13:40,0,0,IDPs outside Marawi can return to homes # InTheLoop # CignalTV,"(['Republic of the Philippines'], Location((12.7503486, 122.7312101, 0.0)))",,# #,891896447183994880,https://twitter.com/bloombergtvph/status/891896447183994880
senatePH,2017-07-31 13:40,0,1,"Senator Manny Paquiao, the first among the incumbent senators to visit the Marawi war zone, lifts the spirits of... http://fb.me/zqhTI6Wy","(['Pasay City', ' Philippines'], Location((14.5437592, 120.9954657, 0.0)))",,,891896335913373697,https://twitter.com/senatePH/status/891896335913373697
PHHotTrends,2017-07-31 13:40,0,0,"NPC, SM Cares link up for troops in Marawi https://shar.es/1Tx2of","(['Manila City'], Location((14.5906216, 120.9799696, 0.0)))",,,891896236357431299,https://twitter.com/PHHotTrends/status/891896236357431299
PhilstarNews,2017-07-31 13:37,1,1,"NPC, SM Cares link up for troops in Marawi https://shar.es/1Tx2of","(['Manila', ' Philippines'], Location((14.5906216, 120.9799696, 0.0)))",,,891895556477288449,https://twitter.com/PhilstarNews/status/891895556477288449
WinterFierce17,2017-07-31 13:36,1,0,Thank you direk! Sa support sa Marnigo! Hahaha support din kami kay Maris and Volts para sa Awit sa Marawi MarNigoMMK SaSabadoNa,,,,891895428991430656,https://twitter.com/WinterFierce17/status/891895428991430656
AndySam4780,2017-07-31 13:35,0,1,"concert for a cause for our kapamilyas in Marawi August 6,2017 w/ @ XianLimm together w/ other artists @ OneMusicPHpic.twitter.com/olVtw95nxF",,@ @,,891895046433370112,https://twitter.com/AndySam4780/status/891895046433370112
myurvanshoes,2017-07-31 13:34,0,0,Marawi PH Troops http://fb.me/2fdosfGzU,"(['Republic of the Philippines'], Location((12.7503486, 122.7312101, 0.0)))",,,891894829138927621,https://twitter.com/myurvanshoes/status/891894829138927621
senatePH,2017-07-31 13:32,0,0,"Rebuilding Life in Marawi"" is a fund raising concert for the most vulnerable people affected by the crisis in... http://fb.me/8fofLgR7J""","(['Pasay City', ' Philippines'], Location((14.5437592, 120.9954657, 0.0)))",,,891894361612582912,https://twitter.com/senatePH/status/891894361612582912
SuicideSqD0815,2017-07-31 13:29,1,0,marawi has become melting pot of asean base isil jihadis camp.. sabah only platform that creats work /money ..like Aceh Gam wt malaysia,,,,891893544989765632,https://twitter.com/SuicideSqD0815/status/891893544989765632
dzrhnews,2017-07-31 13:27,3,3,"LOOK: # Marawicrisis: Pabahay para sa mga biktima ng bakbakan sa Marawi, minamadali na para matirahan | Photo credit: Joint Task Force-Marawi pic.twitter.com/PslfUBE9zY","(['Manila', ' Philippines'], Location((14.5906216, 120.9799696, 0.0)))",,#,891892933846122496,https://twitter.com/dzrhnews/status/891892933846122496
OFWWATCH,2017-07-31 13:26,0,0,Solenn Heussaff visited soldiers of Marawi a second time and it changed her life https://shar.es/1Txr6W  via @ gmanews,"(['Davao City', ' Philippines'], Location((7.22650725, 125.454887691, 0.0)))",@,,891892755357589504,https://twitter.com/OFWWATCH/status/891892755357589504
DZRJ810AM,2017-07-31 13:18,2,0,NEWS: The number of Maute Group members left in Marawi City is down to about 30 to 40 fighters as government... http://fb.me/6k1gWKjgZ,"(['Makati City', ' Philippines'], Location((14.5591272, 121.0202094, 0.0)))",,,891890698605260801,https://twitter.com/DZRJ810AM/status/891890698605260801
dzrhnews,2017-07-31 13:17,0,0,"LOOK: # Marawicrisis: Pabahay para sa mga biktima ng bakbakan sa Marawi, minamadali na para matirahan | Photo credit: Joint Task Force-Marawi pic.twitter.com/p7k1aa1DbB","(['Manila', ' Philippines'], Location((14.5906216, 120.9799696, 0.0)))",,#,891890609241206784,https://twitter.com/dzrhnews/status/891890609241206784
crvallejos,2017-07-31 13:17,0,0,News in photo: Senator Pacquiao boosts gov't troops' morale in Marawi http://fb.me/uPUfj00d,"(['Manila'], Location((14.5906216, 120.9799696, 0.0)))",,,891890574193831936,https://twitter.com/crvallejos/status/891890574193831936
phnews24x7,2017-07-31 13:06,0,0,Rehabilitation to begin in Marawi City despite ongoing conflict | http://bit.ly/2vknFDF # PHNewspic.twitter.com/64yaEylJux,"(['Philippines'], Location((12.7503486, 122.7312101, 0.0)))",,#,891887858344091649,https://twitter.com/phnews24x7/status/891887858344091649
myriadbuff,2017-07-31 13:05,0,0,# Marawi # MartialLaw # terrorismhttps://twitter.com/dimkumg0ld/status/891880277940682756 …,"(['Davao', ' Philippines'], Location((7.0645241, 125.6084143, 0.0)))",,# # #,891887501622755328,https://twitter.com/myriadbuff/status/891887501622755328
fmtoday,2017-07-31 13:03,0,0,"No Marawi IS threat in Sabah, says Umno minister https://shar.es/1TxgSo","(['\xc3\x9cT: 3.099457', '101.681025'], Location((47.8754752, -93.8189718, 0.0)))",,,891886944451313664,https://twitter.com/fmtoday/status/891886944451313664
DavidAnanth,2017-07-31 13:00,0,0,"http://myiTimes.com  - No Marawi IS threat in Sabah, says Umno minister http://ow.ly/LyzZ50d7OZV","(['Kuala Lumpur', ' Malaysia'], Location((0.642715, 122.5909774, 0.0)))",,,891886322943758336,https://twitter.com/DavidAnanth/status/891886322943758336
MaharLily,2017-07-31 12:53,0,1,Missing you Marawi.,"(['KOREA'], Location((36.5581914, 127.9408564, 0.0)))",,,891884549377892353,https://twitter.com/MaharLily/status/891884549377892353
MaharLily,2017-07-31 12:53,0,0,"why so hot Iligan? Then, why raining so hard in Marawi? bakiiit???","(['KOREA'], Location((36.5581914, 127.9408564, 0.0)))",,,891884435301212161,https://twitter.com/MaharLily/status/891884435301212161
Haunted_Backlog,2017-07-31 12:51,1,1,Only 5% Muslims in the Philippines and look what's happening in Marawi,,,,891884080379211776,https://twitter.com/Haunted_Backlog/status/891884080379211776
MlaStandard,2017-07-31 12:45,0,0,Stray bullet hits a civilian in Marawi City. http://manilastandard.net/mobile/article/243262 …,"(['Manila', ' Philippines'], Location((14.5906216, 120.9799696, 0.0)))",,,891882394524844032,https://twitter.com/MlaStandard/status/891882394524844032
dimkumg0ld,2017-07-31 12:36,1,2,"People, you shouldn't really mark yourself safe"" if you're actually not in # Marawi right now. It'll just...More at: https://www.facebook.com/myriadbuff/posts/494528527552310 …""","(['Cebu', ' Philippines'], Location((10.45, 123.84, 0.0)))",,#,891880277940682756,https://twitter.com/dimkumg0ld/status/891880277940682756
euniceanne17,2017-07-31 12:33,0,0,Solenn Heussaff visited soldiers of Marawi a second time and it changed her life http://dlvr.it/PZhqzw,"(['philippines'], Location((12.7503486, 122.7312101, 0.0)))",,,891879366107422720,https://twitter.com/euniceanne17/status/891879366107422720
ABSCBNNews,2017-07-31 12:31,8,29,Not just Maute: Soldiers fight dengue in Marawi http://bit.ly/2vWYu6P pic.twitter.com/lMhTrCnDh6,"(['Manila', ' Philippines'], Location((14.5906216, 120.9799696, 0.0)))",,,891878901755949058,https://twitter.com/ABSCBNNews/status/891878901755949058
PhilippineStar,2017-07-31 12:30,0,0,"NPC, SM Cares link up for troops in Marawi http://bit.ly/2wcBfoX pic.twitter.com/hQ775OG2xp","(['Philippines'], Location((12.7503486, 122.7312101, 0.0)))",,,891878594028253185,https://twitter.com/PhilippineStar/status/891878594028253185
ANCALERTS,2017-07-31 12:30,0,9,Not just Maute: Soldiers fight dengue in Marawi http://bit.ly/2uLA6GM,"(['Philippines'], Location((12.7503486, 122.7312101, 0.0)))",,,891878589603258368,https://twitter.com/ANCALERTS/status/891878589603258368
PHShowbizNow,2017-07-31 12:29,0,0,[CHIKA MINUTE] Solenn Heussaff visited soldiers of Marawi a second time and it changed her life http://ift.tt/2vdcrzX  | via GMA News,"(['\xc3\x9cT: 14.5339204', '121.0738461'], Location((47.8892975, -94.2631618, 0.0)))",,,891878386284593152,https://twitter.com/PHShowbizNow/status/891878386284593152
PHShowbizNow,2017-07-31 12:29,0,0,Solenn Heussaff visited soldiers of Marawi a second time and it changed her life http://ift.tt/2vdcrzX  | via GMA News,"(['\xc3\x9cT: 14.5339204', '121.0738461'], Location((47.8892975, -94.2631618, 0.0)))",,,891878374456610816,https://twitter.com/PHShowbizNow/status/891878374456610816
j_mreyes,2017-07-31 12:17,1,0,Padilla asked Marawi residents/evacuees not to go home yet @ Malaya_Online,,@,,891875565644374016,https://twitter.com/j_mreyes/status/891875565644374016
Noel_Dolor,2017-07-31 12:16,0,0,Our troops are there to help keep the peace and rid Marawi of all dangerous elements triggered by terrorism. More prayers also 4 our troops,"(['Makati', ' PHL'], Location((14.55459465, 121.021407905, 0.0)))",,,891875170620555264,https://twitter.com/Noel_Dolor/status/891875170620555264
Noel_Dolor,2017-07-31 12:15,1,1,Sen Pacman's presence in Marawi will definitely inspire our troops greatly.Let us indeed salute both Sen Pacman & our dedicated soldiers,"(['Makati', ' PHL'], Location((14.55459465, 121.021407905, 0.0)))",,,891874846858125312,https://twitter.com/Noel_Dolor/status/891874846858125312
fbdlssnts,2017-07-31 12:09,0,1,A simple act of kindness to help end Marawi Crisis. Thanks to our dear Rotarians for having in this activity.... http://fb.me/5kCh67n2S,"(['Iligan City'], Location((8.17846435, 124.470789035, 0.0)))",,,891873406089662464,https://twitter.com/fbdlssnts/status/891873406089662464
Gabenewsinfo,2017-07-31 12:06,0,0,@ inquirerdotnet Displaced kids view Marawi terrorists as heroes http://newsinfo.inquirer.net/918257/displaced-kids-view-marawi-terrorists-as-heroes …,"(['Whatever...'], Location((37.7600854, -122.4351156, 0.0)))",@,,891872569757970432,https://twitter.com/Gabenewsinfo/status/891872569757970432
AboitizFDN,2017-07-31 12:05,0,0,Aboitiz Group extends assistance to displaced citizens of Marawi > http://ow.ly/8UAU30e1PAX # AboitizBetterWorldpic.twitter.com/WKSIUWEpHq,"(['Manila', ' Philippines'], Location((14.5906216, 120.9799696, 0.0)))",,#,891872323502039040,https://twitter.com/AboitizFDN/status/891872323502039040
OneMusicPH,2017-07-31 12:03,21,57,Mga Kapamilya! Tickets to One Music Live: Awit Para sa Marawi Special Benefit Concert will be available starting tomorrow at @ ABSCBNStore.pic.twitter.com/sK4yDIUxO0,,@,,891871990792863744,https://twitter.com/OneMusicPH/status/891871990792863744
dswdserves,2017-07-31 11:59,2,6,"DSWD Sec. Taguiwalo receives donations from Metro Manila Mayors Spouses Foundation, Inc. for Marawi crisis IDPs. # DSWDMayMalasakitpic.twitter.com/DgR9mffEgK","(['Quezon City', ' Philippines'], Location((14.6509905, 121.0486155, 0.0)))",,#,891870826063994882,https://twitter.com/dswdserves/status/891870826063994882
themmailonline,2017-07-31 11:54,2,1,"Sabah not under security threat from Marawi militants, says minister http://bit.ly/2hfif6H","(['Noveleta', ' Calabarzon'], Location((14.4929874, 120.802425847, 0.0)))",,,891869570071277568,https://twitter.com/themmailonline/status/891869570071277568
MindanaoGSD,2017-07-31 11:52,0,0,Lorenzana sees next threat: Marawi kids # MindanaoGoldstarDaily # GoldstarDailyNews @ mindanaogsdhttp://mindanaogoldstardaily.com/lorenzana-sees-next-threat-marawi-kids/ …,"(['Mindanao', ' Philippines'], Location((7.68980415, 125.236399692, 0.0)))",@,# #,891869155447644161,https://twitter.com/MindanaoGSD/status/891869155447644161
disasters_ph,2017-07-31 11:52,0,0,Cebu provincial govt donates P1M for Marawi conflict victims http://bit.ly/2vWTQGj  via http://pia.gov.ph,,,,891869096459075584,https://twitter.com/disasters_ph/status/891869096459075584
PNP_RCLO18,2017-07-31 11:51,0,0,"RCLO18 personnel PARTICIPATE THE 12:00NN HABIT PRAYER FOR PEACE, PARTICULARLY IN MARAWI CITY July 31, 2017 pic.twitter.com/ZCNz6ZqioI","(['negros', ' Occidental'], Location((10.0206764, 122.977113156, 0.0)))",,,891868785946132480,https://twitter.com/PNP_RCLO18/status/891868785946132480
gmanews,2017-07-31 11:46,4,13,Local gov't officials have decided to begin rehab projects to give Marawi residents temporary housing. http://gmane.ws/2tVHSPA,"(['Philippines'], Location((12.7503486, 122.7312101, 0.0)))",,,891867515923464192,https://twitter.com/gmanews/status/891867515923464192
DavidAnanth,2017-07-31 11:45,0,0,"http://myiTimes.com  - Sabah not under security threat from Marawi militants, says minister http://ow.ly/El8Z50d7N0U","(['Kuala Lumpur', ' Malaysia'], Location((0.642715, 122.5909774, 0.0)))",,,891867433266446336,https://twitter.com/DavidAnanth/status/891867433266446336
ANCALERTS,2017-07-31 11:45,1,4,Not just Maute: Soldiers fight dengue-carrying mosquitoes in Marawi http://bit.ly/2vWBu84,"(['Philippines'], Location((12.7503486, 122.7312101, 0.0)))",,,891867265360068609,https://twitter.com/ANCALERTS/status/891867265360068609
PhilippineStar,2017-07-31 11:45,0,1,Padilla: 300 residents in Marawi still unaccounted; 80 to 100 still being held by Maute terrorists.,"(['Philippines'], Location((12.7503486, 122.7312101, 0.0)))",,,891867263057264640,https://twitter.com/PhilippineStar/status/891867263057264640
manilabulletin,2017-07-31 11:44,0,0,Padilla: Main AFP objective is to rescue hostages in Marawi https://youtu.be/tbr5dz9eqJg,"(['Manila', ' Philippines'], Location((14.5906216, 120.9799696, 0.0)))",,,891867038162993152,https://twitter.com/manilabulletin/status/891867038162993152
nepclo,2017-07-31 11:42,0,0,NEPCLO personnel led by PSUPT CORONEL prepared the donations for the victims of Marawi Incidents @ rclo_three @ CrimeLaboratorypic.twitter.com/YEKBtuptvj,,@ @,,891866731676708864,https://twitter.com/nepclo/status/891866731676708864
jovelyn_n,2017-07-31 11:42,0,0,Not just Maute: Soldiers fight dengue-carrying mosquitoes in Marawi https://goo.gl/fb/rUSXF4,,,,891866697535246338,https://twitter.com/jovelyn_n/status/891866697535246338
nepclo,2017-07-31 11:42,0,0,NEPCLO personnel led by PSUPT CORONEL prepared the donations for the victims of Marawi Incidents @ rclo_three @ CrimeLaboratorypic.twitter.com/OyWe5eVAlK,,@ @,,891866613334421504,https://twitter.com/nepclo/status/891866613334421504
PTVisMin,2017-07-31 11:41,0,0,"LOOK: Kahon-kahong school supplies, hygiene kits,at iba pang donasyon, nakatakdang ipadala ng DEPED sa Marawi siege victims | @ RiaMFernandezhttps://twitter.com/PTVph/status/891862475678797825 …",,@,,891866315522056193,https://twitter.com/PTVisMin/status/891866315522056193
inquirerdotnet,2017-07-31 11:41,2,3,Brig. Gen. Padilla says 40 to 60 terrorists remain holed up in Marawi holding 80 to 100 civilian hostages. | @ pctubezaINQ,"(['Makati City'], Location((14.5591272, 121.0202094, 0.0)))",@,,891866306089172994,https://twitter.com/inquirerdotnet/status/891866306089172994
emmzztrinidad,2017-07-31 11:41,10,3,busy ata si Volts sa practice for Marawi..brader @ voltsvallejo saglot lng to..magPusher k muna MarNigoMMK SaSabadoNa,"(['Dasmarinas', ' Calabarzon'], Location((14.6455597, 120.9995684, 0.0)))",@,,891866288192053249,https://twitter.com/emmzztrinidad/status/891866288192053249
RuthAbbey,2017-07-31 11:40,0,0,Padilla reiterates terrorists' leaders still holed up in Marawi City. @ sunstaronline,,@,,891866255103107072,https://twitter.com/RuthAbbey/status/891866255103107072
cnnphilippines,2017-07-31 11:39,2,0,Padilla: Estimated 80-100 hostages remaining with Mautes; 40-60 enemies still in Marawi | # MindanaoHour live http://bit.ly/2v9OB8l,,,#,891865991621128192,https://twitter.com/cnnphilippines/status/891865991621128192
RuthAbbey,2017-07-31 11:39,0,0,"Padilla says there's no exact number of hostages in Marawi City, adding that gov't estimates the figures at only 80-100. @ sunstaronline",,@,,891865865158746117,https://twitter.com/RuthAbbey/status/891865865158746117
alexisbromero,2017-07-31 11:39,0,0,Padilla: 300 residents in Marawi still unaccounted; 80 to 100 still being held by Maute terrorists @ PhilippineStar @ PhilstarNews,"(['Manila'], Location((14.5906216, 120.9799696, 0.0)))",@ @,,891865773865541632,https://twitter.com/alexisbromero/status/891865773865541632
GenKabiling,2017-07-31 11:38,0,0,Main AFP objective is to rescue hostages in Marawi - Padilla @ manila_bulletin,,@,,891865739111538688,https://twitter.com/GenKabiling/status/891865739111538688
UpdatesMalaysia,2017-07-31 11:38,0,0,"Sabah not under security threat from Marawi militants, says minister | Malaysia - http://malaysiaupdates.com/2017/07/31/sabah-not-under-security-threat-from-marawi-militants-says-minister-malaysia/Sabah … not und...pic.twitter.com/0U4diiuOCo","(['Petaling Jaya', ' Selangor'], Location((3.1055929, 101.642697, 0.0)))",,,891865723412205568,https://twitter.com/UpdatesMalaysia/status/891865723412205568
pctubezaINQ,2017-07-31 11:38,0,0,Brig. Gen. Padilla says 40 to 60 terrorists remain holed up in Marawi holding 80 to 100 civilian hostages.,,,,891865685797650432,https://twitter.com/pctubezaINQ/status/891865685797650432
piaranada,2017-07-31 11:38,1,1,"AFP Spox Padilla: Military estimates 80-100 hostages being held by terrorists, 40-60 terrorists still in Marawi City. @ rapplerdotcom","(['Philippines'], Location((12.7503486, 122.7312101, 0.0)))",@,,891865608874213376,https://twitter.com/piaranada/status/891865608874213376
ABSCBNNews,2017-07-31 11:35,1,0,Office of Civil Defense: Private individual allowing govt to temporarily set up a relocation site in his 11-ha lot in Marawi. | @ dgplacido,"(['Manila', ' Philippines'], Location((14.5906216, 120.9799696, 0.0)))",@,,891864787591680000,https://twitter.com/ABSCBNNews/status/891864787591680000
maracepeda,2017-07-31 11:34,2,0,Ubial: But our problem is clearing Marawi so that our personnel and our supplies can be delivered on the ground.,"(['Manila', ' Philippines'], Location((14.5906216, 120.9799696, 0.0)))",,,891864670901985282,https://twitter.com/maracepeda/status/891864670901985282
maracepeda,2017-07-31 11:34,1,1,"Ubial on Marawi aid: As of the moment, I think we have enough supplies. We have enough health personnel.","(['Manila', ' Philippines'], Location((14.5906216, 120.9799696, 0.0)))",,,891864622067621888,https://twitter.com/maracepeda/status/891864622067621888
manilabulletin,2017-07-31 11:31,1,2,"Purisima says a private individual, a Marawi resident, allowed gov't to use his 11-hectare land as relocation site for Marawi IDPs.","(['Manila', ' Philippines'], Location((14.5906216, 120.9799696, 0.0)))",,,891863760016560129,https://twitter.com/manilabulletin/status/891863760016560129
argyllcyrus_MB,2017-07-31 11:30,0,1,"Purisima says a private individual, a Marawi resident, allowed govt to use his 11-hectare land as relocation site for Marawi IDPs.","(['Manila City'], Location((14.5906216, 120.9799696, 0.0)))",,,891863494550618114,https://twitter.com/argyllcyrus_MB/status/891863494550618114
bworldph,2017-07-31 11:30,2,3,Japan donates $2 million for Marawi rehab | via @ ipcigaral http://bit.ly/japandonates pic.twitter.com/Z6uyB9VEEA,"(['Philippines'], Location((12.7503486, 122.7312101, 0.0)))",@,,891863490570313728,https://twitter.com/bworldph/status/891863490570313728
interaksyon,2017-07-31 11:30,1,5,Japan donates $2 million for Marawi rehab | via @ ipcigaral http://bit.ly/japandonates pic.twitter.com/b0SrCxJSYZ,"(['Philippines'], Location((12.7503486, 122.7312101, 0.0)))",@,,891863490280824832,https://twitter.com/interaksyon/status/891863490280824832
ANCALERTS,2017-07-31 11:29,0,0,Office of Civil Defense: Private individual allowing govt to temporarily set up a relocation site in his 11-ha lot in Marawi | @ dgplacido,"(['Philippines'], Location((12.7503486, 122.7312101, 0.0)))",@,,891863340854648832,https://twitter.com/ANCALERTS/status/891863340854648832
dgplacido,2017-07-31 11:29,0,0,Office of Civil Defense: Private individual allowing govt to temporarily set up a relocation site in his 11-ha lot in Marawi @ ABSCBNNews,"(['Manila', ' Philippines'], Location((14.5906216, 120.9799696, 0.0)))",@,,891863236298944512,https://twitter.com/dgplacido/status/891863236298944512
RuthAbbey,2017-07-31 11:28,0,1,Purisima says 11-hectare lot owned by a Marawi resident would be used for the establishment of transitional shelters. @ sunstaronline,,@,,891863080950419456,https://twitter.com/RuthAbbey/status/891863080950419456
manilabulletin,2017-07-31 11:27,0,0,Guevarra says gov't now has full control over Mapandi Bridge in Marawi City. https://youtu.be/tbr5dz9eqJg,"(['Manila', ' Philippines'], Location((14.5906216, 120.9799696, 0.0)))",,,891862812917551105,https://twitter.com/manilabulletin/status/891862812917551105
manilabulletin,2017-07-31 11:26,1,0,Padilla says the AFP is trying to expedite the clearing operations in Marawi City but sets no deadline due to complexities.,"(['Manila', ' Philippines'], Location((14.5906216, 120.9799696, 0.0)))",,,891862696890515456,https://twitter.com/manilabulletin/status/891862696890515456
piaranada,2017-07-31 11:26,4,2,OCD's Asec Purisima says private citizen allowed use of 11-hectare area for transitional shelters for Marawi residents. @ rapplerdotcom,"(['Philippines'], Location((12.7503486, 122.7312101, 0.0)))",@,,891862695787548674,https://twitter.com/piaranada/status/891862695787548674
DENROfficial,2017-07-31 11:26,1,0,Cimatu to go to Mindanao to check preparations of confiscated logs for contribution to Marawi rehab efforts. # GoodGovernance,"(['Quezon City'], Location((14.6509905, 121.0486155, 0.0)))",,#,891862694260727808,https://twitter.com/DENROfficial/status/891862694260727808
PTVph,2017-07-31 11:25,3,4,"LOOK: Kahon-kahong school supplies, hygiene kits,at iba pang donasyon, nakatakdang ipadala ng DEPED sa Marawi siege victims | @ RiaMFernandezpic.twitter.com/XhRWtWKSGM","(['Philippines'], Location((12.7503486, 122.7312101, 0.0)))",@,,891862475678797825,https://twitter.com/PTVph/status/891862475678797825
piaranada,2017-07-31 11:25,2,1,OCD's Asec Toby Purisima says Rapid Damage and Needs Assessment on Marawi conflict conducted. Report to be released this week @ rapplerdotcom,"(['Philippines'], Location((12.7503486, 122.7312101, 0.0)))",@,,891862461980082177,https://twitter.com/piaranada/status/891862461980082177
cnnphilippines,2017-07-31 11:25,1,1,Padilla on Marawi crisis: We now have direct access to ground zero | # MindanaoHour live http://bit.ly/2v9OB8l,,,#,891862385211854848,https://twitter.com/cnnphilippines/status/891862385211854848
manilabulletin,2017-07-31 11:24,1,0,"Padilla says workers, despite the dangers and risks, are working hard to prepare the relocation area for the Marawi IDPs. | @ argyllcyrus_MB","(['Manila', ' Philippines'], Location((14.5906216, 120.9799696, 0.0)))",@,,891862157884669952,https://twitter.com/manilabulletin/status/891862157884669952
PhilippineStar,2017-07-31 11:23,2,2,Marawi crisis update as of July 30. pic.twitter.com/vNNk4dBC1C,"(['Philippines'], Location((12.7503486, 122.7312101, 0.0)))",,,891861928657559553,https://twitter.com/PhilippineStar/status/891861928657559553
manilabulletin,2017-07-31 11:23,0,0,Padilla says even the relocation area for the Marawi IDPs in evacuation centers are being hit by stray bullets. https://youtu.be/tbr5dz9eqJg,"(['Manila', ' Philippines'], Location((14.5906216, 120.9799696, 0.0)))",,,891861860365942785,https://twitter.com/manilabulletin/status/891861860365942785
argyllcyrus_MB,2017-07-31 11:23,0,0,Guevarra says gov't now has full control over Mapandi Bridge in Marawi City.,"(['Manila City'], Location((14.5906216, 120.9799696, 0.0)))",,,891861824852770816,https://twitter.com/argyllcyrus_MB/status/891861824852770816
alexisbromero,2017-07-31 11:23,0,0,Marawi crisis update as of July 30 @ PhilippineStar @ PhilstarNewspic.twitter.com/IVdpo3IGaj,"(['Manila'], Location((14.5906216, 120.9799696, 0.0)))",@ @,,891861772000403457,https://twitter.com/alexisbromero/status/891861772000403457
