HLAFphil,2017-08-31 07:58,0,0,READ: Nightmares of war haunting displaced Marawi children (Philippines) http://www.peace-ed-campaign.org/nightmares-war-haunting-displaced-marawi-children-philippines/ …,,,,903044278816989185,https://twitter.com/HLAFphil/status/903044278816989185
realprincetotty,2017-08-31 07:54,0,0,Sm kaya mrka fitnah. Teroriz rekayasa polri. Klau teroriz di marawi rekayasa polri jg.kah. Sm ky imam besarnya teriak-2 maksiat. Taunye. https://twitter.com/kangdede78/status/902913824554024964 …,,,,903043302827606016,https://twitter.com/realprincetotty/status/903043302827606016
dhaytish,2017-08-31 07:53,0,4,Tumpak! 1. He went to Marawi during Kian's wake (photo op) 2. Meeting with Kian's parents. 3. Mayor Jed from Iloilo! 4. Marcos's gold bars.,,,,903042918176276480,https://twitter.com/dhaytish/status/903042918176276480
disruptivesigna,2017-08-31 07:50,0,0,"Duterte says fighting against ISIS in Marawi enters ‘final stages’"" http://theduran.com/duterte-says-fighting-isis-marawi-enters-final-stages/ … @jimmypedya # headlines # news # feedly""",,@jimmypedya,# # #,903042378138738688,https://twitter.com/disruptivesigna/status/903042378138738688
Ivan226622,2017-08-31 07:47,0,0,"Duterte says Marawi battle in 'final stages' http://bit.ly/2x6A1PR  pic.twitter.com/NwB46l2ev4 — ABS-CBN News (ABSCBNNews) August 30, 2017",,,,903041583368548353,https://twitter.com/Ivan226622/status/903041583368548353
PoGo_Port,2017-08-31 07:45,0,0,Meet and Greet with the Participants of Tabak Educational Tour Peaceful Environment for Marawi https://goo.gl/nDcNc9 pic.twitter.com/SWOi85NBLZ,,,,903040915618488322,https://twitter.com/PoGo_Port/status/903040915618488322
CaminaJan,2017-08-31 07:40,0,0,"wrong! It should be Pinsalang dulot ng mga terrorista sa Marawi.""""",,,,903039708225093633,https://twitter.com/CaminaJan/status/903039708225093633
yatrough,2017-08-31 07:39,0,0,"Preparasyon para sa panibagong concert para sa mga sundalo at pulis sa Marawi, inumpisahan na | UNTV News and Rescue http://fb.me/2lQ1Ah8Ly",,,,903039601626906624,https://twitter.com/yatrough/status/903039601626906624
newsjsph,2017-08-31 07:39,0,0,"Mighty windfall to benefit Marawi, military – Dominguez - The Manila Times http://dlvr.it/PjlT22 # newspic.twitter.com/vTTpB2Muuc",,,#,903039444592103424,https://twitter.com/newsjsph/status/903039444592103424
i3ryok,2017-08-31 07:37,0,0,Duterte inaming pinigil pagbomba sa mosque; pero ngayon nasa militar na opsyon sa Marawi ops - http://www.newsportal.ph/duterte-inaming-pinigil-pagbomba-sa-mosque-pero-ngayon-nasa-militar-na-opsyon-sa-marawi-ops/ …pic.twitter.com/iWzmvE7ZIl,,,,903039096083197952,https://twitter.com/i3ryok/status/903039096083197952
DZAR1026,2017-08-31 07:36,0,0,Duterte pinangunahan ang AFP-PNP joint command sa ika-100 araw ng Marawi crisis. # UsapingBayan # SmniNewshttp://bit.ly/2rmNz6F,,,# #,903038694801661954,https://twitter.com/DZAR1026/status/903038694801661954
smninewschannel,2017-08-31 07:36,0,0,Duterte pinangunahan ang AFP-PNP joint command sa ika-100 araw ng Marawi crisis. # UsapingBayan # SmniNewshttp://bit.ly/2rmNz6F,,,# #,903038694801604609,https://twitter.com/smninewschannel/status/903038694801604609
ABSCBNNews,2017-08-31 07:35,27,60,Look: Marawi@100days http://bit.ly/2x6CqKa # MarawiClashpic.twitter.com/DnWhyj2VJ3,,@100days,#,903038374281445376,https://twitter.com/ABSCBNNews/status/903038374281445376
sam_vadas,2017-08-31 07:34,0,0,A milestone in the battle for # Marawi # Philippineshttps://twitter.com/reuterstv/status/902836404581003264 …,,,# #,903038283000627200,https://twitter.com/sam_vadas/status/903038283000627200
tonylavs,2017-08-31 07:34,0,3,The liberation of Marawi is pyrrhic if we lose the war over minds and hearts of the people. And be sure we know that we could lose that.,,,,903038125613518848,https://twitter.com/tonylavs/status/903038125613518848
DZAR1026,2017-08-31 07:32,0,0,"Anti-Bomb Police ng Davao City, pinapadala ni Pangulong Duterte, sa Marawi. # UsapingBayan # SmniNews http://bit.ly/2rmNz6F",,,# #,903037851339595776,https://twitter.com/DZAR1026/status/903037851339595776
smninewschannel,2017-08-31 07:32,0,0,"Anti-Bomb Police ng Davao City, pinapadala ni Pangulong Duterte, sa Marawi. # UsapingBayan # SmniNews http://bit.ly/2rmNz6F",,,# #,903037851331203072,https://twitter.com/smninewschannel/status/903037851331203072
tonylavs,2017-08-31 07:31,0,2,"The devastation of Marawi is staggering. I hope the wreckage of lives is not as bad. If yes, we all have lost this war with the Mautes.",,,,903037376506716164,https://twitter.com/tonylavs/status/903037376506716164
ReutersJean,2017-08-31 07:30,1,0,The Marawi city siege enters its 100th day: http://reut.tv/2wnTwRz  via @ ReutersTV @ MartinPetty,,@ @,,903037318419726336,https://twitter.com/ReutersJean/status/903037318419726336
ABSCBNNews,2017-08-31 07:30,3,11,Duterte says Marawi battle in 'final stages' http://bit.ly/2x6A1PR pic.twitter.com/LRlUoOBnUn,,,,903037115029651457,https://twitter.com/ABSCBNNews/status/903037115029651457
ANCALERTS,2017-08-31 07:30,4,5,Cops face murder rap for killing soldier who fought in Marawi http://bit.ly/2gkE0ht,,,,903037114803077121,https://twitter.com/ANCALERTS/status/903037114803077121
PCSOLotteryDraw,2017-08-31 07:27,0,0,"I liked a @ YouTube video http://youtu.be/VjVR8tOC0Ag?a  MARAWI CITY UPDATE AT IBA PA AUGUST 31, 2017",,@,,903036563537489920,https://twitter.com/PCSOLotteryDraw/status/903036563537489920
dzIQ990,2017-08-31 07:26,0,0,"Bakbakan sa Marawi City, war against drugs at anti-insurgency, kabilang sa mga natalakay sa joint command conference | @ isaavendanoDZIQ",,@,,903036339469221889,https://twitter.com/dzIQ990/status/903036339469221889
GMPilipinas,2017-08-31 07:25,0,0,PANOORIN: Panayam ng PTV kay B/Gen. Restituto Padilla kaugnay sa kasalukuyang lagay ng Marawi City http://fb.me/6tZLNjUjH,,,,903036055179243520,https://twitter.com/GMPilipinas/status/903036055179243520
MaDayZa,2017-08-31 07:23,0,1,Maglagot jud ko anang mga pataka ug yawyaw ipahatod takas marawi karun qiqil mo si accoe,,,,903035384648482816,https://twitter.com/MaDayZa/status/903035384648482816
PTVph,2017-08-31 07:22,2,4,PANOORIN: Panayam ng Bagong Pilipinas kay B/Gen. Restituto Padilla kaugnay sa kasalukuyang lagay ng Marawi City pic.twitter.com/ZwK9GZ5gd0,,,,903035287005048832,https://twitter.com/PTVph/status/903035287005048832
paengLopez,2017-08-31 07:21,0,1,"can't believe it has been 100 days, # Marawi. been too long. may WE find peace soon.",,,#,903034908288929792,https://twitter.com/paengLopez/status/903034908288929792
bdsaguing,2017-08-31 07:21,0,0,Cops face murder rap for killing soldier who fought in Marawi http://news.abs-cbn.com/news/08/30/17/cops-face-murder-rap-for-killing-soldier-who-fought-in-marawi … via @ ABSCBNNews,,@,,903034867155423235,https://twitter.com/bdsaguing/status/903034867155423235
WPReview,2017-08-31 07:20,2,2,The Philippines says it's preparing for the final battle to root out ISIS-linked militants from Marawi. http://wpr.vu/vSUz30eNplu,,,,903034642915360771,https://twitter.com/WPReview/status/903034642915360771
ANCALERTS,2017-08-31 07:20,2,8,Duterte says Marawi battle in 'final stages' http://bit.ly/2gkJj0o,,,,903034598640107520,https://twitter.com/ANCALERTS/status/903034598640107520
dzrhnews,2017-08-31 07:16,0,1,"Mapandi Bridge na naging sentro ng bakbakan, napasok na ng media sa ika-100 araw ng giyera sa Marawi. # PangunahingBalita",,,#,903033793706991616,https://twitter.com/dzrhnews/status/903033793706991616
dzrhnews,2017-08-31 07:16,0,1,"Duterte, sinisi ang sarili kaya tumagal ang bakbakan sa Marawi City. # PangunahingBalita",,,#,903033609099010048,https://twitter.com/dzrhnews/status/903033609099010048
bdsaguing,2017-08-31 07:14,0,0,Duterte gives military free hand to tackle Marawi conflict | News | GMA News Online https://shar.es/1SwnBq  via...http://fb.me/3Q37HKjLn,,,,903033121498640392,https://twitter.com/bdsaguing/status/903033121498640392
terrorism_info,2017-08-31 07:14,0,0,NYC chair Seguerra serenades Marawi evacuees http://terrorism.trendolizer.com/2017/08/nyc-chair-seguerra-serenades-marawi-evacuees.html …pic.twitter.com/vwTyeSGDxx,,,,903033097448501257,https://twitter.com/terrorism_info/status/903033097448501257
disciple78,2017-08-31 07:13,0,0,"@ wwmonitor: # Marawi three months on: # Islamists still hold # Christian hostages, as residents sta... https://gab.ai/disciple78/posts/11417323 …",,@,# # #,903033003428921346,https://twitter.com/disciple78/status/903033003428921346
weatherfreakk,2017-08-31 07:10,0,0,I liked a @ YouTube video http://youtu.be/8kzi4YmNSEY?a  100 days: Philippine army says 'last stand' near for Marawi fighters,,@,,903032294738468868,https://twitter.com/weatherfreakk/status/903032294738468868
bdsaguing,2017-08-31 07:08,0,0,Duterte gives military free hand to tackle Marawi conflict | News | GMA News Online https://shar.es/1SwnBq  via @ gmanews,,@,,903031719548334081,https://twitter.com/bdsaguing/status/903031719548334081
mylsvalenciaTV5,2017-08-31 07:08,0,0,"Pangulong Duterte, aminadong tumagal ng isandaang araw ang gulo sa Marawi dahil sa kanyang mga desisyon.",,,,903031588904091648,https://twitter.com/mylsvalenciaTV5/status/903031588904091648
egdsgn,2017-08-31 07:04,0,0,Meet and Greet with the Participants of Tabak Educational Tour Peaceful Environment for Marawi https://politicsph.pogoport.com/meet-and-greet-with-the-participants-of-tabak-educational-tour-peaceful-environment-for-marawi/ …,,,,903030741172453377,https://twitter.com/egdsgn/status/903030741172453377
muzi_kha,2017-08-31 07:04,0,0,Meet and Greet with the Participants of Tabak Educational Tour Peaceful Environment for Marawi https://politicsph.pogoport.com/meet-and-greet-with-the-participants-of-tabak-educational-tour-peaceful-environment-for-marawi/ …,,,,903030735740829697,https://twitter.com/muzi_kha/status/903030735740829697
chris19thws,2017-08-31 07:04,0,0,Meet and Greet with the Participants of Tabak Educational Tour Peaceful Environment for Marawi https://politicsph.pogoport.com/meet-and-greet-with-the-participants-of-tabak-educational-tour-peaceful-environment-for-marawi/ …,,,,903030729898123266,https://twitter.com/chris19thws/status/903030729898123266
PoGo_Port,2017-08-31 07:04,0,0,Meet and Greet with the Participants of Tabak Educational Tour Peaceful Environment for Marawi https://politicsph.pogoport.com/meet-and-greet-with-the-participants-of-tabak-educational-tour-peaceful-environment-for-marawi/ …,,,,903030723803836416,https://twitter.com/PoGo_Port/status/903030723803836416
orga_ogop,2017-08-31 07:04,0,0,Meet and Greet with the Participants of Tabak Educational Tour Peaceful Environment for Marawi https://politicsph.pogoport.com/meet-and-greet-with-the-participants-of-tabak-educational-tour-peaceful-environment-for-marawi/ …,,,,903030708817539073,https://twitter.com/orga_ogop/status/903030708817539073
RTheKrak3n,2017-08-31 07:04,0,0,Meet and Greet with the Participants of Tabak Educational Tour Peaceful Environment for Marawi https://politicsph.pogoport.com/meet-and-greet-with-the-participants-of-tabak-educational-tour-peaceful-environment-for-marawi/ …,,,,903030701167083525,https://twitter.com/RTheKrak3n/status/903030701167083525
nrjsbr,2017-08-31 07:02,0,0,Will be going home to Marawi in sha Allah!,,,,903030112605560833,https://twitter.com/nrjsbr/status/903030112605560833
lynmar45,2017-08-31 07:00,0,0,I liked a @ YouTube video http://youtu.be/ReyCCALhAFE?a  BINULGAR NI PRES. DUTERTE TOTOONG DAHILAN KAYA TUMAGAL ANG GIYERA SA MARAWI,,@,,903029739929161728,https://twitter.com/lynmar45/status/903029739929161728
BadBoySaRadyo,2017-08-31 07:00,0,0,ICYMI: Caravan to Marawi highlights Peace Month https://www.radyonatin.com/story.php?storyid=21194 …,,,,903029574786801669,https://twitter.com/BadBoySaRadyo/status/903029574786801669
SirDex07,2017-08-31 06:55,0,2,"Very nice ang song na Marawi!"" Nakahilak ko. who's the composer of this song?""",,,,903028435601080320,https://twitter.com/SirDex07/status/903028435601080320
dwiz882,2017-08-31 06:54,0,0,AFP's Galvez on Marawi battle: Nasa final phase na tayo at ang pinaghahandaan na natin ay yung rehabilitation na ng Marawi.,,,,903028198010585088,https://twitter.com/dwiz882/status/903028198010585088
nerowattz,2017-08-31 06:49,0,0,All-woman AFP-PNP team ready to help in Marawi rehab http://inq.ph/inqmobileapp  InquirerMobilehttp://ift.tt/2vtPdGX,,,,903026895159255040,https://twitter.com/nerowattz/status/903026895159255040
yusufledesma,2017-08-31 06:48,1,1,Troops start final push to retake Marawi from terrorists http://newsinfo.inquirer.net/926796/marawi-siege-melquiades-ordiales-mapandi-bridge-rolando-joselito-bautista …,,,,903026644163600384,https://twitter.com/yusufledesma/status/903026644163600384
totocyven,2017-08-31 06:48,0,0,Duterte says he shelved plan to bomb Marawi's Grand Mosque http://news.abs-cbn.com/news/08/30/17/duterte-says-he-shelved-plan-to-bomb-marawis-grand-mosque … via @ ABSCBNNews,,@,,903026578476605440,https://twitter.com/totocyven/status/903026578476605440
LoidaJacobo,2017-08-31 06:42,0,0,send him to Marawi...let's see how brave he really is,,,,903025049111674880,https://twitter.com/LoidaJacobo/status/903025049111674880
DZAR1026,2017-08-31 06:37,0,0,"Anti-bomb police ng Davao, pinapadala ni duterte sa Marawi # SmniNewshttp://bit.ly/2rmNz6F",,,#,903023885628489728,https://twitter.com/DZAR1026/status/903023885628489728
smninewschannel,2017-08-31 06:37,0,0,"Anti-bomb police ng Davao, pinapadala ni duterte sa Marawi # SmniNewshttp://bit.ly/2rmNz6F",,,#,903023885624291328,https://twitter.com/smninewschannel/status/903023885624291328
ACNMex,2017-08-31 06:28,5,10,"# BuenasNoticias Liberada la # Catedral de Sta. Maria en # Marawi, # Filipinas, ocupada y profanada por yihadistas http://bit.ly/2vK2pTc  RTpic.twitter.com/mdIgkeWUQL",,,# # # #,903021736005914624,https://twitter.com/ACNMex/status/903021736005914624
bdsaguing,2017-08-31 06:27,0,0,@ inquirerdotnet Troops start final push to retake Marawi from terrorists http://newsinfo.inquirer.net/926796/marawi-siege-melquiades-ordiales-mapandi-bridge-rolando-joselito-bautista …,,@,,903021313559638016,https://twitter.com/bdsaguing/status/903021313559638016
PhilDefNews,2017-08-31 06:26,0,0,Pressing need for snipers noted in Marawi conflict http://www.pna.gov.ph/articles/1008023 …,,,,903021105354391552,https://twitter.com/PhilDefNews/status/903021105354391552
MiguelGeroche,2017-08-31 06:23,0,0,"Duterte: Military can bomb Marawi mosques with terrorists, hostages # DontPawnLives. # EndMarawiCrisishttps://www.rappler.com/nation/180658-duterte-allows-military-bomb-marawi-mosques-terrorists-hostages …",,,# #,903020419430588420,https://twitter.com/MiguelGeroche/status/903020419430588420
marawi_93,2017-08-31 06:23,1,1,لا إله إلا الله وحده لا شريك له ، له المُلك ، ولك الحمد وهو على كُلِ شيءٍ قدير,,,,903020286886506496,https://twitter.com/marawi_93/status/903020286886506496
radyopilipinas1,2017-08-31 06:22,0,0,"BALITA: AFP, may natutunang leksyon sa 100-araw na pakikipaglaban sa Marawi. Kailangan ng AFP ng karagdagang pagsasanay sa urban warfare.",,,,903020090089586689,https://twitter.com/radyopilipinas1/status/903020090089586689
tatoom20,2017-08-31 06:18,0,0,Parang pinupunit ang puso ko ng makita ko ang Marawi city,,,,903019013478924288,https://twitter.com/tatoom20/status/903019013478924288
maxangelo987,2017-08-31 06:13,0,0,http://bit.ly/2wVTIq2  Duterte gives military free hand to tackle Marawi conflict http://gmane.ws/2iKOV8T # gmanews,,,#,903017889049055238,https://twitter.com/maxangelo987/status/903017889049055238
gregjamesbarton,2017-08-31 06:13,1,0,"With a population of 300,000 Marawi is the largest Islamic city in the majority Catholic country."" https://twitter.com/lindsay_murdoch/status/903016250913075200 …""",,,,903017775433519104,https://twitter.com/gregjamesbarton/status/903017775433519104
GeraldTicke,2017-08-31 06:12,0,0,WATCH: Zamboanga cops killing home-bound soldier from Marawi caught on CCTV https://shar.es/1SZSLr  via @ gmanews,,@,,903017701626462208,https://twitter.com/GeraldTicke/status/903017701626462208
rickrick888,2017-08-31 06:12,1,1,# InsideMarawi: Today marks 101 days since the Marawi crisis began. RexCNNPH takes us inside Ground Zero. http://cnn.ph/2wSOi33  — CNN Ph…,,,#,903017624468164616,https://twitter.com/rickrick888/status/903017624468164616
StevenRoodPH,2017-08-31 06:12,1,1,Suicide vest discovered in # Marawi mosque -- Video has also has scenes from inside # Marawi church https://buff.ly/2vqk9aY  by @ sandraguinaldopic.twitter.com/Kj6vEAtazs,,@,# #,903017501315010564,https://twitter.com/StevenRoodPH/status/903017501315010564
m3_tess,2017-08-31 06:11,0,0,"Preparasyon para sa panibagong concert para sa mga sundalo at pulis sa Marawi, inumpisahan na | UNTV News and Rescue http://fb.me/1zuZb9sNx",,,,903017291792748544,https://twitter.com/m3_tess/status/903017291792748544
cnnphilippines,2017-08-31 06:08,5,1,# InsideMarawi: Today marks 101 days since the Marawi crisis began. @ RexCNNPH takes us inside Ground Zero. http://cnn.ph/2wSOi33,,@,#,903016582703587330,https://twitter.com/cnnphilippines/status/903016582703587330
terrorism_info,2017-08-31 06:07,0,0,Troops start final push to retake Marawi from terrorists http://terrorism.trendolizer.com/2017/08/troops-start-final-push-to-retake-marawi-from-terrorists.html …pic.twitter.com/m76Bw1aRxK,,,,903016332039524352,https://twitter.com/terrorism_info/status/903016332039524352
AnsonReginald,2017-08-31 06:04,0,0,@ ClaireCeldran I think the crisis in marawi must end now pic.twitter.com/YziazgoLfR,,@,,903015632962072576,https://twitter.com/AnsonReginald/status/903015632962072576
gmanews,2017-08-31 06:01,0,10,Duterte gives military free hand to tackle Marawi conflict http://gmane.ws/2iKOV8T,,,,903014717446275072,https://twitter.com/gmanews/status/903014717446275072
Fifth_Sertorius,2017-08-31 05:56,1,0,Duterte says fighting against ISIS in Marawi enters ‘final stages’ http://theduran.com/?p=21438  via @ theduran_com,,@,,903013535453593602,https://twitter.com/Fifth_Sertorius/status/903013535453593602
Alan_Mark_,2017-08-31 05:55,0,0,Proof of Weak & incompetent leadership>Duterte: Military can bomb Marawi mosques w/hostages - http://www.rappler.com/nation/180658-duterte-allows-military-bomb-marawi-mosques-terrorists-hostages …pic.twitter.com/LjHeZo57x4,,,,903013388636233729,https://twitter.com/Alan_Mark_/status/903013388636233729
ChristianToday,2017-08-31 05:52,0,1,"After 95 days of fighting with Christians caught in the crossfire, Philippines troops retake Cathedral in Marawi: https://www.christiantoday.com/article/after.95.days.of.fighting.with.christians.caught.in.the.crossfire.philippines.troops.retake.cathedral.in.marawi/112735.htm … …pic.twitter.com/dyBie3YHN0",,,,903012452559937537,https://twitter.com/ChristianToday/status/903012452559937537
harawld,2017-08-31 05:48,0,0,sa marawi naman ngayon g0sh i love muslim conquered places,,,,903011676735152129,https://twitter.com/harawld/status/903011676735152129
NewsRmn,2017-08-31 05:37,0,0,"Pangulong Duterte, tinutulan ang plano na pagbomba sa ilang Mosque na pinagkukutaan ng Maute group sa Marawi City https://rmn.ph/pangulong-duterte-tinutulan-ang-plano-na-pagbomba-sa-ilang-mosque-na-pinagkukutaan-ng-maute-group-sa-marawi-city/ …",,,,903008687920365568,https://twitter.com/NewsRmn/status/903008687920365568
mortamz,2017-08-31 05:36,0,0,Troops start final push to retake Marawi from terrorists. http://newsinfo.inquirer.net/926796/marawi-siege-melquiades-ordiales-mapandi-bridge-rolando-joselito-bautista …,,,,903008648800100352,https://twitter.com/mortamz/status/903008648800100352
romerojo7,2017-08-31 05:35,1,0,Zamboanga cops killing home-bound soldier from Marawi caught on CCTV | News | GMA News Online https://shar.es/1SZRDe  via @ gmanews,,@,,903008199703281664,https://twitter.com/romerojo7/status/903008199703281664
JulienLeClezio,2017-08-31 05:23,0,3,"C'est la nouvelle stratégie de l'EI de mettre en avant Marawi depuis quelques semaines, donc c'est récent oui.",,,,903005331625791489,https://twitter.com/JulienLeClezio/status/903005331625791489
UncleRuthless,2017-08-31 05:18,0,0,Duterte: Anti-ISIS operation in Marawi has entered its 'final stages' -- Puppet Masters -- http://Sott.net https://www.sott.net/article/360664-Duterte-Anti-ISIS-operation-in-Marawi-has-entered-its-final-stages …,,,,903003970179817472,https://twitter.com/UncleRuthless/status/903003970179817472
dzrhdagupan,2017-08-31 05:13,0,0,"After 100 days, Philippine army says ‘last stand’ near for Marawi fighters http://dzrhnews.com.ph/100-days-philippine-army-says-last-stand-near-marawi-fighters/ …",,,,903002810517786631,https://twitter.com/dzrhdagupan/status/903002810517786631
dzrhlaoag,2017-08-31 05:13,0,0,"After 100 days, Philippine army says ‘last stand’ near for Marawi fighters http://dzrhnews.com.ph/100-days-philippine-army-says-last-stand-near-marawi-fighters/ …",,,,903002723758608391,https://twitter.com/dzrhlaoag/status/903002723758608391
dzrhnews,2017-08-31 05:11,0,1,"Mga miyembro ng media nakapasok na sa battle zone sa Marawi City, lawak ng pinsala matindi. # RapidoHatawBalita",,,#,903002281846611968,https://twitter.com/dzrhnews/status/903002281846611968
Thefinnigans,2017-08-31 05:10,3,4,The @ TurnbullMalcolm Regime is playing a very dangerous game for Aust by entangling Aust with Duterte Regime esp in Marawi pic.twitter.com/3WSAKlg2Uh,,@,,903002103374790656,https://twitter.com/Thefinnigans/status/903002103374790656
commentbotph,2017-08-31 05:02,0,0,Stupidong mga Pulis yan dapat sila ipadala sa marawi i front aa assault team ng matingnan ang galing ng mga kagrupo nya.,,,,903000012250066946,https://twitter.com/commentbotph/status/903000012250066946
ARMAKdeODELOT,2017-08-31 05:00,0,0,FILIPINAS después de MARAWI http://centrodeperiodicos.blogspot.com/2017/08/filipinas-despues-de-marawi.html …,,,,902999473756000257,https://twitter.com/ARMAKdeODELOT/status/902999473756000257
PropOrNotApp,2017-08-31 04:57,0,0,Duterte: Anti-ISIS operation in Marawi has entered its 'final stages' https://www.therussophile.org/duterte-anti-isis-operation-in-marawi-has-entered-its-final-stages.html/ … # fakenews # propagandapic.twitter.com/FJENqj8e7P,,,# #,902998809420206084,https://twitter.com/PropOrNotApp/status/902998809420206084
RTVMalacanang,2017-08-31 04:57,1,2,Meet and Greet with the Participants of Tabak Educational Tour Peaceful Environment for Marawi: http://youtu.be/NC4Z24jGUMQ?a  via @ YouTube,,@,,902998663642972163,https://twitter.com/RTVMalacanang/status/902998663642972163
prepperbot,2017-08-31 04:57,0,1,# alerts PHILIPPINES - Military Can Bomb Marawi Mosques With Terrorists Hostages http://dlvr.it/Pjk687 # preppers,,,# #,902998621674602497,https://twitter.com/prepperbot/status/902998621674602497
bomboradyonaga,2017-08-31 04:54,0,0,"Misis ng nasawing sundalo sa Marawi siege na binaril din ng sundalo sa Zambo City, pumanaw na | Bombo Radyo... http://fb.me/1cGwjd4M5",,,,902997866301374464,https://twitter.com/bomboradyonaga/status/902997866301374464
duterte_ism,2017-08-31 04:50,0,0,BINULGAR NI PRES. DUTERTE TOTOONG DAHILAN KAYA TUMAGAL ANG GIYERA SA MARAWI: http://youtu.be/ReyCCALhAFE?a  via @ YouTube,,@,,902996855235235840,https://twitter.com/duterte_ism/status/902996855235235840
PropOrNotApp,2017-08-31 04:48,0,0,Philippine Army Starts Its Final Push To Liberate Marawi City https://www.therussophile.org/philippine-army-starts-its-final-push-to-liberate-marawi-city.html/ … # fakenews # propagandapic.twitter.com/vjlqEyore3,,,# #,902996353197932544,https://twitter.com/PropOrNotApp/status/902996353197932544
TerlinguaRE2,2017-08-31 04:46,0,0,Duterte: Anti-ISIS operation in Marawi has entered its 'final stages': http://ift.tt/2wTFxpI,,,,902995886854336513,https://twitter.com/TerlinguaRE2/status/902995886854336513
MauthausenGusen,2017-08-31 04:45,0,0,Philippine Army Starts Its Final Push To Liberate Marawi City https://southfront.org/philippine-army-starts-final-push-liberate-marawi-city/ …,,,,902995739340570624,https://twitter.com/MauthausenGusen/status/902995739340570624
PeopleSurge,2017-08-31 04:41,1,1,"In the post-Martial law era of Marawi and Mindanao, the damages wrought by the Armed Forces of the Philippines... http://fb.me/8riux4PHH",,,,902994797023002624,https://twitter.com/PeopleSurge/status/902994797023002624
rickrick888,2017-08-31 04:37,0,0,"Int'l Red Cross, PH arm set up website for missing persons in Marawi http://bit.ly/2wRIx5L  pic.twitter.com/IYJRsm8Zby — CNN Philippines (…",,,,902993686925103108,https://twitter.com/rickrick888/status/902993686925103108
EJMantillo,2017-08-31 04:35,0,0,# TopNews IN PHOTOS: Military opens Mapandi bridge to media amid heavy fighting in Marawi - Rappler https://goo.gl/oQ346A,,,#,902993250310471680,https://twitter.com/EJMantillo/status/902993250310471680
inquirerdotnet,2017-08-31 04:30,1,4,Troops start final push to retake Marawi from terrorists | @ inqmindanaohttp://ebx.sh/2goips0,,@,,902992050399870976,https://twitter.com/inquirerdotnet/status/902992050399870976
TransAwakening,2017-08-31 04:30,2,0,Duterte says fighting against ISIS in Marawi enters ‘final stages’ http://theduran.com/duterte-says-fighting-isis-marawi-enters-final-stages/ …,,,,902992004484698112,https://twitter.com/TransAwakening/status/902992004484698112
cnnphilippines,2017-08-31 04:30,1,0,"Int'l Red Cross, PH arm set up website for missing persons in Marawi http://bit.ly/2wRIx5L pic.twitter.com/kEbgb3BUIA",,,,902991818169565184,https://twitter.com/cnnphilippines/status/902991818169565184
