dubsdublin,2017-08-28 12:31,0,0,Lumalaban sa Marawi. Bayani.,,,,902025812790042624,https://twitter.com/dubsdublin/status/902025812790042624
dzmmPatrol44,2017-08-28 12:30,0,1,"Pagkamatay ni Cayamora Maute, posibleng gamiting propaganda ng mga teroristang grupo sa loob ng Marawi City - Bgen Padilla pic.twitter.com/sIrjeNaO4k",,,,902025639858888704,https://twitter.com/dzmmPatrol44/status/902025639858888704
jaye_gwaps,2017-08-28 12:30,0,1,"Lumalaban para sa Marawi, bayani. # NationalHeroesDay",,,#,902025586977230849,https://twitter.com/jaye_gwaps/status/902025586977230849
dzbb,2017-08-28 12:30,0,2,"LIVE sa DZBB: B/Gen. Restituto Padilla, AFP spokesman kaugnay ng lagay sa Marawi City matapos ang pagkasawi ni Cayamora Maute.",,,,902025583445532672,https://twitter.com/dzbb/status/902025583445532672
amaarriieeee,2017-08-28 12:30,0,0,"Lumalaban para sa marawi. Bayani."" # ShowtimeSaLudoSaBayani""",,,#,902025570292137984,https://twitter.com/amaarriieeee/status/902025570292137984
PhilippineStar,2017-08-28 12:30,1,8,Marawi donations for 68 slain soldiers hit P68M http://bit.ly/2wKS8et pic.twitter.com/PXpu7uwr5i,,,,902025451169648640,https://twitter.com/PhilippineStar/status/902025451169648640
CNPH2016,2017-08-28 12:29,1,3,Mga beterano at pamilya ng mga sundalo at pulis na nasawi sa Marawi dumalo sa National Heroes Day kasama ang... http://fb.me/4whxI7CSZ,,,,902025287625449476,https://twitter.com/CNPH2016/status/902025287625449476
dwiz882,2017-08-28 12:29,0,0,Bilang ng napapatay na terorista sa Marawi nasa mahigit 600 na http://www.dwiz882am.com/index.php/bilang-ng-napapatay-na-terorista-sa-marawi-nasa-mahigit-600-na/ …,,,,902025282466439168,https://twitter.com/dwiz882/status/902025282466439168
hannah_kwekkwek,2017-08-28 12:29,0,0,HAHAHAHHAHAHA padala sa marawi -coco,,,,902025254003806210,https://twitter.com/hannah_kwekkwek/status/902025254003806210
dhemncabel,2017-08-28 12:27,0,2,"Lumalaban para sa Marawi, Bayani # ShowtimeSaLudoSaBayani",,,#,902024876482904064,https://twitter.com/dhemncabel/status/902024876482904064
sphasiaone,2017-08-28 12:25,0,0,Woman wonders if kidnapped son is fighting with IS militants in Marawi http://ebx.sh/2wL5Yh8,,,,902024309090258944,https://twitter.com/sphasiaone/status/902024309090258944
topetto,2017-08-28 12:24,3,2,# Marawi - # Filippine -: una guerra ignorata dai più su @ RSInews con @ tincazzi e @ RubenLagattollahttp://www.rsi.ch/g/9442546,,@ @ @,# #,902023981942935552,https://twitter.com/topetto/status/902023981942935552
ItsmeAlSilva,2017-08-28 12:24,0,10,Kudos sa lahat ng sundalo na nakikipaglaban sa Marawi. # NationalHeroesDay,,,#,902023940767342593,https://twitter.com/ItsmeAlSilva/status/902023940767342593
epicandor,2017-08-28 12:23,0,1,"Patuloy ang laban para sa Marawi at para sa bayan, Pilipinas! # NationalHeroesDay",,,#,902023918160044032,https://twitter.com/epicandor/status/902023918160044032
maxangelo987,2017-08-28 12:23,0,0,http://bit.ly/2wVTIq2  Terrorist leader Isnilon Hapilon still in Marawi but trying to escape says Lt. Gen. Carlito Galvez. # gmanews,,,#,902023796323909632,https://twitter.com/maxangelo987/status/902023796323909632
JustRoseeyy,2017-08-28 12:22,0,1,Lumalaban para sa Marawi.,,,,902023632624291840,https://twitter.com/JustRoseeyy/status/902023632624291840
hellohanash211,2017-08-28 12:22,0,0,Bayani para sa marawi # ShowtimeSaLudoSaBayani,,,#,902023600739311616,https://twitter.com/hellohanash211/status/902023600739311616
sarahcasticbabe,2017-08-28 12:22,0,0,"BAYANI para sa MARAWI""""",,,,902023576210903040,https://twitter.com/sarahcasticbabe/status/902023576210903040
mikka_dyosa31,2017-08-28 12:22,1,1,"Lumalaban para sa Marawi,Bayan"" saveeeh!!!""",,,,902023487107211264,https://twitter.com/mikka_dyosa31/status/902023487107211264
andaya_hazel,2017-08-28 12:22,0,0,Bayani para sa Marawi.,,,,902023467997978624,https://twitter.com/andaya_hazel/status/902023467997978624
dzrhnews,2017-08-28 12:20,1,1,"Mga sundalo't pulis na namatay sa Marawi, sinaluduhan sa National Heroes Day. # RapidoHatawBalita",,,#,902023029114322944,https://twitter.com/dzrhnews/status/902023029114322944
ConceptGrp,2017-08-28 12:19,1,0,"Duterte confers Lapu-Lapu award on Espenido, Marawi fallen heroes http://gmane.ws/2vjBSRz",,,,902022776587902976,https://twitter.com/ConceptGrp/status/902022776587902976
JoshCendana,2017-08-28 12:19,0,2,qaqo yung gera sa pool kagabi HAHAHAHA nagmala marawi yung Water State eh hahahaha,,,,902022681012297728,https://twitter.com/JoshCendana/status/902022681012297728
egdsgn,2017-08-28 12:17,0,0,"Task Force Marawi, kinumpirma ang pagkakaroon ng child fighters ng Maute Group https://politicsph.pogoport.com/task-force-marawi-kinumpirma-ang-pagkakaroon-ng-child-fighters-ng-maute-group/ …",,,,902022403580190720,https://twitter.com/egdsgn/status/902022403580190720
muzi_kha,2017-08-28 12:17,0,0,"Task Force Marawi, kinumpirma ang pagkakaroon ng child fighters ng Maute Group https://politicsph.pogoport.com/task-force-marawi-kinumpirma-ang-pagkakaroon-ng-child-fighters-ng-maute-group/ …",,,,902022399100669953,https://twitter.com/muzi_kha/status/902022399100669953
chris19thws,2017-08-28 12:17,0,0,"Task Force Marawi, kinumpirma ang pagkakaroon ng child fighters ng Maute Group https://politicsph.pogoport.com/task-force-marawi-kinumpirma-ang-pagkakaroon-ng-child-fighters-ng-maute-group/ …",,,,902022393631318016,https://twitter.com/chris19thws/status/902022393631318016
PoGo_Port,2017-08-28 12:17,0,0,"Task Force Marawi, kinumpirma ang pagkakaroon ng child fighters ng Maute Group https://politicsph.pogoport.com/task-force-marawi-kinumpirma-ang-pagkakaroon-ng-child-fighters-ng-maute-group/ …",,,,902022388543610880,https://twitter.com/PoGo_Port/status/902022388543610880
orga_ogop,2017-08-28 12:17,0,0,"Task Force Marawi, kinumpirma ang pagkakaroon ng child fighters ng Maute Group https://politicsph.pogoport.com/task-force-marawi-kinumpirma-ang-pagkakaroon-ng-child-fighters-ng-maute-group/ …",,,,902022383460024320,https://twitter.com/orga_ogop/status/902022383460024320
RTheKrak3n,2017-08-28 12:17,0,0,"Task Force Marawi, kinumpirma ang pagkakaroon ng child fighters ng Maute Group https://politicsph.pogoport.com/task-force-marawi-kinumpirma-ang-pagkakaroon-ng-child-fighters-ng-maute-group/ …",,,,902022374870192129,https://twitter.com/RTheKrak3n/status/902022374870192129
PresPoliticsPh,2017-08-28 12:17,0,0,"MARAWI UPDATE - AUGUST 28, 2017 LUMILIYAB NA BALITA NGAYONG ARAW !: http://youtu.be/npSwfZ4Ztxk?a  via @ YouTube",,@,,902022208511463425,https://twitter.com/PresPoliticsPh/status/902022208511463425
gmanews,2017-08-28 12:16,2,22,"Duterte confers Lapu-Lapu award on Espenido, Marawi fallen heroes http://gmane.ws/2vjBSRz",,,,902021982702649344,https://twitter.com/gmanews/status/902021982702649344
RSInews,2017-08-28 12:14,0,1,"Filippine. Ci torniamo oggi con Cristiano Tinazzi e Ruben Lagattolla. Più precisamente a Marawi, città in guerra,... http://fb.me/280SheF6a",,,,902021650539008000,https://twitter.com/RSInews/status/902021650539008000
rickrick888,2017-08-28 12:13,0,0,"Militar, nakaalerto sa posibleng ganti ng Maute sa pagkamatay ni Cayamora Maute. Nasa Marawi si RexCNNPH. http://cnn.ph/2wKFQmw  …",,,,902021360578437124,https://twitter.com/rickrick888/status/902021360578437124
cnnphilippines,2017-08-28 12:12,5,3,"Militar, nakaalerto sa posibleng ganti ng Maute sa pagkamatay ni Cayamora Maute. Nasa Marawi si @ RexCNNPH. http://cnn.ph/2wKFQmw pic.twitter.com/oqcLTw43Fw",,@,,902021003831738369,https://twitter.com/cnnphilippines/status/902021003831738369
AnsonReginald,2017-08-28 12:11,0,0,@ karadavid marawi will rise again https://www.instagram.com/p/BYUtcfdnYkW/,,@,,902020842263064577,https://twitter.com/AnsonReginald/status/902020842263064577
diethervc,2017-08-28 12:07,0,1,"To all # soldiers who defend # marawi to my # parents who always there, # Friends may the power wit u # NationalHeroesDay",,,# # # # #,902019778390269952,https://twitter.com/diethervc/status/902019778390269952
prncjnpgy,2017-08-28 12:06,0,0,nakakaawa yung mga family ng mga nasawing sundalo sa marawi :(,,,,902019577365782528,https://twitter.com/prncjnpgy/status/902019577365782528
hernit_rayner,2017-08-28 12:06,0,0,Buti pa ikaw...yung bf kong sundalo nasa marawi huhuhu tagal pa umuwi...,,,,902019466208231424,https://twitter.com/hernit_rayner/status/902019466208231424
dzbb,2017-08-28 12:04,0,1,"Mahigit 100 sundalo at pulis na napatay sa bakbakan sa Marawi City, ginawaran ng Order of Lapu-Lapu. # SuperBalitaSaTanghaliNationwide",,,#,902019014511038464,https://twitter.com/dzbb/status/902019014511038464
CJ_Chanco,2017-08-28 12:03,0,1,"So few real gains at such high cost (12k dead, a peace process in shambles, martial law, marawi, neoliberal budget & federal/tax system)",,,,902018869547687936,https://twitter.com/CJ_Chanco/status/902018869547687936
PHINewsNet2,2017-08-28 12:03,0,0,Duterte: I cannot thank them [fallen troops in Marawi] for their valuable service to our nation and we are forever in debt to them.,,,,902018836005654528,https://twitter.com/PHINewsNet2/status/902018836005654528
PHINewsNet2,2017-08-28 12:02,0,0,# BREAKINGNEWSNOW:Duterte awards Order of Lapu Lapu medals to 129 fatalities of Marawi siege and Chief Insp. Jovie Espenido | @ alexisbromero,,@,#,902018623769739264,https://twitter.com/PHINewsNet2/status/902018623769739264
trinityunimelb,2017-08-28 12:02,1,1,"Professor Tim Lindsey (TC 1981), speaking on additional military commitments to Marawi: http://ab.co/2wgOJAZ",,,,902018589355474944,https://twitter.com/trinityunimelb/status/902018589355474944
Pahtowtey,2017-08-28 12:02,0,0,Off to Marawi,,,,902018565535961088,https://twitter.com/Pahtowtey/status/902018565535961088
ghippysam,2017-08-28 12:02,0,0,Yes the incident in Marawi intensified the need for mental health services,,,,902018407800778753,https://twitter.com/ghippysam/status/902018407800778753
PHINewsNet2,2017-08-28 12:00,0,0,# BREAKINGNEWSNOW:Terrorist leader Isnilon Hapilon still in Marawi but trying to escape says Lt. Gen. Carlito Galvez. (via @ sandraguinaldo),,@,#,902018123066294274,https://twitter.com/PHINewsNet2/status/902018123066294274
PhilippineStar,2017-08-28 12:00,2,4,Marawi donations for 68 slain soldiers hit P68 M http://bit.ly/2wKS8et pic.twitter.com/1yYwIDJXrv,,,,902017905029611521,https://twitter.com/PhilippineStar/status/902017905029611521
deinaaaaaaaaaa,2017-08-28 11:59,0,0,"Tropa nya marawi"" HAHAHA GAGU KA BRY""",,,,902017746115862530,https://twitter.com/deinaaaaaaaaaa/status/902017746115862530
MariaAareenSofi,2017-08-28 11:57,0,0,Dati tuwing National Heroes Day mga bayani ng unang panahon ang inaalala. Ngayon kasama na ang mga sundalong namatay sa bakbakang Marawi,,,,902017360252379136,https://twitter.com/MariaAareenSofi/status/902017360252379136
Ideal_Views,2017-08-28 11:55,0,0,"http://newsinfo.inquirer.net/926072/news-rodrigo-duterte-jovie-espenido-marawi-order-of-lapu-lapu-national-heroes-day-taguig-city-magalong-medal-parojinog-kalasag-medal … Duterte gives Lapu-Lapu award to Espenido, 129 Marawi fallen",,,,902016775449178112,https://twitter.com/Ideal_Views/status/902016775449178112
PTVph,2017-08-28 11:53,5,15,Mga beterano at pamilya ng mga sundalo at pulis na nasawi sa Marawi dumalo sa National Heroes Day kasama si PRRD sa libingan ng mga bayani pic.twitter.com/jtkfEhRUUd,,,,902016244278116352,https://twitter.com/PTVph/status/902016244278116352
enajsancho,2017-08-28 11:52,0,0,Mga kaanak ng Fallen Soldiers ng Marawi tinanggap ang Order of Lapu-Lapu Kalasag Medal mula kay… https://www.instagram.com/p/BYUrTYsAzXk/,,,,902016134416871424,https://twitter.com/enajsancho/status/902016134416871424
News5AKSYON,2017-08-28 11:51,1,4,"WMC Lt. Gen. Galvez: With the phase of the on-going military operation in Marawi, I can confidently say that the end is very near.""""",,,,902015712486539265,https://twitter.com/News5AKSYON/status/902015712486539265
News5AKSYON,2017-08-28 11:50,2,2,WMC Lt. Gen. Galvez says they might ask for assistance from foreign countries on clearing Marawi's main battle area | @ KatherineImsonpic.twitter.com/DdlvRjH8rt,,@,,902015516528615424,https://twitter.com/News5AKSYON/status/902015516528615424
Radyo_Agila1062,2017-08-28 11:47,0,0,"Nasasawi sa bakbakan sa Marawi, umakyat na sa 772 - http://bit.ly/2vjDef2 pic.twitter.com/6Y1xffwMib",,,,902014686790647809,https://twitter.com/Radyo_Agila1062/status/902014686790647809
baptistaivanaaa,2017-08-28 11:45,0,0,Sundalo daw ako ng marawi hahaha,,,,902014349371256832,https://twitter.com/baptistaivanaaa/status/902014349371256832
dwiz882,2017-08-28 11:45,0,1,"# IZHeadlines Pangulong Duterte, pinangunahan ang selebrasyon ng # NationalHeroesDay; 129 sundalong nasawi sa Marawi, ginawaran ng medalya",,,# #,902014301870866432,https://twitter.com/dwiz882/status/902014301870866432
redslim08,2017-08-28 11:45,0,0,"Nagrereklamo kayo sa trapik, sa patayan, sa gulo sa marawi, sa korapsyon, sa pagkawala ni uber at iba pa.... http://fb.me/2bskQTrR8",,,,902014282593955840,https://twitter.com/redslim08/status/902014282593955840
PTVph,2017-08-28 11:44,2,5,"NEWS BREAK: PRRD, nagbigay pugay ang mga nasawing militar, pulis at sibilyan dahil sa kaguluhan sa Marawi City kasabay ng Araw ng mga Bayani pic.twitter.com/OrKiT8MdZW",,,,902014086241632256,https://twitter.com/PTVph/status/902014086241632256
KatherineImson,2017-08-28 11:43,0,0,"WMC Lt. Gen. Galvez | with the phase of the on-going mil opn in Marawi, i can confidently say that the end is very near @ News5AKSYON",,@,,902013781793837056,https://twitter.com/KatherineImson/status/902013781793837056
PHLNewsInsider,2017-08-28 11:43,0,0,# BREAKINGNEWSNOW:Terrorist leader Isnilon Hapilon still in Marawi but trying to escape says Lt. Gen. Carlito Galvez. (via @ sandraguinaldo),,@,#,902013771106762752,https://twitter.com/PHLNewsInsider/status/902013771106762752
bbnijungkook,2017-08-28 11:43,0,1,tapon ko marawi umangal sige HAHAHAHA,,,,902013740685463553,https://twitter.com/bbnijungkook/status/902013740685463553
KatherineImson,2017-08-28 11:43,0,0,WMC Com. Lt. Gen. Galvez says they might asked for assistance from foreign countries on clearing Marawi's main battle area @ News5AKSYONpic.twitter.com/5OClNbUjQM,,@,,902013654559633408,https://twitter.com/KatherineImson/status/902013654559633408
bobbit2266,2017-08-28 11:42,0,0,Terrorist leader Isnilon Hapilon still in Marawi but trying to escape says Lt. Gen. Carlito Galvez. — sandra aguinaldo (sandraguinaldo) Au…,,,,902013537685524480,https://twitter.com/bobbit2266/status/902013537685524480
cescarala,2017-08-28 11:41,0,0,Marawi mall,,,,902013156033126405,https://twitter.com/cescarala/status/902013156033126405
PTVph,2017-08-28 11:35,2,3,"UPDATE: Kabayanihan ng mga sundalong nasawi at patuloy na lumalaban para sa kalayaan ng Marawi,kinilala ng OPAPP ngayong araw ng mga bayani. pic.twitter.com/j2g5TlxSFs",,,,902011606510444544,https://twitter.com/PTVph/status/902011606510444544
alaturka,2017-08-28 11:33,0,0,Militants put up last stand in Marawi https://www.alaturka.us/militants-put-up-last-stand-in-marawi/ …,,,,902011177592639488,https://twitter.com/alaturka/status/902011177592639488
AayrahAmerol,2017-08-28 11:33,0,0,Yung akic sa Marawi hindi dto Iligan,,,,902011105991467008,https://twitter.com/AayrahAmerol/status/902011105991467008
AayrahAmerol,2017-08-28 11:32,0,0,Yung buhay sa marawi.,,,,902010914710331392,https://twitter.com/AayrahAmerol/status/902010914710331392
zyiteblog,2017-08-28 11:30,0,0,President gives posthumous recognition to 129 soldiers killed in Marawi http://ow.ly/thfL50dH5iP,,,,902010508420767745,https://twitter.com/zyiteblog/status/902010508420767745
LOCALNEWSNgayon,2017-08-28 11:29,0,0,"Duterte confers Lapu-Lapu award on Espenido, Marawi fallen heroes | Read: http://ift.tt/2xpO8NK  via GMA News",,,,902010144342626306,https://twitter.com/LOCALNEWSNgayon/status/902010144342626306
ebetdz,2017-08-28 11:29,0,0,KUDOS sa mga Sundalo na nakipaglaban sa MARAWI # ShowtimeSaLudoSaBayani,,,#,902010142148800513,https://twitter.com/ebetdz/status/902010142148800513
inquirerdotnet,2017-08-28 11:28,1,1,"# PresidentDuterte gives Lapu-Lapu award to Espenido, 129 Marawi fallen | @ ncorralesinq http://ebx.sh/2iBPC43 pic.twitter.com/L8v8S27FlW",,@,#,902010065607151616,https://twitter.com/inquirerdotnet/status/902010065607151616
Wadabaday,2017-08-28 11:27,1,0,Salute not only for the old heroes but also to the new who offered their lives for Marawi. # ArawNgMgaBayani2017,,,#,902009616338321408,https://twitter.com/Wadabaday/status/902009616338321408
PTVph,2017-08-28 11:25,0,1,Galvez: Abdullah Maute possibly out of Marawi main battle area already | via @ jervismanahan,,@,,902009279367979008,https://twitter.com/PTVph/status/902009279367979008
ivyriotreads,2017-08-28 11:25,0,0,# oplanpasasalamat Wounded Marawi soldiers pic.twitter.com/lhHPIz8H2N,,,#,902009263949627392,https://twitter.com/ivyriotreads/status/902009263949627392
BusinessMirror,2017-08-28 11:25,0,0,Toy collectors gather in swap meet to cheer Marawi children | via @ rodrik_28 - http://bit.ly/2xphqvO,,@,,902009207875973121,https://twitter.com/BusinessMirror/status/902009207875973121
jervismanahan,2017-08-28 11:24,3,2,Galvez: Abdullah Maute possibly out of Marawi main battle area already @ PTVph,,@,,902008847547588609,https://twitter.com/jervismanahan/status/902008847547588609
jdesignz,2017-08-28 11:23,0,0,"Duterte confers Lapu-Lapu award on Espenido, Marawi fallen heroes http://ift.tt/2xpO8NK  http://ift.tt/eA8V8J",,,,902008778131898369,https://twitter.com/jdesignz/status/902008778131898369
sandraguinaldo,2017-08-28 11:23,6,23,Terrorist leader Isnilon Hapilon still in Marawi but trying to escape says Lt. Gen. Carlito Galvez.,,,,902008725816336385,https://twitter.com/sandraguinaldo/status/902008725816336385
PHLNewsInsider,2017-08-28 11:20,0,0,# BREAKINGNEWSNOW:Duterte awards Order of Lapu Lapu medals to 129 fatalities of Marawi siege and Chief Insp. Jovie Espenido | @ alexisbromero,,@,#,902007970833113088,https://twitter.com/PHLNewsInsider/status/902007970833113088
PHLNewsOnline,2017-08-28 11:20,0,1,"[GMA News] Duterte confers Lapu-Lapu award on Espenido, Marawi fallen heroes https://goo.gl/fb/VEixQs",,,,902007873957486594,https://twitter.com/PHLNewsOnline/status/902007873957486594
LaurentLeGodec,2017-08-28 11:20,1,2,Moving & meaningful ceremony at # Libingan 4 # NationalHeroesDay with relatives of soldiers & policemen fallen in # Marawi. True heroes indeed.,,,# # #,902007872417968131,https://twitter.com/LaurentLeGodec/status/902007872417968131
maxangelo987,2017-08-28 11:13,0,0,http://bit.ly/2wVTIq2  St. Mary's Cathedral in Marawi has been retaken by the government troops. | via sandraguinaldo # gmanews,,,#,902006159716098048,https://twitter.com/maxangelo987/status/902006159716098048
philmonitor,2017-08-28 11:12,0,0,Military: Child Warriors Joins Terrorists In Marawi Battlefield - http://www.philmonitor.com/news/2017/08/military-child-warriors-joins-terrorists-in-marawi-battlefield/ … via @ philmonitor,,@,,902005982561173504,https://twitter.com/philmonitor/status/902005982561173504
PhilippineStar,2017-08-28 11:10,1,2,Duterte awards Order of Lapu Lapu medals to 129 fatalities of Marawi siege and Chief Insp. Jovie Espenido | @ alexisbromero,,@,,902005476841349120,https://twitter.com/PhilippineStar/status/902005476841349120
enajsancho,2017-08-28 11:10,0,1,"Look: Youngest Fallen Soldier of Marawi, Pfc Bernie Lunas @ dzar1026 smni_news https://www.instagram.com/p/BYUmbH-A8P4/",,@,,902005407132123136,https://twitter.com/enajsancho/status/902005407132123136
PunchTheLies,2017-08-28 11:09,45,49,"Duterte gives Lapu-Lapu award to ESPENIDO, 129 Marawi fallen. Why Espenido??? # BABanaDutertepic.twitter.com/BJr0iOhCI6",,,#,902005176881565696,https://twitter.com/PunchTheLies/status/902005176881565696
inquirer_libre,2017-08-28 11:08,0,0,"Duterte gives Lapu-Lapu award to Espenido, 129 Marawi fallen http://ebx.sh/2wh3sfp",,,,902005024586391552,https://twitter.com/inquirer_libre/status/902005024586391552
furtiveglanzer,2017-08-28 11:07,0,2,Salute to the heroes of Marawi! Salute to all who fought for the country! # ArawNgMgaBayani2017,,,#,902004721786920960,https://twitter.com/furtiveglanzer/status/902004721786920960
bobbit2266,2017-08-28 11:07,0,0,"St. Mary's Cathedral in Marawi has been retaken by the government troops. | via sandraguinaldo — GMA News (gmanews) August 28, 2017",,,,902004659036008449,https://twitter.com/bobbit2266/status/902004659036008449
SOLEHEROMNL,2017-08-28 11:06,0,0,"the soldiers fighting in Marawi City, and to all those continuously creating a change in our world, little by little. (4)",,,,902004398708031488,https://twitter.com/SOLEHEROMNL/status/902004398708031488
MuffinsForFree,2017-08-28 11:05,0,0,"Nanaginip ako, tapos na daw yung gyera sa marawi...hindi pa pala :( huhuhu",,,,902004098995691520,https://twitter.com/MuffinsForFree/status/902004098995691520
kieramiranda,2017-08-28 11:04,0,2,"National Heroes Day today, Mabuhay Hero, lalo na ang mga sundaling nakikipaglaban sa Marawi. Yun anh mga tunay na Hero",,,,902003995438333952,https://twitter.com/kieramiranda/status/902003995438333952
alexisbromero,2017-08-28 11:03,0,0,Duterte awards Order of Lapu Lapu medals to 129 fatalities of Marawi siege and Chief Insp. Jovie Espenido @ PhilippineStar @ PhilstarNews,,@ @,,902003776638263296,https://twitter.com/alexisbromero/status/902003776638263296
gmanews,2017-08-28 11:03,15,46,St. Mary's Cathedral in Marawi has been retaken by the government troops. | via @ sandraguinaldo,,@,,902003700314513409,https://twitter.com/gmanews/status/902003700314513409
marvinbeduya,2017-08-28 11:02,0,0,"Slowly, the normalization process proceeds in Marawi! http://fb.me/8n4KB0GCn",,,,902003342582448128,https://twitter.com/marvinbeduya/status/902003342582448128
puretuts,2017-08-28 11:01,0,0,The hospital in Marawi is named after him.,,,,902003194288496640,https://twitter.com/puretuts/status/902003194288496640
sandraguinaldo,2017-08-28 10:58,1,15,St. Mary's Cathedral in Marawi retaken by government troops. @ gmanews,,@,,902002374708838400,https://twitter.com/sandraguinaldo/status/902002374708838400
jovelyn_n,2017-08-28 10:56,0,0,"Marawi terrorists mount 'last stand', child warriors join battlefield: military https://goo.gl/fb/e2Jero",,,,902001902493282304,https://twitter.com/jovelyn_n/status/902001902493282304
WagAkoSabi,2017-08-28 10:55,0,0,Saludo para sa mga bayani sa digmaan sa Marawi! # NationalHeroesDay,,,#,902001570102906883,https://twitter.com/WagAkoSabi/status/902001570102906883
PhilDefNews,2017-08-28 10:53,0,0,Summary of the War in Marawi thus far this National Heroes' Day https://www.facebook.com/manilabulletin/videos/10155983994067985/ …,,,,902001179130863616,https://twitter.com/PhilDefNews/status/902001179130863616
rickrick888,2017-08-28 10:53,0,0,AFP Spokesperson Padilla: Maute patriarch's death may intensify fighting in Marawi http://cnn.ph/2wKFQmw  pic.twitter.com/XSodPXqk8E — CNN…,,,,902001070540550144,https://twitter.com/rickrick888/status/902001070540550144
deear016,2017-08-28 10:52,0,0,Let's also celebrate this National Heroes Day for our soldiers still fighting for peace in Marawi. Mabuhay kayo!,,,,902000882765578240,https://twitter.com/deear016/status/902000882765578240
8trimedia,2017-08-28 10:52,0,0,"NASA LINYA: COL. ALEX ADUCA (Chief, 4th Infantry Battalion) RE: MARAWI UPDATE via YouTube: http://bit.ly/2wKTear # ka8trimediapic.twitter.com/R7CNl3kayl",,,#,902000791141081088,https://twitter.com/8trimedia/status/902000791141081088
cnnphilippines,2017-08-28 10:51,2,1,AFP Spokesperson Padilla: Maute patriarch's death may intensify fighting in Marawi http://cnn.ph/2wKFQmw pic.twitter.com/T0Tv3gdZLN,,,,902000640947138560,https://twitter.com/cnnphilippines/status/902000640947138560
elpidiolaiz,2017-08-28 10:47,1,1,"THANK YOU to troops esp in # Marawi, teachers heroes in classrooms, OFWs. Infographic frm Sen Sonny Angara ofc twitter # NationalHeroesDayhttps://twitter.com/SonnyAngaraNews/status/901972590213742594 …",,,# #,901999659584962561,https://twitter.com/elpidiolaiz/status/901999659584962561
jops1021,2017-08-28 10:46,0,0,"National Heroes day, I salute all modern heroes who fought in Marawi.",,,,901999276607148037,https://twitter.com/jops1021/status/901999276607148037
Doc4Dead,2017-08-28 10:44,5,20,Espenido? Insulto sa mga kaluluwa ng mga namatay sa Marawi. Tsaka kay Lapulapu. https://twitter.com/inquirerdotnet/status/901995352324280322 …,,,,901998978476138497,https://twitter.com/Doc4Dead/status/901998978476138497
PIAalerts,2017-08-28 10:43,0,0,"PIA-NCR: PRD: The ongoing crisis in Marawi, the brought forth valiant and benevolent acts of civilians and... http://fb.me/4QOlEIXEY",,,,901998694412713985,https://twitter.com/PIAalerts/status/901998694412713985
egdsgn,2017-08-28 10:41,0,0,"Rep. Gloria Macapagal-Arroyo, dumalaw sa mga bakwit mula Marawi https://politicsph.pogoport.com/rep-gloria-macapagal-arroyo-dumalaw-sa-mga-bakwit-mula-marawi/ …",,,,901998144472440835,https://twitter.com/egdsgn/status/901998144472440835
muzi_kha,2017-08-28 10:41,0,0,"Rep. Gloria Macapagal-Arroyo, dumalaw sa mga bakwit mula Marawi https://politicsph.pogoport.com/rep-gloria-macapagal-arroyo-dumalaw-sa-mga-bakwit-mula-marawi/ …",,,,901998139397349376,https://twitter.com/muzi_kha/status/901998139397349376
chris19thws,2017-08-28 10:41,0,0,"Rep. Gloria Macapagal-Arroyo, dumalaw sa mga bakwit mula Marawi https://politicsph.pogoport.com/rep-gloria-macapagal-arroyo-dumalaw-sa-mga-bakwit-mula-marawi/ …",,,,901998133709819904,https://twitter.com/chris19thws/status/901998133709819904
PoGo_Port,2017-08-28 10:41,0,0,"Rep. Gloria Macapagal-Arroyo, dumalaw sa mga bakwit mula Marawi https://politicsph.pogoport.com/rep-gloria-macapagal-arroyo-dumalaw-sa-mga-bakwit-mula-marawi/ …",,,,901998128051748868,https://twitter.com/PoGo_Port/status/901998128051748868
