politikovismin,2017-08-30 15:21,0,0,All-female troops deployed to help displaced families in Marawi http://mindanao.politics.com.ph/female-troops-deployed-help-displaced-families-marawi/ …,,,,902793258404683776,https://twitter.com/politikovismin/status/902793258404683776
DZMMTeleRadyo,2017-08-30 15:20,2,0,"# HeadlinePilipinas Dumayo pa sa Iligan City ang ilang tauhan ng NCRPO para mamahagi ng relief goods sa mahigit 1,000 bakwit mula Marawi. pic.twitter.com/KWxPKNKATx",,,#,902793209469796352,https://twitter.com/DZMMTeleRadyo/status/902793209469796352
toto_causing,2017-08-30 15:14,0,0,"All-women, all-Muslim contingent from the AFP and PNP off to rebuild Marawi http://mindanation.com/women-muslim-army-contingent-off-rebuild-marawi/ …",,,,902791539998441472,https://twitter.com/toto_causing/status/902791539998441472
rciagarmando,2017-08-30 15:14,0,0,So......we all just kinda met the mayor of Marawi. And I thought it was gonna be a dull work day.,,,,902791535867060224,https://twitter.com/rciagarmando/status/902791535867060224
toto_causing,2017-08-30 15:13,0,0,"ALL-MUSLIM WOMEN BATTALION OFF TO A MARAWI MISSION Our new heroes, all-Muslim battalion of women who are police... http://fb.me/wo1u0wol",,,,902791465830637568,https://twitter.com/toto_causing/status/902791465830637568
nolybig,2017-08-30 15:12,0,0,"UNTVNewsRescue: RT 99 army, PNP personnel deployed for rehabilitation mission in Marawi City READ: https://www.untvweb.com/news/99-army-pnp-personnel-deployed-rehabilitation-mission-marawi-city/ …",,,,902791032374484993,https://twitter.com/nolybig/status/902791032374484993
UNTVNewsRescue,2017-08-30 15:08,0,3,"99 army, PNP personnel deployed for rehabilitation mission in Marawi City READ: https://www.untvweb.com/news/99-army-pnp-personnel-deployed-rehabilitation-mission-marawi-city/ …",,,,902790217957965824,https://twitter.com/UNTVNewsRescue/status/902790217957965824
paolovarsi1,2017-08-30 15:08,0,0,Marawi. Liberata la Cattedrale | Tempi.it http://www.tempi.it/marawi-liberata-la-cattedrale-nessuna-notizia-dei-cristiani-rapiti …,,,,902790120922853376,https://twitter.com/paolovarsi1/status/902790120922853376
Fabimerlos,2017-08-30 15:08,0,0,El ejército filipino cerca a los yihadistas que combaten en Marawi http://dlvr.it/PjZ5c7 pic.twitter.com/rDDMy6OnyD,,,,902790005713649664,https://twitter.com/Fabimerlos/status/902790005713649664
OFWupdates,2017-08-30 15:07,0,0,Philippines: 18 more bodies recovered in Marawi - Anadolu Agency http://dlvr.it/PjZ50c pic.twitter.com/NdgK076Mwv,,,,902789777677631489,https://twitter.com/OFWupdates/status/902789777677631489
j_mreyes,2017-08-30 15:06,1,0,Duterte: I do not think the siege in Marawi will be the beginning and the end @ Malaya_Online,,@,,902789698262667264,https://twitter.com/j_mreyes/status/902789698262667264
pia_gutierrez,2017-08-30 15:04,0,1,"Duterte: Kailangan 20,000 army and 7 battalions of SAF. I do not think that the siege in Marawi will be the beginning and the end.",,,,902789118572224512,https://twitter.com/pia_gutierrez/status/902789118572224512
rapplerdotcom,2017-08-30 15:02,1,5,# PresidentDuterte: I don't think Marawi will be the beginning or the end.,,,#,902788509320093697,https://twitter.com/rapplerdotcom/status/902788509320093697
D_M_77,2017-08-30 15:01,0,0,Philippines: la cathédrale de Marawi reprise par l'armée - Radio Vatican http://fr.radiovaticana.va/news/1333512,,,,902788347063656448,https://twitter.com/D_M_77/status/902788347063656448
piaranada,2017-08-30 15:00,0,0,# PresidentDuterte: I don't think Marawi will be the beginning or the end.,,,#,902788196819386368,https://twitter.com/piaranada/status/902788196819386368
AayrahAmerol,2017-08-30 15:00,0,0,Kailan ba matatapos ang gulo sa marawi?,,,,902788185285058560,https://twitter.com/AayrahAmerol/status/902788185285058560
smh,2017-08-30 15:00,5,1,Philippine troops prepare final assault to end the almost 100-day battle of Marawi http://ow.ly/SXtD30eM7jp  | @ lindsay_murdoch,,@,,902788180809842688,https://twitter.com/smh/status/902788180809842688
DZMMTeleRadyo,2017-08-30 15:00,2,2,"# HeadlinePilipinas Mas lumiit pa ang teritoryong ginagalawan ng mga rebeldeng Maute sa nagpapatuloy na bakbakan sa Marawi, ayon sa AFP. pic.twitter.com/OqJuhSVhiC",,,#,902788081312440322,https://twitter.com/DZMMTeleRadyo/status/902788081312440322
AayrahAmerol,2017-08-30 15:00,0,0,Sana pwedi narin umuwi sa Marawi.,,,,902788049196597249,https://twitter.com/AayrahAmerol/status/902788049196597249
News5AKSYON,2017-08-30 14:59,0,1,Pres. Duterte: I do not think the siege of Marawi will be the beginning and the end.,,,,902787954782769152,https://twitter.com/News5AKSYON/status/902787954782769152
billballentine,2017-08-30 14:59,0,0,Philippines prepares to defeat Islamic State in final battle for Marawi http://twib.in/l/r5AxnagogjX5  via @ billballentinepic.twitter.com/SLPuo97cYJ,,@,,902787856581758976,https://twitter.com/billballentine/status/902787856581758976
jpjbencito,2017-08-30 14:59,0,0,Duterte: I do not believe that the Marawi siege [is the] beginning and the end,,,,902787742337089536,https://twitter.com/jpjbencito/status/902787742337089536
toto_causing,2017-08-30 14:58,0,0,OUR HEROES IN MARAWI http://fb.me/7Bc4cFrij,,,,902787656165285890,https://twitter.com/toto_causing/status/902787656165285890
NewsRmn,2017-08-30 14:58,0,0,"Valenzuela LGU, pinag-iingat ang mga residente nito sa mga nanghihingi ng solisitasyon para sa mga biktima sa Marawi https://rmn.ph/valenzuela-lgu-pinag-iingat-ang-mga-residente-nito-sa-mga-nanghihingi-ng-solisitasyon-para-sa-mga-biktima-sa-marawi-city/ …",,,,902787603157598208,https://twitter.com/NewsRmn/status/902787603157598208
philippines_tip,2017-08-30 14:58,0,0,Philippines: 18 more bodies recovered in Marawi - Anadolu Agency http://dlvr.it/PjZ13C,,,,902787484035063808,https://twitter.com/philippines_tip/status/902787484035063808
JohnBlaxland1,2017-08-30 14:57,7,5,Great collaborative piece on what to do about Marawi with @ ANU_SDSC @ NSC_ANU @ ASPI_org & @ LowyInstitute Thx to participantshttps://twitter.com/nsc_anu/status/902783241567969281 …,,@ @ @ @,,902787323431026688,https://twitter.com/JohnBlaxland1/status/902787323431026688
Layontayger,2017-08-30 14:49,0,0,"habang nanonood ako ng video ng mga sundalo na namatay cause of bakbakan sa marawi, i just couldn't help my tears from falling",,,,902785346697433088,https://twitter.com/Layontayger/status/902785346697433088
jassspreadlove,2017-08-30 14:47,0,0,"Retweeted CONCEPT ( @ ConceptGrp): President Duterte meets displaced Marawi children, vows to rebuild city... http://fb.me/FksgKa8C",,@,,902784945772482560,https://twitter.com/jassspreadlove/status/902784945772482560
jassspreadlove,2017-08-30 14:47,0,0,"Retweeted CONCEPT ( @ ConceptGrp): Duterte meets displaced Marawi children, vows to rebuild city... http://fb.me/8zXxP13u5",,@,,902784885320024064,https://twitter.com/jassspreadlove/status/902784885320024064
TelemundoAtl,2017-08-30 14:46,0,0,# MasNoticias El ejército filipino cerca a los yihadistas que combaten en Marawi http://ow.ly/2ItI50dJSlx,,,#,902784606604333056,https://twitter.com/TelemundoAtl/status/902784606604333056
PH_NewsDigest,2017-08-30 14:45,0,0,AFP preparing for ‘one big battle’ in Marawi http://dlvr.it/PjYvpK # MedicalandHeathCare,,,#,902784217653796864,https://twitter.com/PH_NewsDigest/status/902784217653796864
JakartaGreater,2017-08-30 14:44,0,0,Pimpinan Teroris Marawi Terkepung di Area 500 Meter Persegi https://jakartagreater.com/pimpinan-teroris-marawi-terkepung-di-area-500-meter-persegi/ … pic.twitter.com/AAThIpoO2Y http://fb.me/8OaX7AvfF,,,,902784074464538624,https://twitter.com/JakartaGreater/status/902784074464538624
JakartaGreater,2017-08-30 14:44,0,0,Pimpinan Teroris Marawi Terkepung di Area 500 Meter Persegi https://jakartagreater.com/pimpinan-teroris-marawi-terkepung-di-area-500-meter-persegi/ …pic.twitter.com/AAThIpoO2Y,,,,902784032345391104,https://twitter.com/JakartaGreater/status/902784032345391104
DavaoToday,2017-08-30 14:42,0,0,Women in uniform leading Marawi peace efforts http://davaotoday.com/main/politics/women-in-uniform-leading-marawi-peace-efforts/ …,,,,902783620766564353,https://twitter.com/DavaoToday/status/902783620766564353
pnagovph,2017-08-30 14:42,0,0,"Pres. Duterte meets displaced Marawi children, vows to rebuild city | @PresidentialCom | http://www.pna.gov.ph/articles/1007931 …pic.twitter.com/ZdTAuCsXee",,@PresidentialCom,,902783510426955776,https://twitter.com/pnagovph/status/902783510426955776
imwenx,2017-08-30 14:41,0,0,MINDANAO YUN B KATABI NG MARAWI,,,,902783258445856768,https://twitter.com/imwenx/status/902783258445856768
NSC_ANU,2017-08-30 14:41,4,2,Marawi and after: how Australia can help. New @ NSC Policy Options Paper @ JohnBlaxland1 @ JCarrollASPI @ AOCarr http://bit.ly/2xLZGds pic.twitter.com/U5O0Fm10Br,,@ @ @ @,,902783241567969281,https://twitter.com/NSC_ANU/status/902783241567969281
Maria86439147,2017-08-30 14:39,1,0,"marj: RT Maria86439147: marj: RT emjmbe_24: Sa Marawi mas malapit, ndi p naman tapos kaya maiihabol pa mga yan. Ha… https://twitter.com/MARJIE30/status/902773909422002180 …",,,,902782773160796160,https://twitter.com/Maria86439147/status/902782773160796160
JCarrollASPI,2017-08-30 14:39,7,7,@ ANU @ NSC_ANU @ ANU_SDSC New policy paper Marawi & After: How Aust can help https://nsc.crawford.anu.edu.au/department-news/11260/marawi-and-after-how-australia-can-help … @ JohnBlaxland1 @ AOCarr,,@ @ @ @ @,,902782707620495361,https://twitter.com/JCarrollASPI/status/902782707620495361
sightmagazine,2017-08-30 14:36,2,0,"Three months on: Islamists still hold Christian hostages, as # Marawi residents start to rebuild @ SightMagazinehttps://www.sightmagazine.com.au/news/7883-three-months-on-islamists-still-hold-christian-hostages-as-marawi-residents-start-to-rebuild …",,@,#,902782044609986560,https://twitter.com/sightmagazine/status/902782044609986560
Maria86439147,2017-08-30 14:34,1,0,"marj: RT emjmbe_24: Sa Marawi mas malapit, ndi p naman tapos kaya maiihabol pa mga yan. Hahaha! # PushAwardsMayWardshttps://twitter.com/MARJIE30/status/902773909422002180 …",,,#,902781490127392768,https://twitter.com/Maria86439147/status/902781490127392768
NewsWcn,2017-08-30 14:29,1,0,PHILIPPINES: # IslamicState Claims Killing 26 Soldiers In Clashes In # Marawi.,,,# #,902780275964469248,https://twitter.com/NewsWcn/status/902780275964469248
OFWupdates,2017-08-30 14:29,0,0,Philippines prepares to defeat Islamic State in final battle for Marawi - The Sydney Morning Herald http://dlvr.it/PjYncd,,,,902780203239432192,https://twitter.com/OFWupdates/status/902780203239432192
WFP_Philippines,2017-08-30 14:28,7,12,The Gov't of Japan formally handed over its contribution to WFP and @ unicefphils in support of the people affected by the conflict in Marawi pic.twitter.com/flj60pgmqG,,@,,902780098469740544,https://twitter.com/WFP_Philippines/status/902780098469740544
philippines_tip,2017-08-30 14:27,0,0,Philippines prepares to defeat Islamic State in final battle for Marawi - The Sydney Morning Herald http://dlvr.it/PjYn4M,,,,902779808534417408,https://twitter.com/philippines_tip/status/902779808534417408
taxreformPH,2017-08-30 14:22,0,0,"Marawi, military to benefit from P30-B gov't windfall from Mighty-JTI deal–Dominguez http://ift.tt/2xLGInk",,,,902778466910818304,https://twitter.com/taxreformPH/status/902778466910818304
FilY0,2017-08-30 14:20,2,5,Mautes & Duterte had a link according to the now dead father. Marawi incident and Many Fallen Soldiers could have been avoided. # DuterteFail,,,#,902777996804734976,https://twitter.com/FilY0/status/902777996804734976
AksyonTV,2017-08-30 14:15,0,0,# ICRC looks to reunite # families split up by Marawi crisis: ... https://goo.gl/fb/ED8YbD # breakingnews # national,,,# # # #,902776687963852800,https://twitter.com/AksyonTV/status/902776687963852800
PHLNewsOnline,2017-08-30 14:15,0,0,[News5] ICRC looks to reunite families split up by Marawi crisis https://goo.gl/fb/hQQVBR,,,,902776677197123586,https://twitter.com/PHLNewsOnline/status/902776677197123586
GLPiccoliICRC,2017-08-30 14:09,3,8,If you are looking for a # Missing family member in # Marawi see what you can do @ philredcross and https://familylinks.icrc.org/Philippines pic.twitter.com/gv4Syot8Dd,,@,# #,902775180350640128,https://twitter.com/GLPiccoliICRC/status/902775180350640128
junrebs,2017-08-30 14:08,0,0,Definitely. Fake News. Houston over marawi?,,,,902775016449875973,https://twitter.com/junrebs/status/902775016449875973
_beyahh,2017-08-30 14:07,0,0,Yung quiz kanina feeling ko nasa Marawi ako tapos lapis na walang tasa lang dala ko bakit ganon.,,,,902774682553905152,https://twitter.com/_beyahh/status/902774682553905152
junmanzanolive,2017-08-30 14:05,0,0,Donating stuff to our soldiers in Marawi. Little things count. https://www.instagram.com/p/BYaEG9zhVvR/,,,,902774367570026496,https://twitter.com/junmanzanolive/status/902774367570026496
y2Vvkru0Hf42tUg,2017-08-30 14:02,0,0,,,,,902773468114149377,https://twitter.com/y2Vvkru0Hf42tUg/status/902773468114149377
MikeeNoy,2017-08-30 14:01,0,1,"It only the 6.4B worth of shabu, # Marawi is still on going. Martial Law in the south is still on going # # FocusLikeAn Adik kailangan dto",,,# # #,902773335901306880,https://twitter.com/MikeeNoy/status/902773335901306880
PhilippineStar,2017-08-30 13:54,6,7,PNP files murder raps against own men over Marawi trooper's slay http://bit.ly/2x3q5GL pic.twitter.com/7tfPmRaWbj,,,,902771551925350401,https://twitter.com/PhilippineStar/status/902771551925350401
gerryblevins,2017-08-30 13:53,0,0,"There's white helmets here too, dodging bullets to rescue the people of marawi. Them white helmets follow ISIS everywhere they go.",,,,902771128913059840,https://twitter.com/gerryblevins/status/902771128913059840
TomMcIlroy,2017-08-30 13:50,0,3,Philippines keen for Australian intelligence help in Marawi http://www.theaustralian.com.au/national-affairs/philippines-keen-for-australian-intelligence-help-in-marawi/news-story/89532437c881689f1abf9f41f3e294db … by @ primroseriordan,,@,,902770470298247169,https://twitter.com/TomMcIlroy/status/902770470298247169
CNPH2016,2017-08-30 13:47,2,3,"UNICEF PROVIDES WATER KITS, HYGIENE KITS, TEMPORARY SANITATION FACILITIES FOR MARAWI The United Nations... http://fb.me/1dQVH4Lk2",,,,902769601355886592,https://twitter.com/CNPH2016/status/902769601355886592
PeruNewsweek,2017-08-30 13:45,0,0,YIHADISTAS FILIPINAS - El ejército filipino cerca a los yihadistas que combaten en Marawi http://ow.ly/Y4n650dJOmk,,,,902769250573713409,https://twitter.com/PeruNewsweek/status/902769250573713409
achengula,2017-08-30 13:44,0,0,"Mga sundalo sa Marawi City, tumaas ang morale kasunod ng pagbisita ni Pangulong Duterte http://achengula.com/2017/08/30/mga-sundalo-sa-marawi-city-tumaas-ang-morale-kasunod-ng-pagbisita-ni-pangulong-duterte/ …",,,,902768955680591872,https://twitter.com/achengula/status/902768955680591872
hotmanila,2017-08-30 13:41,0,3,"Why not to Marawi, where he's sure to find lots of criminals https://twitter.com/inquirerdotnet/status/902736248925634560 …",,,,902768235405344770,https://twitter.com/hotmanila/status/902768235405344770
mindanao_daily,2017-08-30 13:35,0,0,Maute’s patriarch withheld ‘vital info’ on Marawi siege - http://www.mindanaodailynews.com/mautes-patriarch-withheld-vital-info-on-marawi-siege/ …,,,,902766751682842624,https://twitter.com/mindanao_daily/status/902766751682842624
AwesomeMcLisse,2017-08-30 13:31,0,4,Ate Jamjam @ MCLISSEiCOFC you're welcome ate. Sana po matapos na po kaguluhan dyan sa Marawi para po makabalik na po kayo sa dating buhay.,,@,,902765576157880322,https://twitter.com/AwesomeMcLisse/status/902765576157880322
peruenlanoticia,2017-08-30 13:30,0,0,YIHADISTAS FILIPINAS - El ejército filipino cerca a los yihadistas que combaten en Marawi http://ow.ly/LPHD50dJNzM,,,,902765428363202560,https://twitter.com/peruenlanoticia/status/902765428363202560
ScionAi,2017-08-30 13:29,0,0,Marawi crisis is an example,,,,902765112955686916,https://twitter.com/ScionAi/status/902765112955686916
cmfr,2017-08-30 13:29,0,0,# QOTW: The Marawi crisis has reached its 100th day. Do you think media reported the war and its issues sufficiently?,,,#,902765082626674688,https://twitter.com/cmfr/status/902765082626674688
PSGC_,2017-08-30 13:28,0,0,PHILIPPINES TERROR - Philippine army surrounds Maute Group rebels in Marawi http://ift.tt/2wnfDHq,,,,902764927600996353,https://twitter.com/PSGC_/status/902764927600996353
WorldNews7777,2017-08-30 13:28,0,0,PHILIPPINES TERROR - Philippine army surrounds Maute Group rebels in Marawi http://ift.tt/2wnfDHq,,,,902764844532760576,https://twitter.com/WorldNews7777/status/902764844532760576
PHHotTrends,2017-08-30 13:22,0,0,PNP files murder raps against own men over Marawi trooper's slay # MarawiUpdateshttps://shar.es/1Slj13,,,#,902763419383844866,https://twitter.com/PHHotTrends/status/902763419383844866
thanhnamv1,2017-08-30 13:20,0,0,"BREAKING NEWS TODAY AUGUST 30, 2017 BONGBONG MARCOS l PRES DUTERTE l UBER l MARAWI UPDATES: http://youtu.be/4ooH5Q2kpFY?a  qua @ YouTube",,@,,902763049391718400,https://twitter.com/thanhnamv1/status/902763049391718400
PhilstarNews,2017-08-30 13:19,7,7,PNP files murder raps against own men over Marawi trooper's slay # MarawiUpdates https://shar.es/1Slj13,,,#,902762744918757377,https://twitter.com/PhilstarNews/status/902762744918757377
maxangelo987,2017-08-30 13:18,0,0,"http://bit.ly/2wVTIq2  UNICEF provides water kits, hygiene kits, temporary sanitation facilities for Marawi http://gmane.ws/2vD3iOi # gma…",,,#,902762472746176517,https://twitter.com/maxangelo987/status/902762472746176517
updatesmanila,2017-08-30 13:17,0,0,"UNICEF provides water kits, hygiene kits, temporary sanitation facilities for Marawi http://dlvr.it/PjYF6q pic.twitter.com/QCgMP4jVOg",,,,902762076271194113,https://twitter.com/updatesmanila/status/902762076271194113
LimaNoticia,2017-08-30 13:15,0,0,YIHADISTAS FILIPINAS - El ejército filipino cerca a los yihadistas que combaten en Marawi http://ow.ly/yKuz50dJNly,,,,902761661714575360,https://twitter.com/LimaNoticia/status/902761661714575360
svnovavida,2017-08-30 13:12,0,0,Philippines prepares to defeat Islamic State in final battle for Marawi http://www.smh.com.au/world/philippines-prepares-to-defeat-islamic-state-in-final-battle-for-marawi-20170830-gy72p0.html … via @ smh,,@,,902760826825838596,https://twitter.com/svnovavida/status/902760826825838596
gmanews,2017-08-30 13:11,7,23,"UNICEF provides water kits, hygiene kits, temporary sanitation facilities for Marawi http://gmane.ws/2vD3iOi",,,,902760542795739136,https://twitter.com/gmanews/status/902760542795739136
AlejoRinconM,2017-08-30 13:08,0,0,YIHADISTAS FILIPINAS - El ejército filipino cerca a los yihadistas que combaten en Marawi http://dlvr.it/PjY9TH # EFEpic.twitter.com/jUi0dI2yjZ,,,#,902759851268460544,https://twitter.com/AlejoRinconM/status/902759851268460544
gmanewsfacebook,2017-08-30 13:07,0,0,35 batang Bakwit mula Marawi City ang dinala sa Malacañang kahapon. Bukod sa paglilibot sa palasyo nakasama rin... http://fb.me/3gbx2gTqq,,,,902759555813306368,https://twitter.com/gmanewsfacebook/status/902759555813306368
DanHyslop,2017-08-30 13:05,3,1,Excellent overview of conflict dynamics in Mindanao given Marawi @ GlobPeaceIndexhttps://twitter.com/sidneyIPAC/status/902449951040356352 …,,@,,902759113796571136,https://twitter.com/DanHyslop/status/902759113796571136
greyridgegroup,2017-08-30 13:04,0,0,"“Has Marawi killed the Philippines peace process?” https://goo.gl/3ofwwg , via @ LowyInstitute",,@,,902758824142102529,https://twitter.com/greyridgegroup/status/902758824142102529
ClaroteloDigo,2017-08-30 13:00,0,0,Agencia EFE: YIHADISTAS FILIPINAS - El ejército filipino cerca a los yihadistas que combaten en Marawi http://ift.tt/2vHXtyr,,,,902757989303676928,https://twitter.com/ClaroteloDigo/status/902757989303676928
LimaNoticia,2017-08-30 13:00,0,0,YIHADISTAS FILIPINAS - El ejército filipino cerca a los yihadistas que combaten en Marawi http://ow.ly/5mso50dJMTF,,,,902757911226720256,https://twitter.com/LimaNoticia/status/902757911226720256
politikovismin,2017-08-30 13:00,0,0,10 terrorists killed in encounter in Marawi battle zone http://mindanao.politics.com.ph/10-terrorists-killed-encounter-marawi-battle-zone/ … # Marawi,,,#,902757790170710016,https://twitter.com/politikovismin/status/902757790170710016
SaidameerS,2017-08-30 12:56,0,0,First after 100 days of Marawi Siege. Miss you my dear Alma Mater. # MSUpic.twitter.com/yJUUQxbG2D,,,#,902756871358091268,https://twitter.com/SaidameerS/status/902756871358091268
AICSFlashNews,2017-08-30 12:55,0,0,Message from islamist groups in Marawi-Philippines pic.twitter.com/MWN8Xe7qLX,,,,902756634258264065,https://twitter.com/AICSFlashNews/status/902756634258264065
NoticiasPuntual,2017-08-30 12:54,0,0,YIHADISTAS FILIPINAS - El ejército filipino cerca a los yihadistas que combaten en Marawi http://j.mp/2wRrZux,,,,902756348131241990,https://twitter.com/NoticiasPuntual/status/902756348131241990
Vzla_BizarraOfi,2017-08-30 12:53,0,0,EFE: YIHADISTAS FILIPINAS - El ejército filipino cerca a los yihadistas que combaten en Marawi http://ift.tt/2vHXtyr,,,,902756157529391104,https://twitter.com/Vzla_BizarraOfi/status/902756157529391104
AICSpain,2017-08-30 12:52,0,0,Message from islamist groups in Marawi-Philippines pic.twitter.com/wQXuJ7KbEp,,,,902755952495091714,https://twitter.com/AICSpain/status/902755952495091714
DZMMTeleRadyo,2017-08-30 12:52,0,0,"# HeadlinePilipinas AFP chief of staff Gen. Año: Bakbakan sa Marawi, limitado na sa 500 sqm # MarawiClashpic.twitter.com/9TLPyvDp9R",,,# #,902755890364915714,https://twitter.com/DZMMTeleRadyo/status/902755890364915714
philippines_tip,2017-08-30 12:52,0,0,Philippines prepares to defeat Islamic State in final battle for Marawi - The Sydney Morning Herald http://dlvr.it/PjY3Wx,,,,902755773675175936,https://twitter.com/philippines_tip/status/902755773675175936
Jstnjs11,2017-08-30 12:51,0,1,Naiiyak ako sa patalastas ng abs-cbn about dun sa mga sundalong namatay sa marawi.,,,,902755547048550400,https://twitter.com/Jstnjs11/status/902755547048550400
CallMeEYNOT,2017-08-30 12:49,0,1,Lakas maka sad nung pinapakita sa abs cbn na mga asawa ng sundalong nasawi sa marawi,,,,902755230747697152,https://twitter.com/CallMeEYNOT/status/902755230747697152
AbleDart,2017-08-30 12:49,0,0,Has Marawi killed the Philippines peace process? https://www.lowyinstitute.org/the-interpreter/has-marawi-killed-philippines-peace-process …,,,,902755174200090626,https://twitter.com/AbleDart/status/902755174200090626
igrazedeleon,2017-08-30 12:48,0,0,Girl power: Female troops to embark on Marawi peace mission http://fb.me/3p5G6dnlB,,,,902755002241908737,https://twitter.com/igrazedeleon/status/902755002241908737
manilabulletin,2017-08-30 12:46,5,1,AFP chief of staff Gen. Eduardo Ano says Daesh inspired Maute Group terrorists has no way of getting out of Marawi City. | @ MBFTWakefield,,@,,902754276879081473,https://twitter.com/manilabulletin/status/902754276879081473
Alasmrane6,2017-08-30 12:42,0,0,,,,,902753483278954496,https://twitter.com/Alasmrane6/status/902753483278954496
DavaoToday,2017-08-30 12:42,0,0,President Duterte assured displaced children from Marawi City that the government will rebuild the war-torn city. http://davaotoday.com/main/politics/duterte-tells-displaced-marawi-children-we-will-rebuild-your-city/ …,,,,902753330052698112,https://twitter.com/DavaoToday/status/902753330052698112
PCSOLotteryDraw,2017-08-30 12:41,0,0,"MARAWI CITY UPDATE | AUGUST 30, 2017 http://youtu.be/Vp9lm8Yb0mk?a",,,,902753119750193152,https://twitter.com/PCSOLotteryDraw/status/902753119750193152
PCSOLotteryDraw,2017-08-30 12:41,0,0,"I added a video to a @ YouTube playlist http://youtu.be/Vp9lm8Yb0mk?a  MARAWI CITY UPDATE | AUGUST 30, 2017",,@,,902753059712925699,https://twitter.com/PCSOLotteryDraw/status/902753059712925699
CarrollRory,2017-08-30 12:40,0,0,"“Has Marawi killed the Philippines peace process?” https://goo.gl/3ofwwg , via @ LowyInstitute",,@,,902752751532339202,https://twitter.com/CarrollRory/status/902752751532339202
rickrick888,2017-08-30 12:37,0,0,"# InsideMarawi: Mga miyembro ng media, nakapasok sa war zone ng Marawi | # CNNPHBalitaan http://www.cnn.ph  pic.twitter.com/KBjZ3zBkZz —…",,,# #,902752028992163842,https://twitter.com/rickrick888/status/902752028992163842
inquirerdotnet,2017-08-30 12:33,2,3,AFP: Terrorist leaders in 500-square-meter pocket in Marawi http://ebx.sh/2vCBQ3f,,,,902751082862039040,https://twitter.com/inquirerdotnet/status/902751082862039040
cnnphilippines,2017-08-30 12:32,6,5,"# InsideMarawi: Mga miyembro ng media, nakapasok sa war zone ng Marawi | # CNNPHBalitaan http://www.cnn.ph pic.twitter.com/V6zhHE68oK",,,# #,902750912892030976,https://twitter.com/cnnphilippines/status/902750912892030976
rickrick888,2017-08-30 12:32,0,0,Ngayon ang ika-isang daang araw mula nang sumiklab ang giyera sa Marawi City. Si RexCNNPH ay naguulat mula sa barangay ng Mapandi. …,,,,902750855144857603,https://twitter.com/rickrick888/status/902750855144857603
MBFTWakefield,2017-08-30 12:30,0,0,@ manila_bulletin AFP chief of staff Gen. Eduardo Ano says Daesh inspired Maute Group terrorists has no way of getting out of Marawi City.,,@,,902750437287366657,https://twitter.com/MBFTWakefield/status/902750437287366657
SmartNewsroom,2017-08-30 12:30,0,0,From Marawi to Iligan: The longest trip home (via @ PLDT News Center) https://buff.ly/2vqy7K4 pic.twitter.com/jwT18kcU8d,,@,,902750336665997312,https://twitter.com/SmartNewsroom/status/902750336665997312
rapplerdotcom,2017-08-30 12:30,10,16,"It's been 100 days since the Marawi crisis began. More than the clash, what do we know about the city? http://s.rplr.co/KPNADoQ",,,,902750276582563845,https://twitter.com/rapplerdotcom/status/902750276582563845
