Joeltaborasj,2017-10-18 7:33,16,38,with the liberation of marawi private and public education should work together to improve educational delivery to armm phched armmgov,"(['Philippines'], Location((12.7503486, 122.7312101, 0.0)))",@ @,,920432693363449857,https://twitter.com/Joeltaborasj/status/920432693363449857,en
kylebariwawarts,2017-10-18 7:33,0,2,marawi is finally free praise the lord,"(['kangkong'], Location((28.3239551, 87.4666551, 0.0)))",,,920432488320663552,https://twitter.com/kylebariwawarts/status/920432488320663552,en
edwindisbarro00,2017-10-18 7:32,0,1,philippines still hold hostage by a terrorist marawi marawiisfree,"(['Bulacan'], Location((14.794871, 120.8777119, 0.0)))",,# #,920432465272979457,https://twitter.com/edwindisbarro00/status/920432465272979457,en
rhoda_navarro,2017-10-18 7:32,0,0,rejoice liberation of marawi,,,# #,920432371047866369,https://twitter.com/rhoda_navarro/status/920432371047866369,en
cnnphilippines,2017-10-18 7:31,2,5,islamic studies expert after marawi war battle against radical ideas to remain,,,,920432062439370752,https://twitter.com/cnnphilippines/status/920432062439370752,en
stocksilog,2017-10-18 7:31,0,0,psei reaches new high as investors welcome marawi liberation manila philippines  the stock market opened the,"(['Republic of the Philippines'], Location((12.7503486, 122.7312101, 0.0)))",,,920432009624686592,https://twitter.com/stocksilog/status/920432009624686592,en
DailyRahnuma,2017-10-18 7:30,0,0,marawi liberated from daesh dutertedeclares,"(['Hyderabad', ' India'], Location((17.3886068, 78.4608095676, 0.0)))",,,920431938787307520,https://twitter.com/DailyRahnuma/status/920431938787307520,en
neilabayon7,2017-10-18 7:30,0,0,congress urged to create government bodyto oversee marawi city rehabilitation via businessmirror,"(['Northern Samar'], Location((12.42, 124.81, 0.0)))",@,,920431794175885313,https://twitter.com/neilabayon7/status/920431794175885313,en
UNASanDiego,2017-10-18 7:30,1,0,president duterte declares the southern city of marawi as liberated following the 6 month militant takeover,"(['Balboa Park', ' San Diego'], Location((37.72494875, -122.444804524, 0.0)))",,,920431791537782784,https://twitter.com/UNASanDiego/status/920431791537782784,en
PhilippineStar,2017-10-18 7:30,4,2,malaysian terrorist could be new is leader in marawi,"(['Philippines'], Location((12.7503486, 122.7312101, 0.0)))",,,920431741688602624,https://twitter.com/PhilippineStar/status/920431741688602624,en
EmperorLelouch_,2017-10-18 7:29,0,0,marawi city is liberated,,,,920431715373301760,https://twitter.com/EmperorLelouch_/status/920431715373301760,en
GinaRom98458218,2017-10-18 7:28,0,0,after the liberation tough time is realit takes a 100 billion to repair marawi ,"(['Wong Tai Sin District', ' Hong Ko'], Location((22.34432185, 114.202174349, 0.0)))",,,920431365446709248,https://twitter.com/GinaRom98458218/status/920431365446709248,en
nerowattz,2017-10-18 7:28,0,0,military pushes to defeat last marawi fighters inquirermobilehttp,"(['Makati City'], Location((14.5591272, 121.0202094, 0.0)))",,,920431291975327745,https://twitter.com/nerowattz/status/920431291975327745,en
myungcess,2017-10-18 7:28,0,0,this marawi song is just so heartfelt my heart aches every time i heard it play onn dzbb,,@,,920431291232694273,https://twitter.com/myungcess/status/920431291232694273,en
jon_canete,2017-10-18 7:25,0,1,whatever your political color is right now lets take a brief moment to thank our soldiers who died and liberated marawi mabuhay,"(['okotoks', 'ab canada'], Location((50.7240376, -113.979421, 0.0)))",,,920430610128158720,https://twitter.com/jon_canete/status/920430610128158720,en
victoryph,2017-10-18 7:25,107,291,call upon me in the day of trouble i shall rescue you and you will honor me  ps 5015 let us pray for marawi as rebuilding begins,"(['Republic of the Philippines'], Location((12.7503486, 122.7312101, 0.0)))",,,920430486287032320,https://twitter.com/victoryph/status/920430486287032320,en
TrendieePH,2017-10-18 7:24,0,0, marawi  baron geisler  piston  president duterte  maywardhappy creamothoughts 20171018 0713 08 trndnl,"(['Philippines'], Location((12.7503486, 122.7312101, 0.0)))",,#,920430380120977409,https://twitter.com/TrendieePH/status/920430380120977409,en
beagal11,2017-10-18 7:22,0,0,the messed with the wrong country we fight back we may be a third world but our bravery is 1st world marawi,"(['Philippines'], Location((12.7503486, 122.7312101, 0.0)))",,#,920429781941813248,https://twitter.com/beagal11/status/920429781941813248,en
xiaodao159111,2017-10-18 7:22,0,0,philippine president duterte declares marawi liberated from militants after fivemonth siege,,,,920429757723852800,https://twitter.com/xiaodao159111/status/920429757723852800,en
rickrick888,2017-10-18 7:19,0,0,islamic studies expert where will marawi get funds  cnn philippines cnnphilippines ,,,,920429019732029442,https://twitter.com/rickrick888/status/920429019732029442,en
jheffdeleon,2017-10-18 7:18,0,0,i added a video to a youtube playlist duterte declares marawi liberated but fighting continues,,@,,920428853855768576,https://twitter.com/jheffdeleon/status/920428853855768576,en
cnnphilippines,2017-10-18 7:18,2,7,islamic studies expert where will marawi get funds,,,,920428728953344001,https://twitter.com/cnnphilippines/status/920428728953344001,en
tehyayaya,2017-10-18 7:15,0,1,marawi is free and safe now ,,,,920428169437388800,https://twitter.com/tehyayaya/status/920428169437388800,en
NewsyVideos,2017-10-18 7:15,2,3,duterte says peace is restored in marawi city except for a few pockets of resistance ,"(['United States'], Location((39.7837304, -100.4458825, 0.0)))",,#,920427975916519424,https://twitter.com/NewsyVideos/status/920427975916519424,en
Politiko_Ph,2017-10-18 7:11,0,0,marawi liberation marks end of dark days of terrorism  bamaquinohttp,,@,,920426951814275072,https://twitter.com/Politiko_Ph/status/920426951814275072,en
habagatcentral,2017-10-18 7:08,0,2,we like to go back to marawi and recreate some of the shots that we took of its downtown six,"(['Republic of the Philippines'], Location((12.7503486, 122.7312101, 0.0)))",,,920426415585050625,https://twitter.com/habagatcentral/status/920426415585050625,en
ConceptGrp,2017-10-18 7:08,0,2,duterte says marawi liberated but battle continues,,,,920426342981681152,https://twitter.com/ConceptGrp/status/920426342981681152,en
BeachCAE,2017-10-18 7:07,4,8,philippines duterte victory over isis in marawi  the never ever again vow to squash any training grounds of jihadists terrorists,,,#,920426035929219072,https://twitter.com/BeachCAE/status/920426035929219072,en
pususuti,2017-10-18 7:07,0,1,duterte philippine military divide on state of battle for marawi via wsj,"(['Singapore'], Location((1.2904753, 103.8520359, 0.0)))",@,,920425976340758530,https://twitter.com/pususuti/status/920425976340758530,en
eha_news,2017-10-18 7:06,7,4,security operations to take back marawi city from daesh ends with success says phillippines president,"(['Turkey'], Location((38.9597594, 34.9249653, 0.0)))",,# #,920425789908291584,https://twitter.com/eha_news/status/920425789908291584,en
LancasterDioces,2017-10-18 7:06,0,0,philippines marawi freed from terrorists but islamic extremismremains,"(['In the North West of England'], Location((51.3351685, 7.26320898127, 0.0)))",,,920425700577902592,https://twitter.com/LancasterDioces/status/920425700577902592,en
chic_KENNfeet8,2017-10-18 7:06,1,2,soldiers in the marawi city are the true petmalu na lodi werpa for all of you kudos greatness marawisoldiers,,,# # #,920425699416014848,https://twitter.com/chic_KENNfeet8/status/920425699416014848,en
TrendieePH,2017-10-18 7:04,0,0, marawi  baron geisler  piston  maywardhappy creamothoughts  showtime 20171018 0653 08 trndnl,"(['Philippines'], Location((12.7503486, 122.7312101, 0.0)))",,#,920425337007280130,https://twitter.com/TrendieePH/status/920425337007280130,en
barnabychuck,2017-10-18 7:03,0,4,same day marawi was declared liberated isis is losing,"(['Manila', ' Philippines'], Location((14.5906216, 120.9799696, 0.0)))",,,920425178798088192,https://twitter.com/barnabychuck/status/920425178798088192,en
ninyaaofficial,2017-10-18 7:03,1,2,philippines hunts malaysian professor set to be regional isil leader after commanders killed in marawi,"(['Marikina', ' PH'], Location((14.6331084, 121.0993541, 0.0)))",,,920425095515881472,https://twitter.com/ninyaaofficial/status/920425095515881472,en
grahamtempest,2017-10-18 7:02,0,1,duterte declares liberation of marawi from isisaffiliated militants c2,"(['Longwood', ' Florida'], Location((28.7007225, -81.3492779714, 0.0)))",,,920424728959094784,https://twitter.com/grahamtempest/status/920424728959094784,en
CollectedN,2017-10-18 7:02,0,0,duterte says peace restored in marawi city,,,,920424688152731648,https://twitter.com/CollectedN/status/920424688152731648,en
topnewsource,2017-10-18 7:01,0,1,philippine president declares marawi liberated philippine president rodrigo duterte declared marawi liberated from proislamic state milita,,,,920424607311638528,https://twitter.com/topnewsource/status/920424607311638528,en
ilda_talk,2017-10-18 7:01,49,178,duterte was not mentioned daw when us congratulated ph on successful mission in marawi per jim paredes hey moron it was a team effort,,,,920424573669056512,https://twitter.com/ilda_talk/status/920424573669056512,en
Philreport,2017-10-18 7:00,0,1,marawi rehab prioritizes clearing of buildings residents return,,,,920424205975543808,https://twitter.com/Philreport/status/920424205975543808,en
PhilippineStar,2017-10-18 6:59,2,7,rody marawi liberated,"(['Philippines'], Location((12.7503486, 122.7312101, 0.0)))",,,920424052493185025,https://twitter.com/PhilippineStar/status/920424052493185025,en
daizuke001,2017-10-18 6:58,0,0,dutertenews details of foreign aid received for marawi rehabilitation 9,"(['davao city'], Location((7.22650725, 125.454887691, 0.0)))",,,920423759718129664,https://twitter.com/daizuke001/status/920423759718129664,en
jesuitajonathan,2017-10-18 6:58,0,1,philippines marawi freed from terrorists but islamic extremism remains,"(['Santiago', ' Chile'], Location((-33.4377968, -70.6504451, 0.0)))",,,920423707973054464,https://twitter.com/jesuitajonathan/status/920423707973054464,en
greytify,2017-10-18 6:55,0,0,god bless marawi,"(['Singapore'], Location((1.2904753, 103.8520359, 0.0)))",,#,920423159920070656,https://twitter.com/greytify/status/920423159920070656,en
derfliquigan,2017-10-18 6:55,0,5,god answered my prayers marawi is finally and actually free now,"(['honeymoon av\xc3\xa9'], Location((28.739251, -81.867991, 0.0)))",,,920423079389442048,https://twitter.com/derfliquigan/status/920423079389442048,en
jheffdeleon,2017-10-18 6:54,0,0,i added a video to a youtube playlist timeline the marawi conflict,,@,,920422888813092865,https://twitter.com/jheffdeleon/status/920422888813092865,en
Politiko_Ph,2017-10-18 6:51,7,12,dont lift martial law yet despite marawi liberation  jvejercitohttp,,@,,920421920398630912,https://twitter.com/Politiko_Ph/status/920421920398630912,en
TrendieePH,2017-10-18 6:49,0,0, marawi  baron geisler  maute  piston  president duterte 20171018 0633 08 trndnl,"(['Philippines'], Location((12.7503486, 122.7312101, 0.0)))",,#,920421616387088386,https://twitter.com/TrendieePH/status/920421616387088386,en
du30trends,2017-10-18 6:49,0,0,full speech  pres duterte in freed marawi  october 17 2017 via youtube,,@,,920421590319366144,https://twitter.com/du30trends/status/920421590319366144,en
FranklGlarino,2017-10-18 6:47,2,13,marawi has been liberated but look at those anti duterte individuals remaining quiet waiting for him to make a mistake,"(['Philippines'], Location((12.7503486, 122.7312101, 0.0)))",,,920421067629346816,https://twitter.com/FranklGlarino/status/920421067629346816,en
du30trends,2017-10-18 6:46,0,0,pres duterte scenes from marawi  october 17 2017 via youtube,,@,,920420778784575489,https://twitter.com/du30trends/status/920420778784575489,en
sevithethird,2017-10-18 6:46,0,0,this resembles what happened in marawi,"(['Lungsod ng Quezon'], Location((15.5536502, 120.8101793, 0.0)))",,,920420760438448128,https://twitter.com/sevithethird/status/920420760438448128,en
solis_tom,2017-10-18 6:44,0,2,i could give a shit about marawi i am focused on what could become of my federal state cordillera autonomous region igorot forever,,,,920420310284824576,https://twitter.com/solis_tom/status/920420310284824576,en
vatican_en,2017-10-18 6:44,1,2,philippines marawi freed from terrorists but islamic extremism remains lastampa,"(['Vatican City'], Location((41.9034912, 12.4528349, 0.0)))",@,,920420170882936832,https://twitter.com/vatican_en/status/920420170882936832,en
josienorton9,2017-10-18 6:42,0,0,premature ejaculation of phl duterte liberated marawihigh profile bomb maker and financier still holed upbum joy,,,,920419792082812928,https://twitter.com/josienorton9/status/920419792082812928,en
Philippinefails,2017-10-18 6:41,0,0,investigate marawi prior knowledge now cynthiavillar mannypacquiao vppilipinas lenirobredo,,@ @ @ @ @,,920419617008316416,https://twitter.com/Philippinefails/status/920419617008316416,en
Philippinefails,2017-10-18 6:40,0,0,investigate marawi prior knowledge now houseofrepsph bamaquino bongbongmarcos dickgordondg,,@ @ @ @ @,,920419264154148864,https://twitter.com/Philippinefails/status/920419264154148864,en
Philippinefails,2017-10-18 6:39,0,0,investigate marawi prior knowledge now bangonmarawi sengracepoe trillanessonny,,@ @PresidentialCom @ @,#,920418994661687296,https://twitter.com/Philippinefails/status/920418994661687296,en
aenewsline,2017-10-18 6:39,0,0,duterte says peace restored in marawi city 0,,,,920418962491486208,https://twitter.com/aenewsline/status/920418962491486208,en
ilda_talk,2017-10-18 6:37,37,96,jim struggled to come up with something negative to say vs duterte after the us congratulated ph on its successful mission in marawi,,,#,920418447078580225,https://twitter.com/ilda_talk/status/920418447078580225,en
NewsfromAmeric,2017-10-18 6:35,0,0,duterte declares liberation of marawi from isisaffiliated militants,"(['Whatlington', ' England'], Location((50.9356107, 0.5032022, 0.0)))",,,920417964142166017,https://twitter.com/NewsfromAmeric/status/920417964142166017,en
Mael70317,2017-10-18 6:34,0,0,rebuild marawi,"(['Makati', ' PH.'], Location((14.55459465, 121.021407905, 0.0)))",,#,920417870659469312,https://twitter.com/Mael70317/status/920417870659469312,en
keithoi,2017-10-18 6:34,0,0,world bank confirms aid to ph in rebuilding marawi city,,,,920417639524057088,https://twitter.com/keithoi/status/920417639524057088,en
JeLloyAngelo58,2017-10-18 6:33,0,0,i liked a youtube video esang de torres  awit sa marawi official lyric video,"(['Iligan City'], Location((8.17846435, 124.470789035, 0.0)))",@,,920417436238794754,https://twitter.com/JeLloyAngelo58/status/920417436238794754,en
Howieseverino,2017-10-18 6:32,0,40,it was a pleasure meeting and chatting with you in marawi thank you for your service to country,"(['Republic of the Philippines'], Location((12.7503486, 122.7312101, 0.0)))",,,920417327195217920,https://twitter.com/Howieseverino/status/920417327195217920,en
joseolaguer,2017-10-18 6:31,0,0,the marawi crisis has shown the presidents brilliant leadership  prosecutor caete d,"(['MANILA'], Location((14.5906216, 120.9799696, 0.0)))",,,920417054284320768,https://twitter.com/joseolaguer/status/920417054284320768,en
mt_pathfinder,2017-10-18 6:30,0,0,we spent millions in marawi duterte shoulda accepted the militia option to be honest,"(['Richmond', ' British Columbia'], Location((37.5385087, -77.43428, 0.0)))",,,920416727187431427,https://twitter.com/mt_pathfinder/status/920416727187431427,en
BeachCAE,2017-10-18 6:30,2,1,trumpeffect philippines pres duterte declares marawi city liberated vows to crush isis violence never ever again,,,# #,920416694086000640,https://twitter.com/BeachCAE/status/920416694086000640,en
TrendieePH,2017-10-18 6:29,0,0, marawi  baron geisler  maute  piston  president duterte 20171018 0614 08 trndnl,"(['Philippines'], Location((12.7503486, 122.7312101, 0.0)))",,#,920416439328264193,https://twitter.com/TrendieePH/status/920416439328264193,en
NofNewsFilipino,2017-10-18 6:26,0,0,marawi rehab gets china boost ,,,,920415811189194752,https://twitter.com/NofNewsFilipino/status/920415811189194752,en
alivesmatter1,2017-10-18 6:24,0,1,congratulation to duterte philippino soldiers destroy isis fighters duterte declares liberation of marawi,"(['Ontario', ' Canada'], Location((50.000678, -86.000977, 0.0)))",,#,920415141493182464,https://twitter.com/alivesmatter1/status/920415141493182464,en
Joeltaborasj,2017-10-18 6:22,15,76,thank you pres digong for leading the nation to victory in marawi w great sensitivity for the hostages marawi,"(['Philippines'], Location((12.7503486, 122.7312101, 0.0)))",,#,920414722674978817,https://twitter.com/Joeltaborasj/status/920414722674978817,en
Politiko_Ph,2017-10-18 6:21,0,1, rrddavao says marawi city liberated after siege,,@,,920414370382749696,https://twitter.com/Politiko_Ph/status/920414370382749696,en
Joeltaborasj,2017-10-18 6:20,8,37,we thank pres digong  security forces of the ph for the liberation of marawi time now for the nation to come together to rebuild marawi,"(['Philippines'], Location((12.7503486, 122.7312101, 0.0)))",,,920414151314305024,https://twitter.com/Joeltaborasj/status/920414151314305024,en
dzrhdagupan,2017-10-18 6:19,0,0,philippine president declares marawi liberated as battle goes on,,,,920413907046535168,https://twitter.com/dzrhdagupan/status/920413907046535168,en
Joeltaborasj,2017-10-18 6:17,22,143,we thank pres digong and the security forces of the philippines for the liberation of marawi,"(['Philippines'], Location((12.7503486, 122.7312101, 0.0)))",,,920413549800800257,https://twitter.com/Joeltaborasj/status/920413549800800257,en
LrizAmbyt,2017-10-18 6:14,0,0,thank god that marawimaranaos is finally freed from terrorists i hope that our govt now has a great plan for them marawi,"(['QUEEN OF SPADES\xc2\xa0\xe2\x99\xa0'], Location((37.9919369, -108.893993, 0.0)))",,#,920412743533936640,https://twitter.com/LrizAmbyt/status/920412743533936640,en
GoKuwait_Update,2017-10-18 6:14,0,0,duterte declares marawi liberated news,,,#,920412682716663808,https://twitter.com/GoKuwait_Update/status/920412682716663808,en
jistnews2016,2017-10-18 6:14,0,0,philippine president declares marawi liberated 9,"(['Dallas', ' TX'], Location((32.7762719, -96.7968559, 0.0)))",,,920412656456093699,https://twitter.com/jistnews2016/status/920412656456093699,en
wamiqhussainsh4,2017-10-18 6:14,0,0,philippines last leaders of istied siege killed in marawi via youtube,,@,,920412643109695488,https://twitter.com/wamiqhussainsh4/status/920412643109695488,en
imax111,2017-10-18 6:13,0,0,osint summary philippine military reportedly kills senior islamic state commanders in marawi,"(['everywhere'], Location((41.7776533, -72.6740756, 0.0)))",,,920412416122458112,https://twitter.com/imax111/status/920412416122458112,en
wamiqhussainsh4,2017-10-18 6:10,0,0,philippines declares victory over militants in marawi city via youtube,,@,,920411781951922176,https://twitter.com/wamiqhussainsh4/status/920411781951922176,en
atty_edarevalo,2017-10-18 6:10,1,8,liberation day i have participated in many flag raising ceremonies before but this is a class of its own that i recorded it marawi 17x17 u2,"(['Quezon City', ' Philippines'], Location((14.6509905, 121.0486155, 0.0)))",,,920411639958011904,https://twitter.com/atty_edarevalo/status/920411639958011904,en
metesohtaoglu,2017-10-18 6:09,2,1,philippine president duterte declares marawi city emptied from pro isis fighters,"(['Istanbul - Turkiye'], Location((41.0096334, 28.9651646, 0.0)))",,# # # #,920411408835272708,https://twitter.com/metesohtaoglu/status/920411408835272708,en
RodelMusa,2017-10-18 6:07,0,0,dutertenews details of foreign aid received for marawi rehabilitation,,,,920411036901023744,https://twitter.com/RodelMusa/status/920411036901023744,en
Arab_News,2017-10-18 6:07,3,7,marawi liberated from daesh duterte declares,"(['Saudi Arabia'], Location((17.7269134, 42.2363448, 0.0)))",,# #,920410853308010496,https://twitter.com/Arab_News/status/920410853308010496,en
rickrick888,2017-10-18 6:04,1,0,duterte declares marawi liberation from terrorists uu  cnn philippines cnnphilippines oc,,,,920410201387360256,https://twitter.com/rickrick888/status/920410201387360256,en
TrendieePH,2017-10-18 6:04,0,0, marawi  baron geisler  maute  piston  president duterte 20171018 0554 08 trndnl,"(['Philippines'], Location((12.7503486, 122.7312101, 0.0)))",,#,920410150971768832,https://twitter.com/TrendieePH/status/920410150971768832,en
cnnphilippines,2017-10-18 6:04,2,6,duterte declares marawi liberation from terrorists,,,,920410142998278145,https://twitter.com/cnnphilippines/status/920410142998278145,en
solis_tom,2017-10-18 6:03,1,4,war in raqqa  marawi look identical in various wayswhats striking isits combatants look like theyve been fighting a graveyard shift war,,,,920409921392295936,https://twitter.com/solis_tom/status/920409921392295936,en
MagisGratia,2017-10-18 6:01,0,1,isis lost its capital and marawi city has been liberated praise lord and please pray for the isis members because very few will catholic,,,# # #,920409553367392256,https://twitter.com/MagisGratia/status/920409553367392256,en
ginaalmonte7,2017-10-18 6:01,1,1,retweeted jorjani sinsuat  one of the most powerful photos i have ever seen marawi is free,"(['Quezon City', ' National Capital'], Location((14.6509905, 121.0486155, 0.0)))",@JSSinsuat,,920409439802241024,https://twitter.com/ginaalmonte7/status/920409439802241024,en
OrelFargas,2017-10-18 6:00,0,0,the battle of marawi is far from over but the progress by the philippines military brings hope to a dire situation,"(['Kitchener', ' Ontario'], Location((43.453168, -80.494423, 0.0)))",,,920409112139120640,https://twitter.com/OrelFargas/status/920409112139120640,en
LexjeffA,2017-10-18 5:57,1,7,god loves filipinos he never allow marawi incident to happen during the time of aquinos or any yellow vultures thank you lord mabuhay,"(['Davao Region', ' Republic of the'], Location((7.0645241, 125.6084143, 0.0)))",,,9.20409E+17,https://twitter.com/LexjeffA/status/920408569140224000,en
AlinsogJosan,2017-10-18 5:57,0,4,im so happy marawi siege is overthank you soldiersi hope poverty will end too ,"(['Shinjuku-ku', ' Tokyo'], Location((35.6937632, 139.7036319, 0.0)))",,,920408484281118720,https://twitter.com/AlinsogJosan/status/920408484281118720,en
PoliticalReader,2017-10-18 5:57,0,0,the battle for marawi showed islamic stateaffiliated fighters that a small group of militants can,"(['worldwide'], Location((53.4573434, -2.22698994022, 0.0)))",,# #,920408469085347840,https://twitter.com/PoliticalReader/status/920408469085347840,en
Bronxvoice1,2017-10-18 5:56,0,0,new post raqqa kirkuk marawi your wednesday briefing has been published on bronx voice ,"(['Bronx', ' New York'], Location((40.85703325, -73.8366961599, 0.0)))",,,920408125068455936,https://twitter.com/Bronxvoice1/status/920408125068455936,en
imax111,2017-10-18 5:54,0,0,duterte declares marawi free as sporadic clashes continue,"(['everywhere'], Location((41.7776533, -72.6740756, 0.0)))",,,920407735174344705,https://twitter.com/imax111/status/920407735174344705,en
imax111,2017-10-18 5:54,0,0,philippine marawi liberated from daeshlinked terrorists,"(['everywhere'], Location((41.7776533, -72.6740756, 0.0)))",,,920407732368363520,https://twitter.com/imax111/status/920407732368363520,en
imax111,2017-10-18 5:54,0,0,philippines duterte declares marawi freed from terrorist influence,"(['everywhere'], Location((41.7776533, -72.6740756, 0.0)))",,,920407729742729217,https://twitter.com/imax111/status/920407729742729217,en
globnewsen,2017-10-18 5:53,0,0,duterte declares marawi free as sporadic clashes continue,,,,920407430781112320,https://twitter.com/globnewsen/status/920407430781112320,en
globnewsen,2017-10-18 5:53,0,0,philippine marawi liberated from daeshlinked terrorists,,,,920407428604276737,https://twitter.com/globnewsen/status/920407428604276737,en
globnewsen,2017-10-18 5:53,0,0,philippines duterte declares marawi freed from terrorist influence,,,,920407425743753217,https://twitter.com/globnewsen/status/920407425743753217,en
RTVMalacanang,2017-10-18 5:53,2,3,visit to marawi 10172017 via youtube,"(['Manila', ' Philippines'], Location((14.5906216, 120.9799696, 0.0)))",@,,920407363156430848,https://twitter.com/RTVMalacanang/status/920407363156430848,en
inews2day,2017-10-18 5:52,0,0,and australia edition raqqa kirkuk marawi your wednesday briefing news,,,# #,920407269120110593,https://twitter.com/inews2day/status/920407269120110593,en
antzp37LA_USA,2017-10-18 5:50,2,3,get the latest update on the philippines victory over d maute isis group in marawi city giswithdsr untvnewsrescue uc,"(['The Valley', ' Los Angeles County'], Location((12.2185168, -69.0862994, 0.0)))",@ @,#,920406666796965889,https://twitter.com/antzp37LA_USA/status/920406666796965889,en
NofNewsFilipino,2017-10-18 5:50,0,0,marawi liberatedduterte  2,,,,920406571703705600,https://twitter.com/NofNewsFilipino/status/920406571703705600,en
TrendieePH,2017-10-18 5:49,0,0, marawi  baron geisler  maute  piston  president duterte 20171018 0534 08 trndnl,"(['Philippines'], Location((12.7503486, 122.7312101, 0.0)))",,#,920406441340567552,https://twitter.com/TrendieePH/status/920406441340567552,en
TrendieePH,2017-10-18 5:49,0,0, marawi  baron geisler  maute  president duterte  maywardhappy creamothoughts 20171018 0514 08 trndnl,"(['Philippines'], Location((12.7503486, 122.7312101, 0.0)))",,#,920406433983844352,https://twitter.com/TrendieePH/status/920406433983844352,en
