PHINewsNet1,2017-10-18 17:34,0,0,diokno on marawi rehab we lost our soldiers in marawi majority of marawi cities are ready for rehab after the death of terrorists,"(['Manila City', ' National Capital Region'], Location((14.5906216, 120.9799696, 0.0)))",,,920583823254986752,https://twitter.com/PHINewsNet1/status/920583823254986752,en
yellowberrycafe,2017-10-18 17:33,0,0,marawi rebuilding could cost 8 billion architect,,,,920583547567538177,https://twitter.com/yellowberrycafe/status/920583547567538177,en
PickPosts,2017-10-18 17:32,0,0,why marawis 300odd refugees dont blame islamicstate,,,,920583415719780352,https://twitter.com/PickPosts/status/920583415719780352,en
SAGEIntl66,2017-10-18 17:30,0,0,why victory in marawi doesnt mean the end of isis in asia,"(['Adelaide'], Location((-34.9274284, 138.599899, 0.0)))",,,920582754600812544,https://twitter.com/SAGEIntl66/status/920582754600812544,en
radyopilipinas1,2017-10-18 17:28,0,2,news diokno assures budget for marawi rehab,"(['Quezon City', ' Philippines'], Location((14.6509905, 121.0486155, 0.0)))",,,920582341092818944,https://twitter.com/radyopilipinas1/status/920582341092818944,en
yariilualhati,2017-10-18 17:26,0,3,lord im sorry for feeling nothing when im supposed to be grateful days ago the war in marawi ended thank you,"(['Republic of the Philippines'], Location((12.7503486, 122.7312101, 0.0)))",,,920581913701576705,https://twitter.com/yariilualhati/status/920581913701576705,en
MoRaY1959,2017-10-18 17:26,0,0,why marawis 300odd refugees dont blame islamic state via abcnews,"(['In the Middle of Nowhere'], Location((50.063242, -123.000116, 0.0)))",@,,920581826640351232,https://twitter.com/MoRaY1959/status/920581826640351232,en
MurrayHiebert1,2017-10-18 17:26,1,0,duterte philippine military differ on state of battle for marawi jmwatts via wsj,,@ @ @,# # #,920581784638836737,https://twitter.com/MurrayHiebert1/status/920581784638836737,en
PHINewsNet1,2017-10-18 17:25,0,0,dr mahmud is the malaysian terrorist the afp is still hunting learn about his role in the marawi clash,"(['Manila City', ' National Capital Region'], Location((14.5906216, 120.9799696, 0.0)))",,,920581621475983361,https://twitter.com/PHINewsNet1/status/920581621475983361,en
ThottupuramFr,2017-10-18 17:24,0,0,philippine president declares marawi liberated as battle goes on reuters,"(['Kottayam', ' Kerala', ' India'], Location((9.5916046, 76.5221304, 0.0)))",,,9.20581E+17,https://twitter.com/ThottupuramFr/status/920581282714624000,en
worldnews_net,2017-10-18 17:24,0,0,why marawis 300odd refugees dont blame islamic state u2 abcnetau abc news,,,# # #,920581276314296320,https://twitter.com/worldnews_net/status/920581276314296320,en
carlopii,2017-10-18 17:24,0,1,thank you for all our soldiers who offered their lives for our country marawi,,,#,920581240972914688,https://twitter.com/carlopii/status/920581240972914688,en
NofNewsFilipino,2017-10-18 17:23,0,0,editorial ridding marawi of black flags  six days before marawi will mark its fifth month in the midst of ,,,,920581194550460416,https://twitter.com/NofNewsFilipino/status/920581194550460416,en
PIAalerts,2017-10-18 17:23,0,0,pia11davcomval president rodrigo duterte on tuesday october 17 declared that marawi city has been liberated,"(['Philippines'], Location((12.7503486, 122.7312101, 0.0)))",,,920581116129660928,https://twitter.com/PIAalerts/status/920581116129660928,en
manilainformer,2017-10-18 17:23,0,0,legislative and executive spouses band together formarawi,"(['Manila'], Location((14.5906216, 120.9799696, 0.0)))",,,920581008897871873,https://twitter.com/manilainformer/status/920581008897871873,en
MurrayHiebert1,2017-10-18 17:23,1,1,philippines calls marawi liberated months after isis allies seized ithttps,,,# # #,920580982243299328,https://twitter.com/MurrayHiebert1/status/920580982243299328,en
bangonmarawiph,2017-10-18 17:22,3,1,tfbm to establish main hq in marawi city as soon as clearing is completed and work closely with local stakeholders bangonmarawilive,,,# # #,920580857064124417,https://twitter.com/bangonmarawiph/status/920580857064124417,en
pesonaIDnesia,2017-10-18 17:22,0,0,why marawis 300odd refugees dont blame islamic state for drawnout conflict,"(['Indonesia'], Location((-4.7993356, 114.5632032, 0.0)))",,,920580808934674432,https://twitter.com/pesonaIDnesia/status/920580808934674432,en
adharves,2017-10-18 17:21,6,11,why marawis 300odd refugees dont blame islamic state for drawnout conflict via abcnews,"(['Jakarta'], Location((-6.1753942, 106.827183, 0.0)))",@,,920580466616410112,https://twitter.com/adharves/status/920580466616410112,en
bangonmarawiph,2017-10-18 17:20,3,1,tfbm will work with lgus and msu to further review and finalize the consolidated masterplan for reconstruction  rehabilitation in marawi,,,# #,920580380029157378,https://twitter.com/bangonmarawiph/status/920580380029157378,en
inews2day,2017-10-18 17:18,0,0,president declares marawi city liberated from terrorists  news no,,,# # #,920579812330299395,https://twitter.com/inews2day/status/920579812330299395,en
bangonmarawiph,2017-10-18 17:17,3,0,marawi wants wider roads  new alternate roads to avoid problems encountered during the siege where people were trapped bangonmarawilive,,,# #,920579466383917056,https://twitter.com/bangonmarawiph/status/920579466383917056,en
autorenonline,2017-10-18 17:16,0,0,hapilon offered millions for escape from marawi cityafp,,,,920579358493937665,https://twitter.com/autorenonline/status/920579358493937665,en
bangonmarawiph,2017-10-18 17:16,3,1,msu prof invites snd lorenzana and tfbm members to build own homes  live in marawi when the time comes bangonmarawilive,,,# # #,920579226557849600,https://twitter.com/bangonmarawiph/status/920579226557849600,en
Politiko_Ph,2017-10-18 17:15,0,0,look outfit overkill bong go carries rifle handgun on announcement of marawis liberation,,,,920578955773542401,https://twitter.com/Politiko_Ph/status/920578955773542401,en
PHINewsNet1,2017-10-18 17:10,0,0,icymi i hereby declare marawi city liberated from the terrorists duterte said ,"(['Manila City', ' National Capital Region'], Location((14.5906216, 120.9799696, 0.0)))",,,920577712107880448,https://twitter.com/PHINewsNet1/status/920577712107880448,en
ifeanyi09152385,2017-10-18 17:08,0,0,rt cnn why the victory in the philippines city of marawi doesnt mean the end of isis in asia ,"(['Enugu', ' Nigeria'], Location((6.4499833, 7.5000007, 0.0)))",@,#,920577299501715456,https://twitter.com/ifeanyi09152385/status/920577299501715456,en
brycewg,2017-10-18 17:06,3,3,isis prides itself on the ability to regenerate sidneyipac talking to adharves about the latest in marawi ,"(['Jakarta Capital Region'], Location((-6.1753942, 106.827183, 0.0)))",@ @,,920576935121399808,https://twitter.com/brycewg/status/920576935121399808,en
SalvacionRJuan1,2017-10-18 17:04,0,0,let we all pray for marawi,"(['Hamtic', ' Antique Philippines'], Location((10.65933215, 121.939681326, 0.0)))",,,920576267874742272,https://twitter.com/SalvacionRJuan1/status/920576267874742272,en
AubreyTemon,2017-10-18 17:04,0,0,marawi liberated at last thank god and for the brave soldiers and policemen united prayers proven again jesus the peace speaker,"(['Davao Region', ' Republic of the'], Location((7.0645241, 125.6084143, 0.0)))",,,920576238611185665,https://twitter.com/AubreyTemon/status/920576238611185665,en
HarZZada,2017-10-18 17:02,0,2,marawi city will be busy spirited blooming city soon see the davao city how it blooms after du30 brushed up its streets thank you loren,"(['Finland'], Location((63.2467777, 25.9209164, 0.0)))",,,920575763430170624,https://twitter.com/HarZZada/status/920575763430170624,en
TagTheBird,2017-10-18 17:01,0,0,why the victory in the philippines city of marawi doesnt mean the end of isis in asia,,,,920575430356361216,https://twitter.com/TagTheBird/status/920575430356361216,en
BryanGrey18,2017-10-18 16:57,1,1,hands down to president duterte for ending the war in marawi im so proud,"(['Las Pinas', ' Philippines'], Location((-1.0917672, -80.8977939, 0.0)))",,,920574634059210752,https://twitter.com/BryanGrey18/status/920574634059210752,en
frapix11,2017-10-18 16:57,0,1,to sen risa one who rape 15 yo front of her mom in marawi isnt human,"(['National Capital Region'], Location((14.5736108, 121.0329706, 0.0)))",,,920574472943321090,https://twitter.com/frapix11/status/920574472943321090,en
dzrhlaoag,2017-10-18 16:56,0,0,world bank reaffirms aid in marawi rehabilitation,,,,920574256391606272,https://twitter.com/dzrhlaoag/status/920574256391606272,en
WEBFORVIRAL,2017-10-18 16:55,0,0,according to the report task force bangon marawi is looking at either fixing the houses demolishing then 0,"(['Planet Mars'], Location((47.7478023, -3.3604732, 0.0)))",,,920574079802908672,https://twitter.com/WEBFORVIRAL/status/920574079802908672,en
1Chodoro,2017-10-18 16:54,2,1,as i have been studying the use of air power in marawi i would have to agree with mr yap regarding this matter,,,,920573760071024640,https://twitter.com/1Chodoro/status/920573760071024640,en
SunStarDavao,2017-10-18 16:54,0,0,prrdinphotos look president rodrigo roa duterte made his seventh visit to marawi city on october 17 to declare,"(['Davao City', ' Davao Region'], Location((7.22650725, 125.454887691, 0.0)))",,#,920573671751737344,https://twitter.com/SunStarDavao/status/920573671751737344,en
NBCMontana,2017-10-18 16:53,0,0,national news why victory in marawi doesnt mean the end of isis in asia,"(['Montana'], Location((47.3752671, -109.6387579, 0.0)))",,,920573438850252801,https://twitter.com/NBCMontana/status/920573438850252801,en
DavidPapp,2017-10-18 16:48,8,8,the leaders of the isis assault on marawi in the philippines have been killed,"(['Edmonton'], Location((53.535411, -113.507996, 0.0)))",,,920572160363630593,https://twitter.com/DavidPapp/status/920572160363630593,en
genelynmagcase,2017-10-18 16:47,0,0,rt nababaha rt lorenlegarda  legarda lauds military troops urges early rehabilitation for marawipls read  via,,@ @drrmdreagion4a,,9.20572E+17,https://twitter.com/genelynmagcase/status/920572017451008000,en
merrilyoung,2017-10-18 16:46,0,1,rereading my tweets cause i wanna reminisce my marawi moments,"(['space'], Location((48.0579238, -1.7339158, 0.0)))",,,920571838010335232,https://twitter.com/merrilyoung/status/920571838010335232,en
Monitor_sur,2017-10-18 16:46,0,0,rt monitorsur lookingfornews cnn us why the victory in the philippines city of marawi doesnt mean the e c,"(['Los Angeles', ' CA'], Location((34.054935, -118.244476, 0.0)))",@,# #,920571698298179584,https://twitter.com/Monitor_sur/status/920571698298179584,en
Arab_News,2017-10-18 16:45,1,4,philippine city marawi liberated from daesh president duterte declares,"(['Saudi Arabia'], Location((17.7269134, 42.2363448, 0.0)))",,# # # #,920571419288854528,https://twitter.com/Arab_News/status/920571419288854528,en
rapplerdotcom,2017-10-18 16:45,4,7,secretary diokno said however that the government still has no final rehabilitation plan for marawi city,"(['Philippines'], Location((12.7503486, 122.7312101, 0.0)))",,,920571407121002496,https://twitter.com/rapplerdotcom/status/920571407121002496,en
egdsgn,2017-10-18 16:43,0,0,headstart hapilon maute tried to abandon own men in marawimilitary,"(['Davao City', ' Davao Region'], Location((7.22650725, 125.454887691, 0.0)))",,,920571099062161408,https://twitter.com/egdsgn/status/920571099062161408,en
shakesheave,2017-10-18 16:41,0,0,philippine president declares marawi liberated as battle goes on via mailonline,"(['New Zealand'], Location((-41.5000831, 172.8344077, 0.0)))",@,,920570613260943361,https://twitter.com/shakesheave/status/920570613260943361,en
roginhood,2017-10-18 16:41,0,0,hapilons last stand in marawi recalled,"(['Republic of the Philippines'], Location((12.7503486, 122.7312101, 0.0)))",,,920570458268995585,https://twitter.com/roginhood/status/920570458268995585,en
WEBFORVIRAL,2017-10-18 16:41,0,0,duterte pledged earlier to allocate at least p20 billion to rehabilitate marawi the money would be released in,"(['Planet Mars'], Location((47.7478023, -3.3604732, 0.0)))",,,920570447543992320,https://twitter.com/WEBFORVIRAL/status/920570447543992320,en
karl_ohb,2017-10-18 16:38,0,2,make marawi great again,"(['MNL'], Location((14.5121499, 121.022046716, 0.0)))",,,920569799070986240,https://twitter.com/karl_ohb/status/920569799070986240,en
hattilon,2017-10-18 16:38,0,0,love peace and hope loveparadeto marawi thnk u hellobangsie annecurtissmith team yellow nainspired kmi,,@ @,,920569746579509248,https://twitter.com/hattilon/status/920569746579509248,en
geemeera,2017-10-18 16:37,0,0,marawi rehab will soon to start tnx bangonmarawi partnerforchange buildbuildbuild,"(['Republic of the Philippines'], Location((12.7503486, 122.7312101, 0.0)))",,# # #,920569510301593600,https://twitter.com/geemeera/status/920569510301593600,en
manilabulletin,2017-10-18 16:36,3,3, dpwhph confirms the arrival of 47 sets of heavy equipment from china to aid for the quick recovery phase of marawi city  argyllcyrusmb,"(['Manila', ' Philippines'], Location((14.5906216, 120.9799696, 0.0)))",@ @,,920569300355649537,https://twitter.com/manilabulletin/status/920569300355649537,en
EddieQuyo,2017-10-18 16:35,0,2,is nilon hapi lon no way its the end of the road for this man of terror  omar maute a victory for afp  ppl of marawi,"(['California', ' USA'], Location((36.7014631, -118.7559974, 0.0)))",,,920568913133318144,https://twitter.com/EddieQuyo/status/920568913133318144,en
argyllcyrus_MB,2017-10-18 16:34,0,1, dpwhph confirms the arrival of 47 sets of heavy equipment from china to aid for the quick recovery phase of marawi city manilabulletin,"(['Manila City'], Location((14.5906216, 120.9799696, 0.0)))",@ @,,920568871316176897,https://twitter.com/argyllcyrus_MB/status/920568871316176897,en
etdbrief_ro_1,2017-10-18 16:34,0,0,scene of huge destruction in philippines marawi city which has just been captured from militants and faces rec ,,,,920568678567108610,https://twitter.com/etdbrief_ro_1/status/920568678567108610,en
phildaily,2017-10-18 16:33,0,0,marawi rehab funds enough technical assistance needed says dbm  rappler,,,,920568393870249984,https://twitter.com/phildaily/status/920568393870249984,en
johny2b,2017-10-18 16:32,1,0,china gives new equipment to philippines for marawi recovery diplomatapachttp,"(['Jakarta'], Location((-6.1753942, 106.827183, 0.0)))",@,,920568150428606464,https://twitter.com/johny2b/status/920568150428606464,en
syqau,2017-10-18 16:32,3,3,philippine soldiers show off the bodies of dead isis leaders killed in the wartorn city of marawi as duterte dec,"(['USA'], Location((39.7837304, -100.4458825, 0.0)))",,,920568137543806976,https://twitter.com/syqau/status/920568137543806976,en
DrKudNLPtutor4u,2017-10-18 16:31,0,0,at least 6 foreign terrorists still in marawi battle area  afp philippines,"(['England'], Location((52.7954791, -0.540240286617, 0.0)))",,#,920568117729923072,https://twitter.com/DrKudNLPtutor4u/status/920568117729923072,en
bangonmarawiph,2017-10-18 16:30,3,2,bangonmarawilive msu there is urgent need to improve health services  health information systems in marawi bangonmarawi tfbm,,,# # # #,920567666091241472,https://twitter.com/bangonmarawiph/status/920567666091241472,en
AsiaNewsEN,2017-10-18 16:30,0,0,philippines marawi liberated after five months of clashes,,,#,920567629382742016,https://twitter.com/AsiaNewsEN/status/920567629382742016,en
cmfr,2017-10-18 16:30,1,1,womens voices marawi crisis women ease pains of dislocation and homelessness,"(['Philippines'], Location((12.7503486, 122.7312101, 0.0)))",,#,920567628749574146,https://twitter.com/cmfr/status/920567628749574146,en
reyaika,2017-10-18 16:27,0,0,marawi rehab funds enough technical assistance needed says dbm  via rapplerdotcom,"(['Republic of the Philippines'], Location((12.7503486, 122.7312101, 0.0)))",@,,920566879822913541,https://twitter.com/reyaika/status/920566879822913541,en
bangonmarawiph,2017-10-18 16:26,3,0,bangonmarawilive msu what happened in marawi created a drastic change to society thus the need for immediate intervention on social devt,,,# #,920566817302618112,https://twitter.com/bangonmarawiph/status/920566817302618112,en
i__Global,2017-10-18 16:26,0,0,battle for marawi bitter siege that left a city in ruins 9,"(['Global'], Location((43.7283874, -79.3491487932, 0.0)))",,,920566706929627136,https://twitter.com/i__Global/status/920566706929627136,en
fvckgrp,2017-10-18 16:23,0,0,telling soldiers that the marawi conflict is the governments fault is dissing them soldier eh well that statement is nothing more than a malicious employ of post hoc its an obvious appeal to emotion and hate by a fallacy not good not polite,"(['Republic of the Philippines'], Location((12.7503486, 122.7312101, 0.0)))",,,920565999857844224,https://twitter.com/fvckgrp/status/920565999857844224,en
hattilon,2017-10-18 16:23,0,0,husay winner team yellow pd to love parade to marawi the mssge this performance wow peace love at may pag asa,,,,920565918660464640,https://twitter.com/hattilon/status/920565918660464640,en
khcjhk,2017-10-18 16:22,0,0,why marawi victory doesnt mean the end of isis in asia  what comes next for raqqa and isishttp,"(['Hong Kong'], Location((22.2793278, 114.1628131, 0.0)))",,,920565784522276864,https://twitter.com/khcjhk/status/920565784522276864,en
dionese_f,2017-10-18 16:22,0,0,goodnewsph du30admin terrorist maute leaders dead oct 17 2017 in marawi,"(['Netherlands'], Location((52.2379891, 5.53460738162, 0.0)))",,# #,920565736736739328,https://twitter.com/dionese_f/status/920565736736739328,en
KawKndo,2017-10-18 16:22,1,0,philippines the fighting in marawi is not over despite the claim of the government,"(['Southeast Asia'], Location((56.0000002, 103.9999998, 0.0)))",,# #,920565696878338048,https://twitter.com/KawKndo/status/920565696878338048,en
DavidPapp,2017-10-18 16:21,7,9,philippine president rodrigo duterte declares marawi liberated from isis terrorists,"(['Edmonton'], Location((53.535411, -113.507996, 0.0)))",,,920565362151784448,https://twitter.com/DavidPapp/status/920565362151784448,en
WorldNewsNgayon,2017-10-18 16:20,0,0,battle for marawi bitter siege that left a city in ruins via yahoo,"(['Worldwide'], Location((53.4573434, -2.22698994022, 0.0)))",,,920565280027312128,https://twitter.com/WorldNewsNgayon/status/920565280027312128,en
pjvl1507,2017-10-18 16:20,0,0,pray for marawi healourland,,,# #,920565250633510912,https://twitter.com/pjvl1507/status/920565250633510912,en
RiffRaffBriz,2017-10-18 16:20,1,0,dutertes declaration marawi is liberated symbolic  as fighting continues,"(['Selatan'], Location((-5.5, 127.566667, 0.0)))",,#,920565245084540928,https://twitter.com/RiffRaffBriz/status/920565245084540928,en
imjustidris,2017-10-18 16:20,0,0,congratulations marawi,"(['Republic of the Philippines'], Location((12.7503486, 122.7312101, 0.0)))",,,920565113408577536,https://twitter.com/imjustidris/status/920565113408577536,en
bangonmarawiph,2017-10-18 16:19,4,1,bangonmarawilive lgus of marawi  lanaodelsur submit budget proposal for reconstruction  rehabilitation for tfbm execomm review,,,# # # #,920565068168757248,https://twitter.com/bangonmarawiph/status/920565068168757248,en
vots2003,2017-10-18 16:19,0,0,afp looks for mautes p1b loot hidden in marawi ao,"(['Laguna', ' Philippines'], Location((14.1696476, 121.3336526, 0.0)))",,,920565023814160384,https://twitter.com/vots2003/status/920565023814160384,en
PMoallemian,2017-10-18 16:19,0,0,battle for marawi bitter siege that left a city in ruins  iran,"(['Toronto', ' Ontario'], Location((43.653963, -79.387207, 0.0)))",,#,920564955740590080,https://twitter.com/PMoallemian/status/920564955740590080,en
arriannejade22,2017-10-18 16:19,0,0,the marawi crisis has shown the presidents brilliant leadership  prosecutor caete c,"(['Cebu City', ' Central Visayas'], Location((10.3090298, 123.8930839, 0.0)))",,,9.20565E+17,https://twitter.com/arriannejade22/status/920564946533888000,en
inews2day,2017-10-18 16:18,0,0,for marawi bitter siege that left a city in ruins  news noticias nouv9,,,# # # #,920564740174372864,https://twitter.com/inews2day/status/920564740174372864,en
vots2003,2017-10-18 16:17,0,0,watch heydarian says marawi battle over but watch out for spectacular terrorist attacks,"(['Laguna', ' Philippines'], Location((14.1696476, 121.3336526, 0.0)))",,,920564435864969217,https://twitter.com/vots2003/status/920564435864969217,en
greenreflection,2017-10-18 16:14,1,0,asia and australia edition raqqa kirkuk marawi your wednesdaybriefing,,,,920563725530292224,https://twitter.com/greenreflection/status/920563725530292224,en
maxangelo987,2017-10-18 16:14,0,0, hapilon offered millions for escape from marawi city afp uuc gmanews,,,#,920563653828628480,https://twitter.com/maxangelo987/status/920563653828628480,en
jheffdeleon,2017-10-18 16:13,0,0,i added a video to a youtube playlist headstart hapilon maute tried to abandon own men in marawi military,,@,,920563547687579649,https://twitter.com/jheffdeleon/status/920563547687579649,en
DeMolayInAction,2017-10-18 16:13,0,0,inquirerdotnet multiagency teams assessing marawi damage  ndrrmc,"(['Republic of the Philippines'], Location((12.7503486, 122.7312101, 0.0)))",@,,920563451239337989,https://twitter.com/DeMolayInAction/status/920563451239337989,en
senatePH,2017-10-18 16:12,0,1,cabinet senate congressional spouses band together for marawi,"(['Pasay City', ' Philippines'], Location((14.5437592, 120.9954657, 0.0)))",,,920563292950712320,https://twitter.com/senatePH/status/920563292950712320,en
savimendoza,2017-10-18 16:12,0,0,sen lorenlegarda  p16b locked in 2017 2018 budgets to restore marawis former glory via politikovismin,,@ @,,920563191725228032,https://twitter.com/savimendoza/status/920563191725228032,en
msianinsight,2017-10-18 16:12,0,0,philippines has the funds to rebuild marawi residents told,"(['Kuala Lumpur City'], Location((7.0385065, 125.5072204, 0.0)))",,,920563124020830208,https://twitter.com/msianinsight/status/920563124020830208,en
maxangelo987,2017-10-18 16:11,0,0, why the victory in the philippines city of marawi doesnt mean the end of isis in asia ,,,,920562924015489024,https://twitter.com/maxangelo987/status/920562924015489024,en
bangonmarawiph,2017-10-18 16:10,3,3,live the mindanao state university consolidates the master plan for marawi as prepared by local government units of marawi  lanaodelsur,,,# #,920562734390898688,https://twitter.com/bangonmarawiph/status/920562734390898688,en
RichTVXChina,2017-10-18 16:10,0,0,xhnews scene of huge destruction in philippines marawi city which has just been liberated from terrorists an ,"(['Global'], Location((43.7283874, -79.3491487932, 0.0)))",,#,920562727533367297,https://twitter.com/RichTVXChina/status/920562727533367297,en
mondnazareno,2017-10-18 16:09,0,0,sen lorenlegarda hopes mindanao state universitys cultural mapping will save marawis heritage via politikoph,,@ @,,920562480937447424,https://twitter.com/mondnazareno/status/920562480937447424,en
zenszei,2017-10-18 16:08,34,58,the afp was indiscriminately bombing marawi wrong mr renato reyes jr you owe the entire armed forces of the philippines an apology,,,,920562138782957568,https://twitter.com/zenszei/status/920562138782957568,en
DtiPhilippines,2017-10-18 16:08,1,0,marawi internally displaced persons idps receive aid from dti read more 8,"(['Makati City'], Location((14.5591272, 121.0202094, 0.0)))",,#,920562112514215937,https://twitter.com/DtiPhilippines/status/920562112514215937,en
AzeriDaily,2017-10-18 16:07,0,0,philippine conflict duterte says marawi is militantfree 1,,,,920561935111860224,https://twitter.com/AzeriDaily/status/920561935111860224,en
CefasLira_,2017-10-18 16:07,0,0,rt cnn why the victory in the philippines city of marawi doesnt mean the end of isis in asia  ,"(['S\xc3\xa3o Bento', ' Para\xc3\xadba', ' Brasil'], Location((-6.4878082, -37.4494675, 0.0)))",,,920561912563236864,https://twitter.com/CefasLira_/status/920561912563236864,en
jerichoanchetas,2017-10-18 16:07,0,0,sen lorenlegarda lauds military troops urges early rehabilitation for marawipls read ,,@,,920561882838085632,https://twitter.com/jerichoanchetas/status/920561882838085632,en
orlymercado1,2017-10-18 16:06,0,0,afp did well n marawi no high fives or banners saying mission accomplishd learn from our mistakes n tacloban build bak better nd smarter,,,,920561744526811138,https://twitter.com/orlymercado1/status/920561744526811138,en
regina_lilly33,2017-10-18 16:03,0,0,rt why the victory in the philippines city of marawi doesnt mean the end of isis in asia,,,,920560946195697665,https://twitter.com/regina_lilly33/status/920560946195697665,en
LancasterDioces,2017-10-18 16:02,0,0,philippines marawi freed from terrorists but islamic extremism remains,"(['In the North West of England'], Location((51.3351685, 7.26320898127, 0.0)))",,,920560679785988096,https://twitter.com/LancasterDioces/status/920560679785988096,en
adharves,2017-10-18 16:02,17,6,fighting continues in marawi despite philippine president declaring liberation from is militants,"(['Jakarta'], Location((-6.1753942, 106.827183, 0.0)))",,,920560672450027521,https://twitter.com/adharves/status/920560672450027521,en
CatholicHerald,2017-10-18 16:01,1,5,philippine president declares marawi liberated from islamists,,,,920560413355409409,https://twitter.com/CatholicHerald/status/920560413355409409,en
cathnewslive,2017-10-18 16:00,0,1,philippine president declares marawi liberated from islamists  gunfire rang out sporadically and explosi,"(['USA'], Location((39.7837304, -100.4458825, 0.0)))",,,920560188045881345,https://twitter.com/cathnewslive/status/920560188045881345,en
PhilippineStar,2017-10-18 16:00,5,3,how other countries helped regain marawi,"(['Philippines'], Location((12.7503486, 122.7312101, 0.0)))",,,920560090968666114,https://twitter.com/PhilippineStar/status/920560090968666114,en
