thetribunechd,2017-10-18 12:19,0,0,duterte marawi liberated from islinked militants,"(['Chandigarh'], Location((30.7194022, 76.7646552, 0.0)))",,,920504633327607813,https://twitter.com/thetribunechd/status/920504633327607813,en
manilainformer,2017-10-18 12:17,0,0,how other countries helped regainmarawi c,"(['Manila'], Location((14.5906216, 120.9799696, 0.0)))",,,920504047592808448,https://twitter.com/manilainformer/status/920504047592808448,en
TingkoyB,2017-10-18 12:12,1,3,marawi was like counterterrorists win,"(['Titay', ' Zamboanga Peninsula'], Location((7.8678106, 122.5593413, 0.0)))",,,920502931157323776,https://twitter.com/TingkoyB/status/920502931157323776,en
AgenturRU,2017-10-18 12:12,0,0,spotlight philippine president duterte declares liberation of marawi city from terrorists,"(['Berlin'], Location((52.5170365, 13.3888599, 0.0)))",,,920502787687047168,https://twitter.com/AgenturRU/status/920502787687047168,en
nerowattz,2017-10-18 12:08,0,0,partylist solon wants house to commend afp pnp for marawi liberation inquirermobilehttp,"(['Makati City'], Location((14.5591272, 121.0202094, 0.0)))",,,920501838125916165,https://twitter.com/nerowattz/status/920501838125916165,en
PHTopNews,2017-10-18 12:07,0,0,philippines to issue marawi bonds starting january 2018  gma news,,,,920501568826462208,https://twitter.com/PHTopNews/status/920501568826462208,en
LumpyAsia,2017-10-18 12:07,0,0,marawi city liberated  duterte  via rapplerdotcom,"(['Asia-Pacific'], Location((49.4212299, 8.4297698, 0.0)))",@,,920501449590804480,https://twitter.com/LumpyAsia/status/920501449590804480,en
kendimalibot,2017-10-18 12:06,0,1,icymi in marawi ending a siege is just the beginning  irinnews,,@,,920501359811624960,https://twitter.com/kendimalibot/status/920501359811624960,en
VOAStevenson,2017-10-18 12:05,0,0,philippines duterte declares marawi freed from terrorist influence 0,"(['Washington DC'], Location((38.8949549, -77.0366456, 0.0)))",@,,920500959331127296,https://twitter.com/VOAStevenson/status/920500959331127296,en
senatePH,2017-10-18 12:04,0,1,statement of senator cynthia villar on the liberation of marawi,"(['Pasay City', ' Philippines'], Location((14.5437592, 120.9954657, 0.0)))",,,920500805916078082,https://twitter.com/senatePH/status/920500805916078082,en
mystic1434,2017-10-18 12:03,0,0,again i truly wonder why this leni her ilk are wanting to end martial law in mindanao asapwhen infact the ml helps a lot d marawi crisis,"(['Las Vegas', ' NV'], Location((36.1662859, -115.149225, 0.0)))",,,920500554157187072,https://twitter.com/mystic1434/status/920500554157187072,en
kakaibautista,2017-10-18 12:03,14,58,liberation in marawi thank you lord,,,,920500528521637889,https://twitter.com/kakaibautista/status/920500528521637889,en
CNPH2016,2017-10-18 12:00,2,5,president rodrigo roa duterte declares marawi city liberated from the maute terrorist group in his latest visit,"(['Philippines'], Location((12.7503486, 122.7312101, 0.0)))",,,920499744274829312,https://twitter.com/CNPH2016/status/920499744274829312,en
PTVph,2017-10-18 12:00,0,1,legarda lauds military troops urges early rehabilitation for marawi,"(['Philippines'], Location((12.7503486, 122.7312101, 0.0)))",,,920499682362535936,https://twitter.com/PTVph/status/920499682362535936,en
bindadu,2017-10-18 11:59,0,0,marawi style,"(['Bacolod City PH'], Location((10.6762836, 122.9513786, 0.0)))",,,920499656668467202,https://twitter.com/bindadu/status/920499656668467202,en
IbnSiqilli,2017-10-18 11:58,1,0,irgc militia poster says iran fighting in syria top prevent situation like marawi where it takes months to oust is ,"(['Cambridge', ' MA'], Location((52.2033051, 0.124862, 0.0)))",,#,920499231579832321,https://twitter.com/IbnSiqilli/status/920499231579832321,en
sgtastemakers,2017-10-18 11:57,0,0,a planned domestic bond issue by the philippine government to fund rebuilding of the conflicttorn southern city of marawi will likely be l,"(['Singapore'], Location((1.2904753, 103.8520359, 0.0)))",,,920499049467432960,https://twitter.com/sgtastemakers/status/920499049467432960,en
yusufledesma,2017-10-18 11:57,1,3,armms adiong confident maranaos will overcome marawi crisis,"(['Manila'], Location((14.5906216, 120.9799696, 0.0)))",,,920498977367355392,https://twitter.com/yusufledesma/status/920498977367355392,en
RodolfoLemoss,2017-10-18 11:57,0,0,philippines hunts malaysian professor set to be regional isil leader after commanders killed in marawi,,,,920498973516873728,https://twitter.com/RodolfoLemoss/status/920498973516873728,en
autorenonline,2017-10-18 11:57,0,0,relatively its already safe to rebuild marawi saysandanar,,,,920498957209559040,https://twitter.com/autorenonline/status/920498957209559040,en
autorenonline,2017-10-18 11:56,0,0,govt troopers continue mopup clearing ops inmarawi,,,,920498858307801089,https://twitter.com/autorenonline/status/920498858307801089,en
PTVph,2017-10-18 11:54,0,0,watch ndrrmc holds press briefing on paoloph and ocds marawi updates and assessment,"(['Philippines'], Location((12.7503486, 122.7312101, 0.0)))",,#,920498367347744768,https://twitter.com/PTVph/status/920498367347744768,en
chubiboDENNIS,2017-10-18 11:54,0,0,a good friday kind of day for destabilizers who believed marawi was the end of this admin,,,,920498271331717120,https://twitter.com/chubiboDENNIS/status/920498271331717120,en
Visayanbizpost,2017-10-18 11:54,0,0,philippines to issue marawi bonds starting january 2018  gma news d,"(['Ormoc', ' Philippines'], Location((11.0094099, 124.6075767, 0.0)))",,,920498185201524736,https://twitter.com/Visayanbizpost/status/920498185201524736,en
rej_12,2017-10-18 11:54,0,0,liberation of marawi,"(['Philippines'], Location((12.7503486, 122.7312101, 0.0)))",,,920498182676799488,https://twitter.com/rej_12/status/920498182676799488,en
NofNewsFilipino,2017-10-18 11:54,0,0,wb commits aid for marawi rehab  the world bank has confirmed its commitment to work with the philippine ,,,,920498181841895424,https://twitter.com/NofNewsFilipino/status/920498181841895424,en
manilainformer,2017-10-18 11:51,0,0,livestream military in marawi shootings support and manila malfeasance  manilavideo,"(['Manila'], Location((14.5906216, 120.9799696, 0.0)))",,,920497645856149509,https://twitter.com/manilainformer/status/920497645856149509,en
tightsarntpants,2017-10-18 11:50,0,1,but 1 this is not in marawi 2 thats not members of the philippine army behind du30 what is the point of using this photo then,,,,920497409867878400,https://twitter.com/tightsarntpants/status/920497409867878400,en
NofNewsFilipino,2017-10-18 11:50,0,0,last call from marawi hero  baguio city  it was mission accomplished for special action force saf ,,,,920497233321177093,https://twitter.com/NofNewsFilipino/status/920497233321177093,en
deniseannedc,2017-10-18 11:49,2,3,marawi is now liberated in sha allah,,,,920497001552318465,https://twitter.com/deniseannedc/status/920497001552318465,en
SunStar_CDO,2017-10-18 11:48,0,1,marawi city residents who have sought refuge in cagayan de oro city are now anxious to go home following,,,,920496740997795840,https://twitter.com/SunStar_CDO/status/920496740997795840,en
nanchocp,2017-10-18 11:47,0,0,asia and australia edition raqqa kirkuk marawi your wednesday briefing,"(['Alcoy', ' Spain'], Location((9.7086113, 123.5074111, 0.0)))",,,920496631975256064,https://twitter.com/nanchocp/status/920496631975256064,en
SunStar_CDO,2017-10-18 11:47,0,0,the deaths of the two terrorist leaders in marawi city on monday should not be cause for state forces to become,,,,920496610152300545,https://twitter.com/SunStar_CDO/status/920496610152300545,en
PlataNecesito,2017-10-18 11:47,0,0,asia and australia edition raqqa kirkuk marawi your wednesday briefing c,,,,920496592368443392,https://twitter.com/PlataNecesito/status/920496592368443392,en
phildaily,2017-10-18 11:45,0,0,philippines to issue marawi bonds starting january 2018  gma news c9,,,,920496143137693698,https://twitter.com/phildaily/status/920496143137693698,en
puppolsci,2017-10-18 11:45,1,0,he tanhaei on marawi siege peace and development is a concept we need,"(['Sta. Mesa', ' Manila'], Location((14.598948, 121.0176419, 0.0)))",,,920495957422338048,https://twitter.com/puppolsci/status/920495957422338048,en
NewsNearYouca,2017-10-18 11:45,0,0,philippine president declares marawi city liberated from terrorists philippine president rodrigo duterte has,"(['Canada'], Location((61.0666922, -107.9917071, 0.0)))",,,920495914329948160,https://twitter.com/NewsNearYouca/status/920495914329948160,en
MsIngridCarino,2017-10-18 11:43,1,1,philippine pres duterte has declared marawi free from isismaute group will start rehab process we hope tht would be the end of isis here,,,,920495552122507265,https://twitter.com/MsIngridCarino/status/920495552122507265,en
vincent5126,2017-10-18 11:41,0,1,mga socalled diosnon na dali motuo ug fake news about cbcp being assholes about the marawi liberation grow up fake catholics,"(['Compostela', ' Cebu', ' Philippines'], Location((42.8804219, -8.5458608, 0.0)))",,,920495032582500352,https://twitter.com/vincent5126/status/920495032582500352,en
cdrsalamander,2017-10-18 11:41,8,19,marawi raqqa mosul all liberated cities look the same get used to it plan for it expect it ,"(['Navassa Island'], Location((18.408351, -75.0144367672, 0.0)))",,,920495021576552448,https://twitter.com/cdrsalamander/status/920495021576552448,en
WorldNewsNgayon,2017-10-18 11:40,0,0,philippines hunts malaysian professor set to be regional isil leader after commanders killed in marawi via yahoo,"(['Worldwide'], Location((53.4573434, -2.22698994022, 0.0)))",,,920494768316125184,https://twitter.com/WorldNewsNgayon/status/920494768316125184,en
Civ_Politics,2017-10-18 11:39,1,0,marawi has been liberated,,,,920494470369628161,https://twitter.com/Civ_Politics/status/920494470369628161,en
Iraqolizer,2017-10-18 11:37,0,0,marawi rebuilding to consider iraq afghanistan models budgetchief benjamindiokno budgetsecretary c1,"(['Iraq'], Location((33.0955793, 44.1749775, 0.0)))",,# # # # #,920494056144293888,https://twitter.com/Iraqolizer/status/920494056144293888,en
akemor,2017-10-18 11:37,0,0,philippines duterte declares liberation of marawi from isisaffiliated militants  key leaders were killed mon,"(['Eastern North Carolina'], Location((-26.0165629, -54.6322973, 0.0)))",,# # # #,920493965991989248,https://twitter.com/akemor/status/920493965991989248,en
Viankyyy,2017-10-18 11:36,1,6,praise god marawi is free ,,,,920493772231802880,https://twitter.com/Viankyyy/status/920493772231802880,en
newsjsMY,2017-10-18 11:36,0,0,malaysian terrorist mahmud ahmad likely still in marawi  free malaysia today c,"(['Malaysia'], Location((2.3923759, 112.8471939, 0.0)))",,#,920493712366477312,https://twitter.com/newsjsMY/status/920493712366477312,en
MlaStandard,2017-10-18 11:35,0,2,msheadline ladies and gentlemen i hereby declare marawi city liberated from the terrorist influence duterte said,"(['Manila', ' Philippines'], Location((14.5906216, 120.9799696, 0.0)))",,#,920493584113065985,https://twitter.com/MlaStandard/status/920493584113065985,en
ShowbizGov,2017-10-18 11:33,4,9,your thoughts marawi liberation day should be a holiday and remove ninoy aquino day as holiday,,,,920493080620417025,https://twitter.com/ShowbizGov/status/920493080620417025,en
ConceptGrp,2017-10-18 11:30,2,1,duterte vows to restore marawi to its old glory oathtaking pdplaban pilicamsurhttp,,,# # #,920492255084871680,https://twitter.com/ConceptGrp/status/920492255084871680,en
SunStar_CDO,2017-10-18 11:29,0,0,marawi city  gunfire rang out sporadically and explosions thudded as soldiers fought tuesday october 17 to c,,,,920492093168001024,https://twitter.com/SunStar_CDO/status/920492093168001024,en
SunStar_CDO,2017-10-18 11:29,0,0,military pushes to defeat last marawi fighters  sunstar philippines via sunstaronline,,@,,920492070212575234,https://twitter.com/SunStar_CDO/status/920492070212575234,en
imax111,2017-10-18 11:29,0,0,in photos marawis liberation 2,"(['everywhere'], Location((41.7776533, -72.6740756, 0.0)))",,,920491983864565761,https://twitter.com/imax111/status/920491983864565761,en
eyesgonzales,2017-10-18 11:28,1,9,this is marawi photos by jesaznar for nythttps,"(['Manila', ' Philippines', ''], Location((14.5906216, 120.9799696, 0.0)))",@,,920491628082626560,https://twitter.com/eyesgonzales/status/920491628082626560,en
PhilippineStar,2017-10-18 11:27,4,3,dojnbi present karen aizha hamidonalleged to have spread isis propaganda encouraged foreign muslims to join marawi siege by social media,"(['Philippines'], Location((12.7503486, 122.7312101, 0.0)))",,,920491617408057344,https://twitter.com/PhilippineStar/status/920491617408057344,en
ZamYusa,2017-10-18 11:27,0,0,watch drone video of troops retrieving hapilon and mautes bodies in marawi marawiclash marawiupdates isis islamicstatehttps,"(['Malaysia'], Location((2.3923759, 112.8471939, 0.0)))",,# # # # #,920491431034261504,https://twitter.com/ZamYusa/status/920491431034261504,en
manilabulletin,2017-10-18 11:25,1,2,look aguirre presents arrested woman found recruiting fighters for maute in marawi city  via,"(['Manila', ' Philippines'], Location((14.5906216, 120.9799696, 0.0)))",@,,920491060723249152,https://twitter.com/manilabulletin/status/920491060723249152,en
bornokyo,2017-10-18 11:25,0,0,you dont see muslims helping marawi city a so called muslim city,"(['Makati City', ' Philippines'], Location((14.5591272, 121.0202094, 0.0)))",,,920490979475341312,https://twitter.com/bornokyo/status/920490979475341312,en
Politiko_Ph,2017-10-18 11:25,1,0,legarda hopes mindanao state universitys cultural mapping will save marawis heritage,,,,920490873040732160,https://twitter.com/Politiko_Ph/status/920490873040732160,en
amirbangsamoro,2017-10-18 11:24,0,0,marawi tragedy is a humanitarian concern abbas,,,,920490618635345921,https://twitter.com/amirbangsamoro/status/920490618635345921,en
WorldNewsNgayon,2017-10-18 11:20,0,0,philippine president declares marawi city liberated from terrorists via yahoo,"(['Worldwide'], Location((53.4573434, -2.22698994022, 0.0)))",,,920489721054355459,https://twitter.com/WorldNewsNgayon/status/920489721054355459,en
MBJeffDamicog,2017-10-18 11:19,0,0,aguirre presents arrested woman found recruiting fighters for maute in marawi city,,@,,920489452627116032,https://twitter.com/MBJeffDamicog/status/920489452627116032,en
cocoshrink,2017-10-18 11:18,0,0,for rehabilitation and reconstruction philippines to issue marawi bonds starting january 2018 via gmanews,"(['Quezon City'], Location((14.6509905, 121.0486155, 0.0)))",@,,920489196439060480,https://twitter.com/cocoshrink/status/920489196439060480,en
Sreekant,2017-10-18 11:17,0,0,duterte marawi liberated from isillinked fighters,,,,920489091371761664,https://twitter.com/Sreekant/status/920489091371761664,en
JamesESisson1,2017-10-18 11:17,0,1,marawi has ben liberated in the philippines 800 plus rebels  isis members killed killed monday morning the leader of isis in asia  maute,"(['Denver', ' CO'], Location((39.7391536, -104.9847034, 0.0)))",,,920489086854377472,https://twitter.com/JamesESisson1/status/920489086854377472,en
kateamazonaaa,2017-10-18 11:15,0,1,marawi is free,,,,920488560737710080,https://twitter.com/kateamazonaaa/status/920488560737710080,en
reybarskie,2017-10-18 11:15,0,0,end of marawi crisis so happy that it was declared by the no other that the president himself yesterday god bless the philippines marawi,,,#,920488519520231425,https://twitter.com/reybarskie/status/920488519520231425,en
NRS_BDLLS,2017-10-18 11:15,0,1,be free be marawi,"(['Ubiquitous'], Location((51.52360145, -0.0618584400804, 0.0)))",,,9.20488E+17,https://twitter.com/NRS_BDLLS/status/920488453019648000,en
sam_abby64,2017-10-18 11:14,0,0,what measure would you be able to pitch in to rebuild marawi city archbishop soc villegas pls state something not nebulous but concrete,,,,920488196802093056,https://twitter.com/sam_abby64/status/920488196802093056,en
HRepLibrary,2017-10-18 11:12,1,0,marawi liberated from terrorists but battle drags on  inquirernews,"(['National Capital Region'], Location((14.5736108, 121.0329706, 0.0)))",,,920487609335398400,https://twitter.com/HRepLibrary/status/920487609335398400,en
jmonial,2017-10-18 11:11,1,0,what what good had they done recently to deserve double pay pnp death and mistargetted suspects afp poor intel on marawi siege,,,,920487525784764416,https://twitter.com/jmonial/status/920487525784764416,en
prespow,2017-10-18 11:10,0,0,the philippines  pres duterte declares marawi liberated fighting continues,,,,920487168698548225,https://twitter.com/prespow/status/920487168698548225,en
ANCALERTS,2017-10-18 11:10,1,9,marawi rebuilding to consider iraq afghanistan models budget chief c,"(['Philippines'], Location((12.7503486, 122.7312101, 0.0)))",,,920487101165998080,https://twitter.com/ANCALERTS/status/920487101165998080,en
manilainformer,2017-10-18 11:08,0,0,military pushes to defeat last marawifighters,"(['Manila'], Location((14.5906216, 120.9799696, 0.0)))",,,920486821456330753,https://twitter.com/manilainformer/status/920486821456330753,en
brkguller,2017-10-18 11:08,0,0,raqqa kirkuk marawi your wednesday briefing,"(['Kadirli', ' T\xc3\xbcrkiye'], Location((37.4620632, 36.1721471087, 0.0)))",,,920486742200868864,https://twitter.com/brkguller/status/920486742200868864,en
NofNewsFilipino,2017-10-18 11:08,0,0,afp not letting guard down  the deaths of the two terrorist leaders in marawi city on monday should not be ,,,,920486639163424768,https://twitter.com/NofNewsFilipino/status/920486639163424768,en
newslineph,2017-10-18 11:07,0,0,marawi is free,"(['Republic of the Philippines'], Location((12.7503486, 122.7312101, 0.0)))",,,920486365518643200,https://twitter.com/newslineph/status/920486365518643200,en
acidscrambler,2017-10-18 11:06,0,2,just like free tuituon for collegepast admin thought it wasnt probablebut for prd pwedeso rehab of marawi whatever the cost oks lang yan,"(['Tagaytay City', ' Cavite', ' PH'], Location((7.0741691, 125.5558867, 0.0)))",,,920486333952360449,https://twitter.com/acidscrambler/status/920486333952360449,en
ABSCBNNews,2017-10-18 11:05,8,20,marawi rebuilding to consider iraq afghanistan models budget chief,"(['Manila', ' Philippines'], Location((14.5906216, 120.9799696, 0.0)))",,,920485841885192192,https://twitter.com/ABSCBNNews/status/920485841885192192,en
Politiko_Ph,2017-10-18 11:05,1,2,hater gonna hate bam snubs dutertes role in liberating marawi city,,,,920485839825702912,https://twitter.com/Politiko_Ph/status/920485839825702912,en
NofNewsFilipino,2017-10-18 11:05,0,0,maranaos eager to go back home  marawi city residents who have sought refuge in cagayan de oro city are ,,,,920485838177239040,https://twitter.com/NofNewsFilipino/status/920485838177239040,en
safpio,2017-10-18 11:04,3,8,we honor the bravery of 1 of our troopers who selflessly sacrificed his life 4 d liberation of marawi from d hands of isis inspired local terrorist group 4 d greater good of our countryur sacrifice will never b 4gotten brother rest in peace po2 danieltegwa u,,,#,920485733831344129,https://twitter.com/safpio/status/920485733831344129,en
mj_dagcuta,2017-10-18 11:04,0,1,doj presents maute supporter karen aizha hamidon who uses social media to call out support for rebellion in marawi ,"(['Nuevo', 'Makati City Philippines'], Location((33.8056345, -117.139560153, 0.0)))",@,,920485691821191168,https://twitter.com/mj_dagcuta/status/920485691821191168,en
NofNewsFilipino,2017-10-18 11:04,0,0,marawi san mateo duterte and trump  evening wrap  today on rappler us hails afp for killing ,,,,920485690218921984,https://twitter.com/NofNewsFilipino/status/920485690218921984,en
Rab1012Ugc,2017-10-18 11:03,0,0,thanks god its finally done  war in marawi  salute all filipino soldiers,"(['South Carolina', ' USA'], Location((33.6874388, -80.4363743, 0.0)))",,# # #I,920485543279919105,https://twitter.com/Rab1012Ugc/status/920485543279919105,en
CanUDefineLove5,2017-10-18 11:01,0,0,i liked a youtube video panoorin marawi update the loudspeaker teams operations in marawi city,"(['Republic of the Philippines'], Location((12.7503486, 122.7312101, 0.0)))",@,,920485057541832704,https://twitter.com/CanUDefineLove5/status/920485057541832704,en
jovelyn_n,2017-10-18 11:01,0,0,hapilon maute tried to abandon own men in marawi military u,,,,920484863341457409,https://twitter.com/jovelyn_n/status/920484863341457409,en
TheNewDailyAu,2017-10-18 11:00,1,0,philippine president declares marawi liberated from is but military spokesman reports hostages still being held,"(['Australia'], Location((-24.7761086, 134.755, 0.0)))",,#,920484592867598336,https://twitter.com/TheNewDailyAu/status/920484592867598336,en
PTVph,2017-10-18 11:00,0,1,news  views  rody marawi liberated filipinos satisfied with war on drugs  survey bagongpilipinas,"(['Philippines'], Location((12.7503486, 122.7312101, 0.0)))",,#,920484584885698560,https://twitter.com/PTVph/status/920484584885698560,en
stillfaithfull,2017-10-18 10:58,0,1,please help marawi philippines to survive their futuremy filipino fellow men their are down,"(['cavite philippines'], Location((14.25, 120.833333, 0.0)))",,,920484263065092096,https://twitter.com/stillfaithfull/status/920484263065092096,en
gallledroronpo,2017-10-18 10:58,0,0,philippines hunts malaysian professor set to be regional isil leader after commanders killed in marawi 2,"(['New York', ' USA'], Location((40.7306458, -73.9866136, 0.0)))",,,920484195411070977,https://twitter.com/gallledroronpo/status/920484195411070977,en
PHHotTrends,2017-10-18 10:56,0,0,how other countries helped regain marawi marawiupdates,"(['Manila City'], Location((14.5906216, 120.9799696, 0.0)))",,#,920483729050624002,https://twitter.com/PHHotTrends/status/920483729050624002,en
BarangayLife,2017-10-18 10:56,0,0,marawi city liberated  duterte 2,"(['National Capital Region'], Location((14.5736108, 121.0329706, 0.0)))",,,920483609860902914,https://twitter.com/BarangayLife/status/920483609860902914,en
DominoG,2017-10-18 10:54,0,1,im no fan of duterte but hes the commander in chief the victory in marawi is his victory too,"(['Makati City', ' Philippines'], Location((14.5591272, 121.0202094, 0.0)))",,,920483241420734464,https://twitter.com/DominoG/status/920483241420734464,en
aatweetsagain,2017-10-18 10:54,0,0,marawi is free presidentduterte and our own troops fought for this to happen,,,#,920483216364003328,https://twitter.com/aatweetsagain/status/920483216364003328,en
JanetOrendorff,2017-10-18 10:50,1,0,philippines confirms islamic state affiliate chiefs dead in marawi,"(['United States'], Location((39.7837304, -100.4458825, 0.0)))",,,920482298537152512,https://twitter.com/JanetOrendorff/status/920482298537152512,en
HRepLibrary,2017-10-18 10:50,0,0,military pushes to defeat last marawi fighters  inquirernews,"(['National Capital Region'], Location((14.5736108, 121.0329706, 0.0)))",,,920482180874276865,https://twitter.com/HRepLibrary/status/920482180874276865,en
estudyanteh,2017-10-18 10:49,1,5,i cant wait for marawi to be rebuilt im pretty sure this will stun people with how well we as a nation will cope thank you our soldiers,"(['Neverland'], Location((36.548132, -121.919599, 0.0)))",,,920481913185243136,https://twitter.com/estudyanteh/status/920481913185243136,en
fonsoaltamira,2017-10-18 10:48,0,1,this isnt in marawi tho lol,,,,920481805693722624,https://twitter.com/fonsoaltamira/status/920481805693722624,en
pnagovph,2017-10-18 10:48,0,0,dbm sec benjamin diokno assures budget for marawi city rehab  via,"(['Quezon City'], Location((14.6509905, 121.0486155, 0.0)))",@,,920481692866953216,https://twitter.com/pnagovph/status/920481692866953216,en
melucky873,2017-10-18 10:48,0,0,the leaders of the isis assault on marawi in the philippines have been killed  by ro wat,"(['USA'], Location((39.7837304, -100.4458825, 0.0)))",,,920481681781469191,https://twitter.com/melucky873/status/920481681781469191,en
snogroove,2017-10-18 10:44,0,0,1228 spotted if isis assholes in marawi are holding priests and civilians hostage send a bunch of friendly,"(['Europe', ' Travelling'], Location((51.0, 10.0, 0.0)))",,,920480608232423424,https://twitter.com/snogroove/status/920480608232423424,en
pnagovph,2017-10-18 10:43,0,0,solon eyes reconstruction commission for marawi rehab  filanemikee ,"(['Quezon City'], Location((14.6509905, 121.0486155, 0.0)))",@,,920480374475464704,https://twitter.com/pnagovph/status/920480374475464704,en
petsthesecret,2017-10-18 10:41,0,2,to the men and women of afp to those who have fallen in action to those whose who were wounded to the filipino people who kept on praying for the resolution of this ordeal this victory is all for you marawi marawiclash,,,# #,920479853563977729,https://twitter.com/petsthesecret/status/920479853563977729,en
PHHotTrends,2017-10-18 10:41,0,1,military pushes to defeat last marawi fighters marawiupdateshttps,"(['Manila City'], Location((14.5906216, 120.9799696, 0.0)))",,#,920479846865821696,https://twitter.com/PHHotTrends/status/920479846865821696,en
HouseCracka,2017-10-18 10:39,7,8,philippines confirms islamic state affiliate chiefs dead in marawi 1,"(['Republic of House'], Location((39.8266503, -97.6580834, 0.0)))",,,920479395051200512,https://twitter.com/HouseCracka/status/920479395051200512,en
cosmogenesis777,2017-10-18 10:37,0,0,when isis took over marawi phillipines they blew up the police station beheaded to chief of police and then the,,,,920478968121319425,https://twitter.com/cosmogenesis777/status/920478968121319425,en
PhilstarNews,2017-10-18 10:37,0,0,military pushes to defeat last marawi fighters marawiupdates,"(['Manila', ' Philippines'], Location((14.5906216, 120.9799696, 0.0)))",,#,920478899183566848,https://twitter.com/PhilstarNews/status/920478899183566848,en
