valenzuelacity,2017-09-30 13:02,0,1,coordination of relief operations at marawi city relief operations center at the residence of marawi city mayor http,"(['Valenzuela City', ' Philippines'], Location((37.7751808, -4.220174, 0.0)))",,,913992445351821312,https://twitter.com/valenzuelacity/status/913992445351821312,en
PhilippinesLN,2017-09-30 13:00,0,0,if the marawi siege does end soon,"(['Central Luzon'], Location((15.39091185, 120.685699512, 0.0)))",,,,,en
globemail_diff,2017-09-30 12:57,0,0,100 days into marawi siege,"(['Toronto', ' Ontario'], Location((43.653963, -79.387207, 0.0)))",,,,,en
iwannagosurfin6,2017-09-30 12:57,0,4,trump is visiting the philippines give him the hospitality he deserves and send him to marawi,,,,913991049370001408,https://twitter.com/iwannagosurfin6/status/913991049370001408,en
PHLNewsOnline,2017-09-30 12:55,0,0,rappler 13 maute terrorists,"(['Philippines'], Location((12.7503486, 122.7312101, 0.0)))",,,,,en
manilabulletin,2017-09-30 12:50,0,2,opapps peace buzz now on its way to a safe zone in marawi city for a short program,"(['Manila', ' Philippines'], Location((14.5906216, 120.9799696, 0.0)))",,,913989337041141760,https://twitter.com/manilabulletin/status/913989337041141760,en
terrorism_info,2017-09-30 12:41,0,0,net  fresh firefight in marawi leaves 2 soldiers and http ernetfreshfirefightinmarawileaves2soldiersandhtml ,,,#INQUIRER,913987076772761600,https://twitter.com/terrorism_info/status/913987076772761600,en
MB_unite,2017-09-30 12:38,0,0,marawi heroes dependents get p275m aid from dpwh http awiheroesdependentsgetp275maidfromdpwh  via,"(['Pilipinas'], Location((12.7503486, 122.7312101, 0.0)))",@manila_bulletin,,913986325543448578,https://twitter.com/MB_unite/status/913986325543448578,en
terrorism_info,2017-09-30 12:38,0,0,fresh firefight in marawi leaves 2 soldiers and 13 terrorists dead http firefightinmarawileaves2soldiersand13terroristsdeadhtml ,,,,913986270124273664,https://twitter.com/terrorism_info/status/913986270124273664,en
manilabulletin,2017-09-30 12:31,2,0,look latest update on the marawi siege death toll,"(['Manila', ' Philippines'], Location((14.5906216, 120.9799696, 0.0)))",,,,,en
iam_unwritten,2017-09-30 12:14,0,1,lord,"(['Philippines'], Location((12.7503486, 122.7312101, 0.0)))",,,,,en
inquirerdotnet,2017-09-30 12:12,2,7,fresh firefight in marawi leaves 2 soldiers and 13 terrorists dead  http 01,"(['Makati City'], Location((14.5591272, 121.0202094, 0.0)))",@anawalINQ @inqmindanao,,913979847885680641,https://twitter.com/inquirerdotnet/status/913979847885680641,en
PHINewsNet2,2017-09-30 12:00,0,0,two more soldiers die as afp makes another push into maute position in marawi friday afp death toll now 155 ,"(['Republic of the Philippines'], Location((12.7503486, 122.7312101, 0.0)))",@anawalINQ,#BREAKINGNEWSNOW,913976927739715584,https://twitter.com/PHINewsNet2/status/913976927739715584,en
UltrascanMENA,2017-09-30 11:57,0,0,islamic state suffers a setback in marawi  and intelligence assistance,"(['Paris', ' France'], Location((48.8566101, 2.3514992, 0.0)))",,,,,en
nerowattz,2017-09-30 11:53,0,0,fresh firefight in marawi leaves 2 soldiers and 13 terrorists dead http inquirermobile http,"(['Makati City'], Location((14.5591272, 121.0202094, 0.0)))",,,913974953506164736,https://twitter.com/nerowattz/status/913974953506164736,en
JohnLester,2017-09-30 11:52,0,0,this malawi siege is about 130 days now fresh firefight in marawi leaves 2 soldiers and 13 terrorists dead  https smalawisiegeisabout130daysnowfreshfirefightinmarawileaves2soldiersand13terroristsdeadinquirernews ,,,,913974922547990528,https://twitter.com/JohnLester/status/913974922547990528,en
maxangelo987,2017-09-30 11:47,0,0,http sept 30 target to free marawi may still be 10 to 15 days away http,,,#gmanews,913973468269547520,https://twitter.com/maxangelo987/status/913973468269547520,en
MfrTiangco,2017-09-30 11:43,0,0,thank you to our for your dedicated service to country pray for peace in marawi,,,,,,en
Gabenewsinfo,2017-09-30 11:41,0,0,http inenewsupdatesmarawimautegroupterrorismislamicstatemajgencarlitogalvezjr  marawi siege to end in less than a month  afp,"(['Whatever...'], Location((37.7600854, -122.4351156, 0.0)))",,,913971927282315264,https://twitter.com/Gabenewsinfo/status/913971927282315264,en
Gabenewsinfo,2017-09-30 11:38,0,0,malaysian may have been suicide bombing guru in marawi  n20170928malaysianmahmudahmadmayhavebeensuicidebombingguruinmarawi ,"(['Whatever...'], Location((37.7600854, -122.4351156, 0.0)))",,,913971293250359296,https://twitter.com/Gabenewsinfo/status/913971293250359296,en
RebPadreDamaso,2017-09-30 11:38,19,55,next duterte statement de lima has been contacting alien species to reinforce marawi terrorists an anonymous tikbalang told me,"(['Salamanca', ' Spain'], Location((40.9651572, -5.6640182, 0.0)))",,#TotooNaPo,913971207837425664,https://twitter.com/RebPadreDamaso/status/913971207837425664,en
sunnypajamas,2017-09-30 11:37,2,0,amidst the war that tearing the country apart,"(['Jammies \xc2\xa0\xf0\x9f\x92\x9b'], Location((0.7384954, 31.8950769, 0.0)))",,,,,en
Gabenewsinfo,2017-09-30 11:37,1,0,http seesmarawicrisisendingbytheendofthemonth  duterte sees marawi crisis ending by the end of the month,"(['Whatever...'], Location((37.7600854, -122.4351156, 0.0)))",,,913970915666427905,https://twitter.com/Gabenewsinfo/status/913970915666427905,en
PhilippineStar,2017-09-30 11:36,14,15,situation in marawi as of september 29 ,"(['Philippines'], Location((12.7503486, 122.7312101, 0.0)))",@xtinamen,,913970686082691072,https://twitter.com/PhilippineStar/status/913970686082691072,en
SecurityJourno,2017-09-30 11:35,0,0,top msian terrorist mahmud ahmad  two other msians sighted by hostage in  my report  n20170929mahmudahmadsightedinmarawibyformerhostage ,"(['Malaysia'], Location((2.3923759, 112.8471939, 0.0)))",,#Marawi #MarawiClash,913970653044150272,https://twitter.com/SecurityJourno/status/913970653044150272,en
johncarlosdomi7,2017-09-30 11:33,0,1,we make marawi,"(['Malabon city'], Location((14.675233, 120.9573542, 0.0)))",,#BangonMaraWe,913970017774952449,https://twitter.com/johncarlosdomi7/status/913970017774952449,en
phildaily,2017-09-30 11:32,0,0,september 30 target to free marawi may still be 10 to 15 days away  gma news https,,,,913969658197430273,https://twitter.com/phildaily/status/913969658197430273,en
naz_gul,2017-09-30 11:26,0,0,coins,"(['London', ' Singapore'], Location((51.5073219, -0.1276474, 0.0)))",,,,,en
InqNational,2017-09-30 11:24,4,3,two more soldiers die as afp makes another push into maute position in marawi friday afp death toll now 155 ,"(['Manila', ' Philippines'], Location((14.5906216, 120.9799696, 0.0)))",@anawalINQ @inqmindanao,,913967826813124608,https://twitter.com/InqNational/status/913967826813124608,en
anawalINQ,2017-09-30 11:20,2,1,two more soldiers die as afp makes another push into maute position in marawi friday afp death toll now 155,,@InqNational @inquirerdotnet,,913966764546973697,https://twitter.com/anawalINQ/status/913966764546973697,en
PHLNewsOnline,2017-09-30 11:05,0,0,gma news september 30 target to free marawi may still be 10 to 15 days away https,"(['Philippines'], Location((12.7503486, 122.7312101, 0.0)))",,,913962997185417216,https://twitter.com/PHLNewsOnline/status/913962997185417216,en
manilabulletin,2017-09-30 11:03,1,5,look mgen rolando bautista commander of jtf marawi inspects captured firearms and war materials,"(['Manila', ' Philippines'], Location((14.5906216, 120.9799696, 0.0)))",,,913962511560359936,https://twitter.com/manilabulletin/status/913962511560359936,en
gmanewsfacebook,2017-09-30 11:00,0,0,marawi citys complete liberation from proisis maute terrorists is not going to happen on september 30,,,,,,en
phnews24x7,2017-09-30 10:58,0,0,september 30 target to free marawi may still be 10 to 15 days away  http u,"(['Philippines'], Location((12.7503486, 122.7312101, 0.0)))",,#PHNews,913961294826369024,https://twitter.com/phnews24x7/status/913961294826369024,en
disasters_ph,2017-09-30 10:51,0,1,battle in marawi  it took one week to cross a street  manila bulletin http,,,,913959413102383104,https://twitter.com/disasters_ph/status/913959413102383104,en
PCSOLotteryDraw,2017-09-30 10:50,0,0,marawi city update  september 30,,,,,,en
PCSOLotteryDraw,2017-09-30 10:50,0,0,i added a video to a playlist http marawi city update  september 30,,,,,,en
mcmanaloto,2017-09-30 10:31,5,4,wtf they had a group of kids doing the clenched fist these kids have no homes because duterte dared maute to burn marawi,,,,913954531045646336,https://twitter.com/mcmanaloto/status/913954531045646336,en
cezxy,2017-09-30 10:07,0,0,run for marawi,"(['singapore'], Location((1.2904753, 103.8520359, 0.0)))",,,913948460251885568,https://twitter.com/cezxy/status/913948460251885568,en
manilainformer,2017-09-30 10:05,0,0,september 30 target to free marawi may still be 10 to 15 daysaway https er30targettofreemarawimaystillbe10to15daysaway ,"(['Manila'], Location((14.5906216, 120.9799696, 0.0)))",,,913947789549346817,https://twitter.com/manilainformer/status/913947789549346817,en
mila_d_aguilar,2017-09-30 10:03,2,2,my heart goes out to puerto rico like it goes out to marawi  so difficult to be ruled by psychopaths https 945349903065088 ,"(['Quezon City', ' Metro Manila PH'], Location((14.6509905, 121.0486155, 0.0)))",,,913947317132079104,https://twitter.com/mila_d_aguilar/status/913947317132079104,en
LOCALNEWSNgayon,2017-09-30 10:02,0,0,september 30 target to free marawi may still be 10 to 15 days away  read http via gma news,"(['Philippines'], Location((12.7503486, 122.7312101, 0.0)))",,,913947113737859072,https://twitter.com/LOCALNEWSNgayon/status/913947113737859072,en
jdesignz,2017-09-30 9:57,0,0,sept 30 target to free marawi may still be 10 to 15 days away http http,,,,913945918721941504,https://twitter.com/jdesignz/status/913945918721941504,en
rex_gatchalian,2017-09-30 9:55,10,76,our team is now going around the different evac centers in marawi to deliver the donations of our socio civic clubs,"(['Valenzuela City'], Location((37.7751808, -4.220174, 0.0)))",,,,,en
jassspreadlove,2017-09-30 9:42,1,0,retweeted concept  david pomeranz marawi will rise again  http,"(['Manila City', ' National Capital'], Location((14.5906216, 120.9799696, 0.0)))",@ConceptGrp,#DavidPomeranz #Diyakatra,913942135140945921,https://twitter.com/jassspreadlove/status/913942135140945921,en
islamoinform,2017-09-30 9:38,0,0,afp video shows militants intention of establishing islamic state in marawi  headlines,"(['Portland', ' ME'], Location((45.5202471, -122.6741949, 0.0)))",,,,,en
TiMoJeNsAcAr,2017-09-30 9:28,0,0,the fresh and cool air of marawi mornings http,"(['Manila', ' Philippines'], Location((14.5906216, 120.9799696, 0.0)))",,#MarawiDays,913938692477276161,https://twitter.com/TiMoJeNsAcAr/status/913938692477276161,en
RiffRaffBriz,2017-09-30 9:21,2,2,five militants  three maute brothers were killed along with two foreigners in lt gen galvez said  hilippinephilippinesmilitants09292017135410html ,"(['Selatan'], Location((-5.5, 127.566667, 0.0)))",,#Marawi,913936806587990018,https://twitter.com/RiffRaffBriz/status/913936806587990018,en
MindanaoGSD,2017-09-30 9:08,0,0,marawi crisis a symptom of bigger conflict in mindanao http symptombiggerconflictmindanao ,"(['Mindanao', ' Philippines'], Location((7.68980415, 125.236399692, 0.0)))",@mindanaogsd,#MindanaoGoldstarDaily #GoldstarDailyNews,913933439975305217,https://twitter.com/MindanaoGSD/status/913933439975305217,en
PTVph,2017-09-30 9:00,3,9,news more bodies of maute terrorists recovered inside marawi mosque  d20 o9d1u ,"(['Philippines'], Location((12.7503486, 122.7312101, 0.0)))",,,913931401136832512,https://twitter.com/PTVph/status/913931401136832512,en
johncarlomarq,2017-09-30 8:58,0,0,marawi here i go,"(['Iloilo City', ' Western Visayas'], Location((10.7026718, 122.5686136, 0.0)))",,,913931118885457920,https://twitter.com/johncarlomarq/status/913931118885457920,en
jun_scorpio86,2017-09-30 8:48,0,0,at abbas gym mba marawi city,,,,913928497080410112,https://twitter.com/jun_scorpio86/status/913928497080410112,en
babygabana,2017-09-30 8:47,0,0,end of marawi war seen http d ofmarawiwarseen  via,"(['Botong Oton Iloilo'], Location((10.685581, 122.4382692, 0.0)))",@manila_bulletin,#EndMarawiWarNow,913928331346665472,https://twitter.com/babygabana/status/913928331346665472,en
SUGA_PH,2017-09-30 8:38,2,12,you may still join our project that will benefit marawi families,"(['Manila', ' Philippines'], Location((14.5906216, 120.9799696, 0.0)))",,,,,en
ConceptGrp,2017-09-30 8:33,4,0,david pomeranz marawi will rise again http 0929davidpomeranzmarawiwillrise ,,,#DavidPomeranz #Diyakatra,913924639914463232,https://twitter.com/ConceptGrp/status/913924639914463232,en
rangerperots,2017-09-30 8:31,0,0,congrats to all the fighting troops in marawi  http,"(['Central Luzon'], Location((15.39091185, 120.685699512, 0.0)))",,,913924175064002561,https://twitter.com/rangerperots/status/913924175064002561,en
pinoynewsonline,2017-09-30 8:31,0,0,breaking news today august 30,"(['Republic of the Philippines'], Location((12.7503486, 122.7312101, 0.0)))",,,,,en
crazyyyyannie,2017-09-30 8:07,0,0,run for marawi ,"(['Mindoro', ' Ph \xc2\xa0\xf0\x9f\x8c\xb4'], Location((12.86913875, 121.134828244, 0.0)))",,,913918227549372416,https://twitter.com/crazyyyyannie/status/913918227549372416,en
crazyyyyannie,2017-09-30 7:56,0,0,run for marawi  capitol complex,"(['Mindoro', ' Ph \xc2\xa0\xf0\x9f\x8c\xb4'], Location((12.86913875, 121.134828244, 0.0)))",,,,,en
manilabulletin,2017-09-30 7:48,5,7,look improvised grenade with coins as shrapnel recovered by troops in the mba  jtf marawi  ,"(['Manila', ' Philippines'], Location((14.5906216, 120.9799696, 0.0)))",@MBFTWakefield,,913913308758945792,https://twitter.com/manilabulletin/status/913913308758945792,en
manilabulletin,2017-09-30 7:42,9,10,watch afp releases video of maute terrorists looting a building in marawi city  via,"(['Manila', ' Philippines'], Location((14.5906216, 120.9799696, 0.0)))",@MBFTWakefield,,913911828828188672,https://twitter.com/manilabulletin/status/913911828828188672,en
manilabulletin,2017-09-30 7:36,6,5,end of marawi war seen  read http,"(['Manila', ' Philippines'], Location((14.5906216, 120.9799696, 0.0)))",,#BeFullyInformed,913910262964609024,https://twitter.com/manilabulletin/status/913910262964609024,en
diamathematical,2017-09-30 7:24,0,1,with the martial law in mindanao,"(['Republic of the Philippines'], Location((12.7503486, 122.7312101, 0.0)))",,,,,en
henryoneill1733,2017-09-30 7:21,0,0,there is a war in the southern philippines most of the fighting right now is going on in a city called marawi look it up on youtube,"(['Vero Beach', ' FL'], Location((27.6387163, -80.3975399, 0.0)))",,,913906646199488512,https://twitter.com/henryoneill1733/status/913906646199488512,en
PTVph,2017-09-30 7:00,6,8,news president duterte hopes marawi siege will be over by end september  awkn8 ,"(['Philippines'], Location((12.7503486, 122.7312101, 0.0)))",,,913901210599661568,https://twitter.com/PTVph/status/913901210599661568,en
anticrusader1,2017-09-30 6:58,1,0,islamic state praises jihadist attacks in marawi,,,,,,en
BenarNews,2017-09-30 6:53,2,0,commentary islamic state suffers a setback in marawi  tariesasiapacificthreatupdatemarawiend09292017181318html ,,,,913899602486661121,https://twitter.com/BenarNews/status/913899602486661121,en
jailagan,2017-09-30 5:49,0,0,end of marawi war seen http d ofmarawiwarseen ,,,,913883565380706304,https://twitter.com/jailagan/status/913883565380706304,en
southeastasia4u,2017-09-30 5:15,0,0,mayhem in marawi  is the philippines up to the task of handling the latest wave of islamist terrorism http,,,,913874925873704960,https://twitter.com/southeastasia4u/status/913874925873704960,en
manilainformer,2017-09-30 5:14,0,0,fighting in marawi not yetover https ginmarawinotyetover ,"(['Manila'], Location((14.5906216, 120.9799696, 0.0)))",,,913874679475163136,https://twitter.com/manilainformer/status/913874679475163136,en
PhamNguyenly,2017-09-30 5:04,0,0,mayhem in marawi https,,,,913872238931320833,https://twitter.com/PhamNguyenly/status/913872238931320833,en
southeastasia4u,2017-09-30 4:45,0,0,mayhem in marawi  is the philippines up to the task of handling the latest wave of islamist ter http 1,,,#SoutheastAsia,913867463858810880,https://twitter.com/southeastasia4u/status/913867463858810880,en
palojournal,2017-09-30 4:30,0,0,part of typhoon relief fund to be used for marawi rehabilitation  gulf times http,"(['Palo', ' Eastern Visayas'], Location((42.3231958, 0.2440283, 0.0)))",,,913863639798607872,https://twitter.com/palojournal/status/913863639798607872,en
Qatar_Update,2017-09-30 4:20,0,0,part of typhoon relief fund to be used for marawi rehabilitation http c,"(['Qatar'], Location((25.22803095, 55.1733279309, 0.0)))",,#news,913861120313749504,https://twitter.com/Qatar_Update/status/913861120313749504,en
phildaily,2017-09-30 4:20,0,0,end of marawi war seen  manila bulletin https,,,,913860987186565120,https://twitter.com/phildaily/status/913860987186565120,en
GulfTimes_QATAR,2017-09-30 4:19,0,1,part of typhoon relief fund to be used for marawi rehabilitation ,"(['Al Hilal - C Ring Road'], Location((25.2627163, 51.5377702, 0.0)))",,,913860718855847937,https://twitter.com/GulfTimes_QATAR/status/913860718855847937,en
Marawi_01,2017-09-30 4:13,0,0,could this day get any worse,,,,913859316054155265,https://twitter.com/Marawi_01/status/913859316054155265,en
phnews24x7,2017-09-30 3:57,0,0,two more marawi mosques remain in the hands of maute military  http,"(['Philippines'], Location((12.7503486, 122.7312101, 0.0)))",,#PHNews,913855247960829952,https://twitter.com/phnews24x7/status/913855247960829952,en
Toastaful,2017-09-30 3:52,0,0,i liked a video http frontlines  s5 e5 the siege of marawi  fighting isis in the far east,,@YouTube,,913853929573769216,https://twitter.com/Toastaful/status/913853929573769216,en
junar1967,2017-09-30 3:44,0,0,ph military conducts air strikes outside marawi via http,,@rapplerdotcom,,913852027389739008,https://twitter.com/junar1967/status/913852027389739008,en
CountryJackG,2017-09-30 3:10,0,0,watch frontlines  s5 e5 the siege of marawi  fighting isis in the far east on youtube http http ,"(['Southern Michigan', ' USA'], Location((41.9429134, -83.9460166, 0.0)))",,,913843372200251397,https://twitter.com/CountryJackG/status/913843372200251397,en
FarrierJackG,2017-09-30 3:10,0,0,watch frontlines  s5 e5 the siege of marawi  fighting isis in the far east on youtube http ,"(['Southern Michigan', ' USA'], Location((41.9429134, -83.9460166, 0.0)))",,,913843363752931328,https://twitter.com/FarrierJackG/status/913843363752931328,en
UAV_news,2017-09-30 3:09,0,0,duterte now claims arrest warrant vs drug lord triggered marawi siege  philippine star  http 9,"(['Global'], Location((43.7283874, -79.3491487932, 0.0)))",,,913843124811608064,https://twitter.com/UAV_news/status/913843124811608064,en
SaladinAlDronni,2017-09-30 3:08,1,3,military says 2 more weeks needed to liberate marawi http 2917militarysays2moreweeksneededtoliberatemarawi  via,,@ABSCBNNews,,913842911959244806,https://twitter.com/SaladinAlDronni/status/913842911959244806,en
phildaily,2017-09-30 3:07,0,0,end of marawi war seen  manila bulletin https u8,,,,913842715212877826,https://twitter.com/phildaily/status/913842715212877826,en
CAMILO905,2017-09-30 3:00,0,0,the diyakatra  moral recovery initiative for marawi gala dinner  september 28,,,,,,en
mitch8951,2017-09-30 2:46,0,0,philippines is conducting drills i thought what was happening in marawi city was real https status913825861459152897 ,"(['Europe'], Location((51.0, 10.0, 0.0)))",,,913837464489529344,https://twitter.com/mitch8951/status/913837464489529344,en
disasters_ph,2017-09-30 2:41,0,0,battle in marawi  it took one week to cross a street  manila bulletin http 0,,,,913836176745877505,https://twitter.com/disasters_ph/status/913836176745877505,en
PHTopNews,2017-09-30 2:15,0,0,end of marawi war seen  manila bulletin https d,,,,913829587615911937,https://twitter.com/PHTopNews/status/913829587615911937,en
BenarPhilippine,2017-09-30 2:00,0,0,soldiers killed 5 militant leaders in marawi,"(['Washington', ' DC'], Location((38.8949549, -77.0366456, 0.0)))",,,,,en
TempoPHL,2017-09-30 2:00,0,0,duterte lauds us help vs militants in marawi http ertelaudsushelpvsmilitantsinmarawi ,"(['Intramuros', ' Philippines'], Location((14.5905862, 120.97533, 0.0)))",,,913825901539987456,https://twitter.com/TempoPHL/status/913825901539987456,en
politikovismin,2017-09-30 1:41,0,0,military rescued 1,,,,,,en
ANCALERTS,2017-09-30 1:15,1,8,military says 2 more weeks needed to liberate marawi http,"(['Philippines'], Location((12.7503486, 122.7312101, 0.0)))",,,913814382563307520,https://twitter.com/ANCALERTS/status/913814382563307520,en
OkuhleMciteka,2017-09-30 0:56,0,0,you guys dont understand how happy i was to see my marawi friend,,,,,,en
TempoPHL,2017-09-30 0:00,0,0,duterte sees end of marawi war thismonth http erteseesendofmarawiwarthismonth ,"(['Intramuros', ' Philippines'], Location((14.5905862, 120.97533, 0.0)))",,,913795564667641856,https://twitter.com/TempoPHL/status/913795564667641856,en
