JastineRN,2017-09-30 23:57,0,0,salute to all nurses  doctors in marawi who untiringly provide rescue for our wounded troops,"(['Quezon City', ' Philippines'], Location((14.6509905, 121.0486155, 0.0)))",,#HeroesSaveHeroes #Iwitness #WarzoneER,914157297479196673,https://twitter.com/JastineRN/status/914157297479196673,en
Youth4MH,2017-09-30 23:48,5,19,indeed our warmest thanks to everyone who took on the challenge to volunteer for the sprout marawi mental health mission https tus914153275175313408 ,,,#ParaSaMarawi,914155016855752706,https://twitter.com/Youth4MH/status/914155016855752706,en
YelOropesa,2017-09-30 23:41,1,12,too blessed to work with passionate,"(['Republika ng Pilipinas \xc2\xa0\xf0\x9f\x87\xb5\xf0\x9f\x87\xad'], Location((12.7503486, 122.7312101, 0.0)))",,,,,en
tongueincheekss,2017-09-30 23:38,0,2,good job our soldiers are dying in marawi while our politicians are busy politicking in manila,"(['National Capital Region', ' Republic of the Philippines'], Location((14.5736108, 121.0329706, 0.0)))",@sandraguinaldo,,914152579902218246,https://twitter.com/tongueincheekss/status/914152579902218246,en
YelOropesa,2017-09-30 23:38,10,39,my heart is full 77 committees of sprout marawi have concluded initial meetings as of today the real work begins here,"(['Republika ng Pilipinas \xc2\xa0\xf0\x9f\x87\xb5\xf0\x9f\x87\xad'], Location((12.7503486, 122.7312101, 0.0)))",,,,,en
Joniasuncion,2017-09-30 23:36,1,1,nw iwitness i salute to all soldiers fighting for marawi,,,,,,en
soul_eater_aj,2017-09-30 23:36,0,1,shedding tearshigh respect for all the soldiers,,,,,,en
DeeLigent,2017-09-30 23:35,4,6,salute to the heroes saving heroes,"(['Mimaropa'], Location((13.0152201, 121.406418305, 0.0)))",@IWitnessGMA,#WarZoneER #iWitness #Marawi,914151827003686912,https://twitter.com/DeeLigent/status/914151827003686912,en
jdgssn,2017-09-30 23:30,1,3,salute all combat medic in marawi ,"(['Vigan City', ' Ilocos Sur'], Location((14.650482, 121.0313529, 0.0)))",,#iwitness #WarzoneER #SupportOurTroops,914150411078004736,https://twitter.com/jdgssn/status/914150411078004736,en
Rosie_1007,2017-09-30 23:29,0,0,so brave these soldiers fighting  saving lives in marawi  im sure that while fightng at the back of their minds is will this ,"(['Quezon City', ' Philippines'], Location((14.6509905, 121.0486155, 0.0)))",,#WarZoneER,914150338118033408,https://twitter.com/Rosie_1007/status/914150338118033408,en
Bhong29,2017-09-30 23:29,0,0,tgp triskelion alumni night for brothers  sisters of marawi http,,,,914150109524451328,https://twitter.com/Bhong29/status/914150109524451328,en
loren_legarda,2017-09-30 23:22,1,8,soldiers set up mobile kitchen to serve marawi evacuees  soldiersmobilekitchenmarawievacuees ,"(['Philippines'], Location((12.7503486, 122.7312101, 0.0)))",,,914148498538340352,https://twitter.com/loren_legarda/status/914148498538340352,en
maxangelo987,2017-09-30 23:22,0,0,http 13 maute members,,,,,,en
soul_eater_aj,2017-09-30 23:21,3,5,thank you is not enough but still thank you to all the brave soldiers risking their life in marawi for our country,,@sandraguinaldo,#IWitness,914148292971204608,https://twitter.com/soul_eater_aj/status/914148292971204608,en
Rosie_1007,2017-09-30 23:19,7,15,salute to all the soldiers fighting in marawi  the soldiers who save their lives so heartbreaking especially if a soldier dies,"(['Quezon City', ' Philippines'], Location((14.6509905, 121.0486155, 0.0)))",,#WarZoneER,914147753223061506,https://twitter.com/Rosie_1007/status/914147753223061506,en
MichelleGaliza,2017-09-30 23:14,2,2,financial gains but also sacrificing their security for our country,"(['Republic of the Philippines'], Location((12.7503486, 122.7312101, 0.0)))",,,,,en
negyolk,2017-09-30 23:11,0,3,to everyone,,,,,,en
MiaKabOom,2017-09-30 23:11,0,0,salute to all the heroes in marawi  watching iwitness,"(['Tagaytay City'], Location((7.0741691, 125.5558867, 0.0)))",,,914145663494975488,https://twitter.com/MiaKabOom/status/914145663494975488,en
celluloidsurfer,2017-09-30 23:11,0,0,war will always be a harrowing experience salute  big thanks to our men  women in uniform esp those in marawi,"(['National Capital Region'], Location((14.5736108, 121.0329706, 0.0)))",,#WarERZone #IWitness,914145573791350784,https://twitter.com/celluloidsurfer/status/914145573791350784,en
ORaphTheSnowman,2017-09-30 23:10,0,0,watching iwitness dyusq this is another face of the war in marawi ,"(['Pasig City', ' Philippines'], Location((9.7771753, 125.4915723, 0.0)))",,,914145449153404928,https://twitter.com/ORaphTheSnowman/status/914145449153404928,en
1MillionPHL,2017-09-30 23:04,0,0,the very latest news and videos updated every hour mga taga marawi,,,,,,en
negyolk,2017-09-30 23:03,0,7,it still breaks my heart seeing and hearing news about the war in marawi ,,,,914143641383211008,https://twitter.com/negyolk/status/914143641383211008,en
mdfir212,2017-09-30 22:53,0,0,isis made in usa,,,,,,en
vegasboy21,2017-09-30 22:52,0,1,it would better if the money spent on was donated to the people of marawi ,"(['Dubai', ' United AE'], Location((2.9470179, 30.961206, 0.0)))",,#StarMagicBall2017 #justsayin,914140904394575874,https://twitter.com/vegasboy21/status/914140904394575874,en
PHLNewsOnline,2017-09-30 22:52,0,0,gma news 13 maute members,"(['Philippines'], Location((12.7503486, 122.7312101, 0.0)))",,,,,en
LeeJoseh1,2017-09-30 22:49,0,1,the prize is one week to marawi with one way ticket or one week accomodation with de5s place,"(['United States'], Location((39.7837304, -100.4458825, 0.0)))",,,914140234580860928,https://twitter.com/LeeJoseh1/status/914140234580860928,en
WinGatchalian74,2017-09-30 22:46,7,36,turnover of financial assistance from to marawi lgu with vice mayor lori natividad borja,"(['Republic of the Philippines'], Location((12.7503486, 122.7312101, 0.0)))",@valenzuelacity,#HappeningNow,914139318377005056,https://twitter.com/WinGatchalian74/status/914139318377005056,en
gmanews,2017-09-30 22:46,3,14,13 maute members,"(['Philippines'], Location((12.7503486, 122.7312101, 0.0)))",,,,,en
PHINewsNet1,2017-09-30 22:41,0,0,sept 30 target to free marawi may still be 10 to 15 days away http,"(['Manila City', ' National Capital Region'], Location((14.5906216, 120.9799696, 0.0)))",,,914138122866253825,https://twitter.com/PHINewsNet1/status/914138122866253825,en
PHINewsNet1,2017-09-30 22:37,0,0,two more marawi mosques remain in the hands of maute military http,"(['Manila City', ' National Capital Region'], Location((14.5906216, 120.9799696, 0.0)))",,,914137175997816839,https://twitter.com/PHINewsNet1/status/914137175997816839,en
PHINewsNet1,2017-09-30 22:30,0,0,president rodrigo duterte wants the crisis in marawi city to end before october http,"(['Manila City', ' National Capital Region'], Location((14.5906216, 120.9799696, 0.0)))",,,914135472175063040,https://twitter.com/PHINewsNet1/status/914135472175063040,en
archieherrera,2017-09-30 22:28,0,0,i liked a video http marawi city update sept30,"(['Manila City'], Location((14.5906216, 120.9799696, 0.0)))",,,,,en
rapplerdotcom,2017-09-30 22:22,7,17,soldiers bring a mobile kitchen to evacuation centers to serve filipinos affected by the marawi crisis http,"(['Philippines'], Location((12.7503486, 122.7312101, 0.0)))",,,914133275861450753,https://twitter.com/rapplerdotcom/status/914133275861450753,en
inquirerdotnet,2017-09-30 22:19,2,2,relocation sites for marawi evacuees wont be ready until 2018 http d,"(['Makati City'], Location((14.5591272, 121.0202094, 0.0)))",,,914132497784606720,https://twitter.com/inquirerdotnet/status/914132497784606720,en
mariaressa,2017-09-30 22:16,2,5,photos show marawi ancestral home before and after clashes via http,"(['Philippines'], Location((12.7503486, 122.7312101, 0.0)))",@rapplerdotcom,,914131858308206594,https://twitter.com/mariaressa/status/914131858308206594,en
mariaressa,2017-09-30 22:16,5,8,soldiers set up mobile kitchen to serve marawi evacuees via http,"(['Philippines'], Location((12.7503486, 122.7312101, 0.0)))",@rapplerdotcom,,914131749763932160,https://twitter.com/mariaressa/status/914131749763932160,en
disasters_ph,2017-09-30 22:12,0,0,soldiers set up mobile kitchen to serve marawi evacuees  rappler http,,,,914130772843515905,https://twitter.com/disasters_ph/status/914130772843515905,en
dailyjostle,2017-09-30 22:10,0,0,the philippine air force flies the fa50 we used ours in marawi  the first time the jet was used in combat http deneaglethelowcostfightermightseesome17649 ,"(['Manila', ' Philippines'], Location((14.5906216, 120.9799696, 0.0)))",,,914130245002731520,https://twitter.com/dailyjostle/status/914130245002731520,en
PTVph,2017-09-30 22:10,3,2, prayer rally,"(['Philippines'], Location((12.7503486, 122.7312101, 0.0)))",,,,,en
PHINewsNet2,2017-09-30 22:04,0,0,this is where maute fighters hid during air strikes by the government in marawi  http,"(['Republic of the Philippines'], Location((12.7503486, 122.7312101, 0.0)))",,,914128848387579904,https://twitter.com/PHINewsNet2/status/914128848387579904,en
PHINewsNet2,2017-09-30 22:03,0,0,3 regular fighters of the maute group have surrendered to the military in marawi  http ,"(['Republic of the Philippines'], Location((12.7503486, 122.7312101, 0.0)))",,,914128601250881538,https://twitter.com/PHINewsNet2/status/914128601250881538,en
jellybeyn,2017-09-30 22:00,0,6,met my marawi team today marawi here we come cc our reynas,"(['Philippines'], Location((12.7503486, 122.7312101, 0.0)))",,,,,en
AranetaCenter,2017-09-30 21:53,0,4,vp leni robredo joins us tonight for benefit concert for the soldiers of marawi  http,"(['Quezon City', ' Philippines'], Location((14.6509905, 121.0486155, 0.0)))",,#BangonMarawe #PopUpNight,914125968175906817,https://twitter.com/AranetaCenter/status/914125968175906817,en
blazingjdb,2017-09-30 21:39,2,2,for the victims of marawi  for all the souls and life you sacrifice fornthe nation,"(['MNL'], Location((14.5121499, 121.022046716, 0.0)))",,,,,en
zyiteblog,2017-09-30 21:30,0,0,tournament to benefit soldiers fighting in marawi  the manila times online http 2,,,,914120367903510529,https://twitter.com/zyiteblog/status/914120367903510529,en
ayah_disimban,2017-09-30 21:27,0,0,september 30 target to free marawi may not happen afp official  news  gma news online  on62771september30targettofreemarawimaynothappenafpofficialstory ,,,,914119526194733056,https://twitter.com/ayah_disimban/status/914119526194733056,en
carmelafonbuena,2017-09-30 21:23,4,0,photos show marawi ancestral home before and after clashes via  alontoancestralhousemarawiutmsourcetwitterutmmediumreferralutmmediumsharebar ,"(['Manila', ' Philippines'], Location((14.5906216, 120.9799696, 0.0)))",@rapplerdotcom,,914118493401866241,https://twitter.com/carmelafonbuena/status/914118493401866241,en
dabeeyow,2017-09-30 21:21,0,0,tournament to benefit soldiers fighting in marawi  duterte news portal http,"(['Angeles City', ' Pampanga'], Location((7.1221824, 125.6453029, 0.0)))",,,914118005847613440,https://twitter.com/dabeeyow/status/914118005847613440,en
beverdera,2017-09-30 21:21,0,1,vp leni robredo,"(['Cavite', ' Philippines'], Location((14.25, 120.833333, 0.0)))",,,,,en
Bhong29,2017-09-30 21:13,0,1,we love you marawi brothers and sisters long live tau gamma phi triskelion grand fraternity,,,,914116046591856640,https://twitter.com/Bhong29/status/914116046591856640,en
alagangkapatid,2017-09-30 20:57,2,6,atm free benefit concert for marawi  manhattan row,"(['Philippines'], Location((12.7503486, 122.7312101, 0.0)))",,,,,en
Bhong29,2017-09-30 20:55,0,0,for brothers  sisters of marawi http,,,,914111372069425152,https://twitter.com/Bhong29/status/914111372069425152,en
m1ll1onaireman,2017-09-30 20:51,0,0,pacquiao loss leaves warweary filipinos in disbelief marawi,"(['Alicante', ' Spain'], Location((38.353738, -0.4901846, 0.0)))",,,,,en
dmmichalski,2017-09-30 20:46,0,1,i shall i expect to be thoroughly qestioned by both nations as to why im going to mindanao it is 250km from marawi ,"(['Escondido', ' California'], Location((33.1216751, -117.0814849, 0.0)))",,,914109132583575554,https://twitter.com/dmmichalski/status/914109132583575554,en
khayemags,2017-09-30 20:45,0,0,yohoo back to msu on monday i really miss the cold weather in marawi,"(['Seattle', ' WA'], Location((47.6038321, -122.3300624, 0.0)))",,,914109052879216640,https://twitter.com/khayemags/status/914109052879216640,en
PhilippineStar,2017-09-30 20:30,1,0,government loses 2 more soldiers in marawi http,"(['Philippines'], Location((12.7503486, 122.7312101, 0.0)))",,,914105045255196672,https://twitter.com/PhilippineStar/status/914105045255196672,en
PIA_NorMin,2017-09-30 20:09,0,0,letters of hope from students continue to pour in as marawi crisis still ongoing story http  http,"(['Cagayan de Oro City'], Location((8.42980265, 124.682410212, 0.0)))",,,914099777763201026,https://twitter.com/PIA_NorMin/status/914099777763201026,en
BieberManila,2017-09-30 20:07,18,31,we dedicate this project to and the victims of marawi and also to everyone who participated in this project c,"(['Manila', ' Philippines'], Location((14.5906216, 120.9799696, 0.0)))",,#SuperCJ #YouGiveMePurpose,914099258877370368,https://twitter.com/BieberManila/status/914099258877370368,en
ikwondg,2017-09-30 20:00,0,0,rains benefit concert for marawi wholl come,"(['YG entertainment'], Location((37.54886025, 126.908148428, 0.0)))",,,914097561299849216,https://twitter.com/ikwondg/status/914097561299849216,en
aeluin_lake,2017-09-30 19:46,0,0,camp marawi you want ,"(['Non-existent'], Location((38.2721368, -119.7256949, 0.0)))",,,914093999199100929,https://twitter.com/aeluin_lake/status/914093999199100929,en
PHLNewsOnline,2017-09-30 19:45,0,0,inquirer relocation sites for marawi evacuees wont be ready until 2018 http 11,"(['Philippines'], Location((12.7503486, 122.7312101, 0.0)))",,,914093745322172416,https://twitter.com/PHLNewsOnline/status/914093745322172416,en
pinoynewsonline,2017-09-30 19:31,0,0,marawi news latest update september 14 2017 more on http,"(['Republic of the Philippines'], Location((12.7503486, 122.7312101, 0.0)))",,,914090238376644608,https://twitter.com/pinoynewsonline/status/914090238376644608,en
terrorism_info,2017-09-30 19:27,1,0,13 mautes,,,,,,en
rox_favila,2017-09-30 19:18,1,14,run for marawi rank 13 male division,"(['PH'], Location((12.44249325, 122.160395164, 0.0)))",,,914086980895391744,https://twitter.com/rox_favila/status/914086980895391744,en
manilabulletin,2017-09-30 19:14,0,1,jcmac meeting officially ends here in marawi city peace buzz now prepping up to go to iligan city,"(['Manila', ' Philippines'], Location((14.5906216, 120.9799696, 0.0)))",,,,,en
cherylcosim,2017-09-30 19:00,1,2,come and join us here at manhattan row bangon marawe free concert help us rebuild marawi  http,"(['Philippines'], Location((12.7503486, 122.7312101, 0.0)))",,,914082571364868097,https://twitter.com/cherylcosim/status/914082571364868097,en
DLSUD_LCDC,2017-09-30 18:57,2,3,become a beacon of hope and light lcdc,"(['Dasmarinas', ' Calabarzon'], Location((14.6455597, 120.9995684, 0.0)))",,,,,en
falloutriah,2017-09-30 18:48,0,0,dear ma pa,,,,,,en
manilainformer,2017-09-30 18:41,1,1,government loses 2 more soldiers in marawi https entloses2moresoldiersinmarawi ,"(['Manila'], Location((14.5906216, 120.9799696, 0.0)))",,,914077811660517376,https://twitter.com/manilainformer/status/914077811660517376,en
manilabulletin,2017-09-30 18:38,0,0,the couple was presented at a press briefing at the joint coordinating,"(['Manila', ' Philippines'], Location((14.5906216, 120.9799696, 0.0)))",,,,,en
manilabulletin,2017-09-30 18:38,0,0,look saipoding mariga,"(['Manila', ' Philippines'], Location((14.5906216, 120.9799696, 0.0)))",,,,,en
DavaoToday,2017-09-30 18:35,0,4,mindanao bikers unite for troops in marawi http 2 mindanaobikersunitefortroopsinmarawi ,"(['Davao City', ' Philippines'], Location((7.22650725, 125.454887691, 0.0)))",,,914076297118101504,https://twitter.com/DavaoToday/status/914076297118101504,en
sandraguinaldo,2017-09-30 18:34,4,15,video in marawi,"(['manila', ' philippines'], Location((14.5906216, 120.9799696, 0.0)))",,,,,en
BieberBuyoutPH,2017-09-30 18:30,2,5,you may include more pics like news from marawi,"(['Philippines'], Location((12.7503486, 122.7312101, 0.0)))",,,,,en
nerowattz,2017-09-30 18:22,0,0,relocation sites for marawi evacuees wont be ready until 2018 http inquirermobile http,"(['Makati City'], Location((14.5591272, 121.0202094, 0.0)))",,,914072876361371648,https://twitter.com/nerowattz/status/914072876361371648,en
penalbaluigi,2017-09-30 18:21,0,0,stop the violence in marawi ,"(['Indang', ' Cavite'], Location((14.1844183, 120.871317089, 0.0)))",,,914072602120876032,https://twitter.com/penalbaluigi/status/914072602120876032,en
halfbaaad,2017-09-30 18:19,0,2,bring me back,"(['PH'], Location((12.44249325, 122.160395164, 0.0)))",,,,,en
cnnphilippines,2017-09-30 18:08,1,3, residents returning to marawi soon  reports http,,@gergcahiles,#InsideMarawi,914069319784394752,https://twitter.com/cnnphilippines/status/914069319784394752,en
carmelafonbuena,2017-09-30 18:02,5,7,the life of a maute hostage in marawi via http,"(['Manila', ' Philippines'], Location((14.5906216, 120.9799696, 0.0)))",@rapplerdotcom,,914067981717577729,https://twitter.com/carmelafonbuena/status/914067981717577729,en
KingFlare,2017-09-30 17:56,0,0,seeing pictures of what happened to marawi  all those maute members deserve to be 6 feet underground asap dead or alive idgaf,"(['Marikina City'], Location((14.6331084, 121.0993541, 0.0)))",,,914066326838140928,https://twitter.com/KingFlare/status/914066326838140928,en
phildaily,2017-09-30 17:32,0,0,september 30 target to free marawi may not happen afp official  gma news https,,,,914060351615983617,https://twitter.com/phildaily/status/914060351615983617,en
ah_tago,2017-09-30 17:31,0,1,with dti sec mon lopez at the opening day of bangon marawi exhibit,"(['Philippines'], Location((12.7503486, 122.7312101, 0.0)))",,,914060181457166336,https://twitter.com/ah_tago/status/914060181457166336,en
manilabulletin,2017-09-30 17:16,2,1,peace buzz arrives in the besieged city of marawi  provincial crisis management committee meeting to start in a bit  u1,"(['Manila', ' Philippines'], Location((14.5906216, 120.9799696, 0.0)))",@MB_mrtnsdngdng,,914056249322364928,https://twitter.com/manilabulletin/status/914056249322364928,en
PHINewsNet2,2017-09-30 17:09,0,0,marawi conflict may end sunday,"(['Republic of the Philippines'], Location((12.7503486, 122.7312101, 0.0)))",,,,,en
pinoynewsonline,2017-09-30 17:01,0,0,this soldier sacrificed his life and blocks a grenade explosion with his own body to save his comrades in marawi  http,"(['Republic of the Philippines'], Location((12.7503486, 122.7312101, 0.0)))",,,914052496372506624,https://twitter.com/pinoynewsonline/status/914052496372506624,en
mslillie_blue,2017-09-30 16:43,1,0,whether ur in camp naoffend or camp nka offend,,,,,,en
DonaldAllenWil2,2017-09-30 16:36,0,0,we have been under martial law here in the philliphines as well because of what has been going on in marawi city and other places wterrorism,"(['CDO', 'Philliphines'], Location((14.03446345, 121.143447992, 0.0)))",,,914046367827238913,https://twitter.com/DonaldAllenWil2/status/914046367827238913,en
Philippinefails,2017-09-30 16:25,0,0,why dont you call for to investigate prior knowledge of the marawi attack http  why the cover up,,@senatePH,,914043548369952768,https://twitter.com/Philippinefails/status/914043548369952768,en
phildaily,2017-09-30 16:24,0,0,september 30 target to free marawi may not happen afp official  gma news https c,,,,914043197449543680,https://twitter.com/phildaily/status/914043197449543680,en
valenzuelacity,2017-09-30 16:22,4,39,evacuees from marawi who are staying at the tent city of pantar,"(['Valenzuela City', ' Philippines'], Location((37.7751808, -4.220174, 0.0)))",,,,,en
giadua,2017-09-30 16:03,0,0,went to marawi city the second time around hahaha pero grabi nga experienced bomba,"(['Philippines'], Location((12.7503486, 122.7312101, 0.0)))",,,,,en
ModernizePH,2017-09-30 16:00,0,0,duterte us helped us a lot,"(['Republic of the Philippines'], Location((12.7503486, 122.7312101, 0.0)))",,,,,en
duterte_ism,2017-09-30 15:58,0,0,president duterte hopes marawi siege will be over by end september watch http,"(['Republic of the Philippines'], Location((12.7503486, 122.7312101, 0.0)))",,,914036838234431488,https://twitter.com/duterte_ism/status/914036838234431488,en
KBReboldad1,2017-09-30 15:42,0,0,marawi lootingmindanao,"(['Honeymoon Av.'], Location((28.739251, -81.867991, 0.0)))",,,914032616097030146,https://twitter.com/KBReboldad1/status/914032616097030146,en
OkuhleMciteka,2017-09-30 15:40,0,0,marawi gin https atus914028691595939840 ,,,,914032131629871106,https://twitter.com/OkuhleMciteka/status/914032131629871106,en
TheRealYeahUp,2017-09-30 15:38,3,27,marawi happened,"(['Olongapo City', ' Central Luzon'], Location((14.8314675, 120.2835205, 0.0)))",,,914031666930135040,https://twitter.com/TheRealYeahUp/status/914031666930135040,en
rex_gatchalian,2017-09-30 15:25,10,69,our social workers are the ones who take care of valenzuelanos in neednow pati mga taga marawi na din,"(['Valenzuela City'], Location((37.7751808, -4.220174, 0.0)))",,,914028291492683776,https://twitter.com/rex_gatchalian/status/914028291492683776,en
violetagloria,2017-09-30 15:06,0,0,the wind cleanse the face the sun doesnt burn the skin the crickets bring you to slumber  atty f abbas on marawi,,,,914023510208544768,https://twitter.com/violetagloria/status/914023510208544768,en
tWSilliman,2017-09-30 15:02,2,5,sillimanians bond with marawi refugees su muslim students sponsor run for marawi  http limaniansbondwithmarawirefugeessumuslimstudentssponsorrunformarawi ,,,,914022588095111168,https://twitter.com/tWSilliman/status/914022588095111168,en
anapinuela,2017-09-30 14:57,0,0,the beautiful marawi city with its beautiful stuctures and affluent houses was reduce into rubles and ashes all becaise of selfishness https status91401388932291201 ,,,,914021358836768768,https://twitter.com/anapinuela/status/914021358836768768,en
valenzuelacity,2017-09-30 14:49,3,48,valenzuela cares distributing relief goods to marawi evacuees at baloi covered court evacuation center,"(['Valenzuela City', ' Philippines'], Location((37.7751808, -4.220174, 0.0)))",,,,,en
manilainformer,2017-09-30 14:40,0,0,marawi war ends this september,"(['Manila'], Location((14.5906216, 120.9799696, 0.0)))",,,,,en
rex_gatchalian,2017-09-30 14:40,3,29,more on our teams marawi operations,"(['Valenzuela City'], Location((37.7751808, -4.220174, 0.0)))",,,914017039647256576,https://twitter.com/rex_gatchalian/status/914017039647256576,en
riskmap_,2017-09-30 14:38,2,0,philippines coins,"(['Cardiff', ' Wales'], Location((51.4816546, -3.1791934, 0.0)))",,,,,en
DuterteHolic,2017-09-30 14:29,1,2,fresh firefight in marawi leaves 2 soldiers and 13 terrorists dead http,"(['Republic of the Philippines'], Location((12.7503486, 122.7312101, 0.0)))",,,914014215282634752,https://twitter.com/DuterteHolic/status/914014215282634752,en
cnnphilippines,2017-09-30 14:27,34,23,look alonto ancestral house in marawi city before and after clashes in the area  via 9,,@gergcahiles,#InsideMarawi,914013889322291201,https://twitter.com/cnnphilippines/status/914013889322291201,en
gergcahiles,2017-09-30 14:19,1,0,look alonto ancestral house in marawi city before and after clashes in the area,"(['Manila'], Location((14.5906216, 120.9799696, 0.0)))",@cnnphilippines,#MarawiCrisis,914011815947911170,https://twitter.com/gergcahiles/status/914011815947911170,en
Philippinefails,2017-09-30 14:18,0,0,why is not investigating prior knowledge of marawi attack http  why the cover up,,@senateph @Cynthia_Villar @sotto_tito,,914011546803568640,https://twitter.com/Philippinefails/status/914011546803568640,en
cgnetwork,2017-09-30 14:03,0,0,3 explosions hit maguindanao in a week marawi city,"(['Thailand'], Location((14.8971921, 100.83273, 0.0)))",,,,,en
InqNational,2017-09-30 13:40,3,13,marawi children mingling with soldiers theres no trace of fear in them  1,"(['Manila', ' Philippines'], Location((14.5906216, 120.9799696, 0.0)))",@anawalINQ @inqmindanao,,914002010877259776,https://twitter.com/InqNational/status/914002010877259776,en
stinecanja,2017-09-30 13:14,0,0,prayers for marawi,"([""Greyson's \xc2\xa0\xf0\x9f\x92\x99""], Location((14.6004534, 121.0291314, 0.0)))",,,913995509727059968,https://twitter.com/stinecanja/status/913995509727059968,en
Ronnie_Vidal,2017-09-30 13:14,0,0,after marawi,"(['J. RIZAL', ' A. BONIFACIO', ' LAPU-LAPU & G. del PILAR Country'], Location((14.4108643, 120.9837257, 0.0)))",,,,,en
PHTopNews,2017-09-30 13:07,0,0,13 maute terrorists,,,,,,en
rex_gatchalian,2017-09-30 13:06,8,46,our 2nd trip to marawi brings into the city 3m worth of goods contributed by the great people of valenzuelavalenzuela cares,"(['Valenzuela City'], Location((37.7751808, -4.220174, 0.0)))",,,913993541314998273,https://twitter.com/rex_gatchalian/status/913993541314998273,en
rex_gatchalian,2017-09-30 13:05,1,24,valenzuela cares our team going around marawi to deliver what our citizens gave,"(['Valenzuela City'], Location((37.7751808, -4.220174, 0.0)))",,,913993262100123648,https://twitter.com/rex_gatchalian/status/913993262100123648,en
j_mreyes,2017-09-30 13:05,1,0,marawi update as of sept 29 749 enemies killed47 civilians killed by terrorists153 govt casualties,,@Malaya_Online,,913993198761951232,https://twitter.com/j_mreyes/status/913993198761951232,en
rex_gatchalian,2017-09-30 13:05,2,38,to the valenzuelano donorsour team is in marawi already,"(['Valenzuela City'], Location((37.7751808, -4.220174, 0.0)))",,,913993078523912192,https://twitter.com/rex_gatchalian/status/913993078523912192,en
