guaniocrystelle,2017-10-10 23:53,0,1,"Nanay: Tel, gusto mong tumakbo sa Marawi? Me: PO? *nabingi ako eh* N: Anokaba siempre hindi sa Marawi, para sa Marawi ung proceeds. Aahh","(['Republic of the Philippines'], Location((12.7503486, 122.7312101, 0.0)))",,,917780117602033664,https://twitter.com/guaniocrystelle/status/917780117602033664
philmonitor,2017-10-10 23:51,0,0,AFP confirms death of Malaysian militant in Marawi City - https://www.philmonitor.com/philippines/2017/10/afp-confirms-death-of-malaysian-militant-in-marawi-city/ … via @ philmonitor,"(['Republic of the Philippines'], Location((12.7503486, 122.7312101, 0.0)))",@,,917779527073398787,https://twitter.com/philmonitor/status/917779527073398787
eu_echo,2017-10-10 23:45,3,1,"# Philippines | # Marawi conflict, forced displacement and humanitarian response pic.twitter.com/EmeOwpKYWi","(['Brussels and Worldwide'], Location((50.8556882, 4.3600830086, 0.0)))",,# #,917778057217396736,https://twitter.com/eu_echo/status/917778057217396736
PresPoliticsPh,2017-10-10 23:40,0,0,"I liked a @ YouTube video http://youtu.be/GE6csvU5R6s?a  LUMILIYAB NA BALITA NGAYONG ARAW OCTOBER 11, 2017 PRES. DUTERTE / DE LIMA / MARAWI","(['Davao Region'], Location((7.0645241, 125.6084143, 0.0)))",@,,917776978643734528,https://twitter.com/PresPoliticsPh/status/917776978643734528
PresPoliticsPh,2017-10-10 23:39,0,0,"LUMILIYAB NA BALITA NGAYONG ARAW OCTOBER 11, 2017 PRES. DUTERTE / DE LIMA / MARAWI UPDATE: http://youtu.be/GE6csvU5R6s?a  via @ YouTube","(['Davao Region'], Location((7.0645241, 125.6084143, 0.0)))",@,,917776673709481984,https://twitter.com/PresPoliticsPh/status/917776673709481984
borresanj,2017-10-10 23:31,0,0,Cant wait para ma finalize na ang run for a cause for marawi evacuees and soldiers.,,,,917774699735613440,https://twitter.com/borresanj/status/917774699735613440
CCTabet,2017-10-10 23:30,0,0,Fears of malnutrition crisis as Marawi conflict continues http://www.thetablet.co.uk/news/7894/0/fears-of-malnutrition-crisis-as-marawi-conflict-continues …,"(['London'], Location((51.5073219, -0.1276474, 0.0)))",,,917774468499542016,https://twitter.com/CCTabet/status/917774468499542016
starappaul,2017-10-10 23:23,0,0,"Napakalandi naman ng caller na to! Porket nasa Marawi yung jowa, may jinojowang iba dito?! Pweh.","(['Orient Pearl', ' Midgard'], Location((14.60264405, 120.9867617, 0.0)))",,,917772503904161792,https://twitter.com/starappaul/status/917772503904161792
PresPoliticsPh,2017-10-10 23:22,0,0,"LUMILIYAB NA BALITA NGAYONG ARAW OCTOBER 11, 2017 PRES. DUTERTE / DE LIMA / MARAWI UPDATE: http://youtu.be/kqpC8H1ReyQ?a  via @ YouTube","(['Davao Region'], Location((7.0645241, 125.6084143, 0.0)))",@,,917772302426787840,https://twitter.com/PresPoliticsPh/status/917772302426787840
GTiptoeg,2017-10-10 23:22,0,0,Marawi. Lalayo kapa.,"(['Davao City'], Location((7.22650725, 125.454887691, 0.0)))",,,917772217227677696,https://twitter.com/GTiptoeg/status/917772217227677696
inquirerdotnet,2017-10-10 23:10,1,1,Requests for DNA match reveal 61 still missing in Marawi http://ebx.sh/2y7Dxb3,"(['Makati City'], Location((14.5591272, 121.0202094, 0.0)))",,,917769320075284480,https://twitter.com/inquirerdotnet/status/917769320075284480
johnorvz,2017-10-10 23:04,0,0,Young officer’s promise to wed fiancee after Marawi siege broken by Maute sniper | https://shar.es/1VP8fh,,,,917767692978761728,https://twitter.com/johnorvz/status/917767692978761728
jademendiola15,2017-10-10 23:02,0,1,Saludo po ako sa lahat ng mga sundalong lumalaban sa marawi! maraming salamat po!,,,,917767388447203328,https://twitter.com/jademendiola15/status/917767388447203328
PHLNewsOnline,2017-10-10 22:52,0,0,[News5] WATCH | Military says Marawi endgame is approaching; Maute cornered https://goo.gl/fb/tXavek,"(['Philippines'], Location((12.7503486, 122.7312101, 0.0)))",,,917764813861933057,https://twitter.com/PHLNewsOnline/status/917764813861933057
AksyonTV,2017-10-10 22:46,0,0,WATCH | Military says # Marawi # endgame is approaching: ... https://goo.gl/fb/3Qtjch # breakingnews # mainhomepageheader,"(['TV5', ' Philippines'], Location((47.8967217, 106.887564062, 0.0)))",,# # # #,917763175684149250,https://twitter.com/AksyonTV/status/917763175684149250
AngelesRezrez,2017-10-10 22:44,0,0,"Diba gangster ka? yung tipong hindi tinatablan ng kaba, lulusob ka nga sa marawi, pakikisama lang dala",,,,917762796875522049,https://twitter.com/AngelesRezrez/status/917762796875522049
CNPH2016,2017-10-10 22:43,0,2,MABUHAY MGA KA DDS. CONCERT FOR A CAUSE. FOR OUR MARAWI TROOPS! Goodluck. Pls. Support! http://fb.me/Bs1Ihnpt,"(['Philippines'], Location((12.7503486, 122.7312101, 0.0)))",,,917762402157920256,https://twitter.com/CNPH2016/status/917762402157920256
Marc_Ulan,2017-10-10 22:42,0,0,opo mamsh dalin nyong marawi,"(['MNL'], Location((14.5121499, 121.022046716, 0.0)))",,,917762277771698176,https://twitter.com/Marc_Ulan/status/917762277771698176
gmanews,2017-10-10 22:41,6,28,Young officer’s promise to wed fiancee after Marawi siege broken by Maute sniper http://bit.ly/2kD8MaS,"(['Philippines'], Location((12.7503486, 122.7312101, 0.0)))",,,917761894412374017,https://twitter.com/gmanews/status/917761894412374017
liveuamapde,2017-10-10 22:35,0,0,Pro-IS Scharfschütze in Marawi tötet bald-zu-heiraten Armee Junior-Offizier https://philippines.liveuamap.com/de/2017/10-october-prois-sniper-in-marawi-kills-soontomarry-army … via @ inquirerdotnetpic.twitter.com/UHVXLlHn7o,,@,,917760439970402305,https://twitter.com/liveuamapde/status/917760439970402305
liveuamapfr,2017-10-10 22:35,0,0,Un tireur d'élite pro-EI à Marawi tue un officier subalterne de l'armée bientôt marié https://philippines.liveuamap.com/fr/2017/10-october-prois-sniper-in-marawi-kills-soontomarry-army … via @ inquirerdotnetpic.twitter.com/Lf5o6ZJIgT,,@,,917760428041756672,https://twitter.com/liveuamapfr/status/917760428041756672
icvillapane,2017-10-10 22:30,9,53,My cousin's fiancé died in Marawi yesterday please don't stop praying for Marawi and our soldiers still fighting for peace in Mindanao,,,,917759232115482624,https://twitter.com/icvillapane/status/917759232115482624
PHINewsNet1,2017-10-10 22:27,0,0,"Abu Sayyaf, Maute leaders behind Marawi siege still alive, very aggressive and desperate – AFP - http://bit.ly/2yVJsz6 # BeFullyInformed","(['Manila City', ' National Capital Region'], Location((14.5906216, 120.9799696, 0.0)))",,#,917758503325810688,https://twitter.com/PHINewsNet1/status/917758503325810688
charlene_ostrea,2017-10-10 22:24,0,0,FORD NG MARAWI CHAROT HAHAHHAAHAHAHAHAHAHAHHA,"(['R \xc2\xa0\xe2\x9d\xa4'], Location((40.9953754, -74.0120832, 0.0)))",,,917757684379611136,https://twitter.com/charlene_ostrea/status/917757684379611136
PHINewsNet1,2017-10-10 22:22,1,0,Pro-IS sniper in Marawi kills soon-to-marry Army junior officer http://ebx.sh/2y5LhwD,"(['Manila City', ' National Capital Region'], Location((14.5906216, 120.9799696, 0.0)))",,,917757163178561536,https://twitter.com/PHINewsNet1/status/917757163178561536
PHINewsNet2,2017-10-10 22:22,0,0,Malaysian militant Joraimee killed in Marawi http://ebx.sh/2y7p2GM,"(['Republic of the Philippines'], Location((12.7503486, 122.7312101, 0.0)))",,,917757109936168961,https://twitter.com/PHINewsNet2/status/917757109936168961
PHINewsNet1,2017-10-10 22:22,0,0,Malaysian militant Joraimee killed in Marawi http://ebx.sh/2y7p2GM,"(['Manila City', ' National Capital Region'], Location((14.5906216, 120.9799696, 0.0)))",,,917757109793570816,https://twitter.com/PHINewsNet1/status/917757109793570816
fabio_polese,2017-10-10 22:20,0,0,# Philippines: Foreigners in leading militant roles in besieged # Marawi https://asiancorrespondent.com/2017/10/philippines-foreigners-taking-leading-militant-roles-besieged-marawi/ … @ AsCorrespondent,"(['Perugia'], Location((43.1119613, 12.3890104, 0.0)))",@,# #,917756635090767873,https://twitter.com/fabio_polese/status/917756635090767873
LilyT32,2017-10-10 22:18,0,0,Philippines: Philippines | Marawi Conflict Displacement and Response Overview (as of 31 July 2017) – DG ECHO Daily Map | 10/10/2017 # human…pic.twitter.com/60TPrTwimr,"(['New Zealand'], Location((-41.5000831, 172.8344077, 0.0)))",,#,917756275114631168,https://twitter.com/LilyT32/status/917756275114631168
LilyT32,2017-10-10 22:16,0,0,Philippines: Philippines | Marawi Conflict Displacement and Response Overview (as of 31 July 2017) – DG ECHO Daily Map | 10/10/2017 # human…pic.twitter.com/fmkayHFWwk,"(['New Zealand'], Location((-41.5000831, 172.8344077, 0.0)))",,#,917755623231709184,https://twitter.com/LilyT32/status/917755623231709184
VapeRhaidz,2017-10-10 22:14,0,0,Alhamdulillah at salamat po. sa wakas mawawala na Sa kamay ng mga terrorist ang marawi city at Sana po makabangon... http://fb.me/BnseSMe0,,,,917755342397652992,https://twitter.com/VapeRhaidz/status/917755342397652992
_rizzavillanuev,2017-10-10 22:13,0,2,Feeling ko ready na ako sa marawi. De joke. Oy na aadik na ako dito hahahahahahahaha pic.twitter.com/0uXFKiUTcI,"(['pink room'], Location((41.9162679, 12.4881584, 0.0)))",,,917755040038662145,https://twitter.com/_rizzavillanuev/status/917755040038662145
PhilippinePolRR,2017-10-10 22:09,0,0,Malaysian militant Joraimee killed in Marawi http://www.rightrelevance.com/search/articles/hero?article=01ebf171e7a9d9f500443c782985edaf4fca3be8&query=philippines&taccount=philippinepolrr …pic.twitter.com/086dQ5fSSA,,,,917753896218619904,https://twitter.com/PhilippinePolRR/status/917753896218619904
JordanRibo,2017-10-10 22:08,0,0,Parang sa MARAWI o kaya Trillanes vs Duterte. # MartialLawSaGC,"(['Santo Tomas', ' Ilocos Region'], Location((14.079621, 121.18955973, 0.0)))",,#,917753774105493504,https://twitter.com/JordanRibo/status/917753774105493504
kakeycious,2017-10-10 22:06,0,0,Dear @ TeamAFP - never ever be paasa... Nahihirapan na mga tao sa Marawi tapos hinahayaan niyo ang mga nasa comms group magkalat... https://twitter.com/PhilstarNews/status/917594346920144896 …,"(['Filipinas'], Location((12.7503486, 122.7312101, 0.0)))",@,,917753155068108800,https://twitter.com/kakeycious/status/917753155068108800
NPRAshley,2017-10-10 22:05,0,1,REMINDER: Siege in # Marawi between Philippines army & Islamic insurgents still happening. http://ow.ly/mb5p30fLOrf # Philippines,"(['Washington', ' DC'], Location((38.8949549, -77.0366456, 0.0)))",,# #,917752855536291841,https://twitter.com/NPRAshley/status/917752855536291841
AmrodingGandamr,2017-10-10 22:03,0,0,Operation Limpiyo Marawi at Bangon and Barangay Datu Saber area this morning....,"(['132 Gen. Tinio Street', ' Calooca'], Location((14.6299295, 120.9933326, 0.0)))",,,917752527260545030,https://twitter.com/AmrodingGandamr/status/917752527260545030
PHINewsNet1,2017-10-10 22:02,0,0,Soldier set to marry dies in 'last phase' of Marawi war http://bit.ly/2xvYlH6,"(['Manila City', ' National Capital Region'], Location((14.5906216, 120.9799696, 0.0)))",,,917752232312938496,https://twitter.com/PHINewsNet1/status/917752232312938496
Fair_Anita,2017-10-10 22:01,0,0,Safe spaces offer relief as fighting in Marawi rages on | UNFPA - United Nations Population Fund http://ow.ly/zluU30fIYnd,"(['St Paul'], Location((44.9504037, -93.1015026, 0.0)))",,,917752035163897856,https://twitter.com/Fair_Anita/status/917752035163897856
AmrodingGandamr,2017-10-10 21:59,0,0,This we have our Operation Limpiyo Marawi at Barangay Lukes a Datu then Barangay Datu Saber and Bangon.with the... http://fb.me/MYTPI5Ct,"(['132 Gen. Tinio Street', ' Calooca'], Location((14.6299295, 120.9933326, 0.0)))",,,917751458367279109,https://twitter.com/AmrodingGandamr/status/917751458367279109
danaechavaria,2017-10-10 21:58,0,2,badly wanna help the unicef to collect donations for marawi kids,"(['nueva ecija'], Location((15.583333, 121.0, 0.0)))",,,917751263034408960,https://twitter.com/danaechavaria/status/917751263034408960
manilainformer,2017-10-10 21:55,0,0,Young officer's promise to wed fiancee after Marawi siege broken by Maute sniper https://manilainformer.com/252376/young-officers-promise-to-wed-fiancee-after-marawi-siege-broken-by-maute-sniper/ …pic.twitter.com/Z331R9MnCt,"(['Manila'], Location((14.5906216, 120.9799696, 0.0)))",,,917750511125790721,https://twitter.com/manilainformer/status/917750511125790721
heyjuuuuudee,2017-10-10 21:54,0,0,And the Marawi itself is close to become powdered city due to massive explosions taking place there. My heart is aching.,,,,917750066789486594,https://twitter.com/heyjuuuuudee/status/917750066789486594
eurmoi,2017-10-10 21:52,0,0,Nangaon mi ni blaine sa jollibee niingon syag kusog “ana si kaizer ky sa marawi kay naay maute” Im shookt daghan pajd tao diri,"(['cagayan de oro', ' philippines'], Location((8.42980265, 124.682410212, 0.0)))",,,917749770709430273,https://twitter.com/eurmoi/status/917749770709430273
heyjuuuuudee,2017-10-10 21:51,0,0,My heart is breaking. Again. Another soldier (soon to be married after the mission) died in Marawi. # angmamatayngdahilsayo,,,#,917749549539586054,https://twitter.com/heyjuuuuudee/status/917749549539586054
gmanewsfacebook,2017-10-10 21:51,0,0,Wedding bells will no longer be heard for a soldier in Marawi City after he was killed by a sniper of the... http://fb.me/yfskj5qp,,,,917749351111311360,https://twitter.com/gmanewsfacebook/status/917749351111311360
_kristyanparina,2017-10-10 21:50,0,1,"Kung yung thesis nga daw nga naipagalalaban niya ikaw pa kaya, e tutal matapang ka edi ikaw na lumaban don sa marawi.",,,,917749180642103298,https://twitter.com/_kristyanparina/status/917749180642103298
RolandoHot69,2017-10-10 21:48,0,2,Magsama pa kayo ni lawrence marawi,,,,917748575810945024,https://twitter.com/RolandoHot69/status/917748575810945024
annafelicia_,2017-10-10 21:42,0,0,Young officer’s promise to wed fiancee after Marawi siege broken by Maute sniper https://shar.es/1VPAtv  via @ gmanews,"(['Quezon City', ' National Capital Region'], Location((14.6509905, 121.0486155, 0.0)))",@,,917747180823134208,https://twitter.com/annafelicia_/status/917747180823134208
inquirer_libre,2017-10-10 21:42,0,0,Malaysian militant Joraimee killed in Marawi http://ebx.sh/2y71di8,"(['Philippines'], Location((12.7503486, 122.7312101, 0.0)))",,,917747102662479872,https://twitter.com/inquirer_libre/status/917747102662479872
FuryBlazing,2017-10-10 21:41,0,0,NY subway & Times Square bomb plotter was doctor to pro-ISIS # Maute in # Marawi http://sc.mp/QRJiYS,,,# #,917746945933828096,https://twitter.com/FuryBlazing/status/917746945933828096
raquickie,2017-10-10 21:41,0,1,Darkest hour? Nation??? Pwedeng pakitanong muna...kasi ang Pilipinas di lang Luzon at Mindanao ay lang Marawi??,,,,917746825938923520,https://twitter.com/raquickie/status/917746825938923520
jdesignz,2017-10-10 21:40,0,0,Young officer's promise to wed fiancee after Marawi siege broken by Maute sniper http://ift.tt/2y8IzUL  http://ift.tt/eA8V8J,,,,917746730317295617,https://twitter.com/jdesignz/status/917746730317295617
LOCALNEWSNgayon,2017-10-10 21:40,0,0,Young officer's promise to wed fiancee after Marawi siege broken by Maute sniper | Read: http://ift.tt/2y8IzUL  via GMA News,"(['Philippines'], Location((12.7503486, 122.7312101, 0.0)))",,,917746578374447106,https://twitter.com/LOCALNEWSNgayon/status/917746578374447106
SUGA_PH,2017-10-10 21:33,7,6,Pls help us make this happen for the affected Marawi families https://twitter.com/suga_ph/status/901456590871470080 …,"(['Manila', ' Philippines'], Location((14.5906216, 120.9799696, 0.0)))",,,917744866905415681,https://twitter.com/SUGA_PH/status/917744866905415681
saleswalk,2017-10-10 21:30,0,0,Marawi http://fb.me/yHxd2xU7,"(['philippines'], Location((12.7503486, 122.7312101, 0.0)))",,,917744045119516673,https://twitter.com/saleswalk/status/917744045119516673
stateofdnation,2017-10-10 21:29,0,1,"Sa pagpapatuloy ng bakbakan sa Marawi City, todo bantay ang militar sa Lanao Lake para matiyak na wala nang matatakbuhan ang Maute-ISIS.","(['Manila', ' Philippines'], Location((14.5906216, 120.9799696, 0.0)))",,,917743791338954752,https://twitter.com/stateofdnation/status/917743791338954752
itsrvin,2017-10-10 21:25,0,0,17 Marawi hostages about to be beheaded were rescued.,"(['General Trias', ' Calabarzon'], Location((14.32675975, 120.90618458, 0.0)))",,,917742823574618113,https://twitter.com/itsrvin/status/917742823574618113
gaudenjoe,2017-10-10 21:22,0,0,WATCH: Ang Dating Daan conducts Massive Medical Mission for Displaced Marawi Citizens https://thegoodnewsph.wordpress.com/2017/10/10/watch-ang-dating-daan-conducts-maasive-medical-mission-for-displaced-marawi-citizens/ … via,"(['Pasig City'], Location((9.7771753, 125.4915723, 0.0)))",,,917742223789133825,https://twitter.com/gaudenjoe/status/917742223789133825
AsCorrespondent,2017-10-10 21:15,1,0,Eight foreigners among the remaining 40 militants still fighting in Marawi - Philippines army https://goo.gl/sQ3Ajn # MauteGrouppic.twitter.com/heAH97wjkA,"(['Kuala Lumpur City'], Location((7.0385065, 125.5072204, 0.0)))",,#,917740249249325056,https://twitter.com/AsCorrespondent/status/917740249249325056
ANCALERTS,2017-10-10 21:13,1,16,Duterte hopes Marawi crisis over in one week http://bit.ly/2xwM6dj,"(['Philippines'], Location((12.7503486, 122.7312101, 0.0)))",,,917739816116035584,https://twitter.com/ANCALERTS/status/917739816116035584
ABSCBNNews,2017-10-10 21:12,2,25,Duterte hopes Marawi crisis over in one week http://bit.ly/2xwovcL,"(['Manila', ' Philippines'], Location((14.5906216, 120.9799696, 0.0)))",,,917739618597879808,https://twitter.com/ABSCBNNews/status/917739618597879808
tunelife_mag,2017-10-10 21:11,0,0,Video shared and posted -Marawi - Pio Balbuena (Official Music Video) - http://tune.life/marawi-pio-balbuena-offi …...pic.twitter.com/78X1c4BiXq,"(['United States'], Location((39.7837304, -100.4458825, 0.0)))",,,917739423890051072,https://twitter.com/tunelife_mag/status/917739423890051072
pausemuna,2017-10-10 21:10,0,0,10/10/17 PEACE PARA SA BAYAN EVENING MEDITATION - Sending peace to Marawi - Sending peace to Mindanao... http://fb.me/1BXDIp1ZC,"(['Makati', ' Philippines'], Location((14.55459465, 121.021407905, 0.0)))",,,917739226015309824,https://twitter.com/pausemuna/status/917739226015309824
FlorianNeuhof,2017-10-10 21:08,1,0,Siege of # Marawi: How # Philippines insurgency provides fertile recruiting ground for jihad in Asia https://www.thenational.ae/world/asia/siege-of-marawi-how-philippines-insurgency-provided-fertile-recruiting-ground-for-extremists-1.665738 … # ISIS,"(['Erbil'], Location((36.37662015, 44.1661820118, 0.0)))",,# # #,917738633079283712,https://twitter.com/FlorianNeuhof/status/917738633079283712
inquirer_libre,2017-10-10 21:07,0,0,Pro-IS sniper in Marawi kills soon-to-marry Army junior officer http://ebx.sh/2wKiI3S,"(['Philippines'], Location((12.7503486, 122.7312101, 0.0)))",,,917738356922048514,https://twitter.com/inquirer_libre/status/917738356922048514
Ot9yskie,2017-10-10 21:07,0,1,BALAKAJAN SA MARAWI ISA KA KASING SAWI!! BOOOM GALING MO PICK UP,"(['Hogwarts'], Location((-1.24139975, 36.784112734, 0.0)))",,,917738296133988354,https://twitter.com/Ot9yskie/status/917738296133988354
wadafukraven,2017-10-10 21:06,0,0,HAHAHAHAHA UNANG BASA KO BALA KA JAN MARAWI HAHAHAHAHHA XD,"([""pizza's""], Location((-34.9123699, -56.1781241, 0.0)))",,,917738170770272257,https://twitter.com/wadafukraven/status/917738170770272257
eurasiamap,2017-10-10 21:03,0,0,Pro-IS sniper in Marawi kills soon-to-marry Army junior officer https://philippines.liveuamap.com/en/2017/10-october-prois-sniper-in-marawi-kills-soontomarry-army … via @ inquirerdotnetpic.twitter.com/e3YD3Zbm9n,,@,,917737294714589184,https://twitter.com/eurasiamap/status/917737294714589184
Kei_jpg,2017-10-10 21:02,0,0,# AskKib sabi mo gusto mo sa susunod na BS mo hindi na sa luzon. So? Marawi o Tawi-tawi? @ Raze_WP,"(['Fiction'], Location((51.3735655, -0.102693351897, 0.0)))",@,#,917736986911244288,https://twitter.com/Kei_jpg/status/917736986911244288
dwiz882,2017-10-10 20:57,0,0,Paglalagay ng linya ng kuryente sa Marawi City nakumpleto na http://www.dwiz882am.com/index.php/paglalagay-ng-linya-ng-kuryente-sa-marawi-city-nakumpleto-na/ …,"(['Pasig City', ' Philippines'], Location((9.7771753, 125.4915723, 0.0)))",,,917735916092907520,https://twitter.com/dwiz882/status/917735916092907520
ZachAbuza,2017-10-10 20:57,17,10,# Malaysian militant Joraimee confirmed dead in Marawi; 3rd Malaysian to have been killed. Still no word on Dr Mahmud http://globalnation.inquirer.net/160825/malaysian-militant-joraimee-killed-marawi …,,,#,917735788724609026,https://twitter.com/ZachAbuza/status/917735788724609026
eurasiamap,2017-10-10 20:54,0,0,Malaysian militant Joraimee killed in Marawi https://philippines.liveuamap.com/en/2017/10-october-malaysian-militant-joraimee-killed-in-marawi … via @ inquirerdotnetpic.twitter.com/0Kdjdh2hGL,,@,,917735053970550785,https://twitter.com/eurasiamap/status/917735053970550785
etdbrief_ro_1,2017-10-10 20:52,0,0,Pro-IS sniper in Marawi kills soon-to-marry Army junior officer https://philippines.liveuamap.com/en/2017/10-october-prois-sniper-in-marawi-kills-soontomarry-army …,,,,917734557545369600,https://twitter.com/etdbrief_ro_1/status/917734557545369600
manilainformer,2017-10-10 20:49,0,0,Duterte: PH doing best to end to Marawi crisis in 'one week' https://manilainformer.com/252353/duterte-ph-doing-best-to-end-to-marawi-crisis-in-one-week/ …pic.twitter.com/POm1qZBZJ9,"(['Manila'], Location((14.5906216, 120.9799696, 0.0)))",,,917733922263453696,https://twitter.com/manilainformer/status/917733922263453696
Kristeynponce,2017-10-10 20:42,0,0,Alam nyo kung anong masarap gawin ngayon? Yung mga plastic patapon nyo sa marawi,,,,917732151180718080,https://twitter.com/Kristeynponce/status/917732151180718080
inquirerdotnet,2017-10-10 20:40,5,3,Pro-IS sniper in Marawi kills soon-to-marry Army junior officer http://ebx.sh/2y5LhwD,"(['Makati City'], Location((14.5591272, 121.0202094, 0.0)))",,,917731498987524096,https://twitter.com/inquirerdotnet/status/917731498987524096
louvaleriano_,2017-10-10 20:38,0,1,"Wag ng tanggapin! Hahaha sabi ba sakin lilipat ka daw school, sa marawi daw.","(['PH'], Location((12.44249325, 122.160395164, 0.0)))",,,917730990763655168,https://twitter.com/louvaleriano_/status/917730990763655168
luckylu0420,2017-10-10 20:34,0,0,Yung selpon ko sarap ipatapon sa marawi. Di ko minsan natatanggap mga message at di rin ako makapag send. Di rin... http://fb.me/ArqkuKn0,"(['Seoul', ' Republic of Korea'], Location((37.5666791, 126.9782914, 0.0)))",,,917730088443138049,https://twitter.com/luckylu0420/status/917730088443138049
DailyStarPH,2017-10-10 20:33,0,0,Malaysian militant Joraimee killed in Marawi - https://www.dailystarph.com/malaysian-militant-joraimee-killed-in-marawi/ …pic.twitter.com/FblFPLDkMs,"(['Republic of the Philippines'], Location((12.7503486, 122.7312101, 0.0)))",,,917729799044550657,https://twitter.com/DailyStarPH/status/917729799044550657
strawpaully,2017-10-10 20:26,0,1,Grabe sa agh shet puro mga nainjured sa marawi patient amp solid pala talaga don kakataqt,"(['San Pedro', ' Calabarzon'], Location((-24.1602794, -56.713749623, 0.0)))",,,917727943165591555,https://twitter.com/strawpaully/status/917727943165591555
1ksuarez,2017-10-10 20:23,0,0,"Deleted a tweet. It wasnt worth the effort. Insane tweets over the side Stay strong and courageous, soldiers in # Marawi. # terrorism","(['Republic of the Philippines'], Location((12.7503486, 122.7312101, 0.0)))",,# #,917727367375679488,https://twitter.com/1ksuarez/status/917727367375679488
PHTopNews,2017-10-10 20:23,0,0,Malaysian militant Joraimee killed in Marawi - http://Inquirer.net  https://goo.gl/fb/h4YHUk,,,,917727311071498240,https://twitter.com/PHTopNews/status/917727311071498240
AsiaNews_FR,2017-10-10 20:21,3,0,# Philippine une évacuée de # Marawi gère une entreprise florissante de tente de secours Par @ JackBoardCNApic.twitter.com/c5mTohhuvh,,@,# #,917726754793340928,https://twitter.com/AsiaNews_FR/status/917726754793340928
inquirerdotnet,2017-10-10 20:14,2,8,Malaysian militant Joraimee killed in Marawi http://ebx.sh/2y7p2GM,"(['Makati City'], Location((14.5591272, 121.0202094, 0.0)))",,,917724988475658242,https://twitter.com/inquirerdotnet/status/917724988475658242
avilexzxc,2017-10-10 20:12,0,0,"Di mo pa ba nakikita yung MARAWI"" ang nakalagay?""",,,,917724525206241286,https://twitter.com/avilexzxc/status/917724525206241286
Dan_Torrechiva,2017-10-10 20:09,0,0,ingat ingat din tayo tol baka mapatapon ka sa marawi nyan,,,,917723823201333248,https://twitter.com/Dan_Torrechiva/status/917723823201333248
kppdrm,2017-10-10 20:04,0,0," Polis mengesahkan militan warga Malaysia, Muhammad Joraimee Awang Raimee terbunuh di bandar Marawi, Filipina. ""... http://fb.me/69d2lA9hZ""",,,,917722586884194304,https://twitter.com/kppdrm/status/917722586884194304
Tatuaje_famosos,2017-10-10 20:04,0,0,ARESTADO NA! BIG FISH FINANCIER NG MAUTE GROUP sa MARAWI at ibang REBELDENG GROUPO! https://goo.gl/fb/CkPJqg,"(['Espa\xc3\xb1a'], Location((40.0028028, -4.003104, 0.0)))",,,917722559306715137,https://twitter.com/Tatuaje_famosos/status/917722559306715137
Lieysuarez,2017-10-10 20:04,0,0," Polis mengesahkan militan warga Malaysia, Muhammad Joraimee Awang Raimee terbunuh di bandar Marawi, Filipina. ""... http://fb.me/3Y1rgkh8W""","(['Putrajaya'], Location((2.9069676, 101.6750533, 0.0)))",,,917722542823006208,https://twitter.com/Lieysuarez/status/917722542823006208
monykafsosa,2017-10-10 20:03,0,0,ARESTADO NA! BIG FISH FINANCIER NG MAUTE GROUP sa MARAWI at ibang REBELDENG GROUPO! https://goo.gl/fb/CkPJqg,"(['Espa\xc3\xb1a'], Location((40.0028028, -4.003104, 0.0)))",,,917722132032966656,https://twitter.com/monykafsosa/status/917722132032966656
