urhairstylist4u,2017-07-26 10:46,0,0,UMAYAW ANG CHR! Chito Gascon Natakot sa Planong Ipadestino Siya sa Marawi ni Duterte. http://youtu.be/s7BCY4kSGcc?a,,,,890040546772779018,https://twitter.com/urhairstylist4u/status/890040546772779018
RTVMalacanang,2017-07-26 10:45,1,2,Salamat Magigiting na Mandirigma: Go Negosyo Kapatid for Marawi 7/25/2017: http://youtu.be/8XVyZ-9t6_A?a  via @ YouTube,"(['Manila', ' Philippines'], Location((14.5906216, 120.9799696, 0.0)))",@,,890040312328015872,https://twitter.com/RTVMalacanang/status/890040312328015872
PTVph,2017-07-26 10:45,0,2,NEWS: China to provide assistance for Marawi rehab http://dai.ly/x5us23s,"(['Philippines'], Location((12.7503486, 122.7312101, 0.0)))",,,890040226957058048,https://twitter.com/PTVph/status/890040226957058048
BoybandPH_PNGSN,2017-07-26 10:44,0,0,Buy your tickets online now at http://bit.ly/AwitParaSaMarawiTix … … Proceeds will be for the benefit of those afflicted by the conflict in Marawi.,"(['Republic of the Philippines'], Location((12.7503486, 122.7312101, 0.0)))",,,890040089174200320,https://twitter.com/BoybandPH_PNGSN/status/890040089174200320
MotherNature888,2017-07-26 10:44,0,0,"Please donate # HALAL food in # Marawi, not just any food","(['Philippines'], Location((12.7503486, 122.7312101, 0.0)))",,# #,890040040964882433,https://twitter.com/MotherNature888/status/890040040964882433
BoybandPH_PNGSN,2017-07-26 10:44,0,3,"Super fans & bandmates, BoybandPH will be performing at One Music LIVE: Awit Para Sa Marawi on August 6, 2017. Catch them live. pic.twitter.com/ElTTXY5MG5","(['Republic of the Philippines'], Location((12.7503486, 122.7312101, 0.0)))",,,890040010837065729,https://twitter.com/BoybandPH_PNGSN/status/890040010837065729
eriq49,2017-07-26 10:43,0,0,Actually I was thinking higher-level violence but closely localized like Marawi.,"(['Toronto'], Location((43.653963, -79.387207, 0.0)))",,,890039921469206529,https://twitter.com/eriq49/status/890039921469206529
hailjahna,2017-07-26 10:40,0,0,and yung mga vids at pictures ng war sa marawi at war on drugs sakit sa puso hindi ko kaya makita.,,,,890039163910631424,https://twitter.com/hailjahna/status/890039163910631424
H2OComms,2017-07-26 10:40,8,5,"Report by @ staronline & @ theSundaily: Singapore & Brunei may join # TMP sea patrols"" ""Humanitarian help for # Marawi people"" @ HishammuddinH2Opic.twitter.com/7yuK2vx5da""","(['Malaysia'], Location((2.3923759, 112.8471939, 0.0)))",@ @ @,# #,890039075649929217,https://twitter.com/H2OComms/status/890039075649929217
wabshikoi06,2017-07-26 10:37,0,0,"Dalhin kita sa marawi!!! Mga ganitong tao ang salot sa lipunan kahit sinong presidente mag rarally ka, ang taas... http://fb.me/39bpcU3ox","(['Philippines'], Location((12.7503486, 122.7312101, 0.0)))",,,890038393605947392,https://twitter.com/wabshikoi06/status/890038393605947392
NGOHaRUM,2017-07-26 10:36,0,0,"Sumbangan orang ramai kepada HaRUM, khusus untuk Marawi akan mula diedarkan pada 27hb July. Insyallah 4 orang... http://fb.me/5N7QAvy3l","(['Kuala Lumpur City'], Location((7.0385065, 125.5072204, 0.0)))",,,890038206036561920,https://twitter.com/NGOHaRUM/status/890038206036561920
gmanewsfacebook,2017-07-26 10:35,0,0,Nakunan ng video ang paglikas ng isang grupo ng sibilyan mula sa bakbakan sa Marawi City. Aabot naman sa hanggang... http://fb.me/6giyg1kiI,,,,890037722525519873,https://twitter.com/gmanewsfacebook/status/890037722525519873
cheorcz,2017-07-26 10:34,0,0,Mga Sundalo sa Marawi Nagpasalamat sa Supporta: http://youtu.be/g9HrPdmuZyU?a  via @ YouTube,,@,,890037563657998337,https://twitter.com/cheorcz/status/890037563657998337
DGeek0,2017-07-26 10:33,0,0,im no Girl Scout...but lets continue to Pray for Marawi.... and # SupportOurTroops # DefendMarawipic.twitter.com/gTF6koRqaY,,,# #,890037320253980672,https://twitter.com/DGeek0/status/890037320253980672
PHHotTrends,2017-07-26 10:33,0,0,Slain Marawi soldiers’ families get P1.25 M each https://shar.es/1ThLj0,"(['Manila City'], Location((14.5906216, 120.9799696, 0.0)))",,,890037269876420609,https://twitter.com/PHHotTrends/status/890037269876420609
amayalleen16,2017-07-26 10:31,0,0,Ipadala ko sya sa MARAWI eh ng mahimasmasan sya at magkaroon ng nginig sa ABS nya.banas talaga ako sa yabang nya .,"(['Quezon City', ' National Capital'], Location((14.6509905, 121.0486155, 0.0)))",,,890036746674593793,https://twitter.com/amayalleen16/status/890036746674593793
undercoater_05,2017-07-26 10:31,0,0,President Duterte leads turnover of financial assistance to families of slain troops in Marawi President Rodrigo... http://fb.me/8TmIGobek,"(['brunei'], Location((4.4137155, 114.5653908, 0.0)))",,,890036725766127616,https://twitter.com/undercoater_05/status/890036725766127616
RMNIloilo774,2017-07-26 10:30,0,0,KAPULISAN SANG PRO6 NAG HATAG SANG RELIEF ASSISTANCE SA DSWD NGA IPADALA SA MARAWI CITY. (Marjorie Hervo) http://fb.me/yRUyGh9U,"(['Iloilo City', ' Western Visayas'], Location((10.7026718, 122.5686136, 0.0)))",,,890036623097901057,https://twitter.com/RMNIloilo774/status/890036623097901057
PhilstarNews,2017-07-26 10:30,0,5,Slain Marawi soldiers’ families get P1.25 M each https://shar.es/1ThLj0,"(['Manila', ' Philippines'], Location((14.5906216, 120.9799696, 0.0)))",,,890036540151287810,https://twitter.com/PhilstarNews/status/890036540151287810
yusufledesma,2017-07-26 10:27,1,0,@ inquirerdotnet AFP to bar civilians from returning to Marawi now http://newsinfo.inquirer.net/917580/afp-to-bar-civilians-from-returning-to-marawi-now …,"(['Manila'], Location((14.5906216, 120.9799696, 0.0)))",@,,890035881926475776,https://twitter.com/yusufledesma/status/890035881926475776
RMNIloilo774,2017-07-26 10:27,0,0,KAPULISAN SANG PRO6 NAG HATAG SANG RELIEF ASSISTANCE SA DSWD NGA IPADALA SA MARAWI CITY. (Marjorie Hervo) http://fb.me/1wSot9yxC,"(['Iloilo City', ' Western Visayas'], Location((10.7026718, 122.5686136, 0.0)))",,,890035862838312960,https://twitter.com/RMNIloilo774/status/890035862838312960
colcolfrancisco,2017-07-26 10:27,0,4,Rest in peace kuya Toto/Totoy we'll surely miss you. May God guide you back to Him. Sana matapos narin yung kaguluhan sa Marawi.,,,,890035799751655424,https://twitter.com/colcolfrancisco/status/890035799751655424
RTVMalacanang,2017-07-26 10:26,1,2,Salamat Magigiting na Mandirigma: Go Negosyo Kapatid for Marawi (Speech) 7/25/2017: http://youtu.be/fKygudQbXNk?a  via @ YouTube,"(['Manila', ' Philippines'], Location((14.5906216, 120.9799696, 0.0)))",@,,890035660219965440,https://twitter.com/RTVMalacanang/status/890035660219965440
RMNIloilo774,2017-07-26 10:25,0,0,PR06 NAG TURN OVER SANG RELIEF ASSISTANCE NGA IPADALA SA MARAWI CITY. # TatakRMN (Marjorie Hervo) http://fb.me/A2jJsG2s,"(['Iloilo City', ' Western Visayas'], Location((10.7026718, 122.5686136, 0.0)))",,#,890035387376259072,https://twitter.com/RMNIloilo774/status/890035387376259072
CalibaraFely,2017-07-26 10:25,0,0,Ipadala yan sa Marawi. http://fb.me/6L1GqI3DB,,,,890035318661017601,https://twitter.com/CalibaraFely/status/890035318661017601
crlyl3,2017-07-26 10:22,0,0,*MARAWI GAMING,,,,890034659542810624,https://twitter.com/crlyl3/status/890034659542810624
crlyl3,2017-07-26 10:22,0,0,mag dota muna ako then mag MARAWI GAMING ako],,,,890034610515595264,https://twitter.com/crlyl3/status/890034610515595264
MINDEFMalaysia,2017-07-26 10:21,5,5,"Humanitarian help for Marawi people, says Hisham Source: @ theSundailypic.twitter.com/cUE1AcUpbY",,@,,890034209678540800,https://twitter.com/MINDEFMalaysia/status/890034209678540800
gmanews,2017-07-26 10:20,1,10,LOOK: Presidential Peace Process Adviser Jesus Dureza dialogues with Marawi evacuees. | via @ stevefdailisanpic.twitter.com/Bbn3JADMTJ,"(['Philippines'], Location((12.7503486, 122.7312101, 0.0)))",@,,890034182600052736,https://twitter.com/gmanews/status/890034182600052736
stevefdailisan,2017-07-26 10:19,0,1,LOOK: Presidential Peace Process Adviser Jesus Dureza dialogues with Marawi evacuees. pic.twitter.com/V4cXi7Ymhc,"(['Republic of the Philippines'], Location((12.7503486, 122.7312101, 0.0)))",,,890033844572758016,https://twitter.com/stevefdailisan/status/890033844572758016
Ibajay,2017-07-26 10:19,0,0,Top business leaders give families of fallen Marawi troopers P1.25M each http://fb.me/7uYH1cXiI,,,,890033798355836930,https://twitter.com/Ibajay/status/890033798355836930
NewsRmn,2017-07-26 10:18,0,0,"Mga bakwit, pinagbabawalan pa ring makabalik ng Marawi City https://rmn.ph/mga-bakwit-pinagbabawalan-pa-ring-makabalik-ng-marawi-city/ … via @ rmnnetworks","(['Republic of the Philippines'], Location((12.7503486, 122.7312101, 0.0)))",@,,890033641304109056,https://twitter.com/NewsRmn/status/890033641304109056
PHHotTrends,2017-07-26 10:18,0,0,Duterte suspends military operations in Marawi # MarawiUpdateshttps://shar.es/1ThMSb,"(['Manila City'], Location((14.5906216, 120.9799696, 0.0)))",,#,890033596156739584,https://twitter.com/PHHotTrends/status/890033596156739584
mariaressa,2017-07-26 10:18,3,2,Rappler Talk: Sidney Jones on Marawi siege and ISIS in Southeast Asia http://www.rappler.com/nation/176689-rappler-talk-sidney-jones-marawi-siege-terrorism-southeast-asia … via @ rapplerdotcompic.twitter.com/digs4xAVuc,"(['Philippines'], Location((12.7503486, 122.7312101, 0.0)))",@,,890033541458702336,https://twitter.com/mariaressa/status/890033541458702336
kayestalkstalks,2017-07-26 10:18,0,3,ANG SAKIT.MGA SUNDALO NGA SA MARAWI DI SUMUSUKO TEH.TAPOS IKAW SUSUKUAN?? ANG SAKIT HUHU,"(['Wonderland'], Location((16.3131877, 121.1297478, 0.0)))",,,890033470432346113,https://twitter.com/kayestalkstalks/status/890033470432346113
NewsRmn,2017-07-26 10:18,0,0,"P-Duterte, pinangunahan ang pagbigay tulong pinansyal sa mga kaanak ng mga sundalo at pulis na nasawi sa Marawi City https://rmn.ph/pangulong-rodrigo-duterte-pinangunahan-ang-pagbibigay-ng-tulong-pinansyal-sa-mga-kaanak-ng-mga-sundalo-at-pulis-na-nasawi-sa-marawi-city/ …","(['Republic of the Philippines'], Location((12.7503486, 122.7312101, 0.0)))",,,890033453902647296,https://twitter.com/NewsRmn/status/890033453902647296
mariaressa,2017-07-26 10:17,1,4,How pro-ISIS fighters recruited Filipino youth for Marawi siege - http://www.rappler.com/world/regions/asia-pacific/176302-muslim-youth-recruitment-marawi … via @ RapplerIDpic.twitter.com/fmzmkkVWuW,"(['Philippines'], Location((12.7503486, 122.7312101, 0.0)))",@,,890033354275303425,https://twitter.com/mariaressa/status/890033354275303425
radyopilipinas1,2017-07-26 10:17,0,0,NEWS: Lorenzana on Marawi crisis: Now is not the time for finger-pointing,"(['Quezon City', ' Philippines'], Location((14.6509905, 121.0486155, 0.0)))",,,890033350022385664,https://twitter.com/radyopilipinas1/status/890033350022385664
mariaressa,2017-07-26 10:17,0,3,"Via Telegram, Western Union: How ISIS in Syria funded Marawi terrorists - http://www.rappler.com/nation/176295-syria-isis-marawi-funding … via @ RapplerIDpic.twitter.com/modAKzQ3nJ","(['Philippines'], Location((12.7503486, 122.7312101, 0.0)))",@,,890033318183305216,https://twitter.com/mariaressa/status/890033318183305216
egdsgn,2017-07-26 10:16,0,0,PRRD graces the ‘Salamat Magigiting na Mandirigma: Go Negosyo Kapatid for Marawi’ ceremony https://politicsph.pogoport.com/prrd-graces-the-salamat-magigiting-na-mandirigma-go-negosyo-kapatid-for-marawi-ceremony/ …,"(['Davao City', ' Davao Region'], Location((7.22650725, 125.454887691, 0.0)))",,,890033025043529729,https://twitter.com/egdsgn/status/890033025043529729
muzi_kha,2017-07-26 10:16,0,0,PRRD graces the ‘Salamat Magigiting na Mandirigma: Go Negosyo Kapatid for Marawi’ ceremony https://politicsph.pogoport.com/prrd-graces-the-salamat-magigiting-na-mandirigma-go-negosyo-kapatid-for-marawi-ceremony/ …,"(['The Office'], Location((9.6663813, 80.0122994306, 0.0)))",,,890033020413063170,https://twitter.com/muzi_kha/status/890033020413063170
chris19thws,2017-07-26 10:16,0,0,PRRD graces the ‘Salamat Magigiting na Mandirigma: Go Negosyo Kapatid for Marawi’ ceremony https://politicsph.pogoport.com/prrd-graces-the-salamat-magigiting-na-mandirigma-go-negosyo-kapatid-for-marawi-ceremony/ …,"(['Philippines'], Location((12.7503486, 122.7312101, 0.0)))",,,890033014281043968,https://twitter.com/chris19thws/status/890033014281043968
PoGo_Port,2017-07-26 10:16,0,0,PRRD graces the ‘Salamat Magigiting na Mandirigma: Go Negosyo Kapatid for Marawi’ ceremony https://politicsph.pogoport.com/prrd-graces-the-salamat-magigiting-na-mandirigma-go-negosyo-kapatid-for-marawi-ceremony/ …,,,,890033008757133313,https://twitter.com/PoGo_Port/status/890033008757133313
orga_ogop,2017-07-26 10:16,0,0,PRRD graces the ‘Salamat Magigiting na Mandirigma: Go Negosyo Kapatid for Marawi’ ceremony https://politicsph.pogoport.com/prrd-graces-the-salamat-magigiting-na-mandirigma-go-negosyo-kapatid-for-marawi-ceremony/ …,,,,890033003031912448,https://twitter.com/orga_ogop/status/890033003031912448
RTheKrak3n,2017-07-26 10:16,0,0,PRRD graces the ‘Salamat Magigiting na Mandirigma: Go Negosyo Kapatid for Marawi’ ceremony https://politicsph.pogoport.com/prrd-graces-the-salamat-magigiting-na-mandirigma-go-negosyo-kapatid-for-marawi-ceremony/ …,,,,890032993594691589,https://twitter.com/RTheKrak3n/status/890032993594691589
rmnnetworks,2017-07-26 10:15,0,0,"# LATESTNEWS Mga bakwit, pinagbabawalan pa ring makabalik ng Marawi City http://fb.me/8dazc8TKW",,,#,890032737716916225,https://twitter.com/rmnnetworks/status/890032737716916225
1MillionPHL,2017-07-26 10:10,0,0,"The very latest news and videos updated every hour (Marawi offensives not suspended, ...) has been published on http://1millionfilipinos.com/watch-2403/ pic.twitter.com/OtrkM9wuR7",,,,890031489546452992,https://twitter.com/1MillionPHL/status/890031489546452992
pilipinasvirals,2017-07-26 10:09,0,0,I added a video to a @ YouTube playlist http://youtu.be/5qnuxOrsisc?a  MAUTE NAGLABAS NG PANIBAGONG VIDEO MARAWI LATEST NEWS UPDATE,,@,,890031179654737924,https://twitter.com/pilipinasvirals/status/890031179654737924
Peace20Imagine,2017-07-26 10:07,0,0,Slain Marawi soldiers’ families get P1.25 M each | Philstar for iOS http://www.philstar.com/headlines/2017/07/26/1721638/slain-marawi-soldiers-families-get-p1.25-m-each …pic.twitter.com/8aChQneUJG,"(['Canada'], Location((61.0666922, -107.9917071, 0.0)))",,,890030695933894656,https://twitter.com/Peace20Imagine/status/890030695933894656
manuelg56250743,2017-07-26 10:01,0,0,Top business leaders give families of fallen Marawi troopers P1.25M each http://news.mb.com.ph/2017/07/26/top-business-leaders-give-families-of-fallen-marawi-troopers-p1-25m-each/ … via @ manila_bulletin,,@,,890029357334265856,https://twitter.com/manuelg56250743/status/890029357334265856
pnagovph,2017-07-26 10:00,1,0,"Gifts, inspiring letters for soldiers fighting in Marawi | http://www.pna.gov.ph/articles/1002809 …","(['Quezon City'], Location((14.6509905, 121.0486155, 0.0)))",,,890029072662675456,https://twitter.com/pnagovph/status/890029072662675456
dncnclreyes,2017-07-26 10:00,0,5,"nagsitakbuhan mga tao kasi may sign board yung isang jeep. kaso paglapit ng jeep MARAWI :P"" NAKALAGAY HAHAHAHAHAHA""","(['Pasay City', ' Merville'], Location((14.5437592, 120.9954657, 0.0)))",,,890028983181426688,https://twitter.com/dncnclreyes/status/890028983181426688
TheKingGiovanne,2017-07-26 09:59,0,14,Huy nice na lagi ang msu marawi ron wa nakay bayran bisag piso pa enrol,,,,890028872372076544,https://twitter.com/TheKingGiovanne/status/890028872372076544
judedeanp,2017-07-26 09:58,0,0,Marawi Checkpoint! https://www.instagram.com/p/BW_gBXMBd5m/,"([""I'm a Martian.""], Location((43.5303957, 0.5613721, 0.0)))",,,890028635582803968,https://twitter.com/judedeanp/status/890028635582803968
shlycrz_14,2017-07-26 09:57,0,31,SAVE MARAWI !!! pic.twitter.com/PZrWkYCuen,"(['moon'], Location((44.7716333, -89.787902, 0.0)))",,,890028259659743232,https://twitter.com/shlycrz_14/status/890028259659743232
marawi_5,2017-07-26 09:56,1,1,كيف أذبل وإنت في عُمري نعيم,,,,890027929190772737,https://twitter.com/marawi_5/status/890027929190772737
jovelyn_n,2017-07-26 09:55,0,0,"Marawi offensives not suspended, says military https://goo.gl/fb/PvkQQX",,,,890027826602180609,https://twitter.com/jovelyn_n/status/890027826602180609
dzIQ990,2017-07-26 09:53,0,0,"Mga sundalo sa main battle area sa Marawi, nagkakasakit na | @ chonayu1","(['Makati City'], Location((14.5591272, 121.0202094, 0.0)))",@,,890027276691054592,https://twitter.com/dzIQ990/status/890027276691054592
sibal_03,2017-07-26 09:53,0,0,اممممممممين يارب,,,,890027143694094336,https://twitter.com/sibal_03/status/890027143694094336
Marawi_alii,2017-07-26 09:51,0,0,انت النعمة ،، الي مابيها لغيري.,,,,890026879872323584,https://twitter.com/Marawi_alii/status/890026879872323584
CNPH2016,2017-07-26 09:50,0,0,President Duterte leads turnover of financial assistance to families of slain troops in Marawi President Rodrigo... http://fb.me/xsoL82wg,"(['Philippines'], Location((12.7503486, 122.7312101, 0.0)))",,,890026515655786496,https://twitter.com/CNPH2016/status/890026515655786496
marawi_5,2017-07-26 09:48,2,1,يارب أجعل كل مادعيته لك سراً وجهراً تكتبه لي واقعاً يفرح به قلبي.,,,,890026110561472513,https://twitter.com/marawi_5/status/890026110561472513
KakBejo,2017-07-26 09:48,0,0,"Kalo negaranya kadang kayak Suriah ato yg deket deh, kayk di Marawi, Filipin, gimana buk?","(['Jakarta Timur', ' DKI Jakarta'], Location((-6.26289085, 106.882228947, 0.0)))",,,890026058514219008,https://twitter.com/KakBejo/status/890026058514219008
marawi_5,2017-07-26 09:47,0,2,كل شيء قابّل للتغيير إلا إنتمائي وحُبي لك.,,,,890025864364163072,https://twitter.com/marawi_5/status/890025864364163072
newspaperphcom,2017-07-26 09:47,0,0,"WATCH: Sundalong Rapper, Nag-viral Sa Social Media Ang Tula Niya Para sa Kapwa Sundalo sa Marawi http://ift.tt/2uXraid","(['Republic of the Philippines'], Location((12.7503486, 122.7312101, 0.0)))",,,890025749054455809,https://twitter.com/newspaperphcom/status/890025749054455809
AmyChewCNA,2017-07-26 09:45,0,0,# MauteGroup member&#8217; nabbed in Lanao Sur evacuation center # Marawi http://newsinfo.inquirer.net/917574/maute-group-member-nabbed-in-lanao-sur-evacuation-center …,"(['Malaysia & Indonesia'], Location((-7.5388376, 112.2379849, 0.0)))",,# #8217 #,890025175676198912,https://twitter.com/AmyChewCNA/status/890025175676198912
netizens88,2017-07-26 09:44,0,0,"WATCH: Sundalong Rapper, Nag-viral Sa Social Media Ang Tula Niya Para sa Kapwa Sundalo sa Marawi http://ift.tt/2tI4vHb # netizensPH # pino…",,,# #,890024948613492737,https://twitter.com/netizens88/status/890024948613492737
tagpi1,2017-07-26 09:43,0,0,"Again, Marawi is not Mindanao & Mindanao is not Marawi. Why is this very hard to understand??!",,,,890024823698501632,https://twitter.com/tagpi1/status/890024823698501632
hellyeahshin,2017-07-26 09:43,0,1,"Extension of Martial Law would be fine, if and it will be for the betterment of Marawi.","(['Melting Pot of the South'], Location((39.0404491, -94.5932427, 0.0)))",,,890024765469085696,https://twitter.com/hellyeahshin/status/890024765469085696
20002091qqw,2017-07-26 09:42,3,1,اللهم ارحمه واغفر له,,,,890024593129426944,https://twitter.com/20002091qqw/status/890024593129426944
pnagovph,2017-07-26 09:41,1,0,Ilonggo troops in Marawi City grateful to Duterte's unwavering support | @ TeamAFP @ pnppio | http://www.pna.gov.ph/articles/1002814 …pic.twitter.com/2Z8KwkYv7s,"(['Quezon City'], Location((14.6509905, 121.0486155, 0.0)))",@ @,,890024158943367169,https://twitter.com/pnagovph/status/890024158943367169
dzrhnews,2017-07-26 09:38,0,0,Marawi Councilor Borgy sumama rin sa usapan ng # Isyu ngayong araw,"(['Manila', ' Philippines'], Location((14.5906216, 120.9799696, 0.0)))",,#,890023534365257728,https://twitter.com/dzrhnews/status/890023534365257728
Terpolska,2017-07-26 09:38,0,0,Awesome article re:what's really going on on Marawi....https://www.rt.com/op-edge/396462-marawi-duterte-isis-war/ …,,,,890023364210835456,https://twitter.com/Terpolska/status/890023364210835456
iwriteasiwrite,2017-07-26 09:36,16,29,"While the AFP is trying to tear down the constitution, they're sending troops into Marawi without basic protections and equipment.","(['Philippines'], Location((12.7503486, 122.7312101, 0.0)))",,,890023103551512577,https://twitter.com/iwriteasiwrite/status/890023103551512577
Proud_ilocano,2017-07-26 09:35,0,0,"IAPAdamag July 26, 2017 Bangkay ti Cordilleran SAF trooper a pimmusay sadiay Marawi City, maiturong sadiay... http://fb.me/1AuelYAC7","(['Philippines'], Location((12.7503486, 122.7312101, 0.0)))",,,890022662797484033,https://twitter.com/Proud_ilocano/status/890022662797484033
dzrhnews,2017-07-26 09:33,0,0,Dy: Magdo-donate po tayo ng 1 milyon para sa mga kababayan natin na nakikipagbakbakan sa Marawi.,"(['Manila', ' Philippines'], Location((14.5906216, 120.9799696, 0.0)))",,,890022348056809472,https://twitter.com/dzrhnews/status/890022348056809472
aasf44,2017-07-26 09:31,4,2,انا لله وانا اليه راجعون عظم الله اجرها وغفر الله لميتها واسكنه فسيح جناته,,,,890021840722305028,https://twitter.com/aasf44/status/890021840722305028
inquirerdotnet,2017-07-26 09:31,4,7,AFP to bar civilians from returning to Marawi now http://ebx.sh/2uXAhiH pic.twitter.com/06hlB8hDWV,"(['Makati City'], Location((14.5591272, 121.0202094, 0.0)))",,,890021621645418497,https://twitter.com/inquirerdotnet/status/890021621645418497
dwdd1134,2017-07-26 09:30,0,0,HELPING HAND | Marawi evacuees receives relief assistance from ASEAN Humanitarian Centre # Katropa # DSWD... http://fb.me/6HD0LNtd1,,,# #,890021421811986433,https://twitter.com/dwdd1134/status/890021421811986433
manilabulletin,2017-07-26 09:30,2,5,Top business leaders give families of fallen Marawi troopers P1.25M each - Read: http://bit.ly/2uV1J18 # BeFullyInformed,"(['Manila', ' Philippines'], Location((14.5906216, 120.9799696, 0.0)))",,#,890021352467566598,https://twitter.com/manilabulletin/status/890021352467566598
sycipft,2017-07-26 09:29,0,0,GOOD NEWS: PAMILYA NG MGA NASAWING SUNDALO BINIGYAN NG 1-MILLION | DUTERTE FULL Speech at Go Negosyo for Marawi 7/25 http://www.pinoybalita.net/2017/07/good-news-pamilya-ng-mga-nasawing.html#.WXfwaodm7OQ.twitter …,,,#,890021202739183616,https://twitter.com/sycipft/status/890021202739183616
DailyDuterte,2017-07-26 09:16,0,1,President Duterte leads turnover of financial assistance to families of slain troops in Marawi President Rodrigo... http://fb.me/1pt7iTkhB,"(['Republic of the Philippines'], Location((12.7503486, 122.7312101, 0.0)))",,,890018065835900928,https://twitter.com/DailyDuterte/status/890018065835900928
manilabulletin,2017-07-26 09:15,2,1,18 months not enough to rehabilitate Marawi – Lorenzana - Read: http://bit.ly/2uVtI0x # BeFullyInformed,"(['Manila', ' Philippines'], Location((14.5906216, 120.9799696, 0.0)))",,#,890017577103220739,https://twitter.com/manilabulletin/status/890017577103220739
Terpolska,2017-07-26 09:13,0,1,On the ground in Marawi amid Duterte's battle against ISIS https://www.rt.com/op-edge/396462-marawi-duterte-isis-war/#.WXfsyRCcqto.twitter …,,,#,890017281727528960,https://twitter.com/Terpolska/status/890017281727528960
EastMinComAFP,2017-07-26 09:10,0,1,Evacuees in Marawi refute alleged abuses of some AFP personnel. http://fb.me/6D6DObxpr,,,,890016545111289856,https://twitter.com/EastMinComAFP/status/890016545111289856
Ivan226622,2017-07-26 09:10,0,0,"AFP: No more deadline for end to Marawi crisis http://bit.ly/2uve6zT  pic.twitter.com/NGgfUlH2H0 — ABS-CBN News (ABSCBNNews) July 26, 2017",,,,890016335828324353,https://twitter.com/Ivan226622/status/890016335828324353
Ivan226622,2017-07-26 09:10,0,0,"Marawi offensives not suspended, says military http://bit.ly/2uvvNzt # MarawiClash pic.twitter.com/VtZsh0ksB2 — ABS-CBN News (ABSCBNNews) …",,,#,890016334033059840,https://twitter.com/Ivan226622/status/890016334033059840
ABSCBNNews,2017-07-26 09:10,2,15,AFP: No more deadline for end to Marawi crisis http://bit.ly/2uve6zT pic.twitter.com/vEorABOvFx,"(['Manila', ' Philippines'], Location((14.5906216, 120.9799696, 0.0)))",,,890016318526640129,https://twitter.com/ABSCBNNews/status/890016318526640129
ABSCBNNews,2017-07-26 09:09,3,11,"Marawi offensives not suspended, says military http://bit.ly/2uvvNzt # MarawiClashpic.twitter.com/EKEtGWIP8D","(['Manila', ' Philippines'], Location((14.5906216, 120.9799696, 0.0)))",,#,890016247718453248,https://twitter.com/ABSCBNNews/status/890016247718453248
ANCALERTS,2017-07-26 09:09,0,4,"Marawi offensives not suspended, says military http://bit.ly/2uvPXJK","(['Philippines'], Location((12.7503486, 122.7312101, 0.0)))",,,890016237975031808,https://twitter.com/ANCALERTS/status/890016237975031808
enjeineer,2017-07-26 09:08,0,2,We are adopting a dog from Marawi cant wait to go home mamaya huhuhuhu or not leave the house nlg huhuhuhuhu,"(['Davao City', ' Phl'], Location((7.22650725, 125.454887691, 0.0)))",,,890015870306533376,https://twitter.com/enjeineer/status/890015870306533376
dzIQ990,2017-07-26 09:07,0,0,"VIRAL: Sundalong rapper, nag-alay ng tula sa mga kapwa sundalo sa Marawi - DZIQ Radyo Inquirer990AM http://radyo.inquirer.net/75221/viral-sundalong-rapper-nag-alay-ng-tula-sa-mga-kapwa-sundalo-sa-marawi#sthash.U7widEqP.uxfs … | @ donadominguez","(['Makati City'], Location((14.5591272, 121.0202094, 0.0)))",@,#sthash,890015595118215168,https://twitter.com/dzIQ990/status/890015595118215168
eviebeybey,2017-07-26 09:04,0,1,Kinsa jud diay? Huhu help me guys HAHAHAHA naikog kay ang Marawi kung mao na,,,,890014843054333952,https://twitter.com/eviebeybey/status/890014843054333952
