GalangJOVINO,2017-07-26 23:58,0,0,"Sundalong nasawi sa Marawi, na-sniper ng Maute sa ari; ikakasal na sana",,,,890240013517991937,https://twitter.com/GalangJOVINO/status/890240013517991937
CdOlaso,2017-07-26 23:58,0,0,Maraming maraming salamat sa pagtulong!!!! # One4MARAWI # Pray4MARAWI @Marawi City https://www.instagram.com/p/BXBADr4jp8a/,,@Marawi,# #,890239819388997634,https://twitter.com/CdOlaso/status/890239819388997634
itsjeca,2017-07-26 23:54,0,0,suko na kayo padala ko kayo sa marawi psh,"(['\xe2\x9d\x9dpals\xe2\x9d\x9e'], Location((41.9709891, 3.1460371, 0.0)))",,,890238867202232323,https://twitter.com/itsjeca/status/890238867202232323
blackalive_,2017-07-26 23:54,0,0,"Philippines President Calls On Separatists, Maoists Militant Groups To Fight ISIS In Marawi http://ref.gl/fMwtn8Bn","(['Detroit', ' MI'], Location((42.3486635, -83.0567375, 0.0)))",,,890238785748844544,https://twitter.com/blackalive_/status/890238785748844544
toptensg_com,2017-07-26 23:53,0,0,Duterte makes surprise visit to war-torn Marawi - https://ggmobiletech.com/apple-singapore/duterte-makes-surprise-visit-to-war-torn-marawi/ …,"(['Worldwide'], Location((53.4573434, -2.22698994022, 0.0)))",,,890238669176676352,https://twitter.com/toptensg_com/status/890238669176676352
dra_oraa,2017-07-26 23:53,13,24,Ipahagis nga daw po sa Marawi!!! https://twitter.com/julietjavier90/status/890237412336558080 …,,,,890238575853228032,https://twitter.com/dra_oraa/status/890238575853228032
hapilayf,2017-07-26 23:49,2,1,Ihagis sa Marawi yan.,,,,890237726481567745,https://twitter.com/hapilayf/status/890237726481567745
AKIRANTSLIFE,2017-07-26 23:49,0,0,"The hell is empty, the devils are here."" # PrayForMarawi""",,,#,890237542653542404,https://twitter.com/AKIRANTSLIFE/status/890237542653542404
halfbaaad,2017-07-26 23:47,0,0,Marawi. Maybe I was discriminated by their excuse about me being not qualified for any positions based on my resume and performance.,"(['PH'], Location((12.44249325, 122.160395164, 0.0)))",,,890237167263285248,https://twitter.com/halfbaaad/status/890237167263285248
Jetskie095,2017-07-26 23:46,0,0,# FPJAPUbusan Dapat si cardo yung pinapadala sa marawi eh hindi namatay eh,"(['Quezon City'], Location((14.6509905, 121.0486155, 0.0)))",,#,890236841726623744,https://twitter.com/Jetskie095/status/890236841726623744
harley_JSJ,2017-07-26 23:45,0,0,Parang pumasok sa Marawi na suntukan lang alam,,,,890236535479468033,https://twitter.com/harley_JSJ/status/890236535479468033
ajfrncsc_,2017-07-26 23:43,0,0,Aray. Sige hahaha ingat ka dun baka di ka tumagal. Nag-tatago mga pepe ng marawi e,"(['Rizal', ' Calabarzon'], Location((14.65, 121.25, 0.0)))",,,890236041839263745,https://twitter.com/ajfrncsc_/status/890236041839263745
ClarenzChrstian,2017-07-26 23:42,0,0,Hahaa next week marami ako lakad pupunta pa ko sa marawi,"(['Rizal', ' Calabarzon'], Location((14.65, 121.25, 0.0)))",,,890235874687856640,https://twitter.com/ClarenzChrstian/status/890235874687856640
sofyani100,2017-07-26 23:39,0,0,ياررررب,,,,890235106287333376,https://twitter.com/sofyani100/status/890235106287333376
sofyani100,2017-07-26 23:37,0,0,يسعدقلبك,,,,890234593785376770,https://twitter.com/sofyani100/status/890234593785376770
himari_chan_,2017-07-26 23:37,0,0,qiqil niya si acouh papatawag ko yung mga marawi para salakayin siya,,,,890234545328357376,https://twitter.com/himari_chan_/status/890234545328357376
moyekayente,2017-07-26 23:33,0,0,Why don't you move to Marawi instead. This will decongest Luzon Island.,,,,890233569150353408,https://twitter.com/moyekayente/status/890233569150353408
PhilippineStar,2017-07-26 23:30,0,3,Duterte suspends military operations in Marawi http://bit.ly/2uVq72R pic.twitter.com/om5UtR9Qqp,"(['Philippines'], Location((12.7503486, 122.7312101, 0.0)))",,,890232745149972480,https://twitter.com/PhilippineStar/status/890232745149972480
juztpost,2017-07-26 23:26,0,0,# juztpost 2 months later: A bridge in Marawi http://juztpost.com/2017/07/26/2-months-later-bridge-marawi/ …pic.twitter.com/t4fS8ZEQoT,"(['Republic of the Philippines'], Location((12.7503486, 122.7312101, 0.0)))",,#,890231923485921280,https://twitter.com/juztpost/status/890231923485921280
0ryuge,2017-07-26 23:26,1,1,Duterte halts military operations in Marawi http://www.rantburg.com/poparticle.php?D=07/26/2017&SO=&HC=1&ID=493607 … # Rantburg # WarOnTerror # ryuge # 26July2017,"(['Arizona'], Location((34.395342, -111.7632755, 0.0)))",,# # # #,890231787250606081,https://twitter.com/0ryuge/status/890231787250606081
saksi,2017-07-26 23:25,0,0,Sumiklab ang sunog sa ilang bahay sa Raya Madaya sa Marawi kaninang hapon.,"(['Philippines'], Location((12.7503486, 122.7312101, 0.0)))",,,890231538163503104,https://twitter.com/saksi/status/890231538163503104
PAPI_ORLAN,2017-07-26 23:25,0,0,Wla pong pasok sa marawi.,,,,890231517133234176,https://twitter.com/PAPI_ORLAN/status/890231517133234176
angel_osmil29,2017-07-26 23:23,0,0,Ganahan kag gubat dae? Adto ta sa marawi na,,,,890231187419021312,https://twitter.com/angel_osmil29/status/890231187419021312
liexlore,2017-07-26 23:23,0,0,Next contestant word:martial law sagot:ito ay pinatupad sa bansang marawi.. HAHAHA puta! Kulang na lang sabihin ang capital nito ay mauti!,,,,890231094699712512,https://twitter.com/liexlore/status/890231094699712512
changemakers_ph,2017-07-26 23:22,0,0,*~ KALAYO for MARAWI ~* <3 http://fb.me/1wJgxwrRk,"(['The Philippines'], Location((12.7503486, 122.7312101, 0.0)))",,,890230967608242178,https://twitter.com/changemakers_ph/status/890230967608242178
KimXianATGInc,2017-07-26 23:21,23,36,Let's campaign and support @ XianLimm & @ OneMusicPH 's campaign for Marawi https://twitter.com/xianlimm/status/890229660075925504 …,,@ @,,890230520369471488,https://twitter.com/KimXianATGInc/status/890230520369471488
begailbee,2017-07-26 23:19,7,10,"To survive in peace and harmony, united and strong, we must have 1 people, 1 nation, 1 flag. # PrayForPH # PrayForMarawi # PrayForPeace","(['error'], Location((51.242037, -0.1939401, 0.0)))",,# # #,890230029346496513,https://twitter.com/begailbee/status/890230029346496513
cheyndriaford,2017-07-26 23:18,0,0,"Im super busy right now but my friend asked me to edit a bookmark for Marawi, who am I to reject the opportunity? pic.twitter.com/P2AQuFInwI","(['hogwarts'], Location((-1.24139975, 36.784112734, 0.0)))",,,890229849150824448,https://twitter.com/cheyndriaford/status/890229849150824448
ab90o,2017-07-26 23:12,0,0,الله يسعدك ربي,"(['\xd8\xa7\xd9\x84\xd8\xb1\xd9\x8a\xd8\xa7\xd8\xb6', ' \xd8\xa7\xd9\x84\xd9\x85\xd9\x85\xd9\x84\xd9\x83\xd8\xa9 \xd8\xa7\xd9\x84\xd8\xb9\xd8\xb1\xd8\xa8\xd9\x8a\xd8\xa9 \xd8\xa7\xd9\x84\xd8\xb3\xd8\xb9\xd9\x88\xd8\xaf\xd9\x8a\xd8\xa9'], Location((24.6319692, 46.7150648, 0.0)))",,,890228237162467329,https://twitter.com/ab90o/status/890228237162467329
iamk14sulit,2017-07-26 23:11,0,3,11:11 i hope people who fight for marawi are okay,"([""keps'""], Location((51.4539664, -0.009755, 0.0)))",,,890228183093493760,https://twitter.com/iamk14sulit/status/890228183093493760
juztpost,2017-07-26 23:11,0,0,# juztpost AFP to bar civilians from returning to Marawi now http://juztpost.com/2017/07/26/afp-bar-civilians-returning-marawi-now/ …pic.twitter.com/yfTXbH0BZi,"(['Republic of the Philippines'], Location((12.7503486, 122.7312101, 0.0)))",,#,890228123538685952,https://twitter.com/juztpost/status/890228123538685952
DZMMTeleFeed,2017-07-26 23:10,0,0,"Mga naulila ng government troops sa Marawi, binigyan dahil sa armas",,,,890227712983486464,https://twitter.com/DZMMTeleFeed/status/890227712983486464
simpleisromz,2017-07-26 23:09,0,0,"..Because the Scout Rangers are specialized on Jungle warfare and not on urban areas(Marawi), they are also... http://fb.me/6gHGODKza","(['Cebu'], Location((10.45, 123.84, 0.0)))",,,890227488223371265,https://twitter.com/simpleisromz/status/890227488223371265
3ashgAltha7ka,2017-07-26 23:08,0,0,مروة مساء الخير,"(['Q8'], Location((38.19069715, 15.2734138919, 0.0)))",,,890227219917942784,https://twitter.com/3ashgAltha7ka/status/890227219917942784
marksmytuan,2017-07-26 23:07,0,0,BAT PARANG MAS MALALA PA SA marawi YUNG NANGYAYARI SA TWITTER PAG MAY BAG POPOST NG TEASER PHOTOS,"(['PH \xc2\xa0\xf0\x9f\x87\xb5\xf0\x9f\x87\xad'], Location((12.44249325, 122.160395164, 0.0)))",,,890227042947547136,https://twitter.com/marksmytuan/status/890227042947547136
Hope_Delevingne,2017-07-26 23:05,0,0,Duguan yung isda sumabak sa marawi,,,,890226515459297280,https://twitter.com/Hope_Delevingne/status/890226515459297280
Dantitoy,2017-07-26 23:04,0,3,uhm.. Thanks? charot congrats sa inyo do kamo baya amo bet kay marawi and pusil² and aso² effect,"(['by khalid'], Location((13.8811666, 45.2793848, 0.0)))",,,890226371925917696,https://twitter.com/Dantitoy/status/890226371925917696
Asiablog_it,2017-07-26 23:03,4,2,"Da quasi 2 mesi una parte di Marawi, nelle # Filippine, è sotto il controllo dell'ISIS http://www.ilpost.it/2017/07/25/isis-maraqi-filippine/ …pic.twitter.com/zNXZnOkK5Q","(['Selangor', ' Malaysia'], Location((3.2083304, 101.304146, 0.0)))",,#,890226019310813184,https://twitter.com/Asiablog_it/status/890226019310813184
alaturka,2017-07-26 23:00,0,0,Filipinler'de Marawi emniyet müdürlüğüne İmam Konseyi Başkanı atandı https://www.alaturka.us/filipinlerde-marawi-emniyet-mudurlugune-imam-konseyi-baskani-atandi/ …,"(['Beverly Hills', ' CA'], Location((34.0736204, -118.4003563, 0.0)))",,,890225306379972608,https://twitter.com/alaturka/status/890225306379972608
egdsgn,2017-07-26 22:59,0,0,"P250,000 financial aid, ibinigay sa pamilya ng mga pulis at sundalo na nasawi sa Marawi crisis https://politicsph.pogoport.com/p250000-financial-aid-ibinigay-sa-pamilya-ng-mga-pulis-at-sundalo-na-nasawi-sa-marawi-crisis/ …","(['Davao City', ' Davao Region'], Location((7.22650725, 125.454887691, 0.0)))",,,890225129703305216,https://twitter.com/egdsgn/status/890225129703305216
muzi_kha,2017-07-26 22:59,0,0,"P250,000 financial aid, ibinigay sa pamilya ng mga pulis at sundalo na nasawi sa Marawi crisis https://politicsph.pogoport.com/p250000-financial-aid-ibinigay-sa-pamilya-ng-mga-pulis-at-sundalo-na-nasawi-sa-marawi-crisis/ …","(['The Office'], Location((9.6663813, 80.0122994306, 0.0)))",,,890225124590440448,https://twitter.com/muzi_kha/status/890225124590440448
chris19thws,2017-07-26 22:59,0,0,"P250,000 financial aid, ibinigay sa pamilya ng mga pulis at sundalo na nasawi sa Marawi crisis https://politicsph.pogoport.com/p250000-financial-aid-ibinigay-sa-pamilya-ng-mga-pulis-at-sundalo-na-nasawi-sa-marawi-crisis/ …","(['Philippines'], Location((12.7503486, 122.7312101, 0.0)))",,,890225119309725696,https://twitter.com/chris19thws/status/890225119309725696
PoGo_Port,2017-07-26 22:59,0,0,"P250,000 financial aid, ibinigay sa pamilya ng mga pulis at sundalo na nasawi sa Marawi crisis https://politicsph.pogoport.com/p250000-financial-aid-ibinigay-sa-pamilya-ng-mga-pulis-at-sundalo-na-nasawi-sa-marawi-crisis/ …",,,,890225113878212608,https://twitter.com/PoGo_Port/status/890225113878212608
orga_ogop,2017-07-26 22:59,0,0,"P250,000 financial aid, ibinigay sa pamilya ng mga pulis at sundalo na nasawi sa Marawi crisis https://politicsph.pogoport.com/p250000-financial-aid-ibinigay-sa-pamilya-ng-mga-pulis-at-sundalo-na-nasawi-sa-marawi-crisis/ …",,,,890225107595132930,https://twitter.com/orga_ogop/status/890225107595132930
RTheKrak3n,2017-07-26 22:59,0,0,"P250,000 financial aid, ibinigay sa pamilya ng mga pulis at sundalo na nasawi sa Marawi crisis https://politicsph.pogoport.com/p250000-financial-aid-ibinigay-sa-pamilya-ng-mga-pulis-at-sundalo-na-nasawi-sa-marawi-crisis/ …",,,,890225099416141824,https://twitter.com/RTheKrak3n/status/890225099416141824
daniellefanlo,2017-07-26 22:54,2,11,Mission: Resupply tomorrow at Abreeza 4-9pm! Here are the things you can donate for our troops in Marawi. pic.twitter.com/IBbHt7ipFZ,"(['Meliora'], Location((55.7566761, 37.6327184, 0.0)))",,,890223818756694018,https://twitter.com/daniellefanlo/status/890223818756694018
john_dipaluPig,2017-07-26 22:50,0,0,Those in marawi i guess???based on the press conference of pduts ..,"(['Isulan', 'SK'], Location((6.6340869, 124.5971379, 0.0)))",,,890222721702838274,https://twitter.com/john_dipaluPig/status/890222721702838274
Biebervapes,2017-07-26 22:49,0,1,Yep ikr. Insecure lang yan mga yan. Yan dapat yung mga pinapadala sa marawi eh. Mga walang magawa.,"(['Australia'], Location((-24.7761086, 134.755, 0.0)))",,,890222470623412224,https://twitter.com/Biebervapes/status/890222470623412224
ykhflv,2017-07-26 22:48,0,0,Ptapon ko kayo sa marawi ba. https://twitter.com/flvdaniel/status/890222007308111872 …,,,,890222317527113729,https://twitter.com/ykhflv/status/890222317527113729
pattypasion,2017-07-26 22:45,0,0,Little-known fact: Marawi schools outperform others in ARMM - http://www.rappler.com/thought-leaders/176773-education-spotlight-marawi … via @ rapplerdotcompic.twitter.com/JrVjxyN51D,"(['Philippines'], Location((12.7503486, 122.7312101, 0.0)))",@,,890221516436119552,https://twitter.com/pattypasion/status/890221516436119552
hannaxbanana_,2017-07-26 22:42,1,1,"marikina at manila wala ng pasok! so taga san school natin? marawi? zambales?"" hahaha baliw""","(['korea'], Location((36.5581914, 127.9408564, 0.0)))",,,890220887634464768,https://twitter.com/hannaxbanana_/status/890220887634464768
EusebioMarkie,2017-07-26 22:42,0,1,Oh God have mercy on Marawi.,"(['Republic of the Philippines'], Location((12.7503486, 122.7312101, 0.0)))",,,890220863034859520,https://twitter.com/EusebioMarkie/status/890220863034859520
colleenchuuu,2017-07-26 22:42,0,0,Hi CHRISTIANNE KAYE M?(MARAWI) NADA!! miss u :< @ shanexnada,,@,,890220749188812800,https://twitter.com/colleenchuuu/status/890220749188812800
saageeng,2017-07-26 22:42,0,0,"Give a person a chance to change. Pero if wala pa ding change, pwede ng ipadala sa marawi baka sakaling dun magchange.",,,,890220680968454144,https://twitter.com/saageeng/status/890220680968454144
KylaVenadas,2017-07-26 22:41,0,0,Eto medyo malamig na ganon pa din may gera parin sa marawi,"(['angono rizal'], Location((14.525133, 121.1539805, 0.0)))",,,890220633988059136,https://twitter.com/KylaVenadas/status/890220633988059136
bradford_adkins,2017-07-26 22:40,0,0,Retweeted ABS-CBN News Channel ( @ ANCALERTS): Duterte: Families of fallen Marawi soldiers to receive P1-M each... http://fb.me/8Eba9PK6O,"(['San Francisco', ' CA'], Location((8.444585, 125.951249185, 0.0)))",@,,890220331180347392,https://twitter.com/bradford_adkins/status/890220331180347392
bradford_adkins,2017-07-26 22:40,0,0,Duterte: Families of fallen Marawi soldiers to receive P1-M each from anonymous donor http://fb.me/7Y0MfMgb0,"(['San Francisco', ' CA'], Location((8.444585, 125.951249185, 0.0)))",,,890220281989484545,https://twitter.com/bradford_adkins/status/890220281989484545
johnlouieq,2017-07-26 22:38,0,5,"isa pang chat mo, ipapadala na kita sa marawi",,,,890219880288444416,https://twitter.com/johnlouieq/status/890219880288444416
JalanIslam,2017-07-26 22:37,0,2,Marawi akan Dibangun dengan Skema Keuangan Syariah http://republika.co.id/r/otblra pic.twitter.com/3IJ8n8OpHI,"(['Cianjur', ' Indonesia'], Location((-6.824096, 107.1374006, 0.0)))",,,890219550611918848,https://twitter.com/JalanIslam/status/890219550611918848
AminullahLucman,2017-07-26 22:34,0,0,: If Martial Law is 'The Solution' learning experiences under despotism & ridding in the end would have saved us # Marawi.,"(['Marawi City', ' Philippines'], Location((8.0034938, 124.286626, 0.0)))",,#,890218722157182976,https://twitter.com/AminullahLucman/status/890218722157182976
harveyviajedor,2017-07-26 22:34,0,2,Ready to marawi https://twitter.com/phjoke/status/890105047656394753 …,"(['DAVAO \xc2\xa0\xf0\x9f\x87\xb5\xf0\x9f\x87\xad'], Location((7.0645241, 125.6084143, 0.0)))",,,890218718151688192,https://twitter.com/harveyviajedor/status/890218718151688192
itsme_gairuu,2017-07-26 22:33,0,2,"bat di natuloy concert ni bieber dito?"" ""baka yung sa isis kasi, baka mangyari din tulad nung kay ariana baka din yung sa marawi kaya yun""""",,,,890218608906743808,https://twitter.com/itsme_gairuu/status/890218608906743808
Iam_Mish24,2017-07-26 22:33,0,1,"Nasa Bulacan na si Heneral,bakasyon engrande na nya bago daw madestino ng Marawi","(['Bustos', 'Bulacan'], Location((14.9549111, 120.9181565, 0.0)))",,,890218607887745025,https://twitter.com/Iam_Mish24/status/890218607887745025
CarlBienes,2017-07-26 22:31,0,3,Pag pray natin na may pasok bukas at matigil na ang gera sa marawi.,"(['coast'], Location((57.8155948, -5.6696957, 0.0)))",,,890218073638096896,https://twitter.com/CarlBienes/status/890218073638096896
piggyswinepoel,2017-07-26 22:30,1,2,Du gamo man lang napangita ka mga babayi nga ja. Kadto nalang kamo tu sa marawi,"(['Cali'], Location((3.4319329, -76.5113048, 0.0)))",,,890217851428102144,https://twitter.com/piggyswinepoel/status/890217851428102144
Paulodelapena_9,2017-07-26 22:30,0,0,thankyouuu ng marami flappyburd. Hahahahahaa nasa marawi lang ako. godbless din. https://twitter.com/lysjulianne/status/890216860842508290 …,,,,890217837440020485,https://twitter.com/Paulodelapena_9/status/890217837440020485
rjbermal_,2017-07-26 22:28,0,1,# PrayforMarawi,"(['stage'], Location((40.6120989, -104.7436204, 0.0)))",,#,890217286568525824,https://twitter.com/rjbermal_/status/890217286568525824
_mpanada,2017-07-26 22:28,0,3,Kase ikaw talaga ipapadala namen sa marawi,,,,890217191718633472,https://twitter.com/_mpanada/status/890217191718633472
Darssss08,2017-07-26 22:25,0,1,sige tas papadala ko kayo sa marawi! hahaha,,,,890216493643833345,https://twitter.com/Darssss08/status/890216493643833345
leonalyn03,2017-07-26 22:22,0,0,Naririndi na tlga ako Bess. Huhu.masarap siyamg ibala sa KANYON sa Marawi,"(['Panitan', ' Western Visayas'], Location((11.4265242, 122.778870346, 0.0)))",,,890215802464382976,https://twitter.com/leonalyn03/status/890215802464382976
Chislon_Bolanos,2017-07-26 22:22,1,8,"WHAT: 'Benefit Show for Marawi Soldiers' WHERE: @ SaguijoOfficial WHEN: Aug 4, 2017! Guitar session ulit for VOC :)pic.twitter.com/R7rfWduDHX","(['Republic of the Philippines'], Location((12.7503486, 122.7312101, 0.0)))",@,,890215774538813440,https://twitter.com/Chislon_Bolanos/status/890215774538813440
egdsgn,2017-07-26 22:21,0,0,"24 Oras: Isa sa mga pumuga sa Marawi City Jail, sumuko https://politicsph.pogoport.com/24-oras-isa-sa-mga-pumuga-sa-marawi-city-jail-sumuko/ …","(['Davao City', ' Davao Region'], Location((7.22650725, 125.454887691, 0.0)))",,,890215595165306880,https://twitter.com/egdsgn/status/890215595165306880
muzi_kha,2017-07-26 22:21,0,0,"24 Oras: Isa sa mga pumuga sa Marawi City Jail, sumuko https://politicsph.pogoport.com/24-oras-isa-sa-mga-pumuga-sa-marawi-city-jail-sumuko/ …","(['The Office'], Location((9.6663813, 80.0122994306, 0.0)))",,,890215589901479937,https://twitter.com/muzi_kha/status/890215589901479937
chris19thws,2017-07-26 22:21,0,0,"24 Oras: Isa sa mga pumuga sa Marawi City Jail, sumuko https://politicsph.pogoport.com/24-oras-isa-sa-mga-pumuga-sa-marawi-city-jail-sumuko/ …","(['Philippines'], Location((12.7503486, 122.7312101, 0.0)))",,,890215584553717760,https://twitter.com/chris19thws/status/890215584553717760
PoGo_Port,2017-07-26 22:21,0,0,"24 Oras: Isa sa mga pumuga sa Marawi City Jail, sumuko https://politicsph.pogoport.com/24-oras-isa-sa-mga-pumuga-sa-marawi-city-jail-sumuko/ …",,,,890215578501361664,https://twitter.com/PoGo_Port/status/890215578501361664
orga_ogop,2017-07-26 22:21,0,0,"24 Oras: Isa sa mga pumuga sa Marawi City Jail, sumuko https://politicsph.pogoport.com/24-oras-isa-sa-mga-pumuga-sa-marawi-city-jail-sumuko/ …",,,,890215572289593348,https://twitter.com/orga_ogop/status/890215572289593348
RTheKrak3n,2017-07-26 22:21,0,0,"24 Oras: Isa sa mga pumuga sa Marawi City Jail, sumuko https://politicsph.pogoport.com/24-oras-isa-sa-mga-pumuga-sa-marawi-city-jail-sumuko/ …",,,,890215563963904000,https://twitter.com/RTheKrak3n/status/890215563963904000
Philreport,2017-07-26 22:21,0,0,Dureza holds dialogue with Marawi evacuees Evacuees of strife-torn Marawi City on Wednesday had a dialogue with... http://fb.me/8LBXkkQHa,,,,890215505054674944,https://twitter.com/Philreport/status/890215505054674944
EDZabarte,2017-07-26 22:17,0,0,"Do not regret growing older It is a privilege denied to many,To the Fallen of Marawi,(Taps).Salute,Journey well Heroes.","(['Philippines'], Location((12.7503486, 122.7312101, 0.0)))",,,890214561554382848,https://twitter.com/EDZabarte/status/890214561554382848
neilgibsonp,2017-07-26 22:17,0,0,# PrayForMarawi,"(['Cebu City', ' Central Visayas'], Location((10.3090298, 123.8930839, 0.0)))",,#,890214448375320577,https://twitter.com/neilgibsonp/status/890214448375320577
astrero_anna,2017-07-26 22:12,0,0,"parang nasa marawi pag binuksan ang gc namin jusko ang ingay na nga, sabog pa HAHAHAHAHA gg kay oca eh.",,,,890213284980195329,https://twitter.com/astrero_anna/status/890213284980195329
LewisFeranil,2017-07-26 22:12,0,0,may tumalo na sa marawi ni joric HAHAHAHAHAHAHA https://twitter.com/itscarlitos1/status/890200973435482112 …,,,,890213233553948678,https://twitter.com/LewisFeranil/status/890213233553948678
sufimaki,2017-07-26 22:12,0,0,How much budget is now spent for Marawi war? Military budget how true drained na?,"(['Quezon City'], Location((14.6509905, 121.0486155, 0.0)))",,,890213118869028865,https://twitter.com/sufimaki/status/890213118869028865
utog69,2017-07-26 22:09,0,0,@ Matt_VanDyke perhaps you've heard ISIS encroaching into the southern Philippines where military is in heavy fighting them in Marawi city,,@,,890212443040866306,https://twitter.com/utog69/status/890212443040866306
EdgeDavao,2017-07-26 22:08,0,0,DND: Marawi war stems from failure to value intel What happened in Marawi City was not a failure of intelligence … http://ift.tt/2tDmaeU,"(['Davao City', ' Philippines'], Location((7.22650725, 125.454887691, 0.0)))",,,890212285968506880,https://twitter.com/EdgeDavao/status/890212285968506880
Lainetek,2017-07-26 22:06,0,0,nyahahaha ang etuc nan! Musta marawi web$?,,,,890211800033120256,https://twitter.com/Lainetek/status/890211800033120256
francisjanx44,2017-07-26 22:06,0,1,"Lumipat ka ng marawi"" Mali kasi spelling ng joric nyo HAHAHAH pic.twitter.com/Em5Wo8DwYw""",,,,890211622546948096,https://twitter.com/francisjanx44/status/890211622546948096
williamumali1,2017-07-26 22:05,0,1,TARA SA MARAWI!!!,"(['Olongapo City', ' Central Luzon'], Location((14.8314675, 120.2835205, 0.0)))",,,890211539738796032,https://twitter.com/williamumali1/status/890211539738796032
damnitswebs,2017-07-26 22:05,0,1,Busy pa sa pagsakop sa marawi laine,"(['kili kili'], Location((43.1857625, -2.4662981, 0.0)))",,,890211365075296258,https://twitter.com/damnitswebs/status/890211365075296258
manilabulletin,2017-07-26 22:03,0,1,AFP spox B/Gen. Restituto Padilla says there is no stoppage of military operations in war-torn Marawi City. | @ MBFTWakefield,"(['Manila', ' Philippines'], Location((14.5906216, 120.9799696, 0.0)))",@,,890210923985620992,https://twitter.com/manilabulletin/status/890210923985620992
khalashnikov98,2017-07-26 22:02,0,2,"Agama diperalat utk membunuh sesama. Marawi, kini jadi kota terkutuk krn KEBODOHAN warganya sendiri mendukung ISIS. https://twitter.com/temponewsroom/status/869057866782707712 …","(['Jakarta'], Location((-6.1753942, 106.827183, 0.0)))",,,890210757278785536,https://twitter.com/khalashnikov98/status/890210757278785536
disasters_ph,2017-07-26 22:02,0,0,Zamboanga sends medical team to Marawi City | SunStar - http://Sun.Star http://bit.ly/2uYIbbJ,,,,890210666803580928,https://twitter.com/disasters_ph/status/890210666803580928
mlhdjjml,2017-07-26 22:00,0,0,Aw. E sanay naman kayo jan e. Di nga dn plagidn sa marawi ka salakaw dn a marawi gaw hahaha,"(['Republic of the Philippines'], Location((12.7503486, 122.7312101, 0.0)))",,,890210258659848192,https://twitter.com/mlhdjjml/status/890210258659848192
PhilippineStar,2017-07-26 22:00,0,3,Slain Marawi soldiers’ families get P1.25 M each http://bit.ly/2eLYrXu pic.twitter.com/fX8B7G30DA,"(['Philippines'], Location((12.7503486, 122.7312101, 0.0)))",,,890210109158064128,https://twitter.com/PhilippineStar/status/890210109158064128
bworldph,2017-07-26 22:00,2,0,Duterte says order against attacking mosque delaying Marawi City’s liberation | via @ ipcigaral http://bit.ly/marawiDu30 pic.twitter.com/oSrpeywVyL,"(['Philippines'], Location((12.7503486, 122.7312101, 0.0)))",@,,890210104825585664,https://twitter.com/bworldph/status/890210104825585664
interaksyon,2017-07-26 22:00,0,0,Duterte says order against attacking mosque delaying Marawi City’s liberation | via @ ipcigaral http://bit.ly/marawiDu30 pic.twitter.com/jfaT4kqoi2,"(['Philippines'], Location((12.7503486, 122.7312101, 0.0)))",@,,890210103319769095,https://twitter.com/interaksyon/status/890210103319769095
MBFTWakefield,2017-07-26 21:59,0,0,@ manila_bulletin AFP spox B/Gen. Restituto Padilla says there is no stoppage of military operations in war-torn Marawi City.,"(['Manila'], Location((14.5906216, 120.9799696, 0.0)))",@,,890210051582967809,https://twitter.com/MBFTWakefield/status/890210051582967809
sunnynoorfatmah,2017-07-26 21:59,0,0,Mapea dn. Nga nga dn mambo. Lagid kami dn mambo o sisa Marawi,,,,890209907026219009,https://twitter.com/sunnynoorfatmah/status/890209907026219009
khalashnikov98,2017-07-26 21:59,29,30,"Bila Anda BUKAN simpatisan ISIS, Anda hrs bersuara menentang radikalisme. Mosul, Raqqa dan Marawi, kini seperti mimpi buruk bagi rakyatnya.","(['Jakarta'], Location((-6.1753942, 106.827183, 0.0)))",,,890209884997799936,https://twitter.com/khalashnikov98/status/890209884997799936
