AdammNurwahid,2017-07-26 15:08,0,0,"Di Bangunan-bangunan di Marawi, Teroris Maute Tinggalkan Bom IED http://nasionalisme.net/di-bangunan-bangunan-di-marawi-teroris-maute-tinggalkan-bom-ied/28865/ …pic.twitter.com/XpTYrjBkhR","(['Central Java', ' Indonesia'], Location((-6.9806312, 110.412646801, 0.0)))",,,890106564698398720,https://twitter.com/AdammNurwahid/status/890106564698398720
AchmadAdya7,2017-07-26 15:08,0,0,"Di Bangunan-bangunan di Marawi, Teroris Maute Tinggalkan Bom IED http://nasionalisme.net/di-bangunan-bangunan-di-marawi-teroris-maute-tinggalkan-bom-ied/28865/ …pic.twitter.com/vXqjGMVqUo","(['Jakarta Capital Region'], Location((-6.1753942, 106.827183, 0.0)))",,,890106541138993153,https://twitter.com/AchmadAdya7/status/890106541138993153
AbyanNanda77,2017-07-26 15:08,0,0,"Di Bangunan-bangunan di Marawi, Teroris Maute Tinggalkan Bom IED http://nasionalisme.net/di-bangunan-bangunan-di-marawi-teroris-maute-tinggalkan-bom-ied/28865/ …pic.twitter.com/wr46hTOrkN","(['Kota Manado', ' Sulawesi Utara'], Location((1.3094931, 124.8273339, 0.0)))",,,890106520280739844,https://twitter.com/AbyanNanda77/status/890106520280739844
AbrahamReynand9,2017-07-26 15:08,0,0,"Di Bangunan-bangunan di Marawi, Teroris Maute Tinggalkan Bom IED http://nasionalisme.net/di-bangunan-bangunan-di-marawi-teroris-maute-tinggalkan-bom-ied/28865/ …pic.twitter.com/nio52anzA9","(['samarinda'], Location((-0.5017804, 117.1393089, 0.0)))",,,890106496511598596,https://twitter.com/AbrahamReynand9/status/890106496511598596
peacegovph,2017-07-26 15:08,1,5,Peace Sec. Jesus Dureza assured the Marawi residents currently staying in Iligan that the government will help heal the wounds of conflict. https://twitter.com/PTVph/status/890052912105234433 …,"(['Philippines'], Location((12.7503486, 122.7312101, 0.0)))",,,890106464823586816,https://twitter.com/peacegovph/status/890106464823586816
TweettGua,2017-07-26 15:08,0,0,"Di Bangunan-bangunan di Marawi, Teroris Maute Tinggalkan Bom IED http://nasionalisme.net/di-bangunan-bangunan-di-marawi-teroris-maute-tinggalkan-bom-ied/28865/ …pic.twitter.com/pfF0ostIQq","(['Jakarta'], Location((-6.1753942, 106.827183, 0.0)))",,,890106436532961280,https://twitter.com/TweettGua/status/890106436532961280
InformaAlMinuto,2017-07-26 15:06,1,0,ULTIMAS HORAS: # Filipinas Enfrentamiento entre militares y terroristas en # Marawi deja al menos 16 soldados del ejército muertos. pic.twitter.com/Q5ENvghkyl,"(['CHILE'], Location((-31.7613365, -71.3187697, 0.0)))",,# #,890105986853330944,https://twitter.com/InformaAlMinuto/status/890105986853330944
Sang_Ibon,2017-07-26 15:04,0,0,US threatened by ISIS That they help in Marawi is only incidental Same in WPS Assistance limited to their interest re freedom of navigation,,,,890105509138792448,https://twitter.com/Sang_Ibon/status/890105509138792448
pnp_rceo8,2017-07-26 15:02,0,2,"RCEO8, Pers initiated to donate 3 Boxes of Noodles and used clothing for the displaced People of Marawi and was handed to PSI CONEJO,PRO8. pic.twitter.com/CKtOG1L8WR","(['camp kangleon', ' palo', ' leyte'], Location((11.18489045, 124.989852246, 0.0)))",,,890105092321550336,https://twitter.com/pnp_rceo8/status/890105092321550336
pinoynewsonline,2017-07-26 15:02,0,0,"SONA: Pres. Duterte, nag-alok ng ceasefire sa NPA habang abala sa pagsugpo ng problema sa Marawi More on... http://fb.me/If5ARNny","(['Republic of the Philippines'], Location((12.7503486, 122.7312101, 0.0)))",,,890105081819000832,https://twitter.com/pinoynewsonline/status/890105081819000832
EagleNewsPH,2017-07-26 15:01,1,0,At least 200 civilians caught up in war in Marawi - http://bit.ly/2uXXmlw pic.twitter.com/6fFlRd2thN,"(['Quezon City', 'Philippines'], Location((14.6509905, 121.0486155, 0.0)))",,,890104842311565313,https://twitter.com/EagleNewsPH/status/890104842311565313
PIA_RIII,2017-07-26 15:01,0,1,"HAPPENING NOW: Bulacan Day of Prayer Peace for the Philippines"" and ceremonial turn over of donations for # Marawi City pic.twitter.com/vSO2r7bZaS""","(['Hyatt Garden Building', ' Dolores', ' City of San Fernando', ' Pampanga'], Location((33.7616238, -84.3866370084, 0.0)))",,#,890104811412238337,https://twitter.com/PIA_RIII/status/890104811412238337
rapplerdotcom,2017-07-26 15:01,1,10,"LIVE: HUDCC's Del Rosario on Marawi rehab, housing backlog, Kadamay. # RapplerTalk:http://s.rplr.co/0O0Ww7T","(['Philippines'], Location((12.7503486, 122.7312101, 0.0)))",,#,890104743590342656,https://twitter.com/rapplerdotcom/status/890104743590342656
DefenceNews_SDI,2017-07-26 15:00,0,0,Duterte pays visit to troops in Marawi City http://www.gulf-times.com/story/557364/Duterte-pays-visit-to-troops-in-Marawi-City … # DefenceIntelligence,"(['London', ' UK'], Location((51.5073219, -0.1276474, 0.0)))",,#,890104526425948162,https://twitter.com/DefenceNews_SDI/status/890104526425948162
LyssaReyes_,2017-07-26 15:00,1,0,corny naman neto padala kita sa marawi eh,,,,890104460692905991,https://twitter.com/LyssaReyes_/status/890104460692905991
MOAArena,2017-07-26 15:00,22,39,"Lyca Gairanod is now grown up and will join Rebuilding Life in Marawi"" on August 10! Buy your tickets today at http://bit.ly/MarawiTWORG .pic.twitter.com/YaL94gPLY0""",,,,890104404023619590,https://twitter.com/MOAArena/status/890104404023619590
PIA_RIII,2017-07-26 14:58,0,0,"HAPPENING NOW: Bulacan Day of Prayer Peace for the Philippines"" and ceremonial turn over of donations for Marawi... http://fb.me/yRbtFI1f""","(['Hyatt Garden Building', ' Dolores', ' City of San Fernando', ' Pampanga'], Location((33.7616238, -84.3866370084, 0.0)))",,,890104011432525825,https://twitter.com/PIA_RIII/status/890104011432525825
cmogpa,2017-07-26 14:56,0,0,"PROVINCIAL CAPITOL, Marawi City – Displaced Marawi residents housed in Saguiaran and Balo-i evacuation centers,... http://fb.me/5M2hFwCyv","(['Philippines'], Location((12.7503486, 122.7312101, 0.0)))",,,890103530601762818,https://twitter.com/cmogpa/status/890103530601762818
Ocean023,2017-07-26 14:54,1,0,Hnd ko tlga makuha ang points ng mga rallyista!!! Ung ingay lang kaya nila gawin sa bansa... lang ya punta kau sa marawi! # Dutertesona2017,"(['Sydney', ' New South Wales'], Location((-33.8548157, 151.2164539, 0.0)))",,#,890103108638060546,https://twitter.com/Ocean023/status/890103108638060546
juan_cruz_2014,2017-07-26 14:53,1,1,"Ung nagkakamatay na ang mga kasamahan mo sa labanan sa Marawi, pero may nambababoy pa rin pic.twitter.com/O3bUcb2DC7",,,,890102827628081152,https://twitter.com/juan_cruz_2014/status/890102827628081152
rapplerdotcom,2017-07-26 14:53,7,9,Towns near Marawi are also affected by the clashes. The provincial govt sent out relief goods today. pic.twitter.com/1xYWBQp2EC,"(['Philippines'], Location((12.7503486, 122.7312101, 0.0)))",,,890102757776084992,https://twitter.com/rapplerdotcom/status/890102757776084992
MaskReader,2017-07-26 14:53,0,0,Marawi city : 15 Sibilyan Buwis-buhay na tumakas mula sa giyera.: http://youtu.be/o4IyAAS-ZvY?a  via @ YouTube,"(['Philippines'], Location((12.7503486, 122.7312101, 0.0)))",@,,890102742714380288,https://twitter.com/MaskReader/status/890102742714380288
rilwebnews,2017-07-26 14:52,0,0,Menlu: Kasus Marawi Adalah Wake-up Call Kita - https://news.rilweb.com/nasional/menlu-kasus-marawi-adalah-wake-up-call-kita/ …pic.twitter.com/RUA8kcXoCI,"(['Indonesia'], Location((-4.7993356, 114.5632032, 0.0)))",,,890102548442607622,https://twitter.com/rilwebnews/status/890102548442607622
joeyblatagan,2017-07-26 14:50,0,0,Marawi crisis was a lesson for us – Lorenzana http://fb.me/1dzJZpPrC,"(['Dubai'], Location((2.9470179, 30.961206, 0.0)))",,,890102128626323456,https://twitter.com/joeyblatagan/status/890102128626323456
valdeerei,2017-07-26 14:50,0,0,"TRUE! LAHAT NALANG GINAWAN NG EXCUSE! WHEN PPL FROM MARAWI SPEAK UP ABT IMPLEMENTING ML ON THE WHOLE OF MINDANAO, YOU DO NOT SPEAK FOR...""",,,,890102113350635520,https://twitter.com/valdeerei/status/890102113350635520
reymansy,2017-07-26 14:49,0,3,"Kung good girl kayo, good rin kami. Kung bad kayo, rerape-in namin kayo."" -a soldier told an evacuee in Marawi""","(['Dumaguete City', ' Central Visayas'], Location((9.3054777, 123.3080446, 0.0)))",,,890101835742277632,https://twitter.com/reymansy/status/890101835742277632
marawi_q8,2017-07-26 14:49,1,0,وين اختفيت انت يومين عسي ايامك كانت بسلام,,,,890101799763554304,https://twitter.com/marawi_q8/status/890101799763554304
carmelafonbuena,2017-07-26 14:49,0,0,Towns near Marawi are also affected by the clashes. The provincial govt sent out relief goods today @ rapplerdotcompic.twitter.com/5iBpwlF6GC,"(['Manila', ' Philippines'], Location((14.5906216, 120.9799696, 0.0)))",@,,890101673678471168,https://twitter.com/carmelafonbuena/status/890101673678471168
sonorasurabaya,2017-07-26 14:49,0,0,13:52 # BeritaSonora - Teroris Maute Tinggalkan Bom IED di Bangunan-bangunan di Marawi. Sumber @ kompascom. http://internasional.kompas.com/read/2017/07/26/11162051/teroris-maute-tinggalkan-bom-ied-di-bangunan-bangunan-di-marawi … (Cla20),,@,#,890101634105315334,https://twitter.com/sonorasurabaya/status/890101634105315334
GaUsahMunafik,2017-07-26 14:48,0,0,"Segera terjunkan TNI gabung dgn Tentara Philipina musnakan ISIS di Marawi. Jangan terlalu anggap remeh, ujung2nya ga bisa beresin stlh besar",,,,890101625511084032,https://twitter.com/GaUsahMunafik/status/890101625511084032
ahwakw,2017-07-26 14:48,1,1,بخير الله يجمل حالج,"(['\xd8\xaf\xd9\x88\xd9\x84\xd8\xa9 \xd8\xa7\xd9\x84\xd9\x83\xd9\x88\xd9\x8a\xd8\xaa'], Location((29.2733964, 47.4979476, 0.0)))",,,890101548642160640,https://twitter.com/ahwakw/status/890101548642160640
marjostani,2017-07-26 14:45,0,0,Presenting a very serious deck on Marawi bless me,,,,890100675698470914,https://twitter.com/marjostani/status/890100675698470914
marawi_q8,2017-07-26 14:44,1,0,ياهلا فيك اشحالك,,,,890100601559932928,https://twitter.com/marawi_q8/status/890100601559932928
ahwakw,2017-07-26 14:44,1,1,اطلق صباح في ذمتي تشتاقلج العافيه,"(['\xd8\xaf\xd9\x88\xd9\x84\xd8\xa9 \xd8\xa7\xd9\x84\xd9\x83\xd9\x88\xd9\x8a\xd8\xaa'], Location((29.2733964, 47.4979476, 0.0)))",,,890100444927860739,https://twitter.com/ahwakw/status/890100444927860739
News5AKSYON,2017-07-26 14:43,4,11,"Binigyan ng P250,000 tulong pinansyal ang bawat pamilya ng namatay na mga pulis at sundalo sa Marawi. http://news.tv5.com.ph/aksyonsatanghali/watch/sNyZBcfKixg/pamilya%20ng%20mga%20namatay%20na%20sundalo%20at%20pulis,%20nakatanggap%20ng%20tulong%20pinansyal …","(['Philippines'], Location((12.7503486, 122.7312101, 0.0)))",,,890100364762075137,https://twitter.com/News5AKSYON/status/890100364762075137
rezka_ahmed,2017-07-26 14:42,0,0,منوره يالغاليه,,,,890099992442134528,https://twitter.com/rezka_ahmed/status/890099992442134528
hasan_alqarni11,2017-07-26 14:41,0,0,اللهم أمين,"(['\xd8\xac\xd8\xaf\xd8\xa9', ' \xd8\xa7\xd9\x84\xd9\x85\xd9\x85\xd9\x84\xd9\x83\xd8\xa9 \xd8\xa7\xd9\x84\xd8\xb9\xd8\xb1\xd8\xa8\xd9\x8a\xd8\xa9 \xd8\xa7\xd9\x84\xd8\xb3\xd8\xb9\xd9\x88\xd8\xaf\xd9\x8a\xd8\xa9'], Location((21.5822247, 39.1640396, 0.0)))",,,890099621741162497,https://twitter.com/hasan_alqarni11/status/890099621741162497
solibeau,2017-07-26 14:39,0,0,As to compare to helping Marawi by volunteering to give relief goods and money. You get?,,,,890099120848994309,https://twitter.com/solibeau/status/890099120848994309
pcrcabuyaocps,2017-07-26 14:38,0,0,"The Cabuyao CPS and Rotary Club of Cabuyao with Philippine Red Cross conducted bloodletting project entitled “Dugong Bayani,Para sa Marawi” pic.twitter.com/5olvCxwkHv",,,,890099016821874688,https://twitter.com/pcrcabuyaocps/status/890099016821874688
NewsRmn,2017-07-26 14:38,0,0,"Operasyon ng militar sa Marawi, hindi ipinatigil ng Pangulo https://rmn.ph/operasyon-ng-militar-sa-marawi-hindi-ipinatigil-ng-pangulo/ … via @ rmnnetworks","(['Republic of the Philippines'], Location((12.7503486, 122.7312101, 0.0)))",@,,890098876610433029,https://twitter.com/NewsRmn/status/890098876610433029
marawi_q8,2017-07-26 14:36,0,0,هلا فيك,,,,890098435592003587,https://twitter.com/marawi_q8/status/890098435592003587
rezka_ahmed,2017-07-26 14:35,0,0,صباح المزاج الراقي,,,,890098270999117824,https://twitter.com/rezka_ahmed/status/890098270999117824
solibeau,2017-07-26 14:34,0,1,Do they live in Marawi? Maybe they say that cause they're not evacuated in some gym and their city isnt being bombed :(,,,,890098000256790528,https://twitter.com/solibeau/status/890098000256790528
sycipft,2017-07-26 14:33,0,0,Duterte: War in Marawi to go on until last terrorist is killed @ PhilstarNewshttps://shar.es/1T4tTC,,@,,890097828927868928,https://twitter.com/sycipft/status/890097828927868928
wikisabah,2017-07-26 14:32,0,0,WikiSabah: Businessmen give aid to families of slain Marawi t... http://wikisabah.blogspot.com/2017/07/businessmen-give-aid-to-families-of.html?spref=tw …,"(['Sabah'], Location((5.595237, 117.0051734, 0.0)))",,,890097586199199746,https://twitter.com/wikisabah/status/890097586199199746
saaaaad5231212,2017-07-26 14:32,0,0,نتشرف فيك وبـ متابعتك,,,,890097508160024576,https://twitter.com/saaaaad5231212/status/890097508160024576
9DashLine,2017-07-26 14:32,7,1,"# Marawi standoff enters third month, underlining crisis in Philippines http://reut.rs/2uq0kga # ISIS",,,# #,890097372549832706,https://twitter.com/9DashLine/status/890097372549832706
marawi_q8,2017-07-26 14:30,1,0,تسلم لي والله الغالي ما تقصر,,,,890096861029306368,https://twitter.com/marawi_q8/status/890096861029306368
saaaaad5231212,2017-07-26 14:29,1,2,@ marawi_q8 تشبه السمآء في علو مستواهارائعة الأخلآق مبارگ لڱ مروهـ بعدد ماعا نقت قطرآت الندى بتلآت الوردهنئالـك # 5k_محبpic.twitter.com/RRuWn0jIOE,,@,#,890096761657860097,https://twitter.com/saaaaad5231212/status/890096761657860097
na1402f,2017-07-26 14:29,0,1,ياهلا وغلا,"(['\xd8\xa7\xd9\x84\xd8\xaf\xd9\x85\xd8\xa7\xd9\x85', ' \xd8\xa7\xd9\x84\xd9\x85\xd9\x85\xd9\x84\xd9\x83\xd8\xa9 \xd8\xa7\xd9\x84\xd8\xb9\xd8\xb1\xd8\xa8\xd9\x8a\xd8\xa9 \xd8\xa7\xd9\x84\xd8\xb3\xd8\xb9\xd9\x88\xd8\xaf'], Location((26.4367824, 50.1039991, 0.0)))",,,890096641100980226,https://twitter.com/na1402f/status/890096641100980226
dzmmRP45,2017-07-26 14:28,0,0,PANOORIN: Update ng Malakanyang sa nagpapatuloy na bakbakan sa Marawi City @ DZMMTeleRadyopic.twitter.com/X8I0QSD0DE,"(['Philippines'], Location((12.7503486, 122.7312101, 0.0)))",@,,890096570296926208,https://twitter.com/dzmmRP45/status/890096570296926208
gwapito,2017-07-26 14:28,0,0,"By Genalyn Kabiling Despite facing security risks, President Duterte is mulling another visit to Marawi City... http://fb.me/99M08Q8Nd",,,,890096568497565696,https://twitter.com/gwapito/status/890096568497565696
eac_bonj,2017-07-26 14:28,0,0,"Punta muna kayo sa mindanao, specially sa Marawi bago magprotesta. Ang nakikita nyo din sa news ay kulang pa.",,,,890096430257504256,https://twitter.com/eac_bonj/status/890096430257504256
rshdsgm,2017-07-26 14:28,0,1,marawi g na,"(['Caloocan City'], Location((14.6815301, 121.0089111, 0.0)))",,,890096362855038977,https://twitter.com/rshdsgm/status/890096362855038977
BoobsAndBeyond,2017-07-26 14:27,0,2,"At the moment, the Scout Rangers we have interviewed in Marawi City, some of them who are lucky enough to have... http://fb.me/1oJ8dmvjU",,,,890096337932492800,https://twitter.com/BoobsAndBeyond/status/890096337932492800
senatePH,2017-07-26 14:26,0,1,Legarda Seeks Senate Inquiry into Marawi Rehab http://fb.me/1iZ6xjBhi,"(['Pasay City', ' Philippines'], Location((14.5437592, 120.9954657, 0.0)))",,,890095921652006912,https://twitter.com/senatePH/status/890095921652006912
bloombergtvph,2017-07-26 14:26,0,0,Malaysian media reports the country's Defence Minister has committed providing water purification equipment and medical assistance to Marawi,"(['Republic of the Philippines'], Location((12.7503486, 122.7312101, 0.0)))",,,890095888626003968,https://twitter.com/bloombergtvph/status/890095888626003968
marawi_q8,2017-07-26 14:25,1,0,صباح الورد انه شتقت لك الغالي,,,,890095728076488704,https://twitter.com/marawi_q8/status/890095728076488704
marawi_q8,2017-07-26 14:24,1,0,صباح النور,,,,890095425562312705,https://twitter.com/marawi_q8/status/890095425562312705
saaaaad5231212,2017-07-26 14:24,2,2,ياصباح الخير وهبات آلنسيم ويآصباح آلنور ونقول السلام آلسعادة رزق وآلمعطي كريم آسعدآلله قلب من رد السلام,,,,890095343798538240,https://twitter.com/saaaaad5231212/status/890095343798538240
brigadanational,2017-07-26 14:23,0,0,"Ilang lugar sa Marawi City, nabawi na ng gov't troops Read more: https://www.brigadanews.ph/article/national/Ilang-lugar-sa-Marawi-City%2C-nabawi-na-ng-gov%27t-troops …pic.twitter.com/IylkfAnwui","(['Makati', ' PH'], Location((14.55459465, 121.021407905, 0.0)))",,,890095250827554816,https://twitter.com/brigadanational/status/890095250827554816
marawi_q8,2017-07-26 14:22,10,9,سلاماً للصباح .. وللحياه ولكل شئ مزهر وللتفاصيل التي ارشفهامن فنجان قهوتي بوجود أحبتي ،..pic.twitter.com/fz4IkaV9ev,,,,890095005347586048,https://twitter.com/marawi_q8/status/890095005347586048
viasogorg,2017-07-26 14:22,0,0,melang: di katext karon no me: way signal gani kim: gyera siguro sa marawi hahahahahahahahahahaha unsay connect oy,,,,890094989442768896,https://twitter.com/viasogorg/status/890094989442768896
cmogpa,2017-07-26 14:22,0,0,"PROVINCIAL CAPITOL, Marawi City – Soldiers of the Joint Task Group Tabang (JTG Tabang) treated the... http://fb.me/193kRm6dW","(['Philippines'], Location((12.7503486, 122.7312101, 0.0)))",,,890094965497495553,https://twitter.com/cmogpa/status/890094965497495553
biebersconcepts,2017-07-26 14:21,0,0,Since this project is not only for Justin but also for CJ and Marawi victims. @ BieberBuyoutPH are u guys up for this?,"(['winterfell'], Location((51.5455107, 13.9594132, 0.0)))",@,,890094685531897865,https://twitter.com/biebersconcepts/status/890094685531897865
marawi_q8,2017-07-26 14:21,5,13,"@ Sahoma_q8  هات حسك واضوي لي صباحي ،، عاف قلبي عتمة البارح بدونك . # صباح الحب""",,@,#,890094667093741569,https://twitter.com/marawi_q8/status/890094667093741569
TheGUIDON,2017-07-26 14:20,1,2,ICYMI: @ DaveGuilas of Students for Liberty Philippines believes the gov't should think long-term when developing a better Marawi. # SONA2017pic.twitter.com/OIi0YXYU1Z,"(['Loyola Heights', ' Quezon City'], Location((14.6404857, 121.0745584, 0.0)))",@,#,890094386373177344,https://twitter.com/TheGUIDON/status/890094386373177344
hanoovah,2017-07-26 14:19,0,0,هههههههههههه لا ارد ليش مارد بس كنت مشغوله شوي,,,,890094174149775361,https://twitter.com/hanoovah/status/890094174149775361
sipsipbloom,2017-07-26 14:18,0,1,Haaaha ayaw ng mag salita baka itapon sa # Marawi https://twitter.com/galangir/status/890030626908160004 …,,,#,890094069405364224,https://twitter.com/sipsipbloom/status/890094069405364224
kootjunhoe,2017-07-26 14:17,0,0,"Menlu: Gejolak di Marawi Tidak Sekadar Cerita, Harus Direspons http://kom.ps/AFxuog",,,,890093684204728321,https://twitter.com/kootjunhoe/status/890093684204728321
minosgon,2017-07-26 14:17,0,0,"Menlu: Gejolak di Marawi Tidak Sekadar Cerita, Harus Direspons http://kom.ps/AFxuog","(['NSA'], Location((39.10871595, -76.7711555253, 0.0)))",,,890093636091772928,https://twitter.com/minosgon/status/890093636091772928
soter_m,2017-07-26 14:15,0,0,"Menlu: Gejolak di Marawi Tidak Sekadar Cerita, Harus Direspons http://kom.ps/AFxuog",,,,890093204544028675,https://twitter.com/soter_m/status/890093204544028675
hanoovah,2017-07-26 14:14,0,0,هلافيك هيوف منوره,,,,890092931033575424,https://twitter.com/hanoovah/status/890092931033575424
kompascom,2017-07-26 14:14,1,2,"Menlu: Gejolak di Marawi Tidak Sekadar Cerita, Harus Direspons http://kom.ps/AFxuog","(['Indonesia'], Location((-4.7993356, 114.5632032, 0.0)))",,,890092829623582722,https://twitter.com/kompascom/status/890092829623582722
EJMantillo,2017-07-26 14:11,0,0,# TopNews Bomb found in clearing ops in Marawi - GMA News https://goo.gl/iP5oTu,"(['Philippines'], Location((12.7503486, 122.7312101, 0.0)))",,#,890092103497338880,https://twitter.com/EJMantillo/status/890092103497338880
Urit4,2017-07-26 14:10,0,0,Filipinas después de Marawi http://www.rebelion.org/noticia.php?id=229558 …,"(['United States'], Location((39.7837304, -100.4458825, 0.0)))",,,890091999709335561,https://twitter.com/Urit4/status/890091999709335561
rmnnetworks,2017-07-26 14:10,0,0,"# LATESTNEWS Operasyon ng militar sa Marawi, hindi ipinatigil ng Pangulo http://fb.me/2VVVYbRYO",,,#,890091876849782784,https://twitter.com/rmnnetworks/status/890091876849782784
miguelecas,2017-07-26 14:09,0,0,Filipinas después de Marawi http://dlvr.it/PYYmr9,"(['Ccs', ' Venezuela'], Location((48.26527155, 7.44576151958, 0.0)))",,,890091589967773696,https://twitter.com/miguelecas/status/890091589967773696
solibeau,2017-07-26 14:09,0,2,Can you ask them why the students from the school in Marawi is rallying against ML? Would be interesting to hear from both sides.,,,,890091580467666944,https://twitter.com/solibeau/status/890091580467666944
yamgishi,2017-07-26 14:07,4,4,'JOMA SISON PAKAMATAY KA NA LANG' - DUTERTE at Go Negosyo for Marawi Cit... # WeSupportPRRDMartialLawNationWide https://www.youtube.com/watch?v=hWiD_LyKEf8&feature=share …,,,#,890091272135999489,https://twitter.com/yamgishi/status/890091272135999489
Macalelonmps34a,2017-07-26 14:05,0,2,"7/26/2017-12:00nn Macalelon PNP offered prayer led by PSI JUN G BALILO,COP for peace in our country especially to the people in Marawi City pic.twitter.com/kPIfVMuzpq",,,,890090587894034432,https://twitter.com/Macalelonmps34a/status/890090587894034432
dzrhdagupan,2017-07-26 14:04,0,0,Prez Duterte orders military operations suspension in Marawi http://dzrhnews.com.ph/prez-duterte-orders-military-operations-suspension-marawi/ …,,,,890090351993782276,https://twitter.com/dzrhdagupan/status/890090351993782276
ronna_ce,2017-07-26 14:01,0,0,"When ppl in Luzon speak up Bakit taga Marawi ba kayo?!"" When ppl from Marawi speak up ""DILAWAN! BAYARAN!""""",,,,890089704095449088,https://twitter.com/ronna_ce/status/890089704095449088
dzrhlaoag,2017-07-26 14:01,0,0,Prez Duterte orders military operations suspension in Marawi http://dzrhnews.com.ph/prez-duterte-orders-military-operations-suspension-marawi/ …,,,,890089609094467584,https://twitter.com/dzrhlaoag/status/890089609094467584
CebuInfocen,2017-07-26 14:00,1,1,"READ: Elementary and high school students turned over 3,000 pieces of personal messages to soldiers in # Marawi City. http://bit.ly/2uXAZ0i https://twitter.com/themindanaohour/status/890010916908974080 …","(['Gorordo Ave.', ' Cebu City'], Location((10.3118269, 123.9034544, 0.0)))",,#,890089298376241152,https://twitter.com/CebuInfocen/status/890089298376241152
Brent_Michael_,2017-07-26 13:59,0,0,# peace for marawi,"(['Caloocan City'], Location((14.6815301, 121.0089111, 0.0)))",,#,890089162904416256,https://twitter.com/Brent_Michael_/status/890089162904416256
jomaligmps,2017-07-26 13:55,0,2,"July 26, 2017/12:00 PM, Jomalig PNP conducted 12 nn habit prayer for peace as our communal prayer for our country especially in Marawi City. pic.twitter.com/21Dhc3LsEt","(['Jomalig', ' Calabarzon'], Location((14.6960971, 122.3285413, 0.0)))",,,890088234943995906,https://twitter.com/jomaligmps/status/890088234943995906
IuUTsMV7JjqH52x,2017-07-26 13:53,0,0,والله وضعي المسكين,"(['Kingdom of Saudi Arabia'], Location((-6.8638235, 39.2551949, 0.0)))",,,890087658587815938,https://twitter.com/IuUTsMV7JjqH52x/status/890087658587815938
bernardo_sundal,2017-07-26 13:52,0,0,Bernardo Feria in prison Marawi City 27 May 2017 06:00AM Bernardo:help me!...help!!!!...please anybody help me!!!... http://fb.me/1vcx0gULg,,,,890087375564668928,https://twitter.com/bernardo_sundal/status/890087375564668928
WillShawnTelle,2017-07-26 13:51,0,0,Kerlan Fanagel Protesta ky PRRD na gustong paalisin ang ML s Mindanao. cno b ang nag cmula n sakupin ang Marawi ang AFP or Mautae? # Dumbasspic.twitter.com/QEbw8NRlwH,"(['Cupertino', ' CA'], Location((37.3230107, -122.0322519, 0.0)))",,#,890087032751611904,https://twitter.com/WillShawnTelle/status/890087032751611904
marawi_q8,2017-07-26 13:50,8,8,ياربي في هذه الظهيره الحاره برد ع قبور موتانا وموتى المسلمين وهب عليهم من نسيم الجنه واسقهم من نهر الكوثر واسكنهم الفردوس الأعلى من الجنه,,,,890086960160796677,https://twitter.com/marawi_q8/status/890086960160796677
renz_aurelio,2017-07-26 13:48,13,13,Special benefit concert para sa mga kababayan nting taga Marawi. # LaLunaSangrePagasahttps://twitter.com/OneMusicPH/status/889756768930209792 …,"(['Republic of the Philippines'], Location((12.7503486, 122.7312101, 0.0)))",,#,890086469108477952,https://twitter.com/renz_aurelio/status/890086469108477952
newspaperphcom,2017-07-26 13:47,0,0,WATCH: Nadiskubre ng mga Militar ang Hideout Tunnel ng mga Maute sa Marawi http://ift.tt/2tBtIz1,"(['Republic of the Philippines'], Location((12.7503486, 122.7312101, 0.0)))",,,890086116589809664,https://twitter.com/newspaperphcom/status/890086116589809664
Ivan226622,2017-07-26 13:45,0,0,"Labi ng sundalong nasawi sa Marawi, naiuwi na sa Iloilo http://bit.ly/2uw3Xmo  — ABS-CBN News (ABSCBNNews) July 26, 2017",,,,890085634953629698,https://twitter.com/Ivan226622/status/890085634953629698
